index,url,valid,domain,title,description,image,published,archive,content,quote,language,keyword
https://futurezone.at/apps/app-kaelte-immer-griffbereit-haben-kaeltetelefon-kaelteapp-obdachlos-wien-melden/403118685,https://futurezone.at/apps/app-kaelte-immer-griffbereit-haben-kaeltetelefon-kaelteapp-obdachlos-wien-melden/403118685,0,futurezone.at,Extreme Kälte: Diese App solltet ihr jetzt immer griffbereit haben,Die KälteApp und das Kältetelefon können bei diesen Temperaturen zum Lebensretter werden.,https://image.futurezone.at/images/facebook/9187236/46-175463301.jpg,2026-01-05T10:08:48Z,,Die KälteApp und das Kältetelefon können bei diesen Temperaturen zum Lebensretter werden.,,de,'Kälte'
https://www.bild.de/regional/hamburg/rettung-dauert-vier-stunden-huendin-lucie-bricht-in-hamburg-ins-eis-ein-695b64a3c83d5f8e0659c922,https://www.bild.de/regional/hamburg/rettung-dauert-vier-stunden-huendin-lucie-bricht-in-hamburg-ins-eis-ein-695b64a3c83d5f8e0659c922,0,www.bild.de,Beim Gassigehen in See eingebrochen - Nach 4 Stunden! Feuerwehr rettet Hund aus Eiswasser,Dramatische Rettung am Öjendorfer See: Hündin Lucie bricht ins Eis ein und kämpft ums Überleben. Mit welcher aufwendigen Taktik das Tier gerettet wurde.,"https://images.bild.de/695b64a3c83d5f8e0659c922/3d86dadd83f82474dc7d9859701eff81,f0bfeccb?w=1280",2026-01-05T10:22:51Z,,"Hamburg Was als harmloser Spaziergang begann, wurde für Mischlingshündin Lucie zum Überlebenskampf im Eiswasser und zu einer aufwendigen Rettungsaktion für 20 Helfer.
Am Sonntagnachmittag gegen 15.3… [+1900 chars]",,de,'Kälte'
https://www.sueddeutsche.de/bayern/funtensee-berchtesgaden-nationalpark-frost-eis-temperaturen-minusgrade-li.3363266,https://www.sueddeutsche.de/bayern/funtensee-berchtesgaden-nationalpark-frost-eis-temperaturen-minusgrade-li.3363266,0,www.sueddeutsche.de,"Nationalpark Berchtesgaden: Kalt, kälter - Funtensee","Klirrende Kälte hat nicht nur Bayern im Griff. Doch es gibt einen Ort im Nationalpark Berchtesgaden, der immer die eisigsten Temperaturen liefert. Was den Funtensee so besonders macht.",https://www.sueddeutsche.de/2026/01/05/650e2153-04ea-4a47-a221-e654555db386.jpg?q=60&fm=webp&width=1200&rect=0%2C48%2C2560%2C1440,2026-01-05T10:42:19Z,,"Der Kälterekord
An Heiligabend 2001 maß eine private Wetterstation am Funtensee minus 45,9 Grad  der historische Tiefstwert in Deutschland. Die Station des Deutschen Wetterdienstes (DWD) auf der and… [+4896 chars]",,de,'Kälte'
https://www.faz.net/aktuell/wirtschaft/trumps-venezuela-abenteuer-wirft-fragen-auf-110813978.html,https://www.faz.net/aktuell/wirtschaft/trumps-venezuela-abenteuer-wirft-fragen-auf-110813978.html,0,www.faz.net,US-Intervention in Venezuela: Trumps Abenteuer,"Öl allein kann die Intervention in Venezuela nicht erklären. Eher wird die Welt Zeuge einer Rückkehr zu Zeiten, in denen die Großmächte nach Gutdünken schalten und walten. Das sind keine schöne Aussichten.",https://media0.faz.net/image/w1200h627/db7c95c06775/w3452h1803x0y69o/202601/43601.0.1637357922/per-hubschrauber-der.webp,2026-01-05T20:29:53Z,,"Man muss konstatieren, dass die amerikanische Regierung bis heute keine schlüssige Begründung für die spektakuläre Intervention in Venezuela und die Entführung des Staatschefs geliefert hat. Das ist … [+1908 chars]",,de,'Öl'
https://www.bild.de/politik/ausland-und-internationales/us-experte-sicher-trumps-oel-plan-schwaecht-russland-und-china-695bce60b0086aa64be6f78e,https://www.bild.de/politik/ausland-und-internationales/us-experte-sicher-trumps-oel-plan-schwaecht-russland-und-china-695bce60b0086aa64be6f78e,0,www.bild.de,US-Experte sicher - Trumps Öl-Plan schwächt Russland und China,USA zielen auf Chinas und Russlands Einfluss in Südamerika. Expertenanalyse zur Festnahme von Maduro.,"https://images.bild.de/695bce60b0086aa64be6f78e/d20ef17fe6b65d838d5173dc71c833c5,b6d8bd6a?w=1280",2026-01-05T20:53:46Z,,"Berlin Richtet sich der Militärschlag der USA in Venezuela auch gegen China und Russland?
Nach der Festnahme des Diktators Nicolás Maduro durch amerikanische Truppen im Zuge eines Militäreinsatzes i… [+3365 chars]",,de,'Öl'
https://www.n-tv.de/wirtschaft/Wall-Street-startet-stark-in-die-Woche-id30206126.html,https://www.n-tv.de/wirtschaft/Wall-Street-startet-stark-in-die-Woche-id30206126.html,0,www.n-tv.de,Ölpreise ziehen an: Wall Street startet stark in die Woche,"Der Sturz Maduros in Venezuela sorgt an der Wall Street nicht für Panik. Die Ölpreise fallen zunächst, legen im Tagesverlauf aber deutlich zu. Insgesamt schauen die US-Anleger inzwischen gelassener auf die stürmische Geopolitik.",https://www.n-tv.de/img/30206125/1767651285/Img_16_9/1200/Trader-Jonathan-Mueller-works-on-the-floor-of-the-New-York-Stock-Exchange-Friday-Jan-2-2026.jpg,2026-01-05T21:28:38Z,,"Die Handelswoche beginnt in New York freundlich. (Foto: AP)
Der Sturz Maduros in Venezuela sorgt an der Wall Street nicht für Panik. Die Ölpreise fallen zunächst, legen im Tagesverlauf aber deutlich… [+4258 chars]",,de,'Öl'
https://www.faz.net/aktuell/politik/ausland/liveblog-angriff-auf-venezuela-berichte-ueber-schuesse-in-der-naehe-des-praesidentenpalastes-faz-200405141.html,https://www.faz.net/aktuell/politik/ausland/liveblog-angriff-auf-venezuela-berichte-ueber-schuesse-in-der-naehe-des-praesidentenpalastes-faz-200405141.html,0,www.faz.net,angriff auf Venezuela: Berichte über Schüsse in der Nähe des Präsidentenpalastes,Venezuela sucht nach Kollaborateuren des US-Angriffs +++ Öl-Aktien legen nach US-Intervention in Venezuela zu +++ Die Nachfolgerin Maduros legt einen Amtseid in der Nationalversammlung ab  +++ alle Entwicklungen im Liveblog,https://media0.faz.net/image/w1200h627/9cf2a608e251/w3000h1567x0y216o/202601/43601.0.1630719899/truppen-der-praesidentengarde.webp,2026-01-06T02:01:00Z,,"Der amerikanische UN-Botschafter Mike Waltz wiederholt in New York die Darstellung der Regierung in Washington. Maduro sei verantwortlich für Angriffe auf Amerikaner, die Destabilisierung der Westlic… [+1029 chars]",,de,'Öl'
https://www.welt.de/politik/ausland/article6958ef97441b06c4906d1ccf/venezuela-liveticker-lage-angeblich-unter-kontrolle-polizei-gibt-schuesse-vor-praesidentenpalast-ab.html,https://www.welt.de/politik/ausland/article6958ef97441b06c4906d1ccf/venezuela-liveticker-lage-angeblich-unter-kontrolle-polizei-gibt-schuesse-vor-praesidentenpalast-ab.html,0,www.welt.de,Lage angeblich unter Kontrolle – Polizei gibt Schüsse vor Präsidentenpalast ab,"Donald Trump kann sich vorstellen, US-Ölkonzernen in Venezuela unter die Arme zu greifen. Noch halten sich die Unternehmen zurück, doch ihre Aktien steigen bereits stark. In der venezuelanischen Hauptstadt Caracas fallen Schüsse. Mehr im Liveticker.",https://images.welt.de/6958ef97441b06c4906d1ccf/04cc1fa003fe4f07c3d8fffe81d6133f/ci16x9-w1200/dpa-com-20090101-260105-99-84142-jpg,2026-01-06T02:32:00Z,,"Donald Trump kann sich vorstellen, US-Ölkonzernen in Venezuela unter die Arme zu greifen. Noch halten sich die Unternehmen zurück, doch ihre Aktien steigen bereits stark. In der venezuelanischen Haup… [+11912 chars]",,de,'Öl'
https://www.bild.de/sport/fussball/fc-bayern-testspiel-gegen-red-bull-salzburg-hier-im-live-ticker-ab-15-uhr-695cd489fb77630dac278f0e,https://www.bild.de/sport/fussball/fc-bayern-testspiel-gegen-red-bull-salzburg-hier-im-live-ticker-ab-15-uhr-695cd489fb77630dac278f0e,0,www.bild.de,Ab 15 Uhr - Bayern-Test gegen Salzburg hier im Live-Ticker,Die Bayern starten mit dem Testspiel bei Red Bull Salzburg in das Fußball-Jahr 2026.  Fünf Tage später geht es in der Bundesliga gegen den VfL Wolfsburg.,"https://images.bild.de/695cd489fb77630dac278f0e/a0ff98eef0e61e843810a347dad9bc1f-landscape,286682aa?w=1280",2026-01-06T10:09:52Z,,"+++Koalitionsbruch in Brandenburg Woidke feuert Wagenknecht-Partei: Keine Basis mehr!
+++Koalitionsbruch in Brandenburg Woidke feuert Wagenknecht-Partei: Keine Basis mehr!
+++Koalitionsbruch in Bra… [+668 chars]",,de,'Bayern'
https://www.bild.de/news/ausland/schnee-und-eis-legen-europa-lahm-flug-und-zugchaos-frost-und-schulschliessungen-695cc070b125e961a2f99acd,https://www.bild.de/news/ausland/schnee-und-eis-legen-europa-lahm-flug-und-zugchaos-frost-und-schulschliessungen-695cc070b125e961a2f99acd,0,www.bild.de,Zug- und Flugausfälle und Mega-Frost - Wintereinbruch legt halb Europa lahm,"Der heftige Wintereinbruch legt halb Europa lahm: Es kommt zu Flug- und Zugausfällen, Monster-Staus und Schulausfällen.","https://images.bild.de/695cc070b125e961a2f99acd/220551bcf9e751f841172f86ae9f69af,86c2ed52?w=1280",2026-01-06T10:12:30Z,,"Berlin Die Winter-Zange hat uns fest im Griff! Während Deutschland zu Beginn der Woche schon bei bis zu minus 24 Grad bibberte, kämpfen auch große Teile Europas mit den Auswirkungen von Super-Kälte, … [+7290 chars]",,de,'Winter'
https://www.zeit.de/news/2026-01/06/minister-sieht-bayern-fuer-stromausfall-gewappnet,https://www.zeit.de/news/2026-01/06/minister-sieht-bayern-fuer-stromausfall-gewappnet,0,www.zeit.de,Katastrophenschutz: Minister sieht Bayern für Stromausfall gewappnet,Hier finden Sie Informationen zu dem Thema „Katastrophenschutz“. Lesen Sie jetzt „Minister sieht Bayern für Stromausfall gewappnet“.,https://img.zeit.de/news/2026-01/06/minister-sieht-bayern-fuer-stromausfall-gewappnet-image-group/wide__1300x731,2026-01-06T10:34:39Z,,Im Freistaat liegen dem Innenministerium zufolge keine konkreten Hinweise auf einen Angriff auf die kritische Infrastruktur vor. Mit Blick auf den in Berlin mutmaßlich durch einen linksextremistische… [+1752 chars],,de,'Bayern'
https://www.bild.de/sport/fussball/fc-bayern-kennen-sie-den-noch-ex-bayern-profi-in-die-politik-695cdbd395fe8bf439d66e41,https://www.bild.de/sport/fussball/fc-bayern-kennen-sie-den-noch-ex-bayern-profi-in-die-politik-695cdbd395fe8bf439d66e41,0,www.bild.de,Kennen Sie den noch? - Ex-Bayern-Profi in die Politik!,"Beim FC Bayern spielte er gemeinsam mit Weltstars. Jetzt drängt Andreas Görlitz in die Politik, in Rott kandidiert er für den Gemeinderat.","https://images.bild.de/695cdbd395fe8bf439d66e41/69438c39fc92218a4ec6b998c3045b4d,afeeae5b?w=1280",2026-01-06T10:50:44Z,,"Beim FC Bayern spielte er gemeinsam mit Weltstars wie Oliver Kahn (56), Philipp Lahm (42) oder Bastian Schweinsteiger (41). Jetzt drängt Andreas Görlitz (43) in die Politik! 
In seinem Heimatort Rot… [+1806 chars]",,de,'Bayern'
https://www.bild.de/sport/fussball/fc-bayern-ueberraschendes-comeback-von-tv-legende-695ce1d295fe8bf439d66ed8,https://www.bild.de/sport/fussball/fc-bayern-ueberraschendes-comeback-von-tv-legende-695ce1d295fe8bf439d66ed8,0,www.bild.de,Überraschendes Comeback - Bayern holt TV-Legende zurück,Der FC Bayern hat vor seinem heutigen Testspiel bei RB Salzburg (15 Uhr) eine Besonderheit bei der Übertragung der Partie angekündigt.,"https://images.bild.de/695ce1d295fe8bf439d66ed8/02db1f4999a188af5153ef715ace0c78,68d2d7bf?w=1280",2026-01-06T11:05:54Z,,"Huiuiui, was für eine legendäre Überraschung!
Der FC Bayern hat vor seinem heutigen Testspiel bei RB Salzburg (15 Uhr) eine Besonderheit bei der Übertragung der Partie angekündigt.
Kommentaren-Lege… [+1820 chars]",,de,'Bayern'
