index,url,valid,domain,title,description,image,published,archive,content,quote,language,keyword
https://www.n-tv.de/sport/fussball/Bayer-Leverkusen-vollfuehrt-schlimme-Akte-der-Selbstzerstoerung-article25609586.html,https://www.n-tv.de/sport/fussball/Bayer-Leverkusen-vollfuehrt-schlimme-Akte-der-Selbstzerstoerung-article25609586.html,0,www.n-tv.de,Wirtz ist nur noch genervt: Bayer Leverkusen vollführt schlimme Akte der Selbstzerstörung,"Supertrainer Xabi Alonso ist für den FC Bayern doch nicht unbesiegbar. Im Achtelfinalhinspiel der Champions League erlebt Bayer Leverkusen in München einen Abend, der schrecklicher nicht laufen kann.",https://www.n-tv.de/img/incoming/crop25609590/2961325204-cImg_16_9-w1200/3a0c8b2c0d28e3580d2e972ed93fbf12.jpg,2025-03-06T04:58:07Z,,"Supertrainer Xabi Alonso ist für den FC Bayern doch nicht unbesiegbar. Im Achtelfinalhinspiel der Champions League erlebt Bayer Leverkusen in München einen Abend, der schrecklicher nicht laufen kann.… [+7272 chars]",,de,'Bayern'
https://www.stern.de/gesellschaft/regional/bayern/champions-league--kane-als-bayern-anfuehrer---haelfte-des-jobs-erledigt--35526608.html,https://www.stern.de/gesellschaft/regional/bayern/champions-league--kane-als-bayern-anfuehrer---haelfte-des-jobs-erledigt--35526608.html,0,www.stern.de,"Champions League: Kane als Bayern-Anführer: ""Hälfte des Jobs erledigt""",Harry Kane ist voll da. Der englische Nationalstürmer erzielt im Hinspiel gegen Bayer Leverkusen einen Doppelpack. Es waren vermutlich seine bislang wichtigsten Treffer für die Münchner.,https://image.stern.de/35526610/t/XP/v1/w1440/r1.7778/-/06--euaui5vopxv5axs2048jpeg---5622c46a89d9547b.jpg,2025-03-06T05:07:37Z,,"Kopiere den aktuellen Link
Zur Merkliste hinzufügen
Harry Kane ist voll da. Der englische Nationalstürmer erzielt im Hinspiel gegen Bayer Leverkusen einen Doppelpack. Es waren vermutlich seine bisl… [+1714 chars]",,de,'Bayern'
https://www.tagesspiegel.de/sport/champions-league-kane-als-bayern-anfuhrer-halfte-des-jobs-erledigt-13323406.html,https://www.tagesspiegel.de/sport/champions-league-kane-als-bayern-anfuhrer-halfte-des-jobs-erledigt-13323406.html,0,www.tagesspiegel.de,Champions League: Kane als Bayern-Anführer: „Hälfte des Jobs erledigt“,Harry Kane ist voll da. Der englische Nationalstürmer erzielt im Hinspiel gegen Bayer Leverkusen einen Doppelpack. Es waren vermutlich seine bislang wichtigsten Treffer für die Münchner.,https://www.tagesspiegel.de/images/13323403/alternates/BASE_16_9_W1400/1741237732000/harry-kane.jpeg,2025-03-06T05:08:52Z,,Harry Kane war quasi überall. Der Kapitän der englischen Fußball-Nationalmannschaft trieb den FC Bayern beim imposanten 3:0 (1:0) im Champions-League-Kracher gegen Bayer Leverkusen unermüdlich an. Un… [+2223 chars],,de,'Bayern'
