index,url,valid,domain,title,description,image,published,archive,content,quote,language,keyword
https://www.zeit.de/news/2024-03/01/treffen-der-g20-finanzminister-endet-ohne-abschlusserklaerung,https://www.zeit.de/news/2024-03/01/treffen-der-g20-finanzminister-endet-ohne-abschlusserklaerung,0,www.zeit.de,Krieg: Treffen der G20-Finanzminister endet ohne Abschlusserklärung,Hier finden Sie Informationen zu dem Thema „Krieg“. Lesen Sie jetzt „Treffen der G20-Finanzminister endet ohne Abschlusserklärung“.,https://img.zeit.de/news/2024-03/01/treffen-der-g20-finanzminister-endet-ohne-abschlusserklaerung-image-group/wide__1300x731,2024-03-01T01:21:10Z,,Die Finanzminister der führenden Industrie- und Schwellenländer (G20) haben sich bei ihrem Treffen in São Paulo wegen Unstimmigkeiten zum Ukraine-Krieg nicht auf eine gemeinsame Abschlusserklärung ve… [+3081 chars],,de,'Krieg'
https://www.focus.de/politik/deutschland/vor-spitzengespraech-soeder-schliesst-zustimmung-zu-micky-maus-wachstumsgesetz-aus_id_259718174.html,https://www.focus.de/politik/deutschland/vor-spitzengespraech-soeder-schliesst-zustimmung-zu-micky-maus-wachstumsgesetz-aus_id_259718174.html,0,www.focus.de,Vor Spitzengespräch - Söder schließt Zustimmung zu „Micky-Maus-Wachstumsgesetz“ aus,Der CSU-Chef bekräftigt vor dem Spitzengespräch der deutschen Wirtschaft eine Blockade im Bundesrat. Bayern kündigt eine eigene Initiative für Entlastungspaket an.,https://p6.focus.de/img/fotos/id_259714613/imago0396618989h.jpg?im=Crop%3D%280%2C0%2C3464%2C1732%29%3BResize%3D%281200%2C627%29&impolicy=perceptual&quality=mediumHigh&hash=5ae22166cae2048c05406d31367816ea99f780c95a2b614cb4c899beffe04ba6,2024-03-01T03:39:59Z,,Der CSU-Chef bekräftigt vor dem Spitzengespräch der deutschen Wirtschaft eine Blockade im Bundesrat. Bayern kündigt eine eigene Initiative für Entlastungspaket an.Vor dem Spitzengespräch der deutsche… [+1531 chars],,de,'Bayern'
https://www.stern.de/gesellschaft/regional/baden-wuerttemberg/fussball--angeschlagene-freiburger-empfangen-den-fc-bayern-34506016.html,https://www.stern.de/gesellschaft/regional/baden-wuerttemberg/fussball--angeschlagene-freiburger-empfangen-den-fc-bayern-34506016.html,0,www.stern.de,Fußball: Angeschlagene Freiburger empfangen den FC Bayern,"Der SC trifft in der Auftaktpartie des 24. Spieltags auf den Rekordmeister. Die Badener hoffen auf einen Befreiungsschlag, die Münchner auf einen Sieg in ihrem 2000. Bundesligaspiel.",https://image.stern.de/34506018/t/vz/v2/w1440/r1.7778/-/01--urnnewsmldpacom2009010124022999172269v3w800h600l639t426r1917b1278jpeg---58e2037349fa6374.jpg,2024-03-01T04:12:46Z,,"Der SC trifft in der Auftaktpartie des 24. Spieltags auf den Rekordmeister. Die Badener hoffen auf einen Befreiungsschlag, die Münchner auf einen Sieg in ihrem 2000. Bundesligaspiel.
Als klarer Auße… [+725 chars]",,de,'Bayern'
https://www.stern.de/gesellschaft/regional/bayern/fussball--jubilaeumsspiel-zum-eberl-start-beim-fc-bayern-34505924.html,https://www.stern.de/gesellschaft/regional/bayern/fussball--jubilaeumsspiel-zum-eberl-start-beim-fc-bayern-34505924.html,0,www.stern.de,Fußball: Jubiläumsspiel zum Eberl-Start beim FC Bayern,Sportvorstand Max Eberl startet offiziell beim FC Bayern. Im 2000. Bundesliga-Spiel der Münchner soll ein Sieg her. Trainer Thomas Tuchel gibt die Maxime vor.,https://image.stern.de/34505926/t/CN/v2/w1440/r1.7778/-/01--urnnewsmldpacom2009010124022999172345v3w800h600l638t429r1916b1290jpeg---facecc08b55fa683.jpg,2024-03-01T04:17:28Z,,"Sportvorstand Max Eberl startet offiziell beim FC Bayern. Im 2000. Bundesliga-Spiel der Münchner soll ein Sieg her. Trainer Thomas Tuchel gibt die Maxime vor.
Die Amtszeit von Sportvorstand Max Eber… [+842 chars]",,de,'Bayern'
https://www.zeit.de/news/2024-03/01/krieg-gegen-die-ukraine-so-ist-die-lage,https://www.zeit.de/news/2024-03/01/krieg-gegen-die-ukraine-so-ist-die-lage,0,www.zeit.de,Russische Invasion: Krieg gegen die Ukraine: So ist die Lage,Hier finden Sie Informationen zu dem Thema „Russische Invasion“. Lesen Sie jetzt „Krieg gegen die Ukraine: So ist die Lage“.,https://img.zeit.de/news/2024-03/01/krieg-gegen-die-ukraine-so-ist-die-lage-image-group/wide__1300x731,2024-03-01T04:38:49Z,,Angesichts der schwierigen Lage an der Front hat der ukrainische Präsident Wolodymyr Selenskyj einmal mehr um militärische Unterstützung aus dem Westen im Abwehrkampf gegen Russland geworben. «Die gl… [+4229 chars],,de,'Krieg'
https://www.bild.de/politik/ausland/politik-ausland/russland-wladimir-putin-plante-auch-fuer-einen-atomkonflikt-mit-china-87356212.bild.html,https://www.bild.de/politik/ausland/politik-ausland/russland-wladimir-putin-plante-auch-fuer-einen-atomkonflikt-mit-china-87356212.bild.html,0,www.bild.de,Nuklear-Papiere enthüllt - Putin plant auch für Atomkonflikt mit China,Wladimir Putin plant auch für einen Atomkonflikt mit China. Das geht aus den enthüllten Kreml-Geheimpapieren hervor.,"https://images.bild.de/65e16ea87d9c8c16555b1a4c/8c4f2d75a3fe15b1dbfc6d63f73fc2b5,b13089a1?w=1280",2024-03-01T07:57:48Z,,"Russlands geheime Atompläne lassen die Welt aufhorchen: Am Mittwoch hatte die Financial Times detailliert beschrieben, unter welchen Bedingungen Kreml-Machthaber 
Wladimir Putin (71) die Atombombe e… [+2483 chars]",,de,'Putin'
https://www.welt.de/kultur/plus250335244/Putin-Kim-Jong-un-und-der-Atomkrieg-Wenn-die-Drohungen-lauter-werden-steigt-das-Risiko.html,https://www.welt.de/kultur/plus250335244/Putin-Kim-Jong-un-und-der-Atomkrieg-Wenn-die-Drohungen-lauter-werden-steigt-das-Risiko.html,0,www.welt.de,Das verkannte Nuklear-Risiko,"Sind häufige Drohgebärden leer, nur weil sie nicht eingelöst werden? Eine Expertin für Nuklearstrategie untersucht die Rhetorik der Kampfansagen von Putin und Kim Jong-un – und macht eine beunruhigende Entdeckung.",https://img.welt.de/img/kultur/mobile250339186/1011351527-ci16x9-w1200-fnov-fpotl-fpi157750653/Presidential-Address-to-Russian-Federal-Assembly-4.jpg,2024-03-01T09:00:06Z,,"Die WELT als ePaper: Die vollständige Ausgabe steht Ihnen bereits am Vorabend zur Verfügung so sind Sie immer hochaktuell informiert. Weitere Informationen: http://epaper.welt.de 
 Der Kurz-Link die… [+49 chars]",,de,'Putin'
https://www.stern.de/politik/wahlen-im-iran--auch-in-diesen-laendern-wird-2024-gewaehlt-34408558.html,https://www.stern.de/politik/wahlen-im-iran--auch-in-diesen-laendern-wird-2024-gewaehlt-34408558.html,0,www.stern.de,Interaktive Grafik: Globales Superwahljahr: In diesen Ländern wird 2024 abgestimmt,"2024 ist ein Superwahljahr: Im Juni findet die Europawahl statt, im November die US-Präsidentschaftswahl und auch Russlands Präsident Putin muss sich im März zumindest symbolisch zur Wahl stellen. In welchen Ländern dieses Jahr noch  gewählt wird, zeigt diese…",https://image.stern.de/34410180/t/75/v1/w1440/r1.7778/-/weltkarte-wahlen-aufmacher.png,2024-03-01T09:05:00Z,,"In diesem Jahr werden weltweit mehr Menschen ihre Stimme abgeben, als jemals zuvor. In 64 Nationalstaaten sowie der gesamten Europäischen Union werden in den nächsten zwölf Monaten voraussichtlich Wa… [+11987 chars]",,de,'Putin'
https://www.focus.de/politik/trotz-schickanen-und-polizeigewalt-putin-gegner-nawalny-wird-in-moskau-beerdigt_id_259719042.html,https://www.focus.de/politik/trotz-schickanen-und-polizeigewalt-putin-gegner-nawalny-wird-in-moskau-beerdigt_id_259719042.html,0,www.focus.de,Trotz Schickanen und Polizeigewalt - Putin-Gegner Nawalny wird in Moskau beerdigt,"In Moskau findet heute die Beerdigung des Kremlkritikers Alexej Nawalny statt, umgeben von Polizeipräsenz und Behördenhindernissen. Trotz Versuchen, die Trauerfeier zu behindern, einschließlich Drohanrufen an Bestattungsunternehmen, versammelt sich die Gemein…",https://p6.focus.de/img/panorama/welt/id_259705450/kremlgegner-alexej-nawalny-ist-in-einem-russischen-straflager-gestorben..jpg?im=Crop%3D%280%2C240%2C2048%2C1024%29%3BResize%3D%281200%2C627%29&impolicy=perceptual&quality=mediumHigh&hash=6a1a5ac30d91ede20708845017fae186e7e281b89c30e02f80b3c95af15f7130,2024-03-01T09:12:19Z,,"<ul><li>
Kommentare</li><li>
E-Mail</li><li>
Teilen</li><li>
Mehr</li><li>
Twitter</li><li>
Drucken</li><li>
Feedback</li><li>
Fehler meldenSie haben einen Fehler gefunden?
Bitte markieren S… [+4018 chars]",,de,'Putin'
https://www.focus.de/earth/experten/mit-alten-tricks-raeumt-sich-gaslobby-ihre-konkurrenz-aus-dem-weg_id_259718022.html,https://www.focus.de/earth/experten/mit-alten-tricks-raeumt-sich-gaslobby-ihre-konkurrenz-aus-dem-weg_id_259718022.html,0,www.focus.de,Solar boomt - Mit Rechentrick will sich die Gaslobby ihre Solar-Konkurrenz aus dem Weg räumen,Solarenergie boomt wieder: Der Anteil der Photovoltaik an der Bruttostromerzeugung in Deutschland in den letzten Jahren immens gestiegen. Doch die Gaslobby versucht mit alten Tricks die starke Konkurrenz aus dem Weg zu schaffen. Mit falschen Berechnungen und …,https://p6.focus.de/img/panorama/id_200791439/solarboom-in-berlin-nachfrage-nach-photovoltaik-anlagen-steigt-rasant.jpg?im=Crop%3D%280%2C250%2C1000%2C500%29%3BResize%3D%281200%2C627%29&impolicy=perceptual&quality=mediumHigh&hash=deea5fccbf73c90ac25bfccb944fd540da7c09d77ebf512c2f2e49d1c9b988b3,2024-03-01T09:28:53Z,,Solarenergie boomt wieder: Der Anteil der Photovoltaik an der Bruttostromerzeugung in Deutschland in den letzten Jahren immens gestiegen. Doch die Gaslobby versucht mit alten Tricks die starke Konkur… [+8252 chars],,de,'Nachhaltige Energie'
https://www.bild.de/politik/ausland/politik-ausland/putin-hochnervoes-scharfschuetzen-und-schlaegertrupps-bei-nawalny-begraebnis-87357592.bild.html,https://www.bild.de/politik/ausland/politik-ausland/putin-hochnervoes-scharfschuetzen-und-schlaegertrupps-bei-nawalny-begraebnis-87357592.bild.html,0,www.bild.de,Putin offenbar hochnervös - Scharfschützen und Schläger bei Nawalny-Abschied,Putins Machtapparat hat vor der heutigen Beerdigung seines schärfsten Kritikers Alexej Nawalny (†47) an Kirche und Friedhof eine irre Drohkulisse aufgebaut.,"https://images.bild.de/65e192e67d9c8c16555b1bce/88392686975293a1a71d0f573a03be0d,e02368d8?w=1280",2024-03-01T10:12:06Z,,Der Kreml hat Angst vor einem Toten und seinen Trauernden! Deshalb hat Putins Machtapparat vor der heutigen Beerdigung seines schärfsten Kritikers Alexej Nawalny (47) an Kirche und Friedhof eine irre… [+4590 chars],,de,'Putin'
https://taz.de/-Nachrichten-im-Ukraine-Krieg-/!5995599/,https://taz.de/-Nachrichten-im-Ukraine-Krieg-/!5995599/,0,taz.de,+++ Nachrichten im Ukraine-Krieg +++: Scholz begründet Taurus-Nein,Kanzler Scholz will weiter keine Marschflugkörper liefern: Deutschland könne sich nicht an deren Einsatz beteilligen. Andere Länder anscheinend schon.,https://taz.de/picture/6861502/948/34781447-1.jpeg,2024-03-01T10:50:00Z,,"Kanzler Scholz will weiter keine Marschflugkörper liefern: Deutschland könne sich nicht an deren Einsatz beteilligen. Andere Länder anscheinend schon.
Bürgerdialog am 29. Februar mit interessanten D… [+15317 chars]",,de,'Krieg'
https://www.stern.de/panorama/--der-ironman-der-skilanglaeufer--100--wasalauf-in-schweden-34508844.html,https://www.stern.de/panorama/--der-ironman-der-skilanglaeufer--100--wasalauf-in-schweden-34508844.html,0,www.stern.de,Der Ironman der Skilangläufer: 100. Wasalauf in Schweden,90 Kilometer auf Langlaufskiern durch den schwedischen Winter: Der Wasalauf gilt als das härteste Langlaufrennen der Welt. Jedes Jahr stellen sich rund 16.000 Menschen diesem Spektakel.,https://image.stern.de/34508846/t/I_/v1/w1440/r1.7778/-/01--urnnewsmldpacom2009010124030199182754v3w800h600l849t504r1911b1367jpeg---f90c53f4e005cedb.jpg,2024-03-01T13:13:26Z,,"90 Kilometer auf Langlaufskiern durch den schwedischen Winter: Der Wasalauf gilt als das härteste Langlaufrennen der Welt. Jedes Jahr stellen sich rund 16.000 Menschen diesem Spektakel.
Dieses Geräu… [+6028 chars]",,de,'Winter'
https://www.morgenpost.de/vermischtes/article241793078/Der-Ironman-der-Skilanglaeufer-100-Wasalauf-in-Schweden.html,https://www.morgenpost.de/vermischtes/article241793078/Der-Ironman-der-Skilanglaeufer-100-Wasalauf-in-Schweden.html,0,www.morgenpost.de,Der Ironman der Skilangläufer: 100. Wasalauf in Schweden,90 Kilometer auf Langlaufskiern durch den schwedischen Winter: Der Wasalauf gilt als das härteste Langlaufrennen der Welt. Jedes Jahr stellen sich rund 16.000 Menschen diesem Spektakel.,https://img.sparknews.funkemedien.de/241793068/241793068_1709298990_v4_3_800.jpeg,2024-03-01T13:15:00Z,,"Sälen. 90 Kilometer auf Langlaufskiern durch den schwedischen Winter: Der Wasalauf gilt als das härteste Langlaufrennen der Welt. Jedes Jahr stellen sich rund 16.000 Menschen diesem Spektakel.
Diese… [+6037 chars]",,de,'Winter'
https://www.n-tv.de/politik/Rosneft-Enteignung-in-Schwedt-immer-unwahrscheinlicher-article24776771.html,https://www.n-tv.de/politik/Rosneft-Enteignung-in-Schwedt-immer-unwahrscheinlicher-article24776771.html,0,www.n-tv.de,Weitere Kontrolle durch Bund?: Rosneft-Enteignung in Schwedt immer unwahrscheinlicher,"Nach dem russischen Einmarsch in der Ukraine werden die Rosneft-Anteile der deutschen Treuhand unterstellt, damit die ostdeutsche Raffinerie Schwedt nicht länger russisches Öl nutzt. Diese Verwaltung würde im März auslaufen. Nun zeichnet sich ab, wie es weite…",https://bilder4.n-tv.de/img/incoming/crop24530691/2851325946-cImg_16_9-w1200/389868446.jpg,2024-03-01T17:17:58Z,,"Nach dem russischen Einmarsch in der Ukraine werden die Rosneft-Anteile der deutschen Treuhand unterstellt, damit die ostdeutsche Raffinerie Schwedt nicht länger russisches Öl nutzt. Diese Verwaltung… [+2277 chars]",,de,'Öl'
https://www.n-tv.de/politik/04-10-Drohnenangriff-auf-Odessa-Hochhaus-stuerzt-teilweise-ein--article23143824.html,https://www.n-tv.de/politik/04-10-Drohnenangriff-auf-Odessa-Hochhaus-stuerzt-teilweise-ein--article23143824.html,0,www.n-tv.de,Ukraine-Krieg im Liveticker: +++ 04:10 Drohnenangriff auf Odessa - Hochhaus stürzt teilweise ein +++,Lesen Sie alle aktuellen Entwicklungen und Nachrichten über den russischen Angriffskrieg auf die Ukraine im Liveticker von ntv.de.,https://bilder2.n-tv.de/img/incoming/crop23332537/9041326157-cImg_16_9-w1200/Liveticker1-grau-1-Kopie.jpg,2024-03-01T23:05:00Z,,"Russische Drohnen haben in der Nacht Odessa angegriffen. Ein junger Mann starb, es gibt mindestens sieben Verletzte, darunter ein dreijähriges Kind. Bei dem Angriff wurden mehrere Hochhäuser beschädi… [+8453 chars]",,de,'Krieg'
https://www.n-tv.de/politik/07-39-Ukraine-meldet-russische-Verluste-in-Hoehe-von-fast-1000-Soldaten--article23143824.html,https://www.n-tv.de/politik/07-39-Ukraine-meldet-russische-Verluste-in-Hoehe-von-fast-1000-Soldaten--article23143824.html,0,www.n-tv.de,Ukraine-Krieg im Liveticker: +++ 07:39 Ukraine meldet russische Verluste in Höhe von fast 1000 Soldaten +++,Lesen Sie alle aktuellen Entwicklungen und Nachrichten über den russischen Angriffskrieg auf die Ukraine im Liveticker von ntv.de.,https://bilder2.n-tv.de/img/incoming/crop23332537/9041326157-cImg_16_9-w1200/Liveticker1-grau-1-Kopie.jpg,2024-03-01T23:05:00Z,,"Dem morgendlichen Bericht des ukrainischen Generalstabs zufolge ist es in der Nacht an der Front zu 82 Kampfhandlungen gekommen. In Richtung Bachmut seien acht feindliche Angriffe abgewehrt worden, i… [+9876 chars]",,de,'Winter'
https://www.n-tv.de/politik/18-42-Ukrainische-Luftwaffe-meldet-Abschuss-eines-weiteren-russischen-Jagdbombers--article23143824.html,https://www.n-tv.de/politik/18-42-Ukrainische-Luftwaffe-meldet-Abschuss-eines-weiteren-russischen-Jagdbombers--article23143824.html,0,www.n-tv.de,Ukraine-Krieg im Liveticker: +++ 18:42 Ukrainische Luftwaffe meldet Abschuss eines weiteren russischen Jagdbombers +++,Lesen Sie alle aktuellen Entwicklungen und Nachrichten über den russischen Angriffskrieg auf die Ukraine im Liveticker von ntv.de.,https://bilder2.n-tv.de/img/incoming/crop23332537/9041326157-cImg_16_9-w1200/Liveticker1-grau-1-Kopie.jpg,2024-03-01T23:05:00Z,,"Die ukrainische Luftwaffe bestätigt den Abschuss eines weiteren russischen Jagdbombers. ""Das East Air Command bestätigt den Abschuss eines Su-34-Jagdbombers. Leider nur einen"", schreibt der ukrainisc… [+31533 chars]",,de,'Winter'
https://www.n-tv.de/politik/10-32-Befehlshaber-Syrskyj-unzufrieden-mit-Front-Kommandeuren--article23143824.html,https://www.n-tv.de/politik/10-32-Befehlshaber-Syrskyj-unzufrieden-mit-Front-Kommandeuren--article23143824.html,0,www.n-tv.de,Ukraine-Krieg im Liveticker: +++ 10:32 Befehlshaber Syrskyj unzufrieden mit Front-Kommandeuren +++,Lesen Sie alle aktuellen Entwicklungen und Nachrichten über den russischen Angriffskrieg auf die Ukraine im Liveticker von ntv.de.,https://bilder2.n-tv.de/img/incoming/crop23332537/9041326157-cImg_16_9-w1200/Liveticker1-grau-1-Kopie.jpg,2024-03-01T23:05:00Z,,Der neue ukrainische Armee-Befehlshaber Olexander Syrskyj zeigt sich unzufrieden mit Kommandeuren an der Front im Osten des Landes und kündigt personelle Veränderungen an. Auf seinem Telegram-Kanal s… [+16536 chars],,de,'Winter'
https://www.autobild.de/videos/e-auto-reichweite-2024-slideshow-winter-autos-25286869.html,https://www.autobild.de/videos/e-auto-reichweite-2024-slideshow-winter-autos-25286869.html,0,www.autobild.de,AUTO BILD hat moderne E-Autos bei Kälte getestet,Im Winter sinkt die Reichweite von Elektroautos. AUTO BILD hat den Autobahn-Radius von diesen aktuellen E-Autos bei Kälte getestet. Zum Video!,https://i.auto-bild.de/ir_img/3/5/5/6/4/9/7/skodakda_166-fbf030d3d7c39bb6.jpg?impolicy=og_images,2024-03-02T04:30:00Z,,"Fiat Pandina: Sondermodell
Pandina: Kleinwagen-Schnäppchen mit Verbrenner",,de,'Kälte'
https://www.zeit.de/news/2024-03/02/scholz-verspricht-aufklaerung-zu-luftwaffen-mitschnitt,https://www.zeit.de/news/2024-03/02/scholz-verspricht-aufklaerung-zu-luftwaffen-mitschnitt,0,www.zeit.de,Krieg: Scholz verspricht Aufklärung zu Luftwaffen-Mitschnitt,Hier finden Sie Informationen zu dem Thema „Krieg“. Lesen Sie jetzt „Scholz verspricht Aufklärung zu Luftwaffen-Mitschnitt“.,https://img.zeit.de/administratives/sharing/fallback-image/wide__1300x731,2024-03-02T12:06:55Z,,Bundeskanzler Olaf Scholz hat nach der Veröffentlichung eines Mitschnitts von Beratungen deutscher Luftwaffen-Offiziere über Unterstützung für die Ukraine schnelle Aufklärung versprochen. Am Rande ei… [+136 chars],,de,'Krieg'
https://www.diepresse.com/18232778/warum-schmerzen-bei-einem-wetterwechsel-die-gelenke,https://www.diepresse.com/18232778/warum-schmerzen-bei-einem-wetterwechsel-die-gelenke,0,www.diepresse.com,Warum schmerzen bei einem Wetterwechsel die Gelenke?,"Kälte nimmt der Gelenkflüssigkeit ihre Funktion als „Stoßdämpfer“. Muskeln, Sehnen und Gelenke verspannen und verfestigen sich.",https://img.diepresse.com/public/incoming/2kx2mm-imago-images-0298888787/alternates/DPR_SOCIAL_NACHRICHTEN/imago%20images%200298888787,2024-03-02T15:45:00Z,,"Kälte nimmt der Gelenkflüssigkeit ihre Funktion als Stoßdämpfer. Muskeln, Sehnen und Gelenke verspannen und verfestigen sich.
Wenn sich der ausklingende Winter anfühlt wie früher der April, nehmen d… [+3207 chars]",,de,'Kälte'
https://www.focus.de/panorama/welt/mega-star-tritt-auf-milliardaers-sohn-feiert-luxus-polterabend-mit-rihanna-und-co_id_259723337.html,https://www.focus.de/panorama/welt/mega-star-tritt-auf-milliardaers-sohn-feiert-luxus-polterabend-mit-rihanna-und-co_id_259723337.html,0,www.focus.de,Indischer Öl-Spross - Milliardärs-Sohn feiert Polterabend für 140 Millionen Euro - mit Auftritt von Mega-Star,"Es sind Zahlen aus einem Märchen: 1200 Gäste, 2300 Speisen, 66 Köche und weit über 100 Millionen Euro. Mit Superstars aus aller Welt feiert die Milliardärsfamilie Ambani Polterabend.",https://p6.focus.de/img/fotos/id_259723335/imago0391459685h.jpg?im=Crop%3D%280%2C0%2C3433%2C1715%29%3BResize%3D%281200%2C627%29&impolicy=perceptual&quality=mediumHigh&hash=528766ebbf0444e14878be4518544899e3c54532fcff1013eac70bd4b7afe8f3,2024-03-02T21:10:10Z,,"Es sind Zahlen aus einem Märchen: 1200 Gäste, 2300 Speisen, 66 Köche und weit über 100 Millionen Euro. Mit Superstars aus aller Welt feiert die Milliardärsfamilie Ambani Polterabend.Google-Chef Sunda… [+2728 chars]",,de,'Öl'
https://www.zeit.de/news/2024-03/03/krieg-gegen-die-ukraine-so-ist-die-lage,https://www.zeit.de/news/2024-03/03/krieg-gegen-die-ukraine-so-ist-die-lage,0,www.zeit.de,Russische Invasion: Krieg gegen die Ukraine: So ist die Lage,Hier finden Sie Informationen zu dem Thema „Russische Invasion“. Lesen Sie jetzt „Krieg gegen die Ukraine: So ist die Lage“.,https://img.zeit.de/news/2024-03/03/krieg-gegen-die-ukraine-so-ist-die-lage-image-group/wide__1300x731,2024-03-03T04:11:27Z,,Nach dem Tod zweier Kinder bei einer russischen Drohnenattacke in Odessa am Schwarzen Meer hat der ukrainische Präsident Wolodymyr Selenskyj erneut auf Hilfe des Westens bei der Flugabwehr gedrungen.… [+5439 chars],,de,'Krieg'
https://www.zeit.de/news/2024-03/03/gaza-krieg-neuer-anlauf-im-ringen-um-feuerpause,https://www.zeit.de/news/2024-03/03/gaza-krieg-neuer-anlauf-im-ringen-um-feuerpause,0,www.zeit.de,Nahost: Gaza-Krieg: Neuer Anlauf im Ringen um Feuerpause,Hier finden Sie Informationen zu dem Thema „Nahost“. Lesen Sie jetzt „Gaza-Krieg: Neuer Anlauf im Ringen um Feuerpause“.,https://img.zeit.de/news/2024-03/03/gaza-krieg-neuer-anlauf-im-ringen-um-feuerpause-image-group/wide__1300x731,2024-03-03T04:32:44Z,,"Während die USA mit dem Abwurf von Nahrungsmitteln aus der Luft für die verzweifelten Zivilisten im Gazastreifen begonnen haben, laufen die gemeinsamen Vermittlungsbemühungen um eine Feuerpause mit K… [+7204 chars]",,de,'Krieg'
https://taz.de/Kriminalisierung-von-Pipelineprotesten/!5993981/,https://taz.de/Kriminalisierung-von-Pipelineprotesten/!5993981/,0,taz.de,Kriminalisierung von Pipelineprotesten: Ab in den ­Hoch­sicherheitstrakt,"In Uganda und Tansania kämpfen Aktivisten gegen eine gigantische, energiefressende Ölpipeline. Nun sitzen sie gemeinsam mit Terrorverdächtigen ein.",https://taz.de/picture/6860234/948/33607129-1.jpeg,2024-03-03T12:14:00Z,https://web.archive.org/web/20240303123347/https://taz.de/Kriminalisierung-von-Pipelineprotesten/!5993981/,"In Uganda und Tansania kämpfen Aktivisten gegen eine gigantische, energiefressende Ölpipeline. Nun sitzen sie gemeinsam mit Terrorverdächtigen ein.
Proteste gegen die Öl-Pipeline EOCAP in Kampala am… [+3948 chars]",,de,'fossile Energie'
https://www.focus.de/kultur/kino_tv/micky-maus-loesung-soeder-zeigt-bei-miosga-was-ihn-zum-perfekten-talk-gast-macht_id_259725294.html,https://www.focus.de/kultur/kino_tv/micky-maus-loesung-soeder-zeigt-bei-miosga-was-ihn-zum-perfekten-talk-gast-macht_id_259725294.html,0,www.focus.de,"„Micky-Maus-Lösung“ - Söder zeigt bei Miosga, was ihn zum perfekten Talk-Gast macht","Söder und die drei Frauen. Als einziger Mann beim ARD-Sonntags-Talk „Caren Miosga“ zeigt der CSU-Vorsitzende, was ihn zum perfekten Talk-Gast macht. Er ist unterhaltsam. Er ist schlagfertig. Und dann auch noch emotional. Von solchen Politikern ist die Moderat…",https://p6.focus.de/img/fotos/id_259725293/caren-miosga-bei-der-anmoderation-ihres-talks-mit-markus-soeder-csu-.png?im=Crop%3D%280%2C25%2C1064%2C532%29%3BResize%3D%281200%2C627%29&impolicy=perceptual&quality=mediumHigh&hash=8757cbd41a6cd8fc04c7c16c43f929c1fc67db59e74a750a5ca01d7cc0c3fa3f,2024-03-04T05:26:39Z,,"Söder und die drei Frauen. Als einziger Mann beim ARD-Sonntags-Talk Caren Miosga zeigt der CSU-Vorsitzende, was ihn zum perfekten Talk-Gast macht. Er ist unterhaltsam. Er ist schlagfertig. Und dann a… [+4684 chars]",,de,'Abhängigkeit'
https://www.golem.de/sonstiges/zustimmung/auswahl.html?from=https://www.golem.de/news/israel-im-krieg-gaza-wird-zum-testgelaende-fuer-militaerische-roboter-2403-182808.html&referer=https://t.co/b5f50df179,https://www.golem.de/sonstiges/zustimmung/auswahl.html?from=https://www.golem.de/news/israel-im-krieg-gaza-wird-zum-testgelaende-fuer-militaerische-roboter-2403-182808.html&referer=https://t.co/b5f50df179,0,www.golem.de,Israel im Krieg: Gaza wird zum Testgelände für militärische Roboter,"Mittlerweile setzt die IDF im Gaza-Konflikt neben ferngesteuerten Bulldozern auch Drohnen ein, die auf Roboterhunden landen. (Drohne, Roboter)",,2024-03-04T08:18:01Z,,"Besuchen Sie Golem.de wie gewohnt mit Werbung und Tracking,
 indem Sie der Nutzung aller Cookies zustimmen.
 Details zum Tracking finden Sie im Privacy Center.
Skript wurde nicht geladen. Informat… [+607 chars]",,de,'Krieg'
https://www.morgenpost.de/wirtschaft/article241809514/pelletspreise-aktuell-heute-4-maerz-pellets-heizung-kosten.html,https://www.morgenpost.de/wirtschaft/article241809514/pelletspreise-aktuell-heute-4-maerz-pellets-heizung-kosten.html,0,www.morgenpost.de,Pelletspreise heute am 4. März: Der aktuelle Preis pro Tonne,Die Inflation in Deutschland geht aktuell zurück. ○ Hat das Auswirkungen auf die Pelletspreise? ○ So viel kostet eine Tonne heute (4. März).,https://img.sparknews.funkemedien.de/237047837/237047837_1669908877_v4_3_800.jpeg,2024-03-04T08:58:13Z,,"Berlin. Die Inflation in Deutschland geht aktuell zurück. Hat das Auswirkungen auf die Pelletspreise? So viel kostet eine Tonne heute (4. März).
Die Pelletheizung kann neben der Wärmepumpe oder der … [+6895 chars]",,de,'Inflation'
