index,url,valid,domain,title,description,image,published,archive,content,quote,language,keyword
https://www.faz.net/aktuell/wirtschaft/unternehmen/oesterreich-ist-beliebt-so-teuer-ist-das-skifahren-in-den-alpen-200412975.html,https://www.faz.net/aktuell/wirtschaft/unternehmen/oesterreich-ist-beliebt-so-teuer-ist-das-skifahren-in-den-alpen-200412975.html,0,www.faz.net,Hohe Nachfrage: So teuer ist das Skivergnügen in den Alpen,Österreich ist ein beliebtes Ziel für deutsche Wintersportler. Doch Klimawandel und die Inflation verteuern den Urlaub rasant.,https://media0.faz.net/image/w1200h627/16ac0e6c6dee/w3000h1567x0y380o/202310/43600.0.2078405645/im-seinerzeitigen-corona.webp,2026-01-06T18:41:48Z,,"Viele Urlauber machen sich in diesen Tagen wieder auf zum Winterurlaub. Österreich ist für Deutsche das Lieblingsziel vor der Schweiz, Italien/Südtirol und Frankreich. Das belegen verschiedene Markta… [+6513 chars]",,de,'Inflation'
https://www.zeit.de/news/2026-01/06/wie-die-koalition-der-willigen-die-ukraine-schuetzen-will,https://www.zeit.de/news/2026-01/06/wie-die-koalition-der-willigen-die-ukraine-schuetzen-will,0,www.zeit.de,"Ukraine-Krieg: Wie die ""Koalition der Willigen"" die Ukraine schützen will","Hier finden Sie Informationen zu dem Thema „Ukraine-Krieg“. Lesen Sie jetzt „Wie die ""Koalition der Willigen"" die Ukraine schützen will“.",https://img.zeit.de/news/2026-01/06/wie-die-koalition-der-willigen-die-ukraine-schuetzen-will-image-group/wide__1300x731,2026-01-06T20:04:23Z,,Wie kann ein erneuter Angriff Russlands auf die Ukraine nach einem Waffenstillstand verhindert werden? Die Verbündeten der Ukraine - vor allem die in Europa - wollen dabei eine zentrale Rolle spielen… [+6594 chars],,de,'Krieg'
https://www.zeit.de/news/2026-01/07/wohnungslosenhilfe-lebensgefahr-fuer-obdachlose-durch-kaelte,https://www.zeit.de/news/2026-01/07/wohnungslosenhilfe-lebensgefahr-fuer-obdachlose-durch-kaelte,0,www.zeit.de,Winter: Wohnungslosenhilfe: Lebensgefahr für Obdachlose durch Kälte,Hier finden Sie Informationen zu dem Thema „Winter“. Lesen Sie jetzt „Wohnungslosenhilfe: Lebensgefahr für Obdachlose durch Kälte“.,https://img.zeit.de/news/2026-01/07/wohnungslosenhilfe-lebensgefahr-fuer-obdachlose-durch-kaelte-image-group/wide__1300x731,2026-01-07T02:04:04Z,,Angesichts der eisigen Temperaturen warnt die Bundesarbeitsgemeinschaft Wohnungslosenhilfe vor Lücken bei der Versorgung von Menschen ohne eigene Wohnung. «Kälte stellt für obdachlose Menschen eine l… [+1782 chars],,de,'Winter'
https://www.focus.de/politik/ausland/mann-glaubt-nicht-an-ukraine-krieg-und-reist-hin-russen-foltern-ihn-zu-tode_65146c89-44bf-4bd6-94b9-1446ec1f093d.html,https://www.focus.de/politik/ausland/mann-glaubt-nicht-an-ukraine-krieg-und-reist-hin-russen-foltern-ihn-zu-tode_65146c89-44bf-4bd6-94b9-1446ec1f093d.html,0,www.focus.de,Mann glaubt nicht an Ukraine-Krieg und reist hin — Russen foltern ihn zu Tode,"Ein Mann aus Polen zweifelte, dass Russland wirklich Krieg gegen die Ukraine führt. Er fuhr selbst in die besetzten Gebiete und wurde dort festgenommen. In Haft folterten ihn die Russen aufgrund seiner polnischen Staatsbürgerschaft. Der Mann starb.",https://quadro.burda-forward.de/ctf/ef7e7510-436c-42df-9fbc-1f424f0e80d2.ce8a7edc-f23f-4248-adbb-7c90d0904b54.png?im=RegionOfInterestCrop%3D%281200%2C630%29%2CregionOfInterest%3D%281156%2C204%29&hash=1106addfd30b95463449b06eb3e3d4b4a49515b72a80ebf54e9ee787b8cbfbfa,2026-01-07T11:29:54Z,,"Ein Mann aus Polen, der nicht glaubte, dass Russland einen Krieg gegen die Ukraine führte, wurde von den Russen zu Tode gefoltert. Krzysztof Galos reiste im April 2023 selbst in die Ukraine und schaf… [+2740 chars]",,de,'Krieg'
https://www.zeit.de/news/2026-01/07/auch-bei-eis-und-schnee-schulen-grundsaetzlich-geoeffnet,https://www.zeit.de/news/2026-01/07/auch-bei-eis-und-schnee-schulen-grundsaetzlich-geoeffnet,0,www.zeit.de,Schulbetrieb im Winter: Auch bei Eis und Schnee: Schulen grundsätzlich geöffnet,Hier finden Sie Informationen zu dem Thema „Schulbetrieb im Winter“. Lesen Sie jetzt „Auch bei Eis und Schnee: Schulen grundsätzlich geöffnet“.,https://img.zeit.de/news/2026-01/07/auch-bei-eis-und-schnee-schulen-grundsaetzlich-geoeffnet-image-group/wide__1300x731,2026-01-07T11:49:56Z,,Das Schweriner Bildungsministerium hat angesichts der Wetterprognosen auf die Regelungen für den Schulbetrieb in der Winterzeit hingewiesen. Die Schulen seien grundsätzlich geöffnet und für alle Jahr… [+607 chars],,de,'Winter'
https://www.stern.de/news/vertreter-der-usa-und-ukraine-beraten-in-paris-weiter-ueber-waffenruhe-37018200.html,https://www.stern.de/news/vertreter-der-usa-und-ukraine-beraten-in-paris-weiter-ueber-waffenruhe-37018200.html,0,www.stern.de,Vertreter der USA und Ukraine beraten in Paris weiter über Waffenruhe,"Einen Tag nach dem Gipfeltreffen zur Ukraine in Paris haben ukrainische und US-Berater ihre Gespräche über Bedingungen für einen Waffenstillstand fortgesetzt. ""Wir gehen davon aus, dass die schwierigsten Punkte eines Rahmen zur Beendigung des Krieges erörtert…",https://image.stern.de/37018202/t/JN/v1/w1440/r1.7778/-/07--wolodymyr-selenskyj---69414fd8f28bed4b.jpg,2026-01-07T12:01:19Z,,"Kopiere den aktuellen Link
Zur Merkliste hinzufügen
Einen Tag nach dem Gipfeltreffen zur Ukraine in Paris haben ukrainische und US-Berater ihre Gespräche über Bedingungen für einen Waffenstillstand… [+2254 chars]",,de,'Krieg'
https://www.sueddeutsche.de/panorama/bundeswehr-wehrdienst-kriegsdienstverweigerung-tipps-li.3351894,https://www.sueddeutsche.de/panorama/bundeswehr-wehrdienst-kriegsdienstverweigerung-tipps-li.3351894,0,www.sueddeutsche.de,Wehrdienstverweigerung: Ich möchte nicht zur Bundeswehr. Wie kann ich den Kriegsdienst verweigern?,"Junge Männer könnten zum Wehrdienst verpflichtet werden, wenn es nicht genug Freiwillige gibt. Oder sie verweigern. Pfarrer Martin Tontsch berät seit Jahren dazu - und weiß, warum „Ich bin gegen Krieg“ als Argument nicht ausreicht.",https://www.sueddeutsche.de/2026/01/05/362f5869-f4e9-47a3-9735-df876001725b.jpg?q=60&fm=webp&width=1200&rect=0%2C156%2C3000%2C1687,2026-01-07T12:23:46Z,,"Wer in diesem Jahr 18 wird, muss sich bald mit einem Schreiben der Bundeswehr auseinandersetzen. Und mit einer Frage: Würde ich zur Bundeswehr gehen, falls ich müsste oder möchte ich den Kriegsdienst… [+367 chars]",,de,'Krieg'
https://www.faz.net/aktuell/politik/ukraine/europa-und-russland-ohne-abschreckung-geht-es-nicht-110814923.html,https://www.faz.net/aktuell/politik/ukraine/europa-und-russland-ohne-abschreckung-geht-es-nicht-110814923.html,0,www.faz.net,Russlands Ukraine-Krieg: Endlich kümmern sich die Europäer um die Abschreckung,"Sollte es einen Frieden geben, wollen die Europäer Soldaten in die Ukraine schicken. Das wäre ein großer Schritt. Wo die Bundeswehr eingesetzt würde, wäre eher zweitrangig.",https://media0.faz.net/image/w1200h627/e1688d336171/w3606h1884x906y1565o/202601/43601.0.1642352225/die-ukrainische-praesident.webp,2026-01-07T12:34:58Z,,"Formal betrachtet sind die Beschlüsse, die beim Treffen der Koalition der Willigen in Paris getroffen wurden, nichts wirklich Neues. Sie konkretisieren Ideen zur Absicherung der Ukraine, die es schon… [+1817 chars]",,de,'Krieg'
https://www.zeit.de/news/2026-01/07/kaelte-kein-problem-fuer-tiger-und-panda-im-schweriner-zoo,https://www.zeit.de/news/2026-01/07/kaelte-kein-problem-fuer-tiger-und-panda-im-schweriner-zoo,0,www.zeit.de,Tiere im Winter: Kälte kein Problem für Tiger und Panda im Schweriner Zoo,Hier finden Sie Informationen zu dem Thema „Tiere im Winter“. Lesen Sie jetzt „Kälte kein Problem für Tiger und Panda im Schweriner Zoo“.,https://img.zeit.de/news/2026-01/07/kaelte-kein-problem-fuer-tiger-und-panda-im-schweriner-zoo-image-group/wide__1300x731,2026-01-07T14:09:44Z,,"Der Sibirische Tiger und der Rote Panda gehören zu den Tieren im Schweriner Zoo, die auch angesichts der aktuellen winterlichen Temperaturen keine Probleme haben. «Beim Tiger gibt ja der Name schon A… [+2024 chars]",,de,'Kälte'
https://www.zeit.de/news/2026-01/07/pistorius-konkrete-beitraege-zur-sicherung-der-ukraine-noetig,https://www.zeit.de/news/2026-01/07/pistorius-konkrete-beitraege-zur-sicherung-der-ukraine-noetig,0,www.zeit.de,Ukraine-Krieg: Pistorius: Konkrete Beiträge zur Sicherung der Ukraine nötig,Hier finden Sie Informationen zu dem Thema „Ukraine-Krieg“. Lesen Sie jetzt „Pistorius: Konkrete Beiträge zur Sicherung der Ukraine nötig“.,https://img.zeit.de/news/2026-01/07/pistorius-konkrete-beitraege-zur-sicherung-der-ukraine-noetig-image-group/wide__1300x731,2026-01-07T15:49:27Z,,"Verteidigungsminister Boris Pistorius hält weitere Planungen zum militärischen Schutz bei einer Friedenslösung in der Ukraine für nötig. «Mir ist wichtig, dass die Unterstützerländer der Ukraine konk… [+2088 chars]",,de,'Putin'
https://www.n-tv.de/wirtschaft/LNG-Terminals-decken-ein-Zehntel-des-deutschen-Gasbedarfs-id30215407.html,https://www.n-tv.de/wirtschaft/LNG-Terminals-decken-ein-Zehntel-des-deutschen-Gasbedarfs-id30215407.html,0,www.n-tv.de,Alternative zu Pipeline-Gas: LNG-Terminals decken ein Zehntel des deutschen Gasbedarfs,"Um die Abhängigkeit von russischen Erdgas-Pipelines nach dem Überfall Moskaus auf die Ukraine rasch zu reduzieren, baut Deutschland Flüssiggas-Terminals an Nord- und Ostsee auf. Mittlerweile machen diese LNG-Importe schon mehr als zehn Prozent an der Gesamtme…",https://www.n-tv.de/img/30215414/1767854378/Img_16_9/1200/Der-LNG-Tanker-Seapeak-Magellan-uebergibt-Fluessigerdgas-an-das-Regasifizierungs-Schiff-Floating-Storage-and-Regasification-Unit-FSRU-Neptune-im-Hafen-Mukran-Das-Regasifizierungsschiff-gehoert-zum-Energie-Terminal-Deutsche-Ostsee.jpg,2026-01-08T06:45:21Z,,"Ein LNG-Tanker übergibt Flüssigerdgas an die ""Neptune"" im Hafen Mukran auf Rügen: Hier soll schon bald wieder ein zweites Spezialschiff LNG aufnehmen können. (Foto: picture alliance/dpa)
Um die Abhä… [+3503 chars]",,de,'Gas'
https://www.focus.de/finanzen/inflation-im-alltag-wer-am-staerksten-verliert-und-welche-anlagen-wirklich-helfen_4d794dab-be26-4400-8284-b3ae9fe984b3.html,https://www.focus.de/finanzen/inflation-im-alltag-wer-am-staerksten-verliert-und-welche-anlagen-wirklich-helfen_4d794dab-be26-4400-8284-b3ae9fe984b3.html,0,www.focus.de,Inflation im Alltag: Wer am stärksten verliert – und welche Anlagen wirklich helfen,"Steigende Preise, sinkende Kaufkraft: Finanzexperte Daniel Walther erklärt, wen Inflation besonders trifft und wie man sich schützen kann.",https://quadro.burda-forward.de/ctf/7040c8bf-5797-4879-bb62-8757719925c4.c460f9d6-6e58-46f2-9951-2ee583de135a.jpg?im=RegionOfInterestCrop%3D%281200%2C630%29%2CregionOfInterest%3D%281097%2C968%29&hash=44ede36532f22c8018cd7a0a203a5bcf9af460f02f2be7002b20d4f08eb0141c,2026-01-08T06:59:30Z,,"Wen trifft die Inflation besonders?
Inflation wird als umso schlimmer wahrgenommen, je höher der Anteil des Einkommens ist, der für Waren und Dienstleistungen ausgegeben wird, besonders die Waren, a… [+2718 chars]",,de,'Inflation'
https://www.faz.net/aktuell/politik/ausland/venezuela-trump-greift-nach-dem-oel-200415833.html,https://www.faz.net/aktuell/politik/ausland/venezuela-trump-greift-nach-dem-oel-200415833.html,0,www.faz.net,Venezuela: Trump greift nach dem Öl,Trump greift nach dem Öl,https://media0.faz.net/image/w1200h627/6fbcebf2e272/w2727h1424x177y278o/202601/43601.0.1643414807/4360101643414807.webp,2026-01-08T07:01:14Z,,"Donald Trump spricht ohne Umschweife über seine Prioritäten in Venezuela: Das Ölgeschäft in dem südamerikanischen Land sei seit Langem ein totales Desaster, sagte er am Samstag nur wenige Stunden nac… [+11391 chars]",,de,'Öl'
https://www.faz.net/aktuell/sport/mehr-sport/hannawald-kritisiert-deutsche-springer-nicht-das-gefuehl-dass-einer-brennt-accg-200418551.html,https://www.faz.net/aktuell/sport/mehr-sport/hannawald-kritisiert-deutsche-springer-nicht-das-gefuehl-dass-einer-brennt-accg-200418551.html,0,www.faz.net,"Kritik von Hannawald: „Nicht das Gefühl, dass einer brennt“","„Mehr Gas geben“ sei nicht möglich gewesen, kritisiert Sven Hannawald die deutschen Springer nach einer durchwachsenen Vierschanzentournee. Einen Springer lässt er bewusst außen vor.",https://media0.faz.net/image/w1200h627/099f0aa16b31/w8256h4313x0y595o/202601/43601.0.1640355836/keine-erfolgreiche-tour.webp,2026-01-08T07:44:32Z,,"Sven Hannawald hat nach der enttäuschend verlaufenen Vierschanzentournee Kritik an den deutschen Skispringern geäußert. Mir ist wieder aufgefallen, dass uns Deutschen dieses noch mal mehr Gas geben n… [+1111 chars]",,de,'Gas'
https://www.focus.de/politik/ausland/jetzt-nimmt-trump-putins-oel-kaeufer-ins-visier-so-will-er-russlands-kriegskasse-austrocknen_81f5e9f4-53e8-4cea-b63c-309755db7382.html,https://www.focus.de/politik/ausland/jetzt-nimmt-trump-putins-oel-kaeufer-ins-visier-so-will-er-russlands-kriegskasse-austrocknen_81f5e9f4-53e8-4cea-b63c-309755db7382.html,0,www.focus.de,Jetzt nimmt Trump Putins Öl-Käufer ins Visier – so will er Russlands Kriegskasse austrocknen,"Donald Trump hat laut Lindsey Graham einem Gesetz zugestimmt, das Sanktionen gegen Russland verschärfen soll. Der US-Präsident will damit Länder treffen, die russisches Öl kaufen.",https://quadro.burda-forward.de/ctf/11885fc7-373f-4487-96ff-6bdd19406621.ca946764-471a-417b-b2bc-4fb14a6c1ac6.jpg?im=RegionOfInterestCrop%3D%281200%2C630%29%2CregionOfInterest%3D%281173%2C864%29&hash=b6ce71d35883664a7b64859e7754e51f6e72849bcf03fd03815c1fdb90e1b6d4,2026-01-08T07:45:13Z,,"US-Präsident Donald Trump hat einem parteiübergreifenden Gesetzesentwurf zugestimmt, der neue Sanktionen gegen Russland vorsieht. Laut Politico könnte der Senat bereits nächste Woche darüber abstimme… [+1812 chars]",,de,'Putin'
https://www.stern.de/wirtschaft/gasspeicher--so-ist-der-fuellstand-in-deutschland-anfang-2026-37017542.html,https://www.stern.de/wirtschaft/gasspeicher--so-ist-der-fuellstand-in-deutschland-anfang-2026-37017542.html,0,www.stern.de,Heizen gegen die Kälte: Ähnlich wie 2022: Gasspeicher in Deutschland leeren sich zusehends,2026 beginnt in Teilen Deutschlands ungewöhnlich kalt und schneereich. Das sieht man auch an den Gasspeichern: Viele drehen ihre Heizung weiter auf als in vergangenen Jahren.,https://image.stern.de/37018406/t/Z3/v1/w1440/r1.7778/-/heizen-symbolbild-gasspeicher.jpg,2026-01-08T08:18:00Z,,"Kopiere den aktuellen Link
Zur Merkliste hinzufügen
2026 beginnt in Teilen Deutschlands ungewöhnlich kalt und schneereich. Das sieht man auch an den Gasspeichern: Viele drehen ihre Heizung weiter a… [+3047 chars]",,de,'Kälte'
https://www.zeit.de/news/2026-01/08/kreis-busunternehmen-koennen-fahrten-einstellen,https://www.zeit.de/news/2026-01/08/kreis-busunternehmen-koennen-fahrten-einstellen,0,www.zeit.de,Winter in Norddeutschland: Kreis: Busunternehmen können Fahrten einstellen,Hier finden Sie Informationen zu dem Thema „Winter in Norddeutschland“. Lesen Sie jetzt „Kreis: Busunternehmen können Fahrten einstellen“.,https://img.zeit.de/news/2026-01/08/kreis-busunternehmen-koennen-fahrten-einstellen-image-group/wide__1300x731,2026-01-08T09:25:23Z,,"Der Kreis Nordfriesland weist darauf hin, dass Verkehrsunternehmen den Busverkehr bei Gefahr durch Wetter einstellen können. Es liege im Ermessensspielraum der Verkehrsunternehmen, ob ein sicherer Be… [+760 chars]",,de,'Winter'
https://www.bild.de/regional/baden-wuerttemberg/grosseinsatz-in-albstadt-wohnhaus-eingestuerzt-war-es-eine-gasexplosion-6929d88be9b1296b9ef9728f,https://www.bild.de/regional/baden-wuerttemberg/grosseinsatz-in-albstadt-wohnhaus-eingestuerzt-war-es-eine-gasexplosion-6929d88be9b1296b9ef9728f,0,www.bild.de,Mehr als 100 Retter in Albstadt im Einsatz - Wohnhaus eingestürzt! War es eine Gasexplosion?,"Großeinsatz am frühen Morgen in Albstadt: Eine Explosion zerstört ein Gebäude vollständig, die Ursache ist noch unbekannt. Opfer und Ursache bislang unklar.","https://images.bild.de/6929d88be9b1296b9ef9728f/3ab23adf1054c012d2602b256d396b4a,c2c443c7?w=1280",2026-01-08T10:37:31Z,,Albstadt (Baden-Württemberg)  Großlage nach einer Explosion am frühen Morgen in Baden-Württemberg! Bei einer Explosion in Albstadt wurde ein Gebäude vollständig zerstört. Zu Ursache und möglichen Opf… [+2147 chars],,de,'Gas'
https://www.n-tv.de/politik/Moskau-wirft-USA-vor-militaerische-Spannungen-zu-schueren-id30218094.html,https://www.n-tv.de/politik/Moskau-wirft-USA-vor-militaerische-Spannungen-zu-schueren-id30218094.html,0,www.n-tv.de,"""Bedauerlich und alarmierend"": Moskau wirft USA vor, militärische Spannungen zu schüren","US-Streitkräfte bringen am Mittwoch zwei Schiffe in der Karibik und im Nordatlantik auf. Darunter ist auch ein unter russischer Flagge fahrender Öltanker. Washington begründet die Militäraktionen mit ""Verstößen gegen US-Sanktionen"". Russland reagiert empört.",https://www.n-tv.de/img/30218204/1767887688/Img_16_9/1200/Dieses-Bild-aus-einem-vom-US-Verteidigungsministerium-zur-Verfuegung-gestellten-Video-zeigt-das-Schiff-der-US-Kuestenwache-Munro-der-die-MS-Bella-1-im-Nordatlantik-waehrend-einer-Seeoperation-beschattet.jpg,2026-01-08T15:54:01Z,,"Ein Schiff der US-Küstenwache beschattet während einer Seeoperation die ""MS Bella 1"" im Nordatlantik. (Foto: picture alliance/dpa/U.S. Department of Defense)
US-Streitkräfte bringen am Mittwoch zwei… [+3176 chars]",,de,'Putin'
https://www.zeit.de/politik/2026-01/donald-trump-wladimir-putin-russland-podcast,https://www.zeit.de/politik/2026-01/donald-trump-wladimir-putin-russland-podcast,0,www.zeit.de,"Donald Trump und Wladimir Putin: Mein Hinterhof, dein Hinterhof",Donald Trump und Wladimir Putin haben ähnliche Vorstellungen von Politik und dürften sich weiter annähern. Für Europa könnte das gefährlich werden.,https://img.zeit.de/politik/ausland/2026-01/donald-trump-wladimir-putin-russland-podcast-bild/wide__1300x731,2026-01-08T16:22:07Z,,"U.S. President Donald Trump speaks with Russian President Vladimir Putin, as they meet to negotiate for an end to the war in Ukraine, at Joint Base Elmendorf-Richardson in Anchorage, Alaska, U.S., Au… [+1893 chars]",,de,'Putin'
https://taz.de/Beschlagnahmter-Tanker/!6144000/,https://taz.de/Beschlagnahmter-Tanker/!6144000/,0,taz.de,Beschlagnahmter Tanker: Sanktionen sind besser als Militäraktionen,Wladimir Putin ignorierte bislang alle Friedensverhandlungen und Kompromisse. Jetzt muss er mit weiteren Sanktionen gegen sein Land rechnen.,https://taz.de/picture/8174929/1200/USA-Russland-Sanktionn-Oel.jpeg,2026-01-08T16:56:00Z,,Wladimir Putin ignorierte bislang alle Friedensverhandlungen und Kompromisse. Jetzt muss er mit weiteren Sanktionen gegen sein Land rechnen. mehr...,,de,'Putin'
https://www.jungewelt.de/artikel/515316.medien-und-ihre-wirkung-der-liberale-feminismus-dient-dem-kriegsregime.html,https://www.jungewelt.de/artikel/515316.medien-und-ihre-wirkung-der-liberale-feminismus-dient-dem-kriegsregime.html,0,www.jungewelt.de,Medien und ihre Wirkung: »Der liberale Feminismus dient dem Kriegsregime«,Über falsche Antworten in der Frauenfrage und die manipulative Rolle der Medien. Ein Gespräch mit Irene Zugasti Hervás • Foto: REUTERS/Pierre Marsaut,https://www.jungewelt.de/img/1100/217608.jpg,2026-01-08T18:36:24Z,,"Sie haben gerade gemeinsam mit Isabel Serra,Abgeordnete von Podemosim EU-Parlament, ein Buch mit dem Titel »Esto no es una guerra« (Dies ist kein Krieg) veröffentlicht.Welche Rolle spielen die Medien… [+9470 chars]",,de,'Putin'
https://www.zeit.de/news/2026-01/08/warnung-vor-starker-schneeverwehung-im-suedwesten-von-mv,https://www.zeit.de/news/2026-01/08/warnung-vor-starker-schneeverwehung-im-suedwesten-von-mv,0,www.zeit.de,Winter im Nordosten: Warnung vor starker Schneeverwehung im Südwesten von MV,Hier finden Sie Informationen zu dem Thema „Winter im Nordosten“. Lesen Sie jetzt „Warnung vor starker Schneeverwehung im Südwesten von MV“.,https://img.zeit.de/news/2026-01/08/warnung-vor-starker-schneeverwehung-im-suedwesten-von-mv-image-group/wide__1300x731,2026-01-08T19:23:25Z,,Der Deutsche Wetterdienst (DWD) hat wegen erwarteten Schneefalls und teils stürmischen Windböen eine Unwetterwarnung für den Südwesten Mecklenburg-Vorpommerns herausgegeben. Der DWD warnt vor starken… [+691 chars],,de,'Winter'
https://www.welt.de/politik/ausland/article695b502cfb77630dac277a28/ukraine-krieg-sie-begruenden-eine-kriegsachse-russland-erklaert-auslaendische-truppen-zu-legitimen-zielen-liveticker.html,https://www.welt.de/politik/ausland/article695b502cfb77630dac277a28/ukraine-krieg-sie-begruenden-eine-kriegsachse-russland-erklaert-auslaendische-truppen-zu-legitimen-zielen-liveticker.html,0,www.welt.de,„Sie begründen eine ‚Kriegsachse‘“ – Russland erklärt ausländische Truppen zu „legitimen Zielen“,"Markus Söder und Friedrich Merz äußern sich, ob eine Teilnahme der Bundeswehr an einer Ukraine-Friedensmission in Betracht gezogen werden kann. Der Wintereinbruch hat Folgen für die Front. Großbritannien gibt derweil neue Waffenlieferungen an die Ukraine beka…",https://images.welt.de/695b502cfb77630dac277a28/882fb8c40e34148ebc730674cd3d68ed/ci16x9-w1200/apdpa-32b85000357a5111-jpg,2026-01-08T20:14:00Z,,Markus Söder und Friedrich Merz äußern sich zu einer eventuellen Teilnahme der Bundeswehr an einer Ukraine-Friedensmission. Der Wintereinbruch hat Folgen für die Front. Russland wendet sich derweil m… [+18823 chars],,de,'Winter'
https://www.welt.de/politik/ausland/article695b502cfb77630dac277a28/ukraine-krieg-kiew-loest-luftalarm-fuer-gesamte-ukraine-aus-begeben-sie-sich-in-schutzraeume-warnt-selenskyj-liveticker.html,https://www.welt.de/politik/ausland/article695b502cfb77630dac277a28/ukraine-krieg-kiew-loest-luftalarm-fuer-gesamte-ukraine-aus-begeben-sie-sich-in-schutzraeume-warnt-selenskyj-liveticker.html,0,www.welt.de,"Kiew löst Luftalarm für gesamte Ukraine aus – „Begeben Sie sich in Schutzräume“, warnt Selenskyj","Markus Söder und Friedrich Merz äußern sich, ob eine Teilnahme der Bundeswehr an einer Ukraine-Friedensmission in Betracht gezogen werden kann. Der Wintereinbruch hat Folgen für die Front. Großbritannien gibt derweil neue Waffenlieferungen an die Ukraine beka…",https://images.welt.de/695b502cfb77630dac277a28/3d8b33baa7a7ff8f4f95264406ce2e0c/ci16x9-w1200/566210573-jpg,2026-01-08T22:34:00Z,,Markus Söder und Friedrich Merz äußern sich zu einer eventuellen Teilnahme der Bundeswehr an einer Ukraine-Friedensmission. Der Wintereinbruch hat Folgen für die Front. Russland wendet sich derweil m… [+19382 chars],,de,'Putin'
https://www.bild.de/leben-wissen/lifestyle/kennen-sie-schon-diese-tipps-gegen-kaelte-so-frieren-sie-nicht-mehr-67594473423348047ff9e479,https://www.bild.de/leben-wissen/lifestyle/kennen-sie-schon-diese-tipps-gegen-kaelte-so-frieren-sie-nicht-mehr-67594473423348047ff9e479,0,www.bild.de,Nicht mehr frieren im Winter - Kennen Sie schon diese Tipps gegen Kälte?,"Was tun, wenn die Kälte einen richtig packt? Wie schützt man sich richtig vor dem Frost? BILD verrät Ihnen, was man bei Kälte im Winter beachten sollte.","https://images.bild.de/67594473423348047ff9e479/64fba5f12f0e65f8a2768db4366b0480,21a6ded0?w=1280",2026-01-09T05:33:24Z,,"TTS-Player überspringenArtikel weiterlesenDer Winter ist angekommen und bringt eisige Temperaturen mit sich.
Wer sich jetzt vor die Tür wagt, muss sich warm anziehen und auf die kalte Jahreszeit vor… [+6237 chars]",,de,'Winter'
https://www.n-tv.de/sport/fussball/DFL-ist-alarmiert-Bundesliga-kaempft-gegen-das-Wetter-Chaos-id30219939.html,https://www.n-tv.de/sport/fussball/DFL-ist-alarmiert-Bundesliga-kaempft-gegen-das-Wetter-Chaos-id30219939.html,0,www.n-tv.de,"Anreise, Absage, Gesundheit: DFL ist ""alarmiert"": Bundesliga kämpft gegen das Wetter-Chaos","Der Winter hat vor allem den Norden Deutschlands im Griff. Schulen bleiben geschlossen, Züge fallen aus - und womöglich auch das ein oder andere Spiel zum Start der Rückrunde der Fußball-Bundesliga. Wie das entschieden wird - und was Fans und Profis beachten …",https://www.n-tv.de/img/30220074/1767941347/Img_16_9/1200/Fussball-Herren-Saison-2025-2026-1-Bundesliga-1-FC-Union-Berlin-freiwillige-Fans-und-Angestellte-befreien-Wege-und-Parkplaetze-am-und-im-Stadion-An-der-Alten-Foersterei-von-Schnee-im-Bild-ein-Stadionmitarbeiter-bringt-mit-einem-Bagger-Schnee-weg-08-01.jpg,2026-01-09T05:55:41Z,,"Anreise, Absage, GesundheitDFL ist ""alarmiert"": Bundesliga kämpft gegen das Wetter-Chaos
An der alten Försterei in Berlin wird mit schwerem Gerät gearbeitet. (Foto: IMAGO/Matthias Koch)
Der Winter … [+5413 chars]",,de,'Winter'
https://www.tagesspiegel.de/potsdam/landeshauptstadt/frost-schnee-und-eisige-kalte-sturmtief-elli-friert-potsdam-ein--die-besten-bilder-15115716.html,https://www.tagesspiegel.de/potsdam/landeshauptstadt/frost-schnee-und-eisige-kalte-sturmtief-elli-friert-potsdam-ein--die-besten-bilder-15115716.html,0,www.tagesspiegel.de,"Frost, Schnee und eisige Kälte: Sturmtief „Elli“ friert Potsdam ein – die besten Bilder","Auch Potsdam muss sich auf ein paar frostige Tage einstellen. Die Temperaturen stürzen ab, es drohen Rutschpartien auf den Straßen. Der Potsdamer Winter in Bildern.",https://www.tagesspiegel.de/images/15115709/alternates/BASE_16_9_W1400/1767877456000/winter-potsdam.jpeg,2026-01-09T05:57:41Z,,In Potsdam herrscht eisige Kälte  zugleich sorgen Schnee und Sonnenschein für zauberhafte Winterstimmung. Aber Vorsicht ist geboten: Der Deutsche Wetterdienst (DWD) warnt vor Glätte. Zudem drohen am … [+929 chars],,de,'Winter'
