index,url,valid,domain,title,description,image,published,archive,content,quote,language,keyword
https://www.stern.de/news/gesundheitsminister--anerkennungsverfahren-fuer-auslaendische-aerzte-beschleunigen-34796330.html,https://www.stern.de/news/gesundheitsminister--anerkennungsverfahren-fuer-auslaendische-aerzte-beschleunigen-34796330.html,0,www.stern.de,Gesundheitsminister: Anerkennungsverfahren für ausländische Ärzte beschleunigen,Die Gesundheitsminister und -ministerinnen der Bundesländer wollen die Anerkennungsverfahren von ausländischen Ärztinnen und Ärzten beschleunigen. Das beschlossen die Ressortchefs zum Abschluss ihrer turnusmäßigen Konferenz am Donnerstag in Lübeck. Bayern sol…,https://image.stern.de/34796332/t/96/v1/w1440/r1.7778/-/13--arzt-mit-stethoskop---c15574ce303669b0.jpg,2024-06-13T13:44:11Z,,Die Gesundheitsminister und -ministerinnen der Bundesländer wollen die Anerkennungsverfahren von ausländischen Ärztinnen und Ärzten beschleunigen. Das beschlossen die Ressortchefs zum Abschluss ihrer… [+1307 chars],,de,'Bayern'
https://www.bild.de/leben-wissen/trotz-hoher-preise-verbraucher-wollen-qualitaet-beim-einkauf-666ad1fac674eb2c4b564865,https://www.bild.de/leben-wissen/trotz-hoher-preise-verbraucher-wollen-qualitaet-beim-einkauf-666ad1fac674eb2c4b564865,0,www.bild.de,Trotz Inflation - Jeder Zweite kauft mehr Bio-Produkte,"Trotz hoher Preise für Lebensmittel achten viele Verbraucher auf eine gute Qualität und große Auswahl beim Einkauf, besagt eine aktuelle Studie.","https://images.bild.de/666ad1fac674eb2c4b564865/0f3185ee27a9db407a8ebfa32328b6fd,13ba808a?w=1280",2024-06-13T13:44:38Z,,"Im Supermarkt stöhnen viele Verbraucher angesichts gestiegener Preise. Aber auch wenn die Teuerungen für Lebensmittel schmerzen: Verbraucher wollen beim Einkauf eine Top-Qualität! 
Das ergibt eine r… [+1906 chars]",,de,'Inflation'
https://www.bild.de/sport/fussball/fc-bayern-abwehr-star-ueberraschend-auf-der-verkaufsliste-jetzt-spricht-matthijs-de-ligt-666ac88020f331631ea0f537,https://www.bild.de/sport/fussball/fc-bayern-abwehr-star-ueberraschend-auf-der-verkaufsliste-jetzt-spricht-matthijs-de-ligt-666ac88020f331631ea0f537,0,www.bild.de,Auf Bayerns Verkaufsliste - Jetzt spricht Matthijs de Ligt!,Wie sieht die Zukunft von Matthijs de Ligt beim FC Bayern aus? Dazu äußerte er sich jetzt.Foto: Tom Weller/dpa,"https://images.bild.de/666ac88020f331631ea0f537/dd0dd94076a2f2c127bf88c54cecfc53,5f0f5f5a?w=1280",2024-06-13T14:01:57Z,,"Auf diesen Moment haben viele Bayern-Fans gespannt gewartet!
Nachdem BILD und Sky kürzlich darüber berichtet hatten, dass Matthijs de Ligt (24) überraschend auf der Verkaufsliste der Münchner für di… [+2396 chars]",,de,'Bayern'
https://www.sueddeutsche.de/sport/fc-bayern-basketball-alba-berlin-basketball-bundesliga-playoffs-lux.AbgxRqnn54AvxfAsbSynyS,https://www.sueddeutsche.de/sport/fc-bayern-basketball-alba-berlin-basketball-bundesliga-playoffs-lux.AbgxRqnn54AvxfAsbSynyS,0,www.sueddeutsche.de,Basketball-Playoffs: Gefangen im Viereck,"Der FC Bayern gewinnt das dritte Spiel der Finalserie auch deshalb mit 67:63, weil sie Albas besten Schützen Matt Thomas mit einer unüblichen Sonderbewachung irritieren. Am Freitag können die Münchner erstmals seit 2019 deutscher Meister werden.",https://www.sueddeutsche.de/2024/06/13/3a60af45-9103-4215-bcf2-b9f856f269df.jpeg?q=60&fm=webp&width=1200&rect=0%2C148%2C3987%2C2243,2024-06-13T14:02:05Z,,"Kurz war ein Gähnen zu sehen bei Moritz Wagner, als ihn die Kameras einfingen, er war gemeinsam mit seinem Bruder Franz zum Spiel Alba Berlin gegen Bayern München gekommen. Aber aus Langeweile gähnte… [+4336 chars]",,de,'Bayern'
https://www.n-tv.de/wirtschaft/Experten-sehen-Licht-am-Ende-des-Konjunkturtunnels-article25012394.html,https://www.n-tv.de/wirtschaft/Experten-sehen-Licht-am-Ende-des-Konjunkturtunnels-article25012394.html,0,www.n-tv.de,"Zeichen für Erholung mehren sich: Experten sehen ""Licht am Ende des Konjunkturtunnels""","Höhere Löhne und eine geringere Inflation sowie anspringende Exporte: Mehrere Wirtschaftsexperten sehen Deutschland auf dem Weg aus der Flaute. Allerdings spricht selbst das Ministerium von einem holprigen Weg. Und Konjunkturforscher verweisen darauf, dass es…",https://bilder1.n-tv.de/img/incoming/crop25012412/2991329085-cImg_16_9-w1200/462898147.jpg,2024-06-13T14:08:04Z,,Höhere Löhne und eine geringere Inflation sowie anspringende Exporte: Mehrere Wirtschaftsexperten sehen Deutschland auf dem Weg aus der Flaute. Allerdings spricht selbst das Ministerium von einem hol… [+3670 chars],,de,'Inflation'
https://www.kicker.de/ito-bei-bayern-nur-der-anfang-mit-fuenf-bis-sieben-neuen-spielern-ist-zu-rechnen-1031765/video,https://www.kicker.de/ito-bei-bayern-nur-der-anfang-mit-fuenf-bis-sieben-neuen-spielern-ist-zu-rechnen-1031765/video,0,www.kicker.de,"Ito bei Bayern nur der Anfang: ""Mit fünf bis sieben neuen Spielern ist zu rechnen""","Video: Kicker-Reporter Frank Linkesch gibt seine Einschätzung zum Ito-Transfer der Bayern und verrät, was beim FCB hinter den Kulissen noch geplant wird.",https://derivates.kicker.de/image/upload/c_crop%2Cx_0%2Cy_0%2Cw_4000%2Ch_2250/w_1200%2Cq_auto/v1/2024/06/13/4a77324f-3c5d-4951-9956-f2b749dfa138.jpeg,2024-06-13T14:16:39Z,,"Werbung und Tracking: Um dir relevante Inhalte und personalisierte Werbung anzubieten, setzen wir Cookies und andere Technologien ein. Damit messen wir, wie und womit du unsere Angebote nutzt. Diese … [+1979 chars]",,de,'Bayern'
https://www.kicker.de/kaufen-die-bayern-die-liga-kaputt-das-ist-populismus-1031754/video,https://www.kicker.de/kaufen-die-bayern-die-liga-kaputt-das-ist-populismus-1031754/video,0,www.kicker.de,"Kaufen die Bayern die Liga kaputt? ""Das ist Populismus""","Video: Hiroki Ito wechselt zum FC Bayern München, Jonathan Tah ist wohl kurz davor. Zwei weitere Bundesliga-Spieler, die innerhalb der Liga transferiert werden. Das wirft die Frage auf, ob der Rekordmeister die Liga kaputt kauft - kicker-Reporter Frank Linkes…",https://derivates.kicker.de/image/upload/c_crop%2Cx_0%2Cy_273%2Cw_4000%2Ch_2250/w_1200%2Cq_auto/v1/2024/06/13/63ea2b2c-4012-4534-b038-d61c4499f001.jpeg,2024-06-13T14:17:46Z,,"Werbung und Tracking: Um dir relevante Inhalte und personalisierte Werbung anzubieten, setzen wir Cookies und andere Technologien ein. Damit messen wir, wie und womit du unsere Angebote nutzt. Diese … [+1979 chars]",,de,'Bayern'
https://www.focus.de/experts/waehrungen-in-afrika-simbabwe-fuehrt-als-erstes-land-goldstandard-ein-das-kann-schwerwiegende-folgen-haben_id_260033965.html,https://www.focus.de/experts/waehrungen-in-afrika-simbabwe-fuehrt-als-erstes-land-goldstandard-ein-das-kann-schwerwiegende-folgen-haben_id_260033965.html,0,www.focus.de,"Währungen in Afrika - Simbabwe führt als erstes Land Goldstandard ein, das kann schwerwiegende Folgen haben","Finanziell verunsicherte Länder suchen nach neuen Lösungen, um ihre Wirtschaft zu stabilisieren. Finanz-Profi Sebastian Hell ordnet die Entwicklungen rund um die Einführung des Goldstandards in afrikanischen Ländern für Sie ein.Von FOCUS-online-Gastautor Seba…",https://p6.focus.de/img/fotos/id_260033967/gettyimages-869481918.jpg?im=Crop%3D%280%2C177%2C2119%2C1059%29%3BResize%3D%281200%2C627%29&impolicy=perceptual&quality=mediumHigh&hash=ab4e9c692f8801c3aaa15acb24ef7fcc74b51c8a1189ed564bd3ea30322a6e97,2024-06-13T14:21:46Z,,"<ul><li>
Kommentare</li><li>
E-Mail</li><li>
Teilen</li><li>
Mehr</li><li>
Twitter</li><li>
Drucken</li><li>
Feedback</li><li>
Fehler meldenSie haben einen Fehler gefunden?
Bitte markieren S… [+6742 chars]",,de,'Inflation'
https://www.kicker.de/de-ligt-zum-lewandowski-ausfall-das-ist-ein-grosser-verlust-fuer-sie-1031771/video,https://www.kicker.de/de-ligt-zum-lewandowski-ausfall-das-ist-ein-grosser-verlust-fuer-sie-1031771/video,0,www.kicker.de,"De Ligt zum Lewandowski-Ausfall: ""Das ist ein großer Verlust für sie""",Video: Polen muss zum EM-Auftakt gegen die Niederlande auf Stürmer Robert Lewandowski verzichten. Bayern-Verteidiger Matthijs de Ligt sieht im Gegner dennoch eine sehr starke Mannschaft.,https://derivates.kicker.de/image/upload/c_crop%2Cx_0%2Cy_66%2Cw_3189%2Ch_1794/w_1200%2Cq_auto/v1/2024/06/13/a71cd397-36ba-4aba-8443-7ed987f322fa.jpeg,2024-06-13T14:31:38Z,,"Werbung und Tracking: Um dir relevante Inhalte und personalisierte Werbung anzubieten, setzen wir Cookies und andere Technologien ein. Damit messen wir, wie und womit du unsere Angebote nutzt. Diese … [+1979 chars]",,de,'Bayern'
https://taz.de/Filmemacher-Steyerl-und-Radynski/!6016739/,https://taz.de/Filmemacher-Steyerl-und-Radynski/!6016739/,0,taz.de,Filmemacher Steyerl und Radynski: „Eher ein fraktaler Kolonialismus“,Hito Steyerl und Oleksiy Radynski über Verstrickungen russisch-deutscher Gasgeschäfte und ihr Kunstprojekt „LEAK. Das Ende der Pipeline“ in Leipzig.,https://taz.de/picture/7059330/948/MdbK-Leak-Installationsansicht-6-13-06-2024-1.jpeg,2024-06-13T16:25:00Z,,"Hito Steyerl und Oleksiy Radynski über Verstrickungen russisch-deutscher Gasgeschäfte und ihr Kunstprojekt LEAK. Das Ende der Pipeline in Leipzig.
Pipeline-Röhren um Filmcollagen: Ausstellungsansich… [+10543 chars]",,de,'fossile Energie'
https://www.zeit.de/video/2024-06/6354946997112/ukraine-krieg-g7-gewaehren-ukraine-kredit-in-hoehe-von-50-milliarden-dollar,https://www.zeit.de/video/2024-06/6354946997112/ukraine-krieg-g7-gewaehren-ukraine-kredit-in-hoehe-von-50-milliarden-dollar,0,www.zeit.de,Ukraine-Krieg: G7 gewähren Ukraine Kredit in Höhe von 50 Milliarden Dollar,In Italien haben sich die G7 auf weitere Ukraine-Hilfen geeinigt. 50 Milliarden US-Dollar sollen aus den Zinserträgen von eingefrorenen russischen Vermögen kommen.,https://img.zeit.de/video/2024-06/6354946997112-still/wide__1300x731,2024-06-13T21:25:45Z,,"Schließen
Hier können Sie interessante Artikel speichern, um sie später zu lesen und wiederzufinden.
Sie haben bereits ein Konto?
 Hier anmelden.",,de,'Krieg'
https://www.zeit.de/news/2024-06/14/g7-unterstuetzen-bidens-friedensplan,https://www.zeit.de/news/2024-06/14/g7-unterstuetzen-bidens-friedensplan,0,www.zeit.de,Krieg in Nahost: G7 unterstützen Bidens Friedensplan,Hier finden Sie Informationen zu dem Thema „Krieg in Nahost“. Lesen Sie jetzt „G7 unterstützen Bidens Friedensplan“.,https://img.zeit.de/news/2024-06/14/g7-unterstuetzen-bidens-friedensplan-image-group/wide__1300x731,2024-06-14T03:03:38Z,,Auf der Suche nach einem Weg aus dem Gaza-Krieg zwischen Israel und der islamistischen Hamas hat sich auch die G7-Gruppe der führenden demokratischen Industrienationen hinter den von US-Präsident Joe… [+5006 chars],,de,'Krieg'
https://www.focus.de/kultur/kino_tv/im-zdf-talk-spd-chefin-lobt-trotz-wahldebakel-konzepte-der-ampel-da-reagiert-lanz-sprachlos_id_260035105.html,https://www.focus.de/kultur/kino_tv/im-zdf-talk-spd-chefin-lobt-trotz-wahldebakel-konzepte-der-ampel-da-reagiert-lanz-sprachlos_id_260035105.html,0,www.focus.de,Im ZDF-Talk - SPD-Chefin lobt trotz Wahldebakel Konzepte der Ampel - da reagiert Lanz „sprachlos“,"Bei der Europawahl wurden vor allem die Ampel-Parteien von den Wählern abgestraft. SPD-Chefin Saskia Esken sah dennoch keinen Grund, die politische Richtung der Regierung zu überdenken. Stattdessen argumentierte sie bei „Markus Lanz“, dass die Inflation ein G…",https://p6.focus.de/img/kultur/kino_tv/id_260035103/die-talkrunde-bei-markus-lanz-am-donnerstag-13.-juni-2024.jpg?im=Crop%3D%280%2C113%2C1360%2C680%29%3BResize%3D%281200%2C627%29&impolicy=perceptual&quality=mediumHigh&hash=a7f27bf095d643790f0ca95456c6ee9ebebb47db9cc5ce721e6b338bff8513b9,2024-06-14T04:00:10Z,,"<ul><li>
Kommentare</li><li>
E-Mail</li><li>
Teilen</li><li>
Mehr</li><li>
Twitter</li><li>
Drucken</li><li>
Feedback</li><li>
Fehler meldenSie haben einen Fehler gefunden?
Bitte markieren S… [+6527 chars]",,de,'Inflation'
https://www.zeit.de/news/2024-06/14/lehren-aus-spiel-zwei-bayern-will-titel-in-berlin-holen,https://www.zeit.de/news/2024-06/14/lehren-aus-spiel-zwei-bayern-will-titel-in-berlin-holen,0,www.zeit.de,Basketball: Lehren aus Spiel zwei: Bayern will Titel in Berlin holen,Hier finden Sie Informationen zu dem Thema „Basketball“. Lesen Sie jetzt „Lehren aus Spiel zwei: Bayern will Titel in Berlin holen“.,https://img.zeit.de/news/2024-06/14/lehren-aus-spiel-zwei-bayern-will-titel-in-berlin-holen-image-group/wide__1300x731,2024-06-14T04:02:42Z,,Für den einen noch fehlenden Sieg zur deutschen Meisterschaft setzen die Basketballer von Bayern München auf die Lehren aus einer bitteren Niederlage. Nach der gewonnenen ersten Partie in der Finalse… [+2280 chars],,de,'Bayern'
https://www.focus.de/finanzen/news/schock-im-supermarkt-inflation-niedriger-doch-diese-lebensmittel-sind-weiter-sehr-teuer_id_260033987.html,https://www.focus.de/finanzen/news/schock-im-supermarkt-inflation-niedriger-doch-diese-lebensmittel-sind-weiter-sehr-teuer_id_260033987.html,0,www.focus.de,"Schock im Supermarkt - Inflation sinkt, doch diese Lebensmittel sind weiterhin extrem teuer",Für die Verbraucher gibt es gute Nachrichten. Die Inflation ist im Vergleich zum Vorjahr deutlich zurückgegangen und auch in den Supermärkten liefern sich die Händler zunehmend Preisschlachten. Für einige Lebensmittel müssen die Haushalte aber nach wie vor ti…,https://p6.focus.de/img/fotos/id_260034020/imago0536170388h-1-.jpg?im=Crop%3D%280%2C308%2C3431%2C1715%29%3BResize%3D%281200%2C627%29&impolicy=perceptual&quality=mediumHigh&hash=7e8fc353fb195a2eb17aedf47044bf05b8912f142224a36d48ef9a59c3671bcb,2024-06-14T04:28:35Z,,Für die Verbraucher gibt es gute Nachrichten. Die Inflation ist im Vergleich zum Vorjahr deutlich zurückgegangen und auch in den Supermärkten liefern sich die Händler zunehmend Preisschlachten. Für e… [+8609 chars],,de,'Inflation'
https://www.zeit.de/news/2024-06/14/krieg-gegen-die-ukraine-so-ist-die-lage,https://www.zeit.de/news/2024-06/14/krieg-gegen-die-ukraine-so-ist-die-lage,0,www.zeit.de,Russische Invasion: Krieg gegen die Ukraine: So ist die Lage,Hier finden Sie Informationen zu dem Thema „Russische Invasion“. Lesen Sie jetzt „Krieg gegen die Ukraine: So ist die Lage“.,https://img.zeit.de/news/2024-06/14/krieg-gegen-die-ukraine-so-ist-die-lage-image-group/wide__1300x731,2024-06-14T04:30:51Z,,US-Präsident Joe Biden hat der Ukraine Hoffnung auf eine Stärkung ihrer Luftverteidigung durch weitere Patriot-Systeme aus dem Ausland gemacht. Es gebe von fünf Ländern Zusagen für Patriot-Batterien … [+5471 chars],,de,'Krieg'
https://www.diepresse.com/18565547/rechtsextrem-ist-auch-ein-sprachproblem,https://www.diepresse.com/18565547/rechtsextrem-ist-auch-ein-sprachproblem,0,www.diepresse.com,„Rechtsextrem“ ist auch ein Sprachproblem [premium],"„Rechtspopulistisch“, „rechtsradikal“, „rechtsaußen“ oder einfach „rechts“? Über die Inflation eines im Deutschen besonders extremen Begriffs und die Mutation von „Rechts“ zum Reich der Finsternis.",https://img.diepresse.com/public/incoming/efh3vs-TOPSHOT-FRANCE-POLITICS-DEMO/alternates/DPR_SOCIAL_MAGAZIN_PAID/TOPSHOT-FRANCE-POLITICS-DEMO,2024-06-14T04:42:40Z,,"Rechtspopulistisch, rechtsradikal,rechtsaußen, rechts? Über die Inflation eines im Deutschen besonders extremen Begriffs und die Mutation von Rechts zum Reich der Finsternis. 
Deutschland: Wer sind … [+1627 chars]",,de,'Inflation'
https://www.zeit.de/news/2024-06/14/erst-die-usa-dann-die-eu-neue-russland-sanktionen,https://www.zeit.de/news/2024-06/14/erst-die-usa-dann-die-eu-neue-russland-sanktionen,0,www.zeit.de,"Krieg: Erst die USA, dann die EU: Neue Russland-Sanktionen","Hier finden Sie Informationen zu dem Thema „Krieg“. Lesen Sie jetzt „Erst die USA, dann die EU: Neue Russland-Sanktionen“.",https://img.zeit.de/news/2024-06/14/erst-die-usa-dann-die-eu-neue-russland-sanktionen-image-group/wide__1300x731,2024-06-14T04:52:27Z,,Auch wenn Donald Trump im November zurück ins Weiße Haus gewählt werden sollte: Die Ukraine soll sich im Krieg gegen Russland langfristig auf finanzielle und militärische Hilfe des Westens verlassen … [+5686 chars],,de,'Krieg'
https://www.zeit.de/news/2024-06/14/hamas-sprecher-niemand-weiss-wie-viele-geiseln-noch-leben,https://www.zeit.de/news/2024-06/14/hamas-sprecher-niemand-weiss-wie-viele-geiseln-noch-leben,0,www.zeit.de,"Nahost-Krieg: Hamas-Sprecher: Niemand weiß, wie viele Geiseln noch leben","Hier finden Sie Informationen zu dem Thema „Nahost-Krieg“. Lesen Sie jetzt „Hamas-Sprecher: Niemand weiß, wie viele Geiseln noch leben“.",https://img.zeit.de/news/2024-06/14/hamas-sprecher-niemand-weiss-wie-viele-geiseln-noch-leben-image-group/wide__1300x731,2024-06-14T05:22:33Z,,"Mehr als acht Monate nach dem Angriff auf Israel weiß die islamistische Hamas eigenen Angaben nach nicht, wie viele der rund 120 im Gazastreifen vermuteten Geiseln noch am Leben sind. ""Ich weiß es ni… [+2300 chars]",,de,'Krieg'
https://www.faz.net/aktuell/finanzen/finanzmarkt/inflation-in-argentinien-iwf-billigt-800-millionen-dollar-kredit-19788216.html,https://www.faz.net/aktuell/finanzen/finanzmarkt/inflation-in-argentinien-iwf-billigt-800-millionen-dollar-kredit-19788216.html,0,www.faz.net,Währungsfonds billigt 800 Millionen Dollar Kredit für Argentinien,"Mileis Sparprogramm, um die galoppierende Inflation in den Griff zu bekommen, scheint zu wirken. Dafür gibt es jetzt Geld vom Internationalen Währungsfonds.",https://media1.faz.net/ppmedia/aktuell/politik/659599944/1.9788231/facebook_teaser/geld-bewilligt-doch-der-unmut.jpg,2024-06-14T08:12:57Z,,"Die guten Nachrichten setzen sich fort, kommentierte Milei die Entscheidung. Zuvor hatte das nationale Statistikamt gemeldet, dass die Inflationsrate im Mai auf 4,2 Prozent gesunken war - das ist der… [+1146 chars]",,de,'Inflation'
https://www.zeit.de/politik/deutschland/2024-06/rente-erhoehung-juli-ost-west,https://www.zeit.de/politik/deutschland/2024-06/rente-erhoehung-juli-ost-west,0,www.zeit.de,"Rentenerhöhung: Renten steigen ab Juli um 4,57 Prozent","Zum ersten Mal seit Jahren bleibt die Rentenerhöhung nicht hinter der Inflation zurück. Auf eine Rente von 1.000 Euro gibt es 45,70 mehr – in Ost- und Westdeutschland.",https://img.zeit.de/gesellschaft/2024-06/rente-bild/wide__1300x731,2024-06-14T10:08:38Z,,"Die Renten in Deutschland steigen zum 1. Juli um 4,57
Prozent. Der Bundesrat billigte eine entsprechende Verordnung des
Bundesarbeitsministeriums. Erstmals fällt die Erhöhung für die mehr
als 21 M… [+1533 chars]",,de,'Inflation'
https://www.zeit.de/news/2024-06/14/neues-nato-hauptquartier-fuer-ukraine-einsatz-in-deutschland,https://www.zeit.de/news/2024-06/14/neues-nato-hauptquartier-fuer-ukraine-einsatz-in-deutschland,0,www.zeit.de,Verteidigung: Neues Nato-Hauptquartier für Ukraine-Einsatz in Deutschland,Hier finden Sie Informationen zu dem Thema „Ukraine-Krieg“. Lesen Sie jetzt „Neues Nato-Hauptquartier in Deutschland“.,https://img.zeit.de/news/2024-06/14/neues-nato-hauptquartier-fuer-ukraine-einsatz-in-deutschland-image-group/wide__1300x731,2024-06-14T12:03:06Z,,Das Hauptquartier für den geplanten Nato-Einsatz zur Koordinierung von Waffenlieferungen und Ausbildungsaktivitäten für die ukrainischen Streitkräfte wird in Deutschland angesiedelt. Wie die Deutsche… [+3510 chars],,de,'Krieg'
https://www.zeit.de/politik/ausland/2024-06/ukraine-krieg-nato-putin-bedingungen-waffenruhe,https://www.zeit.de/politik/ausland/2024-06/ukraine-krieg-nato-putin-bedingungen-waffenruhe,0,www.zeit.de,Ukraine-Krieg: Ukraine und Nato weisen Putins Bedingungen für Waffenruhe zurück,"Die Ukraine wünscht sich weniger Beachtung für ""Augenwischerei"" aus Russland. Für Jens Stoltenberg bedeuten diese Äußerungen nur ""mehr Aggression, mehr Besatzung"".",https://img.zeit.de/politik/ausland/2024-06/ukraine-russland-krieg/wide__1300x731,2024-06-14T13:16:59Z,,"Die Ukraine hat die Bedingungen des russischen Präsidenten Wladimir Putin für eine Waffenruhe und Friedensverhandlungen als ""Augenwischerei"" zurückgewiesen. ""Es gibt nichts Neues, keine wirklichen Fr… [+3039 chars]",,de,'Krieg'
https://www.kicker.de/zeit-fuer-fussball-und-begeisterung-auf-gehts-zur-heim-em-1032012/artikel,https://www.kicker.de/zeit-fuer-fussball-und-begeisterung-auf-gehts-zur-heim-em-1032012/artikel,0,www.kicker.de,Zeit für Fußball und Begeisterung: Auf geht’s zur Heim-EM,Die Weltmeisterschaft 2018 fand in Russland statt. Das paneuropäische Turnier 2021 wurde von der Corona-Pandemie überschattet. Die Winter-WM 2022 in Katar stand im Zeichen politischer Debatten über Menschenrechtsverletzungen und kulturelle Gegensätze. Jetzt s…,https://derivates.kicker.de/image/upload/c_crop%2Cx_394%2Cy_799%2Cw_3154%2Ch_1774/w_1200%2Cq_auto/v1/2024/06/14/566e45ae-0414-4f30-a3cb-dda46ce2bc10.jpeg,2024-06-14T14:27:27Z,,Die Weltmeisterschaft 2018 fand in Russland statt. Das paneuropäische Turnier 2021 wurde von der Corona-Pandemie überschattet. Die Winter-WM 2022 in Katar stand im Zeichen politischer Debatten über M… [+3246 chars],,de,'Winter'
https://www.faz.net/aktuell/politik/ukraine/russlands-vorschlag-fuer-die-ukraine-darauf-zielt-wladimir-putin-ab-19789805.html,https://www.faz.net/aktuell/politik/ukraine/russlands-vorschlag-fuer-die-ukraine-darauf-zielt-wladimir-putin-ab-19789805.html,0,www.faz.net,Kommentar zum Ukrainekrieg: Wahlhelfer Putin,"Die Bedingungen, die der russische Präsident jetzt für ein Ende des Krieges genannt hat, muss man nicht ernst nehmen. Sie zielen auf etwas anderes ab.",https://media0.faz.net/ppmedia/aktuell/1395228993/1.9789800/facebook_teaser/der-russische-praesident.jpg,2024-06-14T15:26:45Z,,"Und es soll von einem NATO-Beitritt absehen, was langfristig noch schwerer wiegen würde: Die Ukraine wird ohne westlichen Beistand nicht sicher sein vor dem imperialistischen Aggressorstaat, zu dem P… [+1017 chars]",,de,'Putin'
https://www.faz.net/aktuell/politik/ausland/russlands-illegale-oelexporte-anrainer-wollen-ostsee-besser-schuetzen-19789845.html,https://www.faz.net/aktuell/politik/ausland/russlands-illegale-oelexporte-anrainer-wollen-ostsee-besser-schuetzen-19789845.html,0,www.faz.net,Russlands „Schattenflotte“: Ostseerat will illegalen Ölexport stärker bekämpfen,"Russland nutzt alte Tanker, um illegal Öl zu exportieren. Die Ostseeanrainer fürchten eine Umweltkatastrophe und wollen nun dagegen vorgehen.",https://media1.faz.net/ppmedia/aktuell/politik/3719389393/1.9789841/facebook_teaser/annalena-baerbock-und-elina.jpg,2024-06-14T16:05:45Z,,"Russlands Schattenflotte sei eine Bedrohung nicht nur für die europäische Sicherheit, sondern auch für die fragile Umwelt der Ostsee, sagte Valtonen. Russland umgehe damit sehr effektiv den Ölpreisde… [+1430 chars]",,de,'Öl'
https://www.faz.net/aktuell/politik/ukraine/ukraine-krieg-putin-will-dass-die-ukraine-blockfrei-und-entnazifiziert-wird-19788674.html,https://www.faz.net/aktuell/politik/ukraine/ukraine-krieg-putin-will-dass-die-ukraine-blockfrei-und-entnazifiziert-wird-19788674.html,0,www.faz.net,"Putin will, dass die Ukraine blockfrei und „entnazifiziert“ wird","In einem Treffen mit der Leitung seines Außenministeriums bekräftigt der russische Präsident die Kriegsziele, die er 2022 ausgegeben hat. Seine Rede zielt auf den G-7-Gipfel und die Friedenskonferenz in der Schweiz.",https://media0.faz.net/ppmedia/aktuell/politik/ukraine/1169688524/1.9788696/facebook_teaser/wladimir-putin-am-freitag-in.jpg,2024-06-14T16:08:47Z,,Zu Putins Forderungen zählt auch eine Anerkennung der 2014 und 2022 völkerrechtswidrig von Russland annektierten Gebiete der Ukraine sowie ein Abzug der ukrainischen Truppen aus den Teilen dieser Geb… [+2604 chars],,de,'Putin'
https://www.zeit.de/politik/ausland/2024-06/nahost-israel-libanon-hisbollah-netanjahu-krieg,https://www.zeit.de/politik/ausland/2024-06/nahost-israel-libanon-hisbollah-netanjahu-krieg,0,www.zeit.de,Nahost: Provozieren bis zum Krieg,"Die Lage zwischen Israel und der Hisbollah gerät außer Kontrolle. Noch zögert Netanjahu, aber ein Krieg gegen den Libanon könnte nicht mehr zu verhindern sein.",https://img.zeit.de/politik/ausland/2024-06/nahost-israel-libanon-hisbollah-benjamin-netanjahu-krieg/wide__1300x731,2024-06-14T17:53:07Z,,Nach acht Monaten konstantem Beschuss droht die Lage an der Grenze zwischen Israel und dem Libanon außer Kontrolle zu geraten. Mitte der Woche tötete Israels Armee bei einem gezielten Angriff Taleb A… [+834 chars],,de,'Krieg'
https://www.zeit.de/news/2024-06/14/fc-bayern-gewinnt-meistertitel-in-basketball-bundesliga,https://www.zeit.de/news/2024-06/14/fc-bayern-gewinnt-meistertitel-in-basketball-bundesliga,0,www.zeit.de,BBL-Finale: FC Bayern gewinnt Meistertitel in Basketball-Bundesliga,Hier finden Sie Informationen zu dem Thema „BBL-Finale“. Lesen Sie jetzt „Bayern krönt Basketball-Saison - Meister nach Sieg bei Alba“.,https://img.zeit.de/news/2024-06/14/fc-bayern-gewinnt-meistertitel-in-basketball-bundesliga-image-group/wide__1300x731,2024-06-14T18:07:48Z,,Der FC Bayern München hat seinen sechsten Meistertitel in der Basketball-Bundesliga perfekt gemacht. Das Team von Trainer Pablo Laso gewann das vierte Finale bei Dauerrivale Alba Berlin mit 88:82 (44… [+1668 chars],,de,'Bayern'
