index,url,valid,domain,title,description,image,published,archive,content,quote,language,keyword
https://www.focus.de/finanzen/boerse/rene_will_rendite/die-rene-will-rendite-kolumne-jetzt-wird-es-richtig-schwer-die-inflation-tritt-in-eine-neue-phase_id_187219796.html,https://www.focus.de/finanzen/boerse/rene_will_rendite/die-rene-will-rendite-kolumne-jetzt-wird-es-richtig-schwer-die-inflation-tritt-in-eine-neue-phase_id_187219796.html,0,www.focus.de,Die „René will Rendite“-Kolumne - Jetzt wird es richtig schwer: Die Inflation tritt in eine neue Phase,"Eigentlich schien die Inflation auf einem guten Weg nach unten. Die Raten fielen. Doch nun stagnieren die Inflationsraten und die Gefahr wächst, dass die EZB den Bogen überspannt.",https://p6.focus.de/img/fotos/id_187221064/ezb-kopie.jpg?im=Crop%3D%280%2C11%2C1280%2C640%29%3BResize%3D%281200%2C627%29&impolicy=perceptual&quality=medium&hash=46abdb06218cd6bf99a4b4307b221431772ae70f5998abe4fec787e07800f8e0,2023-03-02T11:10:55Z,https://web.archive.org/web/20230302132302/https://www.focus.de/finanzen/boerse/rene_will_rendite/die-rene-will-rendite-kolumne-jetzt-wird-es-richtig-schwer-die-inflation-tritt-in-eine-neue-phase_id_187219796.html,"<ul><li>
Kommentare</li><li>
E-Mail</li><li>
Teilen</li><li>
Mehr</li><li>
Twitter</li><li>
Drucken</li><li>
Feedback</li><li>
Fehler meldenSie haben einen Fehler gefunden?
Bitte markieren S… [+4443 chars]",,de,'Inflation'
https://www.diepresse.com/6258046/inflation-im-euroraum-bleibt-bei-85-prozent-ueberraschend-hoch,https://www.diepresse.com/6258046/inflation-im-euroraum-bleibt-bei-85-prozent-ueberraschend-hoch,0,www.diepresse.com,"Inflation im Euroraum bleibt bei 8,5 Prozent überraschend hoch",Hohe Energiepreise befeuerten Teuerung im Euroraum im Februar weiter.,https://media.diepresse.com/social_diepresse_nachrichten/images/uploads_1200/d/7/e/6258046/BELGIUM-EU-POLITICS_1677757365239960_v0_h.jpg,2023-03-02T11:43:00Z,,"Hohe Energiepreise befeuerten Teuerung im Euroraum im Februar weiter.
Die Inflation in der Eurozone erweist sich als überraschend hartnäckig. Im Februar kletterten die Verbraucherpreise binnen Jahre… [+1607 chars]",,de,'Energiepreise'
https://www.focus.de/finanzen/verbot-von-oel-und-gaskesseln-wenn-berlin-den-grossen-heizungstausch-will-muss-es-seine-hausaufgaben-machen_id_187159314.html,https://www.focus.de/finanzen/verbot-von-oel-und-gaskesseln-wenn-berlin-den-grossen-heizungstausch-will-muss-es-seine-hausaufgaben-machen_id_187159314.html,0,www.focus.de,"Verbot von Öl- und Gaskesseln - Wenn Berlin den großen Heizungstausch will, muss es seine Hausaufgaben machen","Öl- und Gasheizungen sollen moderneren Technologien weichen. Der Plan von Wirtschaftsminister Robert Habeck: Fernwärme, Wärmepumpen und Co. stärken, CO2-Emissionen im Gebäudesektor senken. Doch wie grün sind eigentlich Fernwärme und Wärmepumpenstrom in Deutsc…",https://p6.focus.de/img/fotos/id_187217320/heizkraftwerk-lichterfelde-75314465.jpg?im=Crop%3D%280%2C152%2C3478%2C1741%29%3BResize%3D%281200%2C627%29&impolicy=perceptual&quality=medium&hash=4e05dadbc4f929f5a21b47696cc320026378063ae022a731cb0f04a9ba0b2aa2,2023-03-02T11:52:26Z,,"<ul><li>
Kommentare</li><li>
E-Mail</li><li>
Teilen</li><li>
Mehr</li><li>
Twitter</li><li>
Drucken</li><li>
Feedback</li><li>
Fehler meldenSie haben einen Fehler gefunden?
Bitte markieren S… [+8194 chars]",,de,'fossile Energie'
https://www.zeit.de/news/2023-03/02/putin-beruft-nationalen-sicherheitsrat-ein,https://www.zeit.de/news/2023-03/02/putin-beruft-nationalen-sicherheitsrat-ein,0,www.zeit.de,Russland: Putin beruft nationalen Sicherheitsrat ein,,,2023-03-02T12:09:06Z,https://web.archive.org/web/20230302123531/https://www.zeit.de/news/2023-03/02/putin-beruft-nationalen-sicherheitsrat-ein,"When browsing with ads:
We collect personal data and also transmit it to third-party providers
 that help us improve and finance our digital content. Some of the information stored on your device, … [+732 chars]",,de,'Putin'
https://www.brigitte.de/aktuell/gesellschaft/heizkosten--mit-diesen-tricks-kannst-du-viel-geld-sparen-13487734.html,https://www.brigitte.de/aktuell/gesellschaft/heizkosten--mit-diesen-tricks-kannst-du-viel-geld-sparen-13487734.html,0,www.brigitte.de,Stromsparen: Diese Fehler beim Heizen kosten dich bares Geld,"In Zeiten der Energiekrise ist es besonders wichtig, den eigenen Stromverbrauch zu reduzieren. Durch einfache Tricks kann der eigene Geldbeutel geschont werden. Im Video erfährst du, wozu der Experte rät.",https://image.brigitte.de/13487732/t/R3/v3/w1440/r1.7778/-/adobestock-334474143.jpg,2023-03-02T12:11:00Z,https://web.archive.org/web/20230302134851/https://www.brigitte.de/aktuell/gesellschaft/heizkosten--mit-diesen-tricks-kannst-du-viel-geld-sparen-13487734.html,"Stopp! Du bist noch nicht angemeldet
Registriere dich jetzt einmalig bei BRIGITTE und erhalte vollen Zugriff auf Exklusiv-Inhalte, wie Videos und Artikel sowie praktische Features.
Bereits registri… [+18 chars]",,de,'Heizen'
https://www.n-tv.de/wirtschaft/Deutsche-Gasspeicherstaende-sinken-weiterhin-leicht-article23955933.html,https://www.n-tv.de/wirtschaft/Deutsche-Gasspeicherstaende-sinken-weiterhin-leicht-article23955933.html,0,www.n-tv.de,"Kühles Wetter, höherer Verbrauch: Deutsche Gasspeicherstände sinken weiterhin leicht","Draußen wird's kühler, drinnen wird mehr geheizt: Aktuell steigt der Gasverbrauch in Deutschland leicht. Das wirkt sich auf die Speicherstände aus. Derzeit liegen sie insgesamt bei 69,5 Prozent, knapp 0,6 Prozentpunkte unter dem Vortagsniveau. Grund zur Sorge…",https://bilder1.n-tv.de/img/incoming/crop23955932/1191321358-cImg_16_9-w1200/385652501.jpg,2023-03-02T12:29:06Z,https://web.archive.org/web/20230302123048/https://www.n-tv.de/wirtschaft/Deutsche-Gasspeicherstaende-sinken-weiterhin-leicht-article23955933.html,"Draußen wird's kühler, drinnen wird mehr geheizt: Aktuell steigt der Gasverbrauch in Deutschland leicht. Das wirkt sich auf die Speicherstände aus. Derzeit liegen sie insgesamt bei 69,5 Prozent, knap… [+1117 chars]",,de,'Gas'
https://www.bild.de/regional/saarland/saarland-news/mettlach-trotz-pandemie-und-inflation-keramik-boom-bei-villeroy-boch-83073550.bild.html,https://www.bild.de/regional/saarland/saarland-news/mettlach-trotz-pandemie-und-inflation-keramik-boom-bei-villeroy-boch-83073550.bild.html,0,www.bild.de,Trotz Pandemie und Inflation - Keramik-Boom bei Villeroy & Boch,Villeroy & Boch geht gestärkt aus der Pandemie hervor. Auch hohe Energiepreise und eine galoppierende Inflation bremsen offenbar nicht die Lust auf Keramik.,"https://images.bild.de/6400965191230b138e289b58/ffc07addd58a08abf2c5cd8c01b6c570,e29826b4?w=1280",2023-03-02T13:15:46Z,https://web.archive.org/web/20230302204048/https://www.bild.de/regional/saarland/saarland-news/mettlach-trotz-pandemie-und-inflation-keramik-boom-bei-villeroy-boch-83073550.bild.html,"Mettlach (Saarland) Der Keramikhersteller Villeroy &amp; Boch (V&amp;B) geht gestärkt aus der Pandemie hervor.
Auch hohe Energiepreise und eine galoppierende 
Inflation können die Nachfrage nach Ge… [+499 chars]",,de,'Energiepreise'
https://futurezone.at/science/windrad-voegel-gefahr-untersuchung-vattenfall-offshore-windpark-aberdeen/402348891,https://futurezone.at/science/windrad-voegel-gefahr-untersuchung-vattenfall-offshore-windpark-aberdeen/402348891,0,futurezone.at,Sind Windräder gefährlich für Vögel? Neue Studie enttäuscht Windkraft-Gegner,"Mittels Radarkameras wurden Flugbahnen bei einem Windpark überwacht. Bei über 10.000 Videos wurde analysiert, wie oft Vögel verletzt wurden.",https://image.futurezone.at/images/facebook/7680930/46-189284960.jpg,2023-03-02T13:19:15Z,https://web.archive.org/web/20230302170641/https://futurezone.at/science/windrad-voegel-gefahr-untersuchung-vattenfall-offshore-windpark-aberdeen/402348891,"02.03.2023
Mittels Radarkameras wurden Flugbahnen bei einem Windpark überwacht. Bei über 10.000 Videos wurde analysiert, wie oft Vögel verletzt wurden.",,de,'Windräder'
https://www.wiwo.de/technologie/digitale-welt/waermeenergie-in-gebaeuden-anhaenger-der-oelheizung-hoffen-auf-haertefallklausel/29012930.html,https://www.wiwo.de/technologie/digitale-welt/waermeenergie-in-gebaeuden-anhaenger-der-oelheizung-hoffen-auf-haertefallklausel/29012930.html,0,www.wiwo.de,Wärmeenergie in Gebäuden: Anhänger der Ölheizung hoffen auf Härtefallklausel,"Wer mit Öl heizt, hat lange von gesetzlichen Ausnahmen profitiert. Doch damit ist Schluss: Der Entwurf für die Neuregelung sieht keine Lücken mehr vor. Zumindest bleibt den Fans der Ölthermen ein bisschen Zeit.",https://www.wiwo.de/images/imago128053318/29013840/2-format11240.jpg,2023-03-02T13:29:18Z,https://web.archive.org/web/20230302155353/https://www.wiwo.de/technologie/digitale-welt/waermeenergie-in-gebaeuden-anhaenger-der-oelheizung-hoffen-auf-haertefallklausel/29012930.html,"Trifft mich das? Und wann?, diese Fragen müssen seit Dienstag viele Schornsteinfeger, Energieexperten und Heizungsbauer beantworten. Der Redebedarf bei Hauseigentümern ist groß, seitdem der Entwurf d… [+3565 chars]",,de,'Öl'
https://www.handelsblatt.com/unternehmen/energie/gasspeicher-in-deutschland-fuellstand-liegt-aktuell-bei-69-prozent/28819652.html,https://www.handelsblatt.com/unternehmen/energie/gasspeicher-in-deutschland-fuellstand-liegt-aktuell-bei-69-prozent/28819652.html,0,www.handelsblatt.com,Gasspeicher in Deutschland: Füllstand liegt aktuell bei 69 Prozent,Ein hoher Gasspeicher-Füllstand ist für Deutschlands Gasversorgung in der Energiekrise essenziell. Wie steht es aktuell um die Gasreserven? Ein Überblick.,https://www.handelsblatt.com/images/gasspeicher-in-sachsen-anhalt/28877480/2-format2003.jpg,2023-03-02T13:54:15Z,https://web.archive.org/web/20230302160938/https://www.handelsblatt.com/unternehmen/energie/gasspeicher-in-deutschland-fuellstand-liegt-aktuell-bei-69-prozent/28819652.html,"&gt;&gt;iOS&lt;&lt;&lt;/div&gt;
<ul><li>75 Prozent zum 1. September,</li><li>85 Prozent zum 1. Oktober,</li><li>95 Prozent zum 1. November,</li><li>40 Prozent zum 1. Februar.</li></ul>
Wie schätzt … [+6077 chars]",,de,'Gas'
https://hallespektrum.de/nachrichten/wirtschaft/ausbau-von-windkraft-sachsen-anhalt-ist-vorreiter/432601/,https://hallespektrum.de/nachrichten/wirtschaft/ausbau-von-windkraft-sachsen-anhalt-ist-vorreiter/432601/,0,hallespektrum.de,Ausbau von Windkraft: Sachsen-Anhalt ist Vorreiter,"Beim Ausbau der Windkraft in Sachsen-Anhalt haben drei Landkreise deutlich die Nase vorn. Die meisten Windräder drehen sich demnach aktuell im Landkreis Börde (424), gefolgt vom Salzlandkreis (380) und dem Landkreis Stendal (376). Gemessen an der installierte…",https://hallespektrum.de/wp-content/uploads/2020/02/Windräder-1-scaled.jpg,2023-03-02T14:00:56Z,https://web.archive.org/web/20230302142006/https://hallespektrum.de/nachrichten/wirtschaft/ausbau-von-windkraft-sachsen-anhalt-ist-vorreiter/432601/,"Beim Ausbau der Windkraft in Sachsen-Anhalt haben drei Landkreise deutlich die Nase vorn. Die meisten Windräder drehen sich demnach aktuell im Landkreis Börde (424), gefolgt vom Salzlandkreis (380) u… [+1637 chars]",,de,'Windräder'
https://www.bild.de/geld/wirtschaft/politik-inland/wegen-habecks-heiz-hammer-soll-ich-jetzt-noch-schnell-eine-oel-heizung-kaufen-83067466.bild.html,https://www.bild.de/geld/wirtschaft/politik-inland/wegen-habecks-heiz-hammer-soll-ich-jetzt-noch-schnell-eine-oel-heizung-kaufen-83067466.bild.html,0,www.bild.de,Wegen Habecks Heiz-Hammer - Soll ich jetzt noch eine Öl-Heizung kaufen?,Nach 2001 gebaute Öl- oder Gas-Heizungen dürften in Einfamilienhäusern nur bis 2034 stehen.Foto: picture alliance / pressefoto_ko,"https://images.bild.de/63ffb612ffdda32ca8f6b98e/2ac0451a823229cbb51724ee89400757,a8be84a0?w=1280",2023-03-02T14:02:22Z,https://web.archive.org/web/20230303002836/https://www.bild.de/geld/wirtschaft/politik-inland/wegen-habecks-heiz-hammer-soll-ich-jetzt-noch-schnell-eine-oel-heizung-kaufen-83067466.bild.html,"Nach 2001 gebaute Öl- oder Gas-Heizungen dürfen nach dem Habeck-Entwurf in Einfamilienhäusern nur bis 2034 und in Mehrfamilienhäusern trotz moderner Technik nur bis 2031 laufen.
Heißt: Auch neu inst… [+1054 chars]",,de,'Energiepreise'
https://www.prnewswire.com/news-releases/global-digital-power-forum-2023-unterstutzung-des-betreibererfolgs-auf-dem-globalen-weg-hin-zur-klimaneutralitat-301760926.html,https://www.prnewswire.com/news-releases/global-digital-power-forum-2023-unterstutzung-des-betreibererfolgs-auf-dem-globalen-weg-hin-zur-klimaneutralitat-301760926.html,0,www.prnewswire.com,Global Digital Power Forum 2023: Unterstützung des Betreibererfolgs auf dem globalen Weg hin zur Klimaneutralität,"BARCELONA, Spanien, 2. März 2023 /PRNewswire/ -- Huawei war Gastgeber des Global Digital Power Forums beim Mobile World Congress (MWC) 2023. Das Forum stand unter dem Motto „Unterstützung des Betreibererfolgs auf dem globalen Weg hin zur Klimaneutralität"". Be…",https://mma.prnewswire.com/media/2012705/mmexport1677597449372.jpg?p=facebook,2023-03-02T14:03:00Z,https://web.archive.org/web/20230302142106/https://www.prnewswire.com/news-releases/global-digital-power-forum-2023-unterstutzung-des-betreibererfolgs-auf-dem-globalen-weg-hin-zur-klimaneutralitat-301760926.html,"BARCELONA, Spanien, 2. März 2023 /PRNewswire/ -- Huawei war Gastgeber des Global Digital Power Forums beim Mobile World Congress (MWC) 2023. Das Forum stand unter dem Motto Unterstützung des Betreibe… [+6577 chars]",,de,'Energiepreise'
https://www.n-tv.de/politik/Angst-vor-Chlorhuehnern-ist-schuld-am-gruenen-Subventionshammer-der-USA-sagt-Peter-Liese-im-Klima-Labor-article23955185.html,https://www.n-tv.de/politik/Angst-vor-Chlorhuehnern-ist-schuld-am-gruenen-Subventionshammer-der-USA-sagt-Peter-Liese-im-Klima-Labor-article23955185.html,0,www.n-tv.de,"Grüner Subventionshammer der USA: ""Angst vor Chlorhühnern war ein großer Fehler""","Der Inflation Reduction Act ist ein gigantisches Klimaschutzpaket, das Europa viele Arbeitsplätze kosten könnte. Ein Problem, das man hätte verhindern können, sagt der Europaabgeordnete Peter Liese im ""Klima-Labor"" von ntv. Dennoch sieht der Politiker die EU …",https://bilder1.n-tv.de/img/incoming/crop23955176/8901326832-cImg_16_9-w1200/2022-08-12T172916Z-1407964031-RC24VV9LCKCV-RTRMADP-3-USA-CONGRESS-INFLATION.jpg,2023-03-02T14:11:40Z,https://web.archive.org/web/20230302195114/https://www.n-tv.de/politik/Angst-vor-Chlorhuehnern-ist-schuld-am-gruenen-Subventionshammer-der-USA-sagt-Peter-Liese-im-Klima-Labor-article23955185.html,"Der Inflation Reduction Act (IRA) ist ein gigantisches Klimaschutzpaket, das viele Arbeitsplätze kosten könnte. Denn die US-Regierung lockt mit Subventionen von beinahe 400 Milliarden Dollar für grün… [+12414 chars]",,de,'Inflation'
https://www.focus.de/immobilien/wohnen/energieverbrauch/30-000-euro-und-mehr-aus-fuer-oel-und-gas-was-sie-der-umbau-ihrer-heizung-kostet_id_187248352.html,https://www.focus.de/immobilien/wohnen/energieverbrauch/30-000-euro-und-mehr-aus-fuer-oel-und-gas-was-sie-der-umbau-ihrer-heizung-kostet_id_187248352.html,0,www.focus.de,30.000 Euro und mehr - Aus für Öl und Gas - was Sie der Umbau Ihrer Heizung kostet,"Bundeswirtschaftsminister Robert Habeck plant ein Verbot für Öl- und Gasheizungen - vorerst ab 2024. Stattdessen sollen Haushalte auf Wärmepumpen, Fernwärme, Erdwärme und Biomasse umsteigen. FOCUS online hat sich Kostenvoranschläge eingeholt und sagt, was die…",https://p6.focus.de/img/regional/berlin/id_183306235/eine-frau-dreht-am-thermostat-einer-heizung..jpg?im=Crop%3D%280%2C170%2C2048%2C1024%29%3BResize%3D%281200%2C627%29&impolicy=perceptual&quality=medium&hash=58224cd19194aed0ebe68870f8ead669962d02aee841faa3502fbca6e9b0748f,2023-03-02T15:00:56Z,https://web.archive.org/web/20230302170718/https://www.focus.de/immobilien/wohnen/energieverbrauch/30-000-euro-und-mehr-aus-fuer-oel-und-gas-was-sie-der-umbau-ihrer-heizung-kostet_id_187248352.html,"Bundeswirtschaftsminister Robert Habeck plant ein Verbot für Öl- und Gasheizungen - vorerst ab 2024. Stattdessen sollen Haushalte auf Wärmepumpen, Fernwärme, Erdwärme und Biomasse umsteigen. FOCUS on… [+7186 chars]",,de,'Gas'
https://www.stern.de/news/bmwk-betont-technologieoffenheit-bei-umstieg-auf-erneuerbares-heizen-33246040.html,https://www.stern.de/news/bmwk-betont-technologieoffenheit-bei-umstieg-auf-erneuerbares-heizen-33246040.html,0,www.stern.de,BMWK betont Technologieoffenheit bei Umstieg auf Erneuerbares Heizen,"Im Streit über den Umstieg auf klimafreundliche Heizungen in Gebäuden hat das Bundeswirtschaftsministerium (BMWK) auf die Möglichkeit der Technologieoffenheit sowie auf geplante Ausnahmen verwiesen. In bestehenden Gebäuden könnten auch weiterhin ""Gasheizungen…",https://image.stern.de/33246042/t/36/v1/w1440/r1.7778/-/02--thermostat-einer-heizung---7f6236414ccc5f58.jpg,2023-03-02T15:02:49Z,https://web.archive.org/web/20230302152217/https://www.stern.de/news/bmwk-betont-technologieoffenheit-bei-umstieg-auf-erneuerbares-heizen-33246040.html,Im Streit über den Umstieg auf klimafreundliche Heizungen in Gebäuden hat das Bundeswirtschaftsministerium (BMWK) auf die Möglichkeit der Technologieoffenheit sowie auf geplante Ausnahmen verwiesen. … [+2615 chars],,de,'Heizen'
https://www.sueddeutsche.de/sport/langlauf-nordische-ski-wm-silber-staffel-1.5761622,https://www.sueddeutsche.de/sport/langlauf-nordische-ski-wm-silber-staffel-1.5761622,0,www.sueddeutsche.de,Ski-Nordisch-WM: Die Zukunft ist silbern,"Die Staffel der Langläuferinnen erobert sich in Planica erstmals seit zwölf Jahren wieder eine WM-Medaille. Damit beweist das Quartett, dass der Olympia-Erfolg von Peking kein einmaliges deutsches Wintermärchen war.",https://www.sueddeutsche.de/image/sz.1.5761623/1200x675?v=1677772115,2023-03-02T15:39:40Z,https://web.archive.org/web/20230302160445/https://www.sueddeutsche.de/sport/langlauf-nordische-ski-wm-silber-staffel-1.5761622,"Die Staffel der Langläuferinnen erobert sich in Planica erstmals seit zwölf Jahren wieder eine WM-Medaille. Damit beweist das Quartett, dass der Olympia-Erfolg von Peking kein einmaliges deutsches Wi… [+5077 chars]",,de,'Energie sparen'
https://www.zeit.de/news/2023-03/02/heizen-mit-mehr-wind-und-sonne,https://www.zeit.de/news/2023-03/02/heizen-mit-mehr-wind-und-sonne,0,www.zeit.de,Energie: Heizen mit mehr Wind und Sonne,,,2023-03-02T15:44:47Z,https://web.archive.org/web/20230302160903/https://www.zeit.de/news/2023-03/02/heizen-mit-mehr-wind-und-sonne,"When browsing with ads:
We collect personal data and also transmit it to third-party providers
 that help us improve and finance our digital content. Some of the information stored on your device, … [+732 chars]",,de,'Heizen'
https://www.morgenpost.de/wirtschaft/article237795013/Heizen-mit-mehr-Wind-und-Sonne.html,https://www.morgenpost.de/wirtschaft/article237795013/Heizen-mit-mehr-Wind-und-Sonne.html,0,www.morgenpost.de,Energie: Heizen mit mehr Wind und Sonne,Die Heizung zu Hause soll künftig zum Großteil mit erneuerbarer Energie laufen - das hat die Ampel kurz nach der Wahl verabredet. Nun werden mehr Einzelheiten bekannt. Die sind aber noch hochumstritten.,https://img.morgenpost.de/img/wirtschaft/crop237795011/7632603548-w820-cv16_9-q85/Heizung.jpg,2023-03-02T15:44:47Z,https://web.archive.org/web/20230302170850/https://www.morgenpost.de/wirtschaft/article237795013/Heizen-mit-mehr-Wind-und-Sonne.html,"Berlin. Unter Protest der FDP treibt Bundeswirtschaftsminister Robert Habeck (Grüne) seine Pläne für den Heizungswechsel voran. Wenn die alte Gasheizung noch funktioniert, kann sie drin bleiben. Wenn… [+6246 chars]",,de,'Heizen'
https://www.stern.de/wirtschaft/news/energie--heizen-mit-mehr-wind-und-sonne-33246776.html,https://www.stern.de/wirtschaft/news/energie--heizen-mit-mehr-wind-und-sonne-33246776.html,0,www.stern.de,Energie: Heizen mit mehr Wind und Sonne,Die Heizung zu Hause soll künftig zum Großteil mit erneuerbarer Energie laufen - das hat die Ampel kurz nach der Wahl verabredet. Nun werden mehr Einzelheiten bekannt. Die sind aber noch hochumstritten.,https://image.stern.de/33246778/t/ET/v1/w1440/r1.7778/-/02--urnnewsmldpacom2009010123030299804264v3w800h600l903t310r1827b1281jpeg---094e7c46bcccd699.jpg,2023-03-02T15:44:47Z,https://web.archive.org/web/20230302223528/https://www.stern.de/wirtschaft/news/energie--heizen-mit-mehr-wind-und-sonne-33246776.html,Die Heizung zu Hause soll künftig zum Großteil mit erneuerbarer Energie laufen - das hat die Ampel kurz nach der Wahl verabredet. Nun werden mehr Einzelheiten bekannt. Die sind aber noch hochumstritt… [+6470 chars],,de,'Heizen'
https://www.faz.net/aktuell/politik/ausland/wladimir-putin-spricht-von-ukrainischem-terroranschlag-in-russland-18717426.html,https://www.faz.net/aktuell/politik/ausland/wladimir-putin-spricht-von-ukrainischem-terroranschlag-in-russland-18717426.html,0,www.faz.net,Putin spricht von ukrainischem „Terroranschlag“ in Russland,Laut russischer Darstellung haben Ukrainer in einem Dorf im Südwesten Russlands das Feuer eröffnet. Kiew dementiert das und verweist auf das Telegram-Video einer Gruppe russischer Regimegegner.,https://media0.faz.net/ppmedia/aktuell/politik/52412272/1.8717428/facebook_teaser/der-russische-praesident.jpg,2023-03-02T16:33:23Z,https://web.archive.org/web/20230302181950/https://www.faz.net/aktuell/politik/ausland/wladimir-putin-spricht-von-ukrainischem-terroranschlag-in-russland-18717426.html,"Russlands Präsident Wladimir Putin hat am Donnerstag behauptet, ukrainische Kämpfer seien auf russisches Gebiet vorgedrungen und hätten dort einen Terroranschlag verübt. Mit den angeblichen Vorfällen… [+1896 chars]",,de,'Putin'
https://www.n-tv.de/politik/Habeck-treibt-Gesetz-zu-fossilen-Heizungen-voran-article23957346.html,https://www.n-tv.de/politik/Habeck-treibt-Gesetz-zu-fossilen-Heizungen-voran-article23957346.html,0,www.n-tv.de,Trotz heftiger FDP-Gegenrede: Habeck treibt Aus für fossile Heizungen voran,Von lauten Veto-Rufen aus der FDP lässt sich Wirtschaftsminister Habeck nicht aufhalten: Der Gesetzentwurf für das Aus von Öl- und Gasheizungen ist demnach fertig und mit dem Bauministerium abgestimmt. Das dürfte Finanzminister Lindner gar nicht gefallen.,https://bilder2.n-tv.de/img/incoming/crop23957353/7861321383-cImg_16_9-w1200/397739683.jpg,2023-03-02T16:34:24Z,https://web.archive.org/web/20230303063640/https://www.n-tv.de/politik/Habeck-treibt-Gesetz-zu-fossilen-Heizungen-voran-article23957346.html,Von lauten Veto-Rufen aus der FDP lässt sich Wirtschaftsminister Habeck nicht aufhalten: Der Gesetzentwurf für das Aus von Öl- und Gasheizungen ist demnach fertig und mit dem Bauministerium abgestimm… [+3757 chars],,de,'Öl'
https://www.focus.de/politik/deutschland/christoph-blepp-im-interview-mich-besorgt-das-starke-eingreifen-des-staates-in-form-von-verboten_id_187256665.html,https://www.focus.de/politik/deutschland/christoph-blepp-im-interview-mich-besorgt-das-starke-eingreifen-des-staates-in-form-von-verboten_id_187256665.html,0,www.focus.de,Christoph Blepp im Interview - „Mich besorgt das starke Eingreifen des Staates in Form von Verboten“,"Christoph Blepp ist einer der Tob-Berater in der Baubranche. Über die Auswirkungen des gaplanten Gasheizungsverbots und dessen Auswirklungen auf Kunden, Handwerker und Hersteller hat er seine ganz eigene Meinung.Von Autor Oliver Stock (WirtschaftsKurier)",https://p6.focus.de/img/fotos/id_187256958/cb-sb-strategy.jpg?im=Crop%3D%280%2C217%2C2477%2C1238%29%3BResize%3D%281200%2C627%29&hash=a21d634e0b6d076e01f0c885ab704409d07ca0e72f026013a8b09fe4efe630fb,2023-03-02T17:18:04Z,https://web.archive.org/web/20230302192200/https://www.focus.de/politik/deutschland/christoph-blepp-im-interview-mich-besorgt-das-starke-eingreifen-des-staates-in-form-von-verboten_id_187256665.html,"Christoph Blepp ist einer der Tob-Berater in der Baubranche. Über die Auswirkungen des gaplanten Gasheizungsverbots und dessen Auswirklungen auf Kunden, Handwerker und Hersteller hat er seine ganz ei… [+7786 chars]",,de,'Gas'
https://orf.at/stories/3307347/,https://orf.at/stories/3307347/,0,orf.at,Gasverbrauch in Deutschland gesunken,,https://orf.at/mojo/1_4_1/storyserver//news/common/images/og-fallback-news.png,2023-03-02T17:56:56Z,https://web.archive.org/web/20230302192244/https://orf.at/stories/3307347/,"Deutschland spart weiter Gas. In der vergangenen Woche lag der Gasverbrauch 18,2 Prozent unter dem durchschnittlichen Verbrauch der Jahre 2018 bis 2021, wie die Bundesnetzagentur heute berichtete. Da… [+826 chars]",,de,'Gas'
https://www.faz.net/aktuell/wirtschaft/mehr-foerdermittel-fuer-den-heizungstausch-18718163.html,https://www.faz.net/aktuell/wirtschaft/mehr-foerdermittel-fuer-den-heizungstausch-18718163.html,0,www.faz.net,Umstrittenes Gesetz: Mehr Fördermittel für den Heizungstausch,Das von Robert Habeck geführte Wirtschaftsministerium stellt einkommensabhängige Hilfe bei dem geplanten Verbot neuer Öl- und Gasheizungen in Aussicht. Finanzminister Christian Lindner fordert derweil ein komplett neues Konzept.,https://media0.faz.net/ppmedia/aktuell/3369831748/1.8719320/facebook_teaser/christian-lindner-und-robert.jpg,2023-03-02T20:17:16Z,https://web.archive.org/web/20230302202223/https://www.faz.net/aktuell/wirtschaft/mehr-foerdermittel-fuer-den-heizungstausch-18718163.html,"Nach der Aufregung über das geplante Verbot neuer Öl- und Gasheizungen bemüht sich das Wirtschaftsministerium um Schadensbegrenzung. In einem am Donnerstag veröffentlichten Papier heißt es, der Umsti… [+2662 chars]",,de,'Gas'
