index,url,valid,domain,title,description,image,published,archive,content,quote,language,keyword
https://www.tagesschau.de/wirtschaft/verbraucher/energiepreisbremse-in-kraft-103.html,https://www.tagesschau.de/wirtschaft/verbraucher/energiepreisbremse-in-kraft-103.html,0,www.tagesschau.de,Strom- und Gaspreisbremse in Kraft getreten,Von heute an gilt für Haushalte und Firmen die Strom- und die Gaspreisbremse. Die Entlastung soll auch rückwirkend für die Abrechnungsmonate Januar und Februar greifen. Wie funktioniert das? Was ist zu beachten? <em>Von Martin Polansky.</em>,https://www.tagesschau.de/multimedia/bilder/stromzaehler-117~_v-original.jpg,2023-03-01T07:00:34Z,https://web.archive.org/web/20230301082523/https://www.tagesschau.de/wirtschaft/verbraucher/energiepreisbremse-in-kraft-103.html,Von heute an gilt für Haushalte und Firmen die Strom- und die Gaspreisbremse. Die Entlastung soll auch rückwirkend für die Abrechnungsmonate Januar und Februar greifen. Wie funktioniert das? Was ist … [+2178 chars],,de,'Energiepreise'
https://www.focus.de/finanzen/gastbeitrag-von-gabor-steingart-politik-redet-inflation-klein-und-beluegt-damit-bewusst-uns-alle_id_187126808.html,https://www.focus.de/finanzen/gastbeitrag-von-gabor-steingart-politik-redet-inflation-klein-und-beluegt-damit-bewusst-uns-alle_id_187126808.html,0,www.focus.de,Gastbeitrag von Gabor Steingart - Politiker reden Inflation klein - und belügen damit bewusst uns alle,"Die Inflationsprognosen waren vor dem Einsetzen der zweistelligen Preissteigerung falsch – und sind es jetzt wieder. Dieselben Menschen, namentlich der Wirtschaftsminister, der Kanzler und die EZB-Präsidentin, die vorher angeblich nichts sahen und nichts spür…",https://p6.focus.de/img/fotos/id_187125870/steingart.jpg?im=Crop%3D%280%2C15%2C595%2C297%29%3BResize%3D%281200%2C627%29&impolicy=perceptual&quality=medium&hash=9285612e30bbab9cc1de6c66f29491c391751a56437edba24fc34e6ea4b516e6,2023-03-01T07:21:23Z,https://web.archive.org/web/20230301073324/https://www.focus.de/finanzen/gastbeitrag-von-gabor-steingart-politik-redet-inflation-klein-und-beluegt-damit-bewusst-uns-alle_id_187126808.html,"<ul><li>
Kommentare</li><li>
E-Mail</li><li>
Teilen</li><li>
Mehr</li><li>
Twitter</li><li>
Drucken</li><li>
Feedback</li><li>
Fehler meldenSie haben einen Fehler gefunden?
Bitte markieren S… [+6253 chars]",,de,'Gas'
https://www.zeit.de/wirtschaft/2023-03/realloehne-inflation-statistisches-bundesamt,https://www.zeit.de/wirtschaft/2023-03/realloehne-inflation-statistisches-bundesamt,0,www.zeit.de,Inflation: Reallöhne das dritte Jahr in Folge gesunken,"Die Bruttolöhne in Deutschland sind 2022 zwar ungewöhnlich stark gestiegen. Durch die hohe Inflation verdienten die Arbeitnehmer aber 3,1 Prozent weniger als im Vorjahr.",,2023-03-01T08:05:34Z,https://web.archive.org/web/20230301082701/https://www.zeit.de/wirtschaft/2023-03/realloehne-inflation-statistisches-bundesamt,"When browsing with ads:
We collect personal data and also transmit it to third-party providers
 that help us improve and finance our digital content. Some of the information stored on your device, … [+732 chars]",,de,'Inflation'
https://stadt-bremerhaven.de/anker-everfrost-kuehlbox-mit-austauschbarem-akku-vorgestellt/,https://stadt-bremerhaven.de/anker-everfrost-kuehlbox-mit-austauschbarem-akku-vorgestellt/,0,stadt-bremerhaven.de,Anker EverFrost: Kühlbox mit austauschbarem Akku vorgestellt,"Powerstationen mit oder ohne Solaranbindung kennen viele, seit dem letzten Jahr sind die Geräte in aller Munde und das sicher nicht zuletzt durch die steigenden Energiepreise. Hersteller sind unter anderem Jackery, EcoFlow und neuerdings auch Anker. Mit dem n…",https://stadt-bremerhaven.de/wp-content/uploads/2023/02/Anker_EverFrost.jpg,2023-03-01T08:30:07Z,https://web.archive.org/web/20230302212314/https://stadt-bremerhaven.de/anker-everfrost-kuehlbox-mit-austauschbarem-akku-vorgestellt/,"Powerstationen mit oder ohne Solaranbindung kennen viele, seit dem letzten Jahr sind die Geräte in aller Munde und das sicher nicht zuletzt durch die steigenden Energiepreise. Hersteller sind unter a… [+2209 chars]",,de,'Energiepreise'
https://www.zeit.de/news/2023-03/01/inflation-in-bayern-im-februar-bei-8-8-prozent,https://www.zeit.de/news/2023-03/01/inflation-in-bayern-im-februar-bei-8-8-prozent,0,www.zeit.de,"Verbraucher: Inflation in Bayern im Februar bei 8,8 Prozent",,,2023-03-01T09:11:00Z,https://web.archive.org/web/20230301093819/https://www.zeit.de/news/2023-03/01/inflation-in-bayern-im-februar-bei-8-8-prozent,"When browsing with ads:
We collect personal data and also transmit it to third-party providers
 that help us improve and finance our digital content. Some of the information stored on your device, … [+732 chars]",,de,'Bayern'
https://www.zeit.de/news/2023-03/01/inflation-in-sachsen-weiter-auf-hohem-niveau,https://www.zeit.de/news/2023-03/01/inflation-in-sachsen-weiter-auf-hohem-niveau,0,www.zeit.de,Verbraucher: Inflation in Sachsen weiter auf hohem Niveau,,,2023-03-01T10:29:58Z,https://web.archive.org/web/20230301105307/https://www.zeit.de/news/2023-03/01/inflation-in-sachsen-weiter-auf-hohem-niveau,"When browsing with ads:
We collect personal data and also transmit it to third-party providers
 that help us improve and finance our digital content. Some of the information stored on your device, … [+732 chars]",,de,'Inflation'
https://www.focus.de/klima/experten/gastbeitrag-von-ulf-oesterlin-wenn-deutschland-die-wasserstoff-revolution-will-muss-es-fuenf-probleme-loesen_id_187138696.html,https://www.focus.de/klima/experten/gastbeitrag-von-ulf-oesterlin-wenn-deutschland-die-wasserstoff-revolution-will-muss-es-fuenf-probleme-loesen_id_187138696.html,0,www.focus.de,"Gastbeitrag von Ulf Oesterlin - Wenn Deutschland die Wasserstoff-Revolution will, muss es fünf Probleme lösen","Grüner Wasserstoff ist Kernbestandteil der Dekarbonisierung unserer Wirtschaft. Dementsprechend ambitioniert sind politische Zielsetzungen. Hehre Ziele allein sind jedoch nicht genug, um den Aufbau der Wasserstoffwirtschaft voranzutreiben. Bei der Umsetzung g…",https://p6.focus.de/img/fotos/id_187141003/gettyimages-1231370521.jpg?im=Crop%3D%280%2C577%2C3464%2C1732%29%3BResize%3D%281200%2C627%29&hash=5bce94e263789c1cdfc01a152fb122bb15f49399112979489ce1f20e740339f2,2023-03-01T10:37:57Z,https://web.archive.org/web/20230301123654/https://www.focus.de/klima/experten/gastbeitrag-von-ulf-oesterlin-wenn-deutschland-die-wasserstoff-revolution-will-muss-es-fuenf-probleme-loesen_id_187138696.html,"<ul><li>
Kommentare</li><li>
E-Mail</li><li>
Teilen</li><li>
Mehr</li><li>
Twitter</li><li>
Drucken</li><li>
Feedback</li><li>
Fehler meldenSie haben einen Fehler gefunden?
Bitte markieren S… [+8910 chars]",,de,'Fossile Energie'
https://www.n-tv.de/mediathek/videos/panorama/15-Meter-Loch-klafft-in-Strasse-von-Palma-de-Mallorca-article23952165.html,https://www.n-tv.de/mediathek/videos/panorama/15-Meter-Loch-klafft-in-Strasse-von-Palma-de-Mallorca-article23952165.html,0,www.n-tv.de,Wintersturm hinterlässt Spuren: 15-Meter-Loch klafft in Straße von Palma de Mallorca,"Viele Touristen suchen im Winter die höheren Temperaturen von Mallorca. Doch ein heftiger Wintereinbruch überrascht die Urlaubsinsel. Er flaut zwar bereits ab, doch er hinterlässt Spuren. In der Hauptstadt Palma etwa klafft ein großes Loch mitten in einer Hau…",https://bilder1.n-tv.de/img/incoming/crop23952732/8461321264-cImg_16_9-w1200/LochMalle.jpg,2023-03-01T10:41:38Z,https://web.archive.org/web/20230301135123/https://www.n-tv.de/mediathek/videos/panorama/15-Meter-Loch-klafft-in-Strasse-von-Palma-de-Mallorca-article23952165.html,,,de,'Winter'
https://www.bild.de/leben-wissen/mein-recht-verbraucherportal/nach-habeck-hammer-das-kostet-das-umruesten-von-oel-und-gasheizungen-83050390.bild.html,https://www.bild.de/leben-wissen/mein-recht-verbraucherportal/nach-habeck-hammer-das-kostet-das-umruesten-von-oel-und-gasheizungen-83050390.bild.html,0,www.bild.de,Fossile Brennstoffe vor dem Aus - Das kostet das Umrüsten von Öl- und Gasheizungen,"Gehts nach Wirtschaftsminister Habeck, werden Öl- und Gasheizungen nach und nach verboten. In einem ersten Schritt schon 2024. Das kostet Sie die Umrüstung:","https://images.bild.de/63fde483834b0a045728f376/4271c5d03e784cc5d6690b336edbcde7,d1ed16f6?w=1280",2023-03-01T10:48:26Z,https://web.archive.org/web/20230301155933/https://www.bild.de/leben-wissen/mein-recht-verbraucherportal/nach-habeck-hammer-das-kostet-das-umruesten-von-oel-und-gasheizungen-83050390.bild.html,"Geht es nach Wirtschaftsminister Robert Habeck, werden Öl- und Gasheizungen nach und nach verboten. In einem ersten Schritt bereits ab 2024.
Das Abschalten fossiler Heizungsanlagen aus Klimaschutzgr… [+5666 chars]",,de,'Gas'
https://www.diepresse.com/6257573/ist-skifahren-ueberhaupt-noch-zeitgemaess,https://www.diepresse.com/6257573/ist-skifahren-ueberhaupt-noch-zeitgemaess,0,www.diepresse.com,Ist Skifahren überhaupt noch zeitgemäß?,Es ist nicht kalt genug. Wie bedroht ist der Wintersport? Sogar Athleten schlagen Alarm.,https://media.diepresse.com/social_diepresse_meinung/images/uploads_1200/b/a/5/6257573/A42CE48A-C5DF-4E40-98C7-10FFCFDA5B9F_1677667149756710.jpg,2023-03-01T10:57:00Z,https://web.archive.org/web/20230301134438/https://www.diepresse.com/6257573/ist-skifahren-ueberhaupt-noch-zeitgemaess,"Es ist nicht kalt genug. Wie bedroht ist der Wintersport? Sogar Athleten schlagen Alarm.
Anfang Jänner wusste ich noch nicht, ob ich 2022/23 Ski fahren würde. Österreich bot nichts als weiße Bänder … [+2025 chars]",,de,'Winter'
https://www.bild.de/sport/fussball/dynamo-dresden/ausweich-spielort-darum-darf-bayreuth-bei-dynamo-dresden-kicken-83059840.bild.html,https://www.bild.de/sport/fussball/dynamo-dresden/ausweich-spielort-darum-darf-bayreuth-bei-dynamo-dresden-kicken-83059840.bild.html,0,www.bild.de,Ausweich-Spielort bei Schnee und Eis - Darum darf Bayreuth bei Dynamo kicken,"Noch ist der Winter nicht vorbei. Deshalb könnte es passieren, dass die SpVgg Bayreuth zum „Heimspiel“ in Dresden aufkreuzt!Foto: picture alliance/dpa/dpa-Zentral","https://images.bild.de/63ff2c9849338c1a534d9784/06f27e9394385e7512ea2800eb279fda,cf2ff46?w=1280",2023-03-01T10:57:53Z,https://web.archive.org/web/20230301161947/https://www.bild.de/sport/fussball/dynamo-dresden/ausweich-spielort-darum-darf-bayreuth-bei-dynamo-dresden-kicken-83059840.bild.html,"Noch ist der Winter nicht vorbei, schlägt gerade mit Frost und Schnee nochmal zu. Deshalb könnte es passieren, dass die SpVgg Bayreuth demnächst zu einem Heimspiel in Dresden aufkreuzt...
Hintergrun… [+892 chars]",,de,'Winter'
https://www.zeit.de/news/2023-03/01/preise-fuer-nahrungsmittel-und-getraenke-stark-gestiegen,https://www.zeit.de/news/2023-03/01/preise-fuer-nahrungsmittel-und-getraenke-stark-gestiegen,0,www.zeit.de,Inflation: Preise für Nahrungsmittel und Getränke stark gestiegen,,,2023-03-01T11:00:53Z,https://web.archive.org/web/20230301112134/https://www.zeit.de/news/2023-03/01/preise-fuer-nahrungsmittel-und-getraenke-stark-gestiegen,"When browsing with ads:
We collect personal data and also transmit it to third-party providers
 that help us improve and finance our digital content. Some of the information stored on your device, … [+732 chars]",,de,'Inflation'
https://www.n-tv.de/mediathek/videos/panorama/Meteorologe-zieht-Winterbilanz-Das-ist-Klimawandel-article23952815.html,https://www.n-tv.de/mediathek/videos/panorama/Meteorologe-zieht-Winterbilanz-Das-ist-Klimawandel-article23952815.html,0,www.n-tv.de,"""Spezielle"" Dürren und Regenstürme: Meteorologe zieht Winterbilanz: ""Das ist Klimawandel""","Wie bereits die Jahre zuvor ist auch der aktuelle Winter im Durchschnitt auffällig warm. ntv-Meteorologe Christian Häckl hat keinen Zweifel daran, dass Deutschland hier den Klimawandel zu spüren bekommt. Die Zahlen seien noch erschreckender, als häufig genann…",https://bilder4.n-tv.de/img/incoming/crop23952891/2121325284-cImg_16_9-w1200/Hackl-Wetter-Klimawandel.jpg,2023-03-01T11:17:42Z,https://web.archive.org/web/20230301133331/https://www.n-tv.de/mediathek/videos/panorama/Meteorologe-zieht-Winterbilanz-Das-ist-Klimawandel-article23952815.html,,,de,'Winter'
https://www.faz.net/aktuell/finanzen/inflation-in-deutschland-stagniert-im-februar-bei-8-7-prozent-18712183.html,https://www.faz.net/aktuell/finanzen/inflation-in-deutschland-stagniert-im-februar-bei-8-7-prozent-18712183.html,0,www.faz.net,"Inflation in Deutschland stagniert im Februar bei 8,7 Prozent",Zwar scheinen sich die Energiepreise etwas beruhigt zu haben. Und bei Nahrungsmitteln ist es unterschiedlich. Höhere Preise gibt es jetzt aber unter anderem für viele Dienstleistungen.,https://media1.faz.net/ppmedia/aktuell/finanzen/1633154784/1.8712161/facebook_teaser/inflation.jpg,2023-03-01T13:02:49Z,https://web.archive.org/web/20230301133345/https://www.faz.net/aktuell/finanzen/inflation-in-deutschland-stagniert-im-februar-bei-8-7-prozent-18712183.html,"Die Inflationsrate in Deutschland lag im Februar bei 8,7 Prozent. Das hat das Statistische Bundesamt in Wiesbaden am Mittwoch nach einer ersten Schätzung mitgeteilt. Im Januar hatte die Rate auch bei… [+5402 chars]",,de,'Energiepreise'
https://www.focus.de/finanzen/gesetzesentwurf-von-robert-habeck-aus-fuer-oelheizung-wie-focus-online-leser-auf-das-angekuendigte-gesetz-reagieren_id_187077953.html,https://www.focus.de/finanzen/gesetzesentwurf-von-robert-habeck-aus-fuer-oelheizung-wie-focus-online-leser-auf-das-angekuendigte-gesetz-reagieren_id_187077953.html,0,www.focus.de,Gesetzesentwurf - Bürger ärgern sich über Habecks Heizungs-Hammer und haben eine Hoffnung,"Das Vorhaben der Bundesregierung, das Verbot von reinen Öl- oder Gasheizungen vorzuziehen, sorgt unter Hausbesitzern für Aufruhr. Reaktionen von FOCUS-online-Lesern zeigen, wie groß die Unsicherheit ist.Von FOCUS-online-Redakteurin Mirjam Moll",https://p6.focus.de/img/fotos/id_187048837/habeck1.jpg?im=Crop%3D%280%2C72%2C3467%2C1736%29%3BResize%3D%281200%2C627%29&impolicy=perceptual&quality=medium&hash=46c9e4171cb1bd6ad24f5710ee62869d85bb26367e2aeb53835b97256cb9bee0,2023-03-01T13:10:54Z,https://web.archive.org/web/20230301145406/https://www.focus.de/finanzen/gesetzesentwurf-von-robert-habeck-aus-fuer-oelheizung-wie-focus-online-leser-auf-das-angekuendigte-gesetz-reagieren_id_187077953.html,"Das Vorhaben der Bundesregierung, das Verbot von reinen Öl- oder Gasheizungen vorzuziehen, sorgt unter Hausbesitzern für Aufruhr. Reaktionen von FOCUS-online-Lesern zeigen, wie groß die Unsicherheit … [+5042 chars]",,de,'Gas'
https://www.zeit.de/wirtschaft/2023-03/inflation-deutschland-februar-statistisches-bundesamt,https://www.zeit.de/wirtschaft/2023-03/inflation-deutschland-februar-statistisches-bundesamt,0,www.zeit.de,Statistisches Bundesamt: Inflation in Deutschland stagniert überraschend,"Trotz sinkender Energiepreise hat die Inflation in Deutschland im Februar nicht an Fahrt verloren. Die Inflationsrate lag wie schon im Januar bei 8,7 Prozent.",,2023-03-01T13:24:09Z,https://web.archive.org/web/20230301133922/https://www.zeit.de/wirtschaft/2023-03/inflation-deutschland-februar-statistisches-bundesamt,"When browsing with ads:
We collect personal data and also transmit it to third-party providers
 that help us improve and finance our digital content. Some of the information stored on your device, … [+732 chars]",,de,'Inflation'
https://www.brigitte.de/mode/paris-fashion-week--die-besten-bilder--13487202.html,https://www.brigitte.de/mode/paris-fashion-week--die-besten-bilder--13487202.html,0,www.brigitte.de,Paris Fashion Week: Die besten Bilder aus der Modemetropole,"Vom 27. Februar bis 7. März 2023 wird in Paris wieder die Fashion Week gefeiert. Viele Stars, Promis und Modebegeisterte kommen in die Stadt der Liebe, um die neuesten Kollektionen für kommenden Herbst und Winter auf dem Laufsteg zu bewundern und auch, um sic…",https://image.brigitte.de/13487116/t/7Z/v4/w1440/r1.7778/-/paris-fashion-week-dior-charlize-theron.jpg,2023-03-01T13:56:00Z,https://web.archive.org/web/20230301152140/https://www.brigitte.de/mode/paris-fashion-week--die-besten-bilder--13487202.html,"Stopp! Du bist noch nicht angemeldet
Registriere dich jetzt einmalig bei BRIGITTE und erhalte vollen Zugriff auf Exklusiv-Inhalte, wie Videos und Artikel sowie praktische Features.
Bereits registri… [+18 chars]",,de,'Winter'
https://www.focus.de/sport/fussball/bundesliga1/bayern-faehrt-bei-verliehenem-torwart-nuebel-jetzt-einen-anderen-kurs_id_187150171.html,https://www.focus.de/sport/fussball/bundesliga1/bayern-faehrt-bei-verliehenem-torwart-nuebel-jetzt-einen-anderen-kurs_id_187150171.html,0,www.focus.de,Nach Wechsel des Torwarttrainers - Bayern fährt bei verliehenem Torwart Nübel jetzt einen anderen Kurs,"Stand heute wird Alexander Nübel im Sommer zum FC Bayern zurückkehren. Ob und wie es mit dem 26-jährigen Schlussmann beim deutschen Rekordmeister weitergeht, ist offen. Aktuellen Medienberichten zufolge hat Nübel nun ein „positives Signal“ aus München erhalte…",https://p6.focus.de/img/fotos/id_187154747/alexander-nuebel.png?im=Crop%3D%280%2C38%2C1854%2C927%29%3BResize%3D%281200%2C627%29&impolicy=perceptual&quality=medium&hash=cf5f4f12c99251767d1273cc0e8045e848a98d27daa326557eccaff6fee72a12,2023-03-01T14:10:23Z,https://web.archive.org/web/20230301183346/https://www.focus.de/sport/fussball/bundesliga1/bayern-faehrt-bei-verliehenem-torwart-nuebel-jetzt-einen-anderen-kurs_id_187150171.html,"Während die Winter-Rückkehr von Alexander Nübel zum FC Bayern geplatzt ist, könnte der Schlussmann im Sommer einen neuen Anlauf in München wagen. Auch wenn der Verein in Yann Sommer einen Topkeeper i… [+1314 chars]",,de,'Bayern'
https://burgenland.orf.at/stories/3196831/,https://burgenland.orf.at/stories/3196831/,0,burgenland.orf.at,Energiepreise: AK analysiert laufend,"Nach dem Urteil des Handelsgerichts Wien gegen eine Preiserhöhung des Verbunds reißt die Diskussion um die Strompreiserhöhungen nicht ab. Man analysiere die Situation am Energiemarkt laufend und lasse auch Erkenntnisse aus anderen Bundesländern einfließen, he…",https://ibs.orf.at/bgl?image=https%3A%2F%2Foekastatic.orf.at%2Fmims%2F2022%2F49%2F93%2Fcrops%2Fw%3D1200%2Ch%3D627%2Cq%3D75%2F1593390_master_583493_akhauptversammlung_c0045_00_00_00_00.jpg%3Fs%3D1dfdc3dc0b15ffba65a933ba295f36dc3a78784c,2023-03-01T14:35:00Z,https://web.archive.org/web/20230301145432/https://burgenland.orf.at/stories/3196831/,Das Handelsgericht Wien kippte vergangene Woche die Preiserhöhung des teilstaatlichen Stromkonzerns Verbund vom Mai 2022. Die Klausel zur Anpassung des Strom-Arbeitspreises sei nachteilig für die Kun… [+1149 chars],,de,'Energiepreise'
https://www.stern.de/wirtschaft/inflation-weiter-auf-hohem-niveau--preise-um-8-7-prozent-erhoeht-33242390.html,https://www.stern.de/wirtschaft/inflation-weiter-auf-hohem-niveau--preise-um-8-7-prozent-erhoeht-33242390.html,0,www.stern.de,Vergleich zum Vorjahresmonat: Lebensmittel- und Energiepreise wurden deutlich erhöht: Inflation verharrt auf hohem Niveau,"Die Inflation in Deutschland verharrt auf hohem Niveau: Laut Statistischem Bundesamt wurden die Verbraucherpreise im Februar um 8,7 Prozent im Vergleich z...",https://image.stern.de/33242394/t/vz/v2/w1440/r1.7778/-/inflation--1-.jpg,2023-03-01T14:39:00Z,https://web.archive.org/web/20230301151003/https://www.stern.de/wirtschaft/inflation-weiter-auf-hohem-niveau--preise-um-8-7-prozent-erhoeht-33242390.html,"Die Inflation in Deutschland bleibt hoch. Laut Statistischem Bundesamt lagen die Verbraucherpreise im Februar um 8,7 Prozent höher als im Vorjahresmonat.
Die Teuerung in Deutschland hält sich hartnä… [+3031 chars]",,de,'Inflation'
https://www.morgenpost.de/berlin/article237785215/Union-Stuermer-Becker-kann-sich-Wechsel-vorstellen.html,https://www.morgenpost.de/berlin/article237785215/Union-Stuermer-Becker-kann-sich-Wechsel-vorstellen.html,0,www.morgenpost.de,Bundesliga: Union-Stürmer Becker kann sich Wechsel vorstellen,"Nach abgelehnten Anfragen im Januar kann sich Stürmer Sheraldo Becker vom 1. FC Union Berlin einen Wechsel im Sommer vorstellen. „Im Winter haben Clubs angefragt. Da habe ich gesagt, dass ich bleibe. Ich weiß aber nicht, was im Sommer passiert“, sagte der Nie…",https://img.morgenpost.de/img/berlin/crop237785209/6062608727-w820-cv16_9-q85/Sheraldo-Becker-vom-1.jpg,2023-03-01T14:48:02Z,https://web.archive.org/web/20230301160930/https://www.morgenpost.de/berlin/article237785215/Union-Stuermer-Becker-kann-sich-Wechsel-vorstellen.html,"Berlin (dpa/bb)-. Nach abgelehnten Anfragen im Januar kann sich Stürmer Sheraldo Becker vom 1. FC Union Berlin einen Wechsel im Sommer vorstellen. Im Winter haben Clubs angefragt. Da habe ich gesagt,… [+1348 chars]",,de,'Winter'
https://www.stern.de/news/aussenminister--ukraine-hat-schwierigsten-winter-ihrer-geschichte-ueberstanden-33242732.html,https://www.stern.de/news/aussenminister--ukraine-hat-schwierigsten-winter-ihrer-geschichte-ueberstanden-33242732.html,0,www.stern.de,Außenminister: Ukraine hat schwierigsten Winter ihrer Geschichte überstanden,"Die Ukraine hat nach den Worten ihres Außenministers den schwierigsten Winter ihrer Geschichte überstanden. ""Er war kalt und dunkel, aber wir waren unbesiegbar"", erklärte Außenminister Dmytro Kuleba am Mittwoch. Staatschef Wolodymyr Selenskyj verwies darauf, …",https://image.stern.de/33242734/t/Xy/v1/w1440/r1.7778/-/01--eine-aeltere-frau-in-ihrem-zerschossenen-hinterhof-nahe-bachmut---60ac1a91493a82ae.jpg,2023-03-01T14:51:18Z,https://web.archive.org/web/20230301150535/https://www.stern.de/news/aussenminister--ukraine-hat-schwierigsten-winter-ihrer-geschichte-ueberstanden-33242732.html,"Die Ukraine hat nach den Worten ihres Außenministers den schwierigsten Winter ihrer Geschichte überstanden. ""Er war kalt und dunkel, aber wir waren unbesiegbar"", erklärte Außenminister Dmytro Kuleba … [+2828 chars]",,de,'Winter'
https://www.focus.de/finanzen/interview-mit-daniel-foest-zwei-worte-fehlten-ploetzlich-in-habecks-heiz-gesetz_id_187135091.html,https://www.focus.de/finanzen/interview-mit-daniel-foest-zwei-worte-fehlten-ploetzlich-in-habecks-heiz-gesetz_id_187135091.html,0,www.focus.de,Interview mit Daniel Föst - Zwei Worte fehlten plötzlich in Habecks Heiz-Gesetz,"Das Quasi-Verbot von neuen Öl- und Gasheizungen ab dem Jahr 2024 hat für immenses Aufsehen gesorgt. Der FDP-Bauexperte Daniel Föst erklärt im Interview, warum er den Gesetzentwurf aus dem Wirtschaftsministerium für „brutal“ hält und was Robert Habeck bei dem …",https://p6.focus.de/img/fotos/id_187149474/habeck1.jpg?im=Crop%3D%280%2C79%2C3463%2C1732%29%3BResize%3D%281200%2C627%29&impolicy=perceptual&quality=medium&hash=76b5b85e2e49fc185ba00b09cab4f085f21633464fcc9086fa84bec9f859d440,2023-03-01T15:13:33Z,https://web.archive.org/web/20230301164045/https://www.focus.de/finanzen/interview-mit-daniel-foest-zwei-worte-fehlten-ploetzlich-in-habecks-heiz-gesetz_id_187135091.html,"Das Quasi-Verbot von neuen Öl- und Gasheizungen ab 2024 hat für Aufsehen gesorgt. Der FDP-Bauexperte Daniel Föst erklärt im Interview, warum er den Gesetzentwurf aus dem Wirtschafts- und Klimaministe… [+7423 chars]",,de,'Öl'
https://www.n-tv.de/wirtschaft/Preiserhoehungen-sind-ein-gefaehrliches-Spiel-article23953100.html,https://www.n-tv.de/wirtschaft/Preiserhoehungen-sind-ein-gefaehrliches-Spiel-article23953100.html,0,www.n-tv.de,"Versuchung für Energieversorger: Preiserhöhungen sind ""ein gefährliches Spiel""","Ab heute greifen die Preisbremsen für Gas und Strom - und zwar rückwirkend. Im Interview erklärt der einflussreiche Ökonom und Energieexperte Südekum, was an dem Vorwurf dran ist, die Maßnahme halte die Preise hoch, und vor welcher gefährlichen Versuchung Ver…",https://bilder2.n-tv.de/img/incoming/crop23953197/8091328286-cImg_16_9-w1200/imago0202646233h.jpg,2023-03-01T15:13:38Z,https://web.archive.org/web/20230301151549/https://www.n-tv.de/wirtschaft/Preiserhoehungen-sind-ein-gefaehrliches-Spiel-article23953100.html,"Ab heute greifen die Preisbremsen für Gas und Strom - und zwar rückwirkend. Im Interview erklärt der einflussreiche Ökonom und Energieexperte Südekum, was an dem Vorwurf dran ist, die Maßnahme halte … [+5380 chars]",,de,'Gas'
https://www.n-tv.de/wirtschaft/Die-Inflation-ist-hartnaeckig-article23953973.html,https://www.n-tv.de/wirtschaft/Die-Inflation-ist-hartnaeckig-article23953973.html,0,www.n-tv.de,"Gekommen, um zu bleiben?: Die Inflation ist hartnäckig",Die Teuerung in Deutschland verharrt auf hohem Niveau und dürfte sich in den nächsten Monaten nur langsam abschwächen. Der Gipfel ist aber wohl überschritten.,https://bilder2.n-tv.de/img/incoming/crop23954065/548132304-cImg_16_9-w1200/242240055.jpg,2023-03-01T17:34:40Z,https://web.archive.org/web/20230301174548/https://www.n-tv.de/wirtschaft/Die-Inflation-ist-hartnaeckig-article23953973.html,"Die Teuerung in Deutschland verharrt auf hohem Niveau und dürfte sich in den nächsten Monaten nur langsam abschwächen. Der Gipfel ist aber wohl überschritten.
Die Inflation in Deutschland bleibt hoc… [+4443 chars]",,de,'Inflation'
