index,url,valid,domain,title,description,image,published,archive,content,quote,language,keyword
https://www.computerbase.de/news/smart-home/klimaanlage-x-strompreise-tado-buendelt-steuerung-mit-der-midea-portasplit.97674/,https://www.computerbase.de/news/smart-home/klimaanlage-x-strompreise-tado-buendelt-steuerung-mit-der-midea-portasplit.97674/,0,www.computerbase.de,Klimaanlage x Strompreise: tado° bündelt Steuerung mit der Midea PortaSplit,"tado° ist inzwischen mehr als eine smarte Heizungssteuerung über tado° X (Test) und kann auch Klimaanlage und den Stromverbrauch an Energiepreise koppeln. Nun bündelt tado° die intelligente Steuerung mit der Retro-Fit-Klimaanlage Midea PortaSplit, die längst …",https://pics.computerbase.de/1/2/3/0/1/7-73935c5da83f4a87/article-1280x720.76ac47e0.jpg,2026-06-09T08:00:00Z,,tado° ist inzwischen mehr als eine smarte Heizungssteuerung über tado° X (Test) und kann auch Klimaanlage und den Stromverbrauch an Energiepreise koppeln. Nun bündelt tado° die intelligente Steuerung… [+1832 chars],,de,'Energiepreise'
https://www.zeit.de/politik/ausland/2026-06/jacques-tilly-karneval-russland-gericht-strafe,https://www.zeit.de/politik/ausland/2026-06/jacques-tilly-karneval-russland-gericht-strafe,0,www.zeit.de,Karneval: Russisches Gericht bestätigt Strafe gegen Satiriker Jacques Tilly,Wegen Karnevalswagen mit Putin-Motiv wurde Jacques Tilly in Abwesenheit zu mehr als acht Jahren Haft verurteilt. Ein Moskauer Berufungsgericht hat das Urteil bestätigt.,https://img.zeit.de/politik/ausland/2026-06/jacques-tilly-karneval-russland-gericht-strafe-foto-1/wide__1300x731,2026-06-09T10:43:27Z,,"Ein russisches Berufungsgericht hat die Strafe von achteinhalb Jahren Haft gegen den deutschen, in Abwesenheit verurteilten Satiriker Jacques Tilly bestätigt. Richter Wladimir Ussow verlas in Moskau … [+1102 chars]",,de,'Putin'
https://www.zeit.de/news/2026-06/09/beliebteste-babynamen-in-bayern-sind-felix-und-sophia,https://www.zeit.de/news/2026-06/09/beliebteste-babynamen-in-bayern-sind-felix-und-sophia,0,www.zeit.de,Vornamen in Bayern: Beliebteste Babynamen in Bayern sind Felix und Sophia,Hier finden Sie Informationen zu dem Thema „Vornamen in Bayern“. Lesen Sie jetzt „Beliebteste Babynamen in Bayern sind Felix und Sophia“.,https://img.zeit.de/news/2026-06/09/beliebteste-babynamen-in-bayern-sind-felix-und-sophia-image-group/wide__1300x731,2026-06-09T11:53:15Z,,"Felix und Sophia haben in Bayern einen Lauf - zumindest bei Babys. Wie schon im Vorjahr waren das auch 2025 die beliebtesten Vornamen bei Neugeborenen im Freistaat, wie aus einer Statistik der Gesell… [+2095 chars]",,de,'Bayern'
https://www.zeit.de/news/2026-06/09/weniger-buerokratie-soll-wohnungsbau-in-bayern-ankurbeln,https://www.zeit.de/news/2026-06/09/weniger-buerokratie-soll-wohnungsbau-in-bayern-ankurbeln,0,www.zeit.de,Kabinett: Weniger Bürokratie soll Wohnungsbau in Bayern ankurbeln,Hier finden Sie Informationen zu dem Thema „Kabinett“. Lesen Sie jetzt „Weniger Bürokratie soll Wohnungsbau in Bayern ankurbeln“.,https://img.zeit.de/news/2026-06/09/weniger-buerokratie-soll-wohnungsbau-in-bayern-ankurbeln-image-group/wide__1300x731,2026-06-09T12:53:26Z,,Unter anderem mit einem Abbau von Auflagen will Bayern den seit Jahren nur schleppend vorankommenden Wohnungsbau ankurbeln. Bauminister Christian Bernreiter (CSU) sprach nach einer Sitzung des Kabine… [+2167 chars],,de,'Bayern'
https://www.zeit.de/news/2026-06/10/nach-helikopter-abschuss-us-militaer-greift-ziele-im-iran-an,https://www.zeit.de/news/2026-06/10/nach-helikopter-abschuss-us-militaer-greift-ziele-im-iran-an,0,www.zeit.de,Iran-Krieg: Nach Helikopter-Abschuss: US-Militär greift Ziele im Iran an,Hier finden Sie Informationen zu dem Thema „Iran-Krieg“. Lesen Sie jetzt „Nach Helikopter-Abschuss: US-Militär greift Ziele im Iran an“.,https://img.zeit.de/news/2026-06/10/nach-helikopter-abschuss-us-militaer-greift-ziele-im-iran-an-image-group/wide__1300x731,2026-06-09T22:52:36Z,,"Nach dem Abschuss eines US-Militärhubschraubers haben die USA nach eigenen Angaben Vergeltungsschläge auf Ziele im Iran ausgeführt. Die Angriffe erfolgten auf Anordnung von Präsident Donald Trump, er… [+2927 chars]",,de,'Krieg'
https://www.tagesspiegel.de/wirtschaft/immobilien-anteil-von-warmepumpen-in-neubauten-verdoppelt-sich-15699009.html,https://www.tagesspiegel.de/wirtschaft/immobilien-anteil-von-warmepumpen-in-neubauten-verdoppelt-sich-15699009.html,0,www.tagesspiegel.de,Immobilien: Anteil von Wärmepumpen in Neubauten verdoppelt sich,Wärmepumpen heizen inzwischen fast drei Viertel aller neuen Wohngebäude in Deutschland. Doch im Bestand dominieren noch fossile Energien.,https://www.tagesspiegel.de/images/15699008/alternates/BASE_16_9_W1400/1781073522000/warmepumpe-im-einfamilienhaus.jpeg,2026-06-10T06:38:42Z,,"Ein immer größerer Teil der neuen Wohngebäude in Deutschland wird mit Wärmepumpen beheizt. Knapp drei Viertel (73,6 Prozent) der rund 58.900 Wohngebäude, die 2025 fertiggestellt wurden, nutzen haupts… [+2483 chars]",,de,'fossile Energie'
https://www.faz.net/aktuell/finanzen/finanzmarkt/ezb-warum-nun-die-zinsen-erhoeht-werden-sollten-200909610.html,https://www.faz.net/aktuell/finanzen/finanzmarkt/ezb-warum-nun-die-zinsen-erhoeht-werden-sollten-200909610.html,0,www.faz.net,"Zinserhöhung: Na los, EZB","So, nun ist genug herumüberlegt. Die Inflation hat 3,2 Prozent erreicht. Zeit für eine Zinserhöhung.",https://media0.faz.net/image/w1200h627/8077c69f7546/w3309h1728x0y272o/202606/43601.0.2186965830/stimmungsvoll-die-notenbank.webp,2026-06-10T08:18:24Z,,"Den richtigen Zeitpunkt für eine Zinswende zu erwischen, ist in der Geldpolitik gar nicht so einfach. Das hängt unter anderem damit zusammen, dass viele Daten erst mit Verzögerung vorliegen und auch … [+1260 chars]",,de,'Öl'
https://www.zeit.de/news/2026-06/10/ministerin-polen-will-raffinerie-pck-unterstuetzen,https://www.zeit.de/news/2026-06/10/ministerin-polen-will-raffinerie-pck-unterstuetzen,0,www.zeit.de,Ölraffinerie Schwedt: Ministerin: Polen will Raffinerie PCK unterstützen,Hier finden Sie Informationen zu dem Thema „Ölraffinerie Schwedt“. Lesen Sie jetzt „Ministerin: Polen will Raffinerie PCK unterstützen“.,https://img.zeit.de/news/2026-06/10/ministerin-polen-will-raffinerie-pck-unterstuetzen-image-group/wide__1300x731,2026-06-10T09:37:26Z,,Brandenburgs Wirtschaftsministerin Martina Klement (CSU) sieht die Sicherstellung der Produktion bei der Ölraffinerie PCK trotz des Stopps kasachischen Öls auf einem guten Weg. Einen Durchbruch bei d… [+1769 chars],,de,'Öl'
https://www.zeit.de/gesellschaft/2026-06/wohnkultur-politik-wohnen-alpenlaender-alpenpodcast,https://www.zeit.de/gesellschaft/2026-06/wohnkultur-politik-wohnen-alpenlaender-alpenpodcast,0,www.zeit.de,Wohnkultur und Politik: Die Sofa-TV-Achse,"Beim Auftritt in Graz reden wir übers Wohnen. Was ist typisch für Deutschland, Österreich und die Schweiz, und was hat die Einbauküche mit dem Kalten Krieg zu tun?",https://img.zeit.de/gesellschaft/2026-06/https-vivi-zeit-de-repository-gesellschaft-2026-06-wohnkultur-politik-wohnen-alpenlaender-alpenpodcast-bild-neu/wide__1300x731,2026-06-10T10:51:52Z,,"Die Hosts beim Auftritt im Grazer Opernhaus© Ingo Pertramer für DIE ZEIT
Wir stoßen die Türen auf zu den Wohnungen und Häusern in den Alpenländern: Wie sieht es drinnen aus? In dieser Folge vom Auft… [+942 chars]",,de,'Krieg'
https://www.zeit.de/news/2026-06/10/ukraine-krieg-dauert-nun-so-lange-wie-der-erste-weltkrieg,https://www.zeit.de/news/2026-06/10/ukraine-krieg-dauert-nun-so-lange-wie-der-erste-weltkrieg,0,www.zeit.de,Drohnenangriffe: Ukraine-Krieg dauert nun so lange wie der Erste Weltkrieg,Hier finden Sie Informationen zu dem Thema „Drohnenangriffe“. Lesen Sie jetzt „Ukraine-Krieg dauert nun so lange wie der Erste Weltkrieg“.,https://img.zeit.de/news/2026-06/10/ukraine-krieg-dauert-nun-so-lange-wie-der-erste-weltkrieg-image-group/wide__1300x731,2026-06-10T12:38:10Z,,In ihrem Abwehrkampf gegen Russland hat die ukrainische Armee Ziele Hunderte Kilometer tief im Hinterland des Gegners mit Drohnen und Raketen angegriffen. Das russische Verteidigungsministerium in Mo… [+3494 chars],,de,'Krieg'
https://www.freitag.de/autoren/joern-boewe/energiewende-wenn-aus-waermepumpen-sondermuell-wird-ist-das-ein-rohstoffproblem,https://www.freitag.de/autoren/joern-boewe/energiewende-wenn-aus-waermepumpen-sondermuell-wird-ist-das-ein-rohstoffproblem,0,www.freitag.de,Wärmepumpen als Sondermüll: Wie sich das Rohstoffproblem der Energiewende lösen lässt,"Dekarbonisierung ist notwendig. Aber die ökologische Wende gelingt nur, wenn sie mit dem massiven Ressourcenverbrauch des fossilen Zeitalters bricht. Das ist derzeit kaum der Fall, ob bei Elektromobilität, Windkraft oder Batterien Im Westen Serbiens beginnt E…",https://www.freitag.de/autoren/joern-boewe/energiewende-wenn-aus-waermepumpen-sondermuell-wird-ist-das-ein-rohstoffproblem/@@images/image/great,2026-06-10T13:40:00Z,,"Im Westen Serbiens beginnt Europas saubere Zukunft. Oder sie endet dort. So sehen es jedenfalls viele Menschen im Jadar-Tal, wo der Bergbaukonzern Rio Tinto Lithium fördern will. Unter den Ackerfelde… [+10204 chars]",,de,'fossile Energie'
https://www.faz.net/aktuell/wirtschaft/mehr-wirtschaft/us-inflation-steigt-auf-hoechsten-stand-seit-drei-jahren-200917192.html,https://www.faz.net/aktuell/wirtschaft/mehr-wirtschaft/us-inflation-steigt-auf-hoechsten-stand-seit-drei-jahren-200917192.html,0,www.faz.net,US-KonJunktur: Teure Energie befeuert die US-Inflation,Die Preise in den USA sind binnen zwölf Monaten so stark gestiegen wie seit drei Jahren nicht. Für den neuen Chef der Zentralbank kommt das zur Unzeit.,https://media0.faz.net/image/w1200h627/4d0fe2065d59/w5616h2934x0y405o/202604/43601.0.2028532622/tanken-wird-teuer-in-den-usa.webp,2026-06-10T13:56:37Z,,"Die Inflation in den USA entfernt sich weiter von der Zielmarke. Der Verbraucherpreisindex (CPI) stieg in den vergangenen zwölf Monaten um 4,2 Prozent. Das ist das höchste Niveau seit drei Jahren. Im… [+1098 chars]",,de,'Energiepreise'
https://www.drweb.de/drei-von-vier-neubauten-heizen-mit-waermepumpe/,https://www.drweb.de/drei-von-vier-neubauten-heizen-mit-waermepumpe/,0,www.drweb.de,Drei von vier Neubauten heizen mit Wärmepumpe,"Die Wärmepumpe hat sich im Wohnungsneubau als Normheizung durchgesetzt. 73,6 Prozent der 2025 fertiggestellten Wohngebäude laufen damit, Gas spielt fast keine Rolle mehr. Für...",https://www.drweb.de/wp-content/uploads/2026/06/drei-von-vier-neubauten-heizen-mit-waermepumpe-beitragsbild.jpg,2026-06-10T14:15:57Z,,"Die Wärmepumpe hat sich im Wohnungsneubau als Normheizung durchgesetzt. 73,6 Prozent der 2025 fertiggestellten Wohngebäude laufen damit, Gas spielt fast keine Rolle mehr. Für Planer, Investoren und d… [+3832 chars]",,de,'Gas'
https://www.drweb.de/eu-kommission-will-stromsteuer-senken/,https://www.drweb.de/eu-kommission-will-stromsteuer-senken/,0,www.drweb.de,EU-Kommission will Stromsteuer senken,"Die EU-Kommission will Strom steuerlich künftig besserstellen als Erdgas. Ein neuer Verordnungsentwurf soll die Stromsteuer drücken, die Netzentgelte angleichen und den Umstieg von Gas...",https://www.drweb.de/wp-content/uploads/2026/06/bruessel-dreht-die-steuerlogik-strom-schlaegt-gas-beitragsbild-1.jpg,2026-06-10T14:27:03Z,,"Die EU-Kommission will Strom steuerlich künftig besserstellen als Erdgas. Ein neuer Verordnungsentwurf soll die Stromsteuer drücken, die Netzentgelte angleichen und den Umstieg von Gas auf Strom besc… [+3375 chars]",,de,'Gas'
https://www.zeit.de/news/2026-06/10/regionalzuege-in-bayern-kamen-erneut-unpuenktlicher,https://www.zeit.de/news/2026-06/10/regionalzuege-in-bayern-kamen-erneut-unpuenktlicher,0,www.zeit.de,Jahresbilanz: Regionalzüge in Bayern kamen erneut unpünktlicher,Hier finden Sie Informationen zu dem Thema „Jahresbilanz“. Lesen Sie jetzt „Regionalzüge in Bayern kamen erneut unpünktlicher“.,https://img.zeit.de/news/2026-06/10/regionalzuege-in-bayern-kamen-erneut-unpuenktlicher-image-group/wide__1300x731,2026-06-10T15:08:05Z,,"Der Negativtrend bei der Pünktlichkeit im bayerischen Eisenbahnregionalverkehr geht weiter. 84,9 Prozent aller Regionalzüge und S-Bahnen im Freistaat erreichten 2025 ihr Ziel pünktlich - sofern sie n… [+1815 chars]",,de,'Bayern'
https://www.faz.net/podcasts/f-a-z-podcast-fuer-deutschland/trump-putin-netanjahu-konfliktforscherin-deitelhoff-ueber-die-neuen-warlords-200915592.html,https://www.faz.net/podcasts/f-a-z-podcast-fuer-deutschland/trump-putin-netanjahu-konfliktforscherin-deitelhoff-ueber-die-neuen-warlords-200915592.html,0,www.faz.net,"F. A. Z. Podcast für Deutschland: Trump, Putin, Netanjahu: Konfliktforscherin Deitelhoff über die „neuen Warlords“","Das Völkerrecht interessiert sie nicht und Gewalt wird zum normalen Mittel der Politik: Die Friedensforscherin Nicole Deitelhoff warnt zusammen mit Kollegen im neuen Friedensgutachten vor den Akteuren, die den Verfall der alten Weltordnung beschleunigen.",https://media0.faz.net/image/w1200h627/87c8d4923602/w2600h1358x0y118o/202606/43601.0.2189134715/4360102189134715.webp,2026-06-10T15:35:40Z,,"Völkerrecht interessiert sie nicht und Gewalt wird zum normalen Mittel der Politik: Friedensforscherin Nicole Deitelhoff warnt im neuen Friedensgutachten vor den Akteuren, die den Verfall der alten W… [+24 chars]",,de,'Putin'
https://www.zeit.de/news/2026-06/10/us-militaer-neue-angriffe-auf-ziele-im-iran-haben-begonnen,https://www.zeit.de/news/2026-06/10/us-militaer-neue-angriffe-auf-ziele-im-iran-haben-begonnen,0,www.zeit.de,Krieg: US-Militär: Neue Angriffe auf Ziele im Iran haben begonnen,Hier finden Sie Informationen zu dem Thema „Krieg“. Lesen Sie jetzt „US-Militär: Neue Angriffe auf Ziele im Iran haben begonnen“.,https://img.zeit.de/administratives/sharing/fallback-image-die-zeit/wide__1300x731,2026-06-10T21:43:17Z,,Das US-Militär hat nach eigenen Angaben auf Befehl von US-Präsident Donald Trump mit neuen Angriffen auf mehrere Ziele im Iran begonnen. «Die Angriffe sind eine Reaktion auf die ungerechtfertigte und… [+167 chars],,de,'Krieg'
https://www.zeit.de/news/2026-06/11/iran-erklaert-strasse-von-hormus-fuer-komplett-gesperrt,https://www.zeit.de/news/2026-06/11/iran-erklaert-strasse-von-hormus-fuer-komplett-gesperrt,0,www.zeit.de,Krieg: Iran erklärt Straße von Hormus für komplett gesperrt,Hier finden Sie Informationen zu dem Thema „Iran-Krieg“. Lesen Sie jetzt „Iran erklärt Straße von Hormus für komplett gesperrt“.,https://img.zeit.de/news/2026-06/11/iran-erklaert-strasse-von-hormus-fuer-komplett-gesperrt-image-group/wide__1300x731,2026-06-10T23:03:12Z,,"Das iranische Militär hat die Straße von Hormus als Reaktion auf die jüngsten US-Angriffe auf Ziele im Süden des Landes nach eigenen Angaben komplett gesperrt. Jedes Schiff, dass die Meerenge zu pass… [+1609 chars]",,de,'Krieg'
https://www.zeit.de/news/2026-06/11/bayern-fordert-haertere-strafen-fuer-verbotene-geldabhebungen,https://www.zeit.de/news/2026-06/11/bayern-fordert-haertere-strafen-fuer-verbotene-geldabhebungen,0,www.zeit.de,Justizministerkonferenz: Bayern fordert härtere Strafen für verbotene Geldabhebungen,Hier finden Sie Informationen zu dem Thema „Justizministerkonferenz“. Lesen Sie jetzt „Bayern fordert härtere Strafen für verbotene Geldabhebungen“.,https://img.zeit.de/news/2026-06/11/bayern-fordert-haertere-strafen-fuer-verbotene-geldabhebungen-image-group/wide__1300x731,2026-06-11T02:00:33Z,,"Bayern fordert härtere Strafen für verbotene Geldabhebungen mit Bankkarten ohne PIN-Eingabe. «Beim Missbrauch von Bankkarten müssen wir strafrechtliche Lücken schließen», sagte Bayerns Justizminister… [+1932 chars]",,de,'Bayern'
https://www.zeit.de/news/2026-06/11/dauerregen-in-bayern-sonne-erst-am-wochenende-in-sicht,https://www.zeit.de/news/2026-06/11/dauerregen-in-bayern-sonne-erst-am-wochenende-in-sicht,0,www.zeit.de,Wetter in Bayern: Dauerregen in Bayern - Sonne erst am Wochenende in Sicht,Hier finden Sie Informationen zu dem Thema „Wetter in Bayern“. Lesen Sie jetzt „Dauerregen in Bayern - Sonne erst am Wochenende in Sicht“.,https://img.zeit.de/news/2026-06/11/dauerregen-in-bayern-sonne-erst-am-wochenende-in-sicht-image-group/wide__1300x731,2026-06-11T03:43:06Z,,"Dauerregen, kühl und ungemütlich: Wer sich nach Sonne sehnt, muss noch ein bisschen Geduld mitbringen. Es gebe viele Wolken, Schauer und hin und wieder sogar Gewitter, sagt der Deutsche Wetterdienst … [+649 chars]",,de,'Bayern'
https://www.faz.net/aktuell/wirtschaft/mehr-wirtschaft/kiel-report-oekonomen-sehen-russlands-wirtschaft-im-endstadium-accg-200916211.html,https://www.faz.net/aktuell/wirtschaft/mehr-wirtschaft/kiel-report-oekonomen-sehen-russlands-wirtschaft-im-endstadium-accg-200916211.html,0,www.faz.net,„Kiel Report“: Ökonomen sehen Russlands Wirtschaft im „Endstadium“,Ein neuer Bericht sieht Putins Kriegswirtschaft am Abgrund. Die Autoren fordern schärfere Sanktionen des Westens und einen speziellen Zoll.,https://media0.faz.net/image/w1200h627/adc324ccaf95/w3000h1567x0y216o/202509/43601.0.1290232120/im-vergangenen-herbst-putin.webp,2026-06-11T03:54:43Z,,"Ein neuer Bericht von Ökonomen sieht eine düstere Zukunft für Russlands Wirtschaft. Diese befinde sich in einem Endstadium, argumentiert der jüngste Kiel Report, den das Kieler Institut für Weltwirts… [+5220 chars]",,de,'Krieg'
https://www.faz.net/aktuell/sport/fussball-wm/merkel-berater-heusgen-die-kanzlerin-hat-sich-in-der-halbzeitpause-mit-putin-getroffen-accg-200914140.html,https://www.faz.net/aktuell/sport/fussball-wm/merkel-berater-heusgen-die-kanzlerin-hat-sich-in-der-halbzeitpause-mit-putin-getroffen-accg-200914140.html,0,www.faz.net,Heusgen im Interview: „Die Kanzlerin hat sich in der Halbzeitpause mit Putin getroffen“,"Christoph Heusgen, langjähriger Berater von Angela Merkel, erklärt, wie die Kanzlerin Sport für ihre Politik genutzt hat, Trump die WM zu seiner Show machen wird und warum Lothar Matthäus einst sauer auf ihn war.",https://media0.faz.net/image/w1200h627/e2b6d4ff9cc6/w2727h1424x83y122o/202411/43601.0.708331203/kabinenparty-mit-kanzlerin.webp,2026-06-11T04:34:39Z,,"Christoph Heusgen, langjähriger Berater von Angela Merkel, erklärt, wie die Kanzlerin Sport für ihre Politik genutzt hat, Trump die WM zu seiner Show machen wird und warum Lothar Matthäus einst sauer… [+12 chars]",,de,'Putin'
https://www.zeit.de/2026/26/putin-verhandlungen-europa-usa-nato-ukraine,https://www.zeit.de/2026/26/putin-verhandlungen-europa-usa-nato-ukraine,0,www.zeit.de,Putins Verhandlungen: Friedenswirren,"Putins Traum, mit den USA über Europas Zukunft zu verhandeln, ist geplatzt. Eine Chance für die EU. Jetzt bräuchte es ein Verhandlerteam, das auslotet, was möglich ist.",https://img.zeit.de/2026/26/friedenswirren-bild-2/wide__1300x731,2026-06-11T07:23:26Z,,"Schließen
Artikelzusammenfassung
Putin versucht, Europa zum Reden zu bringen, während Deutschland in Moskau zum Feindbild wird. Die Kritik an Europa ist groß, mit Vorwürfen und Drohungen seitens de… [+586 chars]",,de,'Putin'
https://www.zeit.de/politik/deutschland/2026-06/markus-frohnmaier-afd-russland-geheimschutz-bundestag,https://www.zeit.de/politik/deutschland/2026-06/markus-frohnmaier-afd-russland-geheimschutz-bundestag,0,www.zeit.de,Hybride Kriegsführung: Koalition fordert strengeren Geheimschutz wegen AfD-Russlandkontakten,"Mehrere AfD-Abgeordnete pflegen Kontakte zu Putin-Vertrauten. Union und SPD mahnen Maßnahmen an, damit keine geheimen Informationen nach Russland weitergegeben werden.",https://img.zeit.de/politik/deutschland/2026-06/markus-frohnmaier-afd-russland-geheimschutz-bundestag-foto-1/wide__1300x731,2026-06-11T11:06:01Z,,"Wegen der Russlandkontakte von AfD-Bundestagsabgeordneten erwägen Union und SPD schärfere Vorkehrungen zum Schutz vertraulicher Informationen im Parlament. »Der Bundestag sollte prüfen, wie geheimhal… [+2764 chars]",,de,'Krieg'
https://www.zeit.de/politik/ausland/2026-06/ukraine-angriff-bruecken-krim-treibstoffmangel,https://www.zeit.de/politik/ausland/2026-06/ukraine-angriff-bruecken-krim-treibstoffmangel,0,www.zeit.de,Krieg gegen die Ukraine: Ukraine attackiert mehrere Brücken zur Krim,"Die Ukraine verstärkt ihre Angriffe auf die Landverbindung zur Krim. Der Verkauf von Treibstoff auf der besetzten Halbinsel wurde gestoppt, der Busverkehr eingeschränkt.",https://img.zeit.de/politik/ausland/2026-06/ukraine-angriff-bruecken-krim-treibstoffmangel-foto-1/wide__1300x731,2026-06-11T11:08:03Z,,Das ukrainische Militär hat nach eigenen Angaben und nach Darstellung russischer Besatzungsvertreter ihre Angriffe auf die Transportwege von Russland zur besetzten Krim-Halbinsel fortgesetzt. Wolodym… [+5088 chars],,de,'Krieg'
https://www.faz.net/aktuell/finanzen/finanzmarkt/ezb-hebt-erstmals-seit-september-2023-die-zinsen-an-accg-200916055.html,https://www.faz.net/aktuell/finanzen/finanzmarkt/ezb-hebt-erstmals-seit-september-2023-die-zinsen-an-accg-200916055.html,0,www.faz.net,Zinsentscheidung für Juni: EZB hebt erstmals seit drei Jahren die Zinsen an,"Nach einer langen Pause steigt der wichtigste Leitzins im Euroraum auf 2,25 Prozent. Damit reagiert die Notenbank auf die aufkommende Inflation. Was heißt das für Sparer und Hausbauer?",https://media0.faz.net/image/w1200h627/f4e6fd9c1c7b/w6144h3210x0y123o/202605/43601.0.2050093834/die-praesidentin-der.webp,2026-06-11T12:16:33Z,,"Die Europäische Zentralbank (EZB) hebt alle drei Leitzinsen um 0,25 Prozentpunkte an. Das hat die Notenbank am Donnerstag nach der Juni-Zinssitzung des EZB-Rats mitgeteilt. Es ist die erste Zinserhöh… [+6967 chars]",,de,'Inflation'
https://www.zeit.de/news/2026-06/11/ezb-erwartet-wegen-krieg-mehr-inflation-und-weniger-wachstum,https://www.zeit.de/news/2026-06/11/ezb-erwartet-wegen-krieg-mehr-inflation-und-weniger-wachstum,0,www.zeit.de,Folgen des Nahost-Kriegs: EZB erwartet wegen Krieg mehr Inflation und weniger Wachstum,Hier finden Sie Informationen zu dem Thema „Folgen des Nahost-Kriegs“. Lesen Sie jetzt „EZB erwartet wegen Krieg mehr Inflation und weniger Wachstum“.,https://img.zeit.de/news/2026-06/11/ezb-erwartet-wegen-krieg-mehr-inflation-und-weniger-wachstum-image-group/wide__1300x731,2026-06-11T12:29:06Z,,Die Europäische Zentralbank (EZB) rechnet wegen des Iran-Kriegs mit mehr Inflation und weniger Wirtschaftswachstum im Euroraum. Im wahrscheinlichsten Szenario erwartet die Notenbank für dieses Jahr e… [+1323 chars],,de,'Krieg'
https://www.zeit.de/news/2026-06/11/trump-droht-mit-vollstaendiger-kontrolle-ueber-irans-oel,https://www.zeit.de/news/2026-06/11/trump-droht-mit-vollstaendiger-kontrolle-ueber-irans-oel,0,www.zeit.de,Konflikte: Trump droht mit «vollständiger Kontrolle» über Irans Öl,Hier finden Sie Informationen zu dem Thema „Konflikte“. Lesen Sie jetzt „Trump droht mit «vollständiger Kontrolle» über Irans Öl“.,https://img.zeit.de/administratives/sharing/fallback-image-die-zeit/wide__1300x731,2026-06-11T12:41:41Z,,US-Präsident Donald Trump hat mit der Übernahme der für Irans Ölindustrie wichtigen Insel Kharg gedroht. Irgendwann in nicht allzu ferner Zukunft werde man die Insel und andere Öl-Infrastrukturpunkte… [+247 chars],,de,'Öl'
https://www.faz.net/aktuell/politik/inland/damir-dawydow-russischer-general-in-moskau-getoetet-200919944.html,https://www.faz.net/aktuell/politik/inland/damir-dawydow-russischer-general-in-moskau-getoetet-200919944.html,0,www.faz.net,Sprengstoffanschlag auf Militär: Wieder explodierte nahe Moskau ein Auto,Ein weiterer ranghoher Militär stirbt durch eine Explosion. Die Liste solcher Anschläge ist lang. Putin will derartige „Ausrutscher“ eigentlich verhindern.,https://media0.faz.net/image/w1200h627/0c103ab1016b/w6558h3426x0y724o/202606/43601.0.2197042996/der-bmw-x3-ist-ausgebrannt-das.webp,2026-06-11T15:22:44Z,,"Nach allem, was man weiß, war Damir Dawydow im russischen Verteidigungsministerium dafür zuständig, den Nachschub an Raketen und Granaten zu organisieren. Allem Anschein nach war er es, der am frühen… [+4970 chars]",,de,'Putin'
https://www.zeit.de/news/2026-06/11/oelpreise-erstaunlich-stabil-trotz-eskalation-im-nahen-osten,https://www.zeit.de/news/2026-06/11/oelpreise-erstaunlich-stabil-trotz-eskalation-im-nahen-osten,0,www.zeit.de,Entwicklung beim Ölpreis: Neue Wege und Reserven: Ölmarkt trotzt der Krise,Hier finden Sie Informationen zu dem Thema „Entwicklung beim Ölpreis“. Lesen Sie jetzt „Neue Wege und Reserven: Ölmarkt trotzt der Krise“.,https://img.zeit.de/news/2026-06/11/oelpreise-erstaunlich-stabil-trotz-eskalation-im-nahen-osten-image-group/wide__1300x731,2026-06-11T18:19:12Z,,Die Nachricht schlug an den Märkten ein: US-Präsident Donald Trump hat die für Donnerstagabend angekündigten schweren Angriffe auf den Iran abgesagt - und dies mit dem Verhandlungsstand begründet. Pr… [+5407 chars],,de,'Öl'
https://www.zeit.de/news/2026-06/12/bayern-profi-davies-verpasst-wm-auftakt-mit-kanada,https://www.zeit.de/news/2026-06/12/bayern-profi-davies-verpasst-wm-auftakt-mit-kanada,0,www.zeit.de,Schmerzhafter Ausfall: Bayern-Profi Davies verpasst WM-Auftakt mit Kanada,Hier finden Sie Informationen zu dem Thema „Schmerzhafter Ausfall“. Lesen Sie jetzt „Bayern-Profi Davies verpasst WM-Auftakt mit Kanada“.,https://img.zeit.de/news/2026-06/12/bayern-profi-davies-verpasst-wm-auftakt-mit-kanada-image-group/wide__1300x731,2026-06-11T23:31:53Z,,Bayern-Profi Alphonso Davies steht Co-Gastgeber Kanada zum Auftakt der Fußball-WM nicht zur Verfügung. Der Abwehrspieler des deutschen Fußball-Rekordmeisters aus München muss das erste Vorrundenduell… [+1088 chars],,de,'Bayern'
