index,url,valid,domain,title,description,image,published,archive,content,quote,language,keyword
https://www.faz.net/aktuell/finanzen/meine-finanzen/sparen-und-geld-anlegen/geldanlage-wie-sich-anleger-vor-inflation-schuetzen-koennen-19080730.html,https://www.faz.net/aktuell/finanzen/meine-finanzen/sparen-und-geld-anlegen/geldanlage-wie-sich-anleger-vor-inflation-schuetzen-koennen-19080730.html,0,www.faz.net,Geldanlage: Was wirklich vor Inflation schützt,"Die Preise steigen zwar weniger stark, aber die Teuerung bleibt hoch. Aktien und Immobilien bieten Investoren den besten Schutz vor Inflation, heißt es oft. Doch da gibt es ein Problem.",https://media0.faz.net/ppmedia/aktuell/2380693679/1.9088606/facebook_teaser_fplus/flucht-vor-der-inflation.jpg,2023-08-09T06:45:09Z,https://web.archive.org/web/20230809080026/https://www.faz.net/aktuell/finanzen/meine-finanzen/sparen-und-geld-anlegen/geldanlage-wie-sich-anleger-vor-inflation-schuetzen-koennen-19080730.html,"Vom Komiker Danny Kaye stammt der Ausspruch, dass die Wirtschaftswissenschaften die einzige Disziplin sind, in der jedes Jahr auf dieselben Fragen andere Antworten richtig sind. Diese Idee stimmt sic… [+489 chars]",,de,'Inflation'
https://www.businessinsider.de/gruenderszene/technologie/20-millionen-euro-fuer-klimaneutrale-industrien-das-hat-der-kraftblock-gruender-vor/,https://www.businessinsider.de/gruenderszene/technologie/20-millionen-euro-fuer-klimaneutrale-industrien-das-hat-der-kraftblock-gruender-vor/,0,www.businessinsider.de,20 Millionen Euro für klimaneutrale Industrien – das hat der Kraftblock-Gründer vor,"Wann immer Energie aufgewandt wird, um Produkte wie Kunststoff, Papier oder Keramikgeschirr herzustellen, geht fast genauso viel Energie verloren. Industrielle Abwärme entsteht automatisch bei Produktionsprozessen, verpufft aber meist ungenutzt als Gas in der…",https://cdn.businessinsider.de/wp-content/uploads/2023/08/2020_CEO-Dr.-Martin-Schichtel_2.jpg?ver=1691513841,2023-08-09T08:00:00Z,https://web.archive.org/web/20230810152948/https://www.businessinsider.de/gruenderszene/technologie/20-millionen-euro-fuer-klimaneutrale-industrien-das-hat-der-kraftblock-gruender-vor/,"Die Wärmespeicher des Startups fangen ungenutzte Energie auf, die bei Industrie-Prozessen entsteht, und recyceln sie. Neben Frank Thelen investiert seit kurzem auch Öl-Gigant Shell.Wann immer Energie… [+4728 chars]",,de,'Gas'
https://www.wiwo.de/unternehmen/energie/energiepreise-im-grosshandel-sichere-nachhaltige-energie-hat-ihren-preis-und-das-wird-erstmal-so-bleiben/29319874.html,https://www.wiwo.de/unternehmen/energie/energiepreise-im-grosshandel-sichere-nachhaltige-energie-hat-ihren-preis-und-das-wird-erstmal-so-bleiben/29319874.html,0,www.wiwo.de,"Energiepreise im Großhandel: „Sichere, nachhaltige Energie hat ihren Preis, und das wird erstmal so bleiben“","Die Energiepreise sind in den vergangenen Monat stark gesunken. Dennoch geht der Energiekonzern E.On nicht davon aus, dass der Preis für den Großhandel auf das Vorkrisenniveau fällt. Was kommt auf die Privatkunden zu?",https://www.wiwo.de/images/eon-finanzvorstand-marc-spieker/29320328/3-format11240.jpg,2023-08-09T08:00:39Z,https://web.archive.org/web/20230810035516/https://www.wiwo.de/unternehmen/energie/energiepreise-im-grosshandel-sichere-nachhaltige-energie-hat-ihren-preis-und-das-wird-erstmal-so-bleiben/29319874.html,"E.On habe daher die Tarife in mehreren Phasen angepasst. Kunden, die zuletzt eine Preiserhöhung bekommen hätten, seien bis dahin über einen längeren Zeitraum auf vergleichsweise niedrigen Preisen gef… [+1049 chars]",,de,'Nachhaltige Energie'
https://www.n-tv.de/wirtschaft/EON-Strompreise-frueherer-Jahre-kommen-nicht-zurueck-article24314230.html,https://www.n-tv.de/wirtschaft/EON-Strompreise-frueherer-Jahre-kommen-nicht-zurueck-article24314230.html,0,www.n-tv.de,Trotz sinkender Kosten: Eon: Strompreise früherer Jahre kommen nicht zurück,"Die Energiekrise lässt die Preise teils horrend steigen. Die Ankündigung von EON, einige Preise zu senken, sorgt für ein wenig Entspannung. Allerdings würden Strompreise wie vor Pandemie und Ukraine-Krieg nicht mehr möglich sein, erklärt Finanzvorstand Spieke…",https://bilder1.n-tv.de/img/incoming/crop24314284/726132335-cImg_16_9-w1200/419890333.jpg,2023-08-09T08:15:55Z,,"Die Energiekrise lässt die Preise teils horrend steigen. Die Ankündigung von EON, einige Preise zu senken, sorgt für ein wenig Entspannung. Allerdings würden Strompreise wie vor Pandemie und Ukraine-… [+2973 chars]",,de,'Nachhaltige Energie'
https://www.telepolis.de/features/Investiert-Bundesregierung-Milliarden-in-neue-fossile-Gaskraftwerke-9238586.html,https://www.telepolis.de/features/Investiert-Bundesregierung-Milliarden-in-neue-fossile-Gaskraftwerke-9238586.html,0,www.telepolis.de,Investiert Bundesregierung Milliarden in neue fossile Gaskraftwerke?,"Energie und Klima – kompakt: Wirtschaftsministerium will für Dunkelflauten Kraftwerke bauen lassen. Grüner Wasserstoff im Mittelpunkt, auch fossile Gaskraftwerke sind erlaubt.",https://heise.cloudimg.io/bound/1200x1200/q85.png-lossy-85.webp-lossy-85.foil1/_www-heise-de_/imgs/18/4/2/8/3/1/7/9/h2-strategie_ho-4a6a7d68767f6c86.png,2023-08-09T10:00:00Z,,"Energie und Klima kompakt: Wirtschaftsministerium will für Dunkelflauten Kraftwerke bauen lassen. Grüner Wasserstoff im Mittelpunkt, auch fossile Gaskraftwerke sind erlaubt.
Wir hatten letzte Woche … [+5949 chars]",,de,'fossile Energie'
https://www.handelsblatt.com/politik/deutschland/energie-europaeischer-gaspreis-steigt-mehr-als-20-prozent-gaspreisbremse-kostet-laut-studie-viel-weniger-als-gedacht/28616386.html,https://www.handelsblatt.com/politik/deutschland/energie-europaeischer-gaspreis-steigt-mehr-als-20-prozent-gaspreisbremse-kostet-laut-studie-viel-weniger-als-gedacht/28616386.html,0,www.handelsblatt.com,+++ Energiekrise +++: Europäischer Gaspreis steigt mehr als 20 Prozent – Gaspreisbremse kostet laut Studie viel weniger als gedacht,Deutsche Gasspeicher knapp 90 Prozent gefüllt +++ Eon rechnet mit dauerhaft höheren Energiepreisen +++ Kartellamt hält RWE bei Stromerzeugung weiter für marktbeherrschend +++ Der Newsblog.,https://www.handelsblatt.com/images/erdgasleitung/29321250/3-format2003.jpg,2023-08-09T12:46:45Z,,"<li>Herr Max Heck09.08.2023, 14:57 Uhr
In 2 Jahren sind Habeck und Baerbock mit der grünen Gefolgschaft -näheren Kommentar dazu erspare ich mir und den Lesern- Geschichte. 
Und Linke sowieso! 
</l… [+4881 chars]",,de,'Gas'
https://www.sueddeutsche.de/wirtschaft/erdgas-gaspreis-lng-1.6112132,https://www.sueddeutsche.de/wirtschaft/erdgas-gaspreis-lng-1.6112132,0,www.sueddeutsche.de,Energieversorgung: Gaspreis steigt um mehr als 20 Prozent,Europäisches Erdgas wird an der Börse in Amsterdam plötzlich deutlich teurer gehandelt. Was dahintersteckt.,https://www.sueddeutsche.de/image/sz.1.6093399/1200x675?v=1691588203,2023-08-09T13:34:34Z,,Europäisches Erdgas wird an der Börse in Amsterdam plötzlich deutlich teurer gehandelt. Was dahintersteckt.Der Großhandelspreis für europäisches Erdgas ist am Mittwoch wegen möglicher Probleme beim A… [+1289 chars],,de,'Gas'
https://www.faz.net/aktuell/politik/inland/das-koennte-putin-von-bismarck-lernen-die-macht-der-emotionen-19037657.html,https://www.faz.net/aktuell/politik/inland/das-koennte-putin-von-bismarck-lernen-die-macht-der-emotionen-19037657.html,0,www.faz.net,Die Macht der Emotionen: Gefühlspolitik à la mode,"Gefühle sind der Treibstoff, um die Massen für politische Zwecke zu instrumentalisieren. Doch die wahre Staatskunst besteht darin, gefühlspolitische Botschaften zum Mittel vernunftgeleiteter Politik zu machen. Ein Gastbeitrag.",https://media1.faz.net/ppmedia/aktuell/979465959/1.9081309/facebook_teaser_fplus/gute-miene-zum-boesen-spiel.jpg,2023-08-09T13:48:58Z,https://web.archive.org/web/20230810021401/https://www.faz.net/aktuell/politik/inland/das-koennte-putin-von-bismarck-lernen-die-macht-der-emotionen-19037657.html,"Wer wollte es bestreiten: Gefühle sind à la mode, und Gefühlspolitik ist es nicht minder. Der Begriff stammt aus dem frühen 19. Jahrhundert, schon Reichskanzler Otto von Bismarck hat ihn benutzt. Er … [+838 chars]",,de,'Gas'
https://www.wiwo.de/my/unternehmen/it/tsmc-ansiedlung-in-dresden-eine-neue-chipfabrik-kommt-doch-die-abhaengigkeit-von-china-bleibt-/29312834.html,https://www.wiwo.de/my/unternehmen/it/tsmc-ansiedlung-in-dresden-eine-neue-chipfabrik-kommt-doch-die-abhaengigkeit-von-china-bleibt-/29312834.html,0,www.wiwo.de,"TSMC-Ansiedlung in Dresden : Eine neue Chipfabrik kommt, doch die Abhängigkeit von China bleibt","Deutschland muss unabhängiger von China werden. Es ist also eine gute Nachricht, dass die hiesige Chipindustrie mit einem Halbleiterwerk in Dresden gefördert wird. Eine Achillesferse gegenüber China bleibt aber bestehen.",https://www.wiwo.de/images/tsmc-dresden-imago-231981512-dpa/29315848/4-format11240.jpg,2023-08-09T14:15:00Z,https://web.archive.org/web/20230811003900/https://www.wiwo.de/my/unternehmen/it/tsmc-ansiedlung-in-dresden-eine-neue-chipfabrik-kommt-doch-die-abhaengigkeit-von-china-bleibt-/29312834.html,"TSMC-Ansiedlung in Dresden Eine neue Chipfabrik kommt, doch die Abhängigkeit von China bleibt 
Deutschland muss unabhängiger von China werden. Da ist es eine gute Nachricht, dass die hiesige Chipind… [+15248 chars]",,de,'Abhängigkeit'
https://www.handelsblatt.com/unternehmen/energie/energiekosten-so-teuer-wird-heizen-mit-oel-und-gas-durch-die-neuen-co2-preise/29321714.html,https://www.handelsblatt.com/unternehmen/energie/energiekosten-so-teuer-wird-heizen-mit-oel-und-gas-durch-die-neuen-co2-preise/29321714.html,0,www.handelsblatt.com,Energiekosten: So teuer wird Heizen mit Öl und Gas durch die neuen CO2-Preise,"Wer Emissionen verursacht, wird in den kommenden Jahren immer stärker zur Kasse gebeten. Verbraucher können ausrechnen, wie sehr sie das bis 2027 treffen wird.",https://www.handelsblatt.com/images/oelheizung/29321724/2-format2003.jpg,2023-08-09T16:06:19Z,https://web.archive.org/web/20230810033506/https://www.handelsblatt.com/unternehmen/energie/energiekosten-so-teuer-wird-heizen-mit-oel-und-gas-durch-die-neuen-co2-preise/29321714.html,"ÖlheizungBei Öl sind die CO2-Kosten am höchsten. Quelle: Imago
Düsseldorf Wer mit Öl oder Gas heizt, muss künftig mit größeren Preissteigerungen rechnen als zuletzt. Die Bundesregierung hat einen ne… [+957 chars]",,de,'Gas'
https://www.stern.de/news/klima--co2-preis--warum-tanken-und-heizen-teurer-werden-33723474.html,https://www.stern.de/news/klima--co2-preis--warum-tanken-und-heizen-teurer-werden-33723474.html,0,www.stern.de,Klima: CO2-Preis: Warum Tanken und Heizen teurer werden,Rund 212 Milliarden Euro will die Regierung von 2024 bis 2027 in Klimaschutz und Transformation der Wirtschaft investieren - über ein Sondervermögen. Dessen Einnahmen steigen. Was das für Verbraucher bedeutet.,https://image.stern.de/33723476/t/AM/v1/w1440/r1.7778/-/09--urnnewsmldpacom2009010123080999781783v3w800h600l773t651r2051b1515jpeg---b05230fd472a0f7d.jpg,2023-08-09T16:26:29Z,https://web.archive.org/web/20230810092306/https://www.stern.de/news/klima--co2-preis--warum-tanken-und-heizen-teurer-werden-33723474.html,Rund 212 Milliarden Euro will die Regierung von 2024 bis 2027 in Klimaschutz und Transformation der Wirtschaft investieren - über ein Sondervermögen. Dessen Einnahmen steigen. Was das für Verbraucher… [+6969 chars],,de,'Heizen'
https://www.tagesschau.de/wirtschaft/verbraucher/energiepreise-anbieterwechsel-100.html,https://www.tagesschau.de/wirtschaft/verbraucher/energiepreise-anbieterwechsel-100.html,0,www.tagesschau.de,Sinkende Energiepreise: Anbieterwechsel kann sich lohnen,Die Gas-und Strompreise sind inzwischen sehr viel niedriger als noch vor einem Jahr. Für Privatkunden kann sich ein Versorgerwechsel lohnen. Allerdings könnten die sinkenden Gaspreise zum Problem für den Klimaschutz werden. Von David Zajonz.,https://images.tagesschau.de/image/ae398b6e-5c17-44a6-ba89-8e48bc747dfc/AAABiHYPph0/AAABibBxqrQ/16x9-1280/stromrechnung-108.jpg,2023-08-09T16:49:00Z,,"Stand: 09.08.2023 18:49 Uhr
Die Gas-und Strompreise sind inzwischen sehr viel niedriger als noch vor einem Jahr. Für Privatkunden kann sich ein Versorgerwechsel lohnen. Allerdings könnten die sinken… [+3600 chars]",,de,'Gasspeicher'
https://www.zeit.de/news/2023-08/09/fc-bayern-mueller-und-choupo-moting-zurueck-im-teamtraining,https://www.zeit.de/news/2023-08/09/fc-bayern-mueller-und-choupo-moting-zurueck-im-teamtraining,0,www.zeit.de,Bundesliga: FC Bayern: Müller und Choupo-Moting zurück im Teamtraining,,,2023-08-09T17:03:41Z,https://web.archive.org/web/20230811070310/https://www.zeit.de/news/2023-08/09/fc-bayern-mueller-und-choupo-moting-zurueck-im-teamtraining,"When browsing with ads:
We collect personal data and also transmit it to third-party providers
 that help us improve and finance our digital content. Some of the information stored on your device, … [+821 chars]",,de,'Bayern'
https://www.welt.de/politik/deutschland/video246831418/Tanken-und-Heizen-wird-teurer-Steigender-CO2-Preis-allemal-besser-als-irgendwelche-Heizungsgesetze.html,https://www.welt.de/politik/deutschland/video246831418/Tanken-und-Heizen-wird-teurer-Steigender-CO2-Preis-allemal-besser-als-irgendwelche-Heizungsgesetze.html,0,www.welt.de,„Steigender CO2-Preis allemal besser als irgendwelche Heizungsgesetze“,"Tanken und Heizen mit fossilen Energien wird in 2024 teurer als gedacht. Die Bundesregierung will den CO2-Preis zum 1. Januar auf 40 Euro pro Tonne erhöhen - „ein transparentes und vernünftiges Marktinstrument“, findet Nikolaus Doll, WELT-Redakteur Innenpolit…",https://img.welt.de/img/politik/deutschland/mobile246831422/5391358007-ci16x9-w1200/ONL-Doll-18-00-5672-jpg.jpg,2023-08-09T17:59:29Z,https://web.archive.org/web/20230818152653/https://www.welt.de/politik/deutschland/video246831418/Tanken-und-Heizen-wird-teurer-Steigender-CO2-Preis-allemal-besser-als-irgendwelche-Heizungsgesetze.html,"Die WELT als ePaper: Die vollständige Ausgabe steht Ihnen bereits am Vorabend zur Verfügung so sind Sie immer hochaktuell informiert. Weitere Informationen: http://epaper.welt.de 
 Der Kurz-Link die… [+49 chars]",,de,'Energie sparen'
https://www.tagesschau.de/ausland/afrika/niger-158.html,https://www.tagesschau.de/ausland/afrika/niger-158.html,0,www.tagesschau.de,ECOWAS berät Lage in Niger: Droht ein neuer regionaler Krieg?,Im Zuge ihres Ultimatums an die Putschisten in Niger hat die westafrikanische Staatengemeinschaft ECOWAS mit Gewalt gedroht. Heute will sie das weitere Vorgehen nach dem Verstreichen der Frist besprechen. Von Jens Borchers.,https://images.tagesschau.de/image/95745823-fb1c-46a6-97aa-f161bbd196f9/AAABid0QPjs/AAABibBxqrQ/16x9-1280/niger-putschisten-100.jpg,2023-08-10T01:33:16Z,https://web.archive.org/web/20230810063543/https://www.tagesschau.de/ausland/afrika/niger-158.html,"Stand: 10.08.2023 03:33 Uhr
Im Zuge ihres Ultimatums an die Putschisten in Niger hat die westafrikanische Staatengemeinschaft ECOWAS mit Gewalt gedroht. Heute will sie das weitere Vorgehen nach dem … [+2930 chars]",,de,'Krieg'
https://www.zeit.de/news/2023-08/10/gas-stroemt-aus-undichtem-fluessiggastank-aus,https://www.zeit.de/news/2023-08/10/gas-stroemt-aus-undichtem-fluessiggastank-aus,0,www.zeit.de,Rhein-Sieg-Kreis: Gas strömt aus undichtem Flüssiggastank aus,,,2023-08-10T03:36:52Z,https://web.archive.org/web/20230811114935/https://www.zeit.de/news/2023-08/10/gas-stroemt-aus-undichtem-fluessiggastank-aus,"When browsing with ads:
We collect personal data and also transmit it to third-party providers
 that help us improve and finance our digital content. Some of the information stored on your device, … [+821 chars]",,de,'Gas'
https://www.welt.de/politik/deutschland/video246833054/CO2-Preis-steigt-Tanken-und-Heizen-werden-deutlich-teurer-als-erwartet.html,https://www.welt.de/politik/deutschland/video246833054/CO2-Preis-steigt-Tanken-und-Heizen-werden-deutlich-teurer-als-erwartet.html,0,www.welt.de,Tanken und Heizen werden deutlich teurer als erwartet,Die Bundesregierung hat Details des Klima- und Transformationsfonds beschlossen. Im kommenden Jahr steigt der nationale CO2-Preis deutlich – was das Tanken und Heizen mit fossiler Energie verteuert.,https://img.welt.de/img/incoming/mobile246833052/3241350167-ci16x9-w1200/418782907-jpg.jpg,2023-08-10T06:19:37Z,https://web.archive.org/web/20230810145844/https://www.welt.de/politik/deutschland/video246833054/CO2-Preis-steigt-Tanken-und-Heizen-werden-deutlich-teurer-als-erwartet.html,"Die WELT als ePaper: Die vollständige Ausgabe steht Ihnen bereits am Vorabend zur Verfügung so sind Sie immer hochaktuell informiert. Weitere Informationen: http://epaper.welt.de 
 Der Kurz-Link die… [+49 chars]",,de,'fossile Energie'
https://www.zeit.de/video/2023-08/6332775503112/ukraine-krieg-mehrere-menschen-sterben-bei-russischem-angriff-auf-saporischschja,https://www.zeit.de/video/2023-08/6332775503112/ukraine-krieg-mehrere-menschen-sterben-bei-russischem-angriff-auf-saporischschja,0,www.zeit.de,Ukraine-Krieg: Mehrere Menschen sterben bei russischem Angriff auf Saporischschja,"Präsident Wolodymyr Selenskyj teilte über Telegram mit, dass drei Menschen bei dem Angriff gestorben seien. Laut örtlicher Behörden wurde ein Wohnquartier getroffen.",,2023-08-10T07:53:29Z,,"When browsing with ads:
We collect personal data and also transmit it to third-party providers
 that help us improve and finance our digital content. Some of the information stored on your device, … [+821 chars]",,de,'Krieg'
https://www.stern.de/wirtschaft/steigender-co2-preis-erhoeht-heizkosten-fuer-gas--und-heizoelkunden-33724812.html,https://www.stern.de/wirtschaft/steigender-co2-preis-erhoeht-heizkosten-fuer-gas--und-heizoelkunden-33724812.html,0,www.stern.de,Rechnung von Check24: Steigender CO2-Preis erhöht Heizkosten für Gas- und Heizölkunden,"Steigt der CO2-Preis, steigen auch die Heizkosten. Das Vergleichsportal Check24 rechnet vor, welche Zusatzkosten auf den Einzelnen zukommen könnten.",https://image.stern.de/33724850/t/tq/v2/w1440/r1.7778/-/co2-preis-heizkosten.jpg,2023-08-10T08:02:01Z,https://web.archive.org/web/20230811103026/https://www.stern.de/wirtschaft/steigender-co2-preis-erhoeht-heizkosten-fuer-gas--und-heizoelkunden-33724812.html,"Steigt der CO2-Preis, steigen auch die Heizkosten. Das Vergleichsportal Check24 rechnet vor, welche Zusatzkosten auf den Einzelnen zukommen könnten.
Die Bundesregierung will Medienberichten zufolge … [+1646 chars]",,de,'Fossile Energie'
https://consent.google.com/ml?continue=https://news.google.com/rss/articles/CBMihAFodHRwczovL3dlYi5kZS9tYWdhemluZS9wb2xpdGlrL3J1c3NsYW5kLWtyaWVnLXVrcmFpbmUva3JpZWctdWtyYWluZS1saXZlLXRpY2tlci11a3JhaW5pc2NoZS10cnVwcGVuLWZyb250YWJzY2huaXR0ZW4tZHJ1Y2stMzg1MTMxNDbSAQA?oc%3D5&gl=FR&hl=en-US&cm=2&pc=n&src=1,https://consent.google.com/ml?continue=https://news.google.com/rss/articles/CBMihAFodHRwczovL3dlYi5kZS9tYWdhemluZS9wb2xpdGlrL3J1c3NsYW5kLWtyaWVnLXVrcmFpbmUva3JpZWctdWtyYWluZS1saXZlLXRpY2tlci11a3JhaW5pc2NoZS10cnVwcGVuLWZyb250YWJzY2huaXR0ZW4tZHJ1Y2stMzg1MTMxNDbSAQA?oc%3D5&gl=FR&hl=en-US&cm=2&pc=n&src=1,0,consent.google.com,Krieg in der Ukraine im Live-Ticker: Ukrainische Truppen an vielen Frontabschnitten unter Druck - WEB.DE News,"<ol><li>Krieg in der Ukraine im Live-Ticker: Ukrainische Truppen an vielen Frontabschnitten unter Druck  WEB.DE News
</li><li>Liveblog: ++ Ukrainische Truppen unter Druck ++ | tagesschau.de  tagesschau.de
</li><li>Heftige Russen-Angriffe: Ukraine-Truppen an…",,2023-08-10T08:07:39Z,,"We use cookies and data to<ul><li>Deliver and maintain Google services</li><li>Track outages and protect against spam, fraud, and abuse</li><li>Measure audience engagement and site statistics to unde… [+1131 chars]",,de,'Krieg'
https://consent.google.com/ml?continue=https://news.google.com/rss/articles/CBMib2h0dHBzOi8vd3d3LnpkZi5kZS9uYWNocmljaHRlbi9wb2xpdGlrL2NoZXJzb24tbWFyc2NoZmx1Z2tvZXJwZXItZ2VnZW5vZmZlbnNpdmUtdWtyYWluZS1rcmllZy1ydXNzbGFuZC0xMDAuaHRtbNIBb2h0dHBzOi8vYW1wLnpkZi5kZS9uYWNocmljaHRlbi9wb2xpdGlrL2NoZXJzb24tbWFyc2NoZmx1Z2tvZXJwZXItZ2VnZW5vZmZlbnNpdmUtdWtyYWluZS1rcmllZy1ydXNzbGFuZC0xMDAuaHRtbA?oc%3D5&gl=FR&hl=en-US&cm=2&pc=n&src=1,https://consent.google.com/ml?continue=https://news.google.com/rss/articles/CBMib2h0dHBzOi8vd3d3LnpkZi5kZS9uYWNocmljaHRlbi9wb2xpdGlrL2NoZXJzb24tbWFyc2NoZmx1Z2tvZXJwZXItZ2VnZW5vZmZlbnNpdmUtdWtyYWluZS1rcmllZy1ydXNzbGFuZC0xMDAuaHRtbNIBb2h0dHBzOi8vYW1wLnpkZi5kZS9uYWNocmljaHRlbi9wb2xpdGlrL2NoZXJzb24tbWFyc2NoZmx1Z2tvZXJwZXItZ2VnZW5vZmZlbnNpdmUtdWtyYWluZS1rcmllZy1ydXNzbGFuZC0xMDAuaHRtbA?oc%3D5&gl=FR&hl=en-US&cm=2&pc=n&src=1,0,consent.google.com,"Militärexperte im Interview: Lange: Russland nutzt ""Strategie des Terrors"" - ZDFheute","<ol><li>Militärexperte im Interview: Lange: Russland nutzt ""Strategie des Terrors""  ZDFheute
</li><li>„Dann ist dieser Moment gekommen, wo der Krieg strategisch gewonnen ist“  FOCUS Online
</li><li>Keine schnellen Erfolge für Ukraine: Militärexperte Masala …",,2023-08-10T08:15:16Z,,"We use cookies and data to<ul><li>Deliver and maintain Google services</li><li>Track outages and protect against spam, fraud, and abuse</li><li>Measure audience engagement and site statistics to unde… [+1131 chars]",,de,'Krieg'
https://taz.de/-Nachrichten-im-Ukraine-Krieg-/!5953640/,https://taz.de/-Nachrichten-im-Ukraine-Krieg-/!5953640/,0,taz.de,+++ Nachrichten im Ukraine-Krieg +++: Russland meldet Drohnenabschuss,Die russische Regierung berichtet von Drohnenangriffen auf Moskau und die Krim. Derweil gibt es durch einen russischen Luftangriff auf Saporischschja drei Tote.,https://taz.de/picture/6442693/948/33368391-1.jpeg,2023-08-10T08:56:00Z,https://web.archive.org/web/20230811103908/https://taz.de/-Nachrichten-im-Ukraine-Krieg-/!5953640/,"Die russische Regierung berichtet von Drohnenangriffen auf Moskau und die Krim. Derweil gibt es durch einen russischen Luftangriff auf Saporischschja drei Tote.
Rettungsarbeiten nach den Angriffen a… [+4788 chars]",,de,'Krieg'
https://www.tagesspiegel.de/kultur/ukrainisches-kriegstagebuch-159-rote-bete-gazpacho-in-charkiw-10289824.html,https://www.tagesspiegel.de/kultur/ukrainisches-kriegstagebuch-159-rote-bete-gazpacho-in-charkiw-10289824.html,0,www.tagesspiegel.de,Ukrainisches Kriegstagebuch (159): Rote-Bete-Gazpacho in Charkiw,"Der ukrainische Autor, DJ und Musiker Yuriy Gurzhy lebt seit 1995 in Berlin. Hier schreibt er über den Krieg in der Ukraine.",https://www.tagesspiegel.de/kultur/images/fdd24f78-8125-47ae-b02e-3b992a2a95d8jpg/alternates/BASE_16_9_W1400/fdd24f78-8125-47ae-b02e-3b992a2a95d8jpg.jpeg,2023-08-10T09:30:41Z,https://web.archive.org/web/20230810095403/https://www.tagesspiegel.de/kultur/ukrainisches-kriegstagebuch-159-rote-bete-gazpacho-in-charkiw-10289824.html,"3.8.2023Im Dezember 2022 wurde mir kurz vor meiner Reise in die Ukraine bewusst, dass mein Zug Lwiw spät in der Nacht erreichen würde. Wo soll ich denn um drei Uhr nachts mitten in der Sperrstunde hi… [+4569 chars]",,de,'Krieg'
https://www.bild.de/politik/ausland/politik-ausland/paul-ronzheimer-startet-neuen-podcast-der-krieg-ist-irre-unheimlich-84997860.bild.html,https://www.bild.de/politik/ausland/politik-ausland/paul-ronzheimer-startet-neuen-podcast-der-krieg-ist-irre-unheimlich-84997860.bild.html,0,www.bild.de,Paul Ronzheimer startet neuen Podcast - Der Krieg ist „irre unheimlich“,Seit Russlands Überfall auf die Ukraine berichtet BILD-Vize Paul Ronzheimer unaufhörlich über den Krieg.,"https://images.bild.de/64d4a20f082aab10e0c3753a/5572328a90c035d88b2b087c50ef31e8,db97ff83?w=1280",2023-08-10T09:41:46Z,,"Seit Russlands Überfall auf die Ukraine berichtet BILD-Vize Paul Ronzheimer unaufhörlich über den Krieg: Er interviewte mehrfach Präsident Wolodymyr Selenskyj (45), reiste an die Front der Gegenoffen… [+2442 chars]",,de,'Krieg'
https://www.zeit.de/wissen/umwelt/2023-08/klimawandel-kalter-krieg-no-future-generation-klima-ausreden,https://www.zeit.de/wissen/umwelt/2023-08/klimawandel-kalter-krieg-no-future-generation-klima-ausreden,0,www.zeit.de,Klimawandel: Aber den Kalten Krieg haben wir auch überlebt …,Viele fühlen sich bei der Klimakrise ans Wettrüsten erinnert. Doch hier lauert eine psychologische Falle: Der Kalte Krieg ist mit dem Klimawandel nicht zu vergleichen.,,2023-08-10T09:42:53Z,https://web.archive.org/web/20230811103530/https://www.zeit.de/wissen/umwelt/2023-08/klimawandel-kalter-krieg-no-future-generation-klima-ausreden,"When browsing with ads:
We collect personal data and also transmit it to third-party providers
 that help us improve and finance our digital content. Some of the information stored on your device, … [+821 chars]",,de,'Krieg'
