index,url,valid,domain,title,description,image,published,archive,content,quote,language,keyword
https://www.zeit.de/2024/29/krieg-sudan-kriegsverbrechen-hunger-waffe-tod-paramilitaer,https://www.zeit.de/2024/29/krieg-sudan-kriegsverbrechen-hunger-waffe-tod-paramilitaer,0,www.zeit.de,Krieg im Sudan: Das geht uns an!,"Im Sudan droht die schlimmste Vertreibungskrise der Welt. Millionen Menschen dürften sterben, weil Hunger als Waffe eingesetzt wird. Was Europa jetzt tun kann – und muss.",https://img.zeit.de/2024/29/krieg-sudan-kriegsverbrechen-hunger-waffe-tod-paramilitaer-teaser-2/wide__1300x731,2024-07-03T12:52:39Z,,"Sie sind der Krisen und Kriege müde? Willkommen im Club. Ich bin es auch, wir alle sind es. Wegzuschauen ist in diesen Zeiten sehr verlockend. Es ist im Fall des Sudan nur leider keine Option. Auch, … [+5308 chars]",,de,'Krieg'
https://www.stern.de/gesellschaft/regional/thueringen/nachhaltige-energiespeicher--forscher-wollen-aus-holzabfall-batterie-materialien-gewinnen-34850470.html,https://www.stern.de/gesellschaft/regional/thueringen/nachhaltige-energiespeicher--forscher-wollen-aus-holzabfall-batterie-materialien-gewinnen-34850470.html,0,www.stern.de,Nachhaltige Energiespeicher: Forscher wollen aus Holzabfall Batterie-Materialien gewinnen,In Batterien schlummern oft kritische Metalle wie Lithium oder Kobalt. Jenaer Forscher wollen diese Metalle ersetzen. Wächst die Alternative auf - oder besser gesagt in - Bäumen?,https://image.stern.de/34850472/t/DN/v1/w1440/r1.7778/-/03--lzmicuixwqv9axw800h600jpeg---8094912ed45a26f3.jpg,2024-07-03T12:54:02Z,,"In Batterien schlummern oft kritische Metalle wie Lithium oder Kobalt. Jenaer Forscher wollen diese Metalle ersetzen. Wächst die Alternative auf - oder besser gesagt in - Bäumen?
Aus Abfallstoffen d… [+1274 chars]",,de,'Nachhaltige Energie'
https://www.faz.net/aktuell/sport/fussball/bundesliga/bundesliga-start-fuer-fc-bayern-geht-es-zum-vfl-wolfsburg-19833658.html,https://www.faz.net/aktuell/sport/fussball/bundesliga/bundesliga-start-fuer-fc-bayern-geht-es-zum-vfl-wolfsburg-19833658.html,0,www.faz.net,Bundesliga-Start: Rhein-Derby eröffnet die Saison,Meister Leverkusen muss zum Saisonauftakt nach Mönchengladbach. Für den FC Bayern geht es zum VfL Wolfsburg. Stuttgart erwartet ein bristantes Spiel. Wer spielt wo gegen wen?,https://media0.faz.net/ppmedia/aktuell/1166320569/1.9833538/facebook_teaser/daumen-hoch-xabi-alonso-und.jpg,2024-07-04T10:51:16Z,,"Eröffnet wird die Saison am 23. August mit dem Rhein-Derby zwischen Borussia Mönchengladbach und Meister Bayer Leverkusen.
Auch auf Vizemeister VfB Stuttgart wartet zum Saisonstart ein brisantes Der… [+860 chars]",,de,'Bayern'
https://www.basicthinking.de/blog/2024/07/04/anteil-erneuerbarer-energien-deutschland/,https://www.basicthinking.de/blog/2024/07/04/anteil-erneuerbarer-energien-deutschland/,0,www.basicthinking.de,Neuer Rekord: Anteil erneuerbarer Energien in Deutschland nimmt zu,"Der Anteil erneuerbarer Energien in Deutschland nimmt immer weiter zu. Im ersten Halbjahr 2024 verzeichneten Windräder, Solaranlagen und Co. sogar einen neuen Rekord bei der Deckung des Strombedarfs.  Erneuerbare Energien haben im ersten Halbjahr 2024 rund 58…",https://www.basicthinking.de/blog/wp-content/uploads/2024/07/energierekord-erneuerbare-energie.jpg,2024-07-04T10:55:23Z,,"Der Anteil erneuerbarer Energien in Deutschland nimmt immer weiter zu. Im ersten Halbjahr 2024 verzeichneten Windräder, Solaranlagen und Co. sogar einen neuen Rekord bei der Deckung des Strombedarfs.… [+2525 chars]",,de,'Windräder'
https://www.zeit.de/politik/ausland/2024-07/russische-desinformation-kampagnen-deutschland-berichte-geheimdienstpapiere,https://www.zeit.de/politik/ausland/2024-07/russische-desinformation-kampagnen-deutschland-berichte-geheimdienstpapiere,0,www.zeit.de,Ukraine-Krieg: Interne Dokumente zeigen laut Bericht russische Desinformationsdoktrin,"Mit Propaganda versucht Russland antiukrainische Stimmungen zu schüren, auch in Deutschland. Geheimdienstpapiere sollen zeigen, welche Strategien zum Einsatz kommen.",https://img.zeit.de/politik/ausland/2024-07/russland-desinformation-geheimdienstpapiere-berichte-bild/wide__1300x731,2024-07-04T23:04:30Z,,"Russische Geheimdienstpapiere deuten darauf hin, dass Deutschland eines der wichtigen Zielländer russischer Desinformationskampagnen ist. Das berichten der Spiegel und das Investigativportal The Insi… [+3949 chars]",,de,'Krieg'
https://www.zeit.de/politik/ausland/2024-07/wladimir-putin-russland-propaganda-politiker-5vor8,https://www.zeit.de/politik/ausland/2024-07/wladimir-putin-russland-propaganda-politiker-5vor8,0,www.zeit.de,Russische Propaganda: Worüber Putin gerade ganz zufrieden sein kann,"Russlands Propaganda wettert gegen Liberalismus und Demokratie, wo es nur geht. Angesichts der Selbstdemontage westlicher Politiker muss sie auch gar nicht so viel lügen.",https://img.zeit.de/politik/ausland/2024-07/wladimir-putin-2/wide__1300x731,2024-07-05T07:01:26Z,,"Hätten Sie gedacht, dass russische Staatsmedien in allerjüngster Zeit nicht mehr durchgehend lügen müssen, ja bisweilen sogar die Realität wiedergeben? Das fällt mir vor allem bei den Berichten über … [+760 chars]",,de,'Putin'
https://www.zeit.de/news/2024-07/05/orban-frieden-schafft-man-nicht-vom-bequemen-sessel-aus,https://www.zeit.de/news/2024-07/05/orban-frieden-schafft-man-nicht-vom-bequemen-sessel-aus,0,www.zeit.de,Ukraine-Krieg: Orban: Frieden schafft man nicht vom bequemen Sessel aus,Hier finden Sie Informationen zu dem Thema „Ukraine-Krieg“. Lesen Sie jetzt „Orban: Frieden schafft man nicht vom bequemen Sessel aus“.,https://img.zeit.de/news/2024-07/05/orban-frieden-schafft-man-nicht-vom-bequemen-sessel-aus-image-group/wide__1300x731,2024-07-05T08:19:57Z,,"Ungarns Regierungschef Viktor Orban inszeniert sich zunehmend als Friedensstifter im Ukraine-Krieg. «Man kann Frieden nicht von einem bequemen Sessel in Brüssel aus schaffen», schrieb Orban auf der O… [+2668 chars]",,de,'Krieg'
https://www.zeit.de/politik/ausland/2024-07/viktor-orb-n-zu-treffen-mit-putin-in-moskau-eingetroffen,https://www.zeit.de/politik/ausland/2024-07/viktor-orb-n-zu-treffen-mit-putin-in-moskau-eingetroffen,0,www.zeit.de,Umstrittener Besuch: Viktor Orbán zu Treffen mit Putin in Moskau eingetroffen,Nach einem Besuch in Kiew ist Ungarns Ministerpräsident überraschend nach Russland gereist. Dort will Orbán Wladimir Putin treffen. Die EU kritisiert den Besuch.,https://img.zeit.de/administratives/eilmeldung-share-image/wide__1300x731,2024-07-05T09:59:03Z,,"Der ungarische Ministerpräsident Viktor Orbán ist nach einem Besuch 
in Kiew überraschend nach Russland weitergereist. Orbáns Sprecher 
Bertalan Havasi bestätigte entsprechende Berichte, wonach ein… [+1373 chars]",,de,'Putin'
https://www.focus.de/politik/ausland/gas-revolte-im-nachbarland-blutgeld-fuer-energie-wieso-oesterreich-so-sehr-am-russischen-gas-haengt_id_260111159.html,https://www.focus.de/politik/ausland/gas-revolte-im-nachbarland-blutgeld-fuer-energie-wieso-oesterreich-so-sehr-am-russischen-gas-haengt_id_260111159.html,0,www.focus.de,Milliarden Euro für Putin - „Blutgeld“ für Energie? Wieso Österreich so sehr am russischen Gas hängt,Von Polen bis nach Italien haben sich die EU-Länder weitgehend vom russischen Gas entkoppeln können. Österreich dagegen hängt noch zu mehr als 80 Prozent am russischen Tropf. Jetzt läuft jedoch ein entscheidender Vertrag aus. Was tun?Von Autor Oliver Stock,https://p6.focus.de/img/panorama/id_248776037/der-russische-praesident-wladimir-putin-nimmt-nach-angaben-des-moskauer-staatsfernsehens-an-diesem-mittwoch-an-einem-virtuellen-g20-gipfel-teil..jpg?im=Crop%3D%280%2C73%2C1000%2C500%29%3BResize%3D%281200%2C627%29&impolicy=perceptual&quality=mediumHigh&hash=855c30f9c758ded44b03b8cd286b2169ec44ae3d9375a7b6f748df58fe2bf196,2024-07-05T10:48:14Z,,Von Polen bis nach Italien haben sich die EU-Länder weitgehend vom russischen Gas entkoppeln können. Österreich dagegen hängt noch zu mehr als 80 Prozent am russischen Tropf. Jetzt läuft jedoch ein e… [+5054 chars],,de,'Putin'
https://www.nzz.ch/sport/fussball/em-2024-englands-nationalcoach-wechselt-gegen-die-schweiz-das-spielsystem-ld.1838255,https://www.nzz.ch/sport/fussball/em-2024-englands-nationalcoach-wechselt-gegen-die-schweiz-das-spielsystem-ld.1838255,0,www.nzz.ch,Radikaler Taktikwechsel? So will Gareth Southgate mit England gegen die Schweiz bestehen,Vor dem Spiel gegen die Schweiz nimmt der englische Nationaltrainer Änderungen im Spielsystem vor. Doch die Abhängigkeit von Einzelspielern bleibt gross.,"https://img.nzz.ch/2024/07/05/3a296aaf-4e5b-40a7-9dac-370b887f98a9.jpeg?width=1200&height=674&fit=bounds&quality=75&auto=webp&crop=2546,1432,x0,y76&wmark=nzz",2024-07-05T12:00:00Z,,"Vertraut Gareth Southgate (rechts) gegen die Schweiz einfach wieder auf einen Geniestreich von Jude Bellingham? Viele Optionen hat der englische Nationaltrainer nicht.
Er habe sich ein bisschen gefü… [+6040 chars]",,de,'Abhängigkeit'
https://www.tagesschau.de/ausland/europa/orban-putin-moskau-besuch-100.html,https://www.tagesschau.de/ausland/europa/orban-putin-moskau-besuch-100.html,0,www.tagesschau.de,Besuch bei Putin: Orban inszeniert sich als Vermittler,"Die europäischen Partner sind erbost, doch Ungarns Regierungschef Orban verteidigt seinen Weg. Bei seinem überraschenden Besuch in Moskau bekräftigt er sein Vorhaben, im Ukraine-Krieg vermitteln zu wollen.",https://images.tagesschau.de/image/14cd5db4-06cc-48c6-b092-b838f4e8ec8e/AAABkIOhX_s/AAABjwnlFvA/16x9-1280/orban-putin-122.jpg,2024-07-05T15:56:13Z,,"Stand: 05.07.2024 17:56 Uhr
Die europäischen Partner sind erbost, doch Ungarns Regierungschef Orban verteidigt seinen Weg. Bei seinem überraschenden Besuch in Moskau bekräftigt er sein Vorhaben, im … [+3154 chars]",,de,'Putin'
https://www.zeit.de/politik/ausland/2024-07/ukraine-krieg-wladimir-putin-viktor-orban-moskau-treffen,https://www.zeit.de/politik/ausland/2024-07/ukraine-krieg-wladimir-putin-viktor-orban-moskau-treffen,0,www.zeit.de,Ukraine-Krieg: Orbán und Putin sprechen über russische Bedingungen für Kriegsende,"Trotz Kritik von EU-Kollegen hörte sich Viktor Orbán in Moskau Wladimir Putins Forderungen an die Ukraine an. Das diene dem Frieden, sagte der ungarische Regierungschef.",https://img.zeit.de/politik/ausland/2024-07/orban-putin-2/wide__1300x731,2024-07-05T16:43:57Z,,Der ungarische Ministerpräsident Viktor Orbán hat sich in Moskau mit dem russischen Staatschef Wladimir Putin getroffen und sich dort nach Aussagen beider Politiker vor allem über die russischen Ford… [+6391 chars],,de,'Krieg'
https://www.zeit.de/politik/ausland/2024-07/viktor-orban-moskau-wladimir-putin-ungarn-russland-ukraine,https://www.zeit.de/politik/ausland/2024-07/viktor-orban-moskau-wladimir-putin-ungarn-russland-ukraine,0,www.zeit.de,Viktor Orban: Putin süßsauer,Viktor Orbán wollte sich auf seiner Moskau-Reise als Friedensstifter aufdrängen. Doch er bekam nicht mehr als eine Bühne und einen Hinweis auf die Zukunft.,https://img.zeit.de/politik/ausland/2024-07/viktor-orban-moskau-wladimir-putin-ungarn-russland-ukraine-bild-2/wide__1300x731,2024-07-05T16:51:40Z,,"Damit hat er heute viele in Europa überrascht: Da steht Viktor Orbán im Katharinensaal des Kremls, keine drei Meter von dem Mann entfernt, der den Krieg gegen die Ukraine und, wie er selbst sagt, geg… [+6499 chars]",,de,'Putin'
https://www.zeit.de/news/2024-07/06/ungarn-begruendet-baerbock-absage-mit-terminaenderung,https://www.zeit.de/news/2024-07/06/ungarn-begruendet-baerbock-absage-mit-terminaenderung,0,www.zeit.de,Nach Orbans Visite bei Putin: Ungarn begründet Baerbock-Absage mit «Terminänderung»,"Hier finden Sie Informationen zu dem Thema „Nach Orbans Visite bei Putin“. Lesen Sie jetzt „Ungarn begründet Baerbock-Absage mit ""Terminänderung""“.",https://img.zeit.de/news/2024-07/06/ungarn-begruendet-baerbock-absage-mit-terminaenderung-image-group/wide__1300x731,2024-07-06T10:07:35Z,,Das ungarische Außenministerium begründet die Absage des ursprünglich für Montag geplanten Besuchs von Außenministerin Annalena Baerbock (Grüne) mit einer «unvorhergesehenen Änderung im Terminkalende… [+2099 chars],,de,'Putin'
https://www.zeit.de/news/2024-07/06/selenskyj-kuendigt-neue-strategie-auf-see-an,https://www.zeit.de/news/2024-07/06/selenskyj-kuendigt-neue-strategie-auf-see-an,0,www.zeit.de,Krieg in der Ukraine: Selenskyj kündigt neue Strategie auf See an,Hier finden Sie Informationen zu dem Thema „Krieg in der Ukraine“. Lesen Sie jetzt „Selenskyj kündigt neue Strategie auf See an“.,https://img.zeit.de/news/2024-07/06/selenskyj-kuendigt-neue-strategie-auf-see-an-image-group/wide__1300x731,2024-07-06T20:49:59Z,,"Die Ukraine will den russischen Einfluss im westlichen Teil des Schwarzen Meeres zurückdrängen. Sein Land werde dazu eine neue nationale Seestrategie erarbeiten, kündigte der ukrainische Präsident Wo… [+2101 chars]",,de,'Krieg'
https://www.zeit.de/news/2024-07/06/kiew-gebiet-im-osten-bleibt-heiss-umkaempfter-frontabschnitt,https://www.zeit.de/news/2024-07/06/kiew-gebiet-im-osten-bleibt-heiss-umkaempfter-frontabschnitt,0,www.zeit.de,Krieg in der Ukraine: Kiew: Gebiet im Osten bleibt heiß umkämpfter Frontabschnitt,Hier finden Sie Informationen zu dem Thema „Krieg in der Ukraine“. Lesen Sie jetzt „Kiew: Gebiet im Osten bleibt heiß umkämpfter Frontabschnitt“.,https://img.zeit.de/news/2024-07/06/kiew-gebiet-im-osten-bleibt-heiss-umkaempfter-frontabschnitt-image-group/wide__1300x731,2024-07-06T21:02:53Z,,"Die schweren Kämpfe im Osten der Ukraine halten nach Angaben der Militärführung in Kiew weiter an. «Am heißesten war die Lage heute im Raum Pokrowsk, daneben war der Feind auch in Richtung Lyman und … [+2225 chars]",,de,'Krieg'
https://www.zeit.de/news/2024-07/07/us-institut-sieht-keinen-echten-verhandlungswillen-bei-putin,https://www.zeit.de/news/2024-07/07/us-institut-sieht-keinen-echten-verhandlungswillen-bei-putin,0,www.zeit.de,Krieg in der Ukraine: US-Institut sieht keinen echten Verhandlungswillen bei Putin,Hier finden Sie Informationen zu dem Thema „Krieg in der Ukraine“. Lesen Sie jetzt „US-Institut sieht keinen echten Verhandlungswillen bei Putin“.,https://img.zeit.de/news/2024-07/07/us-institut-sieht-keinen-echten-verhandlungswillen-bei-putin-image-group/wide__1300x731,2024-07-07T07:23:47Z,,Kremlchef Wladimir Putin zeigt nach Einschätzung von US-Experten auch nach seinem Treffen mit dem ungarischen Regierungschef Viktor Orban keinen echten Willen für Verhandlungen in seinem Angriffskrie… [+2810 chars],,de,'Krieg'
