index,url,valid,domain,title,description,image,published,archive,content,quote,language,keyword
https://www.zeit.de/news/2026-06/04/prognose-immer-mehr-fluessigerdgas-transporte-nach-europa,https://www.zeit.de/news/2026-06/04/prognose-immer-mehr-fluessigerdgas-transporte-nach-europa,0,www.zeit.de,Gasversorgung: Prognose: Immer mehr Flüssigerdgas-Transporte nach Europa,Hier finden Sie Informationen zu dem Thema „Gasversorgung“. Lesen Sie jetzt „Prognose: Immer mehr Flüssigerdgas-Transporte nach Europa“.,https://img.zeit.de/news/2026-06/04/prognose-immer-mehr-fluessigerdgas-transporte-nach-europa-image-group/wide__1300x731,2026-06-04T02:30:07Z,,Flüssigerdgas wird nach Einschätzung von Energieexperten schon in wenigen Jahren mehr als die Hälfte des Gasaufkommens in den großen Gasmärkten Europas ausmachen. «Der Anteil von Flüssiggas im Gasmix… [+3094 chars],,de,'Gas'
https://www.zeit.de/news/2026-06/04/altstaedte-koenigsschloesser-und-mehr-welterbe-in-bayern,https://www.zeit.de/news/2026-06/04/altstaedte-koenigsschloesser-und-mehr-welterbe-in-bayern,0,www.zeit.de,"Bundesweiter Aktionstag: Altstädte, Königsschlösser und mehr - Welterbe in Bayern","Hier finden Sie Informationen zu dem Thema „Bundesweiter Aktionstag“. Lesen Sie jetzt „Altstädte, Königsschlösser und mehr - Welterbe in Bayern“.",https://img.zeit.de/news/2026-06/04/altstaedte-koenigsschloesser-und-mehr-welterbe-in-bayern-image-group/wide__1300x731,2026-06-04T04:15:08Z,,Die deutschen Unesco-Welterbestätten feiern am kommenden Sonntag sich und besonders Regensburg. Die Stadt in der Oberpfalz richtet den diesjährigen bundesweiten Welterbetag aus. Vor 20 Jahren war Reg… [+5394 chars],,de,'Bayern'
https://www.zeit.de/news/2026-06/04/ferienende-in-bayern-feucht-und-wenig-sonnig,https://www.zeit.de/news/2026-06/04/ferienende-in-bayern-feucht-und-wenig-sonnig,0,www.zeit.de,Wettervorhersage: Ferienende in Bayern: Feucht und wenig sonnig,Hier finden Sie Informationen zu dem Thema „Wettervorhersage“. Lesen Sie jetzt „Ferienende in Bayern: Feucht und wenig sonnig“.,https://img.zeit.de/news/2026-06/04/ferienende-in-bayern-feucht-und-wenig-sonnig-image-group/wide__1300x731,2026-06-04T05:33:51Z,,Am Feiertag Fronleichnam müssen Ausflügler in Bayern wetterfest sein: Nach einem oft noch trockenen Start ziehen im Tagesverlauf von Nordwesten her Schauer und teils kräftige Gewitter auf. Vor allem … [+1970 chars],,de,'Bayern'
https://www.zeit.de/politik/deutschland/2026-06/russland-deutschland-eu-verhandlungen-ukraine-krieg-putin,https://www.zeit.de/politik/deutschland/2026-06/russland-deutschland-eu-verhandlungen-ukraine-krieg-putin,0,www.zeit.de,Verhandlungen über den Ukrainekrieg: Die Bundesregierung bereitet sich auf Verhandlungen mit Russland vor,Mit Wladimir Putin reden? Dafür sah Friedrich Merz lange keinen Anlass. Nun aber wappnet sich das Kanzleramt für Gespräche mit Russland. Wer dabei am Tisch sitzen soll.,https://img.zeit.de/politik/deutschland/2026-06/russland-deutschland-eu-verhandlungen-ukraine-krieg-putin-bild/wide__1300x731,2026-06-04T06:00:51Z,,"Dass Deutschland demnächst Gespräche mit Wladimir Putins Russland aufnehmen könnte, dazu gab es bislang nur Gerüchte und Andeutungen. Die Altkanzlerin Angela Merkel könnte im Namen der EU mit Putin v… [+613 chars]",,de,'Putin'
https://www.nzz.ch/international/iran-krieg-aktuelle-news-und-entwicklungen-im-liveticker-ld.10009801,https://www.nzz.ch/international/iran-krieg-aktuelle-news-und-entwicklungen-im-liveticker-ld.10009801,0,www.nzz.ch,LIVE-TICKER - Iran-Krieg: Israels Polizeiminister kritisiert Libanon-Waffenruhe +++ Tote nach israelischen Angriffen in Südlibanon,Die USA und Israel haben Iran angegriffen. Teheran hat heftige Gegenangriffe lanciert. Gegenwärtig gilt eine Waffenruhe. Die Folgen des Konflikts sind weltweit spürbar. Die neuesten Entwicklungen im Live-Ticker.,"https://img-msp-prod.nzz.ch/2026/06/03/c98ca520-866c-40e6-9372-7da9aa2e2d6e.jpg?width=1200&height=675&fit=bounds&quality=75&auto=webp&crop=5500,3094,x0,y1&wmark=nzz",2026-06-04T06:40:07Z,,Der israelische Polizeiminister Itamar Ben-Gvir hat die Vereinbarung zwischen Israel und Libanon auf einen neuen Anlauf zur Umsetzung einer Waffenruhe als «schweren Fehler» kritisiert. Es handele sic… [+867 chars],,de,'Krieg'
https://www.focus.de/politik/druck-auf-trump-repraesentantenhaus-stimmt-gegen-iran-krieg_59113e4c-7139-43ba-b1aa-fb0929abc219.html,https://www.focus.de/politik/druck-auf-trump-repraesentantenhaus-stimmt-gegen-iran-krieg_59113e4c-7139-43ba-b1aa-fb0929abc219.html,0,www.focus.de,Druck auf Trump: Repräsentantenhaus stimmt gegen Iran-Krieg,Die Spannungen im Iran-Krieg dauern an. Der Iran hat wegen Israels Angriffen im Libanon mit dem Abbruch der Verhandlungen gedroht. Trump verkündete daraufhin eine Waffenruhe zwischen Israel und der Hisbollah. Alle Entwicklungen im Liveticker.,"https://quadro.burda-forward.de/ctf/afd20d27-8edd-457d-8e97-e6f502753ae9.ddf1f91d-dd2c-4db6-a4d4-eb005c9d5d16.jpg?im=RegionOfInterestCrop=(1200,630),regionOfInterest=(605,343)&hash=55b548e78bada4d2016d7900c0d5f0c1d702c29acd598c4314c3695d4ad3a101",2026-06-04T06:45:00Z,,"US-Repräsentantenhaus stimmt gegen Iran-Krieg 
Das US-Repräsentantenhaus hat für den Abzug des Militärs aus Kampfhandlungen mit dem Iran gestimmt und damit den politischen Druck auf Präsident Donald… [+4981 chars]",,de,'Krieg'
https://www.tagesspiegel.de/sport/diplomatie-krieg-und-spiele-trumps-spagat-zwischen-wm-und-iran-15675474.html,https://www.tagesspiegel.de/sport/diplomatie-krieg-und-spiele-trumps-spagat-zwischen-wm-und-iran-15675474.html,0,www.tagesspiegel.de,Diplomatie: Krieg und Spiele: Trumps Spagat zwischen WM und Iran,Eigentlich soll es ein Sommer mit vielen tollen Events für Donald Trump werden: Die Fußball-WM beginnt den Reigen - doch der Präsident ist mit einem Krieg beschäftigt.,https://www.tagesspiegel.de/images/15675473/alternates/BASE_16_9_W1400/1780556173000/donald-trump-und-gianni-infantino.jpeg,2026-06-04T06:56:14Z,,Es soll für Donald Trump ein Sommer der Superlative werden. Die Fußball-Weltmeisterschaft beginnt in der kommenden Woche (11. Juni). Nur wenige Tage nach dem WM-Start feiert der US-Präsident dann sei… [+4427 chars],,de,'Krieg'
https://www.perlentaucher.de/9punkt/2026-06-04.html,https://www.perlentaucher.de/9punkt/2026-06-04.html,0,www.perlentaucher.de,9PUNKT - DIE DEBATTENRUNDSCHAU: Es ist wie ein Hütchenspiel,"Im Interview mit FAZ und SpOn erzählt der neue ungarische Regierungschef Péter Magyar, wie es in Ungarn weitergehen soll. Wenn die Ukraine die Waffen niederlegt, wird Putin direkt in den nächsten Krieg ziehen, warnt Garri Kasparow in der Welt. Die SZ blickt a…",https://www.perlentaucher.de/static/img/perlentaucher-logo-512x.png,2026-06-04T07:00:00Z,,"In seinen ersten Interviews mit der deutschen Presse nach seinem Wahlsieg, erzählt der neue ungarische Ministerpräsident Péter Magyar, wie es nun in seinem Land weitgehen soll. Im SpOn-Interview mit … [+3425 chars]",,de,'Krieg'
https://www.bild.de/politik/ausland-und-internationales/diplomaten-deuten-an-wladimir-putin-steckt-hinter-deutschlands-un-klatsche-6a210ea6aa3fa782d14711d8,https://www.bild.de/politik/ausland-und-internationales/diplomaten-deuten-an-wladimir-putin-steckt-hinter-deutschlands-un-klatsche-6a210ea6aa3fa782d14711d8,0,www.bild.de,Andeutung von Diplomaten - Steckt Putin hinter Deutschlands UN-Klatsche?,"Russland lobbyierte gegen Deutschlands UN-Pläne, Berlin verspielte Vertrauen bei Partnern.","https://images.bild.de/6a210ea6aa3fa782d14711d8/ba2550fc3f5a5787d47528165bc925ec,962df2e8?w=1280",2026-06-04T07:10:34Z,,TTS-Player überspringenArtikel weiterlesenNew York (USA) Hat Wladimir Putin hinter den Kulissen die Fäden gezogen und Deutschland am Ende eiskalt ausgebremst? Nach Angaben von Diplomaten machte Russl… [+2666 chars],,de,'Putin'
https://www.diepresse.com/21454232/buergermeister-von-charkiw-niemand-weiss-ob-unsere-kinder-wieder-werden,https://www.diepresse.com/21454232/buergermeister-von-charkiw-niemand-weiss-ob-unsere-kinder-wieder-werden,0,www.diepresse.com,"Bürgermeister von Charkiw: „Niemand weiß, ob unsere Kinder wieder aufwachen werden“ [premium]","Ihor Terechow ist Bürgermeister im ukrainischen Charkiw, einer „Stadt im Krieg“. Was Wien von Charkiw lernen kann, warum der Stadtchef Häuser wiederaufbauen lässt, auf welche Friedenslösung er hofft und ob er tatsächlich höhere politische Ambitionen hat, erkl…",https://img.diepresse.com/public/incoming/fpnsjg-ihor-terehow-burgermeister-von-charkiw-ukraine/alternates/WEBP_WIDE_1200/Ihor%20Terehow%20B%C3%BCrgermeister%20von%20Charkiw%20Ukraine,2026-06-04T08:15:36Z,,"Herr Terechow, Sie wurden kurz vor Beginn des Krieges gewählt. Welche Pläne hatten Sie damals?Ihor Terechow: Als ich bei den Wahlen im Oktober 2021 für dieses Amt kandidierte, habe ich nicht erwartet… [+12010 chars]",,de,'Krieg'
https://taz.de/Waffenruhe-im-Libanon/!6184366/,https://taz.de/Waffenruhe-im-Libanon/!6184366/,0,taz.de,„Waffenruhe“ im Libanon: Die Regierung in Beirut und Israel nehmen neuen Anlauf,"Zuletzt eskalierte der Krieg Israels gegen die Hisbollah trotz vereinbarter „Waffenruhe“, nun soll sie umgesetzt werden. Kann das gelingen?",https://taz.de/picture/8478924/1200/Israel-Libanon-Waffenruhe.jpeg,2026-06-04T08:32:00Z,,"Zuletzt eskalierte der Krieg Israels gegen die Hisbollah trotz vereinbarter „Waffenruhe“, nun soll sie umgesetzt werden. Kann das gelingen? mehr...",,de,'Krieg'
https://www.zeit.de/news/2026-06/04/tschechien-startet-bahn-ausbau-richtung-bayern,https://www.zeit.de/news/2026-06/04/tschechien-startet-bahn-ausbau-richtung-bayern,0,www.zeit.de,Verkehr: Tschechien startet Bahn-Ausbau Richtung Bayern,Hier finden Sie Informationen zu dem Thema „Verkehr“. Lesen Sie jetzt „Tschechien startet Bahn-Ausbau Richtung Bayern“.,https://img.zeit.de/news/2026-06/04/tschechien-startet-bahn-ausbau-richtung-bayern-image-group/wide__1300x731,2026-06-04T10:00:00Z,,"In Tschechien hat die Modernisierung der Bahnstrecke zwischen Pilsen (Plzen) und der bayerischen Grenze bei Furth im Wald begonnen. Der erste Bauabschnitt umfasst eine 12,3 Kilometer lange Strecke zw… [+1270 chars]",,de,'Bayern'
https://www.zeit.de/politik/2026-06/wahlen-armenien-russland-podcast,https://www.zeit.de/politik/2026-06/wahlen-armenien-russland-podcast,0,www.zeit.de,Wahlen in Armenien: Russlands wichtigste Wahl,"In einer kleinen Demokratie am Kaukasus wird am Sonntag gewählt. Doch Putin versucht alles, um sich Armenien gefügig zu machen. Drei Oligarchen fordern den Präsidenten.",https://img.zeit.de/politik/ausland/2026-06/wahlen-armenien-russland-podcast-bild/wide__1300x731,2026-06-04T16:00:56Z,,"In den Ländern von Russland bis Iran regiert ein Autokrat neben dem anderen mit einer Ausnahme. Es gibt ein Land, das am 7. Juni eine echte Wahl hat: Armenien. 2,5 Millionen Wahlberechtigte können üb… [+1472 chars]",,de,'Putin'
https://www.tagesspiegel.de/internationales/auftritt-in-sankt-petersburg-afd-politiker-werfen-deutschland-vor-vertrauen-zu-russland-zerstort-zu-haben-15678611.html,https://www.tagesspiegel.de/internationales/auftritt-in-sankt-petersburg-afd-politiker-werfen-deutschland-vor-vertrauen-zu-russland-zerstort-zu-haben-15678611.html,0,www.tagesspiegel.de,"Auftritt in Sankt Petersburg: AfD-Politiker werfen Deutschland vor, Vertrauen zu Russland zerstört zu haben","Während einer Podiumsdiskussion bei Putins Wirtschaftsforum wird der Ukraine-Krieg mit so gut wie keinem Wort erwähnt. Stattdessen schimpfen AfD-Politiker auf deutsche Medien, Westeuropa und Grüne.",https://www.tagesspiegel.de/images/15678954/alternates/BASE_16_9_W1400/1780591443000/internationales-wirtschaftsforum-in-russland.jpeg,2026-06-04T17:17:30Z,,"Die AfD-Politiker Petr Bystron, Jörg Urban und Steffen Kotré haben beim Wirtschaftsforum im russischen Sankt Petersburg bei einer Podiumsdiskussion über Instrumente globaler Einflussnahme diskutiert.… [+6744 chars]",,de,'Putin'
https://www.diepresse.com/28203011/der-iran-will-die-usa-aus-der-golfregion-vertreiben,https://www.diepresse.com/28203011/der-iran-will-die-usa-aus-der-golfregion-vertreiben,0,www.diepresse.com,Der Iran will die USA aus der Golfregion vertreiben [premium],Der iranische Drohnenangriff auf Kuwait ist Teil einer langfristigen Strategie. Die Araber wollen sich allmählich aus der US-Abhängigkeit lösen.,https://img.diepresse.com/public/incoming/g7isx-imago-images-0858263363/alternates/WEBP_WIDE_1200/imago%20images%200858263363,2026-06-04T17:46:49Z,,"Nikosia. Als eine iranische Drohne in ein Passagier-Terminal am Flughafen von Kuwait einschlug, einen Menschen tötete und mehr als 60 weitere verletzte, war das nicht nur eine Vergeltungsaktion für v… [+4291 chars]",,de,'Abhängigkeit'
https://www.zeit.de/2026/25/katechon-carl-schmitt-alexander-dugin-peter-thiel-religion,https://www.zeit.de/2026/25/katechon-carl-schmitt-alexander-dugin-peter-thiel-religion,0,www.zeit.de,Katechon: Kennen Sie dieses rechte Zauberwort?,"Mit dem Begriff Katechon bekämpfen Putin-Einflüsterer und Techmilliardäre den Liberalismus. Der Historiker Volker Weiß erklärt in seinem neuen Buch, was dahintersteckt.",https://img.zeit.de/2026/25/kennen-sie-dieses-rechte-zauberwort-bild-2/wide__1300x731,2026-06-04T17:56:06Z,,"Die Krise der Demokratie nährt nicht nur allgemeine Zweifel am Fortschritt, auch vermeintlich Gebanntes und überwunden Geglaubtes kehrt wieder: Antiliberalismus, Autokratie, der politische Irrational… [+858 chars]",,de,'Putin'
https://www.zeit.de/news/2026-06/04/putin-zeigt-sich-weiter-siegesgewiss-bei-wirtschaftsforum,https://www.zeit.de/news/2026-06/04/putin-zeigt-sich-weiter-siegesgewiss-bei-wirtschaftsforum,0,www.zeit.de,Ukraine-Krieg: Putin zeigt sich weiter siegesgewiss bei Wirtschaftsforum,Hier finden Sie Informationen zu dem Thema „Ukraine-Krieg“. Lesen Sie jetzt „Putin zeigt sich weiter siegesgewiss bei Wirtschaftsforum“.,https://img.zeit.de/news/2026-06/04/putin-zeigt-sich-weiter-siegesgewiss-bei-wirtschaftsforum-image-group/wide__1300x731,2026-06-04T17:57:42Z,,Kremlchef Wladimir Putin beharrt auf seiner Forderung nach einer vollständigen russischen Kontrolle der Gebiete Donezk und Luhansk als Voraussetzung für einen Frieden in der Ukraine. Die Forderung se… [+1491 chars],,de,'Krieg'
https://www.tagesspiegel.de/internationales/wirtschaftsforum-putin-zeigt-sich-offen-fur-dialog-mit-westen--lob-fur-afd-15679066.html,https://www.tagesspiegel.de/internationales/wirtschaftsforum-putin-zeigt-sich-offen-fur-dialog-mit-westen--lob-fur-afd-15679066.html,0,www.tagesspiegel.de,Wirtschaftsforum: Putin zeigt sich offen für Dialog mit Westen – Lob für AfD,Kremlchef Putin hält beim Wirtschaftsforum in St. Petersburg Hof. Bei einem Gespräch mit westlichen Journalisten äußert er sich auch zu seinem Krieg gegen die Ukraine und zur Rolle Deutschlands.,https://www.tagesspiegel.de/images/15679128/alternates/BASE_16_9_W1400/1780597390000/wladimir-putin.jpeg,2026-06-04T17:58:43Z,,Der russische Präsident Wladimir Putin hat seine Bereitschaft zum Dialog auch mit Europa zur Beendigung seines Krieges gegen die Ukraine bekräftigt. Als Vermittler kämen aber nur neutrale Leute infra… [+1799 chars],,de,'Krieg'
https://www.tagesspiegel.de/internationales/gazprom-ist-dazu-bereit-putin-lobt-afd-und-verspricht-sofortige-gaslieferungen-15679066.html,https://www.tagesspiegel.de/internationales/gazprom-ist-dazu-bereit-putin-lobt-afd-und-verspricht-sofortige-gaslieferungen-15679066.html,0,www.tagesspiegel.de,„Gazprom ist dazu bereit“: Putin lobt AfD und verspricht sofortige Gaslieferungen,"Beim Wirtschaftsforum in St. Petersburg empfängt Putin internationale Journalisten. Dabei geht es unter anderem um Altkanzler Schröder, die AfD und eine Wiederaufnahme von Gaslieferungen.",https://www.tagesspiegel.de/images/15679149/alternates/BASE_16_9_W1400/1780598942000/russian-president-vladimir-putin-meets-with-representatives-of-international-news-agencies-on-the-sidelines-of-the-st-petersburg-international-economic-forum.jpeg,2026-06-04T17:58:43Z,,Der russische Präsident Wladimir Putin hat seine Bereitschaft zum Dialog auch mit Europa zur Beendigung seines Krieges gegen die Ukraine bekräftigt. Als Vermittler kämen aber nur neutrale Leute infra… [+1926 chars],,de,'Putin'
https://www.stern.de/politik/ausland/wirtschaftsforum--putin-zeigt-sich-offen-fuer-dialog-mit-westen---lob-fuer-afd-37495292.html,https://www.stern.de/politik/ausland/wirtschaftsforum--putin-zeigt-sich-offen-fuer-dialog-mit-westen---lob-fuer-afd-37495292.html,0,www.stern.de,Wirtschaftsforum: Putin zeigt sich offen für Dialog mit Westen – Lob für AfD,Kremlchef Putin hält beim Wirtschaftsforum in St. Petersburg Hof. Bei einem Gespräch mit westlichen Journalisten äußert er sich auch zu seinem Krieg gegen die Ukraine und zur Rolle Deutschlands.,https://image.stern.de/37495332/t/9f/v1/w1440/r1.7778/-/04--vpp6tihplwv7axs2048jpeg---98a03077d34999ea.jpg,2026-06-04T18:22:04Z,,"Kopiere den aktuellen Link
Zur Merkliste hinzufügen
Kremlchef Putin hält beim Wirtschaftsforum in St. Petersburg Hof. Bei einem Gespräch mit westlichen Journalisten äußert er sich auch zu seinem Kr… [+1953 chars]",,de,'Öl'
https://www.welt.de/politik/ausland/article6a21bd2f3807a686af77dfb5/wladimir-putin-beim-treffen-mit-auslaendischen-journalisten-lobt-er-ploetzlich-die-afd.html,https://www.welt.de/politik/ausland/article6a21bd2f3807a686af77dfb5/wladimir-putin-beim-treffen-mit-auslaendischen-journalisten-lobt-er-ploetzlich-die-afd.html,0,www.welt.de,Beim Treffen mit ausländischen Journalisten lobt Putin die AfD,Russlands Machthaber Wladimir Putin spricht am Rande des Wirtschaftsforums in St. Petersburg mit internationalen Medien. Dabei wird er auch nach den ukrainischen Drohnenangriffen gefragt. Für die angereisten AfD-Politiker findet er lobende Worte.,https://images.welt.de/6a21bd2f3807a686af77dfb5/f0953e61e622de47e88008f79acad698-master/ci16x9-w1200/2026-06-04t173511z-1411074104-rc25nlasz950-rtrmadp-3-russia-forum-putin-media-jpg,2026-06-04T18:50:05Z,,Russlands Machthaber Wladimir Putin spricht am Rande des Wirtschaftsforums in St. Petersburg mit internationalen Medien. Dabei wird er auch nach den ukrainischen Drohnenangriffen gefragt. Für die ang… [+3678 chars],,de,'Putin'
https://www.n-tv.de/politik/Putin-gibt-sich-in-St-Petersburg-siegesgewiss-id30893288.html,https://www.n-tv.de/politik/Putin-gibt-sich-in-St-Petersburg-siegesgewiss-id30893288.html,0,www.n-tv.de,Weiter liebäugeln mit Schröder: Putin gibt sich in St. Petersburg siegesgewiss,"Gebietsgewinne auf der eigenen Seite, Rekrutierungsprobleme beim Gegner. Bei einem traditionellen Aufeinandertreffen mit internationalen Medien bleibt Russlands Präsident bei seiner Sichtweise auf den Krieg in der Ukraine. Und es gibt ein Lob für die AfD.",https://www.n-tv.de/img/30893298/1780604097/Img_16_9/1200/Russian-President-Vladimir-Putin-speaks-to-representatives-of-international-news-agencies-on-the-sidelines-of-the-St-Petersburg-International-Economic-Forum-at-the-Constantine-Palace-in-St-Petersburg-Russia-on-Thursday-June-4-2026.jpg,2026-06-04T19:13:22Z,,"Russlands Präsident Wladimir Putin im Austausch mit dem Präsident der chinesischen Nachrichtenagentur Xinhua, Fu Hua. (Foto: picture alliance / Dmitri Lovetsky/AP via AP)
Gebietsgewinne auf der eige… [+3933 chars]",,de,'Putin'
https://www.n-tv.de/politik/21-17-Selenskyj-schreibt-offenen-Brief-an-Putin-id30893694.html,https://www.n-tv.de/politik/21-17-Selenskyj-schreibt-offenen-Brief-an-Putin-id30893694.html,0,www.n-tv.de,Ukraine-Krieg im Liveticker: +++ 21:17 Selenskyj schreibt offenen Brief an Putin +++,"Berlin, Washington, Brüssel - überall. ntv berichtet von allen wichtigen Schauplätzen der Innen- und Außenpolitik.",https://www.n-tv.de/img/2339153/1721988811/Img_16_9/1200/Ukraine-Liveticker.jpg,2026-06-04T20:00:00Z,,"Der ukrainische Präsident Wolodymyr Selenskyj fordert Putin in einem offenen Brief zu einem persönlichen Treffen auf. ""Ich schlage vor, ein klares Datum für ein Treffen festzulegen"", schreibt Selensk… [+32667 chars]",,de,'Putin'
https://www.n-tv.de/politik/21-47-IAEA-warnt-vor-Weiterverbreitung-von-iranischem-Atommaterial-id30893757.html,https://www.n-tv.de/politik/21-47-IAEA-warnt-vor-Weiterverbreitung-von-iranischem-Atommaterial-id30893757.html,0,www.n-tv.de,Iran-Krieg im Liveticker: +++ 21:47 IAEA warnt vor Weiterverbreitung von iranischem Atommaterial +++,"Berlin, Washington, Brüssel - überall. ntv berichtet von allen wichtigen Schauplätzen der Innen- und Außenpolitik.",https://www.n-tv.de/img/30683469/1775385589/Img_16_9/1200/Smoke-rises-after-an-Israeli-airstrike-hits-a-building-near-the-airport-road-in-Beirut-Lebanon-Tuesday-March-31-2026.jpg,2026-06-04T20:00:00Z,,"Die Internationale Atomenergiebehörde (IAEA) hat vor einer Weiterverbreitung von Nuklearmaterial aus dem Iran gewarnt. Der derzeit fehlende Zugang zu iranischen Atomanlagen ""gibt Anlass zur Sorge hin… [+20798 chars]",,de,'Öl'
https://www.tagesschau.de/ausland/asien/putin-wirtschaftsforum-ukraine-100.html,https://www.tagesschau.de/ausland/asien/putin-wirtschaftsforum-ukraine-100.html,0,www.tagesschau.de,Putin offen für Dialog - unter Bedingungen,Russlands Präsident Putin hat sich offen für einen Dialog mit Europa zur Beendigung des Ukraine-Kriegs gezeigt. Deutschland schloß er  als Vermittler aber aus. Zu einem möglichen EU-Beitritt der Ukraine schlug Putin überraschende Töne an.,https://images.tagesschau.de/image/c90bdd83-049b-4b35-8ec6-910bbd2f3c85/AAABnpQARXM/AAABnSSvrFg/16x9-big/putin-1464.jpg?width=1280,2026-06-04T20:19:11Z,,"Stand: 04.06.2026 22:19 Uhr
Russlands Präsident Putin hat sich offen für einen Dialog mit Europa zur Beendigung des Ukraine-Kriegs gezeigt. Deutschland schloß er als Vermittler aber aus. Zu einem mö… [+4605 chars]",,de,'Krieg'
https://www.stern.de/news/-schoene--saubere-kohle---trump-kuendigt-700-millionen-dollar-fuer-fossile-energie-an-37495618.html,https://www.stern.de/news/-schoene--saubere-kohle---trump-kuendigt-700-millionen-dollar-fuer-fossile-energie-an-37495618.html,0,www.stern.de,"„Schöne, saubere Kohle“: Trump kündigt 700 Millionen Dollar für fossile Energie an","„Schöne, saubere Kohle“: Unter diesem Motto hat US-Präsident Donald Trump Investitionen von 700 Millionen Dollar (rund 603 Millionen Euro) für die Kohleindustrie angekündigt. Damit sollen Kraftwerke in den USA modernisiert, Bergwerke ausgebaut und ein für Exp…",https://image.stern.de/37495620/t/b6/v1/w1440/r1.7778/-/04--donald-trump-mit-mitarbeitern-im-weissen-haus---0dc94164b59730db.jpg,2026-06-04T20:46:55Z,,"Kopiere den aktuellen Link
Zur Merkliste hinzufügen
Schöne, saubere Kohle: Unter diesem Motto hat US-Präsident Donald Trump Investitionen von 700 Millionen Dollar (rund 603 Millionen Euro) für die … [+1571 chars]",,de,'fossile Energie'
https://www.faz.net/aktuell/politik/ukraine/ukraine-liveticker-russlands-praesident-spricht-in-sankt-petersburg-mit-internationaler-presse-faz-110683325.html,https://www.faz.net/aktuell/politik/ukraine/ukraine-liveticker-russlands-praesident-spricht-in-sankt-petersburg-mit-internationaler-presse-faz-110683325.html,0,www.faz.net,Liveblog Ukrainekrieg: Putin: Wir müssen die Luftabwehr verbessern,Russlands Präsident spricht in Sankt Petersburg mit internationaler Presse +++ EU erwägt Ende von Schutzstatus für wehrfähige Ukrainer +++ Rutte nennt Russland „zunehmend verzweifelt“ +++ alle Neuigkeiten im Liveblog,https://media0.faz.net/image/w1200h627/4ae82349fb20/w6999h3656x0y307o/202606/43601.0.2182468056/der-russissche-praesident-bei.webp,2026-06-04T21:17:58Z,,Putin relativierte zudem den in der Vergangenheit noch von ihm selbst gefeierten Einsatz der Mittelstreckenrakete Oreschnik gegen Ziele in der Ukraine. Die Waffe sei noch nicht im ganzen Sinne des Wo… [+2982 chars],,de,'Putin'
https://www.zeit.de/news/2026-06/05/putin-gibt-sich-siegesgewiss-selenskyj-bietet-treffen-an,https://www.zeit.de/news/2026-06/05/putin-gibt-sich-siegesgewiss-selenskyj-bietet-treffen-an,0,www.zeit.de,Russisch-ukrainischer Krieg: Putin gibt sich siegesgewiss - Selenskyj bietet Treffen an,Hier finden Sie Informationen zu dem Thema „Russisch-ukrainischer Krieg“. Lesen Sie jetzt „Putin gibt sich siegesgewiss - Selenskyj bietet Treffen an“.,https://img.zeit.de/news/2026-06/05/putin-gibt-sich-siegesgewiss-selenskyj-bietet-treffen-an-image-group/wide__1300x731,2026-06-04T22:15:04Z,,Beim Internationalen Wirtschaftsforum in St. Petersburg hat der russische Präsident Wladimir Putin vor seiner heute mit Spannung erwarteten Rede eine Pressekonferenz für ausländische Nachrichtenagent… [+5207 chars],,de,'Putin'
https://www.tagesschau.de/ausland/europa/ukraine-selenskyj-brief-putin-100.html,https://www.tagesschau.de/ausland/europa/ukraine-selenskyj-brief-putin-100.html,0,www.tagesschau.de,Selenskyj bietet Putin direkte Friedensgespräche an,Der ukrainische Präsident Selenskyj hat Russlands Präsident in einem Brief zu direkten Friedensverhandlungen aufgefordert. Die Mehrheit der Russen sei bereit für Frieden. Putin wiederholte indes seine Bedingungen für Gespräche.,https://images.tagesschau.de/image/23884002-94d6-4e01-bd95-19a10a1826d3/AAABnBhNH6E/AAABnSSvrFg/16x9-big/selenskyj-1054.jpg?width=1280,2026-06-04T22:43:01Z,,"Stand: 05.06.2026 00:43 Uhr
Der ukrainische Präsident Selenskyj hat Russlands Präsident in einem Brief zu direkten Friedensverhandlungen aufgefordert. Die Mehrheit der Russen sei bereit für Frieden.… [+5195 chars]",,de,'Putin'
