index,url,valid,domain,title,description,image,published,archive,content,quote,language,keyword
https://www.n-tv.de/politik/Russische-Truppen-in-der-Ukraine-setzen-auf-Esel-article25544607.html,https://www.n-tv.de/politik/Russische-Truppen-in-der-Ukraine-setzen-auf-Esel-article25544607.html,0,www.n-tv.de,Lasttiere für die Front: Russische Truppen in der Ukraine setzen auf Esel,"Ist es eine Folge der hohen Materialverluste? Kriegsblogger berichten in den sozialen Medien, dass russische Einheiten in der Ukraine Esel für Nachschubtransporte nutzen. Ein Militärexperte geht von Einzelfällen aus und glaubt nicht an einen massenhaften Eins…",https://www.n-tv.de/img/incoming/crop25544675/109132614-cImg_16_9-w1200/GjD8GipWAAA4CSB.jpg,2025-02-06T20:23:20Z,https://web.archive.org/web/20250208072209/https://www.n-tv.de/politik/Russische-Truppen-in-der-Ukraine-setzen-auf-Esel-article25544607.html,"Ist es eine Folge der hohen Materialverluste? Kriegsblogger berichten in den sozialen Medien, dass russische Einheiten in der Ukraine Esel für Nachschubtransporte nutzen. Ein Militärexperte geht von … [+2570 chars]",,de,'Krieg'
https://www.n-tv.de/politik/21-23-Finnland-will-russischen-Staatsbuergern-Kauf-von-Immobilien-verbieten--article25545171.html,https://www.n-tv.de/politik/21-23-Finnland-will-russischen-Staatsbuergern-Kauf-von-Immobilien-verbieten--article25545171.html,0,www.n-tv.de,Ukraine-Krieg im Liveticker: +++ 21:23 Finnland will russischen Staatsbürgern Kauf von Immobilien verbieten +++,Lesen Sie alle aktuellen Entwicklungen und Nachrichten über den russischen Angriffskrieg auf die Ukraine im Liveticker von ntv.de.,https://www.n-tv.de/img/incoming/crop25117070/4231326595-cImg_16_9-w1200/Ukraine-Liveticker.jpg,2025-02-06T21:00:00Z,https://web.archive.org/web/20250209190556/https://www.n-tv.de/politik/21-23-Finnland-will-russischen-Staatsbuergern-Kauf-von-Immobilien-verbieten--article25545171.html,"Die finnische Regierung will russischen Staatsangehörigen den Kauf von Immobilien verbieten. Ein entsprechender Gesetzesvorschlag soll dem Parlament vorgelegt werden, sagt der Verteidigungsminister F… [+27725 chars]",,de,'Krieg'
https://www.zeit.de/news/2025-02/06/bayern-basketballer-mit-erneutem-sieg-in-euroleague,https://www.zeit.de/news/2025-02/06/bayern-basketballer-mit-erneutem-sieg-in-euroleague,0,www.zeit.de,Euroleague: Bayern-Basketballer mit erneutem Sieg in Euroleague,Hier finden Sie Informationen zu dem Thema „Euroleague“. Lesen Sie jetzt „Bayern-Basketballer mit erneutem Sieg in Euroleague“.,https://img.zeit.de/news/2025-02/06/bayern-basketballer-mit-erneutem-sieg-in-euroleague-image-group/wide__1300x731,2025-02-06T21:40:32Z,https://web.archive.org/web/20250208045803/https://www.zeit.de/news/2025-02/06/bayern-basketballer-mit-erneutem-sieg-in-euroleague,Die Basketballer des FC Bayern München bleiben weiter auf direktem Playoff-Kurs in der Euroleague. Nur 48 Stunden nach dem Erfolg gegen Mailand gewann der deutsche Meister auch gegen Asvel Lyon-Ville… [+1013 chars],,de,'Bayern'
https://www.focus.de/politik/ausland/ukraine-krise/brisante-details-zu-anschlagsplaenen-in-geheimer-putin-runde-faellt-4-mal-der-name-des-rheinmetall-chefs_id_260700069.html,https://www.focus.de/politik/ausland/ukraine-krise/brisante-details-zu-anschlagsplaenen-in-geheimer-putin-runde-faellt-4-mal-der-name-des-rheinmetall-chefs_id_260700069.html,0,www.focus.de,Brisante Details zu Anschlagsplänen - In geheimer Putin-Runde fällt vier Mal der Name des Rheinmetall-Chefs,"Russlands Staatschef Wladimir Putin hat in einer bislang unbekannten Rede vor hohen Offizieren dem Vorstandschef des Düsseldorfer Rüstungskonzerns Rheinmetall, Armin Papperger, gedroht. Putin sieht in dem Topmanager einen Komplizen der verhassten Regierung in…",https://p6.focus.de/img/regional/nordrhein-westfalen/id_260132173/rheinmetall-chef-armin-papperger-soll-sogar-selbst-ziel-eines-attentatsplans-gewesen-sein.-archivbild-.jpg?im=Crop%3D%280%2C111%2C2048%2C1023%29%3BResize%3D%281200%2C627%29&impolicy=perceptual&quality=mediumHigh&hash=4150bb6c1adb9f77063839c9e4d1f744bfa30dc2c5f1cc56a53789088c7c8be9,2025-02-07T06:18:47Z,http://archive.md/20250210133058/https://www.focus.de/politik/ausland/ukraine-krise/brisante-details-zu-anschlagsplaenen-in-geheimer-putin-runde-faellt-4-mal-der-name-des-rheinmetall-chefs_id_260700069.html,"Russlands Staatschef Wladimir Putin hat in einer bislang unbekannten Rede vor hohen Offizieren dem Vorstandschef des Düsseldorfer Rüstungskonzerns Rheinmetall, Armin Papperger, gedroht. Putin sieht i… [+5181 chars]",,de,'Putin'
https://www.welt.de/politik/ausland/video255363794/Krieg-in-der-Ukraine-Russischer-Politiker-kuendigt-baldiges-Treffen-von-Trump-und-Putin-an.html,https://www.welt.de/politik/ausland/video255363794/Krieg-in-der-Ukraine-Russischer-Politiker-kuendigt-baldiges-Treffen-von-Trump-und-Putin-an.html,0,www.welt.de,Russischer Politiker kündigt baldiges Treffen von Trump und Putin an,Kremlchef Putin und US-Präsident Trump könnten sich nach Angaben aus Moskau schon im Februar oder März treffen. Damit rechnet der russische Außenpolitiker Leonid Sluzki. Die Vorbereitungen für das Treffen würden laufen.,https://img.welt.de/img/politik/ausland/mobile255363782/0687936377-ci16x9-w1200/Donald-Trump-und-Wladimir-Putin.jpg,2025-02-07T06:27:30Z,,Kremlchef Putin und US-Präsident Trump könnten sich nach Angaben aus Moskau schon im Februar oder März treffen. Damit rechnet der russische Außenpolitiker Leonid Sluzki. Die Vorbereitungen für das Tr… [+79 chars],,de,'Putin'
https://www.focus.de/politik/meinung/gastkommentar-von-gabor-steingart-trump-kumpelei-war-musks-bestes-investment-doch-der-milliardaer-lebt-gefaehrlich_id_260701740.html,https://www.focus.de/politik/meinung/gastkommentar-von-gabor-steingart-trump-kumpelei-war-musks-bestes-investment-doch-der-milliardaer-lebt-gefaehrlich_id_260701740.html,0,www.focus.de,Gastkommentar von Gabor Steingart - Trump-Kumpelei war Musks bestes Investment – doch der Milliardär lebt gefährlich,"Elon Musk hat viele gute Investitionsentscheidungen getroffen. Doch am meisten könnte sich für ihn lohnen, eine Beziehung zu Donald Trump aufgebaut zu haben. Die Geschichte sollte dem Milliardär aber eine Warnung sein.Von Gastautor Gabor Steingart (Berlin)",https://p6.focus.de/img/fotos/id_260701726/screenshot-2025-02-07-075633.png?im=Crop%3D%280%2C68%2C595%2C298%29%3BResize%3D%281200%2C627%29&impolicy=perceptual&quality=mediumHigh&hash=d5c73ce0f6dd295a2f007935f226fccc98a38e4785c141e7c53afa150736fef1,2025-02-07T07:08:57Z,https://web.archive.org/web/20250207122608/https://www.focus.de/politik/meinung/gastkommentar-von-gabor-steingart-trump-kumpelei-war-musks-bestes-investment-doch-der-milliardaer-lebt-gefaehrlich_id_260701740.html,"Elon Musk hat viele gute Investitionsentscheidungen getroffen. Doch am meisten könnte sich für ihn lohnen, eine Beziehung zu Donald Trump aufgebaut zu haben. Die Geschichte sollte dem Milliardär aber… [+5728 chars]",,de,'Öl'
https://www.sueddeutsche.de/bayern/bundestagswahl-programme-bayern-csu-afd-analyse-kliniken-li.3194671,https://www.sueddeutsche.de/bayern/bundestagswahl-programme-bayern-csu-afd-analyse-kliniken-li.3194671,0,www.sueddeutsche.de,Bundestagswahl 2025: Zurück zur Atomkraft und weniger Kliniken? Was die Wahlprogramme für Bayern bedeuten,"Am 23. Februar wählt Deutschland einen neuen Bundestag, die Pläne der Parteien hätten auch Auswirkungen auf Bayern. Eine Analyse zu vier zentralen Themen.",https://www.sueddeutsche.de/2024/01/01/132bec81-44c4-4692-b233-7b926be65aa3.jpeg?q=60&fm=webp&width=1200&rect=0%2C66%2C1367%2C769,2025-02-07T12:23:34Z,http://archive.md/20250209085104/https://www.sueddeutsche.de/bayern/bundestagswahl-programme-bayern-csu-afd-analyse-kliniken-li.3194671,"Migration
In Bayern haben vergangenes Jahr 36 000 Menschen einen Erstantrag auf Asyl gestellt, Tendenz sinkend. Knapp 25 000 Migranten sind derzeit in Bayern ausreisepflichtig, davon etwa 6200 vollz… [+13010 chars]",,de,'Öl'
https://www.stern.de/gesellschaft/regional/hamburg-schleswig-holstein/nord--und-ostsee--gruene-fordern-haerteres-vorgehen-gegen-schattenflotte-35448764.html,https://www.stern.de/gesellschaft/regional/hamburg-schleswig-holstein/nord--und-ostsee--gruene-fordern-haerteres-vorgehen-gegen-schattenflotte-35448764.html,0,www.stern.de,Nord- und Ostsee: Grüne fordern härteres Vorgehen gegen Schattenflotte,"Viele Tanker in den Weltmeeren stehen im Verdacht, illegal russisches Öl zu transportieren. Die Grünen wollen solche Tanker aus Nord- und Ostsee verbannen - und warnen auch vor Umweltkatastrophen.",https://image.stern.de/6681672/t/nx/v6/w1440/r1.7778/-/video-fallback-image.png,2025-02-07T13:40:11Z,,"Kopiere den aktuellen Link
Viele Tanker in den Weltmeeren stehen im Verdacht, illegal russisches Öl zu transportieren. Die Grünen wollen solche Tanker aus Nord- und Ostsee verbannen - und warnen auc… [+3111 chars]",,de,'Öl'
https://www.sueddeutsche.de/politik/trump-selenskij-putin-frieden-ukraine-russland-li.3197397,https://www.sueddeutsche.de/politik/trump-selenskij-putin-frieden-ukraine-russland-li.3197397,0,www.sueddeutsche.de,Trumps Pläne für die Ukraine: Faustpfand für Frieden,US-Präsident Trump will den Krieg in der Ukraine möglichst schnell beenden. Die Aussichten für Kiew sind dabei nicht so schlecht wie zunächst gedacht.,https://www.sueddeutsche.de/2025/02/07/633c490e-4855-4d97-be27-c1ce57de55d3.jpeg?q=60&fm=webp&width=1200&rect=0%2C193%2C3500%2C1969,2025-02-07T14:50:05Z,http://archive.md/20250207155603/https://www.sueddeutsche.de/politik/trump-selenskij-putin-frieden-ukraine-russland-li.3197397,"Seit dem Amtsantritt von US-Präsident Donald Trump wird viel geredet über mögliche Treffen zu Friedensgesprächen. Die 24 Stunden sind zwar längst vorbei, innerhalb derer Trump den Krieg beenden wollt… [+5757 chars]",,de,'Öl'
https://www.nzz.ch/video/trump-lithium-und-der-krieg-welche-rolle-spielen-die-rohstoffe-der-ukraine-ld.1870076,https://www.nzz.ch/video/trump-lithium-und-der-krieg-welche-rolle-spielen-die-rohstoffe-der-ukraine-ld.1870076,0,www.nzz.ch,"VIDEO - Trump, Lithium und der Krieg: Welche Rolle spielen die Rohstoffe der Ukraine?","Die Ukraine ist reich an Rohstoffen und seltenen Erden – Ressourcen, die derzeit kaum genutzt werden können. Doch ihr geopolitischer Wert ist hoch. Osteuropa-Korrespondent Ivo Mijnssen erklärt, warum Trump den Zugang zu diesen Rohstoffen fordert, welche Inter…","https://img.nzz.ch/2025/02/07/d92e684e-900f-4376-be26-310e7d695d40.png?width=1200&height=675&fit=bounds&quality=75&auto=webp&crop=1920,1080,x0,y0&wmark=nzz",2025-02-07T15:02:46Z,http://archive.md/20250207164752/https://www.nzz.ch/video/trump-lithium-und-der-krieg-welche-rolle-spielen-die-rohstoffe-der-ukraine-ld.1870076,"Die Ukraine ist eines der rohstoffreichsten Länder der Welt. Bekannt ist sie für Kohle zum Beispiel, da gibt es riesige Vorkommen im Osten. Es gibt auch Öl. Es gibt Gas. Vor allem aber hat sie grosse… [+3787 chars]",,de,'Krieg'
https://www.stern.de/gesellschaft/regional/berlin-brandenburg/umwelt--streit-um-schwefeldioxid-ausstoss-der-raffinerie-pck-35449324.html,https://www.stern.de/gesellschaft/regional/berlin-brandenburg/umwelt--streit-um-schwefeldioxid-ausstoss-der-raffinerie-pck-35449324.html,0,www.stern.de,Umwelt: Streit um Schwefeldioxid-Ausstoß der Raffinerie PCK,Die Ölraffinerie PCK im Nordosten Brandenburgs steht wegen ihres Schwefeldioxid-Ausstoßes in der Kritik. Die Genehmigungsbehörde will Ausnahmen für den Grenzwert zulassen. Eine Klage ist angedroht.,https://image.stern.de/35449326/t/Mf/v1/w1440/r1.7778/-/07--fk4l363pczv8axs2048jpeg---61f652f788f30edb.jpg,2025-02-07T16:01:00Z,https://web.archive.org/web/20250209100747/https://www.stern.de/gesellschaft/regional/berlin-brandenburg/umwelt--streit-um-schwefeldioxid-ausstoss-der-raffinerie-pck-35449324.html,"Kopiere den aktuellen Link
Die Ölraffinerie PCK im Nordosten Brandenburgs steht wegen ihres Schwefeldioxid-Ausstoßes in der Kritik. Die Genehmigungsbehörde will Ausnahmen für den Grenzwert zulassen.… [+3642 chars]",,de,'Öl'
https://www.zeit.de/politik/ausland/2025-02/ukraine-krieg-donald-trump-olaf-scholz-seltene-erden,https://www.zeit.de/politik/ausland/2025-02/ukraine-krieg-donald-trump-olaf-scholz-seltene-erden,0,www.zeit.de,Krieg in der Ukraine: Scholz kritisiert Trumps Forderung nach ukrainischen Rohstoffen,Der US-Präsident verlangt im Gegenzug für Militärhilfe die Lieferung Seltener Erden. Kanzler Scholz hält das für keine gute Idee – und missbilligt auch andere US-Pläne.,https://img.zeit.de/politik/ausland/2025-02/ukraine-krieg-donald-trump-olaf-scholz-seltene-erden-bild/wide__1300x731,2025-02-08T01:57:52Z,http://archive.md/20250208113615/https://www.zeit.de/politik/ausland/2025-02/ukraine-krieg-donald-trump-olaf-scholz-seltene-erden,"Bundeskanzler Olaf Scholz hat sich kritisch über den Plan von US-Präsident Donald Trump geäußert, US-Militärhilfen für die Ukraine an Geschäfte mit Seltenen Erden zu knüpfen. ""Die Ukraine wird angegr… [+2299 chars]",,de,'Krieg'
https://www.bild.de/sport/fussball/lustiger-pk-moment-kompany-klaut-werner-die-frage-67a719845f49bb5782682d09,https://www.bild.de/sport/fussball/lustiger-pk-moment-kompany-klaut-werner-die-frage-67a719845f49bb5782682d09,0,www.bild.de,Lustiger PK-Moment - Kompany klaut Werner die Frage,Auf der Pressekonferenz nach dem souveränen 3:0-Sieg der Bayern gegen Bremen leistet sich FCB-Coach Vincent Kompany einen kleinen Fauxpas und antwortet a...,"https://images.bild.de/67a719845f49bb5782682d09/02b416f81fab4d3d8e7ba93399a1cd02,6e7a1d6?w=1280",2025-02-08T08:56:11Z,https://web.archive.org/web/20250209010846/https://www.bild.de/sport/fussball/lustiger-pk-moment-kompany-klaut-werner-die-frage-67a719845f49bb5782682d09,"Mehr zum Video anzeigen 
Auf der Pressekonferenz nach dem souveränen 3:0-Sieg der Bayern gegen Bremen leistet sich FCB-Coach Vincent Kompany einen kleinen Fauxpas und antwortet auf eine Frage, die e… [+80 chars]",,de,'Bayern'
https://www.stern.de/news/vor-celtic-und-leverkusen--elfmeter--alien--kane-gibt-bayern-energieschub-35450020.html,https://www.stern.de/news/vor-celtic-und-leverkusen--elfmeter--alien--kane-gibt-bayern-energieschub-35450020.html,0,www.stern.de,"Vor Celtic und Leverkusen: Elfmeter-""Alien"" Kane gibt Bayern Energieschub","Wenn Harry Kane am Elfmeterpunkt steht, ist klar, was passiert. Seine Serie baut Bayerns Torjäger beim 3:0 gegen Bremen auf 29 Treffer am Stück aus. Für einen Außerirdischen hält er sich aber nicht.",https://image.stern.de/35450224/t/LT/v1/w1440/r1.7778/-/08--2otmolabj6v7axs2048jpeg---d37a10475407f2c2.jpg,2025-02-08T09:14:29Z,https://web.archive.org/web/20250209040755/https://www.stern.de/news/vor-celtic-und-leverkusen--elfmeter--alien--kane-gibt-bayern-energieschub-35450020.html,"Kopiere den aktuellen Link
Wenn Harry Kane am Elfmeterpunkt steht, ist klar, was passiert. Seine Serie baut Bayerns Torjäger beim 3:0 gegen Bremen auf 29 Treffer am Stück aus. Für einen Außerirdisch… [+3721 chars]",,de,'Bayern'
https://www.kicker.de/das-hat-bisher-nur-bayern-geschafft-auch-pizarro-freut-sich-schon-1088931/video,https://www.kicker.de/das-hat-bisher-nur-bayern-geschafft-auch-pizarro-freut-sich-schon-1088931/video,0,www.kicker.de,"""Das hat bisher nur Bayern geschafft"": Auch Pizarro freut sich schon","Video: ""Icing the kicker""-Host Alex von Kuczkowski ist für den kicker vor Ort beim Super Bowl LIX in New Orleans und sorgt für Einblicke rund um das NFL-Spektakel. Der Super Bowl ist live zu sehen bei RTL und auf RTL+ am 9.2. ab 23.15 Uhr.",https://derivates.kicker.de/image/upload/w_1500%2Ch_844%2Cc_fill%2Cg_auto:subject/w_1200%2Cq_auto/v1/2025/02/08/d0b06139-cd7c-4dbc-9dcc-7938ba8db913.png,2025-02-08T09:19:11Z,,"Werbung und Tracking: Um dir relevante Inhalte und personalisierte Werbung anzubieten, setzen wir Cookies und andere Technologien ein. Damit messen wir, wie und womit du unsere Angebote nutzt. Diese … [+1979 chars]",,de,'Bayern'
https://www.bild.de/sport/fussball/werder-bremen-fehler-mit-hand-und-fuss-jung-ist-der-ungluecksrabe-67a718965f49bb5782682cfc,https://www.bild.de/sport/fussball/werder-bremen-fehler-mit-hand-und-fuss-jung-ist-der-ungluecksrabe-67a718965f49bb5782682cfc,0,www.bild.de,Fehler mit Hand und Fuß - Jung ist Werders Unglücksrabe,Eine Halbzeit lang verteidigte Werder aufopferungsvoll und hielt das 0:0 bei den Bayern. Am Ende bekamen die Bremer doch auf die Mütze.,"https://images.bild.de/67a718965f49bb5782682cfc/10f1905a358e8fd54c13d8760e270d0e,e3217020?w=1280",2025-02-08T09:40:44Z,,"Eine Halbzeit lang verteidigte Werder aufopferungsvoll und hielt das 0:0 bei den Bayern. Am Ende bekamen die Bremer doch auf die Mütze. 3:0 gewann der Rekordmeister, weil zwei berechtigte Elfer einen… [+1266 chars]",,de,'Bayern'
https://www.transfermarkt.de/kane-trifft-29-elfer-am-stuck-ohne-strafstosse-auf-platz-18-unter-europas-top-torjagern/view/news/449976,https://www.transfermarkt.de/kane-trifft-29-elfer-am-stuck-ohne-strafstosse-auf-platz-18-unter-europas-top-torjagern/view/news/449976,0,www.transfermarkt.de,FC Bayern: Ohne Elfer wäre Kane auf Platz 18 unter Europas Torjägern,Mit seinem Doppelpack vom Punkt gegen Werder Bremen hat Bayern-Stürmer Harry Kane seine Serie auf 29 verwandelte Elfmeter ausgebaut. In dieser Bundesliga-Saison lautet die Quote des...,https://tmssl.akamaized.net/images/foto/big/harry-kane-fc-bayern-2025-1738963189-160523.jpg?lm=1738963203,2025-02-08T09:47:00Z,,Mit seinem Doppelpack vom Punkt gegen Werder Bremen hat Bayern-Stürmer Harry Kane seine Serie auf 29 verwandelte Elfmeter ausgebaut. In dieser Bundesliga-Saison lautet die Quote des Engländers neun v… [+2475 chars],,de,'Bayern'
https://www.bild.de/sport/fussball/fc-bayern-kurioser-ohrstecker-von-leroy-sane-67a70bd8334072169a3e32ac,https://www.bild.de/sport/fussball/fc-bayern-kurioser-ohrstecker-von-leroy-sane-67a70bd8334072169a3e32ac,0,www.bild.de,Was dahintersteckt - Bayern-Star Sané trägt ungewöhnliche Ohrstecker,Bayern-Star Leroy Sané überrascht mit unauffälligen Ohrsteckern - doch für eine Vertragsverlängerung zählt seine Leistung auf dem Platz.,"https://images.bild.de/67a70bd8334072169a3e32ac/5915d9c92b1c243d2e0580531535b461,90fe7094?w=1280",2025-02-08T09:47:23Z,https://web.archive.org/web/20250209022808/https://www.bild.de/sport/fussball/fc-bayern-kurioser-ohrstecker-von-leroy-sane-67a70bd8334072169a3e32ac,"Haben Sie so was schon mal gesehen?
Leroy Sané (29) durfte wieder über ein Tor jubeln. Nach seiner Einwechslung machte er das zweite Tor beim 3:0 gegen Werder Bremen. Was auffiel: Er trägt neuerding… [+2314 chars]",,de,'Bayern'
https://www.faz.net/aktuell/sport/fussball/bundesliga/bundesliga-fc-bayern-besiegt-werder-bremen-dank-unglaublicher-serie-110284247.html,https://www.faz.net/aktuell/sport/fussball/bundesliga/bundesliga-fc-bayern-besiegt-werder-bremen-dank-unglaublicher-serie-110284247.html,0,www.faz.net,„Absolut souverän“: Mit Rückenwind in wichtige Wochen,"Geduldige Bayern bezwingen Werder Bremen 3:0 – auch dank einer beeindruckenden Serie. Nun richten sie den Blick auf die kommenden Spiele, die die Mannschaft fordern werden.",https://media0.faz.net/ppmedia/aktuell/sport/2627999980/1.10284264/facebook_teaser/die-mannschaft-des-fc-bayern.jpg,2025-02-08T10:07:52Z,,"Es gibt diese Spiele, an die sich schon in wenigen Wochen kaum jemand mehr erinnert, weil sie einem simplen Zweck dienten: zu gewinnen und die Konkurrenz auf Distanz zu halten. Das 3:0 des FC Bayern … [+5943 chars]",,de,'Bayern'
https://www.bild.de/sport/fussball/fc-bayern-naechster-bayern-boss-mit-auffaelligen-aussagen-zu-florian-wirtz-67a70b62094c8360edaf5e76,https://www.bild.de/sport/fussball/fc-bayern-naechster-bayern-boss-mit-auffaelligen-aussagen-zu-florian-wirtz-67a70b62094c8360edaf5e76,0,www.bild.de,Nach Sieg gegen Bremen - Nächster Bayern-Boss mit Wirtz-Aussagen,Der nächste Bayern-Boss spricht über einen Wechsel von Leverkusen-Star Florian Wirtz.,"https://images.bild.de/67a70b62094c8360edaf5e76/994a30b463aafda895004fa17df1e83b,dcb70f61?w=1280",2025-02-08T10:15:07Z,,"Ob die Leverkusener das gerne hören? 
Vor dem Topspiel in einer Woche, bei dem Bayern gegen die Werkself (
Samstag ab 
18.30 Uhr, hier im BILD-Live-Ticker) die Vorentscheidung in der Meisterschaft… [+2009 chars]",,de,'Bayern'
https://www.bild.de/politik/inland/csu-gibt-vollgas-wir-sind-die-brandmauer-soeders-kampfansage-67a71f23094c8360edaf5f62,https://www.bild.de/politik/inland/csu-gibt-vollgas-wir-sind-die-brandmauer-soeders-kampfansage-67a71f23094c8360edaf5f62,0,www.bild.de,Wahlkampf-Vollgas - „Wir sind die Brandmauer!“ Söders Kampfansage,Markus Söder-Rundumschlag gegen Ampel und AfD!  Der Bayern-Regent heizte den Delegierten beim CSU-Parteitag ordentlich ein.,"https://images.bild.de/67a71f23094c8360edaf5f62/80073e5a2d996de3958043d9c9a96cfa,cc17ab5c?w=1280",2025-02-08T10:50:50Z,http://archive.md/20250208111612/https://www.bild.de/politik/inland/csu-gibt-vollgas-wir-sind-die-brandmauer-soeders-kampfansage-67a71f23094c8360edaf5f62,Großer Söder-Rundumschlag gegen Ampel und AfD! Bayern-Regent Markus Söder (58) heizte den Delegierten beim CSU-Parteitag ordentlich ein. Er strotzte wegen der für die Christsozialen äußert erfreulich… [+2062 chars],,de,'Bayern'
https://www.welt.de/sport/article255375586/FC-Bayern-Was-die-Bosse-zu-einem-Transfer-von-Florian-Wirtz-von-Bayer-Leverkusen-sagen.html,https://www.welt.de/sport/article255375586/FC-Bayern-Was-die-Bosse-zu-einem-Transfer-von-Florian-Wirtz-von-Bayer-Leverkusen-sagen.html,0,www.welt.de,Der nächste Bayern-Boss spricht über den Traum-Transfer Florian Wirtz,Der FC Bayern siegt dank Harry Kane gegen Werder Bremen. Doch die entscheidenden Spiele kommen erst. Vor der Spitzenpartie gegen Bayer Leverkusen äußert sich die Klubführung vielsagend zu Florian Wirtz. Das dürfte beim Gegner gar nicht gut ankommen.,https://img.welt.de/img/sport/mobile255375576/4167939567-ci16x9-w1200/Bayer-04-Leverkusen-v-1-FC-Koeln-DFB-Cup-Quarterfinal.jpg,2025-02-08T10:53:09Z,https://web.archive.org/web/20250209023431/https://www.welt.de/sport/article255375586/FC-Bayern-Was-die-Bosse-zu-einem-Transfer-von-Florian-Wirtz-von-Bayer-Leverkusen-sagen.html,Der FC Bayern siegt dank Harry Kane gegen Werder Bremen. Doch die entscheidenden Spiele kommen erst. Vor der Spitzenpartie gegen Bayer Leverkusen äußert sich die Klubführung vielsagend zu Florian Wir… [+4873 chars],,de,'Bayern'
https://www.kicker.de/wie-stark-ist-der-fc-bayern-1088948/artikel,https://www.kicker.de/wie-stark-ist-der-fc-bayern-1088948/artikel,0,www.kicker.de,Wie stark ist der FC Bayern?,Der FC Bayern gab sich auch am Freitag beim 3:0 gegen Bremen keine Blöße. Wirklich in Form wirkt der Tabellenführer vor den Spielen gegen Celtic Glasgow und in Leverkusen trotzdem nicht.,https://derivates.kicker.de/image/upload/w_4000%2Ch_2250%2Cc_fill%2Cg_auto:subject/w_1200%2Cq_auto/v1/2025/02/08/c3b87fb5-f7f8-443b-a4d6-962a325743c7.jpeg,2025-02-08T11:15:03Z,,"Der FC Bayern gab sich auch am Freitag beim 3:0 gegen Bremen keine Blöße. Wirklich in Form wirkt der Tabellenführer vor den Spielen gegen Celtic Glasgow und in Leverkusen trotzdem nicht. 
 ""Wir könn… [+2470 chars]",,de,'Bayern'
https://www.tagesspiegel.de/sport/bayerns-ausnahmesturmer-harry-kane-vom-punkt-trifft-er-immer-13167949.html,https://www.tagesspiegel.de/sport/bayerns-ausnahmesturmer-harry-kane-vom-punkt-trifft-er-immer-13167949.html,0,www.tagesspiegel.de,Bayerns Ausnahmestürmer Harry Kane: Vom Punkt trifft er immer,"Wenn Harry Kane am Elfmeterpunkt steht, ist klar, was passiert. Seine Serie baut Bayerns Torjäger beim 3:0 gegen Bremen auf 29 Treffer am Stück aus. Für einen Außerirdischen hält er sich aber nicht.",https://www.tagesspiegel.de/images/13168090/alternates/BASE_16_9_W1400/1739013792000/fussball-1-bundesliga-fc-bayern-muenchen-werder-bremen.jpeg,2025-02-08T11:23:59Z,,"Ein Alien? Nein, da winkte Harry Kane lachend ab. Noch nicht. Doch die Frage vor der TV-Kamera, ob er nach seinen Elfmetertoren 28 und 29 am Stück ein Außerirdischer sei, drängte sich nach dem 3:0 de… [+5090 chars]",,de,'Bayern'
https://www.focus.de/sport/fussball/darueber-moechte-ich-nicht-reden-bei-frage-nach-ausstiegsklausel-laesst-kane-reporter-eiskalt-abblitzen_b83a8d92-7960-4068-ad9a-73ed1dd9913c.html,https://www.focus.de/sport/fussball/darueber-moechte-ich-nicht-reden-bei-frage-nach-ausstiegsklausel-laesst-kane-reporter-eiskalt-abblitzen_b83a8d92-7960-4068-ad9a-73ed1dd9913c.html,0,www.focus.de,„Darüber möchte ich nicht reden“ - Bei Frage nach Ausstiegsklausel lässt Kane Reporter eiskalt abblitzen,In der vergangenen Woche wurde mehrfach von einer Ausstiegsklausel im Vertrag von Harry Kane beim FC Bayern berichtet. Jetzt hat der Stürmer zu den Meldungen Stellung bezogen.,https://quadro.burda-forward.de/ctf/b7aac52c-aec1-4022-be26-5ff9e3292b1f.2b714ecc-7e5a-4438-a7aa-1e3ad2eec2d6.jpeg?im=RegionOfInterestCrop%3D%281200%2C630%29%2CregionOfInterest%3D%28802%2C157%29&hash=39f58da3fcf9c546a0a9b76a84243690106b03ffd5bc91b6b78c490e8ca693dd,2025-02-08T11:32:00Z,,"Wie die Sport BILD unter der Woche berichtet hatte, wurde bei Harry Kanes Wechsel 2023 eine Ausstiegsklausel in seinem Vertrag beim FC Bayern eingebaut, die es ihm ermöglicht, vorzeitig nach England … [+1735 chars]",,de,'Bayern'
