index,url,valid,domain,title,description,image,published,archive,content,quote,language,keyword
https://www.stern.de/gesellschaft/regional/hessen/weissstoerche-in-hessen--fruehlingsboten--stoerche-starten-in-die-neue-brutsaison-37180278.html,https://www.stern.de/gesellschaft/regional/hessen/weissstoerche-in-hessen--fruehlingsboten--stoerche-starten-in-die-neue-brutsaison-37180278.html,0,www.stern.de,Weißstörche in Hessen: Frühlingsboten: Störche starten in die neue Brutsaison,Mit dem Frühling beginnt in Hessen die Brutsaison der Störche – begleitet von lautem Klappern und Nestkämpfen. Warum immer mehr Vögel auch im Winter bleiben.,https://image.stern.de/37180280/t/eD/v1/w1440/r1.7778/-/01--dns5caeb6uv8axs2048jpeg---cf411a4514ec9cdc.jpg,2026-03-01T03:00:50Z,,"Kopiere den aktuellen Link
Zur Merkliste hinzufügen
Mit dem Frühling beginnt in Hessen die Brutsaison der Störche begleitet von lautem Klappern und Nestkämpfen. Warum immer mehr Vögel auch im Winte… [+3491 chars]",,de,'Winter'
https://www.zeit.de/news/2026-03/01/schaetzung-bis-zu-460-000-frauen-mit-endometriose-in-bayern,https://www.zeit.de/news/2026-03/01/schaetzung-bis-zu-460-000-frauen-mit-endometriose-in-bayern,0,www.zeit.de,Gesundheit: Schätzung: Bis zu 460.000 Frauen mit Endometriose in Bayern,Hier finden Sie Informationen zu dem Thema „Gesundheit“. Lesen Sie jetzt „Schätzung: Bis zu 460.000 Frauen mit Endometriose in Bayern“.,https://img.zeit.de/news/2026-03/01/schaetzung-bis-zu-460-000-frauen-mit-endometriose-in-bayern-image-group/wide__1300x731,2026-03-01T03:00:53Z,,"Nach Angaben des bayerischen Gesundheitsministeriums leiden im Freistaat Schätzungen zufolge bis zu 460.000 Frauen an Endometriose. Diese Zahl ergebe sich auf Grundlage von Studien, denen zufolge 10 … [+1899 chars]",,de,'Bayern'
https://www.stern.de/panorama/jahreszeiten--fruehlingserwachen--das-besondere-an-krokus--pollen-und-co--37180288.html,https://www.stern.de/panorama/jahreszeiten--fruehlingserwachen--das-besondere-an-krokus--pollen-und-co--37180288.html,0,www.stern.de,"Jahreszeiten: Frühlingserwachen: das Besondere an Krokus, Pollen und Co.","Wenn Schneeglöckchen und Krokusse ihre Blüten aus der Erde stecken, verabschiedet sich der Winter so langsam. Was hinter diesen und anderen Frühlingsboten ungewohnt Kurioses steckt.",https://image.stern.de/37180290/t/xK/v1/w1440/r1.7778/-/01--zpccdarahjv1axs2048jpeg---dc3e09e70290301c.jpg,2026-03-01T03:13:05Z,,"Kopiere den aktuellen Link
Zur Merkliste hinzufügen
Wenn Schneeglöckchen und Krokusse ihre Blüten aus der Erde stecken, verabschiedet sich der Winter so langsam. Was hinter diesen und anderen Frühl… [+5457 chars]",,de,'Winter'
https://www.tagesspiegel.de/gesellschaft/panorama/jahreszeiten-fruhlingserwachen-das-besondere-an-krokus-pollen-und-co-15304624.html,https://www.tagesspiegel.de/gesellschaft/panorama/jahreszeiten-fruhlingserwachen-das-besondere-an-krokus-pollen-und-co-15304624.html,0,www.tagesspiegel.de,"Jahreszeiten: Frühlingserwachen: das Besondere an Krokus, Pollen und Co.","Wenn Schneeglöckchen und Krokusse ihre Blüten aus der Erde stecken, verabschiedet sich der Winter so langsam. Was hinter diesen und anderen Frühlingsboten ungewohnt Kurioses steckt.",https://www.tagesspiegel.de/images/15304623/alternates/BASE_16_9_W1400/1772334871000/winterling-in-sachsen.jpeg,2026-03-01T03:14:31Z,,"Wenn die ersten Schneeglöckchen und Krokusse mutig durch den kalten Boden brechen und der feine Pollenflug die ersten Nasen reizt, kündigt der Frühling leise seine Rückkehr an. Meteorologisch betrach… [+5270 chars]",,de,'Winter'
https://www.nzz.ch/feuilleton/tanzen-fuer-die-freiheit-das-nationalballett-der-ukraine-trotzt-dem-krieg-ld.1926450,https://www.nzz.ch/feuilleton/tanzen-fuer-die-freiheit-das-nationalballett-der-ukraine-trotzt-dem-krieg-ld.1926450,0,www.nzz.ch,Tanzen für die Freiheit – das Nationalballett der Ukraine trotzt dem Krieg,"Die Tänzerinnen und Tänzer der Kiewer Kompanie treten unter schwierigsten Bedingungen weiterhin auf und gastieren auch im Ausland. Im Festspielhaus Baden-Baden war zu erleben, wie umfassend der Krieg das Leben der Künstler, aber auch die Kunst selbst veränder…","https://img.nzz.ch/2026/02/25/627cbd20-86a4-46a4-b971-33f9d4fde4d3.jpg?width=1200&height=674&fit=bounds&quality=75&auto=webp&crop=2655,1493,x0,y277&wmark=nzz",2026-03-01T04:30:00Z,,"Jeden Morgen um 9 steht in Kiew die Welt eine Minute lang still. Die Menschen verharren auf den Gehsteigen, etliche gehen auf die Knie, senken die Köpfe, schweigen. Danach wird die Nationalhymne gesp… [+19431 chars]",,de,'Winter'
https://www.n-tv.de/wirtschaft/Jan-Rabe-von-Rabot-Energy-Gaskraftwerke-werden-wir-bald-nicht-mehr-benoetigen-id30403419.html,https://www.n-tv.de/wirtschaft/Jan-Rabe-von-Rabot-Energy-Gaskraftwerke-werden-wir-bald-nicht-mehr-benoetigen-id30403419.html,0,www.n-tv.de,"Das ist das neue Energiesystem: ""Gaskraftwerke werden wir bald nicht mehr benötigen""","Smartmeter und Batteriespeicher sind die Bausteine für das Energiesystem der Zukunft. Und dynamische Tarife. ""Man speichert Strom, wenn er günstig ist, um ihn zu verwenden, wenn er teuer ist"", sagt ein Energieunternehmer im ""Klima-Labor"" von ntv. Das spart Ge…",https://www.n-tv.de/img/30404971/1772191189/Img_16_9/1200/Frachtschiffe-auf-dem-Rhein-vor-der-Kulisse-des-Kraftwerk-Huckingen-Gaskraftwerk-der-HKM-Huettenwerke-Krupp-Mannesmann-Betriebsfuehrung-durch-RWE-Generation-Betrieben-mit-Kuppelgas-aus-der-Stahlerzeugung-und-der-Kokerei-Kokereigas-Kuehltuerme-Duisburg-NRW-Deutschland.jpg,2026-03-01T06:38:18Z,,"Das Gaskraftwerk Huckingen in Duisburg: Nur noch notwendig, um das Sicherheitsbedürfnis vieler Menschen zu erfüllen? (Foto: picture alliance / Jochen Tack)
Digital? Für das deutsche Stromsystem ein … [+11828 chars]",,de,'Gas'
https://www.welt.de/reise/article698ed34c616e1cbb1fcd4bf6/engadin-in-der-schweiz-winter-in-der-abgeschiedenheit-im-tal-der-letzten-dorfbewohner.html,https://www.welt.de/reise/article698ed34c616e1cbb1fcd4bf6/engadin-in-der-schweiz-winter-in-der-abgeschiedenheit-im-tal-der-letzten-dorfbewohner.html,0,www.welt.de,Völlige Ruhe im Tal der letzten Dorfbewohner,"Wenn es schneit, kann man das S-charl-Tal im Engadin nur zu Fuß oder mit dem Pferdeschlitten erreichen. Der Winterurlaub dort ist perfekt zum Runterkommen. Im Dorf halten als einzige dauerhafte Einwohner ein Wirt und seine Partnerin die Stellung.",https://images.welt.de/698ed34c616e1cbb1fcd4bf6/65e1639fa8776235cdb6d213501ad5f6/ci16x9-w1200/s-charl-c-thalia-wunsche-jpg,2026-03-01T06:47:17Z,,"Wenn es schneit, kann man das S-charl-Tal im Engadin nur zu Fuß oder mit dem Pferdeschlitten erreichen. Der Winterurlaub dort ist perfekt zum Runterkommen. Im Dorf halten als einzige dauerhafte Einwo… [+10844 chars]",,de,'Winter'
https://www.faz.net/aktuell/wirtschaft/brauche-ich-eine-waermepumpe-accg-110845271.html,https://www.faz.net/aktuell/wirtschaft/brauche-ich-eine-waermepumpe-accg-110845271.html,0,www.faz.net,Heizungsfrage: Funktioniert die Wärmepumpe sogar im Fachwerkhaus?,"Gasheizungen bleiben erlaubt. Der Eigentümer eines Fachwerkhauses fragt sich, was jetzt besser ist – eine Wärmepumpe oder doch die Grüngasheizung?",https://media0.faz.net/image/w1200h627/4dccc5fe17d7/w3000h1567x0y152o/202412/43601.0.741662566/fachwerkhaeuser-praegen-das.webp,2026-03-01T08:16:30Z,,Wie wollen wir in Zukunft heizen? Darüber machen sich in Deutschland nicht nur Millionen Haushalte mit teilweise hochbetagten Öl- und Gasheizungen Gedanken. Auch die schwarz-rote Bundesregierung hat … [+224 chars],,de,'Gas'
https://www.spektrum.de/news/aktuelles-am-himmel-maerz-2026/2295102,https://www.spektrum.de/news/aktuelles-am-himmel-maerz-2026/2295102,0,www.spektrum.de,Aktuelles am Himmel im März 2026: Der Winter geht auch am Sternenhimmel,Mit den länger werdenden Tagen zeigen sich neue Schauspiele am Abendhimmel: Anfang März stehen sich Saturn und Venus auffällig nah. Mehr Highlights auf den folgenden Seiten.,https://static.spektrum.de/fm/912/f1920x1080/Teaser_Startrails.jpg,2026-03-01T09:00:00Z,,"Bei Sonnenuntergang steht er noch hoch am Himmel, der stolze Jäger Orion, der die dunklen, kalten Winternächte beherrschte. Da die Tage nun spürbar länger werden, verblasst die auffällige Sternfigur … [+1874 chars]",,de,'Winter'
https://www.tagesspiegel.de/sport/tischtennis-in-singapur-grand-smash-erst-dritte-chinesin-stoppt-sabine-winter-15304862.html,https://www.tagesspiegel.de/sport/tischtennis-in-singapur-grand-smash-erst-dritte-chinesin-stoppt-sabine-winter-15304862.html,0,www.tagesspiegel.de,Tischtennis in Singapur: Grand Smash: Erst dritte Chinesin stoppt Sabine Winter,Siege gegen Topspielerinnen aus China sind die härteste Währung im internationalen Tischtennis. Zwei von ihnen hat die Deutsche Sabine Winter beim Grand Smash geschlagen - eine Dritte war zu stark.,https://www.tagesspiegel.de/images/15304861/alternates/BASE_16_9_W1400/1772358236000/sabine-winter.jpeg,2026-03-01T09:43:56Z,,Die Siegesserie der deutschen Tischtennis-Nationalspielerin Sabine Winter ist beim ersten Grand-Smash-Turnier des Jahres erst im Halbfinale gestoppt worden. Die aktuell beste Spielerin Europas verlor… [+876 chars],,de,'Winter'
https://www.tagesspiegel.de/sport/ski-alpin-zweiter-coup-von-ski-juwel-aicher-nun-jagd-auf-kristall-15304987.html,https://www.tagesspiegel.de/sport/ski-alpin-zweiter-coup-von-ski-juwel-aicher-nun-jagd-auf-kristall-15304987.html,0,www.tagesspiegel.de,Ski Alpin: Zweiter Coup von Ski-Juwel Aicher: Nun Jagd auf Kristall,Emma Aicher bleibt auch nach den Winterspielen in Topform. In Andorra deklassiert sie die Konkurrenz und legt tags darauf noch ein Podest nach. Holt sie nach zwei Olympia-Medaillen auch Kristall?,https://www.tagesspiegel.de/images/15305498/alternates/BASE_16_9_W1400/1772369907000/ski-alpin-weltcup.jpeg,2026-03-01T10:23:32Z,,Emma Aicher grinste breit und ließ sich erneut auf Schultern tragen. Ihren zweiten Platz im Super-G von Soldeu feierte die derzeit so famose deutsche Skirennfahrerin fast wie den Triumph nur 24 Stund… [+2982 chars],,de,'Winter'
https://orf.at/stories/3421771/,https://orf.at/stories/3421771/,0,orf.at,Selenskyj: Moskau griff im Winter mit 19.000 Drohnen an,,https://orf.at/mojo/1_4_1/storyserver//news/common/images/og-fallback-news.png,2026-03-01T10:24:09Z,,Russland hat in der Nacht auf heute erneut die Ukraine mit Angriffen überzogen. In der Region Dnipropetrowsk wurden laut Militärgouverneur Olexandr Hanscha bei Attacken mit Drohnen und Artillerie ein… [+998 chars],,de,'Winter'
https://www.stern.de/news/reiche-will-gasfoerderung-in-deutschland-ankurbeln---gruene-verurteilen-vorstoss-37178544.html,https://www.stern.de/news/reiche-will-gasfoerderung-in-deutschland-ankurbeln---gruene-verurteilen-vorstoss-37178544.html,0,www.stern.de,Reiche will Gasförderung in Deutschland ankurbeln - Grüne verurteilen Vorstoß,"Bundeswirtschaftsministerin Katherina Reiche (CDU) will die Förderung von heimischem Gas ausweiten. ""Wir haben eigene Reserven in Deutschland"", sagte Reiche den Zeitungen der Funke Mediengruppe vom Samstag. Die Bundesregierung wolle die Gasförderung ""nicht we…",https://image.stern.de/37180896/t/eH/v1/w1440/r1.7778/-/01--ministerin-reiche---751256177868011c.jpg,2026-03-01T10:35:13Z,,"Kopiere den aktuellen Link
Zur Merkliste hinzufügen
Bundeswirtschaftsministerin Katherina Reiche (CDU) will die Förderung von heimischem Gas ausweiten. ""Wir haben eigene Reserven in Deutschland"", s… [+3049 chars]",,de,'Gasspeicher'
https://www.zeit.de/news/2026-03/02/oelpreise-ziehen-wegen-nahost-eskalation-kraeftig-an,https://www.zeit.de/news/2026-03/02/oelpreise-ziehen-wegen-nahost-eskalation-kraeftig-an,0,www.zeit.de,Rohstoffe: Ölpreise ziehen wegen Nahost-Eskalation kräftig an,Hier finden Sie Informationen zu dem Thema „Rohstoffe“. Lesen Sie jetzt „Ölpreise ziehen wegen Nahost-Eskalation kräftig an“.,https://img.zeit.de/news/2026-03/02/oelpreise-ziehen-wegen-nahost-eskalation-kraeftig-an-image-group/wide__1300x731,2026-03-01T23:54:39Z,,Die Ölpreise haben nach der Eskalation im Nahen Osten am Wochenende wie erwartet deutlich zugelegt. Ein Barrel (159 Liter) der Nordseesorte Brent zur Lieferung im April verteuerte sich in den ersten … [+1158 chars],,de,'Energiepreise'
https://www.zeit.de/news/2026-03/02/sprit-so-teuer-wie-seit-fast-zwei-jahren-nicht-mehr,https://www.zeit.de/news/2026-03/02/sprit-so-teuer-wie-seit-fast-zwei-jahren-nicht-mehr,0,www.zeit.de,Energiepreise: Sprit so teuer wie seit fast zwei Jahren nicht mehr,Hier finden Sie Informationen zu dem Thema „Energiepreise“. Lesen Sie jetzt „Sprit so teuer wie seit fast zwei Jahren nicht mehr“.,https://img.zeit.de/news/2026-03/02/sprit-so-teuer-wie-seit-fast-zwei-jahren-nicht-mehr-image-group/wide__1300x731,2026-03-02T08:27:03Z,,"Die Eskalation im Nahen Osten treibt auch die Preise an deutschen Tankstellen. Bisher fällt der Ausschlag aber vergleichsweise gering aus, wie Zahlen des ADAC zeigen. Im bundesweiten Tagesdurchschnit… [+1761 chars]",,de,'Energiepreise'
https://www.tagesspiegel.de/wirtschaft/energie-iran-krieg-lasst-erdgas-preis-nach-oben-schnellen-15306580.html,https://www.tagesspiegel.de/wirtschaft/energie-iran-krieg-lasst-erdgas-preis-nach-oben-schnellen-15306580.html,0,www.tagesspiegel.de,Energie: Iran-Krieg lässt Erdgas-Preis nach oben schnellen,"Nach dem Angriff auf den Iran steigt der Erdgaspreis so stark wie lange nicht. Analysten warnen vor weiteren Preissprüngen, sollte der Konflikt andauern.",https://www.tagesspiegel.de/images/15306692/alternates/BASE_16_9_W1400/1772443754000/gasspeicher.jpeg,2026-03-02T08:28:21Z,,Der Großhandelspreis für Erdgas ist nach dem Angriff Israels und der USA auf den Iran kräftig gestiegen. Zum Handelsauftakt am Montag sprang die Notierung für den richtungweisenden Terminkontrakt TTF… [+2170 chars],,de,'Gasspeicher'
https://www.zeit.de/politik/ausland/2026-03/usa-praesident-donald-trump-iran-angriff-oeffentlichkeit-auftritt-ziele-unklarheit,https://www.zeit.de/politik/ausland/2026-03/usa-praesident-donald-trump-iran-angriff-oeffentlichkeit-auftritt-ziele-unklarheit,0,www.zeit.de,Donald Trump: Der Präsident meidet sein Land,Seit zwei Tagen führen die USA Krieg gegen den Iran. Donald Trump ist bislang kein einziges Mal vor die Öffentlichkeit getreten. Seine Ziele in Nahost bleiben unklar.,https://img.zeit.de/politik/ausland/2026-03/usa-praesident-donald-trump-iran-angriff-oeffentlichkeit-auftritt-ziele-unklarheit-bild/wide__1300x731,2026-03-02T09:05:50Z,,"Schließen
Artikelzusammenfassung
Ajatollah Ali Chamenei ist tot, amerikanische Soldaten fallen in Kuwait, Iran greift Verbündete an, Ölpreis steigt, Börsen geben nach. Trump schweigt zu den Ereigni… [+601 chars]",,de,'Krieg'
https://www.stern.de/news/energie--iran-krieg-laesst-erdgas-preis-nach-oben-schnellen-37182588.html,https://www.stern.de/news/energie--iran-krieg-laesst-erdgas-preis-nach-oben-schnellen-37182588.html,0,www.stern.de,Energie: Iran-Krieg lässt Erdgas-Preis nach oben schnellen,"Nach dem Angriff auf den Iran steigt der Erdgaspreis so stark wie lange nicht. Analysten warnen vor weiteren Preissprüngen, sollte der Konflikt andauern.",https://image.stern.de/37182864/t/mZ/v1/w1440/r1.7778/-/02--zxcojjl6jov2axs2048jpeg---e622a9cf1f4362f3.jpg,2026-03-02T09:28:04Z,,"Kopiere den aktuellen Link
Zur Merkliste hinzufügen
Nach dem Angriff auf den Iran steigt der Erdgaspreis so stark wie lange nicht. Analysten warnen vor weiteren Preissprüngen, sollte der Konflikt a… [+2281 chars]",,de,'Gasspeicher'
https://www.tagesspiegel.de/wirtschaft/borsen-unter-druck-iran-krieg-lasst-aktienmarkt-einknicken-gold-gefragt-15306835.html,https://www.tagesspiegel.de/wirtschaft/borsen-unter-druck-iran-krieg-lasst-aktienmarkt-einknicken-gold-gefragt-15306835.html,0,www.tagesspiegel.de,Börsen unter Druck: Iran-Krieg lässt Aktienmarkt einknicken - Gold gefragt,"Mit der Eskalation des Iran-Konflikts herrscht Unsicherheit an den Börsen. Während der Aktienindex Dax fällt, springen die Preise für Öl und Gas hoch. Viel hängt nun von der Dauer des Kriegs ab.",https://www.tagesspiegel.de/images/15306834/alternates/BASE_16_9_W1400/1772445152000/borse-frankfurt.jpeg,2026-03-02T09:52:32Z,,Die Eskalation des Iran-Konflikts sorgt für große Verunsicherung an den Finanzmärkten. Vor allem der Anstieg der Gas- und Ölpreise wegen der Einschränkung des Schiffsverkehrs durch die Straße von Hor… [+2185 chars],,de,'Krieg'
https://www.zeit.de/feuilleton/2026-03/iran-krieg-usa-israel-konflikt,https://www.zeit.de/feuilleton/2026-03/iran-krieg-usa-israel-konflikt,0,www.zeit.de,Krieg im Iran: Eine neue Art des Krieges,"Nach dem Kidnapping Maduros versuchen die USA auch im Iran den Krieg durch die ""Enthauptung"" der Staatsspitze abzukürzen. Nur wird das hier nicht einfach gelingen.",https://img.zeit.de/feuilleton/2026-03/iran-krieg-usa-israel/wide__1300x731,2026-03-02T11:02:09Z,,"Zum zweiten Mal ist innerhalb kürzester Zeit ein sogenannter ""Enthauptungsschlag"" gegen ein gegnerisches Regime gelungen, dessen Ziel es ist, einen sonst vermutlich lange währenden Krieg abzukürzen o… [+542 chars]",,de,'Krieg'
https://www.zeit.de/news/2026-03/02/wirtschaft-fuerchtet-hoehere-energiepreise-und-lieferstoerungen,https://www.zeit.de/news/2026-03/02/wirtschaft-fuerchtet-hoehere-energiepreise-und-lieferstoerungen,0,www.zeit.de,Angriff auf den Iran: Wirtschaft fürchtet höhere Energiepreise und Lieferstörungen,Hier finden Sie Informationen zu dem Thema „Angriff auf den Iran“. Lesen Sie jetzt „Wirtschaft fürchtet höhere Energiepreise und Lieferstörungen“.,https://img.zeit.de/news/2026-03/02/wirtschaft-fuerchtet-hoehere-energiepreise-und-lieferstoerungen-image-group/wide__1300x731,2026-03-02T11:53:38Z,,"Der Angriff der USA und Israels auf den Iran wird nach Einschätzung der bayerischen Wirtschaft Folgeschäden für die heimischen Unternehmen nach sich ziehen. Neben einem Anstieg der Öl-, Benzin- und G… [+1509 chars]",,de,'Energiepreise'
https://www.zeit.de/news/2026-03/02/ministerin-reiche-erwartet-preisaufschlaege-durch-iran-krieg,https://www.zeit.de/news/2026-03/02/ministerin-reiche-erwartet-preisaufschlaege-durch-iran-krieg,0,www.zeit.de,Krieg in Nahost: Ministerin Reiche erwartet Preisaufschläge durch Iran-Krieg,Hier finden Sie Informationen zu dem Thema „Krieg in Nahost“. Lesen Sie jetzt „Ministerin Reiche erwartet Preisaufschläge durch Iran-Krieg“.,https://img.zeit.de/news/2026-03/02/ministerin-reiche-erwartet-preisaufschlaege-durch-iran-krieg-image-group/wide__1300x731,2026-03-02T12:27:10Z,,"Der Iran-Krieg bringt aus Sicht von Bundeswirtschaftsministerin Katherina Reiche neue Unsicherheit für die deutsche Wirtschaft. Preisaufschläge auf den Märkten seien bereits sichtbar, die weitere Ent… [+1505 chars]",,de,'Energiepreise'
https://orf.at/stories/3421970/,https://orf.at/stories/3421970/,0,orf.at,Angriff auf Iran lässt Energiepreise steigen,"Nach dem Angriff Israels und der USA auf den Iran ist der Großhandelspreis von Erdgas kräftig gestiegen. Der Preis betrug am Montag zu Handelsbeginn etwa 25 Prozent mehr als am Freitag, es war der stärkste Preissprung seit August 2023. Auch die Ölpreise legte…",https://ibs.orf.at/news?image=https%3A%2F%2Fassets.orf.at%2Fmims%2F2026%2F10%2F13%2Fcrops%2Fw%3D1200%2Ch%3D630%2Cq%3D75%2F2954501_master_1142213_iran_krieg_oel_gas_r.jpg%3Fs%3D690c54d49f29e18b8ba142163944fd55bdd975b4,2026-03-02T12:29:18Z,,Die Straße von Hormus ist eine der wichtigsten Engstellen des weltweiten Energiehandels. Rund ein Fünftel der globalen Öltransporte passiert täglich die Meerenge in der ölreichen Region am Persischen… [+3931 chars],,de,'Öl'
https://www.stern.de/wirtschaft/news/folgen-fuer-die-wirtschaft--iran-krieg-trifft-deutschland--sprit-und-gas-deutlich-teurer-37183546.html,https://www.stern.de/wirtschaft/news/folgen-fuer-die-wirtschaft--iran-krieg-trifft-deutschland--sprit-und-gas-deutlich-teurer-37183546.html,0,www.stern.de,Folgen für die Wirtschaft: Iran-Krieg trifft Deutschland: Sprit und Gas deutlich teurer,Der Irankonflikt hat Folgen für Verbraucher und Wirtschaft - von steigenden Kosten für Heizen und Tanken über sinkende Aktienkurse bis Sorgen um die Konjunktur. Viel hängt von der Dauer des Kriegs ab.,https://image.stern.de/37183790/t/9r/v1/w1440/r1.7778/-/02--qod5shm4n3v1axs2048jpeg---2c09ea15c4e45baf.jpg,2026-03-02T12:39:30Z,,"Kopiere den aktuellen Link
Zur Merkliste hinzufügen
Der Irankonflikt hat Folgen für Verbraucher und Wirtschaft - von steigenden Kosten für Heizen und Tanken über sinkende Aktienkurse bis Sorgen um … [+6329 chars]",,de,'Heizen'
https://www.tagesspiegel.de/wirtschaft/folgen-fur-die-wirtschaft-iran-krieg-trifft-deutschland-sprit-und-gas-deutlich-teurer-15307835.html,https://www.tagesspiegel.de/wirtschaft/folgen-fur-die-wirtschaft-iran-krieg-trifft-deutschland-sprit-und-gas-deutlich-teurer-15307835.html,0,www.tagesspiegel.de,Folgen für die Wirtschaft: Iran-Krieg trifft Deutschland: Sprit und Gas deutlich teurer,Der Irankonflikt hat Folgen für Verbraucher und Wirtschaft - von steigenden Kosten für Heizen und Tanken über sinkende Aktienkurse bis Sorgen um die Konjunktur. Viel hängt von der Dauer des Kriegs ab.,https://www.tagesspiegel.de/images/15307834/alternates/BASE_16_9_W1400/1772455261000/kraftstoffpreise-an-der-tankstelle.jpeg,2026-03-02T12:41:01Z,,"Rasant steigende Öl-, Sprit und Gaspreise, Aktien unter Druck, Sorgen um die Konjunktur: Der Iran-Krieg sorgt für große Unsicherheit und könnte die Wirtschaft in Deutschland treffen - sofern die Kämp… [+6161 chars]",,de,'Gas'
https://www.zeit.de/news/2026-03/02/was-der-iran-krieg-fuer-schiffe-und-haefen-bedeutet,https://www.zeit.de/news/2026-03/02/was-der-iran-krieg-fuer-schiffe-und-haefen-bedeutet,0,www.zeit.de,Krieg in Nahost: Was der Iran-Krieg für Schiffe und Häfen bedeutet,Hier finden Sie Informationen zu dem Thema „Krieg in Nahost“. Lesen Sie jetzt „Was der Iran-Krieg für Schiffe und Häfen bedeutet“.,https://img.zeit.de/news/2026-03/02/was-der-iran-krieg-fuer-schiffe-und-haefen-bedeutet-image-group/wide__1300x731,2026-03-02T14:37:04Z,,"Der Iran-Krieg hat weltweite Folgen. Auch norddeutsche Schifffahrts- und Logistikunternehmen sind von Auswirkungen betroffen. Der Vorsitzende der Industrie- und Handelskammern Nord, André Grobien, sa… [+4735 chars]",,de,'Krieg'
https://www.nzz.ch/pro/der-krieg-in-nahost-schuert-das-gespenst-der-siebziger-jahre-kommt-es-zu-einer-neuen-erdoel-und-erdgaskrise-ld.1927375,https://www.nzz.ch/pro/der-krieg-in-nahost-schuert-das-gespenst-der-siebziger-jahre-kommt-es-zu-einer-neuen-erdoel-und-erdgaskrise-ld.1927375,0,www.nzz.ch,Der Krieg in Nahost schürt das Gespenst der siebziger Jahre: Kommt es zu einer neuen Erdöl- und Erdgaskrise?,"Der Iran-Krieg hat zu Produktionsstopps geführt und den Verkehr in der Strasse von Hormuz vorerst zum Erliegen gebracht. Erdöl ist um 10 Prozent, Erdgas in Europa gar um 40 Prozent teurer geworden.","https://img.nzz.ch/2026/03/02/5e1a0c78-c976-4c07-9193-b6920dd9f974.jpg?width=1200&height=675&fit=bounds&quality=75&auto=webp&crop=5900,3319,x0,y307&wmark=nzz",2026-03-03T04:30:00Z,,"Der Iran-Krieg hat zu Produktionsstopps geführt und den Verkehr in der Strasse von Hormuz vorerst zum Erliegen gebracht. Erdöl ist um 10Prozent, Erdgas in Europa gar um 40Prozent teurer geworden.
Zu… [+6958 chars]",,de,'Krieg'
https://www.bild.de/leben-wissen/mein-recht-verbraucherportal/heizen-im-fruehling-diese-heiztipps-sparen-jetzt-kosten-69a686cb4ffe244904b65e1e,https://www.bild.de/leben-wissen/mein-recht-verbraucherportal/heizen-im-fruehling-diese-heiztipps-sparen-jetzt-kosten-69a686cb4ffe244904b65e1e,0,www.bild.de,Heizen im Frühling - Diese Heiztipps sparen jetzt Kosten,Cleveres Heizen und Lüften im Frühling senkt Energieverbrauch und Heizkosten.,"https://images.bild.de/69a686cb4ffe244904b65e1e/b5f3a2a9e15559371f900bb95a50b716,40345999?w=1280",2026-03-03T10:17:35Z,,"TTS-Player überspringenArtikel weiterlesenBerlin (ots) Der Winter ist so gut wie vorbei, der Frühling naht und mit ihm ein Wetterchaos der besonderen Art. Morgens frostig, mittags mild, abends wieder… [+2029 chars]",,de,'Energie sparen'
https://www.diepresse.com/20642114/gaspreise-in-europa-fast-verdoppelt-bringt-der-angriff-auf-den-iran-als,https://www.diepresse.com/20642114/gaspreise-in-europa-fast-verdoppelt-bringt-der-angriff-auf-den-iran-als,0,www.diepresse.com,Gaspreise in Europa fast verdoppelt: Was bedeutet das für Konsumenten? [premium],"Experten warnen, dass sich die europäische Energiekrise von 2022 durch die Eskalation im Iran wiederhole – „nur diesmal schlimmer“. Was ist da dran? „Die Presse“ beantwortet die fünf wichtigsten Fragen.",https://img.diepresse.com/public/incoming/dojibx-china-usalng/alternates/DPR_SOCIAL_MAGAZIN/CHINA-USALNG,2026-03-03T13:05:16Z,,"Die koordinierten Angriffe von Israel und den USA auf den Iran bringen Europa neuerlich an den Rand einer Energiekrise. Die wichtige Transportroute über die Straße von Hormus ist geschlossen, der zwe… [+5261 chars]",,de,'Gasspeicher'
https://www.dw.com/de/iranische-luftangriffe-sch%C3%BCren-energie%C3%A4ngste/a-76203467,https://www.dw.com/de/iranische-luftangriffe-sch%C3%BCren-energie%C3%A4ngste/a-76203467,0,www.dw.com,Iranische Luftangriffe schüren Energieängste,"Iranische Angriffe auf Raffinerien, Gasanlagen und Öltanker gefährden die globale Energieversorgung und bergen das Risiko schwerwiegender wirtschaftlicher Folgen weltweit. Sie zwingen die Verbraucher zum Sparen. Der Krieg im Nahen Osten stellt Investoren auf …",https://static.dw.com/image/76199392_6.jpg,2026-03-03T17:31:00Z,,"Der Krieg im Nahen Osten stellt Investoren auf der ganzen Welt vor die Aufgabe, die Auswirkungen eines langwierigen regionalen Konflikts auf die weltweite Energieversorgung und sein Potenzial, die In… [+8018 chars]",,de,'Öl'
