index,url,valid,domain,title,description,image,published,archive,content,quote,language,keyword
https://www.stern.de/gesellschaft/regional/bayern/klimawandel--schmelzender-pistenspass--bald-schwimmlager-statt-skilager--35601378.html,https://www.stern.de/gesellschaft/regional/bayern/klimawandel--schmelzender-pistenspass--bald-schwimmlager-statt-skilager--35601378.html,0,www.stern.de,Klimawandel: Schmelzender Pistenspaß: Bald Schwimmlager statt Skilager?,Der Schnee schmilzt - und mit ihm die Chance auf Wintersport. Sollen Kinder überhaupt noch Ski- und Snowboardfahren lernen? Und sollten Schulklassen weiter ins Skilager fahren?,https://image.stern.de/35601380/t/9A/v1/w1440/r1.7778/-/01--nkrwv6lizzv1axs2048jpeg---5fbb062d5ac49111.jpg,2025-04-01T02:30:37Z,,"Kopiere den aktuellen Link
Zur Merkliste hinzufügen
Der Schnee schmilzt - und mit ihm die Chance auf Wintersport. Sollen Kinder überhaupt noch Ski- und Snowboardfahren lernen? Und sollten Schulklas… [+3480 chars]",,de,'Winter'
https://www.stern.de/lifestyle/top-amazon-deal--jack-wolfskin-schuhe-heute-bis-40-prozent-guenstiger-35150574.html,https://www.stern.de/lifestyle/top-amazon-deal--jack-wolfskin-schuhe-heute-bis-40-prozent-guenstiger-35150574.html,0,www.stern.de,Vojo 3 Texapore Mid W : Wasserdichte Outdoorschuhe von Jack Wolfskin heute zum Schnäppchenpreis,Auch im Winter sind Wanderungen beliebt. Neben der passenden Kleidung sind wetterfeste Outdoorschuhe wichtig für trockene Füße. Und die sind bei Jack Wolfskin gerade stark reduziert.,https://image.stern.de/35150576/t/yC/v3/w1440/r1.7778/-/deal-news-jack-wolfskin.jpg,2025-04-01T05:17:00Z,,"Kopiere den aktuellen Link
Zur Merkliste hinzufügen
Auch im Winter sind Wanderungen beliebt. Neben der passenden Kleidung sind wetterfeste Outdoorschuhe wichtig für trockene Füße. Und die sind bei … [+1468 chars]",,de,'Winter'
https://www.zeit.de/news/2025-04/01/mildere-temperaturen-und-mehr-sonne-in-bayern,https://www.zeit.de/news/2025-04/01/mildere-temperaturen-und-mehr-sonne-in-bayern,0,www.zeit.de,Wettervorhersage: Mildere Temperaturen und mehr Sonne in Bayern,Hier finden Sie Informationen zu dem Thema „Wettervorhersage“. Lesen Sie jetzt „Mildere Temperaturen und mehr Sonne in Bayern“.,https://img.zeit.de/news/2025-04/01/mildere-temperaturen-und-mehr-sonne-in-bayern-image-group/wide__1300x731,2025-04-01T06:18:52Z,,"Nach mehreren kühlen Tagen sind wieder frühlingshafte Temperaturen und mehr Sonne in Aussicht. Der Dienstag ist jedoch noch im Süden Bayerns nass, wie der Deutsche Wetterdienst (DWD) mitteilte. Hier … [+557 chars]",,de,'Bayern'
https://www.zeit.de/news/2025-04/01/nur-noch-9-gerichte-in-bayern-entscheiden-ueber-abschiebehaft,https://www.zeit.de/news/2025-04/01/nur-noch-9-gerichte-in-bayern-entscheiden-ueber-abschiebehaft,0,www.zeit.de,Kabinett: Nur noch 9 Gerichte in Bayern entscheiden über Abschiebehaft,Hier finden Sie Informationen zu dem Thema „Kabinett“. Lesen Sie jetzt „Nur noch 9 Gerichte in Bayern entscheiden über Abschiebehaft“.,https://img.zeit.de/news/2025-04/01/nur-noch-9-gerichte-in-bayern-entscheiden-ueber-abschiebehaft-image-group/wide__1300x731,2025-04-01T11:29:03Z,,In Bayern werden Verfahren über die Verhängung einer Abschiebehaft künftig nur noch an 9 der 73 Amtsgerichte verhandelt. Das hat der Ministerrat beschlossen. Durch diese Bündelung solle «eine effizie… [+1599 chars],,de,'Bayern'
