index,url,valid,domain,title,description,image,published,archive,content,quote,language,keyword
https://www.zeit.de/news/2026-01/01/us-medien-laut-cia-kein-angriff-kiews-auf-putins-residenz,https://www.zeit.de/news/2026-01/01/us-medien-laut-cia-kein-angriff-kiews-auf-putins-residenz,0,www.zeit.de,Ukraine-Krieg: US-Medien: Laut CIA kein Angriff Kiews auf Putins Residenz,Hier finden Sie Informationen zu dem Thema „Ukraine-Krieg“. Lesen Sie jetzt „US-Medien: Laut CIA kein Angriff Kiews auf Putins Residenz“.,https://img.zeit.de/news/2026-01/01/us-medien-laut-cia-kein-angriff-kiews-auf-putins-residenz-image-group/wide__1300x731,2026-01-01T02:12:18Z,,"Der US-Geheimdienst CIA ist Medienberichten zufolge zu dem Schluss gekommen, dass einer der jüngsten Drohnenangriffe der Ukraine nicht den russischen Präsidenten Wladimir Putin oder dessen Residenz z… [+3122 chars]",,de,'Putin'
https://www.zeit.de/news/2026-01/01/csu-setzt-auf-rueckkehr-der-atomkraft-in-deutschland,https://www.zeit.de/news/2026-01/01/csu-setzt-auf-rueckkehr-der-atomkraft-in-deutschland,0,www.zeit.de,Winterklausur in Kloster Seeon: CSU setzt auf Rückkehr der Atomkraft in Deutschland,Hier finden Sie Informationen zu dem Thema „Winterklausur in Kloster Seeon“. Lesen Sie jetzt „CSU setzt auf Rückkehr der Atomkraft in Deutschland“.,https://img.zeit.de/news/2026-01/01/csu-setzt-auf-rueckkehr-der-atomkraft-in-deutschland-image-group/wide__1300x731,2026-01-01T03:00:28Z,,Zur Sicherstellung der Energieversorgung setzt die CSU im Bundestag trotz Atomausstiegs auf eine Rückkehr der Kernenergie in Deutschland und den Bau von Mini-Kernkraftwerken. Konkret fordern die Chri… [+3986 chars],,de,'Energiepreise'
https://www.faz.net/aktuell/politik/ukraine/cia-soll-nicht-an-angriff-auf-putins-residenz-glauben-accg-200400274.html,https://www.faz.net/aktuell/politik/ukraine/cia-soll-nicht-an-angriff-auf-putins-residenz-glauben-accg-200400274.html,0,www.faz.net,US-Medienberichte: Laut CIA hat die Ukraine nicht Putins Residenz angegriffen,"Der Geheimdienst CIA soll Donald Trump informiert haben, dass die Ukraine andere Ziele ins Visier nahm – nicht Putin persönlich, wie Russland beklagt hatte. Prompt verbreitet der US-Präsident Putin-Kritisches.",https://media0.faz.net/image/w1200h627/28f601673ac6/w7559h3949x0y385o/202612/43601.0.1622876156/wladimir-putin-haelt-seine.webp,2026-01-01T05:38:08Z,,"Der US-Geheimdienst CIA ist Berichten zufolge zu der Erkenntnis gelangt, dass die Ukraine weder den russischen Präsidenten Wladimir Putin ins Visier genommen noch eine seiner Residenzen angegriffen h… [+5681 chars]",,de,'Putin'
https://www.sueddeutsche.de/bayern/bayern-bayernwerk-netzausbau-stromleitungen-li.3362023,https://www.sueddeutsche.de/bayern/bayern-bayernwerk-netzausbau-stromleitungen-li.3362023,0,www.sueddeutsche.de,Energiewende: Bayernwerk baut Zehntausende Kilometer neuer Stromleitungen,Das Bayernwerk plant den Bau von 40 000 Kilometern Stromleitungen bis 2030. Außerdem werden 300 Umspannwerke ertüchtigt und die Netzsteuerung digitalisiert.,https://www.sueddeutsche.de/2026/01/01/cf3212f7-c004-4406-b89f-0b7558b708e4.jpg?q=60&fm=webp&width=1200&rect=0%2C155%2C4000%2C2250,2026-01-01T14:29:12Z,,"Von Aschaffenburg bis Berchtesgaden: Das Bayern-Team der SZ ist im gesamten Freistaat für Sie unterwegs. Hier entlang, wenn Sie Geschichten, News und Hintergründe direkt aufs Handy bekommen möchten.… [+2976 chars]",,de,'Windräder'
https://www.zeit.de/2026/01/oksana-maksymchuk-ukraine-gedicht-kriegsalltag,https://www.zeit.de/2026/01/oksana-maksymchuk-ukraine-gedicht-kriegsalltag,0,www.zeit.de,Oksana Maksymchuk: Wie übersteht man den Krieg?,"Die Dichterin Oksana Maksymchuk hat ein Tagebuch über die russische Invasion verfasst – und darüber, wie man ihr poetisch standhält. Wir haben sie um ein Gedicht gebeten.",https://img.zeit.de/2026/01/wie-uebersteht-man-den-krieg-bild/wide__1300x731,2026-01-01T15:46:33Z,,"Manche Gedichte brauchen keine Erklärung, weil sie direkt
sind, weil sie uns treffen. So ist es auch mit den Texten der ukrainischen
Dichterin Oksana Maksymchuk, 43, die im Februar 2022 von einer A… [+582 chars]",,de,'Krieg'
https://www.zeit.de/news/2026-01/02/lies-ohne-gas-wird-es-nicht-gehen,https://www.zeit.de/news/2026-01/02/lies-ohne-gas-wird-es-nicht-gehen,0,www.zeit.de,Koalitionsstreit: Lies: Ohne Gas wird es nicht gehen,Hier finden Sie Informationen zu dem Thema „Koalitionsstreit“. Lesen Sie jetzt „Lies: Ohne Gas wird es nicht gehen“.,https://img.zeit.de/news/2026-01/02/lies-ohne-gas-wird-es-nicht-gehen-image-group/wide__1300x731,2026-01-02T04:30:05Z,,"Bei der Gasförderung auf See sind SPD und Grüne in Niedersachsens Landesregierung weiter auf Konfrontationskurs. «Es ist offensichtlich, dass wir bei der Gasförderung unterschiedlicher Auffassung sin… [+2230 chars]",,de,'Gas'
https://www.bild.de/sport/fussball/gladbach-holt-tottenham-profi-6957bb5e392c7b91b7cd2674,https://www.bild.de/sport/fussball/gladbach-holt-tottenham-profi-6957bb5e392c7b91b7cd2674,0,www.bild.de,Erster Winter-Transfer fix - Gladbach holt Tottenham-Profi,Gladbach: Borussia leiht Profi von Tottenham Hotspur aus,"https://images.bild.de/6957bb5e392c7b91b7cd2674/849b89a4910abcfeb7acf489c477863e,f4a57b3c?w=1280",2026-01-02T12:40:37Z,,Der erste Winter-Transfer ist fix! Borussia Mönchengladbach schlägt bei einem großen Klub zu: Abwehr-Talent Kota Takai (21) kommt bis Saisonende per Leihe von Premier-League-Verein Tottenham Hotspur.… [+1920 chars],,de,'Winter'
https://t3n.de/news/autobatterie-im-winter-tausch-schnee-akku-1723739/,https://t3n.de/news/autobatterie-im-winter-tausch-schnee-akku-1723739/,0,t3n.de,Autobatterie macht im Winter schlapp? Was du beim Tausch unbedingt beachten musst,"Starthilfe hat nicht geholfen und jetzt muss eine neue Batterie her? Doch Vorsicht beim Austausch: Ein falscher Handgriff kann dazu führen, dass plötzlich deine Fahrzeugelektronik verrückt spielt. Gerade im Winter machen Autobatterien oft schlapp. Starthilfe …",https://cdn.t3n.de/news/wp-content/uploads/2024/12/e-auto-winter_hero.jpg?class=content,2026-01-02T13:45:30Z,,"Gerade im Winter machen Autobatterien oft schlapp. Starthilfe kann dem Akku zwar wieder Leben einhauchen. Doch wenn das Auto auch danach nur schleppend anspringt, wird es wahrscheinlich Zeit für eine… [+3713 chars]",,de,'Winter'
https://www.bild.de/sport/fussball/lok-leipzig-kurz-vorm-start-wichtige-kaderentscheidung-gefallen-6957badaa42fa187f142cc7b,https://www.bild.de/sport/fussball/lok-leipzig-kurz-vorm-start-wichtige-kaderentscheidung-gefallen-6957badaa42fa187f142cc7b,0,www.bild.de,Kurz vorm Start - Lok Leipzig trifft wichtige Kaderentscheidung,Die Winterpause ist kurz. Am Sonntag startet Lok Leipzig bereits mit der neuen Vorbereitung. Mit einem bis jetzt unverändertem Kader.,"https://images.bild.de/6957badaa42fa187f142cc7b/1b81d66227d3427221194500971ae1d0,a03ad845?w=1280",2026-01-02T14:18:20Z,,"Die Winterpause ist kurz.
Am Sonntag startet Lok Leipzig bereits mit der Vorbereitung. Mit einem bis jetzt unverändertem Kader. Nach der Verletzung von Jan-Philipp Stein (Meniskusriss im rechten Kni… [+1591 chars]",,de,'Winter'
https://www.stern.de/kultur/-unter-anderen-umstaenden--mit-natalia-woerner--krimireihe-im-zdf-feiert-ihr-20--jubilaeum-37006154.html,https://www.stern.de/kultur/-unter-anderen-umstaenden--mit-natalia-woerner--krimireihe-im-zdf-feiert-ihr-20--jubilaeum-37006154.html,0,www.stern.de,"""Unter anderen Umständen"" mit Natalia Wörner: Krimireihe im ZDF feiert ihr 20. Jubiläum","Seit 2006 löst Natalia Wörner als Jana Winter im ZDF knifflige Fälle. Jetzt feiert ""Unter anderen Umständen"" 20-jähriges Jubiläum.",https://image.stern.de/37006158/t/dJ/v1/w1440/r1.7778/-/02--krimireihe-im-zdf-feiert-ihr-20--jubilaeum---16-9---spoton-article-1127916.jpg,2026-01-02T14:34:00Z,,"Kopiere den aktuellen Link
Zur Merkliste hinzufügen
Seit 2006 löst Natalia Wörner als Jana Winter im ZDF knifflige Fälle. Jetzt feiert ""Unter anderen Umständen"" 20-jähriges Jubiläum.
Mit ""Das Mädc… [+3643 chars]",,de,'Winter'
https://www.stern.de/gesellschaft/regional/niedersachsen-bremen/konferenz-der-energieminister--umweltminister--2026--entscheidendes-jahr--fuer-energiewende-37006228.html,https://www.stern.de/gesellschaft/regional/niedersachsen-bremen/konferenz-der-energieminister--umweltminister--2026--entscheidendes-jahr--fuer-energiewende-37006228.html,0,www.stern.de,"Konferenz der Energieminister: Umweltminister: 2026 ""entscheidendes Jahr"" für Energiewende","Bundeswirtschaftsministerin Reiche hat einen Kurswechsel in der Energiepolitik angekündigt. Niedersachsens Energieminister Meyer warnt dagegen vor einem ""fossilen Rollback"".",https://image.stern.de/37006230/t/by/v1/w1440/r1.7778/-/02--5vqw6i3u63v7axs2048jpeg---479911a12c856411.jpg,2026-01-02T14:48:19Z,,"Kopiere den aktuellen Link
Zur Merkliste hinzufügen
Bundeswirtschaftsministerin Reiche hat einen Kurswechsel in der Energiepolitik angekündigt. Niedersachsens Energieminister Meyer warnt dagegen vo… [+2280 chars]",,de,'Fossile Energie'
https://www.n-tv.de/panorama/Der-Winter-ist-da-und-er-will-es-richtig-wissen-id30196922.html,https://www.n-tv.de/panorama/Der-Winter-ist-da-und-er-will-es-richtig-wissen-id30196922.html,0,www.n-tv.de,"Zweistellige Minusgrade: ""Der Winter ist da, und er will es richtig wissen""","Zu Beginn des neuen Jahres hält der Winter Einzug in weiten Teilen Deutschlands. Kräftiger Schneefall, Glätte und außergewöhnlich niedrige Temperaturen sorgen für ein winterliches Wochenende. ntv-Meteorologe Oliver Scheel erklärt im Interview, was genau auf u…",https://www.n-tv.de/img/30196932/1767360478/Img_16_9/1200/Wintereinbruch-in-Essen-NUR-FUeR-REDAKTIONELLE-ZWECKE-EDITORIAL-USE-ONLY-Spaziergaenger-mit-Regenschirm-im-Essener-Stadtgarten-am-Freitag-dem-02-Januar-2026-Wintereinbruch-in-Essen.jpg,2026-01-02T15:13:00Z,,"Zu Beginn des neuen Jahres hält der Winter Einzug in weiten Teilen Deutschlands. Kräftiger Schneefall, Glätte und außergewöhnlich niedrige Temperaturen sorgen für ein winterliches Wochenende. ntv-Met… [+3499 chars]",,de,'Winter'
https://www.sueddeutsche.de/bayern/bayern-hubert-aiwanger-michaela-kaniber-jagd-rehe-waelder-markus-soeder-li.3360686,https://www.sueddeutsche.de/bayern/bayern-hubert-aiwanger-michaela-kaniber-jagd-rehe-waelder-markus-soeder-li.3360686,0,www.sueddeutsche.de,Folge des Klimawandels: Weil der Wald immer zeitiger Deckung bietet: Rehjagd soll früher beginnen,Seit Jahren beklagen Waldbesitzer in Bayern immense Wildschäden und fordern ein modernes Wildtiermanagement. Nun hat die Staatsregierung ein neues Jagdgesetz ins Verfahren gebracht. Experten geht es nicht weit genug.,https://www.sueddeutsche.de/2025/12/29/61d9c7ad-afee-4b94-8bd1-7703784040ba.jpg?q=60&fm=webp&width=1200&rect=0%2C125%2C3000%2C1687,2026-01-02T15:18:21Z,,"Damit sind Rehe die Wildart in Bayern mit der mit Abstand größten jagdlichen Bedeutung. Im Vergleich zu den Vorjahren wurde freilich etwas weniger Rehwild erlegt, insgesamt belief sich die Zahl aber … [+6779 chars]",,de,'Winter'
https://www.stern.de/panorama/wetter/wetter-in-deutschland--live-karten-zeigen--wo-schneesturm-droht-37004664.html,https://www.stern.de/panorama/wetter/wetter-in-deutschland--live-karten-zeigen--wo-schneesturm-droht-37004664.html,0,www.stern.de,Der Winter ist da: Deutschland schneit ein: Wetterkarten zeigen die Lage in Echtzeit,"Das Wetter ist zum Jahreswechsel umgeschlagen: In ganz Deutschland schneit es. Im Norden gibt es eine Sturmflut. Wie sich die Lage entwickelt, zeigen interaktive Karten.",https://image.stern.de/37005690/t/H7/v2/w1440/r1.7778/-/wetter-schneesturm-deutschland.jpg,2026-01-02T15:46:00Z,,"Kopiere den aktuellen Link
Zur Merkliste hinzufügen
Das Wetter ist zum Jahreswechsel umgeschlagen: In ganz Deutschland schneit es. Im Norden gibt es eine Sturmflut. Wie sich die Lage entwickelt, ze… [+2223 chars]",,de,'Winter'
https://www.bild.de/news/inland/kaeltewelle-wetter-mit-schnee-und-glatteis-sorgt-fuer-unfaelle-6957a193a42fa187f142cae3,https://www.bild.de/news/inland/kaeltewelle-wetter-mit-schnee-und-glatteis-sorgt-fuer-unfaelle-6957a193a42fa187f142cae3,0,www.bild.de,Kältewelle - Wetter mit Schnee und Glatteis sorgt für Unfälle,Schnee und Eis legen Deutschland lahm. Es gibt Verletzte und überall Verkehrsunfälle.,"https://images.bild.de/6957a193a42fa187f142cae3/ddd6ec8c24a290ea926de3f61c2f285e,e25a0bb3?w=1280",2026-01-02T15:47:45Z,,Kürten (Nordrhein-Westfalen) Der Start ins neue Jahr ist spiegelglatt: Bei Winterwetter kam es in ganz Deutschland zu zahlreichen Unfällen. Und es soll weiter schneien. In Kürten (NRW) rutschte sogar… [+2900 chars],,de,'Kälte'
https://www.bild.de/regional/berlin/brandserie-in-berlin-alle-kaeltebusse-zerstoert-obdachloser-als-taeter-verdaechtig-695797bf392c7b91b7cd23a5,https://www.bild.de/regional/berlin/brandserie-in-berlin-alle-kaeltebusse-zerstoert-obdachloser-als-taeter-verdaechtig-695797bf392c7b91b7cd23a5,0,www.bild.de,Drei Kältebusse in Berlin abgefackelt - Obdachloser soll Brandstifter sein,Schock für die Berliner Stadtmission: Alle drei Kältebusse wurden angezündet. Ausgerechnet ein Obdachloser soll der Brandstifter sein. Jetzt gibt es eine riesige Hilfswelle für den Verein.,"https://images.bild.de/695797bf392c7b91b7cd23a5/56f04de606c343b347a805e48c46f9d2,9919a9b8?w=1280",2026-01-02T15:50:49Z,,"Berlin Jede Nacht sind viele ehrenamtliche Helfer der Berliner Stadtmission bei eisigen Temperaturen unterwegs, um Obdachlosen in Not zu helfen. Mit drei Kältebussen haben sie in diesem Winter schon … [+3827 chars]",,de,'Winter'
https://www.faz.net/aktuell/wirtschaft/rwe-chef-erwartet-sinkende-strom-und-gaspreise-accg-200404931.html,https://www.faz.net/aktuell/wirtschaft/rwe-chef-erwartet-sinkende-strom-und-gaspreise-accg-200404931.html,0,www.faz.net,Energiekosten: RWE-Chef erwartet sinkende Strom- und Gaspreise,Staatliche Zuschüsse und wachsendes Angebot dämpfen laut Markus Krebber die Energiepreise. Bei der Gasversorgung im Winter sieht der Chef des Energiekonzerns langfristig Risiken.,https://media0.faz.net/image/w1200h627/fcc3bea093e0/w3000h1567x0y111o/202503/43601.0.917413544/markus-krebber.webp,2026-01-03T04:28:30Z,,"Der Chef des Energiekonzerns RWE, Markus Krebber, rechnet mit sinkenden Preisen bei Strom und Gas. Die Großhandelspreise beim Strom seien stabil, sagte Krebber der Rheinischen Post. Da der Staat die … [+1654 chars]",,de,'Energiepreise'
https://www.zeit.de/news/2026-01/03/dauerfrost-und-schneeverwehungen-winter-hat-hessen-im-griff,https://www.zeit.de/news/2026-01/03/dauerfrost-und-schneeverwehungen-winter-hat-hessen-im-griff,0,www.zeit.de,Wetter: Dauerfrost und Schneeverwehungen: Winter hat Hessen im Griff,Hier finden Sie Informationen zu dem Thema „Wetter“. Lesen Sie jetzt „Dauerfrost und Schneeverwehungen: Winter hat Hessen im Griff“.,https://img.zeit.de/news/2026-01/03/dauerfrost-und-schneeverwehungen-winter-hat-hessen-im-griff-image-group/wide__1300x731,2026-01-03T10:04:34Z,,"Die Menschen in Hessen müssen sich in den kommenden Tagen weiterhin auf Winterwetter einstellen. Am Samstag ist ab dem Mittag erneut mit Schneeschauern und Glätte bis ins Flachland zu rechnen, wie de… [+921 chars]",,de,'Winter'
https://www.zeit.de/news/2026-01/03/wintereinbruch-in-mecklenburg-vorpommern,https://www.zeit.de/news/2026-01/03/wintereinbruch-in-mecklenburg-vorpommern,0,www.zeit.de,Winter im Norden: Wintereinbruch in Mecklenburg-Vorpommern,Hier finden Sie Informationen zu dem Thema „Winter im Norden“. Lesen Sie jetzt „Wintereinbruch in Mecklenburg-Vorpommern“.,https://img.zeit.de/news/2026-01/03/wintereinbruch-in-mecklenburg-vorpommern-image-group/wide__1300x731,2026-01-03T12:22:21Z,,"Ein Sturmtief über der Ostsee bringt am Wochenende kalte polare Meeresluft nach Mecklenburg-Vorpommern. Unterstützt durch ein kleinräumiges Tief über Norddeutschland sorgt die Wetterlage für Schnee, … [+2011 chars]",,de,'Winter'
https://stadt-bremerhaven.de/immer-wieder-sonntags-kw-1-guenstige-ikea-sensoren-teure-lautsprecher-und-gedrucktes/,https://stadt-bremerhaven.de/immer-wieder-sonntags-kw-1-guenstige-ikea-sensoren-teure-lautsprecher-und-gedrucktes/,0,stadt-bremerhaven.de,"Immer wieder sonntags KW 1: Günstige IKEA-Sensoren, teure Lautsprecher und Gedrucktes","Moin zusammen! Der Jahresstart 2026 gibt direkt ordentlich Gas, denn die CES steht vor der Tür. Zahlreiche Unternehmen haben bereits ihre Neuvorstellungen gezeigt, genauer gesagt geteasert. Ich denke, dass aber noch einiges kommen wird, die verschießen ihr Pu…",https://stadt-bremerhaven.de/wp-content/uploads/2022/07/Kaffee-Sonntags.jpg,2026-01-04T05:30:17Z,,"Moin zusammen! Der Jahresstart 2026 gibt direkt ordentlich Gas, denn die CES steht vor der Tür. Zahlreiche Unternehmen haben bereits ihre Neuvorstellungen gezeigt, genauer gesagt geteasert. Ich denke… [+6152 chars]",,de,'Gas'
https://www.faz.net/aktuell/politik/venezuela-was-der-sturz-von-maduro-fuer-putin-und-russland-bedeutet-accg-110813288.html,https://www.faz.net/aktuell/politik/venezuela-was-der-sturz-von-maduro-fuer-putin-und-russland-bedeutet-accg-110813288.html,0,www.faz.net,„Caracas in drei Stunden“: Putin musste machtlos zusehen,Russland verliert mit Nicolás Maduro einen weiteren Verbündeten und wirkt ohnmächtig. Putin schweigt – aus mehreren Gründen.,https://media0.faz.net/image/w1200h627/a081441d1200/w7813h4082x0y222o/202601/43601.0.1630892565/putin-empfaengt-maduro-im-mai.webp,2026-01-04T08:39:12Z,,"Das amerikanische Vorgehen gegen Venezuela bringt Russland in eine unbequeme Lage: Schon wieder ist ein Verbündeter gestürzt worden, den man nicht schützen konnte. Der venezolanische Präsident Nicolá… [+5106 chars]",,de,'Putin'
https://www.zeit.de/news/2026-01/04/winter-haelt-hamburg-und-schleswig-holstein-fest-im-griff,https://www.zeit.de/news/2026-01/04/winter-haelt-hamburg-und-schleswig-holstein-fest-im-griff,0,www.zeit.de,Winter im Norden: Winter hält Hamburg und Schleswig-Holstein fest im Griff,Hier finden Sie Informationen zu dem Thema „Winter im Norden“. Lesen Sie jetzt „Winter hält Hamburg und Schleswig-Holstein fest im Griff“.,https://img.zeit.de/news/2026-01/04/winter-haelt-hamburg-und-schleswig-holstein-fest-im-griff-image-group/wide__1300x731,2026-01-04T13:09:59Z,,"Schnee, Frost und Glätte haben am Wochenende Hamburg und Schleswig-Holstein fest im Griff gehalten. Winterdienste waren im Großeinsatz, es kam zu zahlreichen Verkehrsunfällen, der Busverkehr in Teile… [+5912 chars]",,de,'Winter'
https://www.stern.de/wirtschaft/news/erneuerbare-energie--solarenergie-deckt-18-prozent-des-deutschen-stromverbrauchs-37009872.html,https://www.stern.de/wirtschaft/news/erneuerbare-energie--solarenergie-deckt-18-prozent-des-deutschen-stromverbrauchs-37009872.html,0,www.stern.de,Erneuerbare Energie: Solarenergie deckt 18 Prozent des deutschen Stromverbrauchs,Bei der Stromerzeugung schlägt Photovoltaik erstmals zwei fossile Energieträger. Der Branche geht die Ausbreitung der Solaranlagen dennoch zu langsam.,https://image.stern.de/37009874/t/mQ/v1/w1440/r1.7778/-/05--qvisqe7pszv6axs2048jpeg---b0abc27d16ef30e1.jpg,2026-01-05T04:00:11Z,,"Kopiere den aktuellen Link
Zur Merkliste hinzufügen
Bei der Stromerzeugung schlägt Photovoltaik erstmals zwei fossile Energieträger. Der Branche geht die Ausbreitung der Solaranlagen dennoch zu lan… [+1196 chars]",,de,'fossile Energie'
https://www.zeit.de/news/2026-01/05/trump-glaube-nicht-an-angriff-kiews-auf-putins-residenz,https://www.zeit.de/news/2026-01/05/trump-glaube-nicht-an-angriff-kiews-auf-putins-residenz,0,www.zeit.de,Ukraine-Krieg: Trump: Glaube nicht an Angriff Kiews auf Putins Residenz,Hier finden Sie Informationen zu dem Thema „Ukraine-Krieg“. Lesen Sie jetzt „Trump: Glaube nicht an Angriff Kiews auf Putins Residenz“.,https://img.zeit.de/news/2026-01/05/trump-glaube-nicht-an-angriff-kiews-auf-putins-residenz-image-group/wide__1300x731,2026-01-05T04:32:56Z,,"US-Präsident Donald Trump geht nicht von einem Angriff der Ukraine auf die Residenz des russischen Präsidenten Wladimir Putin aus. Er glaube nicht, dass dieser Angriff stattgefunden habe, sagte der R… [+996 chars]",,de,'Putin'
https://www.zeit.de/news/2026-01/05/winter-am-ber-fluege-laufen-meist-planmaessig,https://www.zeit.de/news/2026-01/05/winter-am-ber-fluege-laufen-meist-planmaessig,0,www.zeit.de,Flugverkehr: Winter am BER: Flüge laufen meist planmäßig,Hier finden Sie Informationen zu dem Thema „Flugverkehr“. Lesen Sie jetzt „Winter am BER: Flüge laufen meist planmäßig“.,https://img.zeit.de/news/2026-01/05/winter-am-ber-fluege-laufen-meist-planmaessig-image-group/wide__1300x731,2026-01-05T07:14:26Z,,"Fluggäste am Flughafen Berlin Brandenburg (BER) können trotz winterlicher Wetterlage größtenteils entspannt ihre Reisen antreten. Der Flughafen laufe in seinem normalen Winterbetrieb, teilte ein Spre… [+905 chars]",,de,'Winter'
https://www.welt.de/videos/video695b7271fe6040199bf92939/blackout-in-berlin-vier-decken-und-kerzen-mehr-ging-nicht.html,https://www.welt.de/videos/video695b7271fe6040199bf92939/blackout-in-berlin-vier-decken-und-kerzen-mehr-ging-nicht.html,0,www.welt.de,„Vier Decken und Kerzen. Mehr ging nicht“,"Seit dem Stromausfall herrscht im Berliner Südwesten der Ausnahmezustand. Anwohner kämpfen mit improvisierten Mitteln gegen die Kälte in ihren Wohnungen, berichtet Reporterin Alina Quast.",https://images.welt.de/695b7271fe6040199bf92939/10e90b67502a2b03435257d89b5d48f0-master/ci16x9-w1200/stromausfall-anwohnerin-jpg,2026-01-05T09:15:12Z,,Die WELT als ePaper: Die vollständige Ausgabe steht Ihnen bereits am Vorabend zur Verfügung so sind Sie immer hochaktuell informiert. Weitere Informationen https://epaper.welt.de,,de,'Kälte'
https://www.focus.de/kultur/stars/koennte-ich-nicht-simone-ballack-zeigt-ihr-extremes-dschungelcamp-training_2603f20c-4b02-4f0d-a325-62f9131e9d6e.html,https://www.focus.de/kultur/stars/koennte-ich-nicht-simone-ballack-zeigt-ihr-extremes-dschungelcamp-training_2603f20c-4b02-4f0d-a325-62f9131e9d6e.html,0,www.focus.de,"""Könnte ich nicht"": Simone Ballack zeigt ihr extremes Dschungelcamp-Training","Simone Ballack muss bald mit der tropischen Hitze im Dschungelcamp klarkommen. Zur Vorbereitung trainiert sie jedoch hart in eisiger Kälte, wie sie ihren Followern auf Instagram präsentiert.",https://quadro.burda-forward.de/ctf/a2919440-3b47-4666-a0e0-3f266d5b628b.deca18d3-abe5-4e51-83a0-aa1e835be201.jpg?im=RegionOfInterestCrop%3D%281200%2C630%29%2CregionOfInterest%3D%281766%2C483%29&hash=a8d1589a32208da4b1060d0cfcd6231c9974741319776560b7a35eb19a221b0b,2026-01-05T09:33:23Z,,"Am 23. Januar 2026 schickt RTL erneut zwölf mehr oder weniger bekannte Promis ins Dschungelcamp. Auch Simone Ballack (49) ist Teil der 19. Staffel von ""Ich bin ein Star Holt mich hier raus"". Vor der … [+1601 chars]",,de,'Kälte'
https://www.focus.de/kultur/stars/simone-ballack-zeigt-ihr-extremes-dschungelcamp-training-koennte-ich-nicht_2603f20c-4b02-4f0d-a325-62f9131e9d6e.html,https://www.focus.de/kultur/stars/simone-ballack-zeigt-ihr-extremes-dschungelcamp-training-koennte-ich-nicht_2603f20c-4b02-4f0d-a325-62f9131e9d6e.html,0,www.focus.de,"Simone Ballack zeigt ihr extremes Dschungelcamp-Training: ""Könnte ich nicht""","Simone Ballack muss bald mit der tropischen Hitze im Dschungelcamp klarkommen. Zur Vorbereitung trainiert sie jedoch hart in eisiger Kälte, wie sie ihren Followern auf Instagram präsentiert.",https://quadro.burda-forward.de/ctf/a2919440-3b47-4666-a0e0-3f266d5b628b.deca18d3-abe5-4e51-83a0-aa1e835be201.jpg?im=RegionOfInterestCrop%3D%281200%2C630%29%2CregionOfInterest%3D%281766%2C483%29&hash=a8d1589a32208da4b1060d0cfcd6231c9974741319776560b7a35eb19a221b0b,2026-01-05T09:33:23Z,,"Am 23. Januar 2026 schickt RTL erneut zwölf mehr oder weniger bekannte Promis ins Dschungelcamp. Auch Simone Ballack (49) ist Teil der 19. Staffel von ""Ich bin ein Star Holt mich hier raus"". Vor der … [+1601 chars]",,de,'Kälte'
https://www.tagesspiegel.de/berlin/stromausfall-netzbetreiber-donnerstag-wieder-strom-fur-alle-15103294.html,https://www.tagesspiegel.de/berlin/stromausfall-netzbetreiber-donnerstag-wieder-strom-fur-alle-15103294.html,0,www.tagesspiegel.de,Stromausfall: Netzbetreiber: Donnerstag wieder Strom für alle,Kälte und komplizierte Technik: Erst am Donnerstag soll im Südwesten Berlins der Strom wieder fließen. Wie Experten aus ganz Deutschland jetzt helfen.,https://www.tagesspiegel.de/images/15105055/alternates/BASE_16_9_W1400/1767623492000/stromausfall-in-berlin.jpeg,2026-01-05T09:53:50Z,,"Der Betreiber des Berliner Stromnetzes geht im Moment davon aus, dass nach dem großen Blackout erst am Donnerstagnachmittag wieder alle Haushalte versorgt werden. Dieser schon am Wochenende verkündet… [+1958 chars]",,de,'Kälte'
https://www.tagesspiegel.de/gesellschaft/panorama/chaotische-verhaltnisse-winterwetter-hat-europaische-lander-fest-im-griff-15103342.html,https://www.tagesspiegel.de/gesellschaft/panorama/chaotische-verhaltnisse-winterwetter-hat-europaische-lander-fest-im-griff-15103342.html,0,www.tagesspiegel.de,Chaotische Verhältnisse: Winterwetter hat europäische Länder fest im Griff,"Zugausfälle, stundenlange Verspätungen und Flughäfen im Ausnahmezustand: Schnee und Eis haben viele Länder Europas zu großen Einschränkungen geführt.",https://www.tagesspiegel.de/images/15104087/alternates/BASE_16_9_W1400/1767613707000/winterwetter-in-gro-britannien.jpeg,2026-01-05T10:01:01Z,,"Starker Schneefall und eisige Temperaturen haben in etlichen europäischen Ländern für chaotische Verhältnisse gesorgt. Am Montag, als viele Menschen aus den Weihnachtsferien in den Alltag starteten, … [+3610 chars]",,de,'Kälte'
