index,url,valid,domain,title,description,image,published,archive,content,quote,language,keyword
https://www.stern.de/gesellschaft/regional/baden-wuerttemberg/energie--starker-dezember---doch-mehr-windraeder-im-suedwesten-gebaut-35440208.html,https://www.stern.de/gesellschaft/regional/baden-wuerttemberg/energie--starker-dezember---doch-mehr-windraeder-im-suedwesten-gebaut-35440208.html,0,www.stern.de,Energie: Starker Dezember - Doch mehr Windräder im Südwesten gebaut,In den vergangenen Jahren lief der Ausbau der Windkraft höchstens schleppend. 2024 wurden nun doch mehr Anlagen gebaut als zunächst gedacht. Experten geht es dennoch zu langsam.,https://image.stern.de/35440210/t/LQ/v1/w1440/r1.7778/-/05--52fegh636pv10axs2048jpeg---5e6dfef7ab4d4c6f.jpg,2025-02-05T03:00:40Z,,"Kopiere den aktuellen Link
In den vergangenen Jahren lief der Ausbau der Windkraft höchstens schleppend. 2024 wurden nun doch mehr Anlagen gebaut als zunächst gedacht. Experten geht es dennoch zu la… [+3440 chars]",,de,'Windräder'
https://www.zeit.de/news/2025-02/05/bergwacht-bayern-bei-hohen-einsatzzahlen-weiter-gefordert,https://www.zeit.de/news/2025-02/05/bergwacht-bayern-bei-hohen-einsatzzahlen-weiter-gefordert,0,www.zeit.de,Bayerische Alpen: Bergwacht Bayern bei hohen Einsatzzahlen weiter gefordert,Hier finden Sie Informationen zu dem Thema „Bayerische Alpen“. Lesen Sie jetzt „Bergwacht Bayern bei hohen Einsatzzahlen weiter gefordert“.,https://img.zeit.de/news/2025-02/05/bergwacht-bayern-bei-hohen-einsatzzahlen-weiter-gefordert-image-group/wide__1300x731,2025-02-05T04:00:36Z,https://web.archive.org/web/20250208073920/https://www.zeit.de/news/2025-02/05/bergwacht-bayern-bei-hohen-einsatzzahlen-weiter-gefordert,Alle Hände voll zu tun hatte die Bergwacht Bayern im vergangenen Jahr: Erneut sind die Einsatzzahlen in den Sommermonaten gestiegen. Auch die Anzahl der Einsätze im Winter 23/24 liegen laut Bergwacht… [+2009 chars],,de,'Bayern'
https://www.zeit.de/politik/ausland/2025-02/krieg-ukraine-wolodymyr-selenskyjgespraeche-wladimir-putin,https://www.zeit.de/politik/ausland/2025-02/krieg-ukraine-wolodymyr-selenskyjgespraeche-wladimir-putin,0,www.zeit.de,Krieg in der Ukraine: Selenskyj zeigt Bereitschaft zu direkten Gesprächen mit Putin,"Gespräche zwischen Wladimir Putin und Wolodymyr Selenskyj hat es seit Beginn des Krieges nicht gegeben. Selenskyj hält das jetzt für denkbar, wenn es der Ukraine hilft.",https://img.zeit.de/politik/ausland/2025-02/krieg-ukraine-wolodymyr-selenskyj-gespraeche-wladimir-putin-bild/wide__1300x731,2025-02-05T06:39:32Z,http://archive.md/20250205071757/https://www.zeit.de/politik/ausland/2025-02/krieg-ukraine-wolodymyr-selenskyjgespraeche-wladimir-putin,Der ukrainische Präsident Wolodymyr Selenskyj ist unter Bedingungen zu direkten Verhandlungen mit dem russischen Staatschef Wladimir Putin bereit. Das sagte Selenskyj in einem Videointerview mit dem … [+2809 chars],,de,'Putin'
https://www.welt.de/politik/ausland/video255344016/Moegliche-Gespraeche-Werde-nicht-nett-zu-ihm-sein-Selenskyj-erklaert-sich-zu-Verhandlungen-mit-Putin-bereit.html,https://www.welt.de/politik/ausland/video255344016/Moegliche-Gespraeche-Werde-nicht-nett-zu-ihm-sein-Selenskyj-erklaert-sich-zu-Verhandlungen-mit-Putin-bereit.html,0,www.welt.de,„Werde nicht nett zu ihm sein“ – Selenskyj erklärt sich zu Verhandlungen mit Putin bereit,Der ukrainische Präsident Wolodymyr Selenskyj ist unter Bedingungen zu direkten Verhandlungen mit Russlands Staatschef Wladimir Putin bereit. Christoph Wanner berichtet aus Kiew.,https://img.welt.de/img/politik/ausland/mobile255344014/2257938097-ci16x9-w1200/Holocaust-Gedenktag-Ukraine.jpg,2025-02-05T07:52:58Z,,"Der ukrainische Präsident Wolodymyr Selenskyj ist unter Bedingungen zu direkten Verhandlungen mit Russlands Staatschef Wladimir Putin bereit. Christoph Wanner berichtet aus Kiew.
© Axel Springer Deu… [+38 chars]",,de,'Putin'
https://www.zeit.de/news/2025-02/05/selenskyj-gibt-eigene-verluste-mit-45-000-toten-an,https://www.zeit.de/news/2025-02/05/selenskyj-gibt-eigene-verluste-mit-45-000-toten-an,0,www.zeit.de,Krieg in der Ukraine: Selenskyj gibt eigene Verluste mit 45.000 Toten an,Hier finden Sie Informationen zu dem Thema „Krieg in der Ukraine“. Lesen Sie jetzt „Selenskyj gibt eigene Verluste mit 45.000 Toten an“.,https://img.zeit.de/news/2025-02/05/selenskyj-gibt-eigene-verluste-mit-45-000-toten-an-image-group/wide__1300x731,2025-02-05T09:39:08Z,,"Der ukrainische Präsident Wolodymyr Selenskyj hat die Verluste der ukrainischen Streitkräfte auf 45.100 Gefallene beziffert. Gleichzeitig seien seit Kriegsbeginn 390.000 Soldaten verletzt worden, sag… [+998 chars]",,de,'Krieg'
https://www.stern.de/familie/tiere/insekten--so-ueberstehen-muecken--bienen---co--den-winter-35437148.html,https://www.stern.de/familie/tiere/insekten--so-ueberstehen-muecken--bienen---co--den-winter-35437148.html,0,www.stern.de,Überwintern: Diese Insekten können bei Minusgraden überleben – während andere sterben,"Im Winter verschwinden viele Insekten von der Bildfläche. Während einigen die frostige Kälte kaum etwas anhaben kann, bedeutet sie für andere den sicheren Tod. Ein Überblick.",https://image.stern.de/35437884/t/qp/v4/w1440/r1.7778/-/hummel-insekten-ueberwintern.jpg,2025-02-05T09:45:00Z,https://web.archive.org/web/20250207155931/https://www.stern.de/familie/tiere/insekten--so-ueberstehen-muecken--bienen---co--den-winter-35437148.html,"Kopiere den aktuellen Link
Im Winter verschwinden viele Insekten von der Bildfläche. Während einigen die frostige Kälte kaum etwas anhaben kann, bedeutet sie für andere den sicheren Tod. Ein Überbli… [+1097 chars]",,de,'Kälte'
https://www.stern.de/geo/erkaeltungswelle--was-mediziner-jetzt-empfehlen-und-was-nicht-35207270.html,https://www.stern.de/geo/erkaeltungswelle--was-mediziner-jetzt-empfehlen-und-was-nicht-35207270.html,0,www.stern.de,FAQ: Gesundheit: Die Erkältungswelle rollt: Was Mediziner jetzt empfehlen – und was nicht,"Macht Kälte tatsächlich krank? Und was kann ich tun, um gesund zu bleiben? Acht Fragen, acht Antworten zur Erkältungswelle diesen Herbst und Winter.",https://image.stern.de/35207268/t/Fn/v5/w1440/r1.7778/-/aufmacher-erkaeltungswelle.jpg,2025-02-05T10:36:00Z,http://archive.md/20250130231137/https://www.stern.de/geo/erkaeltungswelle--was-mediziner-jetzt-empfehlen-und-was-nicht-35207270.html,"Stern plusZugang zu stern+statt 
11,96 
 nur 1 
Jetzt testen
Bereits registriert?Hier anmelden",,de,'Kälte'
https://www.ifun.de/neues-buch-hinterfragt-apples-verhaeltnis-zu-china-248045/,https://www.ifun.de/neues-buch-hinterfragt-apples-verhaeltnis-zu-china-248045/,0,www.ifun.de,Neues Buch hinterfragt Apples Verhältnis zu China,"Mit dem Buch „Apple in China“ will Patrick McGee die Herausforderungen und Risiken aufzeigen, die Apples starkes Engagement in China mit sich bringt. Apple hat sich aus Sicht des Autors in eine Situation der Abhängigkeit begeben und sieht sich nun zunehmend d…",https://images.ifun.de/wp-content/uploads/2025/02/apple-in-china-feature-1.jpg,2025-02-05T14:00:04Z,,"Mit dem Buch Apple in China will Patrick McGee die Herausforderungen und Risiken aufzeigen, die Apples starkes Engagement in China mit sich bringt. Apple hat sich aus Sicht des Autors in eine Situati… [+1970 chars]",,de,'Abhängigkeit'
https://www.googlewatchblog.de/?p=239934,https://www.googlewatchblog.de/?p=239934,0,www.googlewatchblog.de,Mit Gemini in den Krieg? Google will KI-Einsatz für das Militär nicht mehr ausschließen – Paragraf gestrichen,"Bei Google steht die Künstliche Intelligenz nicht erst seit Gemini im Mittelpunkt aller Aktivitäten, sondern beschäftigt das Unternehmen schon seit vielen Jahren in allen Bereichen. Einen kriegerischen Einsatz der KI hat man dabei stets ausgeschlossen, doch d…",https://www.googlewatchblog.de/wp-content/uploads/google-kuenstliche-intelligenz-bad.jpg,2025-02-05T14:00:32Z,,"Bei Google steht die Künstliche Intelligenz nicht erst seit Gemini im Mittelpunkt aller Aktivitäten, sondern beschäftigt das Unternehmen schon seit vielen Jahren in allen Bereichen. Einen kriegerisch… [+2616 chars]",,de,'Krieg'
https://www.sueddeutsche.de/bayern/sahra-wagenknecht-bsw-bundestagswahl-bayern-muenchen-mieten-li.3195434,https://www.sueddeutsche.de/bayern/sahra-wagenknecht-bsw-bundestagswahl-bayern-muenchen-mieten-li.3195434,0,www.sueddeutsche.de,Politik: Sahra Wagenknecht und ihre bayerischen Fans,Das BSW setzt alles auf die Popularität der Parteigründerin. Auch in Bayern hat Wagenknecht Anhänger – was erwarten sie von ihr? Die Themen bewegen sich von Mietwucher bis Kriegsangst.,https://www.sueddeutsche.de/2025/02/04/9fb5dcec-ad2d-47a8-a4ed-2addaeb398ea.jpeg?q=60&fm=webp&width=1200&rect=0%2C209%2C4000%2C2250,2025-02-05T14:13:38Z,http://archive.md/20250205142243/https://www.sueddeutsche.de/bayern/sahra-wagenknecht-bsw-bundestagswahl-bayern-muenchen-mieten-li.3195434,Das BSW setzt alles auf die Popularität der Parteigründerin. Auch in Bayern hat Wagenknecht Anhänger was erwarten sie von ihr? Die Themen bewegen sich von Mietwucher bis Kriegsangst.Christine Nagl st… [+539 chars],,de,'Bayern'
https://www.stern.de/familie/merinowolle-waschen--so-pflegen-sie-die-sensiblen-fasern-richtig-35440702.html,https://www.stern.de/familie/merinowolle-waschen--so-pflegen-sie-die-sensiblen-fasern-richtig-35440702.html,0,www.stern.de,Geniales Garn: Merinowolle waschen: Warum die feinen Fasern Fluch und Segen zugleich sind,Merino ist magisch. Die feinen Fasern der australischen Schafe wärmen im Winter und kühlen im Sommer. Nur beim Waschen ist die beliebte Merinowolle etwas zickig.,https://image.stern.de/35441468/t/6e/v1/w1440/r1.7778/-/merinowolle-waschen-aufmacher-februar-2025.jpg,2025-02-05T14:33:00Z,https://web.archive.org/web/20250206164138/https://www.stern.de/familie/merinowolle-waschen--so-pflegen-sie-die-sensiblen-fasern-richtig-35440702.html,"Kopiere den aktuellen Link
Merino ist magisch. Die feinen Fasern der australischen Schafe wärmen im Winter und kühlen im Sommer. Nur beim Waschen ist die beliebte Merinowolle etwas zickig.
Im Gegen… [+3962 chars]",,de,'Kälte'
https://www.bild.de/leben-wissen/lifestyle/sport-im-winter-warum-sie-auch-bei-kaltem-wetter-trainieren-sollten-67934c66f390036261f274e2,https://www.bild.de/leben-wissen/lifestyle/sport-im-winter-warum-sie-auch-bei-kaltem-wetter-trainieren-sollten-67934c66f390036261f274e2,0,www.bild.de,Wichtige Tipps für Sport im Winter - Warum Sie auch bei kaltem Wetter trainieren sollten,"Dr. Leana Wen, Notärztin und Professorin an der George Washington University, erklärt, wie man im Winter fit bleibt und was man dabei beachten sollte.","https://images.bild.de/67934c66f390036261f274e2/c462deddf7638221192c2c4428cf8eff,6d8f628d?w=1280",2025-02-05T16:28:13Z,http://archive.md/20250206140108/https://www.bild.de/leben-wissen/lifestyle/sport-im-winter-warum-sie-auch-bei-kaltem-wetter-trainieren-sollten-67934c66f390036261f274e2,"Draußen glitzern die Straßen unter dem Eis und beim Ausatmen erscheint jedes Mal eine kleine Wolke vor Ihrem Gesicht. Bei diesen eisigen Temperaturen möchte man sich lieber zu Hause einkuscheln, stat… [+309 chars]",,de,'Kälte'
https://www.zeit.de/wirtschaft/2025-02/windraeder-ausbau-energiewende-ziele-erneuerbare,https://www.zeit.de/wirtschaft/2025-02/windraeder-ausbau-energiewende-ziele-erneuerbare,0,www.zeit.de,Windräder: Windenergie holt noch auf,"Während die Solarkraft boomt, stockt seit Langem der Ausbau der Windkraft. Doch nun zeigen Daten erstmals: Deutschland könnte doch seine Ausbauziele für 2030 erreichen.",https://img.zeit.de/wirtschaft/2025-02/windraeder-ausbau-energiewende-ziele-erneuerbare-bild/wide__1300x731,2025-02-06T06:50:07Z,http://archive.md/20250206065147/https://www.zeit.de/wirtschaft/2025-02/windraeder-ausbau-energiewende-ziele-erneuerbare,"Deutschland baut bislang viel zu wenige Windräder an Land. Ende des Jahres betrug die &lt;span style=""color: var(--z-color-primary);background-color:color-mix(in srgb, #13C3D7, var(--z-background-pri… [+725 chars]",,de,'Windräder'
https://www.focus.de/politik/ausland/die-eu-und-trump-zwischen-abschreckung-und-abhaengigkeit_7946d6c7-c6e0-492d-a563-c26128d54d9c.html,https://www.focus.de/politik/ausland/die-eu-und-trump-zwischen-abschreckung-und-abhaengigkeit_7946d6c7-c6e0-492d-a563-c26128d54d9c.html,0,www.focus.de,- Die EU und Trump: Zwischen Abschreckung und Abhängigkeit,"Für die Europäer ist es ein Drahtseilakt: Einerseits droht Donald Trump mit Zöllen und sie wollen Stärke und Einheit zeigen. Andererseits sind die Europäer auf die USA angewiesen, wenn es um die Verteidigung geht.",https://quadro.burda-forward.de/ctf/7f9f694c-a1fe-4151-bdb5-c4f2c980fb49.1852b8b2-1186-41f8-a40a-fc4cf00795aa.png?im=Resize%3D%281200%2C630%29&hash=0102f0137b7df165f2e20e3f45a7a86d2b18d05079180e28528da553beb49232,2025-02-06T07:22:05Z,https://web.archive.org/web/20250207092800/https://www.focus.de/politik/ausland/die-eu-und-trump-zwischen-abschreckung-und-abhaengigkeit_7946d6c7-c6e0-492d-a563-c26128d54d9c.html,"Am Sonntagabend wetterte US-Präsident Donald Trump gegen die Europäische Union: Was sie getan habe, sei ein ""Gräuel"". Denn die Europäer kauften keine Autos und keine Agrarprodukte von den Amerikanern… [+5485 chars]",,de,'Abhängigkeit'
https://www.welt.de/politik/ausland/article255354010/Roskosmos-Putin-entlaesst-ueberraschend-Leiter-der-russischen-Raumfahrtbehoerde.html,https://www.welt.de/politik/ausland/article255354010/Roskosmos-Putin-entlaesst-ueberraschend-Leiter-der-russischen-Raumfahrtbehoerde.html,0,www.welt.de,Putin entlässt überraschend Leiter der russischen Raumfahrtbehörde,"In der russischen Raumfahrt gibt es einen Führungswechsel. Die Behörde hat auch militärische Bedeutung. Gründe für die Entlassung wurden nicht genannt, Hintergrund könnte ein Kostenstreit sein.",https://img.welt.de/img/politik/ausland/mobile255354058/1217934907-ci16x9-w1200/In-this-pool-photograph-distributed.jpg,2025-02-06T09:51:24Z,,"Kremlchef Wladimir Putin hat überraschend den Leiter der russischen Raumfahrtbehörde Roskosmos, Juri Borissow, entlassen. Zum neuen Generaldirektor von Roskosmos sei Dmitri Bakanow ernannt worden, he… [+969 chars]",,de,'Putin'
https://www.telepolis.de/features/Europas-Energiekrise-Zwischen-Ideologie-und-leeren-Gasspeichern-10272408.html,https://www.telepolis.de/features/Europas-Energiekrise-Zwischen-Ideologie-und-leeren-Gasspeichern-10272408.html,0,www.telepolis.de,Europas Energiekrise: Zwischen Ideologie und leeren Gasspeichern,"Europa steckt seit Jahren in der Energiekrise. Gasspeicher leeren sich, Preise könnten bald wieder steigen, die Versorgung wackelt. Ein Kommentar.",https://heise.cloudimg.io/bound/1200x1200/q85.png-lossy-85.webp-lossy-85.foil1/_www-heise-de_/imgs/18/4/7/9/6/1/0/7/shutterstock_1552910354-4bf43e08955f8a66.jpeg,2025-02-06T10:00:00Z,,"(Bild: 63ru78 / Shutterstock.com)
Europa steckt seit Jahren in der Energiekrise. Gasspeicher leeren sich, Preise könnten bald wieder steigen, die Versorgung wackelt. Ein Kommentar.
Die europäische … [+5181 chars]",,de,'Gasspeicher'
https://www.stern.de/wirtschaft/news/energiewende--prognose--ausbauziel-bei-windraedern-erstmals-realistisch-35444590.html,https://www.stern.de/wirtschaft/news/energiewende--prognose--ausbauziel-bei-windraedern-erstmals-realistisch-35444590.html,0,www.stern.de,Energiewende: Prognose: Ausbauziel bei Windrädern erstmals realistisch,Windkraft an Land spielt eine Schlüsselrolle bei der Energiewende. Die Zahl der Genehmigungen hat zuletzt stark angezogen. Können Ziele doch noch erreicht werden?,https://image.stern.de/35444592/t/Rn/v1/w1440/r1.7778/-/06--qcsleayuimv5axs2048jpeg---d01e8de9f619f079.jpg,2025-02-06T10:18:34Z,,"Kopiere den aktuellen Link
Windkraft an Land spielt eine Schlüsselrolle bei der Energiewende. Die Zahl der Genehmigungen hat zuletzt stark angezogen. Können Ziele doch noch erreicht werden?
Das Zie… [+2082 chars]",,de,'Windräder'
https://www.zeit.de/news/2025-02/06/prognose-ausbauziel-bei-windraedern-erstmals-realistisch,https://www.zeit.de/news/2025-02/06/prognose-ausbauziel-bei-windraedern-erstmals-realistisch,0,www.zeit.de,Energiewende: Prognose: Ausbauziel bei Windrädern erstmals realistisch,Hier finden Sie Informationen zu dem Thema „Energiewende“. Lesen Sie jetzt „Prognose: Ausbauziel bei Windrädern erstmals realistisch“.,https://img.zeit.de/news/2025-02/06/prognose-ausbauziel-bei-windraedern-erstmals-realistisch-image-group/wide__1300x731,2025-02-06T10:18:34Z,,Das Ziel beim Ausbau von Windrädern an Land im Jahr 2030 scheint nach einer neuen Prognose erstmals realistisch. Mit der aktuellen Dynamik in den Bundesländern werde das gesetzlich verankerte Bestreb… [+1930 chars],,de,'Windräder'
https://www.focus.de/politik/neues-sicherheitsabkommen-putin-und-lukaschenko-planen-einsatz-von-nuklearwaffen_id_260699479.html,https://www.focus.de/politik/neues-sicherheitsabkommen-putin-und-lukaschenko-planen-einsatz-von-nuklearwaffen_id_260699479.html,0,www.focus.de,Putins strategisches Sicherheitsnetz - Neues Abkommen mit Belarus erlaubt Russland den Einsatz von Atomwaffen,Putin reicht ein neues Sicherheitsabkommen mit Belarus zur Ratifizierung ein. Die Vereinbarung umfasst auch den Einsatz von Nuklearwaffen.,https://p6.focus.de/img/politik/ausland/id_259846982/leider-haben-wir-eine-reihe-von-schlaegen-gegen-unsere-energieobjekte-beobachtet-in-letzter-zeit-und-waren-gezwungen-darauf-zu-antworten-sagte-wladimir-putin-bei-einem-treffen-mit-dem-machthaber-von-belarus-alexander-lukaschenko..jpg?im=Crop%3D%280%2C0%2C2048%2C1024%29%3BResize%3D%281200%2C627%29&impolicy=perceptual&quality=mediumHigh&hash=1586a7abfc72f5a87be33b2688e1e42ed80e8b9e098818ff1521d001739a6c8d,2025-02-06T12:37:10Z,,Putin reicht ein neues Sicherheitsabkommen mit Belarus zur Ratifizierung ein. Die Vereinbarung umfasst auch den Einsatz von Nuklearwaffen.Russlands Präsident Wladimir Putin hat dem russischen Parlame… [+1321 chars],,de,'Putin'
https://www.tagesspiegel.de/internationales/zu-lange-eine-geisel-putins-grossbritannien-erleichtert-bau-neuer-atomkraftwerke-13156774.html,https://www.tagesspiegel.de/internationales/zu-lange-eine-geisel-putins-grossbritannien-erleichtert-bau-neuer-atomkraftwerke-13156774.html,0,www.tagesspiegel.de,„Zu lange eine Geisel Putins“: Großbritannien erleichtert Bau neuer Atomkraftwerke,Neue Kraftwerke sollen den Briten günstigen Strom und tausende Arbeitskräfte bringen. Die Regierung in London sieht vor allem Mini-Atomkraftwerke als Lösung für Energiesicherheit.,https://www.tagesspiegel.de/images/13159894/alternates/BASE_16_9_W1400/1738863816000/britain-nuclair.jpeg,2025-02-06T12:53:14Z,,"Die britische Regierung will den Bau sogenannter Mini-Atomkraftwerke in ihrem Land vorantreiben. Änderungen im Planungsrecht würden den Weg frei machen für kleinere, sicherere und leichter zu bauende… [+3175 chars]",,de,'fossile Energie'
https://www.zeit.de/news/2025-02/06/berichte-ueber-neue-ukrainische-offensive-im-gebiet-kursk,https://www.zeit.de/news/2025-02/06/berichte-ueber-neue-ukrainische-offensive-im-gebiet-kursk,0,www.zeit.de,Ukraine-Krieg: Berichte über neue ukrainische Offensive im Gebiet Kursk,Hier finden Sie Informationen zu dem Thema „Ukraine-Krieg“. Lesen Sie jetzt „Berichte über neue ukrainische Offensive im Gebiet Kursk“.,https://img.zeit.de/news/2025-02/06/berichte-ueber-neue-ukrainische-offensive-im-gebiet-kursk-image-group/wide__1300x731,2025-02-06T13:24:28Z,,"Ukrainische Truppen haben nach russischen Berichten zum zweiten Mal in diesem Jahr eine Offensive im Grenzgebiet Kursk gestartet. Der russische Telegramkanal Shot berichtete, die Ukrainer versuchten,… [+1650 chars]",,de,'Krieg'
https://www.sueddeutsche.de/stil/eigener-herd-bergamotte-zitrusfruechte-sirup-vitamine-li.3196443,https://www.sueddeutsche.de/stil/eigener-herd-bergamotte-zitrusfruechte-sirup-vitamine-li.3196443,0,www.sueddeutsche.de,Kolumne „Eigener Herd“: Superzitrone,Die Bergamotte gilt als aromatischste Zitrusfrucht überhaupt. Mit einem Sirup aus ihrem Saft und ihrer Schale werden Desserts im Winter plötzlich frisch und sommerlich.,https://www.sueddeutsche.de/2025/02/05/48b8c208-24c4-41a0-b8bf-1546d1d60f57.jpeg?q=60&fm=webp&width=1200&rect=0%2C356%2C4000%2C2250,2025-02-06T14:51:38Z,http://archive.md/20250207130955/https://www.sueddeutsche.de/stil/eigener-herd-bergamotte-zitrusfruechte-sirup-vitamine-li.3196443,"Hin und wieder heißt es in dieser Kolumne etwas vorwurfsvoll, das Obstsortiment werde im Zeitalter hoch industrialisierter Lebensmittel immer kleiner. Grundsätzlich ist das leider richtig, aber eben … [+3447 chars]",,de,'Öl'
https://www.n-tv.de/politik/Frankreichs-Sparkurs-wird-fuer-Buerger-richtig-teuer-article25544180.html,https://www.n-tv.de/politik/Frankreichs-Sparkurs-wird-fuer-Buerger-richtig-teuer-article25544180.html,0,www.n-tv.de,Steuererhöhung bei Strom und Gas: Frankreichs Sparkurs wird für Bürger richtig teuer,"Frankreich ist hoch verschuldet. Einen Haushalt auf die Beine zu stellen, ist unter dieser Berücksichtigung nicht einfach. Eine Regierung wurde deshalb zu Fall gebracht. Deren Nachfolger entscheiden sich für einen harten Kurs in der Steuerpolitik. Für so gut …",https://www.n-tv.de/img/incoming/crop25544195/4831327633-cImg_16_9-w1200/imago799939597.jpg,2025-02-06T15:30:06Z,https://web.archive.org/web/20250206182622/https://www.n-tv.de/politik/Frankreichs-Sparkurs-wird-fuer-Buerger-richtig-teuer-article25544180.html,"Frankreich ist hoch verschuldet. Einen Haushalt auf die Beine zu stellen, ist unter dieser Berücksichtigung nicht einfach. Eine Regierung wurde deshalb zu Fall gebracht. Deren Nachfolger entscheiden … [+2677 chars]",,de,'Gas'
https://www.sueddeutsche.de/muenchen/muenchen-waermepumpe-heizungsgesetz-verunsicherung-li.3195214,https://www.sueddeutsche.de/muenchen/muenchen-waermepumpe-heizungsgesetz-verunsicherung-li.3195214,0,www.sueddeutsche.de,Heizen: Warum die Wärmepumpe Deutschland spaltet,"Die Nachfrage ging zuletzt dramatisch runter, jetzt verunsichert auch noch die CDU Hauseigentümer. Warum Experten Wärmepumpen trotzdem anpreisen und welche falschen Gerüchte kursieren.",https://www.sueddeutsche.de/2025/02/06/78ab4532-ee8e-46ca-abaf-e93d2a8c1ac6.jpeg?q=60&fm=webp&width=1200&rect=0%2C210%2C4000%2C2250,2025-02-06T15:48:41Z,http://archive.md/20250206161001/https://www.sueddeutsche.de/muenchen/muenchen-waermepumpe-heizungsgesetz-verunsicherung-li.3195214,"6. Februar 2025, 16:48 UhrLesezeit: 5 Min.
Die Nachfrage ging zuletzt dramatisch runter, jetzt verunsichert auch noch die CDU Hauseigentümer. Warum Experten Wärmepumpen trotzdem anpreisen und welche… [+541 chars]",,de,'Öl'
https://www.diepresse.com/19336743/die-reserven-schmelzen-gaspreis-in-europa-setzt-hoehenflug-fort,https://www.diepresse.com/19336743/die-reserven-schmelzen-gaspreis-in-europa-setzt-hoehenflug-fort,0,www.diepresse.com,Die Reserven schmelzen: Gaspreis in Europa setzt Höhenflug fort,Der Preis für europäisches Erdgas hat am Donnerstag den höchsten Stand seit über einem Jahr erreicht. Als Preistreiber werden am Markt jüngste Wetterprognosen genannt.,https://img.diepresse.com/public/incoming/lyjmz5-UKRAINE-CRISISEUROPE-GAS/alternates/DPR_SOCIAL_NACHRICHTEN/UKRAINE-CRISISEUROPE-GAS,2025-02-06T16:04:50Z,,"Der Preis für europäisches Erdgas hat am Donnerstag den höchsten Stand seit über einem Jahr erreicht. Als Preistreiber werden am Markt jüngste Wetterprognosen genannt. 
Der Preis für europäisches Er… [+1937 chars]",,de,'Gas'
https://www.zeit.de/news/2025-02/06/werder-wegradeln-bayern-sportvorstand-eberl-warnt,https://www.zeit.de/news/2025-02/06/werder-wegradeln-bayern-sportvorstand-eberl-warnt,0,www.zeit.de,"Fußball-Bundesliga: Werder ""wegradeln""? Bayern-Sportvorstand Eberl warnt","Hier finden Sie Informationen zu dem Thema „Fußball-Bundesliga“. Lesen Sie jetzt „Werder ""wegradeln""? Bayern-Sportvorstand Eberl warnt“.",https://img.zeit.de/news/2025-02/06/werder-wegradeln-bayern-sportvorstand-eberl-warnt-image-group/wide__1300x731,2025-02-06T16:18:29Z,,"Bayern Münchens Sportvorstand Eberl will trotz der guten Ausgangsposition in der Fußball-Bundesliga den Titel nicht versprechen. «Ich kann nur versprechen, dass wir alles dafür tun. Das ist sehr plum… [+1171 chars]",,de,'Bayern'
https://www.zeit.de/news/2025-02/06/moskauer-politiker-baldiges-treffen-putins-mit-trump,https://www.zeit.de/news/2025-02/06/moskauer-politiker-baldiges-treffen-putins-mit-trump,0,www.zeit.de,Krieg in der Ukraine: Moskauer Politiker: Baldiges Treffen Putins mit Trump,Hier finden Sie Informationen zu dem Thema „Krieg in der Ukraine“. Lesen Sie jetzt „Moskauer Politiker: Baldiges Treffen Putins mit Trump“.,https://img.zeit.de/news/2025-02/06/moskauer-politiker-baldiges-treffen-putins-mit-trump-image-group/wide__1300x731,2025-02-06T19:30:58Z,,"Der prominente russische Außenpolitiker Leonid Sluzki erwartet ein Treffen von Kremlchef Wladimir Putin und US-Präsident Donald Trump schon in nächster Zeit. «Februar oder März, wir wollen nicht rate… [+1327 chars]",,de,'Putin'
