index,url,valid,domain,title,description,image,published,archive,content,quote,language,keyword
https://www.faz.net/aktuell/politik/ausland/russischer-exilkuenstler-semyon-skrepetsky-in-polen-erschossen-accg-200933933.html,https://www.faz.net/aktuell/politik/ausland/russischer-exilkuenstler-semyon-skrepetsky-in-polen-erschossen-accg-200933933.html,0,www.faz.net,Putin-Kritiker: Russischer Exilkünstler in Polen erschossen,Der für Spottzeichnungen über Putin und Lukaschenko bekannte Russe Semyon Skrepetsky lebte im Exil in Polen. Nun ist er dort auf offener Straße erschossen worden.,https://media0.faz.net/image/w1200h627/f49d2ef5372f/w4032h2106x0y479o/202606/43601.0.2221830901/laut-polizei-wurde-semyon.webp,2026-06-16T05:31:46Z,,Der russische Künstler und Putin-Kritiker Semyon Skrepetsky ist am Montagmorgen im Osten Polens auf offener Straße erschossen worden. Auf den 44 Jahre alten Mann seien mehrere Schüsse abgegeben worde… [+816 chars],,de,'Putin'
https://www.faz.net/aktuell/finanzen/bank-von-japan-hebt-zinsen-auf-hoechsten-stand-seit-1995-accg-200934099.html,https://www.faz.net/aktuell/finanzen/bank-von-japan-hebt-zinsen-auf-hoechsten-stand-seit-1995-accg-200934099.html,0,www.faz.net,Kampf gegen Inflation und billigen Yen: Zinsen in Japan steigen auf höchstes Niveau seit 1995,Aus Sorge vor weiter steigenden Preisen im Zuge der Energiekrise hebt die Notenbank in Tokio die Zinsen weiter an. Der Aktienmarkt durchbricht indes die nächste Rekordmarke.,https://media0.faz.net/image/w1200h627/ff6f8ac66745/w8192h4280x0y592o/202606/43601.0.2222871232/die-zentrale-der-bank-von.webp,2026-06-16T07:38:06Z,,Die Bank von Japan (BOJ) hat am Dienstag ihren Leitzins auf 1 Prozent angehoben und damit auf den höchsten Stand seit 1995. Damit will die Zentralbank einer weiter steigenden Inflation zuvorkommen un… [+3159 chars],,de,'Energiepreise'
https://www.zeit.de/news/2026-06/16/iran-weitere-verhandlungen-mit-usa-beginnen-am-freitag,https://www.zeit.de/news/2026-06/16/iran-weitere-verhandlungen-mit-usa-beginnen-am-freitag,0,www.zeit.de,Krieg in Nahost: Iran: Weitere Verhandlungen mit USA beginnen am Freitag,Hier finden Sie Informationen zu dem Thema „Krieg in Nahost“. Lesen Sie jetzt „Iran: Weitere Verhandlungen mit USA beginnen am Freitag“.,https://img.zeit.de/news/2026-06/16/iran-weitere-verhandlungen-mit-usa-beginnen-am-freitag-image-group/wide__1300x731,2026-06-16T08:18:18Z,,Eine weitere Verhandlungsrunde zwischen den USA und dem Iran soll nach iranischen Angaben direkt nach Unterzeichnung des verhandelten Rahmenabkommens am Freitag in der Schweiz beginnen. Diese weitere… [+1387 chars],,de,'Krieg'
https://www.bild.de/politik/ausland-und-internationales/15-km-vorm-kreml-ukraine-drohne-trifft-moskaus-wichtigste-oel-quelle-6a3104617e682fc37fbfbe66,https://www.bild.de/politik/ausland-und-internationales/15-km-vorm-kreml-ukraine-drohne-trifft-moskaus-wichtigste-oel-quelle-6a3104617e682fc37fbfbe66,0,www.bild.de,15 km vorm Kreml - Ukraine-Drohne trifft Moskaus wichtigste Öl-Quelle,"Moskau – Explosionen, Feuerball, Rauchschwaden. Die wichtigste Öl-Quelle 15 Kilometer vor Moskau brennt! Ukraine-Drohnen haben die Öl-Raffinerie angegrif...","https://images.bild.de/6a3104617e682fc37fbfbe66/1e9fee876135eb524d03315c00c9491e,d07b9997?w=1280",2026-06-16T10:12:23Z,,"TTS-Player überspringenArtikel weiterlesenMoskau Explosionen, Feuerball, Rauchschwaden. Die wichtigste Öl-Quelle 15 Kilometer vor Moskau brennt! Ukraine-Drohnen haben die Öl-Raffinerie angegriffen, d… [+2193 chars]",,de,'Öl'
https://www.zeit.de/politik/ausland/2026-06/usa-iran-donald-trump-vereinbarung-krise-krieg,https://www.zeit.de/politik/ausland/2026-06/usa-iran-donald-trump-vereinbarung-krise-krieg,0,www.zeit.de,USA und Iran: So leicht wird er den Krieg nicht los,"Donald Trump verkauft die Vereinbarung mit dem Iran als Erfolg. Doch den innenpolitischen Krisen, die sein Krieg ausgelöst hat, wird er vorerst nicht entkommen.",https://img.zeit.de/politik/ausland/2026-06/usa-iran-donald-trump-vereinbarung-krise-krieg-bild/wide__1300x731,2026-06-16T10:38:11Z,,"Als der republikanische Senator Lindsey Graham im Februar
bei der Münchner Sicherheitskonferenz war, erzählte er jedem, der es wissen
wollte, dass Donald Trump es schaffen würde, das iranische Regi… [+855 chars]",,de,'Krieg'
https://www.diepresse.com/30641314/g7-staaten-beraten-ueber-strengere-energiesanktionen-gegen-russland,https://www.diepresse.com/30641314/g7-staaten-beraten-ueber-strengere-energiesanktionen-gegen-russland,0,www.diepresse.com,G7-Staaten beraten über strengere Energiesanktionen gegen Russland,Die G7-Staaten haben sich nach Angaben aus Diplomatenkreisen auf neue Sanktionen gegen den Öl- und Gassektor verständigt.,https://img.diepresse.com/public/incoming/y6xovq-afpb79f6kfjpg/alternates/WEBP_WIDE_1200/AFP_B79F6KF.jpg,2026-06-16T11:23:55Z,,Die G7-Staaten haben sich nach Angaben aus Diplomatenkreisen bei ihrem Gipfel in Frankreich auf neue Sanktionen gegen Russland verständigt. Die Staats- und Regierungschefs der sieben Industrienatione… [+3639 chars],,de,'Öl'
https://taz.de/Der-bekannteste-Umweltaktivist-Iraks/!6184690/,https://taz.de/Der-bekannteste-Umweltaktivist-Iraks/!6184690/,0,taz.de,Der bekannteste Umweltaktivist Iraks: Wird in Irak das Wasser so wertvoll wie heute das Öl?,"Umweltexperte Jassim al-Asadi beschäftigt sich mit Sümpfen im Südirak. Er weiß, was nötig ist, um sie zu retten: kluge Bewässerung und starke Frauen.",https://taz.de/picture/8505401/1200/IMG-8815-2.jpeg,2026-06-16T11:25:00Z,,"Umweltexperte Jassim al-Asadi beschäftigt sich mit Sümpfen im Südirak. Er weiß, was nötig ist, um sie zu retten: kluge Bewässerung und starke Frauen. mehr...",,de,'Öl'
https://www.tagesspiegel.de/internationales/g7-gipfel-merz-tag-der-hoffnung-fur-ukraine-und-golfregion-15719235.html,https://www.tagesspiegel.de/internationales/g7-gipfel-merz-tag-der-hoffnung-fur-ukraine-und-golfregion-15719235.html,0,www.tagesspiegel.de,G7-Gipfel: Merz: „Tag der Hoffnung“ für Ukraine und Golfregion,Die USA sehen ein Ende des Krieges mit dem Iran. Nun geht es beim G7-Gipfel auch wieder um die Ukraine. Trump sucht das Gespräch mit dem ukrainischen Präsidenten. Und den Europäern.,https://www.tagesspiegel.de/images/15720749/alternates/BASE_16_9_W1400/1781624803000/g7-gipfel.jpeg,2026-06-16T11:35:30Z,,"Die USA und führende europäische Staaten wollen den Druck auf Russland weiter erhöhen, um ein Ende des Ukraine-Kriegs zu erzwingen. Beim G7-Gipfel im französischen Évian stimmten nach Angaben von Kan… [+5350 chars]",,de,'Krieg'
https://www.tagesschau.de/ausland/europa/g7-ukraine-sanktionen-russland-100.html,https://www.tagesschau.de/ausland/europa/g7-ukraine-sanktionen-russland-100.html,0,www.tagesschau.de,G7 planen neue Russland-Sanktionen,"Die führenden demokratischen Wirtschaftsmächte wollen die Ukraine wieder stärker unterstützen. Dazu sollen neue Sanktionen gegen den russischen Öl- und Gassektor kommen, berichten Medien unter Berufung auf Diplomaten.",https://images.tagesschau.de/image/651d4249-14e5-4439-a71e-0652cc9efd9d/AAABntAwjjY/AAABnSSvrFg/16x9-big/macron-selenskyj-120.jpg?width=1280,2026-06-16T11:55:54Z,,"Stand: 16.06.2026 13:55 Uhr
Die führenden demokratischen Wirtschaftsmächte wollen die Ukraine wieder stärker unterstützen. Dazu sollen neue Sanktionen gegen den russischen Öl- und Gassektor kommen, … [+2716 chars]",,de,'Öl'
https://www.stern.de/politik/ausland/spitzentreffen-am-genfersee--kommt-die-bundeswehr-in-der-strasse-von-hormus-zum-einsatz--37552904.html,https://www.stern.de/politik/ausland/spitzentreffen-am-genfersee--kommt-die-bundeswehr-in-der-strasse-von-hormus-zum-einsatz--37552904.html,0,www.stern.de,Spitzentreffen am Genfersee: Kommt die Bundeswehr in der Straße von Hormus zum Einsatz?,Am Freitag soll das Rahmenabkommen über die Beendigung des Iran-Kriegs unterzeichnet werden. Danach geht es um die weitere Konkretisierung und Umsetzung. Dabei kann Deutschland ins Spiel kommen.,https://image.stern.de/37552906/t/ja/v1/w1440/r1.7778/-/16--rovrve7u2ev5axs2048jpeg---951b8676c85bf769.jpg,2026-06-16T12:46:08Z,,"Kopiere den aktuellen Link
Zur Merkliste hinzufügen
Am Freitag soll das Rahmenabkommen über die Beendigung des Iran-Kriegs unterzeichnet werden. Danach geht es um die weitere Konkretisierung und Um… [+5200 chars]",,de,'Öl'
https://www.tagesspiegel.de/internationales/spitzentreffen-am-genfersee-kommt-die-bundeswehr-in-der-strasse-von-hormus-zum-einsatz-15719613.html,https://www.tagesspiegel.de/internationales/spitzentreffen-am-genfersee-kommt-die-bundeswehr-in-der-strasse-von-hormus-zum-einsatz-15719613.html,0,www.tagesspiegel.de,Spitzentreffen am Genfersee: Kommt die Bundeswehr in der Straße von Hormus zum Einsatz?,Am Freitag soll das Rahmenabkommen über die Beendigung des Iran-Kriegs unterzeichnet werden. Danach geht es um die weitere Konkretisierung und Umsetzung. Dabei kann Deutschland ins Spiel kommen.,https://www.tagesspiegel.de/images/15719611/alternates/BASE_16_9_W1400/1781614043000/minenjagdboot-fulda-startet-zu-einsatz-im-mittelmeer.jpeg,2026-06-16T12:47:23Z,,"Das Rahmenabkommen zur Beendigung des Iran-Kriegs steht, aber viele Fragen sind offen. Dazu gehört, ob die wichtige Handelsroute durch die Straße von Hormus nun durch eine Militärmission gesichert we… [+5058 chars]",,de,'Öl'
https://orf.at/stories/3433492/,https://orf.at/stories/3433492/,0,orf.at,WIFO-Chef sieht Hoffnung für Konjunktur,"WIFO-Chef Gabriel Felbermayr sieht den Iran-Deal zwischen Teheran und Washington – sofern er hält – positiv. Das sei jedenfalls etwas, was „uns konjunkturell und bei der Inflationsbekämpfung sehr helfen“ werde. Auch für das Doppelbudget sah Felbermayr am Dien…",https://ibs.orf.at/news?image=https%3A%2F%2Fassets.orf.at%2Fmims%2F2026%2F25%2F59%2Fcrops%2Fw%3D1200%2Ch%3D630%2Cq%3D75%2F3074928_master_1190459_iran_felbermayr_iea_wirtschaft_coe.jpg%3Fs%3Dd9aa106cf4276f29ba25539c71baf64f0a3f1a30,2026-06-16T13:04:07Z,,"Felbermayr warnte im Ö1-Interview, allzu rasch sollte man den Effekt aber nicht erwarten. Der Preis für die Rohölsorte Brent sei von über 100 auf rund 83 Dollar je Fass gefallen, das übersetzt sich m… [+2681 chars]",,de,'Inflation'
https://www.stern.de/news/trump-will-oel-sanktionen-gegen-russland--bald--wieder-in-kraft-setzen-37553086.html,https://www.stern.de/news/trump-will-oel-sanktionen-gegen-russland--bald--wieder-in-kraft-setzen-37553086.html,0,www.stern.de,Trump will Öl-Sanktionen gegen Russland „bald“ wieder in Kraft setzen,"US-Präsident Donald Trump will ausgesetzte Sanktionen gegen russische Öl-Exporte wieder in Kraft setzen. Die USA würden „bald in der Lage sein“, dies zu tun, sagte Trump am Dienstag beim G7-Gipfel im französischen Evian. Er verwies dabei darauf, dass durch di…",https://image.stern.de/37553088/t/7e/v1/w1440/r1.7778/-/16--trump-beim-g7gipfel-in-evian---456c5b37ea450006.jpg,2026-06-16T13:15:12Z,,"Kopiere den aktuellen Link
Zur Merkliste hinzufügen
US-Präsident Donald Trump will ausgesetzte Sanktionen gegen russische Öl-Exporte wieder in Kraft setzen. Die USA würden bald in der Lage sein, di… [+1144 chars]",,de,'Öl'
https://www.faz.net/aktuell/politik/ausland/g-7-gipfel-donald-trump-fordert-russland-zu-verhandlungen-auf-200935638.html,https://www.faz.net/aktuell/politik/ausland/g-7-gipfel-donald-trump-fordert-russland-zu-verhandlungen-auf-200935638.html,0,www.faz.net,Gipfel in Évian: G7 wollen Druck auf Putin erhöhen,Beim Gipfel in Évian wächst die Hoffnung auf neue Bewegung im Ukrainekrieg: Trump trifft den ukrainischen Präsidenten zum Gespräch – und sendet ein Signal an Moskau.,https://media0.faz.net/image/w1200h627/89c7f0f18c0d/w5727h2992x1524y1260o/202606/43601.0.2223587275/gastgeber-emmanuel-macron.webp,2026-06-16T13:34:18Z,,"Vom G-7-Gipfel in Évian soll ein Signal an den russischen Präsidenten ausgehen, in Verhandlungen mit der Ukraine einzuwilligen. Russland sollte ein Abkommen schließen, sagte der amerikanische Präside… [+5532 chars]",,de,'Putin'
https://www.n-tv.de/politik/G7-wollen-Druck-auf-Moskau-mit-neuen-Energie-Sanktionen-erhoehen-id30972954.html,https://www.n-tv.de/politik/G7-wollen-Druck-auf-Moskau-mit-neuen-Energie-Sanktionen-erhoehen-id30972954.html,0,www.n-tv.de,Weitere Militärhilfen geplant: G7 wollen Druck auf Moskau mit neuen Energie-Sanktionen erhöhen,"Die westlichen Sanktionen gegen Russland setzen den Kreml zwar unter Druck, haben bisher aber keinen Kurswechsel von Präsident Putin im Ukraine-Krieg erzwungen. Nun sehen die G7-Staaten jedoch eine veränderte Dynamik - und wollen diese ausnutzen.",https://www.n-tv.de/img/30972971/1781619100/Img_16_9/1200/Keir-Starmer-premier-ministre-du-Royaume-Uni-Le-president-des-Etats-Unis-Donald-Trump-Le-president-Emmanuel-Macron-Le-president-de-lUkraine-Volodymyr-Zelensky-Mark-Carney-premier-ministre-du-Canada-Giorgia-Meloni-premiere-ministre-de-lItalie-Sanae-Takaichi-premiere-ministre-du-Japon-lors-d-une-reunion-avec-le-president-de-l-Ukraine-lors-du-sommet-du-G7-a-Evian-le-16-juin-2026-Meeting-with-the-President-of-Ukraine-during-the-G7-summit-in-Evian-on-June-16-2026.jpg,2026-06-16T13:39:40Z,,"Weitere Militärhilfen geplantG7 wollen Druck auf Moskau mit neuen Energie-Sanktionen erhöhen
Selenskyj kommt mit den Staats- und Regierungschefs der G7 zusammen. (Foto: picture alliance / SIPA)
Die… [+3288 chars]",,de,'Putin'
https://www.zeit.de/news/2026-06/16/bayern-droht-mit-verfassungsklage-gegen-enteignungen,https://www.zeit.de/news/2026-06/16/bayern-droht-mit-verfassungsklage-gegen-enteignungen,0,www.zeit.de,Wohnungsmarkt: Bayern droht mit Verfassungsklage gegen Enteignungen,Hier finden Sie Informationen zu dem Thema „Wohnungsmarkt“. Lesen Sie jetzt „Bayern droht mit Verfassungsklage gegen Enteignungen“.,https://img.zeit.de/news/2026-06/16/bayern-droht-mit-verfassungsklage-gegen-enteignungen-image-group/wide__1300x731,2026-06-16T13:51:31Z,,Bayern will notfalls mit einer Klage vor dem Bundesverfassungsgericht gegen die Enteignung von Wohnungsunternehmen in Berlin vorgehen. Der Freistaat wolle sich «grundsätzlich dagegen wehren» auch geg… [+2729 chars],,de,'Bayern'
https://www.stern.de/wirtschaft/news/energie--oelpreise-fallen-weiter-deutlich-37550338.html,https://www.stern.de/wirtschaft/news/energie--oelpreise-fallen-weiter-deutlich-37550338.html,0,www.stern.de,Energie: Ölpreise fallen weiter deutlich,Seit der Einigung zwischen den USA und dem Iran auf ein Rahmenabkommen sind die Preise für Rohöl auf Talfahrt. Der Preis für ein Barrel Brent-Öl fällt erstmals seit Anfang März unter 80 US-Dollar.,https://image.stern.de/37553390/t/nJ/v1/w1440/r1.7778/-/16--k6jshf5ka3v12axs2048jpeg---f7b0cd38ebe4a79b.jpg,2026-06-16T14:00:45Z,,"Kopiere den aktuellen Link
Zur Merkliste hinzufügen
Seit der Einigung zwischen den USA und dem Iran auf ein Rahmenabkommen sind die Preise für Rohöl auf Talfahrt. Der Preis für ein Barrel Brent-Öl … [+1659 chars]",,de,'Öl'
https://www.zeit.de/news/2026-06/16/laimer-entscheidung-bei-bayern-gefallen,https://www.zeit.de/news/2026-06/16/laimer-entscheidung-bei-bayern-gefallen,0,www.zeit.de,Fußball-Bundesliga: Laimer-Entscheidung bei Bayern gefallen?,Hier finden Sie Informationen zu dem Thema „Fußball-Bundesliga“. Lesen Sie jetzt „Laimer-Entscheidung bei Bayern gefallen?“.,https://img.zeit.de/news/2026-06/16/laimer-entscheidung-bei-bayern-gefallen-image-group/wide__1300x731,2026-06-16T14:09:20Z,,"Der österreichische Fußball-Nationalspieler Konrad Laimer und der FC Bayern München stehen offenbar vor einer Vertragsverlängerung. Wie der «Kicker» berichtet, nähert sich der lange Poker dem Ende. N… [+1731 chars]",,de,'Bayern'
https://www.welt.de/politik/ausland/article6a31dde0a7834e0047eebf94/treffen-in-evian-g7-staaten-kuendigen-neue-sanktionen-gegen-russland-und-waffen-fuer-die-ukraine-an.html,https://www.welt.de/politik/ausland/article6a31dde0a7834e0047eebf94/treffen-in-evian-g7-staaten-kuendigen-neue-sanktionen-gegen-russland-und-waffen-fuer-die-ukraine-an.html,0,www.welt.de,G7-Staaten kündigen neue Sanktionen gegen Russland und Waffen für die Ukraine an,"In einer Erklärung der Staats- und Regierungschefs vom Gipfeltreffen im französischen Évian heißt es, man werde die Sanktionen verschärfen, auch im Öl- und Gassektor. Kanzler Merz spricht von einem „Tag der Hoffnung“ – und sieht erstmals eine echte Chance auf…",https://images.welt.de/6a31dde0a7834e0047eebf94/84147ef70853cf7dff528f22ab82ccaa-master/ci16x9-w1200/dpa-com-260616-936-15771-jpg,2026-06-16T23:47:01Z,,"Die Staats- und Regierungschefs erklären beim Gipfeltreffen im französischen Évian, man werde die Sanktionen verschärfen, auch im Öl- und Gassektor. Kanzler Merz spricht von einem Tag der Hoffnung un… [+3380 chars]",,de,'Öl'
https://www.tagesspiegel.de/internationales/g7-gipfel-wie-lange-halt-die-gipfelharmonie-mit-trump-15721035.html,https://www.tagesspiegel.de/internationales/g7-gipfel-wie-lange-halt-die-gipfelharmonie-mit-trump-15721035.html,0,www.tagesspiegel.de,G7-Gipfel: Wie lange hält die Gipfelharmonie mit Trump?,"Der Iran-Krieg hat die USA und die Europäer entzweit. Die Hoffnung auf Frieden bringt sie nun wieder zusammen. Das bietet neue Chancen. Fragt sich nur, wie lange das hält?",https://www.tagesspiegel.de/images/15724327/alternates/BASE_16_9_W1400/1781703018000/g7-gipfel.jpeg,2026-06-17T00:56:24Z,,Love Is a Long Road. Mit diesem Song von Tom Petty über eine schwierige Liebesbeziehung hat der französische Präsident Emmanuel Macron auf Instagram die Ankunft von US-Präsident Donald Trump beim G7-… [+4237 chars],,de,'Krieg'
https://www.tagesspiegel.de/internationales/spitzentreffen-in-evian-funf-lehren-aus-dem-g7-gipfel-15721035.html,https://www.tagesspiegel.de/internationales/spitzentreffen-in-evian-funf-lehren-aus-dem-g7-gipfel-15721035.html,0,www.tagesspiegel.de,Spitzentreffen in Évian: Fünf Lehren aus dem G7-Gipfel,Der Iran-Krieg hat die USA und die Europäer entzweit. Die Hoffnung auf Frieden bringt sie nun wieder zusammen. Und das bietet Chancen für die Lösung eines weiteren Konflikts.,https://www.tagesspiegel.de/images/15721034/alternates/BASE_16_9_W1400/1781657783000/g7-gipfel.jpeg,2026-06-17T00:56:24Z,,Schärfere Sanktionen gegen Russland und mehr Waffen für die Ukraine: Die Staats- und Regierungschefs der G7-Staaten haben in der Nacht vor ihrem letzten Gipfeltag eine gemeinsame Erklärung veröffentl… [+4695 chars],,de,'Krieg'
https://www.morgenpost.de/politik/article412304847/g7-staaten-beschliessen-neue-sanktionen-gegen-russland-tag-der-hoffnung.html,https://www.morgenpost.de/politik/article412304847/g7-staaten-beschliessen-neue-sanktionen-gegen-russland-tag-der-hoffnung.html,0,www.morgenpost.de,G7-Staaten beschließen neue Sanktionen gegen Russland: „Tag der Hoffnung“,Gastgeber Emmanuel Macron spricht von einem „strategischem Erwachen“. Überrascht sind die Europäer von US-Präsident Donald trump.,https://img.sparknews.funkemedien.de/412304845/412304845_1781663427_v16_9_1600.jpeg,2026-06-17T02:30:38Z,,Die G7-Staaten haben während ihres Gipfeltreffens im französischen Évian neue Sanktionen gegen Russland angekündigt. Die Staats- und Regierungschefs wollen damit mit zusätzlichem Druck die Bemühungen… [+2107 chars],,de,'Gas'
https://www.tagesspiegel.de/internationales/neue-sanktionen-gegen-moskau-mehr-waffen-fur-kiew-g7-staaten-erhohen-druck-auf-russland-15721146.html,https://www.tagesspiegel.de/internationales/neue-sanktionen-gegen-moskau-mehr-waffen-fur-kiew-g7-staaten-erhohen-druck-auf-russland-15721146.html,0,www.tagesspiegel.de,"Neue Sanktionen gegen Moskau, mehr Waffen für Kiew: G7-Staaten erhöhen Druck auf Russland",Die USA und die anderen G7-Staaten wollen die Bemühungen um ein Ende des Ukraine-Krieges intensivieren. Dafür sollen unter anderem die Sanktionen im Energiesektor verschärft werden.,https://www.tagesspiegel.de/images/15721150/alternates/BASE_16_9_W1400/1781668087000/g7-gipfel.jpeg,2026-06-17T03:44:42Z,,Die USA und die anderen G7-Staaten wollen mit zusätzlichem Druck auf Russland die Bemühungen um ein Ende des Ukraine-Krieges intensivieren. In einer Erklärung der Staats- und Regierungschefs vom Gipf… [+2166 chars],,de,'Öl'
https://www.n-tv.de/politik/Iran-exportiert-erstmals-seit-Monaten-Oel-per-Schiff-id30975360.html,https://www.n-tv.de/politik/Iran-exportiert-erstmals-seit-Monaten-Oel-per-Schiff-id30975360.html,0,www.n-tv.de,Keine US-Blockade mehr: Iran exportiert erstmals seit Monaten Öl per Schiff,"Die Vereinigten Staaten verhindern nicht mehr länger die Ausfahrt von iranischen Schiffen aus der Straße von Hormus. Damit kann das Land seinem Ölgeschäft wieder Auftrieb verleihen. Unklar ist derweil weiterhin, ob sich beide Seiten beim Thema Gebühren einig …",https://www.n-tv.de/img/30975377/1781677039/Img_16_9/1200/Vessels-continue-waiting-for-passage-through-the-Strait-of-Hormuz-GULF-OF-OMAN-JUNE-4-A-screen-grab-taken-from-a-video-shows-commercial-vessels-waiting-in-the-Gulf-of-Oman-after-applying-for-transit-permits-to-pass-through-the-Strait-of-Hormuz-on-June-4-2026-Iran-s-Islamic-Revolutionary-Guard-Corps-IRGC-announced-that-all-shipowners-and-captains-seeking-passage-through-the-strategic-waterway-must-obtain-authorization-through-the-newly-established-Persian-Gulf-Waterway-Management-Authority-More-than-300-vessels-have-reportedly-submitted-permit-applications-while-awaiting-approval-for-transit-Stringer-Anadolu-Gulf-of-Oman-Gulf-of-Oman-Editorial-use-only-Please-get-in-touch-for-any-other-usage.jpg,2026-06-17T04:42:00Z,,"Washington und Teheran wollen am Freitag in der Schweiz ein Abkommen unterzeichnen. (Foto: IMAGO/Anadolu Agency)
Die Vereinigten Staaten verhindern nicht mehr länger die Ausfahrt von iranischen Schi… [+1877 chars]",,de,'Öl'
https://www.welt.de/videos/video6a321d277e682fc37fbfd3fc/treffen-in-evian-g-7-staaten-kuendigen-neue-sanktionen-gegen-russland-und-waffen-fuer-die-ukraine-an.html,https://www.welt.de/videos/video6a321d277e682fc37fbfd3fc/treffen-in-evian-g-7-staaten-kuendigen-neue-sanktionen-gegen-russland-und-waffen-fuer-die-ukraine-an.html,0,www.welt.de,G-7-Staaten kündigen neue Sanktionen gegen Russland und Waffen für die Ukraine an,Die G-7-Staaten wollen mit zusätzlichem Druck auf Russland die Bemühungen um ein Ende des Ukraine-Krieges intensivieren und dazu Sanktionen im Öl- und Gassektor verschärfen. Zudem habe man weitere Waffenlieferungen an die Ukraine vereinbart.,https://images.welt.de/6a321d277e682fc37fbfd3fc/9a716757fa11d6d924cb8762996e6def/ci16x9-w1200/dpa-com-260616-936-15771-jpg,2026-06-17T04:46:56Z,,Die WELT als ePaper: Die vollständige Ausgabe steht Ihnen bereits am Vorabend zur Verfügung so sind Sie immer hochaktuell informiert. Weitere Informationen https://epaper.welt.de,,de,'Öl'
https://www.faz.net/aktuell/politik/ausland/ist-der-istgh-chefanklaeger-karim-khan-taeter-oder-opfer-accg-200921559.html,https://www.faz.net/aktuell/politik/ausland/ist-der-istgh-chefanklaeger-karim-khan-taeter-oder-opfer-accg-200921559.html,0,www.faz.net,Chefankläger des IStGH: Ist Karim Khan Täter oder Opfer?,"Der Internationale Strafgerichtshof hat seinen Chefankläger Karim Khan suspendiert. Der Jurist, der Putin und Netanjahu anklagte, spricht von einer Kampagne.",https://media0.faz.net/image/w1200h627/cd1694baf819/w8640h4514x0y173o/202606/43601.0.2195859658/staatsanwalt-karim-khan.webp,2026-06-17T05:30:21Z,,"Er ging auf Konfrontationskurs mit den Mächtigen dieser Welt. Karim Khan, seit 2021 Chefankläger des Internationalen Strafgerichtshofes, beantragte unter anderem die Haftbefehle gegen den russischen … [+5662 chars]",,de,'Putin'
https://www.tagesschau.de/wirtschaft/finanzen/fed-zinsentscheid-warsh-inflation-trump-100.html,https://www.tagesschau.de/wirtschaft/finanzen/fed-zinsentscheid-warsh-inflation-trump-100.html,0,www.tagesschau.de,Fed-Zinsentscheid: Warsh zwischen Inflation und Trump,Der von Trump ernannte neue Fed-Chef Kevin Warsh steht vor seiner ersten Zinsentscheidung. Fallende Ölpreise verschaffen ihm Luft - doch die Märkte könnten die Inflationsrisiken unterschätzen. Von Angela Göpfert.,https://images.tagesschau.de/image/d156687c-e001-4d1e-96e8-7c4d510016c4/AAABns9GlY4/AAABnSSvrFg/16x9-big/kevin-warsh-112.jpg?width=1280,2026-06-17T06:16:26Z,,"Stand: 17.06.2026 08:16 Uhr
Der von Trump ernannte neue Fed-Chef Kevin Warsh steht vor seiner ersten Zinsentscheidung. Fallende Ölpreise verschaffen ihm Luft - doch die Märkte könnten die Inflations… [+4997 chars]",,de,'Öl'
https://www.diepresse.com/30848620/tracking-website-zeigt-iranische-oel-exporte-per-schiff-laufen-wieder,https://www.diepresse.com/30848620/tracking-website-zeigt-iranische-oel-exporte-per-schiff-laufen-wieder,0,www.diepresse.com,Tracking-Website zeigt: Iranische Öl-Exporte per Schiff laufen wieder an,Es sind die ersten Rohölexporte des Iran seit der Blockade durch die USA vor zwei Monaten.,https://img.diepresse.com/public/incoming/8s1jdh-iran-crisisoil-shipping/alternates/WEBP_WIDE_1200/IRAN-CRISISOIL-SHIPPING,2026-06-17T06:29:25Z,,Nach der Vereinbarung mit den USA zur Beendigung des Iran-Kriegs ist der Export iranischen Erdöls per Schiff wieder angelaufen. Mehrere iranische Öltanker verließen das bisher von der US-Marine block… [+1474 chars],,de,'Öl'
