index,url,valid,domain,title,description,image,published,archive,content,quote,language,keyword
https://www.zeit.de/news/2023-12/01/4000-busfahrer-in-bayern-gesucht,https://www.zeit.de/news/2023-12/01/4000-busfahrer-in-bayern-gesucht,0,www.zeit.de,Arbeitsmarkt: 4000 Busfahrer in Bayern gesucht,Hier finden Sie Informationen zu dem Thema „Arbeitsmarkt“. Lesen Sie jetzt „4000 Busfahrer in Bayern gesucht“.,https://img.zeit.de/news/2023-12/01/4000-busfahrer-in-bayern-gesucht-image-group/wide__1300x731,2023-12-01T08:00:06Z,,"Den bayerischen Busunternehmen fehlen nach Einschätzung ihres Verbands 4000 Fahrer. In den kommenden Jahren drohe eine erhebliche Verschärfung des Personalmangels, da sich viele Fahrer dem Rentenalte… [+664 chars]",,de,'Bayern'
https://www.zeit.de/news/2023-12/01/bolschoi-chef-verlaesst-theater-nach-kritik-an-putins-krieg,https://www.zeit.de/news/2023-12/01/bolschoi-chef-verlaesst-theater-nach-kritik-an-putins-krieg,0,www.zeit.de,Russischer Angriffskrieg: Bolschoi-Chef verlässt Theater nach Kritik an Putins Krieg,Hier finden Sie Informationen zu dem Thema „Russischer Angriffskrieg“. Lesen Sie jetzt „Bolschoi-Chef verlässt Theater nach Kritik an Putins Krieg“.,https://img.zeit.de/news/2023-12/01/bolschoi-chef-verlaesst-theater-nach-kritik-an-putins-krieg-image-group/wide__1300x731,2023-12-01T10:04:38Z,,"Der Chef des weltberühmten Moskauer Bolschoi Theaters, Wladimir Urin, hat nach Kritik am russischen Angriffskrieg gegen die Ukraine das Staatstheater verlassen. «Ich verabschiede mich heute, weil heu… [+2491 chars]",,de,'Krieg'
https://www.zeit.de/news/2023-12/01/alba-im-bayern-duell-nur-aussenseiter,https://www.zeit.de/news/2023-12/01/alba-im-bayern-duell-nur-aussenseiter,0,www.zeit.de,Basketball- Bundesliga: Alba im Bayern-Duell nur Außenseiter,Hier finden Sie Informationen zu dem Thema „Basketball- Bundesliga“. Lesen Sie jetzt „Alba im Bayern-Duell nur Außenseiter“.,https://img.zeit.de/news/2023-12/01/alba-im-bayern-duell-nur-aussenseiter-image-group/wide__1300x731,2023-12-01T10:20:00Z,,Für die Basketballer kommt das Bundesliga-Prestigeduell am Sonntag in der Max-Schmeling-Halle gegen den Dauerrivalen FC Bayern München (17.00 Uhr/Dyn) zu einem denkbar ungünstigen Zeitpunkt. «Es wird… [+2450 chars],,de,'Bayern'
https://www.zeit.de/news/2023-12/01/fc-bayern-bestreitet-testspiel-beim-fc-basel,https://www.zeit.de/news/2023-12/01/fc-bayern-bestreitet-testspiel-beim-fc-basel,0,www.zeit.de,Fußball: FC Bayern bestreitet Testspiel beim FC Basel,Hier finden Sie Informationen zu dem Thema „Fußball“. Lesen Sie jetzt „FC Bayern bestreitet Testspiel beim FC Basel“.,https://img.zeit.de/news/2023-12/01/fc-bayern-bestreitet-testspiel-beim-fc-basel-image-group/wide__1300x731,2023-12-01T10:46:48Z,,Der FC Bayern München wird in der kurzen Winterpause ein Testspiel in der Schweiz gegen den FC Basel bestreiten. Nach dem Verzicht auf ein Trainingslager zum Start ins neue Jahr wird Trainer Thomas T… [+760 chars],,de,'Bayern'
https://www.zeit.de/news/2023-12/01/tuchel-fordert-fuenf-bayern-siege-zum-jahresabschluss,https://www.zeit.de/news/2023-12/01/tuchel-fordert-fuenf-bayern-siege-zum-jahresabschluss,0,www.zeit.de,Fußball: Tuchel fordert fünf Bayern-Siege zum Jahresabschluss,Hier finden Sie Informationen zu dem Thema „Bundesliga“. Lesen Sie jetzt „Tuchel fordert fünf Bayern-Siege zum Jahresabschluss“.,https://img.zeit.de/news/2023-12/01/tuchel-fordert-fuenf-bayern-siege-zum-jahresabschluss-image-group/wide__1300x731,2023-12-01T12:29:28Z,,Nach der matten Nullnummer gegen den FC Kopenhagen hat Trainer Thomas Tuchel beim FC Bayern München vor dem Bundesliga-Heimspiel gegen den 1. FC Union Berlin einen Jahresabschluss mit ausschließlich … [+2219 chars],,de,'Bayern'
https://www.zeit.de/news/2023-12/01/bayern-profi-sarr-mit-kreuzbandriss-im-training,https://www.zeit.de/news/2023-12/01/bayern-profi-sarr-mit-kreuzbandriss-im-training,0,www.zeit.de,Bundesliga: Bayern-Profi Sarr mit Kreuzbandriss im Training,Hier finden Sie Informationen zu dem Thema „Bundesliga“. Lesen Sie jetzt „Bayern-Profi Sarr mit Kreuzbandriss im Training“.,https://img.zeit.de/news/2023-12/01/bayern-profi-sarr-mit-kreuzbandriss-im-training-image-group/wide__1300x731,2023-12-01T17:50:40Z,,Bouna Sarr vom FC Bayern München hat sich im Training einen Kreuzbandriss zugezogen und dürfte damit für den Rest der Saison ausfallen. Der Abwehrspieler wurde nach seinem Malheur am Freitag bereits … [+436 chars],,de,'Bayern'
https://www.welt.de/politik/ausland/article248842044/Russische-Armee-Putin-will-Zahl-der-Soldaten-auf-1-3-Millionen-erhoehen.html,https://www.welt.de/politik/ausland/article248842044/Russische-Armee-Putin-will-Zahl-der-Soldaten-auf-1-3-Millionen-erhoehen.html,0,www.welt.de,"Putin will Zahl der Soldaten auf 1,3 Millionen erhöhen","Wladimir Putin will die russische Armee erneut vergrößern. 170.000 Soldaten sollen zusätzlich rekrutiert werden. Freiwillige, wie das Verteidigungsministerium beteuert. Doch die Bevölkerung sorgt sich vor einer weiteren Mobilisierung.",https://img.welt.de/img/regionales/hessen/mobile248820658/8191350377-ci16x9-w1200/Putin.jpg,2023-12-01T20:30:00Z,https://web.archive.org/web/20231201225805/https://www.welt.de/politik/ausland/article248842044/Russische-Armee-Putin-will-Zahl-der-Soldaten-auf-1-3-Millionen-erhoehen.html,Mehr als anderthalb Jahre nach Beginn seines Angriffskriegs gegen die Ukraine hat Russlands Präsident Wladimir Putin eine erneute Vergrößerung seiner Armee angeordnet. Künftig soll die Zahl der bewaf… [+1638 chars],,de,'Putin'
https://www.zeit.de/news/2023-12/02/krieg-gegen-die-ukraine-so-ist-die-lage,https://www.zeit.de/news/2023-12/02/krieg-gegen-die-ukraine-so-ist-die-lage,0,www.zeit.de,Russische Invasion: Krieg gegen die Ukraine: So ist die Lage,Hier finden Sie Informationen zu dem Thema „Russische Invasion“. Lesen Sie jetzt „Krieg gegen die Ukraine: So ist die Lage“.,https://img.zeit.de/news/2023-12/02/krieg-gegen-die-ukraine-so-ist-die-lage-image-group/wide__1300x731,2023-12-02T04:23:33Z,https://web.archive.org/web/20231203055105/https://www.zeit.de/news/2023-12/02/krieg-gegen-die-ukraine-so-ist-die-lage,"Rund 21 Monate nach Beginn seines Angriffskriegs gegen die Ukraine hat Russlands Präsident Wladimir Putin eine erneute Vergrößerung seiner Armee angeordnet. 
Mehr Schlagzeilen
Künftig soll die Zahl… [+6457 chars]",,de,'Krieg'
https://www.zeit.de/mobilitaet/2023-12/bahn-bayern-wintereinbruch-schnee-zugausfaelle,https://www.zeit.de/mobilitaet/2023-12/bahn-bayern-wintereinbruch-schnee-zugausfaelle,0,www.zeit.de,Wintereinbruch: Schnee legt Bahnverkehr in Bayern lahm,"Im Großraum München fallen wegen Schnee und Eis zahlreiche Bahnverbindungen aus, Reisende mussten teilweise im Zug übernachten. Die Einschränkungen dürften andauern.",https://img.zeit.de/administratives/sharing/fallback-image/wide__1300x731,2023-12-02T06:29:38Z,https://web.archive.org/web/20231203103322/https://www.zeit.de/mobilitaet/2023-12/bahn-bayern-wintereinbruch-schnee-zugausfaelle,"Wegen des Wintereinbruchs ist der Bahnverkehr in Süddeutschland stark beeinträchtigt. Derzeit komme es zu Verspätungen und Zugausfällen, teilte eine Bahnsprecherin mit. Der Hauptbahnhof in München kö… [+1893 chars]",,de,'Bayern'
https://www.zeit.de/news/2023-12/02/schneechaos-bayern-spiel-gegen-union-abgesagt,https://www.zeit.de/news/2023-12/02/schneechaos-bayern-spiel-gegen-union-abgesagt,0,www.zeit.de,Fußball: Schneechaos: Bayern-Spiel gegen Union abgesagt,Hier finden Sie Informationen zu dem Thema „Fußball“. Lesen Sie jetzt „Schneechaos: Bayern-Spiel gegen Union abgesagt“.,https://img.zeit.de/news/2023-12/02/schneechaos-bayern-spiel-gegen-union-abgesagt-image-group/wide__1300x731,2023-12-02T09:10:49Z,,Das Bundesliga-Heimspiel des deutschen Fußball-Meisters FC Bayern München an diesem Samstag (15.30) gegen den 1. FC Union Berlin ist wegen der starken Schneefälle und der damit verbundenen Sicherheit… [+92 chars],,de,'Bayern'
https://www.tagesspiegel.de/sport/wegen-schneechaos-basketball-topspiel-zwischen-alba-und-munchen-abgesagt-10873405.html,https://www.tagesspiegel.de/sport/wegen-schneechaos-basketball-topspiel-zwischen-alba-und-munchen-abgesagt-10873405.html,0,www.tagesspiegel.de,Wegen Schneechaos: Basketball-Topspiel zwischen Alba und München abgesagt,Das Schneechaos in Bayern wirkt sich auch auf das Heimspiel in der Basketball-Bundesliga von Alba Berlin aus. Gegner FC Bayern kommt nicht aus München heraus – das Spiel musste abgesagt werden.,https://www.tagesspiegel.de/images/fc-bayern-munchen-alba-berlin3/alternates/BASE_16_9_W1400/fc-bayern-muenchen---alba-berlin.jpeg,2023-12-02T17:02:58Z,,Nach dem abgesagten Fußballspiel zwischen dem FC Bayern und Union Berlin ist auch die für Sonntag geplante Basketballpartie der Münchner gegen Alba Berlin abgesagt worden. Grund für die Verlegung ist… [+953 chars],,de,'Bayern'
https://www.n-tv.de/panorama/Heftige-Schneefaelle-legen-Bayern-lahm-article24574302.html,https://www.n-tv.de/panorama/Heftige-Schneefaelle-legen-Bayern-lahm-article24574302.html,0,www.n-tv.de,Lawinengefahr in den Alpen: Heftige Schneefälle legen Bayern lahm,"Das erste Schneechaos in diesem Winter hält den Süden Deutschlands fest im Griff. An Flughäfen geht nichts mehr, die Polizei meldet zahlreiche Glätte-Unfälle. In den bayerischen Alpen herrscht Lawinengefahr. ""Bleiben Sie möglichst zu Hause!"", lautet der eindr…",https://bilder3.n-tv.de/img/incoming/crop24574342/2511328506-cImg_16_9-w1200/437099431.jpg,2023-12-02T17:16:57Z,,"Das erste Schneechaos in diesem Winter hält den Süden Deutschlands fest im Griff. An Flughäfen geht nichts mehr, die Polizei meldet zahlreiche Glätte-Unfälle. In den bayerischen Alpen herrscht Lawine… [+5721 chars]",,de,'Winter'
https://www.tagesschau.de/inland/innenpolitik/bayern-winterchaos-stromausfaelle-100.html,https://www.tagesschau.de/inland/innenpolitik/bayern-winterchaos-stromausfaelle-100.html,0,www.tagesschau.de,Winterchaos in Bayern: Tausende Stromausfälle - Retter im Dauereinsatz,Starke Schneefälle haben weite Teile Bayerns lahmgelegt. Tausende Haushalte sind ohne Strom. Am Verkehrsknotenpunkt München müssen Passagiere bei Flügen und Bahnfahrten länger mit Beeinträchtigungen und Ausfällen rechnen.,https://images.tagesschau.de/image/01462db7-1be4-4bf5-a0a7-41e635d74a14/AAABjCs2me8/AAABibBxqrQ/16x9-1280/schnee-528.jpg,2023-12-02T17:28:40Z,https://web.archive.org/web/20231203051554/https://www.tagesschau.de/inland/innenpolitik/bayern-winterchaos-stromausfaelle-100.html,"Stand: 02.12.2023 18:28 Uhr
Starke Schneefälle haben weite Teile Bayerns lahmgelegt. Tausende Haushalte sind ohne Strom. Am Verkehrsknotenpunkt München müssen Passagiere bei Flügen und Bahnfahrten l… [+5595 chars]",,de,'Bayern'
https://www.bild.de/regional/muenchen/muenchen-aktuell/winterchaos-in-muenchen-dieser-cessna-geht-der-ar-auf-grundeis-86303424.bild.html,https://www.bild.de/regional/muenchen/muenchen-aktuell/winterchaos-in-muenchen-dieser-cessna-geht-der-ar-auf-grundeis-86303424.bild.html,0,www.bild.de,Winterchaos in München - Dieser Cessna geht der Ar... auf Grundeis!,Dieser hochnäsige Flieger (Typ Cessna Citation X) hat auf dem Münchner Flughafen offenbar ein wenig zu viel Schnee geschnupft.,"https://images.bild.de/656b692d834e2f74ccd20302/174a1a04b25229a7d89bcc5f59cd88a5,84ae7f64?w=1280",2023-12-02T18:08:59Z,https://web.archive.org/web/20231203041255/https://www.bild.de/regional/muenchen/muenchen-aktuell/winterchaos-in-muenchen-dieser-cessna-geht-der-ar-auf-grundeis-86303424.bild.html,"München Wer wird denn bei so ein paar Flocken gleich in die Luft gehen?
Dieser hochnäsige Flieger (Typ Cessna Citation X) hat auf dem Münchner Flughafen offenbar ein wenig zu viel Schnee geschnupft … [+1075 chars]",,de,'Winter'
https://www.diepresse.com/17883377/120-staaten-fuer-verdreifachung-von-energie-aus-erneuerbaren,https://www.diepresse.com/17883377/120-staaten-fuer-verdreifachung-von-energie-aus-erneuerbaren,0,www.diepresse.com,120 Staaten für Verdreifachung von Energie aus Erneuerbaren,"Ziel ist auch, die Energieeffizienz zu verdoppeln. Strittig ist hingegen, ob sich die Staaten im Rahmen der Weltklimakonferenz auf einen weltweiten Ausstieg aus Kohle, Öl und Gas einigen können.",https://img.diepresse.com/public/incoming/srf1zl-UAE-UN-CLIMATE-COP28/alternates/DPR_SOCIAL_NACHRICHTEN/UAE-UN-CLIMATE-COP28,2023-12-02T18:57:47Z,,"Ziel ist auch, die Energieeffizienz zu verdoppeln. Strittig ist hingegen, ob sich die Staaten im Rahmen der Weltklimakonferenz auf einen weltweiten Ausstieg aus Kohle, Öl und Gas einigen können. 
Au… [+2258 chars]",,de,'Gas'
https://www.nzz.ch/panorama/schneechaos-in-sueddeutschland-muenchner-flughafen-streicht-alle-fluege-bis-sonntagfrueh-behinderungen-auf-strasse-und-schiene-bundesliga-spiel-faellt-aus-ld.1768685,https://www.nzz.ch/panorama/schneechaos-in-sueddeutschland-muenchner-flughafen-streicht-alle-fluege-bis-sonntagfrueh-behinderungen-auf-strasse-und-schiene-bundesliga-spiel-faellt-aus-ld.1768685,0,www.nzz.ch,"Schneechaos in Süddeutschland: Betrieb am Münchner Flughafen eingestellt, Behinderungen auf Strasse und Schiene sowie Stromausfälle",Heftiger Schneefall schränkt in Teilen Süddeutschlands den Auto- und Zugverkehr ein. Am Münchner Flughafen ruht der Betrieb bis Sonntag. Das Fussballspiel zwischen dem FC Bayern und Union Berlin wurde abgesagt.,"https://img.nzz.ch/2023/12/02/9433d431-bc8c-47db-9998-463b0f03d902.jpeg?width=1200&height=674&fit=bound&quality=75&auto=webp&crop=5206,2925,x0,y272&wmark=nzz",2023-12-02T21:25:46Z,,"Eine Frau spaziert mit ihrem Kinderwagen durch eine verschneite Strasse in München. 
Wegen andauernden Schneefalls ist der Schienen-, Strassen- und Flugverkehr in weiten Teilen Süddeutschlands am Sa… [+4134 chars]",,de,'Bayern'
https://www.stern.de/politik/markus-soeder-will-buergergeld-generalueberholen-und-greift-ampel-an-34253038.html,https://www.stern.de/politik/markus-soeder-will-buergergeld-generalueberholen-und-greift-ampel-an-34253038.html,0,www.stern.de,Spardebatte: Angriff auf die Ampel: Söder will Bürgergeld generalüberholen und fordert Stopp der Erhöhung,"Kippen die Bürgergeld-Pläne der Ampel? Im stern fordert Bayerns Ministerpräsident Markus Söder eine Verschiebung der Erhöhung – und kündigt eine Bundesratsinitiative an, um die Sozialleistung grundsätzlich neu aufzustellen.",https://image.stern.de/34253058/t/cc/v2/w1440/r1.7778/-/soeder.jpg,2023-12-02T23:01:00Z,,"Kippen die Bürgergeld-Pläne der Ampel? Im stern fordert Bayerns Ministerpräsident Markus Söder eine Verschiebung der Erhöhung und kündigt eine Bundesratsinitiative an, um die Sozialleistung grundsätz… [+2263 chars]",,de,'Bayern'
https://www.n-tv.de/politik/Soeder-will-Buergergeld-im-Bundesrat-neu-justieren-article24574524.html,https://www.n-tv.de/politik/Soeder-will-Buergergeld-im-Bundesrat-neu-justieren-article24574524.html,0,www.n-tv.de,"""Balance stimmt nicht"": Söder will Bürgergeld im Bundesrat neu justieren","Nach dem Urteil aus Karlsruhe stellt die Union das Bürgergeld auf den Prüfstand. Bayerns Ministerpräsident kündigt eine Bundesratsinitiative an und verlangt, dass die Erhöhung der Regelsätze vertagt wird. Auch für das Grundrecht auf Asyl sieht Söder Reformbed…",https://bilder2.n-tv.de/img/incoming/crop24574529/3791327161-cImg_16_9-w1200/imago0367162814h.jpg,2023-12-02T23:04:53Z,,"Nach dem Urteil aus Karlsruhe stellt die Union das Bürgergeld auf den Prüfstand. Bayerns Ministerpräsident kündigt eine Bundesratsinitiative an und verlangt, dass die Erhöhung der Regelsätze vertagt … [+1953 chars]",,de,'Bayern'
https://www.zeit.de/news/2023-12/03/flughafen-muenchen-hat-flugbetrieb-wieder-aufgenommen,https://www.zeit.de/news/2023-12/03/flughafen-muenchen-hat-flugbetrieb-wieder-aufgenommen,0,www.zeit.de,Wetter: Flughafen München hat Flugbetrieb wieder aufgenommen,Hier finden Sie Informationen zu dem Thema „Bayern“. Lesen Sie jetzt „Flughafen München hat Flugbetrieb wieder aufgenommen“.,https://img.zeit.de/news/2023-12/03/flughafen-muenchen-hat-flugbetrieb-wieder-aufgenommen-image-group/wide__1300x731,2023-12-03T05:44:10Z,,Der Flughafen München hat um 06.00 Uhr seinen Flugbetrieb wieder aufgenommen. Das teilte das Unternehmen am Morgen auf seiner Website mit. Es werde aber weiterhin Einschränkungen im Luftverkehr geben… [+849 chars],,de,'Bayern'
https://www.zeit.de/news/2023-12/03/fc-bayern-schaut-bei-winter-transfers-auf-defensivbereich,https://www.zeit.de/news/2023-12/03/fc-bayern-schaut-bei-winter-transfers-auf-defensivbereich,0,www.zeit.de,Bundesliga: FC Bayern schaut bei Winter-Transfers auf Defensivbereich,Hier finden Sie Informationen zu dem Thema „Bundesliga“. Lesen Sie jetzt „FC Bayern schaut bei Winter-Transfers auf Defensivbereich“.,https://img.zeit.de/news/2023-12/03/fc-bayern-schaut-bei-winter-transfers-auf-defensivbereich-image-group/wide__1300x731,2023-12-03T10:41:02Z,,Vereinspräsident Herbert Hainer hat sich mit Blick auf die bevorstehende Wintertransfer-Periode zurückhaltend zu möglichen Aktivitäten des FC Bayern München geäußert. Trainer Thomas Tuchel sieht vor … [+2158 chars],,de,'Bayern'
https://www.zeit.de/wissen/umwelt/2023-12/un-klimakonferenz-widerstand-gegen-ausstieg-fossile,https://www.zeit.de/wissen/umwelt/2023-12/un-klimakonferenz-widerstand-gegen-ausstieg-fossile,0,www.zeit.de,Klimakonferenz: Gipfelpräsident hält Ausstieg aus fossiler Energie für unnötig,Sultan Ahmed al-Dschaber zweifelt offenbar am wissenschaftlichen Konsens zum Aus fossiler Energieträger. Auch mehrere Öl- und Gasstaaten wollen einen Ausstieg verhindern.,https://img.zeit.de/wissen/umwelt/2023-12/un-klimakonferenz-widerstand/wide__1300x731,2023-12-03T14:28:00Z,,"Der Präsident der Weltklimakonferenz in Dubai, Sultan Ahmed al-Dschaber, hat den wissenschaftlichen Konsens angezweifelt, wonach ein Ausstieg aus den fossilen Energien zum Erreichen des international… [+2652 chars]",,de,'Fossile Energie'
