index,url,valid,domain,title,description,image,published,archive,content,quote,language,keyword
https://www.diepresse.com/19342857/elfmeter-alien-kane-und-seine-magische-serie-vom-punkt,https://www.diepresse.com/19342857/elfmeter-alien-kane-und-seine-magische-serie-vom-punkt,0,www.diepresse.com,Elfmeter-„Alien“ Kane und seine magische Serie vom Punkt,29 Elfmetertore in Folge? Für England-Star Harry Kane eine ganz normale Angelegenheit auch beim 3:0-Sieg der Bayern gegen Werder Bremen.,https://img.diepresse.com/public/incoming/rogksj-SOCCER-GERMANY-FCB-SVWREPORT/alternates/DPR_SOCIAL_NACHRICHTEN/SOCCER-GERMANY-FCB-SVWREPORT,2025-02-08T11:33:47Z,,"29 Elfmetertore in Folge? Für England-Star Harry Kane eine ganz normale Angelegenheit auch beim 3:0-Sieg der Bayern gegen Werder Bremen.
Ein Alien? Nein, da winkte Fußball-Stürmerstar Harry Kane lac… [+2336 chars]",,de,'Bayern'
https://www.focus.de/sport/fussball/internationale-praesenz-staerken-hoeness-neffe-uebernimmt-neue-schluesselrolle-beim-fc-bayern_261d19ef-994b-486d-8092-bb97511fcad6.html,https://www.focus.de/sport/fussball/internationale-praesenz-staerken-hoeness-neffe-uebernimmt-neue-schluesselrolle-beim-fc-bayern_261d19ef-994b-486d-8092-bb97511fcad6.html,0,www.focus.de,„Internationale Präsenz stärken“ - Hoeneß-Neffe übernimmt neue Schlüsselrolle beim FC Bayern,Der FC Bayern setzt auf Wachstum im Ausland und betraut Benjamin Hoeneß mit einer wichtigen Aufgabe. Der Neffe von Uli Hoeneß soll die internationalen Aktivitäten des Vereins auf das nächste Level heben.,https://quadro.burda-forward.de/ctf/1d80e2e6-59e7-4cd3-ace9-093376e93649.5d8f1745-3793-4366-8dee-6179787ed08e.png?im=RegionOfInterestCrop%3D%281200%2C630%29%2CregionOfInterest%3D%28728%2C293%29&hash=ed2b93e24ce5d85b5ccaa8b61e257b8af4515935f2873523042f488343f94dc9,2025-02-08T11:43:00Z,https://web.archive.org/web/20250209030144/https://www.focus.de/sport/fussball/internationale-praesenz-staerken-hoeness-neffe-uebernimmt-neue-schluesselrolle-beim-fc-bayern_261d19ef-994b-486d-8092-bb97511fcad6.html,"Benjamin Hoeneß, Neffe des Ehrenpräsidenten Uli Hoeneß, übernimmt eine zentrale Schlüsselposition beim FC Bayern München. 
Ab sofort wird der 45-Jährige zusammen mit Peter Romics als Geschäftsführer… [+1955 chars]",,de,'Bayern'
https://www.stern.de/gesellschaft/regional/niedersachsen-bremen/fussball-bundesliga--bremens-interimscoach-kohlmann--spass-trotz-niederlage-35450516.html,https://www.stern.de/gesellschaft/regional/niedersachsen-bremen/fussball-bundesliga--bremens-interimscoach-kohlmann--spass-trotz-niederlage-35450516.html,0,www.stern.de,Fußball-Bundesliga: Bremens Interimscoach Kohlmann: Spaß trotz Niederlage,"Da Werder-Trainer Ole Werner gesperrt ist, steht Patrick Kohlmann gegen Bayern in der Verantwortung. Der 41-Jährige freut sich über die baldige Rückkehr des Chefs.",https://image.stern.de/35450518/t/cX/v1/w1440/r1.7778/-/08--umrhapkj77v3axs2048jpeg---f85017f038a8876d.jpg,2025-02-08T11:48:18Z,,"Kopiere den aktuellen Link
Da Werder-Trainer Ole Werner gesperrt ist, steht Patrick Kohlmann gegen Bayern in der Verantwortung. Der 41-Jährige freut sich über die baldige Rückkehr des Chefs.
Mit ge… [+2015 chars]",,de,'Bayern'
https://www.stern.de/gesellschaft/regional/bayern/kriminalitaet--polizisten-bei-auseinandersetzungen-in-bayern-verletzt-35450372.html,https://www.stern.de/gesellschaft/regional/bayern/kriminalitaet--polizisten-bei-auseinandersetzungen-in-bayern-verletzt-35450372.html,0,www.stern.de,Kriminalität: Polizisten bei Auseinandersetzungen in Bayern verletzt,"In Deggendorf geraten zwei Männer in Streit. Und in Lindau wird eine Frau in einer Therme aggressiv. Polizeibeamte kommen, um die Situationen zu klären, und werden verletzt.",https://image.stern.de/35450568/t/d9/v1/w1440/r1.7778/-/08--6f3gceieqhv4axs2048jpeg---905913fae26c94a3.jpg,2025-02-08T12:13:32Z,,"Kopiere den aktuellen Link
In Deggendorf geraten zwei Männer in Streit. Und in Lindau wird eine Frau in einer Therme aggressiv. Polizeibeamte kommen, um die Situationen zu klären, und werden verletz… [+1432 chars]",,de,'Bayern'
https://www.sueddeutsche.de/sport/bayern-bremen-kane-celtic-li.3198586,https://www.sueddeutsche.de/sport/bayern-bremen-kane-celtic-li.3198586,0,www.sueddeutsche.de,"FC Bayern München: Bereit, diesmal wirklich. Oder?","Der FC Bayern gewinnt vor den wichtigen Februar-Spielen beim 3:0 gegen Bremen noch mal an Selbstvertrauen. Spieler und Trainer zeigen sich sehr zufrieden, doch vor dem Auswärtsspiel bei Celtic scheinen auch bekannte Probleme durch.",https://www.sueddeutsche.de/2025/02/08/bab1a6e5-f931-4aa0-a2d0-7b0682b33df7.jpeg?q=60&fm=webp&width=1200&rect=0%2C183%2C3500%2C1969,2025-02-08T12:36:37Z,http://archive.md/20250208131518/https://www.sueddeutsche.de/sport/bayern-bremen-kane-celtic-li.3198586,"Der FC Bayern gewinnt vor den wichtigen Februar-Spielen beim 3:0 gegen Bremen noch mal an Selbstvertrauen. Spieler und Trainer zeigen sich sehr zufrieden, doch vor dem Auswärtsspiel bei Celtic schein… [+517 chars]",,de,'Bayern'
https://www.zeit.de/news/2025-02/09/trump-will-mit-putin-telefoniert-haben-zeitpunkt-unklar,https://www.zeit.de/news/2025-02/09/trump-will-mit-putin-telefoniert-haben-zeitpunkt-unklar,0,www.zeit.de,Russland und USA: Trump will mit Putin telefoniert haben - Zeitpunkt unklar,Hier finden Sie Informationen zu dem Thema „Russland und USA“. Lesen Sie jetzt „Trump will mit Putin telefoniert haben - Zeitpunkt unklar“.,https://img.zeit.de/news/2025-02/09/trump-will-mit-putin-telefoniert-haben-zeitpunkt-unklar-image-group/wide__1300x731,2025-02-09T05:30:56Z,,US-Präsident Donald Trump hat in einem Interview von einem angeblichen Gespräch mit Kremlchef Wladimir Putin über den Ukraine-Krieg berichtet. Allerdings ließ er nach Angaben der «New York Post» offe… [+2727 chars],,de,'Putin'
https://www.diepresse.com/19346989/war-es-das-mit-dem-winter,https://www.diepresse.com/19346989/war-es-das-mit-dem-winter,0,www.diepresse.com,War es das mit dem Winter?,Die Temperaturen liegen derzeit leicht über dem Durchschnitt. Ein Kälteeinbruch ist in den kommenden Tagen nicht in Sicht. Verabschiedet sich der Winter so langsam?,https://img.diepresse.com/public/incoming/kcrdn5-Winter/alternates/DPR_SOCIAL_NACHRICHTEN/Winter,2025-02-10T09:08:52Z,,"Die Temperaturen liegen derzeit leicht über dem Durchschnitt. Ein Kälteeinbruch ist in den kommenden Tagen nicht in Sicht. Verabschiedet sich der Winter so langsam?
Zwar gibt es derzeit innerhalb Ös… [+4947 chars]",,de,'Kälte'
https://www.faz.net/aktuell/politik/ukraine/trump-und-ukraine-krieg-putins-gift-und-kelloggs-beitrag-110285574.html,https://www.faz.net/aktuell/politik/ukraine/trump-und-ukraine-krieg-putins-gift-und-kelloggs-beitrag-110285574.html,0,www.faz.net,Vorverhandlungen mit Russland: Putins Gift und Kelloggs Beitrag,"Trump sagt einer Boulevardzeitung, er habe mit dem russischen Präsidenten telefoniert. Sein  Sondergesandter plädiert für Wahlen in der Ukraine. Das ist ganz nach Moskaus Geschmack.",https://media1.faz.net/ppmedia/aktuell/2768739077/1.10285573/facebook_teaser_fplus/cb7f17d4-e6d2-11ef-94b8.jpg,2025-02-10T09:39:53Z,http://archive.md/20250210100024/https://www.faz.net/aktuell/politik/ukraine/trump-und-ukraine-krieg-putins-gift-und-kelloggs-beitrag-110285574.html,"Noch ist unklar, ob sich Donald Trump und Wladimir Putin treffen werden. Der amerikanische Präsident sagte einer New Yorker Boulevardzeitung, er habe mit dem russischen Präsidenten, mit dem er immer … [+371 chars]",,de,'Putin'
https://www.fitforfun.de/news/die-besten-laufmuetzen-im-test-741270.html,https://www.fitforfun.de/news/die-besten-laufmuetzen-im-test-741270.html,0,www.fitforfun.de,Warm durch den Winter: Die besten Laufmützen im Test,"Auch bei kaltem Wetter nicht frieren: Ein Test von „Runner‘s World“ zeigt die besten Laufmützen für warme Ohren und optimalen Tragekomfort. Hier erfährst du, worauf du beim Kauf achten solltest.","https://www.fitforfun.de/files/images/202502/1/laufmuetze-on-merino-beanie,741271_3x2_n.jpg",2025-02-10T09:54:00Z,,"Laufen bei kühlem Wetter kann schnell zu kalten Ohren führen. Dagegen gibt es eine einfache Lösung: Laufmützen. Diese speziellen Mützen sind leicht, atmungsaktiv und klein verpackbar. Sie sind ideal … [+172 chars]",,de,'Winter'
https://www.welt.de/politik/ausland/plus255304432/Nukleare-Bedrohung-So-nah-war-Putin-einem-Einsatz-von-Atomwaffen-wirklich.html,https://www.welt.de/politik/ausland/plus255304432/Nukleare-Bedrohung-So-nah-war-Putin-einem-Einsatz-von-Atomwaffen-wirklich.html,0,www.welt.de,So nah war Putin einem Einsatz von Atomwaffen wirklich,"Die Gefahr eines russischen Atomwaffeneinsatzes war Ende 2022 offenbar so groß wie seit Jahrzehnten nicht, schreibt Enthüllungsjournalist Bob Woodward und gibt Einblick in dramatische Gespräche. Heute sitzt ein neuer US-Präsident im Weißen Haus. Experten erkl…",https://img.welt.de/img/politik/ausland/mobile255328158/8327931347-ci16x9-w1200-fnov-fpotl-fpi157750653/FILE-PHOTO-General-rehearsal-of-the-Victory-Parade-on-the-Moscow-Red-Square.jpg,2025-02-10T10:27:56Z,http://archive.md/20250210103313/https://www.welt.de/politik/ausland/plus255304432/Nukleare-Bedrohung-So-nah-war-Putin-einem-Einsatz-von-Atomwaffen-wirklich.html,"Die Gefahr eines russischen Atomwaffeneinsatzes war Ende 2022 offenbar so groß wie seit Jahrzehnten nicht, schreibt Enthüllungsjournalist Bob Woodward und gibt Einblick in dramatische Gespräche. Heut… [+96 chars]",,de,'Putin'
https://www.focus.de/wissen/natur/meteorologie/glaettegefahr-in-deutschland-winter-dreht-nochmal-auf-wetterphaenomen-bringt-uns-den-schnee-zurueck_id_260708842.html,https://www.focus.de/wissen/natur/meteorologie/glaettegefahr-in-deutschland-winter-dreht-nochmal-auf-wetterphaenomen-bringt-uns-den-schnee-zurueck_id_260708842.html,0,www.focus.de,Glättegefahr in Deutschland - Winter dreht nochmal auf: „Kaltlufttropfen“ bringt uns den Schnee zurück,"Der Winter kehrt diese Woche zurück nach Deutschland. In den kommenden Tagen erwartet uns markanter Schneefall, verursacht durch einen sogenannten Kaltlufttropfen.Von FOCUS-online-Experte Jan Schenk",https://p6.focus.de/img/fotos/id_260708814/schnee-feb3.png?im=Crop%3D%280%2C60%2C1920%2C960%29%3BResize%3D%281200%2C627%29&impolicy=perceptual&quality=mediumHigh&hash=2a96e5282acbca834cc9f5288be98cd553f6659e84e257dd30f66501f46714a1,2025-02-10T10:53:21Z,,"Der Winter kehrt diese Woche zurück nach Deutschland. In den kommenden Tagen erwartet uns markanter Schneefall, verursacht durch einen sogenannten Kaltlufttropfen.
Bereits am Montag breitet sich Nie… [+1655 chars]",,de,'Winter'
https://www.focus.de/gesundheit/ernaehrung/winter-gemuese-einfacher-trick-macht-rosenkohl-besonders-lecker_id_260066328.html,https://www.focus.de/gesundheit/ernaehrung/winter-gemuese-einfacher-trick-macht-rosenkohl-besonders-lecker_id_260066328.html,0,www.focus.de,Beliebtes Winter-Gemüse - Einfacher Trick macht Rosenkohl besonders lecker,"Knackig, aromatisch und voller Nährstoffe – Rosenkohl ist ein echtes Wintergemüse mit viel Potenzial. Erfahren Sie hier, wie Sie ihn perfekt zubereiten und was ihn besonders lecker macht.",https://p6.focus.de/img/gesundheit/ernaehrung/geniessen/id_181393032/wer-rosenkohl-als-kind-nicht-mochte-sollte-ihn-mal-als-smashed-rosenkohl-probieren.-dazu-wird-er-blanchiert-mariniert-auf-einem-backblech-flach-gedrueckt-und-mit-kaese-ueberbacken..jpg?im=Crop%3D%280%2C170%2C2048%2C1024%29%3BResize%3D%281200%2C627%29&impolicy=perceptual&quality=mediumHigh&hash=5e52bb848074340f072624a4e24576f14f082cbcffd8b9ee9ad5782eb8df26fb,2025-02-10T10:54:57Z,https://web.archive.org/web/20250210140410/https://www.focus.de/gesundheit/ernaehrung/winter-gemuese-einfacher-trick-macht-rosenkohl-besonders-lecker_id_260066328.html,"Knackig, aromatisch und voller Nährstoffe Rosenkohl ist ein echtes Wintergemüse mit viel Potenzial. Erfahren Sie hier, wie Sie ihn perfekt zubereiten und was ihn besonders lecker macht. Wenn es drauß… [+1830 chars]",,de,'Winter'
https://www.tagesspiegel.de/wirtschaft/berechnungen-von-verivox-gaspreise-fur-neukunden-in-vergangenen-zwolf-monaten-stark-gestiegen-13174465.html,https://www.tagesspiegel.de/wirtschaft/berechnungen-von-verivox-gaspreise-fur-neukunden-in-vergangenen-zwolf-monaten-stark-gestiegen-13174465.html,0,www.tagesspiegel.de,Berechnungen von Verivox: Gaspreise für Neukunden in vergangenen zwölf Monaten stark gestiegen,Private Neukunden mit Gasheizung wurden in den vergangenen zwölf Monaten besonders kräftig zur Kasse gebeten. Verivox nennt mehrere Gründe dafür.,https://www.tagesspiegel.de/images/11735072/alternates/BASE_16_9_W1400/1716988610000/dusseldorf-07-01-2024-heizkosten-heizung-heizungskosten-miete-mietkosten-mietnebenkosten-nebenkosten-heizen-thermostat-w.jpeg,2025-02-10T11:40:05Z,https://web.archive.org/web/20250210133132/https://www.tagesspiegel.de/wirtschaft/berechnungen-von-verivox-gaspreise-fur-neukunden-in-vergangenen-zwolf-monaten-stark-gestiegen-13174465.html,Die Gaspreise für private Neukunden in Deutschland sind laut einer Berechnung des Vergleichsportals Verivox in den vergangenen zwölf Monaten stark gestiegen. Ein Haushalt mit einem Jahresverbrauch vo… [+2742 chars],,de,'Winter'
https://www.stern.de/panorama/wetteraussichten--winterwetter-zeigt-sich-oft-ungemuetlich-35454182.html,https://www.stern.de/panorama/wetteraussichten--winterwetter-zeigt-sich-oft-ungemuetlich-35454182.html,0,www.stern.de,Wetteraussichten: Winterwetter zeigt sich oft ungemütlich,"Offenbach - Regen, Kälte und mitunter Schnee: Der Winter zeigt sich ein wenig ungemütlich in den kommenden Tagen. «Am morgigen Dienstag setzt sich",https://image.stern.de/35454184/t/gD/v1/w1440/r1.7778/-/10--ru7hofkppev4axs2048jpeg---4a49c5b0a0966382.jpg,2025-02-10T12:19:02Z,,"Kopiere den aktuellen Link
Es wird vor allem nass und kalt in Deutschland. Nur in einigen Regionen dürfen sich Menschen über Schnee freuen.
Regen, Kälte und mitunter Schnee: Der Winter zeigt sich e… [+1470 chars]",,de,'Winter'
https://www.tagesspiegel.de/gesellschaft/panorama/wetteraussichten-winterwetter-zeigt-sich-oft-ungemutlich-13175962.html,https://www.tagesspiegel.de/gesellschaft/panorama/wetteraussichten-winterwetter-zeigt-sich-oft-ungemutlich-13175962.html,0,www.tagesspiegel.de,Wetteraussichten: Winterwetter zeigt sich oft ungemütlich,Es wird vor allem nass und kalt in Deutschland. Nur in einigen Regionen dürfen sich Menschen über Schnee freuen.,https://www.tagesspiegel.de/images/13175959/alternates/BASE_16_9_W1400/1739190003000/winter-in-niedersachsen.jpeg,2025-02-10T12:20:03Z,,"Regen, Kälte und mitunter Schnee: Der Winter zeigt sich ein wenig ungemütlich in den kommenden Tagen. Am morgigen Dienstag setzt sich abgesehen vom Nordosten nasskaltes Wetter durch, sagte die Meteor… [+2087 chars]",,de,'Winter'
https://netzpolitik.org/2025/algospeak-was-winterschuhe-mit-politik-zu-tun-haben/,https://netzpolitik.org/2025/algospeak-was-winterschuhe-mit-politik-zu-tun-haben/,0,netzpolitik.org,Algospeak: Was Winterschuhe mit Politik zu tun haben,"Schuhe im Schnee oder Chiffre? – Alle Rechte vorbehalten IMAGO / Panthermedia
Politische Inhalte werden teilweise von Social-Media-Plattformen blockiert oder versteckt. Um den algorithmischen Filtern zu entwischen, entwickeln die Nutzer:innen eine eigene Spr…",https://cdn.netzpolitik.org/wp-upload/2025/02/imago303665616-1200x675.jpg,2025-02-10T12:34:02Z,,Politische Inhalte auf Social-Media-Plattformen wie Instagram und TikTok haben teilweise eine geringere Reichweite als andere Postings. Das kann unterschiedliche Gründe haben: Meta etwa bremst entspr… [+4848 chars],,de,'Kälte'
https://www.kicker.de/als-debuetant-gleich-spieler-des-tages-richter-heizt-torwart-karussell-an-1089496/artikel,https://www.kicker.de/als-debuetant-gleich-spieler-des-tages-richter-heizt-torwart-karussell-an-1089496/artikel,0,www.kicker.de,"Als Debütant gleich ""Spieler des Tages"": Richter heizt Torwart-Karussell an","Die Entscheidung, Winter-Neuzugang David Richter ins Tor zu stellen, erweist sich als goldrichtig. Der 25-jährige Keeper meistert ""vier Unhaltbare"" und ist als Debütant gleich ""Spieler des Tages"".",https://derivates.kicker.de/image/upload/c_crop%2Cx_27%2Cy_253%2Cw_2748%2Ch_1546/w_1200%2Cq_auto/v1/2025/02/10/605afac3-a8c4-4317-a595-2c0013f12c2e.jpeg,2025-02-10T13:20:39Z,,"Die Entscheidung, Winter-Neuzugang David Richter ins Tor zu stellen, erweist sich als goldrichtig. Der 25-jährige Keeper meistert ""vier Unhaltbare"" und ist als Debütant gleich ""Spieler des Tages"". 
… [+2214 chars]",,de,'Winter'
https://wien.orf.at/stories/3292674/,https://wien.orf.at/stories/3292674/,0,wien.orf.at,Neue ÖBB-Züge auf Klimaresistenz geprüft,"Wie viel Kälte und Wind die neuen ÖBB-Cityjet-Doppelstockzüge aushalten können, wird aktuell in Floridsdorf getestet. Dort stehen sie derzeit im Klima-Wind-Kanal auf dem Prüfstand. Wenn die Züge die Tests bestehen, sollen sie ab Herbst 2026 zum Einsatz kommen.",https://ibs.orf.at/wie?image=https%3A%2F%2Foekastatic.orf.at%2Fmims%2F2025%2F07%2F23%2Fcrops%2Fw%3D1200%2Ch%3D627%2Cq%3D75%2F2516573_master_963923_downloadmedium.jpg%3Fs%3Df12f1e9828eeb90a9bebfd155d61f776e64e8544,2025-02-10T13:32:28Z,,41 von insgesamt 109 neuen Cityjet Doppelstockzügen will die ÖBB in der Ostregion ab 2026 in den Betrieb schicken. Die Tests der Züge im Klima-Wind-Kanal wurden am Montag in Anwesenheit von Öffi-Stad… [+1745 chars],,de,'Kälte'
https://www.bild.de/sport/fussball/bayer-leverkusen-hermoso-liefert-alonso-hat-eine-maschine-gegen-bayern-67a9fa004664d31e71dfc5e1,https://www.bild.de/sport/fussball/bayer-leverkusen-hermoso-liefert-alonso-hat-eine-maschine-gegen-bayern-67a9fa004664d31e71dfc5e1,0,www.bild.de,Neuling begeistert beim Meister - Alonso hat eine „Maschine“ gegen Bayern,Dieser Transfer geht bisher voll auf. Jetzt soll Mario Hermoso auch die Bayern stoppen.,"https://images.bild.de/67a9fa004664d31e71dfc5e1/bb4ee5c9693a98841ced782280cba64e,b4e6cd36?w=1280",2025-02-10T13:51:43Z,,"Dieser Transfer geht bisher voll auf.
Januar-Zugang Mario Hermoso (29/per Leihe von der AS Rom gekommen) ist seit elf Tagen bei der Werkself und schon jetzt der Winter-Gewinner.
Der Innenverteidige… [+1840 chars]",,de,'Winter'
https://www.kicker.de/tipps-fuers-laufen-im-winter-und-warum-die-nasenatmung-so-wichtig-ist-1089554/artikel,https://www.kicker.de/tipps-fuers-laufen-im-winter-und-warum-die-nasenatmung-so-wichtig-ist-1089554/artikel,0,www.kicker.de,Tipps fürs Laufen im Winter und warum die Nasenatmung so wichtig ist,Die Luft: klar. Die Sonne: da. Klingt nach perfekten Bedingungen für einen Winterlauf. Doch niedrige Temperaturen sind eine Belastung für den Körper. Wie sich Lauf-Fans gut einpacken und aufwärmen.,https://derivates.kicker.de/image/upload/c_crop%2Cx_1199%2Cy_459%2Cw_2801%2Ch_1575/w_1200%2Cq_auto/v1/2025/02/10/7cb1d651-0a83-4b6f-9840-061f838599ac.jpeg,2025-02-10T14:50:07Z,https://web.archive.org/web/20250211074042/https://www.kicker.de/tipps-fuers-laufen-im-winter-und-warum-die-nasenatmung-so-wichtig-ist-1089554/artikel,Die Luft: klar. Die Sonne: da. Klingt nach perfekten Bedingungen für einen Winterlauf. Doch niedrige Temperaturen sind eine Belastung für den Körper. Wie sich Lauf-Fans gut einpacken und aufwärmen. ,,,
https://www.bild.de/sport/fussball/fc-bayern-nach-reha-programm-kompany-star-faehrt-in-den-beauty-salon-67aa19214bc0cf459b8da980,https://www.bild.de/sport/fussball/fc-bayern-nach-reha-programm-kompany-star-faehrt-in-den-beauty-salon-67aa19214bc0cf459b8da980,0,www.bild.de,"Erst die Arbeit, dann das Vergnügen - Bayern-Star fährt nach Reha in den Beauty-Salon!","Erst die Arbeit, dann das Vergnügen: BILD entdeckte einen Bayern-Star am Montag nach dem Reha-Programm auf dem Weg zum Beauty-Salon.","https://images.bild.de/67aa19214bc0cf459b8da980/2c5f75dadc86dcfff7acb8716cebe806,91f0df0e?w=1280",2025-02-10T16:49:43Z,https://web.archive.org/web/20250210225608/https://www.bild.de/sport/fussball/fc-bayern-nach-reha-programm-kompany-star-faehrt-in-den-beauty-salon-67aa19214bc0cf459b8da980,"Erst die Arbeit, dann das Vergnügen!
Bayern-Torwart Daniel Peretz (24) arbeitet seit Anfang Januar am Comeback von einer Nierenquetschung. Nachdem er vergangenen Freitag erstmals wieder auf dem Plat… [+1764 chars]",,de,'Bayern'
https://www.tagesspiegel.de/gesellschaft/panorama/todlicher-bergunfall-in-bayern-schneeschuhwanderer-verungluckt-bei-sturz-in-berchtesgadener-alpen-13178623.html,https://www.tagesspiegel.de/gesellschaft/panorama/todlicher-bergunfall-in-bayern-schneeschuhwanderer-verungluckt-bei-sturz-in-berchtesgadener-alpen-13178623.html,0,www.tagesspiegel.de,Tödlicher Bergunfall in Bayern: Schneeschuhwanderer verunglückt bei Sturz in Berchtesgadener Alpen,"Suchmannschaften fanden am Montag die Leiche des 25-jährigen Wanderers. Angehörige hatten ihn am Sonntagnachmittag als vermisst gemeldet, die Suche war über Nacht zunächst eingestellt worden.",https://www.tagesspiegel.de/images/13178953/alternates/BASE_16_9_W1400/1739205669000/landschaft-oberbayern-berge.jpeg,2025-02-10T16:51:37Z,,"Empfohlener redaktioneller Inhalt
 An dieser Stelle finden Sie einen von unseren Redakteuren ausgewählten, externen Inhalt, der den Artikel für Sie mit zusätzlichen Informationen anreichert. Sie kön… [+466 chars]",,de,'Bayern'
https://www.bild.de/regional/bayern/eltern-in-sorge-falscher-polizist-spricht-kinder-in-mammendorf-an-67aa29411aeb2534badc94f8,https://www.bild.de/regional/bayern/eltern-in-sorge-falscher-polizist-spricht-kinder-in-mammendorf-an-67aa29411aeb2534badc94f8,0,www.bild.de,Eltern in Sorge - Falscher Polizist spricht Kinder in Mammendorf an,"Große Sorge in einem kleinen Ort in Bayern. In Mammendorf (5000 Einwohner, Lkr. Fürstenfeldbruck) hat ein Unbekannter zwei Kinder angesprochen.","https://images.bild.de/67aa29411aeb2534badc94f8/cb3d30e17da43e832b535279d5debb7f,5b902eb5?w=1280",2025-02-10T16:56:48Z,,"Mammendorf Große Sorge in einem kleinen Ort in Bayern. In Mammendorf (5000 Einwohner, Lkr. Fürstenfeldbruck) hat ein Unbekannter zwei Kinder angesprochen, die alleine unterwegs waren. Besorgte Eltern… [+1001 chars]",,de,'Bayern'
https://www.stern.de/sport/fc-bayern-muss-15-000-euro-strafe-zahlen---wegen-zwei-minuten-35455212.html,https://www.stern.de/sport/fc-bayern-muss-15-000-euro-strafe-zahlen---wegen-zwei-minuten-35455212.html,0,www.stern.de,DFB-Urteil: FC Bayern muss 15.000 Euro Strafe zahlen – für zwei Minuten,"Wer zu spät kommt, den bestraft der DFB. Dieses Mal wird der FC Bayern zur Kasse gebeten. Es ging um das Bundesligaspiel gegen den St. Pauli.",https://image.stern.de/35455228/t/WT/v1/w1440/r1.7778/-/fc-bayern-bundesliga.jpg,2025-02-10T17:02:00Z,,"Kopiere den aktuellen Link
Wer zu spät kommt, den bestraft der DFB. Dieses Mal wird der FC Bayern zur Kasse gebeten. Es ging um das Bundesligaspiel gegen den St. Pauli.
Der FC Bayern München muss w… [+1132 chars]",,de,'Bayern'
https://www.kicker.de/habe-gewisse-fantasien-benders-erste-umbauten-in-burghausen-1088946/artikel,https://www.kicker.de/habe-gewisse-fantasien-benders-erste-umbauten-in-burghausen-1088946/artikel,0,www.kicker.de,"""Habe gewisse Fantasien"": Benders erste Umbauten in Burghausen",Anfang März startet Lars Bender mit dem SV Wacker Burghausen in die Restrunde der Regionalliga Bayern. Die ersten Wochen der Zusammenarbeit haben bereits gute Erkenntnisse gebracht.,https://derivates.kicker.de/image/upload/w_4000%2Ch_2250%2Cc_fill%2Cg_auto:subject/w_1200%2Cq_auto/v1/2025/02/10/c417d07f-6175-480d-9b16-0be3256f1afd.jpeg,2025-02-10T17:28:56Z,,Anfang März startet Lars Bender mit dem SV Wacker Burghausen in die Restrunde der Regionalliga Bayern. Die ersten Wochen der Zusammenarbeit haben bereits gute Erkenntnisse gebracht. Mehr zur Regional… [+3371 chars],,de,'Bayern'
https://www.kicker.de/teure-127-sekunden-fc-bayern-zur-kasse-gebeten-1089587/artikel,https://www.kicker.de/teure-127-sekunden-fc-bayern-zur-kasse-gebeten-1089587/artikel,0,www.kicker.de,Teure 127 Sekunden: FC Bayern zur Kasse gebeten,"Wer zu spät kommt den bestraft das Leben, lautet ein bekanntes deutsches Sprichwort, den FC Bayern bestraft aber auch der DFB.",https://derivates.kicker.de/image/upload/c_crop%2Cx_0%2Cy_204%2Cw_4000%2Ch_2250/w_1200%2Cq_auto/v1/2025/02/10/8679ade2-d59b-4e92-8263-f87c2dbbf379.jpeg,2025-02-10T17:57:18Z,,"Wer zu spät kommt den bestraft das Leben, lautet ein bekanntes deutsches Sprichwort, den FC Bayern bestraft aber auch der DFB. 
 Sportlich eilen die Münchner dieser Tage von Sieg zu Sieg und befinde… [+2147 chars]",,de,'Bayern'
https://www.kicker.de/trotz-bayern-coup-feyenoord-trennt-sich-von-priske-1089595/artikel,https://www.kicker.de/trotz-bayern-coup-feyenoord-trennt-sich-von-priske-1089595/artikel,0,www.kicker.de,Trotz Bayern-Coup: Feyenoord trennt sich von Priske,Nur zwei Tage vor dem Hinspiel in den Champions-League-Play-offs gegen die AC Mailand hat Feyenoord Rotterdam die Trennung von Cheftrainer Brian Priske öffentlich gemacht.,https://derivates.kicker.de/image/upload/c_crop%2Cx_0%2Cy_66%2Cw_2206%2Ch_1241/w_1200%2Cq_auto/v1/2025/02/10/5049c2da-0327-4e08-b020-ce04304e5c72.jpeg,2025-02-10T18:29:50Z,,"Nur zwei Tage vor dem Hinspiel in den Champions-League-Play-offs gegen die AC Mailand hat Feyenoord Rotterdam die Trennung von Cheftrainer Brian Priske öffentlich gemacht. 
 Vor knapp drei Wochen fe… [+2077 chars]",,de,'Bayern'
