index,url,valid,domain,title,description,image,published,archive,content,quote,language,keyword
https://www.n-tv.de/wirtschaft/Winterstuerme-verursachen-Milliardenschaeden-id30220020.html,https://www.n-tv.de/wirtschaft/Winterstuerme-verursachen-Milliardenschaeden-id30220020.html,0,www.n-tv.de,"""Elli"" zieht über Deutschland: Winterstürme verursachen Milliardenschäden","Winterstürme können eine Schneise der Verwüstung ziehen: Dächer werden abgedeckt, Bäume stürzen um, Züge bleiben stehen. Laut dem Gesamtverband der Deutschen Versicherungswirtschaft zählen sie zu den verheerendsten Naturkatastrophen in Deutschland - und koste…",https://www.n-tv.de/img/30220066/1767941210/Img_16_9/1200/Zwei-Mitarbeiter-der-Deutschen-Bahn-stehen-am-19-01-2018-in-Muenster-Nordrhein-Westfalen-auf-einem-Hubwagon-und-beginnen-mit-den-Aufraeumarbeiten-am-alten-Bahnhofsgebaeude-am-Hauptbahnhof-in-Muenster-Das-Sturmtief-Friederike-hob-am-Vortag-Teile-des-Daches-vom-Gebaeude-ab.jpg,2026-01-09T06:15:54Z,,"Das Sturmtief ""Friederike"" hob im Januar 2018 Teile des Daches von einem Bahnhofsgebäude in Münster ab. (Foto: picture alliance / Guido Kirchner/dpa)
Winterstürme können eine Schneise der Verwüstung… [+3184 chars]",,de,'Winter'
https://www.n-tv.de/ratgeber/Raeumfahrzeuge-auf-der-Strasse-So-verhaelt-man-sich-richtig-id30217099.html,https://www.n-tv.de/ratgeber/Raeumfahrzeuge-auf-der-Strasse-So-verhaelt-man-sich-richtig-id30217099.html,0,www.n-tv.de,Schnee und Glätte: Räumfahrzeuge auf der Straße: So verhält man sich richtig,"Der Winter gibt ein Gastspiel mit massig Eis und Schnee. Wer Auto fahren muss, freut sich über Räum- und Streufahrzeuge, die für möglichst sichere Straßen sorgen. Worauf ist dabei zu achten?",https://www.n-tv.de/img/30216993/1767881641/Img_16_9/1200/Raeum-und-Streufahrzeuge-besitzen-im-Winter-Sonderrechte-Autofahrer-sollten-ausreichend-Abstand-halten-und-vorsichtig-fahren.jpg,2026-01-09T06:18:07Z,,"Räum- und Streufahrzeuge besitzen im Winter Sonderrechte. Autofahrer sollten ausreichend Abstand halten und vorsichtig fahren. 
Der Winter gibt ein Gastspiel mit massig Eis und Schnee. Wer Autofahre… [+3096 chars]",,de,'Gas'
https://www.stern.de/gesellschaft/regional/hessen/wetter--sky-line-faehrt-nicht---einschraenkungen-auf-der-schiene-37024680.html,https://www.stern.de/gesellschaft/regional/hessen/wetter--sky-line-faehrt-nicht---einschraenkungen-auf-der-schiene-37024680.html,0,www.stern.de,Wetter: Sky Line fährt nicht - Einschränkungen auf der Schiene,Frankfurt/Kassel (lhe) - Das Winterwetter beeinträchtigt den öffentlichen Verkehr in Hessen. Der Rhein-Main-Verkehrsverbund (RMV) berichtete am,https://image.stern.de/37024682/t/oK/v1/w1440/r1.7778/-/09--tipnrpwlnhv5axs2048jpeg---a9546e8cfa95e8d6.jpg,2026-01-09T06:23:11Z,,"Kopiere den aktuellen Link
Zur Merkliste hinzufügen
Der Winter hat Folgen für den öffentlichen Verkehr. Reisende sollten ihre Verbindung checken.
Das Winterwetter beeinträchtigt den öffentlichen V… [+1126 chars]",,de,'Winter'
https://www.faz.net/aktuell/feuilleton/buecher/autoren/peter-handkes-winterliche-reise-der-anfang-der-alternativen-fakten-accg-110816260.html,https://www.faz.net/aktuell/feuilleton/buecher/autoren/peter-handkes-winterliche-reise-der-anfang-der-alternativen-fakten-accg-110816260.html,0,www.faz.net,Handke und der Populismus: Wann ging das los mit den alternativen Fakten?,"Vor 30 Jahren erschien Peter Handkes „Winterliche Reise“ nach Serbien. Was heute die Neuen Rechten prägt, war damals schon alles da: Die Entwertung von Analyse ­zugunsten des Affekts, gepaart mit passiv-aggressiver Opferhaltung.",https://media0.faz.net/image/w1200h627/10e8e347fd3c/w2030h1060x0y699o/032006/1.10816256/der-oesterreichische.webp,2026-01-10T07:54:30Z,,"Wenn ein Autor einen Preis gewinnt, und die Mütter der Opfer eines Genozids protestieren dagegen, dann müsste er sich doch fragen, ob da vielleicht irgendwas schiefgelaufen ist. Denn es ist ja nicht … [+14340 chars]",,de,'Krieg'
https://de.catholicnewsagency.com/article/3043/was-denkt-der-heilige-stuhl-uber-krieg-und-abrustung-jenseits-der-waffenlogik,https://de.catholicnewsagency.com/article/3043/was-denkt-der-heilige-stuhl-uber-krieg-und-abrustung-jenseits-der-waffenlogik,0,de.catholicnewsagency.com,Was denkt der Heilige Stuhl über Krieg und Abrüstung jenseits der Waffenlogik?,"Christian Peschken (EWTN) im Gespr&auml;ch mit Erzbischof Ettore Balestrero, dem St&auml;ndigen Vertreter des Heiligen Stuhls bei der UN in Genf.",https://de.catholicnewsagency.com/image/cna-deutsch-cover-abruestung_1767820885.jpg?w=1200,2026-01-10T08:00:00Z,,"10. Januar 2026
Der Heilige Stuhl hat sich vor kürzlich vor den Vereinten Nationen erneut deutlich zu Fragen von Krieg, Abrüstung und humanitärer Verantwortung positioniert. In seiner Stellungnahme … [+8056 chars]",,de,'Krieg'
https://www.voltairenet.org/article223484.html,https://www.voltairenet.org/article223484.html,0,www.voltairenet.org,"Nach Maduro: der Fall der lateinamerikanischen Berliner Mauer und die Israelisierung des Kontinents, von Alfredo Jalife-Rahme",Die US-Operation in Venezuela muss im Kontext von Donald Trumps Übernahme lateinamerikanischer Öl- und Lithiumreserven interpretiert werden. Aber vor allem muss es als Schlag Israels für das iranisch-venezolanische Bündnis verstanden werden.,https://www.voltairenet.org/IMG/logo/223474arton.jpg?1768033441,2026-01-10T08:25:23Z,,"Mit seiner ""Enthauptungsoperation"" in Venezuela hofft Trump, die Folgen des Epsteingate-Skandals zu minimieren und versucht, seinen Rückgang in den Umfragen vor den Zwischenwahlen zu stoppen. Die Fra… [+5683 chars]",,de,'Öl'
https://www.diepresse.com/20462008/wladimir-putin-der-geopolitik-influencer-im-kreml-auf-toenernen-fuessen,https://www.diepresse.com/20462008/wladimir-putin-der-geopolitik-influencer-im-kreml-auf-toenernen-fuessen,0,www.diepresse.com,"Wladimir Putin, der Geopolitik-Influencer im Kreml auf tönernen Füßen [premium]",Putin spricht schon lang von Einflusssphären. Er strebt die russische Hegemonie im „nahen Ausland“ an. Bilanz: Durchwachsen.,https://img.diepresse.com/public/incoming/dqrxk5-UKRAINE-CRISISRUSSIA-MISSILE/alternates/DPR_SOCIAL_NACHRICHTEN/UKRAINE-CRISISRUSSIA-MISSILE,2026-01-10T09:51:15Z,,"Als im August 2008 russische Panzer auf die georgische Hauptstadt Tiflis zurollten, erlebten viele Europäer eine Schrecksekunde. Doch nur wenige Tage später waren die Zusammenstöße zwischen georgisch… [+4505 chars]",,de,'Putin'
https://www.bild.de/politik/ausland-und-internationales/ukrainekrieg-das-ist-putins-gefaehrlichste-waffe-6960d78a4d1d5f581eeb0f11,https://www.bild.de/politik/ausland-und-internationales/ukrainekrieg-das-ist-putins-gefaehrlichste-waffe-6960d78a4d1d5f581eeb0f11,0,www.bild.de,Kaum abzuwehren! - Das ist Putins gefährlichste Rakete,"Russland hat die Ukraine mit der Rakete Oreschnik angegriffen. „Es ist die gefährlichste Waffe, die Putin bislang eingesetzt hat“, sagt der Sicherheitsexperte Gerhard Mangott.","https://images.bild.de/6960d78a4d1d5f581eeb0f11/77329a85ec7e27dfc7efa28eb8fc34c2,ad0d04d3?w=1280",2026-01-10T10:18:07Z,,"Kreml-Machthaber Wladimir Putin hat die Ukraine mit der Hyperschallrakete Oreschnik angegriffen. Es ist die gefährlichste Waffe, die Putin in diesem Krieg bislang eingesetzt hat und eine der gefährli… [+226 chars]",,de,'Putin'
https://www.diepresse.com/20463102/trag-einen-grossen-stock-bei-dir,https://www.diepresse.com/20463102/trag-einen-grossen-stock-bei-dir,0,www.diepresse.com,„Trag einen großen Stock bei dir!“ [premium],Von der Monroe-Doktrin über den Kalten Krieg bis zu George Bush: Waren die Sicherheitsdoktrinen der US-Präsidenten vereinbar mit dem Völkerrecht?,https://img.diepresse.com/public/incoming/9845z9-GettyImages-96744464.jpg/alternates/DPR_SOCIAL_MAGAZIN/GettyImages-96744464.jpg,2026-01-10T19:02:50Z,,"Die USA wurden 1776 gegründet und man begann von der Alten und der Neuen Welt zu sprechen. Das war nicht nur geografisch gemeint, sondern auch politisch-moralisch. Es wurde klar, dass der neue Staat … [+8319 chars]",,de,'Krieg'
https://www.tagesspiegel.de/berlin/ukrainische-parallelwelten-in-berlin-die-einen-bauen-sich-ein-neues-leben-auf-die-anderen-bekommen-prothesen-15121162.html,https://www.tagesspiegel.de/berlin/ukrainische-parallelwelten-in-berlin-die-einen-bauen-sich-ein-neues-leben-auf-die-anderen-bekommen-prothesen-15121162.html,0,www.tagesspiegel.de,"Ukrainische Parallelwelten in Berlin: Die einen bauen sich ein neues Leben auf, die anderen bekommen Prothesen","Der Krieg führt viele ukrainische Männer einer Generation nach Berlin. Während einige dem Wehrdienst fernbleiben, kommen andere als Verwundete zur Behandlung. Was denken sie voneinander?",https://www.tagesspiegel.de/images/15121208/alternates/BASE_16_9_W1400/1767970659000/ukraine-konferenz.jpeg,2026-01-10T19:07:30Z,,"In Berlin begegnen sich ukrainische Männer derselben Generation immer häufiger obwohl sich ihre Lebenswege zuvor jahrelang kaum berührt haben. Die einen kommen aus dem Krieg: verwundet, zur Behandlun… [+813 chars]",,de,'Krieg'
https://www.sueddeutsche.de/medien/anja-niedringhaus-kriegsberichterstattung-doku-attentat-afghanistan-balkan-krieg-naqibullah-gulbeddin-hekmatjar-li.3363717,https://www.sueddeutsche.de/medien/anja-niedringhaus-kriegsberichterstattung-doku-attentat-afghanistan-balkan-krieg-naqibullah-gulbeddin-hekmatjar-li.3363717,0,www.sueddeutsche.de,Kriegsfotografie: Unter Einsatz ihres Lebens,"Eine ARD-Dokumentation zeigt Leben und Tod der außergewöhnlichen Kriegsfotografin Anja Niedringhaus, die 2014 in Afghanistan erschossen wurde. Warum sind die Hintergründe der Tat bis heute nicht aufgeklärt?",https://www.sueddeutsche.de/2026/01/08/f3d938ff-af45-4ff8-a514-30376112218d.jpg?q=60&fm=webp&width=1200&rect=0%2C151%2C2953%2C1661,2026-01-10T20:15:13Z,,"Selbst wer noch nie etwas von Anja Niedringhaus gehört hat, wird sie nach dieser Dokumentation nicht mehr vergessen. Der ARD-Film Die Fotografin und der Krieg von Sonya und Yury Winterberg rückt eine… [+513 chars]",,de,'Krieg'
https://www.bild.de/politik/ausland-und-internationales/kiew-buergermeister-klitschko-in-bild-putin-will-den-willen-der-ukrainer-brechen-69627b3e4d1d5f581eeb273f,https://www.bild.de/politik/ausland-und-internationales/kiew-buergermeister-klitschko-in-bild-putin-will-den-willen-der-ukrainer-brechen-69627b3e4d1d5f581eeb273f,0,www.bild.de,Kiews Bürgermeister in BILD - „Putin will den Willen der Ukrainer brechen“,Berlin – Perfide Kriegstaktik mitten im Winter: Russlands Machthaber Wladimir Putin (73) lässt die Städte in der Ukraine immer brutaler bombardieren.,"https://images.bild.de/69627b3e4d1d5f581eeb273f/25fd940a1654918649fd3659cdeae217,3bd6bbfc?w=1280",2026-01-10T21:29:45Z,,"Berlin  Es ist eine perfide Kriegstaktik mitten im Winter: Russlands Machthaber Wladimir Putin (73) lässt die Städte in der Ukraine immer brutaler bombardieren, um für einen völligen Blackout zu sorg… [+2602 chars]",,de,'Krieg'
https://www.freitag.de/autoren/der-freitag/ukraine-wie-krieg-spricht-und-wie-sein-schweigen-klingt,https://www.freitag.de/autoren/der-freitag/ukraine-wie-krieg-spricht-und-wie-sein-schweigen-klingt,0,www.freitag.de,"Ukraine | „Busifizierung"" in der Ukraine: Wie der Krieg spricht und wovon er nichts hören will","Helden auf den Plakaten – doch das Handy warnt vor der Rekrutierungspolizei. Ein Streifzug durch Oberflächen und Unterwelten des vom Krieg zerrissenen Landes zeigt die interne Gewalt, die zur Abwehr der äußeren Gewalt ausgeübt wird Nachts die Sirenen, Drohnen…",https://www.freitag.de/autoren/der-freitag/ukraine-wie-krieg-spricht-und-wie-sein-schweigen-klingt/@@images/image/great,2026-01-11T03:00:00Z,,"Nachts die Sirenen, Drohnen, Raketen und Explosionen. Und morgens die Nachrichten über Tote und Ausgebombte – sowie die Frage, ob es Licht und Wärme gibt. Anfang Dezember bin ich aus Kyjiw nach Berli… [+19176 chars]",,de,'Krieg'
https://www.nzz.ch/wirtschaft/deutschlands-gasreserven-sinken-durch-den-strengen-winter-schneller-als-erwartet-geht-dem-land-bald-das-erdgas-aus-ld.1919546,https://www.nzz.ch/wirtschaft/deutschlands-gasreserven-sinken-durch-den-strengen-winter-schneller-als-erwartet-geht-dem-land-bald-das-erdgas-aus-ld.1919546,0,www.nzz.ch,Deutschlands Gasreserven nehmen durch den strengen Winter schneller ab als erwartet: Geht dem Land bald das Erdgas aus?,Die kalte Witterung lässt Deutschlands Gasvorräte rasant schrumpfen. Die Speicher sind nur noch zur Hälfte gefüllt. Dabei hat der Winter gerade erst begonnen. Was hinter den niedrigen Speicherständen steckt – und was sich dagegen tun lässt.,"https://img.nzz.ch/2026/01/09/46d89bc1-c525-48de-821b-20e1b6714db6.jpg?width=1200&height=674&fit=bounds&quality=75&auto=webp&crop=4724,2657,x0,y246&wmark=nzz",2026-01-11T03:30:00Z,,Die kalte Witterung lässt Deutschlands Gasvorräte rasant schrumpfen. Die Speicher sind nur noch zur Hälfte gefüllt. Dabei hat der Winter gerade erst begonnen. Was hinter den niedrigen Speicherständen… [+10746 chars],,de,'Winter'
https://www.nzz.ch/feuilleton/patrioten-fuer-putin-wie-russische-regisseure-die-imperiale-nation-auf-die-grosse-leinwand-bringen-ld.1919276,https://www.nzz.ch/feuilleton/patrioten-fuer-putin-wie-russische-regisseure-die-imperiale-nation-auf-die-grosse-leinwand-bringen-ld.1919276,0,www.nzz.ch,Patrioten für Putin: wie russische Regisseure die imperiale Nation auf die grosse Leinwand bringen,"Einst schielte der Filmemacher Nikita Michalkow selbst auf das Präsidentenamt. Heute zählt er zu einer Riege von Putin-Vasallen, die das Vaterland glorifizieren. Wie kommt die Propaganda beim Publikum an?","https://img.nzz.ch/2026/01/08/c2ab52e7-9e65-4fa7-8917-fbe9d501e8f1.jpg?width=1200&height=675&fit=bounds&quality=75&auto=webp&crop=2048,1152,x0,y107&wmark=nzz",2026-01-11T04:30:00Z,,"Einst schielte der Filmemacher Nikita Michalkow selbst auf das Präsidentenamt. Heute zählt er zu einer Riege von Putin-Vasallen, die das Vaterland glorifizieren. Wie kommt die Propaganda beim Publiku… [+9423 chars]",,de,'Putin'
