index,url,valid,domain,title,description,image,published,archive,content,quote,language,keyword
https://www.focus.de/earth/keine-aschewinter-neuer-untersuchung-entlarvt-den-klima-irrtum-der-supervulkane_id_259734547.html,https://www.focus.de/earth/keine-aschewinter-neuer-untersuchung-entlarvt-den-klima-irrtum-der-supervulkane_id_259734547.html,0,www.focus.de,Aschewinter - Neuer Untersuchung entlarvt den Klima-Irrtum der Supervulkane,Gigantische Vulkane verursachen durch ihre Aschewolken ebenso katastrophale vulkanische Winter - sollte man meinen. Doch der Kühleffekt eines Supervulkans bleibt wohl mäßig.,https://p6.focus.de/img/wissen/id_259734545/keine-globale-katastrophen-durch-supervulkane.jpg?im=Crop%3D%280%2C40%2C1280%2C640%29%3BResize%3D%281200%2C627%29&impolicy=perceptual&quality=mediumHigh&hash=7881a78f690bcea0d04584336041757c7ad6a5574b7b0888216a71ffc4843a58,2024-03-06T11:35:04Z,,Gigantische Vulkane verursachen durch ihre Aschewolken ebenso katastrophale vulkanische Winter - sollte man meinen. Doch der Kühleffekt eines Supervulkans bleibt wohl mäßig.Wenn Supervulkane wie die … [+3299 chars],,de,'Winter'
https://www.sueddeutsche.de/politik/israel-tempelberg-ramadan-gazastreifen-1.6427622,https://www.sueddeutsche.de/politik/israel-tempelberg-ramadan-gazastreifen-1.6427622,0,www.sueddeutsche.de,"Gaza-Krieg: Angst vor einem ""Monat des Terrors""",Während des Ramadan ist die Gefahr gewalttätiger Proteste auf dem Tempelberg in Jerusalem gewaltig. Premier Netanjahu musste deshalb eine schwierige Entscheidung treffen.,https://www.sueddeutsche.de/image/sz.1.6427623/1200x675?v=1709736573,2024-03-06T14:50:00Z,,"Es war die Jerusalem Post, die den im Nahen Osten als Vater allen Übels verschrienen Briten Mark Sykes aus der Mottenkiste kramte. Jerusalem sei ""ein brandgefährliches Territorium"", wurde der britisc… [+4945 chars]",,de,'Öl'
https://www.n-tv.de/wirtschaft/Ersatz-fuer-Moskaus-Gas-Wien-startet-Pipeline-Ausbau-article24787317.html,https://www.n-tv.de/wirtschaft/Ersatz-fuer-Moskaus-Gas-Wien-startet-Pipeline-Ausbau-article24787317.html,0,www.n-tv.de,Leitung führt über Deutschland: Ersatz für Moskaus Gas: Wien startet Pipeline-Ausbau,"Österreich ist stark von russischem Gas abhängig. Der Transitvertrag über die Ukraine läuft allerdings 2025 aus, weshalb Gazprom die Lieferungen drosseln könnte. Bundeskanzler Nehammer will daher unabhängiger werden. Er kündigt dafür die Erweiterung der West-…",https://bilder4.n-tv.de/img/incoming/crop24787315/666132341-cImg_16_9-w1200/450174157.jpg,2024-03-06T15:55:26Z,,"Österreich ist stark von russischem Gas abhängig. Der Transitvertrag über die Ukraine läuft allerdings 2025 aus, weshalb Gazprom die Lieferungen drosseln könnte. Bundeskanzler Nehammer will daher una… [+2569 chars]",,de,'Gas'
https://www.n-tv.de/politik/23-12-Auswaertiges-Amt-verschaerft-Reisewarnung-fuer-Russland--article24788154.html,https://www.n-tv.de/politik/23-12-Auswaertiges-Amt-verschaerft-Reisewarnung-fuer-Russland--article24788154.html,0,www.n-tv.de,Ukraine-Krieg im Liveticker: +++ 23:12 Auswärtiges Amt verschärft Reisewarnung für Russland +++,Lesen Sie alle aktuellen Entwicklungen und Nachrichten über den russischen Angriffskrieg auf die Ukraine im Liveticker von ntv.de.,https://bilder2.n-tv.de/img/incoming/crop23332537/9041326157-cImg_16_9-w1200/Liveticker1-grau-1-Kopie.jpg,2024-03-06T19:30:00Z,,"Das Auswärtige Amt verschärft seine Reisehinweise für Russland und rät nun ""dringend"" von Reisen dorthin ab. Die Änderung sei ""aufgrund der sich weiter verschlechternden Lage einschließlich immer häu… [+27383 chars]",,de,'Öl'
https://www.zeit.de/news/2024-03/07/druck-auf-israel-im-gaza-krieg-waechst,https://www.zeit.de/news/2024-03/07/druck-auf-israel-im-gaza-krieg-waechst,0,www.zeit.de,Krieg in Nahost: Druck auf Israel im Gaza-Krieg wächst,Hier finden Sie Informationen zu dem Thema „Krieg in Nahost“. Lesen Sie jetzt „Druck auf Israel im Gaza-Krieg wächst“.,https://img.zeit.de/news/2024-03/07/druck-auf-israel-im-gaza-krieg-waechst-image-group/wide__1300x731,2024-03-07T04:30:53Z,,"Israel gerät im Gaza-Krieg wegen der katastrophalen humanitären Lage international zunehmend unter Druck. Südafrika forderte den Internationalen Gerichtshof in Den Haag per Eil-Antrag auf, Israel anz… [+7679 chars]",,de,'Krieg'
https://www.welt.de/wirtschaft/plus250422100/USA-Dieser-Oel-Rekord-entlarvt-Bidens-Inszenierung-als-Klima-Praesident.html,https://www.welt.de/wirtschaft/plus250422100/USA-Dieser-Oel-Rekord-entlarvt-Bidens-Inszenierung-als-Klima-Praesident.html,0,www.welt.de,Dieser Öl-Rekord entlarvt Bidens Inszenierung als Klima-Präsident,"US-Präsident Joe Biden hat sich eigentlich dem Klimaschutz verschrieben. Doch seit Monaten floriert die Ölindustrie, die entscheidende Kennzahl ist sogar noch größer als unter Donald Trump. Was nach einem Erfolg klingt, könnte Biden gleich doppelt zum Verlier…",https://img.welt.de/img/wirtschaft/mobile250424536/5801356867-ci16x9-w1200-fnov-fpotl-fpi157750653/DWO-Teaser-USA-Biden-Oelproduktion-js.jpg,2024-03-07T06:21:20Z,,"Die WELT als ePaper: Die vollständige Ausgabe steht Ihnen bereits am Vorabend zur Verfügung so sind Sie immer hochaktuell informiert. Weitere Informationen: http://epaper.welt.de 
 Der Kurz-Link die… [+49 chars]",,de,'Öl'
https://www.morgenpost.de/wirtschaft/article241809514/pelletspreise-aktuell-heute-7-maerz-pellets-heizung-kosten.html,https://www.morgenpost.de/wirtschaft/article241809514/pelletspreise-aktuell-heute-7-maerz-pellets-heizung-kosten.html,0,www.morgenpost.de,Pelletspreise heute am 7. März: Der aktuelle Preis pro Tonne,Die Inflation in Deutschland geht aktuell zurück. ○ Hat das Auswirkungen auf die Pelletspreise? ○ So viel kostet eine Tonne heute (7. März).,https://img.sparknews.funkemedien.de/237047837/237047837_1669908877_v4_3_800.jpeg,2024-03-07T08:33:00Z,,"Berlin. Die Inflation in Deutschland geht aktuell zurück. Hat das Auswirkungen auf die Pelletspreise? So viel kostet eine Tonne heute (7. März).
Haushalte, die mit Pellets heizen, profitieren schon … [+6699 chars]",,de,'Öl'
https://taz.de/Bildungsministerium-reformiert-Bafoeg/!5996832/,https://taz.de/Bildungsministerium-reformiert-Bafoeg/!5996832/,0,taz.de,"Bildungsministerium reformiert Bafög: Mehr Empfänger, nicht mehr Geld","Das Bafög soll reformiert werden. Kritiker bemängeln aber, dass eine Erhöhung der Beträge nicht geplant ist – trotz Inflation und gestiegener Kosten.",https://taz.de/picture/6873537/948/Bafoeg-Stark-Watzinger-1.jpeg,2024-03-07T10:03:00Z,,"Das Bafög soll reformiert werden. Kritiker bemängeln aber, dass eine Erhöhung der Beträge nicht geplant ist trotz Inflation und gestiegener Kosten.
Erstsemesterbegrüßung an der Uni Köln im Oktober 2… [+4692 chars]",,de,'Krieg'
https://www.focus.de/politik/ausland/ukraine-krise/putins-falle-front-statt-security-job-russland-macht-migranten-durch-trick-zu-kanonenfutter_id_259737685.html,https://www.focus.de/politik/ausland/ukraine-krise/putins-falle-front-statt-security-job-russland-macht-migranten-durch-trick-zu-kanonenfutter_id_259737685.html,0,www.focus.de,Putins Falle - Front statt Security-Job - Russland macht Migranten durch Trick zu Kanonenfutter,"Junge Männer aus Indien und Nepal geraten ungewollt in den Ukraine-Krieg. Sie unterschreiben Verträge für Jobs fernab der Heimat, landen jedoch an der Front.",https://p6.focus.de/img/fotos/id_259737756/russische-soldaten.jpg?im=Crop%3D%280%2C213%2C3596%2C1798%29%3BResize%3D%281200%2C627%29&impolicy=perceptual&quality=mediumHigh&hash=4ea58b3ce3f96d51e128d1d3437bac846b4935b5bdbc1d1670cec780de24ab63,2024-03-07T10:07:00Z,,"Junge Männer aus Indien und Nepal geraten ungewollt in den Ukraine-Krieg. Sie unterschreiben Verträge für Jobs fernab der Heimat, landen jedoch an der Front.Junge Männer aus Indien und Nepal, die gla… [+2516 chars]",,de,'Krieg'
https://www.focus.de/politik/ausland/ukraine-krise/von-job-agenten-verschleppt-wie-junge-inder-und-nepalesen-als-kanonenfutter-im-ukraine-krieg-enden_id_259737685.html,https://www.focus.de/politik/ausland/ukraine-krise/von-job-agenten-verschleppt-wie-junge-inder-und-nepalesen-als-kanonenfutter-im-ukraine-krieg-enden_id_259737685.html,0,www.focus.de,Putins Kanonenfutter - Wie junge Inder und Nepalesen im Ukraine-Krieg enden,"Junge Männer aus Indien und Nepal geraten ungewollt in den Ukraine-Krieg. Sie unterschreiben Verträge für Jobs fernab der Heimat, landen jedoch an der Front.",https://p6.focus.de/img/fotos/id_259737756/russische-soldaten.jpg?im=Crop%3D%280%2C213%2C3596%2C1798%29%3BResize%3D%281200%2C627%29&impolicy=perceptual&quality=mediumHigh&hash=4ea58b3ce3f96d51e128d1d3437bac846b4935b5bdbc1d1670cec780de24ab63,2024-03-07T10:07:00Z,,"Junge Männer aus Indien und Nepal geraten ungewollt in den Ukraine-Krieg. Sie unterschreiben Verträge für Jobs fernab der Heimat, landen jedoch an der Front.Junge Männer aus Indien und Nepal, die gla… [+2516 chars]",,de,'Krieg'
https://www.welt.de/mediathek/dokumentation/history/sendung250120692/Hitlers-Krieg-im-Osten-1941-1943-2.html,https://www.welt.de/mediathek/dokumentation/history/sendung250120692/Hitlers-Krieg-im-Osten-1941-1943-2.html,0,www.welt.de,Hitlers Krieg im Osten – 1941-1943 (2),"Unternehmen Barbarossa: der größte Feldzug der Geschichte. Epische Panzerschlachten, Häuserkampf und Völkermord. Hitlers Ostfeldzug kostet über 25 Millionen Menschen das Leben.",https://img.welt.de/img/mediathek/dokumentation/history/mobile250120682/0881358127-ci16x9-w1200/Apocalypse-Hitler-takes-on-the-East-1.jpg,2024-03-07T10:08:11Z,,Am 22. Juni 1941 überfällt Deutschland die Sowjetunion. Hitler bricht den Nichtangriffspakt mit Stalin und entfesselt einen Vernichtungskrieg gegen Slawen und Juden. Er will Lebensraum im Osten schaf… [+295 chars],,de,'Krieg'
https://www.stern.de/politik/ausland/nahost--tel-aviv--un-gericht-soll-gaza-antrag-suedafrikas-ablehnen-34524086.html,https://www.stern.de/politik/ausland/nahost--tel-aviv--un-gericht-soll-gaza-antrag-suedafrikas-ablehnen-34524086.html,0,www.stern.de,Nahost: Tel Aviv: UN-Gericht soll Gaza-Antrag Südafrikas ablehnen,Zu den vielen Kriegstoten im Gazastreifen kommen nun auch noch Hungertote. Südafrika will den Menschen per Eil-Antrag Hilfe verschaffen. Israel macht eine andere Rechnung auf.,https://image.stern.de/34524088/t/qY/v1/w1440/r1.7778/-/07--urnnewsmldpacom2009010124030799252031v3w800h600l975t619r1551b1090jpeg---da6c918c9608beea.jpg,2024-03-07T10:30:58Z,,"Zu den vielen Kriegstoten im Gazastreifen kommen nun auch noch Hungertote. Südafrika will den Menschen per Eil-Antrag Hilfe verschaffen. Israel macht eine andere Rechnung auf.
Israel hat eine energi… [+3041 chars]",,de,'Krieg'
https://www.morgenpost.de/politik/ausland/article241834296/Tel-Aviv-UN-Gericht-soll-Gaza-Antrag-Suedafrikas-ablehnen.html,https://www.morgenpost.de/politik/ausland/article241834296/Tel-Aviv-UN-Gericht-soll-Gaza-Antrag-Suedafrikas-ablehnen.html,0,www.morgenpost.de,Tel Aviv: UN-Gericht soll Gaza-Antrag Südafrikas ablehnen,Zu den vielen Kriegstoten im Gazastreifen kommen nun auch noch Hungertote. Südafrika will den Menschen per Eil-Antrag Hilfe verschaffen. Israel macht eine andere Rechnung auf.,https://img.sparknews.funkemedien.de/241834294/241834294_1709807593_v4_3_800.jpeg,2024-03-07T10:30:58Z,,Jerusalem/Den Haag/Pretoria/Gaza. Zu den vielen Kriegstoten im Gazastreifen kommen nun auch noch Hungertote. Südafrika will den Menschen per Eil-Antrag Hilfe verschaffen. Israel macht eine andere Rec… [+3043 chars],,de,'Krieg'
https://www.morgenpost.de/ratgeber/article240878062/neue-studie-heizung-gasheizung-oelheizung-moeglichkeiten.html,https://www.morgenpost.de/ratgeber/article240878062/neue-studie-heizung-gasheizung-oelheizung-moeglichkeiten.html,0,www.morgenpost.de,Hausbesitzer haben bei Öl- und Gasheizung Qual der Wahl,Für die Heizung im Neubau gelten seit Jahresbeginn strenge Vorgaben. Was für Systeme sind möglich? Eine Studie bringt Licht ins Dunkel.,https://img.sparknews.funkemedien.de/237478197/237478197_1703591767_v4_3_800.jpeg,2024-03-07T10:50:00Z,,"Berlin. Für die Heizung im Neubau gelten seit Jahresbeginn strenge Vorgaben. Was für Systeme sind möglich? Eine Studie bringt Licht ins Dunkel.
<ul><li>Öl- oder Gasheizung? Oder doch die Wärmepumpe?… [+8569 chars]",,de,'Gas'
https://www.zeit.de/news/2024-03/07/zwei-tage-kaelte-maenner-in-kasten-unter-lkw-entdeckt,https://www.zeit.de/news/2024-03/07/zwei-tage-kaelte-maenner-in-kasten-unter-lkw-entdeckt,0,www.zeit.de,Zollkontrolle: Zwei Tage Kälte: Männer in Kasten unter Lkw entdeckt,Hier finden Sie Informationen zu dem Thema „Zollkontrolle“. Lesen Sie jetzt „Zwei Tage Kälte: Männer in Kasten unter Lkw entdeckt“.,https://img.zeit.de/news/2024-03/07/zwei-tage-kaelte-maenner-in-kasten-unter-lkw-entdeckt-image-group/wide__1300x731,2024-03-07T11:58:33Z,,"Zwei Tage haben zwei Männer in einem Unterbaukasten eines Lastwagens verbracht, der in dieser Zeit von Serbien über Ungarn, die Slowakei und Tschechien bis in die Oberpfalz gefahren ist. In Wernberg-… [+1770 chars]",,de,'Kälte'
https://www.stern.de/gesellschaft/regional/bayern/zollkontrolle--zwei-tage-kaelte--maenner-in-kasten-unter-lkw-entdeckt-34524518.html,https://www.stern.de/gesellschaft/regional/bayern/zollkontrolle--zwei-tage-kaelte--maenner-in-kasten-unter-lkw-entdeckt-34524518.html,0,www.stern.de,Zollkontrolle: Zwei Tage Kälte: Männer in Kasten unter Lkw entdeckt,"Zwei Tage haben zwei Männer in einem Unterbaukasten eines Lastwagens verbracht, der in dieser Zeit von Serbien über Ungarn, die Slowakei und Tschechien bis in die Oberpfalz gefahren ist. In Wernberg-Köblitz (Landkreis Schwandorf) überprüfte der Zoll den Laste…",https://image.stern.de/34524520/t/iR/v1/w1440/r1.7778/-/07--urnnewsmldpacom2009010124030799253290v2w800h600l2235t339r4660b1951jpeg---166c851c2d66a36a.jpg,2024-03-07T11:58:33Z,,"Zwei Tage haben zwei Männer in einem Unterbaukasten eines Lastwagens verbracht, der in dieser Zeit von Serbien über Ungarn, die Slowakei und Tschechien bis in die Oberpfalz gefahren ist. In Wernberg-… [+1721 chars]",,de,'Kälte'
https://www.zeit.de/news/2024-03/07/union-will-bundestag-erneut-ueber-taurus-abstimmen-lassen,https://www.zeit.de/news/2024-03/07/union-will-bundestag-erneut-ueber-taurus-abstimmen-lassen,0,www.zeit.de,Ukraine-Krieg: Union will Bundestag erneut über Taurus abstimmen lassen,Hier finden Sie Informationen zu dem Thema „Ukraine-Krieg“. Lesen Sie jetzt „Union will Bundestag erneut über Taurus abstimmen lassen“.,https://img.zeit.de/news/2024-03/07/union-will-bundestag-erneut-ueber-taurus-abstimmen-lassen-image-group/wide__1300x731,2024-03-07T13:45:50Z,,Die Union will den Bundestag in der nächsten Woche erneut über die Lieferung des Marschflugkörpers Taurus an die Ukraine abstimmen lassen. «Die CDU/CSU-Fraktion wird die Frage der Taurus-Lieferung in… [+3077 chars],,de,'Krieg'
https://www.zeit.de/news/2024-03/08/kuehnert-zu-taurus-keinen-oppositionsantraegen-zustimmen,https://www.zeit.de/news/2024-03/08/kuehnert-zu-taurus-keinen-oppositionsantraegen-zustimmen,0,www.zeit.de,Ukraine-Krieg: Kühnert zu Taurus: Keinen Oppositionsanträgen zustimmen,Hier finden Sie Informationen zu dem Thema „Ukraine-Krieg“. Lesen Sie jetzt „Kühnert zu Taurus: Keinen Oppositionsanträgen zustimmen“.,https://img.zeit.de/news/2024-03/08/kuehnert-zu-taurus-keinen-oppositionsantraegen-zustimmen-image-group/wide__1300x731,2024-03-08T01:51:18Z,,Die Union will im Bundestag erneut über eine Lieferung des Marschflugkörpers Taurus an die Ukraine abstimmen lassen mit weiteren Stimmen aus der Ampel-Koalition kann sie dabei nach Einschätzung von S… [+4794 chars],,de,'Krieg'
https://www.zeit.de/news/2024-03/08/usa-wollen-temporaeren-gaza-hafen-fuer-hilfen,https://www.zeit.de/news/2024-03/08/usa-wollen-temporaeren-gaza-hafen-fuer-hilfen,0,www.zeit.de,Krieg in Nahost: USA wollen temporären Gaza-Hafen für Hilfen,Hier finden Sie Informationen zu dem Thema „Krieg in Nahost“. Lesen Sie jetzt „USA wollen temporären Gaza-Hafen für Hilfen“.,https://img.zeit.de/news/2024-03/08/usa-wollen-temporaeren-gaza-hafen-fuer-hilfen-image-group/wide__1300x731,2024-03-08T04:29:53Z,,Angesichts der katastrophalen humanitären Lage im Gazastreifen sollen neben Lieferungen aus der Luft nun auch Güter über den Seeweg kommen. Das US-Militär will dafür zusammen mit internationalen Part… [+8229 chars],,de,'Krieg'
https://www.diepresse.com/18254275/wie-ich-auf-einem-spaziergang-demut-lernte,https://www.diepresse.com/18254275/wie-ich-auf-einem-spaziergang-demut-lernte,0,www.diepresse.com,Wie ich auf einem Spaziergang Demut lernte [premium],"Ana klappt die langen Flügel ihres Jacketts übereinander, weiter unten verschränkt sie die Arme vor der Kälte, wir schreiten voran. Nur kurz, eine weitere Runde und noch eine weitere, wir sind ja mitten im Gespräch. Über die Kunst und wozu sie einen verleitet.",https://img.diepresse.com/public/incoming/rdp1c-brancusi-jpg.jpg/alternates/DPR_SOCIAL_MAGAZIN_PAID/brancusi%20jpg.jpg,2024-03-08T13:10:18Z,,"Ana klappt die langen Flügel ihres Jacketts übereinander, weiter unten verschränkt sie die Arme vor der Kälte, wir schreiten voran. Nur kurz, eine weitere Runde und noch eine weitere, wir sind ja mit… [+1696 chars]",,de,'Kälte'
https://www.n-tv.de/politik/14-31-Papst-ueber-Ukraine-Krieg-Wer-besiegt-wird-muss-Mut-haben-zu-verhandeln--article23143824.html,https://www.n-tv.de/politik/14-31-Papst-ueber-Ukraine-Krieg-Wer-besiegt-wird-muss-Mut-haben-zu-verhandeln--article23143824.html,0,www.n-tv.de,"Ukraine-Krieg im Liveticker: +++ 14:31 Papst über Ukraine-Krieg: Wer ""besiegt wird, muss Mut haben, zu verhandeln"" +++",Lesen Sie alle aktuellen Entwicklungen und Nachrichten über den russischen Angriffskrieg auf die Ukraine im Liveticker von ntv.de.,https://bilder2.n-tv.de/img/incoming/crop23332537/9041326157-cImg_16_9-w1200/Liveticker1-grau-1-Kopie.jpg,2024-03-10T00:27:00Z,,"In einem Interview, das bislang nur in Teilen öffentlich ist, äußert sich Papst Franziskus zum anhaltenden Krieg in der Ukraine. Ohne das Land zu nennen, ruft er dennoch zu ""Mut zur weißen Fahne"" und… [+18362 chars]",,de,'Krieg'
https://www.n-tv.de/politik/16-11-Ukrainischer-Soldat-ueber-modifizierte-Gleitbombe-Die-FAB-1500-ist-die-Hoelle--article23143824.html,https://www.n-tv.de/politik/16-11-Ukrainischer-Soldat-ueber-modifizierte-Gleitbombe-Die-FAB-1500-ist-die-Hoelle--article23143824.html,0,www.n-tv.de,"Ukraine-Krieg im Liveticker: +++ 16:11 Ukrainischer Soldat über modifizierte Gleitbombe: ""Die FAB-1500 ist die Hölle"" +++",Lesen Sie alle aktuellen Entwicklungen und Nachrichten über den russischen Angriffskrieg auf die Ukraine im Liveticker von ntv.de.,https://bilder2.n-tv.de/img/incoming/crop23332537/9041326157-cImg_16_9-w1200/Liveticker1-grau-1-Kopie.jpg,2024-03-10T00:27:00Z,,"Russland soll in der Ukraine vermehrt die Gleitbombe FAB-1500 einsetzen. Es handle sich um eine Bombe aus der Sowjetzeit, die in eine Gleitbombe umgewandelt worden sei, meldet CNN. Die 1,5 Tonnen sch… [+20497 chars]",,de,'Krieg'
https://www.n-tv.de/politik/19-13-Lettlands-Praesident-widerspricht-Papst-Aufruf--article23143824.html,https://www.n-tv.de/politik/19-13-Lettlands-Praesident-widerspricht-Papst-Aufruf--article23143824.html,0,www.n-tv.de,Ukraine-Krieg im Liveticker: +++ 19:13 Lettlands Präsident widerspricht Papst-Aufruf +++,Lesen Sie alle aktuellen Entwicklungen und Nachrichten über den russischen Angriffskrieg auf die Ukraine im Liveticker von ntv.de.,https://bilder2.n-tv.de/img/incoming/crop23332537/9041326157-cImg_16_9-w1200/Liveticker1-grau-1-Kopie.jpg,2024-03-10T00:27:00Z,,"Lettlands Staatspräsident Rinkevics widerspricht dem Aufruf von Papst Franziskus zu Friedensverhandlungen im Ukraine-Krieg. ""Man darf vor dem Bösen nicht kapitulieren, man muss es bekämpfen und besie… [+24235 chars]",,de,'Krieg'
https://www.n-tv.de/politik/18-42-Russisches-Medium-Oberbefehlshaber-von-Russlands-Marine-ausgetauscht--article23143824.html,https://www.n-tv.de/politik/18-42-Russisches-Medium-Oberbefehlshaber-von-Russlands-Marine-ausgetauscht--article23143824.html,0,www.n-tv.de,Ukraine-Krieg im Liveticker: +++ 18:42 Russisches Medium: Oberbefehlshaber von Russlands Marine ausgetauscht +++,Lesen Sie alle aktuellen Entwicklungen und Nachrichten über den russischen Angriffskrieg auf die Ukraine im Liveticker von ntv.de.,https://bilder2.n-tv.de/img/incoming/crop23332537/9041326157-cImg_16_9-w1200/Liveticker1-grau-1-Kopie.jpg,2024-03-10T00:27:00Z,,"Russland hat der privaten Nachrichten-Webseite Fontanka zufolge den Oberbefehlshaber der Marine ausgewechselt. Kommissarisch habe Admiral Alexander Moiseew den Posten übernommen, berichtet Fontanka u… [+23534 chars]",,de,'Krieg'
https://www.n-tv.de/politik/14-00-Nach-Papst-Appell-Strack-Zimmermann-schaemt-sich-als-Katholikin--article23143824.html,https://www.n-tv.de/politik/14-00-Nach-Papst-Appell-Strack-Zimmermann-schaemt-sich-als-Katholikin--article23143824.html,0,www.n-tv.de,Ukraine-Krieg im Liveticker: +++ 14:00 Nach Papst-Appell: Strack-Zimmermann schämt sich als Katholikin +++,Lesen Sie alle aktuellen Entwicklungen und Nachrichten über den russischen Angriffskrieg auf die Ukraine im Liveticker von ntv.de.,https://bilder2.n-tv.de/img/incoming/crop23332537/9041326157-cImg_16_9-w1200/Liveticker1-grau-1-Kopie.jpg,2024-03-10T00:27:00Z,,"Die FDP-Verteidigungspolitikerin Marie-Agnes Strack-Zimmermann hat dem Appell von Papst Franziskus zu Friedensverhandlungen im Ukraine-Krieg in scharfer Form widersprochen. ""Bevor die ukrainischen Op… [+18004 chars]",,de,'Krieg'
https://www.n-tv.de/politik/12-22-Union-bietet-Ampel-bei-Taurus-Zusammenarbeit-an--article23143824.html,https://www.n-tv.de/politik/12-22-Union-bietet-Ampel-bei-Taurus-Zusammenarbeit-an--article23143824.html,0,www.n-tv.de,Ukraine-Krieg im Liveticker: +++ 12:22 Union bietet Ampel bei Taurus Zusammenarbeit an +++,Lesen Sie alle aktuellen Entwicklungen und Nachrichten über den russischen Angriffskrieg auf die Ukraine im Liveticker von ntv.de.,https://bilder2.n-tv.de/img/incoming/crop23332537/9041326157-cImg_16_9-w1200/Liveticker1-grau-1-Kopie.jpg,2024-03-10T00:27:00Z,,"Im Streit um die Lieferung von Taurus-Marschflugkörpern an die Ukraine bietet die Union der Ampel jetzt eine Kooperation an. Unions-Fraktionsvize Johann Wadephul sagt der Düsseldorfer ""Rheinischen Po… [+14536 chars]",,de,'Krieg'
https://www.n-tv.de/politik/04-24-Ein-Toter-mehrere-Verletzte-Russland-beschiesst-Staedte-in-Donezk--article23143824.html,https://www.n-tv.de/politik/04-24-Ein-Toter-mehrere-Verletzte-Russland-beschiesst-Staedte-in-Donezk--article23143824.html,0,www.n-tv.de,"Ukraine-Krieg im Liveticker: +++ 04:24 Ein Toter, mehrere Verletzte: Russland beschießt Städte in Donezk +++",Lesen Sie alle aktuellen Entwicklungen und Nachrichten über den russischen Angriffskrieg auf die Ukraine im Liveticker von ntv.de.,https://bilder2.n-tv.de/img/incoming/crop23332537/9041326157-cImg_16_9-w1200/Liveticker1-grau-1-Kopie.jpg,2024-03-10T00:27:00Z,,"Russische Streitkräfte haben die Ortschaften Chasiv Yar und Ocheretyn im Gebiet Donezk beschossen, wie die Staatsanwaltschaft der Region mitteilt. Demnach wurde eine Person getötet und vier weitere w… [+3094 chars]",,de,'Krieg'
https://www.n-tv.de/politik/20-28-Bericht-Ukrainische-Armee-toetet-einen-der-Achmat-Kommandeure--article23143824.html,https://www.n-tv.de/politik/20-28-Bericht-Ukrainische-Armee-toetet-einen-der-Achmat-Kommandeure--article23143824.html,0,www.n-tv.de,"Ukraine-Krieg im Liveticker: +++ 20:28 Bericht: Ukrainische Armee tötet einen der ""Achmat""-Kommandeure +++",Lesen Sie alle aktuellen Entwicklungen und Nachrichten über den russischen Angriffskrieg auf die Ukraine im Liveticker von ntv.de.,https://bilder2.n-tv.de/img/incoming/crop23332537/9041326157-cImg_16_9-w1200/Liveticker1-grau-1-Kopie.jpg,2024-03-10T00:27:00Z,,"Einer der Kommandeure der tschetschenischen ""Achmat""-Spezialeinheiten soll in der Ukraine getötet worden sein. Das meldet unter anderem das Nachrichtenportal ""Ukrainska Pravda"" und beruft sich auf ei… [+25682 chars]",,de,'Krieg'
https://www.n-tv.de/politik/10-15-Kuleba-Putin-koennte-baltische-Staedte-zerstoeren-wie-Bachmut-und-Awdijiwka--article23143824.html,https://www.n-tv.de/politik/10-15-Kuleba-Putin-koennte-baltische-Staedte-zerstoeren-wie-Bachmut-und-Awdijiwka--article23143824.html,0,www.n-tv.de,Ukraine-Krieg im Liveticker: +++ 10:15 Kuleba: Putin könnte baltische Städte zerstören wie Bachmut und Awdijiwka +++,Lesen Sie alle aktuellen Entwicklungen und Nachrichten über den russischen Angriffskrieg auf die Ukraine im Liveticker von ntv.de.,https://bilder2.n-tv.de/img/incoming/crop23332537/9041326157-cImg_16_9-w1200/Liveticker1-grau-1-Kopie.jpg,2024-03-10T00:27:00Z,,Um Bachmut und Awdijiwka wurde heftig gekämpft. Inzwischen stehen die beiden Städte für die Zerstörungswut der russischen Armee im Angriffskrieg gegen die Ukraine. Nun hat sich der ukrainische Außenm… [+10381 chars],,de,'Putin'
