index,url,valid,domain,title,description,image,published,archive,content,quote,language,keyword
https://www.zeit.de/news/2023-10/01/london-russland-stellt-sich-wohl-noch-auf-langen-krieg-ein,https://www.zeit.de/news/2023-10/01/london-russland-stellt-sich-wohl-noch-auf-langen-krieg-ein,0,www.zeit.de,Ukraine-Krieg: London: Russland stellt sich wohl noch auf langen Krieg ein,,,2023-10-01T08:34:59Z,,"When browsing with ads:
We collect personal data and also transmit it to third-party providers
 that help us improve and finance our digital content. Some of the information stored on your device, … [+821 chars]",,de,'Krieg'
https://www.faz.net/aktuell/politik/ausland/ideen-fuer-morgen-warum-die-eu-weiter-gebraucht-wird-19207467.html,https://www.faz.net/aktuell/politik/ausland/ideen-fuer-morgen-warum-die-eu-weiter-gebraucht-wird-19207467.html,0,www.faz.net,Ideen für die Welt von morgen: Warum die EU weiter gebraucht wird,Integration statt Krieg – keine Idee hat unseren Kontinent stärker verändert als die europäische Einigung. In der multipolaren Welt ist sie aktueller denn je.,https://media0.faz.net/ppmedia/aktuell/1582871503/1.9207462/facebook_teaser_fplus/der-ukrainische-praesident.jpg,2023-10-01T10:56:25Z,,"Die europäische Einigung war schon immer eine Idee für die Welt von morgen, weil sie als Antwort auf eine bittere Vergangenheit entstanden ist. Jean-Claude Juncker, früherer luxemburgischer Ministerp… [+574 chars]",,de,'Krieg'
https://www.zeit.de/news/2023-10/01/cdu-landtagsfraktionen-fordern-entlastungen-der-verbraucher,https://www.zeit.de/news/2023-10/01/cdu-landtagsfraktionen-fordern-entlastungen-der-verbraucher,0,www.zeit.de,Inflation: CDU-Landtagsfraktionen fordern Entlastungen der Verbraucher,,,2023-10-01T13:28:51Z,,"When browsing with ads:
We collect personal data and also transmit it to third-party providers
 that help us improve and finance our digital content. Some of the information stored on your device, … [+821 chars]",,de,'Inflation'
https://www.morgenpost.de/wirtschaft/article239713105/Fuest-Fachkraeftemangel-und-Energiewende-bremsen-Wirtschaft.html,https://www.morgenpost.de/wirtschaft/article239713105/Fuest-Fachkraeftemangel-und-Energiewende-bremsen-Wirtschaft.html,0,www.morgenpost.de,Ifo-Chef: Fuest: Fachkräftemangel und Energiewende bremsen Wirtschaft,"Hohe Energiepreise, zu wenig Fachkräfte, hohe Zinsen: Die deutsche Wirtschaft ist gleich durch mehrere Faktoren belastet. Für Ifo-Chef Clemens Fuest ist keine schnelle Erholung in Sicht.",https://img.morgenpost.de/img/wirtschaft/crop239713103/7702603694-w820-cv16_9-q85/Clemens-Fuest.jpg,2023-10-02T03:44:24Z,,"Frankfurt/Main. Die Arbeitskräfteknappheit und die Energiewende werden nach Einschätzung des Präsidenten des Ifo-Instituts, Clemens Fuest, das Wirtschaftswachstum längerfristig belasten. In Deutschla… [+2911 chars]",,de,'Energiepreise'
https://www.focus.de/finanzen/news/ifo-chef-fuest-fachkraeftemangel-und-energiewende-bremsen-wirtschaft_id_216841877.html,https://www.focus.de/finanzen/news/ifo-chef-fuest-fachkraeftemangel-und-energiewende-bremsen-wirtschaft_id_216841877.html,0,www.focus.de,Ifo-Chef - Fuest: Fachkräftemangel und Energiewende bremsen Wirtschaft,"Hohe Energiepreise, zu wenig Fachkräfte, hohe Zinsen: Die deutsche Wirtschaft ist gleich durch mehrere Faktoren belastet. Für Ifo-Chef Clemens Fuest ist keine schnelle Erholung in Sicht.",https://p6.focus.de/img/finanzen/news/id_216841875/ifo-praesident-clemens-fuest-sieht-mehrere-probleme-fuer-die-deutsche-wirtschaft..jpg?im=Crop%3D%280%2C193%2C2048%2C1024%29%3BResize%3D%281200%2C627%29&impolicy=perceptual&quality=mediumHigh&hash=7f175017453e115e4977b86c7a84c22fd497b759a66cbf98f464f463bb18e000,2023-10-02T03:50:08Z,,"Die Arbeitskräfteknappheit und die Energiewende werden nach Einschätzung des Präsidenten des Ifo-Instituts, Clemens Fuest, das Wirtschaftswachstum längerfristig belasten. «In Deutschland wird das Wac… [+2913 chars]",,de,'Energiepreise'
https://www.zeit.de/sport/2023-10/bundesliga-fc-bayern-jerome-boateng,https://www.zeit.de/sport/2023-10/bundesliga-fc-bayern-jerome-boateng,0,www.zeit.de,Bundesliga-Rückschau: Der FC Bayern schrumpft weiter,"Die Abwehr sucht Orientierung, der Tormann taumelt, der Stürmerstar hängt in der Luft – die Not der Bayern bringt sie auf einen seltsamen Gedanken. Der 6. Spieltag",,2023-10-02T04:14:06Z,,"When browsing with ads:
We collect personal data and also transmit it to third-party providers
 that help us improve and finance our digital content. Some of the information stored on your device, … [+821 chars]",,de,'Bayern'
https://www.basicthinking.de/blog/2023/10/02/5-tipps-um-im-oktober-2023-geld-zu-sparen-2/,https://www.basicthinking.de/blog/2023/10/02/5-tipps-um-im-oktober-2023-geld-zu-sparen-2/,0,www.basicthinking.de,"5 Tipps, um im Oktober 2023 Geld zu sparen","Die Energiepreise schwanken nach wie vor, haben sich jedoch zuletzt stabilisiert. Die Inflation sorgt allerdings bei vielen Produkten und Lebensmitteln für ungewohnt hohe Preise. Das Thema Sparen spielt deshalb immer noch eine große Rolle. Wir haben fünf Tipp…",https://www.basicthinking.de/blog/wp-content/uploads/2023/09/geld-sparen-oktober.jpeg,2023-10-02T04:15:17Z,,"Die Energiepreise schwanken nach wie vor, haben sich jedoch zuletzt stabilisiert. Die Inflation sorgt allerdings bei vielen Produkten und Lebensmitteln für ungewohnt hohe Preise. Das Thema Sparen spi… [+3631 chars]",,de,'Energie sparen'
https://www.zeit.de/news/2023-10/02/regisseur-marcus-h-rosenmueller-kritisiert-aiwanger,https://www.zeit.de/news/2023-10/02/regisseur-marcus-h-rosenmueller-kritisiert-aiwanger,0,www.zeit.de,Landtagswahl in Bayern: Regisseur Marcus H. Rosenmüller kritisiert Aiwanger,,,2023-10-02T06:01:20Z,https://web.archive.org/web/20231003232433/https://www.zeit.de/news/2023-10/02/regisseur-marcus-h-rosenmueller-kritisiert-aiwanger,"When browsing with ads:
We collect personal data and also transmit it to third-party providers
 that help us improve and finance our digital content. Some of the information stored on your device, … [+821 chars]",,de,'Bayern'
https://www.zeit.de/news/2023-10/02/ueber-130-asylbewerber-aus-russland-registriert,https://www.zeit.de/news/2023-10/02/ueber-130-asylbewerber-aus-russland-registriert,0,www.zeit.de,Krieg: Über 130 Asylbewerber aus Russland registriert,,,2023-10-02T06:23:50Z,,"When browsing with ads:
We collect personal data and also transmit it to third-party providers
 that help us improve and finance our digital content. Some of the information stored on your device, … [+821 chars]",,de,'Krieg'
https://www.morgenpost.de/ratgeber/article239713287/heizkosten-senken-heizen-heizung-altbau.html,https://www.morgenpost.de/ratgeber/article239713287/heizkosten-senken-heizen-heizung-altbau.html,0,www.morgenpost.de,Energiesparen: Heizkosten im Altbau senken – diese zwei Maßnahmen helfen,Die Energiepreise steigen derzeit wieder. Doch mit diesen beiden Maßnahmen lassen sich die Kosten für das Heizen unkompliziert senken.,https://img.morgenpost.de/img/wohnen/crop239713189/8192607596-w820-cv16_9-q85/Heizungsrohre-daemmen-mt-Schaumstoff.jpg,2023-10-02T07:45:02Z,,Berlin. Draußen wird es langsam kälter und die Sorge vor explodierenden Heizkosten damit wieder größer. Insbesondere Eigentümer von Altbauten stehen in Zeiten der Nachhaltigkeit und Energieeffizienz … [+2254 chars],,de,'Energiepreise'
https://www.focus.de/panorama/oktoberfest/wiesn-besucher-ueber-landtagswahl-es-reicht-nicht-mehr-45-jahre-schwer-zu-arbeiten-erzaehlt-baecker-franz-60_id_215837129.html,https://www.focus.de/panorama/oktoberfest/wiesn-besucher-ueber-landtagswahl-es-reicht-nicht-mehr-45-jahre-schwer-zu-arbeiten-erzaehlt-baecker-franz-60_id_215837129.html,0,www.focus.de,"Wiesn-Besucher vor Landtagswahl - „Es reicht nicht mehr, 45 Jahre schwer zu arbeiten“, sagt Bäcker Franz (60)",Vor der Landtagswahl in Bayern bestimmen die bundespolitischen Themen das Meinungsbild der Oktoberfest-Besucher. Vor allem die Unzufriedenheit mit der Ampel-Koalition macht sich dabei bemerkbar.Von FOCUS-online-Reporter Niklas Golitschek,https://p6.focus.de/img/fotos/id_215833804/lorena-jannik-vroni.jpg?im=Crop%3D%280%2C250%2C2000%2C1000%29%3BResize%3D%281200%2C627%29&impolicy=perceptual&quality=mediumHigh&hash=5c15892e7426ffe73dfe3a9b2ee1d34295cea02d153cf73645e076c42ba53ca1,2023-10-02T09:30:29Z,,"<ul><li>
Kommentare</li><li>
E-Mail</li><li>
Teilen</li><li>
Mehr</li><li>
Twitter</li><li>
Drucken</li><li>
Feedback</li><li>
Fehler meldenSie haben einen Fehler gefunden?
Bitte markieren S… [+4193 chars]",,de,'Energiepreise'
https://www.tagesspiegel.de/wirtschaft/ifo-chef-fuest-uber-arbeitskraftemangel-und-energiewende-in-deutschland-wird-das-wachstum-kunftig-schwacher-ausfallen-10559413.html,https://www.tagesspiegel.de/wirtschaft/ifo-chef-fuest-uber-arbeitskraftemangel-und-energiewende-in-deutschland-wird-das-wachstum-kunftig-schwacher-ausfallen-10559413.html,0,www.tagesspiegel.de,Ifo-Chef Fuest über Arbeitskräftemangel und Energiewende: „In Deutschland wird das Wachstum künftig schwächer ausfallen“,"Hohe Energiepreise, hohe Zinsen und der Fachkräftemangel belasten Clemens Fuest zufolge die Wirtschaft. Der Ifo-Chef sieht keine schnelle Erholung – auch nicht bei den Strompreisen.",https://www.tagesspiegel.de/images/sachsischer-aussenhandel-wachst-moderat/alternates/BASE_16_9_W1400/saechsischer-aussenhandel-waechst-moderat.jpeg,2023-10-02T09:31:05Z,,"Die Arbeitskräfteknappheit und die Energiewende werden das Wirtschaftswachstum längerfristig belasten, schätzt der Präsidenten des ifo Instituts Clemens Fuest. In Deutschland wird das Wachstum künfti… [+3471 chars]",,de,'Energiepreise'
https://www.zeit.de/news/2023-10/02/wuest-nach-krieg-ein-deutschland-das-europaeischer-denkt,https://www.zeit.de/news/2023-10/02/wuest-nach-krieg-ein-deutschland-das-europaeischer-denkt,0,www.zeit.de,"Ukraine-Krieg: Wüst: Nach Krieg «ein Deutschland, das europäischer denkt»",,,2023-10-02T11:52:34Z,,"When browsing with ads:
We collect personal data and also transmit it to third-party providers
 that help us improve and finance our digital content. Some of the information stored on your device, … [+821 chars]",,de,'Krieg'
https://www.zeit.de/wirtschaft/2023-10/ruestungsexporte-deutschland-hoechstwert-waffen-ukraine-krieg,https://www.zeit.de/wirtschaft/2023-10/ruestungsexporte-deutschland-hoechstwert-waffen-ukraine-krieg,0,www.zeit.de,Ukraine-Krieg: Deutsche Rüstungsexporte deutlich gestiegen,"Die Regierung hat schon jetzt mehr Rüstungsexporte genehmigt als 2022, bis Jahresende dürfte ein neuer Rekord erreicht werden. Größter Faktor sind Waffen für die Ukraine.",,2023-10-02T14:52:26Z,,"When browsing with ads:
We collect personal data and also transmit it to third-party providers
 that help us improve and finance our digital content. Some of the information stored on your device, … [+821 chars]",,de,'Krieg'
https://www.sueddeutsche.de/meinung/serbien-kosovo-eu-linie-kommentar-1.6268050,https://www.sueddeutsche.de/meinung/serbien-kosovo-eu-linie-kommentar-1.6268050,0,www.sueddeutsche.de,"Westlicher Balkan: Ein Mann, viele Worte","Serbiens Präsident beteuert, er wolle keinen Krieg. Aber was will er dann? Europas Diplomaten müssen im Umgang mit Belgrad endlich resoluter auftreten.",https://www.sueddeutsche.de/image/sz.1.6268051/1200x675?v=1696267361,2023-10-02T17:13:16Z,,"Serbiens Präsident beteuert, er wolle keinen Krieg. Aber was will er dann? Europas Diplomaten müssen im Umgang mit Belgrad endlich resoluter auftreten.Serbiens Präsident Aleksandar Vui verfiel mal wi… [+400 chars]",,de,'Krieg'
https://www.n-tv.de/wirtschaft/Putins-Waffenmaschine-stottert-wie-lange-noch-article24437420.html,https://www.n-tv.de/wirtschaft/Putins-Waffenmaschine-stottert-wie-lange-noch-article24437420.html,0,www.n-tv.de,Geldregen im neuen Haushalt: Putins Waffenmaschine stottert - wie lange noch?,Im kommenden Jahr erhöht Russland seine Militärausgaben dramatisch. Doch der Geldregen trifft im Rüstungsbereich auf massive Probleme: Korruption und fehlende Bauteile lassen Beschaffungsverträge platzen.,https://bilder2.n-tv.de/img/incoming/crop24437417/661132465-cImg_16_9-w1200/399818104.jpg,2023-10-02T17:36:01Z,,Im kommenden Jahr erhöht Russland seine Militärausgaben dramatisch. Doch der Geldregen trifft im Rüstungsbereich auf massive Probleme: Korruption und fehlende Bauteile lassen Beschaffungsverträge pla… [+5051 chars],,de,'Putin'
https://www.zeit.de/politik/ausland/2023-10/kosovo-serbien-konflikt-spannungen-haeufigste-fragen-faq,https://www.zeit.de/politik/ausland/2023-10/kosovo-serbien-konflikt-spannungen-haeufigste-fragen-faq,0,www.zeit.de,Serbien und Kosovo: Wie gefährlich ist die Lage im Kosovo?,"Im Nordkosovo spitzen sich die Spannungen mit Serbien zu, die Außenministerin des Kosovo warnt sogar vor Krieg. Was ist passiert – und droht jetzt ein Krim-Szenario?",,2023-10-02T17:36:15Z,https://web.archive.org/web/20231004014112/https://www.zeit.de/politik/ausland/2023-10/kosovo-serbien-konflikt-spannungen-haeufigste-fragen-faq,"When browsing with ads:
We collect personal data and also transmit it to third-party providers
 that help us improve and finance our digital content. Some of the information stored on your device, … [+821 chars]",,de,'Krieg'
https://futurezone.at/digital-life/ukraine-krieg-russland-sowjetisches-amphibienflugboot-berijew-be-12/402616443,https://futurezone.at/digital-life/ukraine-krieg-russland-sowjetisches-amphibienflugboot-berijew-be-12/402616443,0,futurezone.at,Ukraine-Krieg: Russland setzt auf sowjetisches Amphibienflugboot,Die in den 1950ern entworfene Berijew Be-12 kommt laut Geheimdienstangaben im Kampf gegen die Ukraine zum Einsatz.,https://image.futurezone.at/images/facebook/8203107/46-147959988.jpg,2023-10-02T17:48:11Z,,"02.10.2023
Die in den 1950ern entworfene Berijew Be-12 kommt laut Geheimdienstangaben im Kampf gegen die Ukraine zum Einsatz.",,de,'Krieg'
https://www.morgenpost.de/politik/article239713801/ukraine-krieg-panzer-waffen-attrappe-firma-tschechien.html,https://www.morgenpost.de/politik/article239713801/ukraine-krieg-panzer-waffen-attrappe-firma-tschechien.html,0,www.morgenpost.de,Aufblasbare Panzer : Heiße Luft gegen Putin: Firma mit besonderem Geschäftsmodell,Zur Kriegslist gehört täuschen. Eine tschechische Firma hat ihre Nische gefunden: aufblasbare Attrappen. Mit heißer Luft gegen Putin?,https://img.morgenpost.de/img/frontpage/crop239714763/9232605251-w820-cv16_9-q85/dpa-Picture-Alliance-2.jpg,2023-10-02T19:10:59Z,,"Berlin. Die Auftragsbücher sind voll, Umsatz und Gewinne steigen. Das Portfolio von ""Inflatech"": Panzer, Radargeräte, Raketenwerfer, Flugzeuge. Und trotzdem ist es kein Rüstungsunternehmen.
Denn die… [+3969 chars]",,de,'Krieg'
https://www.bild.de/politik/inland/politik-inland/iran-liefert-grad-raketen-neue-waffen-fuer-putins-armee-im-ukraine-krieg-85607566.bild.html,https://www.bild.de/politik/inland/politik-inland/iran-liefert-grad-raketen-neue-waffen-fuer-putins-armee-im-ukraine-krieg-85607566.bild.html,0,www.bild.de,Russen-Video beweist - Neue Waffen für Putins Armee!,"Das iranische Regime liefert Waffen an Russland. Ein neues Armee-Video aus Moskau beweist, dass darunter jetzt auch 20-Kilometer-Reichweite Raketen sind.","https://images.bild.de/651a7ed6db249362a2bf29a2/e29f6f54ece184d35ab320ce62298adf,9ebe98c5?w=1280",2023-10-02T19:19:55Z,,"Neue Waffen für Putins Krieg gegen die Ukraine! Und diesmal kommen sie aus dem Iran.
Lange kursierten Gerüchte: Jetzt ist es bittere Realität. Das iranische Regime liefert Grad-Raketen an die russis… [+2377 chars]",,de,'Krieg'
https://www.tagesschau.de/ausland/korrespondenten/slowakei-regierungsbildung-100.html,https://www.tagesschau.de/ausland/korrespondenten/slowakei-regierungsbildung-100.html,0,www.tagesschau.de,Warum der slowakische Fico die EU in Alarmbereitschaft versetzt,"Noch ist unklar, ob es dem slowakischen Wahlsieger Fico gelingen wird, eine Regierungskoalition zu bilden. Wenn es soweit kommt, dürfte die Geschlossenheit in der EU beim Thema Ukraine-Krieg auf dem Spiel steht. Von Matthias Reiche.",https://images.tagesschau.de/image/efa1f752-06db-481c-b7de-c55adff3e126/AAABiuvfqeo/AAABibBxqrQ/16x9-1280/robert-fico-114.jpg,2023-10-02T19:43:19Z,,"Stand: 02.10.2023 21:43 Uhr
Noch ist unklar, ob es dem slowakischen Wahlsieger Fico gelingen wird, eine Regierungskoalition zu bilden. Wenn es soweit kommt, dürfte die Geschlossenheit in der EU beim… [+3106 chars]",,de,'Krieg'
https://www.tagesspiegel.de/gesellschaft/medien/doku-uber-otfried-preussler-ein-gespenst-ein-hotzenplotz-ein-krieg-10545760.html,https://www.tagesspiegel.de/gesellschaft/medien/doku-uber-otfried-preussler-ein-gespenst-ein-hotzenplotz-ein-krieg-10545760.html,0,www.tagesspiegel.de,"Doku über Otfried Preußler: Ein Gespenst, ein Hotzenplotz, ein Krieg","Eine neue Dokumentation über Otfried Preußler zeigt auch, dass ein Buch des Schriftstellers neu gelesen werden kann.",https://www.tagesspiegel.de/images/otfried-preussler/alternates/BASE_16_9_W1400/otfried-preussler.jpeg,2023-10-02T20:36:41Z,,"Es sind Figuren der Kindheit: Das kleine Gespenst, Die kleine Hexe und natürlich Der Räuber Hotzenplotz. Figuren, mit denen inzwischen mehrere Generationen groß geworden sind. Figuren letztlich auch,… [+2217 chars]",,de,'Krieg'
https://www.n-tv.de/politik/20-46-Naechstes-EU-Land-schliesst-Grenze-fuer-russische-Autos--article24437877.html,https://www.n-tv.de/politik/20-46-Naechstes-EU-Land-schliesst-Grenze-fuer-russische-Autos--article24437877.html,0,www.n-tv.de,Ukraine-Krieg im Liveticker: +++ 20:46 Nächstes EU-Land schließt Grenze für russische Autos +++,Lesen Sie alle aktuellen Entwicklungen und Nachrichten über den russischen Angriffskrieg auf die Ukraine im Liveticker von ntv.de.,https://bilder2.n-tv.de/img/incoming/crop23332537/9041326157-cImg_16_9-w1200/Liveticker1-grau-1-Kopie.jpg,2023-10-02T21:38:45Z,https://web.archive.org/web/20231004013355/https://www.n-tv.de/politik/20-46-Naechstes-EU-Land-schliesst-Grenze-fuer-russische-Autos--article24437877.html,Nach mehreren anderen europäischen Staaten schließt nun auch Bulgarien seine Grenzen für in Russland zugelassene Autos. Das Verbot soll nach Angaben der bulgarischen Grenzpolizei bereits in Kraft sei… [+23655 chars],,de,'Krieg'
https://orf.at/stories/3333306/,https://orf.at/stories/3333306/,0,orf.at,Konflikt mit Serbien: Kosovo warnt vor neuem Krieg,,https://orf.at/mojo/1_4_1/storyserver//news/common/images/og-fallback-news.png,2023-10-02T21:58:06Z,,Im Zusammenhang mit den sich verschärfenden Spannungen im Kosovo warnt die kosovarische Außenministerin Donika Gervalla-Schwarz vor einem neuen Krieg auf dem Balkan. Toleriert die internationale Geme… [+227 chars],,de,'Krieg'
https://www.basicthinking.de/blog/2023/10/03/lebenshaltungskosten-rom/,https://www.basicthinking.de/blog/2023/10/03/lebenshaltungskosten-rom/,0,www.basicthinking.de,Wohnen und Leben: So hoch sind die Lebenshaltungskosten in Rom,Die Inflation macht vielen Mensch zu schaffen. Die Energiekrise scheint sich zwar zu entspannen und die Inflationsrate sinkt allmählich. Doch vor allem die Lebensmittelpreise sind nach wie vor hoch – von den Mieten ganz zu schweigen. Aber wie hoch sind eigent…,https://www.basicthinking.de/blog/wp-content/uploads/2023/09/lebenshaltungskosten-rom.jpg,2023-10-03T04:06:28Z,,Die Inflation macht vielen Mensch zu schaffen. Die Energiekrise scheint sich zwar zu entspannen und die Inflationsrate sinkt allmählich. Doch vor allem die Lebensmittelpreise sind nach wie vor hoch v… [+3432 chars],,de,'Inflation'
https://www.zeit.de/news/2023-10/03/schwerpunkt-frauengesundheit-in-bayern-ab-2024,https://www.zeit.de/news/2023-10/03/schwerpunkt-frauengesundheit-in-bayern-ab-2024,0,www.zeit.de,Gesundheit: Schwerpunkt Frauengesundheit in Bayern ab 2024,,,2023-10-03T09:28:04Z,,"When browsing with ads:
We collect personal data and also transmit it to third-party providers
 that help us improve and finance our digital content. Some of the information stored on your device, … [+821 chars]",,de,'Bayern'
https://www.zeit.de/news/2023-10/03/nobelpreistraeger-ferenc-krausz-in-bayern-voellig-ueberrascht,https://www.zeit.de/news/2023-10/03/nobelpreistraeger-ferenc-krausz-in-bayern-voellig-ueberrascht,0,www.zeit.de,Physiker: Nobelpreisträger Ferenc Krausz in Bayern völlig überrascht,,,2023-10-03T12:02:23Z,,"When browsing with ads:
We collect personal data and also transmit it to third-party providers
 that help us improve and finance our digital content. Some of the information stored on your device, … [+821 chars]",,de,'Bayern'
"https://www.gamestar.de/videos/torn-away-erzaehlt-die-harte-geschichte-eines-kindes-waehrend-des-zweiten-weltkriegs,127087.html","https://www.gamestar.de/videos/torn-away-erzaehlt-die-harte-geschichte-eines-kindes-waehrend-des-zweiten-weltkriegs,127087.html",0,www.gamestar.de,Torn Away erzählt die harte Geschichte eines Kindes während des Zweiten Weltkriegs,"Torn Away schickt euch in das vom Krieg zerst&ouml;rte Europa. Ihr begleitet die kleine Asya, die ein Arbeitslager &uuml;berlebt hat und nun versucht, nach Hause zur&uuml;ckzukehren. Eure Entscheidungen im Spiel werden dabei &uuml;ber ihr weiteres Schicksal e…",https://images.cgames.de/images/gamestar/4/torn-away-erzählt-die-harte-geschichte-eines-kindes-während-des-zweiten-weltkriegs_6255573.jpg,2023-10-03T15:02:00Z,,"Torn Away schickt euch in das vom Krieg zerstörte Europa. Ihr begleitet die kleine Asya, die ein Arbeitslager überlebt hat und nun versucht, nach Hause zurückzukehren. Eure Entscheidungen im Spiel we… [+493 chars]",,de,'Krieg'
https://www.stern.de/politik/ausland/krieg--ukraine--biden-beraet-sich-mit-vertretern-von-g7--nato--eu--33880564.html,https://www.stern.de/politik/ausland/krieg--ukraine--biden-beraet-sich-mit-vertretern-von-g7--nato--eu--33880564.html,0,www.stern.de,"Krieg: Ukraine: Biden berät sich mit Vertretern von G7, Nato, EU",Der US-Präsident hat mit führenden Vertreter von Verbündeten und Partnern weitere Hilfen für die Ukraine besprochen. Vertreter der EU zeigen sich zufrieden.,https://image.stern.de/33880566/t/Dn/v1/w1440/r1.7778/-/03--urnnewsmldpacom2009010123100399427513v3w800h600l478t69r1758b922jpeg---58ddabc8f1e98e5b.jpg,2023-10-03T15:49:56Z,,"Der US-Präsident hat mit führenden Vertreter von Verbündeten und Partnern weitere Hilfen für die Ukraine besprochen. Vertreter der EU zeigen sich zufrieden.
US-Präsident Joe Biden hat eine Reihe der… [+1274 chars]",,de,'Krieg'
https://www.zeit.de/news/2023-10/03/ukraine-biden-beraet-sich-mit-vertretern-von-g7-nato-eu,https://www.zeit.de/news/2023-10/03/ukraine-biden-beraet-sich-mit-vertretern-von-g7-nato-eu,0,www.zeit.de,"Krieg: Ukraine: Biden berät sich mit Vertretern von G7, Nato, EU",,,2023-10-03T15:49:56Z,,"When browsing with ads:
We collect personal data and also transmit it to third-party providers
 that help us improve and finance our digital content. Some of the information stored on your device, … [+821 chars]",,de,'Krieg'
https://www.morgenpost.de/politik/ausland/article239722881/Ukraine-Biden-beraet-sich-mit-Vertretern-von-G7-Nato-EU.html,https://www.morgenpost.de/politik/ausland/article239722881/Ukraine-Biden-beraet-sich-mit-Vertretern-von-G7-Nato-EU.html,0,www.morgenpost.de,"Krieg: Ukraine: Biden berät sich mit Vertretern von G7, Nato, EU",Der US-Präsident hat mit führenden Vertreter von Verbündeten und Partnern weitere Hilfen für die Ukraine besprochen. Vertreter der EU zeigen sich zufrieden.,https://img.morgenpost.de/img/ausland/crop239722875/8812603539-w820-cv16_9-q85/US-Praesident-Biden.jpg,2023-10-03T15:49:56Z,,"Washington. US-Präsident Joe Biden hat eine Reihe der wichtigsten Vertreter von Verbündeten und Partnern zusammengerufen, um weitere Unterstützung für die Ukraine zu koordinieren. Bei einer Telefonko… [+1240 chars]",,de,'Krieg'
https://www.bild.de/regional/hamburg/hamburg-aktuell/mehr-als-700-000-besucher-deutschland-zu-gast-bei-freunden-85623004.bild.html,https://www.bild.de/regional/hamburg/hamburg-aktuell/mehr-als-700-000-besucher-deutschland-zu-gast-bei-freunden-85623004.bild.html,0,www.bild.de,Einheits-Fest in Hamburg - Deutschland zu Gast bei Freunden,"Deutschland zu Gast bei Freunden. Hamburg richtete die Feierlichkeiten zum „Tag der Deutschen Einheit"" aus. Chance genutzt. 700 000 Besucher kamen.","https://images.bild.de/651c0f74acab435a160e8502/ad03431751ff31cce4caab4341f04a2f,fcf232f5?w=1280",2023-10-03T15:52:56Z,,"Hamburg Die Elbmetropole im Einheits-Rausch!
Alle 16 Jahre darf Hamburg die Feierlichkeiten zum Tag der Deutschen Einheit ausrichten. Chance genutzt! 
Bereits am Montag brach die Vorfeier zum Tag d… [+2094 chars]",,de,'Gas'
https://www.n-tv.de/politik/18-05-Selenskyj-begutachtet-Leopard-Panzer-an-der-Front--article24439172.html,https://www.n-tv.de/politik/18-05-Selenskyj-begutachtet-Leopard-Panzer-an-der-Front--article24439172.html,0,www.n-tv.de,Ukraine-Krieg im Liveticker: +++ 18:05 Selenskyj begutachtet Leopard-Panzer an der Front +++,Lesen Sie alle aktuellen Entwicklungen und Nachrichten über den russischen Angriffskrieg auf die Ukraine im Liveticker von ntv.de.,https://bilder2.n-tv.de/img/incoming/crop23332537/9041326157-cImg_16_9-w1200/Liveticker1-grau-1-Kopie.jpg,2023-10-03T16:05:00Z,,Bei seinem Truppenbesuch im Frontabschnitt Kupjansk nimmt der ukrainische Präsident Selenskyj nach offiziellen Angaben auch den Panzer Leopard 2 in Augenschein. Auf einem auf seinem Telegram-Kanal ve… [+20283 chars],,de,'Krieg'
