index,url,valid,domain,title,description,image,published,archive,content,quote,language,keyword
https://www.zeit.de/news/2024-07/01/wuetende-proteste-ultraorthodoxer-israelis-gegen-wehrpflicht,https://www.zeit.de/news/2024-07/01/wuetende-proteste-ultraorthodoxer-israelis-gegen-wehrpflicht,0,www.zeit.de,Krieg in Nahost: Wütende Proteste ultraorthodoxer Israelis gegen Wehrpflicht,Hier finden Sie Informationen zu dem Thema „Lage im Überblick“. Lesen Sie jetzt „Tausende ultraorthodoxe Juden protestieren gegen Wehrpflicht“.,https://img.zeit.de/news/2024-07/01/wuetende-proteste-ultraorthodoxer-israelis-gegen-wehrpflicht-image-group/wide__1300x731,2024-07-01T02:04:18Z,,In Israel haben Tausende ultraorthodoxe Männer gegen die gerichtlich verfügte Verpflichtung zum Wehrdienst in der israelischen Armee protestiert. Laut örtlichen Medienberichten kam es gestern Abend i… [+1562 chars],,de,'Krieg'
https://orf.at/stories/3362230/,https://orf.at/stories/3362230/,0,orf.at,WIFO-Prognose: Inflation erst Mitte 2026 bei zwei Prozent,,https://orf.at/mojo/1_4_1/storyserver//news/common/images/og-fallback-news.png,2024-07-01T05:15:51Z,,"Das Österreichisches Institut für Wirtschaftsforschung (WIFO) rechnet damit, dass die Inflation in Österreich erst Mitte 2026 auf den Zielwert der Europäischen Zentralbank (EZB) von zwei Prozent sink… [+1076 chars]",,de,'Inflation'
https://www.tagesspiegel.de/wirtschaft/finanzen/nach-anstieg-der-teuerungsrate-im-mai-deutsche-inflationsrate-im-juni-auf-22-prozent-gesunken-11932799.html,https://www.tagesspiegel.de/wirtschaft/finanzen/nach-anstieg-der-teuerungsrate-im-mai-deutsche-inflationsrate-im-juni-auf-22-prozent-gesunken-11932799.html,0,www.tagesspiegel.de,"Nach Anstieg der Teuerungsrate im Mai: Deutsche Inflationsrate im Juni auf 2,2 Prozent gesunken",Die extrem hohen Inflationsraten der vergangenen beiden Jahre sind inzwischen passé. Doch der Rückgang der Teuerung ist ins Stocken geraten.,https://www.tagesspiegel.de/wirtschaft/images/inflationsrate-in-deutschland/alternates/BASE_16_9_W1400/inflationsrate-in-deutschland.jpeg,2024-07-01T05:19:07Z,,"Die Inflation in Deutschland ist wieder auf dem Rückzug. Die Verbraucherpreise stiegen im Juni durchschnittlich mit 2,2 Prozent nicht mehr so stark wie im Mai mit 2,4 Prozent, wie das Statistische Bu… [+2226 chars]",,de,'Inflation'
https://www.zeit.de/news/2024-07/01/gericht-verfassungsschutz-darf-afd-in-bayern-beobachten,https://www.zeit.de/news/2024-07/01/gericht-verfassungsschutz-darf-afd-in-bayern-beobachten,0,www.zeit.de,Urteil: Gericht: Verfassungsschutz darf AfD in Bayern beobachten,Hier finden Sie Informationen zu dem Thema „Urteil“. Lesen Sie jetzt „Gericht: Verfassungsschutz darf AfD in Bayern beobachten“.,https://img.zeit.de/news/2024-07/01/gericht-verfassungsschutz-darf-afd-in-bayern-beobachten-image-group/wide__1300x731,2024-07-01T08:38:14Z,,Der Bayerische Verfassungsschutz darf die AfD als rechtsextremistischen Verdachtsfall beobachten. Das hat das Verwaltungsgericht München entschieden. Eine Klage der bayerischen AfD gegen die Beobacht… [+1986 chars],,de,'Bayern'
https://www.focus.de/finanzen/boerse/automatisierung-und-nachhaltigkeit-elon-musk-enthuellt-revolutionaere-plaene-und-will-tesla-neu-ausrichten_id_260097662.html,https://www.focus.de/finanzen/boerse/automatisierung-und-nachhaltigkeit-elon-musk-enthuellt-revolutionaere-plaene-und-will-tesla-neu-ausrichten_id_260097662.html,0,www.focus.de,Automatisierung und Nachhaltigkeit - Elon Musk enthüllt revolutionäre Pläne und will Tesla neu ausrichten,Tesla-Gründer Elon Musk plant einschneidende Änderungen bei Tesla: Der Schwerpunkt soll künftig auf Robotik und nachhaltiger Energie liegen. Ziel ist die Automatisierung in Fabriken und Haushalten.,https://p6.focus.de/img/fotos/id_259983462/elon-musk.jpg?im=Crop%3D%280%2C45%2C1440%2C720%29%3BResize%3D%281200%2C627%29&impolicy=perceptual&quality=mediumHigh&hash=95781541c11b88a42118ece3934a978d185ba88b5931994cb313627b8d60b50d,2024-07-01T09:27:52Z,,Tesla-Gründer Elon Musk plant einschneidende Änderungen bei Tesla: Der Schwerpunkt soll künftig auf Robotik und nachhaltiger Energie liegen. Ziel ist die Automatisierung in Fabriken und Haushalten.Te… [+2568 chars],,de,'nachhaltige Energie'
https://www.focus.de/finanzen/boerse/automatisierung-und-nachhaltigkeit-elon-musk-enthuellt-revolutionaere-plaene-fuer-tesla_id_260097662.html,https://www.focus.de/finanzen/boerse/automatisierung-und-nachhaltigkeit-elon-musk-enthuellt-revolutionaere-plaene-fuer-tesla_id_260097662.html,0,www.focus.de,Automatisierung und Nachhaltigkeit - Elon Musk enthüllt revolutionäre Pläne und will Tesla neu ausrichten,"Tesla-CEO Elon Musk plant weitreichende Änderungen bei dem E-Auto-Konzern: Der Schwerpunkt soll künftig auf Robotik und nachhaltiger Energie liegen. Ziel ist die Automatisierung in Fabriken, aber auch Haushalten.",https://p6.focus.de/img/fotos/id_259983462/elon-musk.jpg?im=Crop%3D%280%2C45%2C1440%2C720%29%3BResize%3D%281200%2C627%29&impolicy=perceptual&quality=mediumHigh&hash=95781541c11b88a42118ece3934a978d185ba88b5931994cb313627b8d60b50d,2024-07-01T09:27:52Z,,"Tesla-CEO Elon Musk plant weitreichende Änderungen bei dem E-Auto-Konzern: Der Schwerpunkt soll künftig auf Robotik und nachhaltiger Energie liegen. Ziel ist die Automatisierung in Fabriken, aber auc… [+2566 chars]",,de,'Nachhaltige Energie'
"https://www.br.de/nachrichten/bayern/attacke-auf-polizisten-an-bahnhof-in-lauf-angreifer-erschossen,UHCBh5c","https://www.br.de/nachrichten/bayern/attacke-auf-polizisten-an-bahnhof-in-lauf-angreifer-erschossen,UHCBh5c",0,www.br.de,Bayern: Polizei tötet Angreifer nach Messerattacke,"Großeinsatz am Sonntagabend an einem Bahnhof im mittelfränkischen Lauf an der Pegnitz: Ein Mann griff drei Polizisten mit einem Messer an. Die Beamten schossen auf den Angreifer, dieser wurde dabei tödlich verletzt.",https://img.br.de/e23b33e8-471e-45a6-be5b-fd20709c03c7.jpeg?q=80&rect=210%2C7%2C1707%2C959&w=1600&h=900,2024-07-01T11:12:53Z,,"Nach einem Messerangriff auf drei Bundespolizisten im mittelfränkischen Lauf an der Pegnitz ist der mutmaßliche Angreifer getötet worden. Wie die Polizei am Sonntagabend mitteilte, ging der 34-jährig… [+1771 chars]",,de,'Bayern'
https://www.faz.net/aktuell/finanzen/finanzmarkt/deutsche-inflationsrate-im-juni-auf-2-2-prozent-gesunken-19825883.html,https://www.faz.net/aktuell/finanzen/finanzmarkt/deutsche-inflationsrate-im-juni-auf-2-2-prozent-gesunken-19825883.html,0,www.faz.net,"Deutsche Inflationsrate im Juni auf 2,2 Prozent gesunken","Die Teuerung in Deutschland hat das niedrigste Niveau seit rund drei Jahren erreicht, liegt jedoch weiterhin über der 2-Prozent-Marke. Das Ifo-Institut rechnet damit, dass dieses Ziel im August erreicht wird.",https://media1.faz.net/ppmedia/aktuell/4176149456/1.9826279/facebook_teaser/die-inflation-macht-sich.jpg,2024-07-01T12:15:59Z,,"Die Inflation in Deutschland ist wieder auf dem Rückzug. Die Verbraucherpreise stiegen im Juni durchschnittlich mit 2,2 Prozent nicht mehr so stark wie im Mai mit 2,4 Prozent, wie das Statistische Bu… [+2238 chars]",,de,'Inflation'
https://www.tagesschau.de/wirtschaft/verbraucher/inflation-verbaucherpreise-100.html,https://www.tagesschau.de/wirtschaft/verbraucher/inflation-verbaucherpreise-100.html,0,www.tagesschau.de,"Inflation in Deutschland im Juni auf 2,2 Prozent gesunken","Die Inflation in Deutschland ist nach einem Anstieg im Mai wieder gesunken. Vor einem Jahr lag sie noch bei 6,4 Prozent. Die EZB strebt für den Euroraum eine Teuerungsrate von zwei Prozent an.",https://images.tagesschau.de/image/1d8cbcf6-4592-4232-b48c-d107ae434fd4/AAABkG42i0c/AAABjwnlFvA/16x9-1280/inflation-preise-104.jpg,2024-07-01T12:47:13Z,,"Stand: 01.07.2024 14:47 Uhr
Die Inflation in Deutschland ist nach einem Anstieg im Mai wieder gesunken. Vor einem Jahr lag sie noch bei 6,4 Prozent. Die EZB strebt für den Euroraum eine Teuerungsrat… [+2358 chars]",,de,'Inflation'
https://www.focus.de/earth/experten/expertin-viviane-raddatz-wunderloesung-fuer-die-energiewende-was-hinter-dem-wasserstoff-hype-steckt_id_260098975.html,https://www.focus.de/earth/experten/expertin-viviane-raddatz-wunderloesung-fuer-die-energiewende-was-hinter-dem-wasserstoff-hype-steckt_id_260098975.html,0,www.focus.de,Expertin Viviane Raddatz - Wunderlösung für die Energiewende? Was hinter dem Wasserstoff-Hype steckt,"Wasserstoff ist das Gold der Energiewende. Oder? Zumindest ist es aktuell vielleichteiner der größten Hypes, wenn es um den nachhaltigen Wandel aller Wirtschaftsbereiche hin zur Klimaneutralität geht. Doch was steckt hinter dem Hype um das Gold der Energiewen…",https://p6.focus.de/img/regional/rheinland-pfalz/id_260026935/eine-rohrleitung-ist-in-der-brennstoffzelle-eines-wasserstoff-kraftwerks..jpg?im=Crop%3D%280%2C177%2C2048%2C1024%29%3BResize%3D%281200%2C627%29&impolicy=perceptual&quality=mediumHigh&hash=2e38225cf1bad81c025cc22f4cd3f357c18270c0d1ff3a6ca0bcbf2b7e07c5bf,2024-07-01T13:03:33Z,,"Wasserstoff ist das Gold der Energiewende. Oder? Zumindest ist es aktuell vielleicht einer der größten Hypes, wenn es um den nachhaltigen Wandel aller Wirtschaftsbereiche hin zur Klimaneutralität geh… [+10136 chars]",,de,'Nachhaltige Energie'
https://www.tagesschau.de/wirtschaft/verbraucher/inflation-lebensmittel-preisanstieg-100.html,https://www.tagesschau.de/wirtschaft/verbraucher/inflation-lebensmittel-preisanstieg-100.html,0,www.tagesschau.de,Wie teuer Lebensmittel seit 2020 geworden sind,"Besonders im Supermarkt merken Verbraucher die Inflation. Neue Daten zeigen nun, wie stark die Lebensmittelpreise seit 2020 schon gestiegen sind - und welche Produkt sich besonders verteuert haben.",https://images.tagesschau.de/image/c746b1d5-7fed-49c1-b7f8-76f474038609/AAABkG3kqFs/AAABjwnlFvA/16x9-1280/inflation-einkauf-102.jpg,2024-07-01T13:28:52Z,,"Stand: 01.07.2024 15:28 Uhr
Besonders im Supermarkt merken Verbraucher die Inflation. Neue Daten zeigen nun, wie stark die Lebensmittelpreise seit 2020 schon gestiegen sind - und welche Produkt sich… [+3217 chars]",,de,'Inflation'
https://www.zeit.de/news/2024-07/01/inflation-faellt-auf-2-2-prozent-dienstleistungen-teurer,https://www.zeit.de/news/2024-07/01/inflation-faellt-auf-2-2-prozent-dienstleistungen-teurer,0,www.zeit.de,"Verbraucherpreise: Inflation fällt auf 2,2 Prozent - Dienstleistungen teurer","Hier finden Sie Informationen zu dem Thema „Verbraucherpreise“. Lesen Sie jetzt „Inflation fällt auf 2,2 Prozent -“.",https://img.zeit.de/news/2024-07/01/inflation-faellt-auf-2-2-prozent-dienstleistungen-teurer-image-group/wide__1300x731,2024-07-01T13:29:46Z,,"Die Inflation in Deutschland lässt wieder nach. Im Juni lagen die Verbraucherpreise um 2,2 Prozent über dem Niveau des Vorjahresmonats - nach 2,4 Prozent im Mai, wie das Statistische Bundesamt auf Ba… [+4447 chars]",,de,'Inflation'
https://www.stern.de/news/verbraucherpreise--inflation-faellt-auf-2-2-prozent---34843530.html,https://www.stern.de/news/verbraucherpreise--inflation-faellt-auf-2-2-prozent---34843530.html,0,www.stern.de,"Verbraucherpreise: Inflation fällt auf 2,2 Prozent -","Wiesbaden - Die Inflation in Deutschland sinkt spürbar. Im Juni lagen die Verbraucherpreise um 2,2 Prozent über dem Niveau des Vorjahresmonats - nach",https://image.stern.de/34843830/t/ba/v1/w1440/r1.7778/-/01--xuf7um6dsnv1axw800h600jpeg---b9840e5707c0bcdb.jpg,2024-07-01T13:29:46Z,,"Nach Jahren extrem hoher Inflation normalisiert sich die Teuerung. Im Juni ist die Inflation deutlich gesunken. Spielt die Fußball-EM eine Rolle?
Die Inflation in Deutschland sinkt spürbar. Im Juni … [+4920 chars]",,de,'Inflation'
https://www.faz.net/aktuell/finanzen/finanzmarkt/boersen-was-anleger-jetzt-wissen-muessen-19826399.html,https://www.faz.net/aktuell/finanzen/finanzmarkt/boersen-was-anleger-jetzt-wissen-muessen-19826399.html,0,www.faz.net,Börsen in turbulenten Zeiten: Was Anleger jetzt wissen müssen,"Sorgen um Biden, Wahlen in Frankreich – die Börsen müssen derzeit einiges schlucken. Doch die Halbjahresbilanz fällt gut aus. Und die gesunkene Inflation macht optimistisch.",https://media0.faz.net/ppmedia/aktuell/3933504357/1.9826420/facebook_teaser_fplus/hat-gut-lachen-der-anfuehrer.jpg,2024-07-01T13:37:26Z,,"Noch ist nichts entschieden: Erst 75 der 577 Sitze der französischen Nationalversammlung sind in der ersten Runde am Sonntag vergeben worden, der große Rest folgt am kommenden Sonntag. Doch viele Ind… [+504 chars]",,de,'Inflation'
https://www.faz.net/aktuell/feuilleton/debatten/frankreich-wahlen-extremismus-am-rechten-und-linken-rand-19826462.html,https://www.faz.net/aktuell/feuilleton/debatten/frankreich-wahlen-extremismus-am-rechten-und-linken-rand-19826462.html,0,www.faz.net,Frankreich: Sind die Ränder in ihrem Extremismus vergleichbar?,Mélenchons linke Partei La France Insoumise hofiert Autokraten wie Putin. Aber Marine Le Pens rechter Rassemblement National will die Demokratie zerstören.,https://media0.faz.net/ppmedia/aktuell/feuilleton/454260026/1.8332892/facebook_teaser/chef-der-linkpopulistischen.jpg,2024-07-01T14:27:08Z,,"Patrick Martin, Präsident der Arbeitgeberorganisation Medef, hatte den rechten RN und die Linkskoalition Nouveau Front populaire (NFP) mit derselben Etikette Extremismus abgefertigt. Dagegen haben si… [+3138 chars]",,de,'Putin'
https://taz.de/Inflation-bei-22-Prozent/!6017918/,https://taz.de/Inflation-bei-22-Prozent/!6017918/,0,taz.de,"Inflation bei 2,2 Prozent: Gewinne auf Kosten der Löhne",Trotz niedrigerer Inflation wird Ende 2024 der Reallohnverlust wegen der Energiekrise nicht ausgeglichen sein. Der Lohnanteil am Volkseinkommen sank.,https://taz.de/picture/7094850/948/35705973-1.jpeg,2024-07-01T15:01:00Z,,"Trotz niedrigerer Inflation wird Ende 2024 der Reallohnverlust wegen der Energiekrise nicht ausgeglichen sein. Der Lohnanteil am Volkseinkommen sank.
Die Reallöhne werden Ende des Jahres voraussicht… [+2234 chars]",,de,'Inflation'
https://www.welt.de/wirtschaft/video252296352/Inflation-faellt-auf-2-2-Prozent-Chefvolkswirt-Joerg-Kraemer-Nicht-zu-frueh-jubeln.html,https://www.welt.de/wirtschaft/video252296352/Inflation-faellt-auf-2-2-Prozent-Chefvolkswirt-Joerg-Kraemer-Nicht-zu-frueh-jubeln.html,0,www.welt.de,Chefvolkswirt Jörg Krämer - „Nicht zu früh jubeln“,"Die Inflation in Deutschland sinkt spürbar. Im Juni lagen die Verbraucherpreise um 2,2 Prozent über dem Niveau des Vorjahresmonats - nach 2,4 Prozent im Mai. Darüber spricht Jörg Krämer, Chefvolkswirt Commerzbank, in der Börse am Abend bei WELT TV.",https://img.welt.de/img/videos/mobile252296840/9291357827-ci16x9-w1200/Kraemer-Chefvolksirt-jpg.jpg,2024-07-01T16:16:52Z,,"Die WELT als ePaper: Die vollständige Ausgabe steht Ihnen bereits am Vorabend zur Verfügung so sind Sie immer hochaktuell informiert. Weitere Informationen: http://epaper.welt.de 
 Der Kurz-Link die… [+49 chars]",,de,'Inflation'
https://www.faz.net/aktuell/finanzen/lagarde-die-arbeit-der-ezb-ist-noch-nicht-getan-19826758.html,https://www.faz.net/aktuell/finanzen/lagarde-die-arbeit-der-ezb-ist-noch-nicht-getan-19826758.html,0,www.faz.net,Lagarde: Die Arbeit ist noch nicht getan,"In Sintra in Portugal hat das EZB-Forum begonnen, ein großes jährliches Notenbanktreffen. EZB-Präsidentin Lagarde sagt, die Notenbank werde nicht ruhen, bis die Inflation zurück bei 2 Prozent sei.",https://media1.faz.net/ppmedia/aktuell/finanzen/3006148606/1.9819221/facebook_teaser/sintra.jpg,2024-07-01T18:56:04Z,,"Auf dem Notenbanker-Treffen vor einem Jahr hatte Lagarde die Pläne für eine erste Zinssenkung im Sommer 2024 angedeutet. Dieses Jahr äußerte sie sich zurückhaltender und ließ offen, ob die Zentralban… [+2095 chars]",,de,'Inflation'
https://www.n-tv.de/wirtschaft/EZB-Chefin-Lagarde-Kampf-gegen-Inflation-noch-nicht-geschafft-article25056387.html,https://www.n-tv.de/wirtschaft/EZB-Chefin-Lagarde-Kampf-gegen-Inflation-noch-nicht-geschafft-article25056387.html,0,www.n-tv.de,"""Sanfte Landung"" gelingt selten: EZB-Chefin Lagarde: Kampf gegen Inflation noch nicht geschafft","Ist das Schlimmste nach dem Inflationsschock überwunden? Nach Einschätzung der EZB-Präsidentin Christine Lagarde könnte die Wirtschaft doch noch neue angebotsseitige Schocks erleiden. Das zeige auch ein Blick auf vergangene Krisen, bei der ""sanfte Landungen"" …",https://bilder4.n-tv.de/img/incoming/crop25056391/3761329651-cImg_16_9-w1200/457412866.jpg,2024-07-01T22:02:15Z,,Ist das Schlimmste nach dem Inflationsschock überwunden? Nach Einschätzung der EZB-Präsidentin Christine Lagarde könnte die Wirtschaft doch noch neue angebotsseitige Schocks erleiden. Das zeige auch … [+1866 chars],,de,'Inflation'
https://www.tagesschau.de/wirtschaft/verbraucher/diebstahl-einzelhandel-100.html,https://www.tagesschau.de/wirtschaft/verbraucher/diebstahl-einzelhandel-100.html,0,www.tagesschau.de,Einzelhandel beklagt Anstieg von Ladendiebstählen,Einzelhändler in Deutschland beklagen einen Anstieg von Ladendiebstählen. Betroffen sind vor allem Supermärkte und Discounter. Experten sehen dafür mehrere Gründe: zum Beispiel wachsende Geldsorgen durch die Inflation - und Personalmangel.,https://images.tagesschau.de/image/289320a8-5847-4a87-92fa-bda1f4c13d84/AAABhoB7fXM/AAABjwnlFvA/16x9-1280/ladendiebstahl-105.jpg,2024-07-02T05:39:12Z,,"Stand: 02.07.2024 07:39 Uhr
Einzelhändler in Deutschland beklagen einen Anstieg von Ladendiebstählen. Betroffen sind vor allem Supermärkte und Discounter. Experten sehen dafür mehrere Gründe: zum Be… [+1817 chars]",,de,'Inflation'
https://www.stern.de/news/suedostasien--verbrauch-von-kohle-indonesiens-und-der-philippinen-steigt-34845184.html,https://www.stern.de/news/suedostasien--verbrauch-von-kohle-indonesiens-und-der-philippinen-steigt-34845184.html,0,www.stern.de,Südostasien: Verbrauch von Kohle Indonesiens und der Philippinen steigt,"In zwei der größten Volkswirtschaften Südostasiens nimmt die Abhängigkeit von Kohle als Energieträger weiter zu, während der Ausbau der Erneuerbaren schwächelt. In Indonesien erreichte der Kohle-Anteil an der Stromproduktion im vergangenen Jahr einen neuen Hö…",https://image.stern.de/34845186/t/0l/v1/w1440/r1.7778/-/02--kohlekraftwerk-in-indonesien---f650b631be9c6906.jpg,2024-07-02T06:38:12Z,,"In zwei der größten Volkswirtschaften Südostasiens nimmt die Abhängigkeit von Kohle als Energieträger weiter zu, während der Ausbau der Erneuerbaren schwächelt. In Indonesien erreichte der Kohle-Ante… [+1677 chars]",,de,'Abhängigkeit'
https://www.diepresse.com/18625694/inflation-sinkt-im-juni-auf-30-prozent,https://www.diepresse.com/18625694/inflation-sinkt-im-juni-auf-30-prozent,0,www.diepresse.com,"Inflation sinkt im Juni auf 3,0 Prozent","Damit sinkt die heimische Inflation auf den niedrigsten Wert seit fast drei Jahren. Vor allem Nahrungsmittel und Treibstoffe würden aktuell weniger preistreibend wirken, so die Statistik Austria in ihrer Schnellschätzung.",https://img.diepresse.com/public/incoming/ib9kgl-ABD0024.jpg/alternates/DPR_SOCIAL_NACHRICHTEN/ABD0024.jpg,2024-07-02T07:04:50Z,,"Damit sinkt die heimische Inflation auf den niedrigsten Wert seit fast drei Jahren. Vor allem Nahrungsmittel und Treibstoffe würden aktuell weniger preistreibend wirken.
Die Inflationsrate in Österr… [+805 chars]",,de,'Inflation'
https://www.nzz.ch/zuerich/windkraft-in-zuerich-regierungsrat-erachtet-20-standorte-als-sehr-geeignet-ld.1837542,https://www.nzz.ch/zuerich/windkraft-in-zuerich-regierungsrat-erachtet-20-standorte-als-sehr-geeignet-ld.1837542,0,www.nzz.ch,Windräder: Der Zürcher Regierungsrat erachtet nach Überprüfung der Kriterien 20 Standorte als sehr geeignet,Der Windenergieplan sieht im ganzen Kanton 52 Potenzialgebiete vor. Er liegt nun vier Monate lang für die öffentliche Anhörung auf.,"https://img.nzz.ch/2024/04/22/3c633f1d-0cb5-4168-9be8-296b000a12c4.jpeg?width=1200&height=674&fit=bounds&quality=75&auto=webp&crop=3341,1879,x337,y858&wmark=nzz",2024-07-02T08:02:42Z,,"Wie hier auf dem Pass Mont-Crosin im Berner Jura soll künftig auch im Kanton Zürich mit Windrädern Strom erzeugt werden.
Vor bald zwei Jahren informierte der Zürcher Baudirektor Martin Neukom (Grüne… [+2840 chars]",,de,'Windräder'
https://www.faz.net/aktuell/karriere-hochschule/hoersaal/bundeswehr-unis-studieren-fuer-den-ernstfall-19821284.html,https://www.faz.net/aktuell/karriere-hochschule/hoersaal/bundeswehr-unis-studieren-fuer-den-ernstfall-19821284.html,0,www.faz.net,Bundeswehrunis: Studieren für den Ernstfall,"Wenn die Kommilitonen Uniform tragen: Wer zur Bundeswehr und dann zur Uni geht, muss trotz Krieg und Krisen mit Skepsis rechnen. Passen Hochschule und Militär überhaupt zusammen?",https://media1.faz.net/ppmedia/aktuell/2024047709/1.9821283/facebook_teaser_fplus/studenten-der-universitaet-der.jpg,2024-07-02T08:04:21Z,,Donnerstagnachmittag auf dem Roten Platz im Hauptgebäude der Helmut-Schmidt-Universität (HSU): Nahe der Büste des ehemaligen Kanzlers und Verteidigungsministers stehen Studenten auf dem roten Boden i… [+504 chars],,de,'Krieg'
https://orf.at/stories/3362361/,https://orf.at/stories/3362361/,0,orf.at,Schnellschätzung: Inflation sinkt auf drei Prozent,,https://orf.at/mojo/1_4_1/storyserver//news/common/images/og-fallback-news.png,2024-07-02T08:06:53Z,,Die Inflationsrate in Österreich ist im Juni laut Schnellschätzung der Statistik Austria auf drei Prozent zurückgegangen. Das ist der niedrigste Wert seit Juli 2021. Im Mai belief sich die Teuerung i… [+773 chars],,de,'Inflation'
https://www.faz.net/aktuell/finanzen/entwicklung-der-preise-das-ende-der-gierflation-19805929.html,https://www.faz.net/aktuell/finanzen/entwicklung-der-preise-das-ende-der-gierflation-19805929.html,0,www.faz.net,Das Ende der Gierflation,Lange lautete der Vorwurf: Firmen missbrauchen die Inflation als Vorwand für übertriebene Preiserhöhungen. Jetzt ist davon nichts mehr zu sehen.,https://media0.faz.net/ppmedia/aktuell/2632360448/1.9827632/facebook_teaser_fplus/ob-sich-konzerne-an-der.jpg,2024-07-02T08:29:36Z,,"Neue Zeiten gehen oft mit neuen Begriffen einher. Als 2022 nach Jahrzehnten der Ruhe plötzlich hohe Preissteigerungen in Deutschland und in Europa wieder zum Thema wurden, da gab es ein neues Wort, d… [+150 chars]",,de,'Inflation'
https://www.tagesspiegel.de/wirtschaft/erste-schatzung-inflation-in-eurozone-sinkt-im-juni-auf-25-prozent-ab-11941802.html,https://www.tagesspiegel.de/wirtschaft/erste-schatzung-inflation-in-eurozone-sinkt-im-juni-auf-25-prozent-ab-11941802.html,0,www.tagesspiegel.de,"Erste Schätzung: Inflation in Eurozone sinkt im Juni auf 2,5 Prozent ab","Die Inflation in der Eurozone hat sich im Juni wieder auf 2,5 Prozent abgeschwächt. Der Preisanstieg im Jahresvergleich fiel damit 0,1 Prozentpunkte weniger stark aus als im Mai.",https://www.tagesspiegel.de/images/inflationsrate4/alternates/BASE_16_9_W1400/inflationsrate.jpeg,2024-07-02T09:11:54Z,,"Nach einem leichten Anstieg im Vormonat hat sich die Inflation in der Eurozone im Juni wieder auf 2,5 Prozent abgeschwächt. Der Preisanstieg im Jahresvergleich fiel damit 0,1 Prozentpunkte weniger st… [+235 chars]",,de,'Inflation'
https://www.tagesspiegel.de/wirtschaft/finanzen/verbraucherpreise-nahezu-unverandert-inflation-in-der-eurozone-schwacht-sich-leicht-auf-25-prozent-ab-11941802.html,https://www.tagesspiegel.de/wirtschaft/finanzen/verbraucherpreise-nahezu-unverandert-inflation-in-der-eurozone-schwacht-sich-leicht-auf-25-prozent-ab-11941802.html,0,www.tagesspiegel.de,"Verbraucherpreise nahezu unverändert: Inflation in der Eurozone schwächt sich leicht auf 2,5 Prozent ab","Die Teuerungsrate in der Eurozone sank im Juni leicht, Deutschland liegt mit seinem Wert im Schnitt der 21 Euro-Länder. Wesentlich schlechter sieht es hingegen in Belgien aus.",https://www.tagesspiegel.de/images/inflationsrate4/alternates/BASE_16_9_W1400/inflationsrate.jpeg,2024-07-02T09:11:54Z,,"Nach einem leichten Anstieg im Vormonat hat sich die Inflation in der Eurozone im Juni wieder auf 2,5 Prozent abgeschwächt. Der Preisanstieg im Jahresvergleich fiel damit 0,1 Prozentpunkte weniger st… [+2859 chars]",,de,'Inflation'
https://www.faz.net/aktuell/wirtschaft/daten-fuer-juni-inflation-im-euroraum-geht-wieder-leicht-zurueck-19827677.html,https://www.faz.net/aktuell/wirtschaft/daten-fuer-juni-inflation-im-euroraum-geht-wieder-leicht-zurueck-19827677.html,0,www.faz.net,Daten für Juni: Inflation im Euroraum geht wieder leicht zurück,"Im Juni ist die Teurerung in den Euro-Ländern auf 2,5 Prozent gesunken. Damit liegt sie weiter über dem Zielwert der Europäischen Zentralbank.",https://media1.faz.net/ppmedia/aktuell/wirtschaft/157418506/1.9827681/facebook_teaser/markt-in-teruel-spanien.jpg,2024-07-02T09:24:57Z,,"Noch im Mai hatte sich die Teuerungsrate auf 2,6 Prozent erhöht nach 2,4 Prozent im April. Für die Europäische Zentralbank (EZB) ist das Abflauen der Teuerung im Juni eine gute Nachricht. Sie kommt d… [+1349 chars]",,de,'Energiepreise'
