index,url,valid,domain,title,description,image,published,archive,content,quote,language,keyword
https://www.morgenpost.de/berlin/article241282938/Wetter-in-Berlin-Kaelte-Glaette-und-Schnee-prognostiziert.html,https://www.morgenpost.de/berlin/article241282938/Wetter-in-Berlin-Kaelte-Glaette-und-Schnee-prognostiziert.html,0,www.morgenpost.de,"Wetter in Berlin: Kälte, Glätte und Schnee prognostiziert",Die Temperaturen in Berlin und Brandenburg gehen in den Keller. Frost und Wolken und kühler Wind bestimmen die nächsten Tage.,https://img.sparknews.funkemedien.de/237427933/237427933_1704351807_v4_3_800.jpeg,2024-01-04T07:02:50Z,,"Berlin. Die Temperaturen in Berlin und Brandenburg gehen in den Keller. Frost und Wolken und kühler Wind bestimmen die nächsten Tage.
Berlin und Brandenburg müssen sich in der Nacht auf einen Temper… [+2067 chars]",,de,'Kälte'
https://www.zeit.de/news/2024-01/04/inflation-in-nrw-steigt-erstmals-seit-september,https://www.zeit.de/news/2024-01/04/inflation-in-nrw-steigt-erstmals-seit-september,0,www.zeit.de,Preise: Inflation in NRW steigt erstmals seit September,Hier finden Sie Informationen zu dem Thema „Preise“. Lesen Sie jetzt „Inflation in NRW steigt erstmals seit September“.,https://img.zeit.de/news/2024-01/04/inflation-in-nrw-steigt-erstmals-seit-september-image-group/wide__1300x731,2024-01-04T07:13:05Z,,"Die Inflation in Nordrhein-Westfalen hat sich erstmals seit September wieder verstärkt. Im bevölkerungsreichsten Bundesland stieg die Inflationsrate im Dezember auf 3,5 Prozent, wie das Statistische … [+1705 chars]",,de,'Inflation'
https://www.stern.de/gesellschaft/regional/nordrhein-westfalen/preise--inflation-in-nrw-steigt-erstmals-seit-september-34336216.html,https://www.stern.de/gesellschaft/regional/nordrhein-westfalen/preise--inflation-in-nrw-steigt-erstmals-seit-september-34336216.html,0,www.stern.de,Preise: Inflation in NRW steigt erstmals seit September,"Die Inflation in Nordrhein-Westfalen hat sich erstmals seit September wieder verstärkt. Im bevölkerungsreichsten Bundesland stieg die Inflationsrate im Dezember auf 3,5 Prozent, wie das Statistische Landesamt am Donnerstag in Düsseldorf mitteilte. Im November…",https://image.stern.de/34336218/t/lE/v1/w1440/r1.7778/-/04--urnnewsmldpacom2009010124010499487354v3w800h600l788t271r1538b1298jpeg---41a73de75341b226.jpg,2024-01-04T07:13:05Z,,"Die Inflation in Nordrhein-Westfalen hat sich erstmals seit September wieder verstärkt. Im bevölkerungsreichsten Bundesland stieg die Inflationsrate im Dezember auf 3,5 Prozent, wie das Statistische … [+1252 chars]",,de,'Inflation'
https://www.bild.de/politik/inland/politik-inland/waehler-befragt-diese-deutschen-freuen-sich-dass-energie-teurer-wird-86618092.bild.html,https://www.bild.de/politik/inland/politik-inland/waehler-befragt-diese-deutschen-freuen-sich-dass-energie-teurer-wird-86618092.bild.html,0,www.bild.de,"Wähler befragt - Diese Deutschen freuen sich, dass Energie teurer wird!","Fossile Energie (Gas, Benzin, Diesel) wird teurer. Wie reagieren Bürger 2024 auf die Mehrkosten? Nur die Hälfte der Bürger will sparen, ergab eine Umfrage","https://images.bild.de/65953593d8485933d0afca54/38185bb7aedea8a760eaf2d83019d92c,24e56a8a?w=1280",2024-01-04T08:58:02Z,,"Jeder dritte Deutsche will sich nach der Verteuerung fossiler Energieträger (Sprit, Gas) in diesem Jahr beim Tanken und Heizen zurückhalten.
Das ergab eine INSA-Umfrage im Auftrag von BILD. 
Demnac… [+1149 chars]",,de,'Gas'
https://www.zeit.de/news/2024-01/04/615-lotto-millionen-und-16-neue-millionaere-in-bayern,https://www.zeit.de/news/2024-01/04/615-lotto-millionen-und-16-neue-millionaere-in-bayern,0,www.zeit.de,Glücksspiel: 615 Lotto-Millionen und 16 neue Millionäre in Bayern,Hier finden Sie Informationen zu dem Thema „Glücksspiel“. Lesen Sie jetzt „615 Lotto-Millionen und 16 neue Millionäre in Bayern“.,https://img.zeit.de/administratives/sharing/fallback-image/wide__1300x731,2024-01-04T09:25:19Z,,Vom Glück begünstigte Lotto-Spieler haben im vergangenen Jahr im Freistaat insgesamt einen hohen dreistelligen Millionenbetrag eingestrichen. Alles in allem seien rund 615 Millionen Euro an Gewinnen … [+3154 chars],,de,'Bayern'
https://www.zeit.de/news/2024-01/04/inflation-steigt-auf-3-4-prozent-lebensmittel-teurer,https://www.zeit.de/news/2024-01/04/inflation-steigt-auf-3-4-prozent-lebensmittel-teurer,0,www.zeit.de,"Preise: Inflation steigt auf 3,4 Prozent: Lebensmittel teurer","Hier finden Sie Informationen zu dem Thema „Preise“. Lesen Sie jetzt „Inflation steigt auf 3,4 Prozent: Lebensmittel teurer“.",https://img.zeit.de/news/2024-01/04/inflation-steigt-auf-3-4-prozent-lebensmittel-teurer-image-group/wide__1300x731,2024-01-04T09:31:07Z,,"Die Inflation in Bayern hat im Dezember wieder angezogen. Die Preissteigerung betrug 3,4 Prozent nach 2,8 Prozent im November. Wie das Landesamt für Statistik am Donnerstag mitteilte, verteuerten sic… [+1276 chars]",,de,'Inflation'
https://www.sueddeutsche.de/bayern/bayern-rentner-kaufkraft-studie-1.6328145,https://www.sueddeutsche.de/bayern/bayern-rentner-kaufkraft-studie-1.6328145,0,www.sueddeutsche.de,Kaufkraft im Alter: Studie: Bayern für Rentner besonders ungünstig,"Wo es sich finanziell komfortabel lebt, hängt von zwei Faktoren ab: Einkommen und Lebenshaltungskosten. Was die Rentenkaufkraft betrifft, so steht nach einer neuen Studie die ältere Generation in Bayern schlecht da.",https://www.sueddeutsche.de/image/sz.1.6042021/1200x675?v=1704360775,2024-01-04T09:33:00Z,,Rentnerinnen und Rentner stehen nach einer neuen Studie in Bayern finanziell schlechter da als in anderen Regionen Deutschland. Besonders günstig war das Verhältnis von Wohnkosten und Renteneinkommen… [+2424 chars],,de,'Bayern'
https://www.zeit.de/news/2024-01/04/inflation-in-sachsen-anhalt-beschleunigt-sich-wieder,https://www.zeit.de/news/2024-01/04/inflation-in-sachsen-anhalt-beschleunigt-sich-wieder,0,www.zeit.de,Verbraucherpreise: Inflation in Sachsen-Anhalt beschleunigt sich wieder,Hier finden Sie Informationen zu dem Thema „Verbraucherpreise“. Lesen Sie jetzt „Inflation in Sachsen-Anhalt beschleunigt sich wieder“.,https://img.zeit.de/news/2024-01/04/inflation-in-sachsen-anhalt-beschleunigt-sich-wieder-image-group/wide__1300x731,2024-01-04T09:51:55Z,,Die Verbraucherpreise in Sachsen-Anhalt sind 2023 im Jahresschnitt um 6 Prozent gestiegen. Zum Jahresende beschleunigte sich die Teuerung wieder. Für Dezember ermittelte das Statistische Landesamt ei… [+1992 chars],,de,'Inflation'
https://www.stern.de/gesellschaft/regional/sachsen-anhalt/verbraucherpreise--inflation-in-sachsen-anhalt-beschleunigt-sich-wieder-34336642.html,https://www.stern.de/gesellschaft/regional/sachsen-anhalt/verbraucherpreise--inflation-in-sachsen-anhalt-beschleunigt-sich-wieder-34336642.html,0,www.stern.de,Verbraucherpreise: Inflation in Sachsen-Anhalt beschleunigt sich wieder,"Die Verbraucherpreise in Sachsen-Anhalt sind 2023 im Jahresschnitt um 6 Prozent gestiegen. Zum Jahresende beschleunigte sich die Teuerung wieder. Für Dezember ermittelte das Statistische Landesamt eine Inflationsrate von 3,5 Prozent. Im November waren die Ver…",https://image.stern.de/34336644/t/u4/v1/w1440/r1.7778/-/04--urnnewsmldpacom2009010124010499488878v3w800h600l640t446r1920b1338jpeg---139c4bfd701233f4.jpg,2024-01-04T09:51:55Z,,Die Verbraucherpreise in Sachsen-Anhalt sind 2023 im Jahresschnitt um 6 Prozent gestiegen. Zum Jahresende beschleunigte sich die Teuerung wieder. Für Dezember ermittelte das Statistische Landesamt ei… [+1645 chars],,de,'Inflation'
https://www.brigitte.de/leben/jogging-gadgets--das-brauchst-du-fuers-laufen-im-winter--13488544.html,https://www.brigitte.de/leben/jogging-gadgets--das-brauchst-du-fuers-laufen-im-winter--13488544.html,0,www.brigitte.de,Jogging Gadgets: So macht Laufen auch im Winter Spaß,Kalte Temperaturen sind kein Hindernis für passionierte Läufer:innen. Wir zeigen sieben günstige Jogging Gadgets für die dunkle Jahreszeit.,https://image.brigitte.de/13443832/t/Fu/v2/w1440/r1.7778/-/geschenke-laeufer.jpg,2024-01-04T10:15:00Z,,"Es ist dunkel, es ist nass, der Wind pfeift: Die Wintermonate sind für viele von uns die beste Ausrede, es sich nach getaner Arbeit auf der Couch gemütlich zu machen. Doch für viele Sportbegeisterte … [+3336 chars]",,de,'Kälte'
https://www.welt.de/wirtschaft/video249349894/Inflation-steigt-nach-Prognosen-weiter-Verbraucher-muessen-sich-auf-Preisanstiege-einstellen.html,https://www.welt.de/wirtschaft/video249349894/Inflation-steigt-nach-Prognosen-weiter-Verbraucher-muessen-sich-auf-Preisanstiege-einstellen.html,0,www.welt.de,Verbraucher müssen sich auf Preisanstiege einstellen,"Die Inflation steigt nach Prognosen wieder an. Volkswirte rechnen mit teureren Lebensmitteln und erhöhten Preisen für Fernwärme. Hermann-Josef Tenhagen, Chefredakteur „Finanztip“, gibt Ratschläge, wie Sie dennoch sparen können.",https://img.welt.de/img/wirtschaft/mobile249350092/4221354357-ci16x9-w1200/219346749-jpg.jpg,2024-01-04T10:22:35Z,,"Die WELT als ePaper: Die vollständige Ausgabe steht Ihnen bereits am Vorabend zur Verfügung so sind Sie immer hochaktuell informiert. Weitere Informationen: http://epaper.welt.de 
 Der Kurz-Link die… [+49 chars]",,de,'Inflation'
https://www.stern.de/gesellschaft/regional/baden-wuerttemberg/wetter--winter-meldet-sich-mit-schnee-und-kaelte-zurueck-34337052.html,https://www.stern.de/gesellschaft/regional/baden-wuerttemberg/wetter--winter-meldet-sich-mit-schnee-und-kaelte-zurueck-34337052.html,0,www.stern.de,Wetter: Winter meldet sich mit Schnee und Kälte zurück,Der Deutsche Wetterdienst erwartet am Wochenende Schneefall. Samstag wird wohl nur das Bergland betroffen sein. Sonntag könnte es dann in fast ganz Baden-Württemberg schneien.,https://image.stern.de/34337054/t/9n/v1/w1440/r1.7778/-/04--urnnewsmldpacom2009010124010499490070v3w800h600l640t478r1920b1438jpeg---5e89ba268ac3f7b8.jpg,2024-01-04T11:28:50Z,,"Der Deutsche Wetterdienst erwartet am Wochenende Schneefall. Samstag wird wohl nur das Bergland betroffen sein. Sonntag könnte es dann in fast ganz Baden-Württemberg schneien.
Der Deutsche Wetterdie… [+1749 chars]",,de,'Kälte'
https://www.zeit.de/news/2024-01/04/winter-meldet-sich-mit-schnee-und-kaelte-zurueck,https://www.zeit.de/news/2024-01/04/winter-meldet-sich-mit-schnee-und-kaelte-zurueck,0,www.zeit.de,Wetter: Winter meldet sich mit Schnee und Kälte zurück,Hier finden Sie Informationen zu dem Thema „Wetter“. Lesen Sie jetzt „Winter meldet sich mit Schnee und Kälte zurück“.,https://img.zeit.de/news/2024-01/04/winter-meldet-sich-mit-schnee-und-kaelte-zurueck-image-group/wide__1300x731,2024-01-04T11:28:50Z,,"Der Deutsche Wetterdienst (DWD) rechnet zum Ferienende am Wochenende mit leichtem Schneefall in Baden-Württemberg. Betroffen seien am Samstag Lagen oberhalb von etwa 500 Metern, wie Oberschwaben, das… [+2387 chars]",,de,'Kälte'
https://www.focus.de/earth/news/riesiges-potential-weltweit-heizen-mit-geothermie-aus-alter-kohlegrube-bochum-nutzt-altes-bergwerk_id_259547610.html,https://www.focus.de/earth/news/riesiges-potential-weltweit-heizen-mit-geothermie-aus-alter-kohlegrube-bochum-nutzt-altes-bergwerk_id_259547610.html,0,www.focus.de,Riesiges Potential weltweit - Heizen mit Geothermie aus alter Kohlegrube - Bochum nutzt altes Bergwerk,Mit Wärme aus alten Kohleschächten will die Stadt Bochum künftig einen neuen Stadtteil heizen. Das Potential ist riesig: In Zukunft könnten Städte weltweit so effizient versorgt werden. Ein Besuch auf der Baustelle.,https://p6.focus.de/img/auto/elektroauto/news/id_258381693/preise-fuer-geothermie-erhoeht-den-grund-akzeptieren-die-kunden-nicht.jpg?im=Crop%3D%280%2C45%2C1440%2C720%29%3BResize%3D%281200%2C627%29&impolicy=perceptual&quality=mediumHigh&hash=406dff61044c9ec36aa503fb677ec951102083f331d72f0283792be5667c7ea1,2024-01-04T11:35:04Z,,"Ein paar Gebäude des Innovationsquartiers Mark 51°7 in Bochum stehen schon, doch der größte Teil des früheren Industriegelände ist noch eine große Baustelle.
Wir stehen hier auf dem Geothermieplatz.… [+5388 chars]",,de,'Kälte'
https://www.sueddeutsche.de/medien/tatort-ludwigshafen-avatar-1.6328419,https://www.sueddeutsche.de/medien/tatort-ludwigshafen-avatar-1.6328419,0,www.sueddeutsche.de,"""Tatort"" mit Lena Odenthal: In der Kälte des Moments","In ""Avatar"" erzählen die Ludwigshafener davon, dass im Netz nicht nur Gefahren lauern. Sondern auch Trost und Mut.",https://www.sueddeutsche.de/image/sz.1.6328420/1200x675?v=1704376751,2024-01-04T13:59:14Z,,"Dieser Tatort vom SWR schlägt sozusagen Brücken von der Vergangenheit ins Futuristische. Vergangenheit sind jetzt, nach 25-jährigem Dauerdienst, die Sekretärin Edith Keller und der Kriminaltechniker … [+3058 chars]",,de,'Kälte'
https://www.nzz.ch/panorama/eine-arktische-kaelte-liegt-ueber-nordeuropa-ld.1772835,https://www.nzz.ch/panorama/eine-arktische-kaelte-liegt-ueber-nordeuropa-ld.1772835,0,www.nzz.ch,"Minus 43,1 Grad: Eine arktische Kälte liegt über Nordeuropa",Beobachtungen aus einem richtigen Winter.,"https://img.nzz.ch/2024/01/04/4ac52b34-bfa1-44e2-8d3b-37da04b5b4ad.jpeg?width=1200&height=675&fit=bound&quality=75&auto=webp&crop=5669,3189,x0,y296&wmark=nzz",2024-01-04T14:14:50Z,,"In Kiruna herrscht im Moment die arktische Temperatur von 39 Grad.
Die Kälte lässt den Atem stocken. Die eisige Luft kratzt in der Kehle, lässt die Augen tränen und die Haut kribbeln. Der Schal, übe… [+3746 chars]",,de,'Kälte'
https://www.n-tv.de/panorama/Auf-den-Dauerregen-folgt-klirrende-Kaelte-article24639392.html,https://www.n-tv.de/panorama/Auf-den-Dauerregen-folgt-klirrende-Kaelte-article24639392.html,0,www.n-tv.de,Unter minus 20 Grad möglich: Auf den Dauerregen folgt klirrende Kälte,In den Hochwasser-Gebieten regnet und regnet es. Laut dem ntv-Wetterexperten Björn Alexander halten die Niederschläge noch bis Samstag an. Dann aber legt sich der Winter über das Land: Es kann ordentlich schneien und es wird in manchen Gebieten sehr kalt.,https://bilder1.n-tv.de/img/incoming/crop24639404/3561322324-cImg_16_9-w1200/263135881959c23dc295cf4135bcb1dc.jpg,2024-01-04T14:23:47Z,,In den Hochwasser-Gebieten regnet und regnet es. Laut dem ntv-Wetterexperten Björn Alexander halten die Niederschläge noch bis Samstag an. Dann aber legt sich der Winter über das Land: Es kann ordent… [+4382 chars],,de,'Winter'
https://www.zeit.de/news/2024-01/04/landesamt-luftqualitaet-in-bayern-hat-sich-verbessert,https://www.zeit.de/news/2024-01/04/landesamt-luftqualitaet-in-bayern-hat-sich-verbessert,0,www.zeit.de,Umwelt: Landesamt: Luftqualität in Bayern hat sich verbessert,Hier finden Sie Informationen zu dem Thema „Umwelt“. Lesen Sie jetzt „Landesamt: Luftqualität in Bayern hat sich verbessert“.,https://img.zeit.de/news/2024-01/04/landesamt-luftqualitaet-in-bayern-hat-sich-verbessert-image-group/wide__1300x731,2024-01-04T14:42:09Z,,"Die Luftqualität in Bayern ist im vergangenen Jahr erneut besser geworden. Dies geht aus Daten des Bayerischen Landesamts für Umwelt (LfU) hervor, wie die Behörde in Augsburg am Donnerstag mitteilte.… [+1583 chars]",,de,'Bayern'
https://www.zeit.de/news/2024-01/04/werders-stark-hofft-auf-winter-verstaerkungen,https://www.zeit.de/news/2024-01/04/werders-stark-hofft-auf-winter-verstaerkungen,0,www.zeit.de,Bundesliga: Werders Stark hofft auf Winter-Verstärkungen,Hier finden Sie Informationen zu dem Thema „Bundesliga“. Lesen Sie jetzt „Werders Stark hofft auf Winter-Verstärkungen“.,https://img.zeit.de/news/2024-01/04/werders-stark-hofft-auf-winter-verstaerkungen-image-group/wide__1300x731,2024-01-04T15:04:01Z,,"Werder Bremens Niklas Stark hofft darauf, dass sich der Fußball-Bundesliga in der Winterpause noch einmal verstärkt. «Natürlich wäre es gut, wenn wir den einen oder anderen dazubekommen würden - in d… [+627 chars]",,de,'Winter'
https://www.zeit.de/2024-01/skandinavien-kaelte-winter-schnee-fs,https://www.zeit.de/2024-01/skandinavien-kaelte-winter-schnee-fs,0,www.zeit.de,Kältewelle in Skandinavien: Leben auf Eis gelegt,In Skandinavien ist es ungewöhnlich kalt. Die Temperaturen fielen teilweise unter minus 40 Grad. Das stellt die dort lebenden Menschen vor Herausforderungen. Die Bilder,https://img.zeit.de/wissen/umwelt/2024-01/skandinavien-kaelte-winter-schnee-bild/wide__1300x731,2024-01-04T16:43:04Z,,"Kälte, Schnee und stürmische Winde sogen in ganz Skandinavien für Chaos. Brücken mussten gesperrt werden, Zug- und Fährverbindungen wurden eingestellt und Schulen geschlossen. In Dänemark rief die Po… [+293 chars]",,de,'Kälte'
https://www.bild.de/video/clip/news/schneechaos-in-schweden-autofahrer-ueber-12-stunden-in-stau-gefangen-86636752.bild.html,https://www.bild.de/video/clip/news/schneechaos-in-schweden-autofahrer-ueber-12-stunden-in-stau-gefangen-86636752.bild.html,0,www.bild.de,Schneechaos in Schweden - Autofahrer über 12 Stunden in Stau gefangen,"Eisige Kälte, Wind und immer mehr Schnee: Langer Stau auf der E22 im Süden Schwedens. Über Stunden stecken die Autofahrer hier fest.","https://images.bild.de/6596d88adc3fc425d2591368/ddade91d92de276477b62c3b5fb9255a,8bbec5d3?w=1280",2024-01-04T17:19:03Z,,"Mehr zum Video anzeigen
Eisige Kälte, Wind und immer mehr Schnee kein Weiterkommen. Auf dieser Autobahn im Süden Schwedens geht am Mittwoch nichts mehr: Starker Schneefall und liegengebliebene Lkw s… [+134 chars]",,de,'Kälte'
https://www.stern.de/gesellschaft/regional/bayern/ueberschwemmungen--hochwassersituation-bleibt-kritisch-34336144.html,https://www.stern.de/gesellschaft/regional/bayern/ueberschwemmungen--hochwassersituation-bleibt-kritisch-34336144.html,0,www.stern.de,Überschwemmungen: Hochwassersituation bleibt kritisch,Weitere Regenfälle haben die Hochwasserlage in Teilen Bayerns weiter verschärft. Überschwemmungen in bebauten Gebieten schließen die Experten nicht aus.,https://image.stern.de/34336146/t/xX/v3/w1440/r1.7778/-/04--urnnewsmldpacom2009010124010499487107v3w800h600l893t361r1589b1267jpeg---6c807ac48bb6a100.jpg,2024-01-04T18:33:55Z,,"Weitere Regenfälle haben die Hochwasserlage in Teilen Bayerns weiter verschärft. Überschwemmungen in bebauten Gebieten schließen die Experten nicht aus.
Die Hochwassersituation im Norden und Osten B… [+3008 chars]",,de,'Bayern'
https://www.tagesschau.de/ausland/europa/waffenlieferungen-ukraine-russland-100.html,https://www.tagesschau.de/ausland/europa/waffenlieferungen-ukraine-russland-100.html,0,www.tagesschau.de,Rüstungsgüter für Krieg: Wer an Kiew liefert - und wer an Moskau,"Die Slowakei, Polen, vorerst auch die USA: Etliche Nationen haben ihre Waffenlieferungen an die Ukraine vorerst eingestellt. Wer was liefert - und woher Russlands Rüstungsgüter kommen. Ein Überblick von Jasper Steinlein.",https://images.tagesschau.de/image/f40e0156-e10a-4c10-afe7-f78c0d7c5bdc/AAABjNXP_vY/AAABibBxqrQ/16x9-1280/usa-munition-ukraine-100.jpg,2024-01-04T18:39:40Z,,"Stand: 04.01.2024 19:39 Uhr
Die Slowakei, Polen, vorerst auch die USA: Etliche Nationen haben ihre Waffenlieferungen an die Ukraine vorerst eingestellt. Wer was liefert - und woher Russlands Rüstung… [+16096 chars]",,de,'Abhängigkeit'
https://orf.at/stories/3344715/,https://orf.at/stories/3344715/,0,orf.at,Auch Österreich steht Wintereinbruch bevor,"Das neue Jahr hat im Norden Europas mit extremer Kälte begonnen: In Schweden und Finnland wurden diese Woche teilweise weit unter minus 30 Grad Celsius gemessen. Während es in Skandinavien gegen Wochenende etwas wärmer wird, steht Österreich der nächste Winte…",https://ibs.orf.at/news?image=https%3A%2F%2Fassets.orf.at%2Fmims%2F2024%2F01%2F40%2Fcrops%2Fw%3D1200%2Ch%3D630%2Cq%3D75%2F2060929_master_777740_klima_wetter_kaelte_im.jpg%3Fs%3Da83122ebf7825a6a5df95233627c3da23896e01c,2024-01-04T18:59:04Z,,"Schon am Samstag soll es verbreitet teils anhaltenden Niederschlag geben, in ganz Österreich wird es durchwegs trüb mit Regen oder Schneefall. In der Nacht von Dreikönig auf Sonntag sinken die Temper… [+3386 chars]",,de,'Kälte'
https://www.n-tv.de/politik/22-19-Selenskyj-rechnet-fest-mit-baldiger-Ruestungshilfe--article24640337.html,https://www.n-tv.de/politik/22-19-Selenskyj-rechnet-fest-mit-baldiger-Ruestungshilfe--article24640337.html,0,www.n-tv.de,Ukraine-Krieg im Liveticker: +++ 22:19 Selenskyj rechnet fest mit baldiger Rüstungshilfe +++,Lesen Sie alle aktuellen Entwicklungen und Nachrichten über den russischen Angriffskrieg auf die Ukraine im Liveticker von ntv.de.,https://bilder2.n-tv.de/img/incoming/crop23332537/9041326157-cImg_16_9-w1200/Liveticker1-grau-1-Kopie.jpg,2024-01-04T19:00:00Z,,"Die Ukraine rechnet nach Angaben von Präsident Wolodymr Selenskyj bald mit neuer ausländischer Rüstungshilfe. ""Ich bin allen unseren Partnern dankbar, die bereits neue Unterstützungspakete schnüren"",… [+33580 chars]",,de,'Krieg'
https://www.freitag.de/autoren/beate-troeger/neuauflage-ingeborg-bachmanns-erster-gedichtband-die-gestundete-zeit,https://www.freitag.de/autoren/beate-troeger/neuauflage-ingeborg-bachmanns-erster-gedichtband-die-gestundete-zeit,0,www.freitag.de,Poesie | Ingeborg Bachmanns erster Gedichtband „Die gestundete Zeit“ neu aufgelegt,"Ingeborg Bachmann hat in ihrem ersten Gedichtband „Die gestundete Zeit“ die Kälte und Härte der Nachkriegszeit gefasst. Der erwartete Skandal blieb aus. Warum die Lektüre heute lohnt „Ich bin jetzt mehr denn je davon überzeugt, dass das Erscheinen dieses Band…",https://www.freitag.de/autoren/beate-troeger/neuauflage-ingeborg-bachmanns-erster-gedichtband-die-gestundete-zeit/@@images/social_image,2024-01-05T03:00:00Z,,"Ich bin jetzt mehr denn je davon überzeugt, dass das Erscheinen dieses Bandes ein Ereignis sein wird (). Denn Ihre Gedichte blenden ja nicht, sondern senken sich langsam auf den Grund, schrieb Alfred… [+7035 chars]",,de,'Kälte'
https://www.stern.de/gesellschaft/regional/nordrhein-westfalen/energie--windraeder-im-wald-geplant---kein-zubau-auf-forstflaechen-2023-34339076.html,https://www.stern.de/gesellschaft/regional/nordrhein-westfalen/energie--windraeder-im-wald-geplant---kein-zubau-auf-forstflaechen-2023-34339076.html,0,www.stern.de,Energie: Windräder im Wald geplant - kein Zubau auf Forstflächen 2023,In den Wäldern Nordrhein-Westfalens stehen im Vergleich zu anderen Bundesländern eher wenige Windräder. Doch das dürfte sich nach Einschätzung der Windkraft-Branche und Forstleuten in den kommenden Jahren ändern.,https://image.stern.de/34339078/t/we/v1/w1440/r1.7778/-/05--urnnewsmldpacom2009010124010599497463v2w800h600l851t1073r4720b3726jpeg---5deb268a4584bce1.jpg,2024-01-05T04:56:55Z,,In den Wäldern Nordrhein-Westfalens stehen im Vergleich zu anderen Bundesländern eher wenige Windräder. Doch das dürfte sich nach Einschätzung der Windkraft-Branche und Forstleuten in den kommenden J… [+4165 chars],,de,'Windräder'
https://www.zeit.de/news/2024-01/05/windraeder-im-wald-geplant-kein-zubau-auf-forstflaechen-2023,https://www.zeit.de/news/2024-01/05/windraeder-im-wald-geplant-kein-zubau-auf-forstflaechen-2023,0,www.zeit.de,Energie: Windräder im Wald geplant - kein Zubau auf Forstflächen 2023,Hier finden Sie Informationen zu dem Thema „Energie“. Lesen Sie jetzt „Windräder im Wald geplant - kein Zubau auf Forstflächen 2023“.,https://img.zeit.de/news/2024-01/05/windraeder-im-wald-geplant-kein-zubau-auf-forstflaechen-2023-image-group/wide__1300x731,2024-01-05T04:56:55Z,,Der lange zurückhaltende Ausbau von Windkraft in nordrhein-westfälischen Wäldern wird Experten zufolge in den kommenden Jahren an Fahrt aufnehmen. Zwar sei im Jahr 2023 kein nennenswerter Zubau auf d… [+4423 chars],,de,'Windräder'
https://www.zeit.de/news/2024-01/05/trainer-streich-hofft-auf-freiburger-winter-transfers,https://www.zeit.de/news/2024-01/05/trainer-streich-hofft-auf-freiburger-winter-transfers,0,www.zeit.de,Bundesliga: Trainer Streich hofft auf Freiburger Winter-Transfers,Hier finden Sie Informationen zu dem Thema „Bundesliga“. Lesen Sie jetzt „Trainer Streich hofft auf Freiburger Winter-Transfers“.,https://img.zeit.de/news/2024-01/05/trainer-streich-hofft-auf-freiburger-winter-transfers-image-group/wide__1300x731,2024-01-05T06:00:38Z,,"Trainer Christian Streich drängt angesichts der Personalsorgen des SC Freiburg auf die eine oder andere Verstärkung in der laufenden Transferperiode. «Ich hoffe, dass bald etwas passiert. Es ist zu d… [+2384 chars]",,de,'Winter'
https://www.sueddeutsche.de/panorama/hochwasser-deutschland-aktuell-lage-deiche-dauerregen-kaelte-1.6327074,https://www.sueddeutsche.de/panorama/hochwasser-deutschland-aktuell-lage-deiche-dauerregen-kaelte-1.6327074,0,www.sueddeutsche.de,Flutkatastrophe: Dauerregen hört auf - jetzt kommt die große Kälte,"Die Unwetterwarnungen sind aufgehoben, vielerorts kommt kein neuer Regen mehr dazu. Am Wochenende soll Schnee fallen. Allerdings besteht nach wie vor die Gefahr, dass durchgeweichte Deiche brechen.",https://www.sueddeutsche.de/image/sz.1.6328663/1200x675?v=1704449554,2024-01-05T07:51:33Z,,"Für unseren Liveblog verwenden wir neben eigenen Recherchen Material der Nachrichtenagenturen dpa, Reuters, epd und KNA.",,de,'Kälte'
