index,url,valid,domain,title,description,image,published,archive,content,quote,language,keyword
https://www.zeit.de/news/2026-01/04/fc-st-pauli-und-werder-trennen-sich-im-winter-test-0-0,https://www.zeit.de/news/2026-01/04/fc-st-pauli-und-werder-trennen-sich-im-winter-test-0-0,0,www.zeit.de,Vorbereitung: FC St. Pauli und Werder trennen sich im Winter-Test 0:0,Hier finden Sie Informationen zu dem Thema „Vorbereitung“. Lesen Sie jetzt „FC St. Pauli und Werder trennen sich im Winter-Test 0:0“.,https://img.zeit.de/news/2026-01/04/fc-st-pauli-und-werder-trennen-sich-im-winter-test-0-0-image-group/wide__1300x731,2026-01-04T16:40:58Z,,Die Bundesliga-Rivalen FC St. Pauli und Werder Bremen haben sich in ihrem einzigen Test vor der Fortsetzung der Fußball-Saison unentschieden getrennt. Eine Woche vor dem ersten Spieltag im neuen Jahr… [+1782 chars],,de,'Winter'
https://www.stern.de/panorama/berlin-stromausfall--weiterer-tag-ohne-elektrizitaet---bei-eisiger-kaelte-37009836.html,https://www.stern.de/panorama/berlin-stromausfall--weiterer-tag-ohne-elektrizitaet---bei-eisiger-kaelte-37009836.html,0,www.stern.de,Berlin: Weiterer Tag ohne Strom bei eisiger Kälte – Schulen und Kitas dicht,"Der Ärger geht weiter: Nach dem Brandanschlag auf wichtige Kabel steht Tausenden Berlinern ein weiterer Tag ohne Strom bevor. Polizei und Rettungskräfte helfen, wo sie können.",https://image.stern.de/37009838/t/Dn/v1/w1440/r1.7778/-/berlin-stromausfall.jpg,2026-01-05T04:00:00Z,,"Kopiere den aktuellen Link
Zur Merkliste hinzufügen
Der Ärger geht weiter: Nach dem Brandanschlag auf wichtige Kabel steht Tausenden Berlinern ein weiterer Tag ohne Strom bevor. Polizei und Rettung… [+2760 chars]",,de,'Kälte'
https://www.stern.de/wirtschaft/news/erneuerbare-energie--solarenergie-deckt-18-prozent-des-deutschen-stromverbrauchs-37009872.html,https://www.stern.de/wirtschaft/news/erneuerbare-energie--solarenergie-deckt-18-prozent-des-deutschen-stromverbrauchs-37009872.html,0,www.stern.de,Erneuerbare Energie: Solarenergie deckt 18 Prozent des deutschen Stromverbrauchs,Bei der Stromerzeugung schlägt Photovoltaik erstmals zwei fossile Energieträger. Der Branche geht die Ausbreitung der Solaranlagen dennoch zu langsam.,https://image.stern.de/37009874/t/mQ/v1/w1440/r1.7778/-/05--qvisqe7pszv6axs2048jpeg---b0abc27d16ef30e1.jpg,2026-01-05T04:00:11Z,,"Kopiere den aktuellen Link
Zur Merkliste hinzufügen
Bei der Stromerzeugung schlägt Photovoltaik erstmals zwei fossile Energieträger. Der Branche geht die Ausbreitung der Solaranlagen dennoch zu lan… [+1196 chars]",,de,'fossile Energie'
https://www.tagesspiegel.de/wirtschaft/erneuerbare-energie-solarenergie-deckt-18-prozent-des-deutschen-stromverbrauchs-15102505.html,https://www.tagesspiegel.de/wirtschaft/erneuerbare-energie-solarenergie-deckt-18-prozent-des-deutschen-stromverbrauchs-15102505.html,0,www.tagesspiegel.de,Erneuerbare Energie: Solarenergie deckt 18 Prozent des deutschen Stromverbrauchs,Bei der Stromerzeugung schlägt Photovoltaik erstmals zwei fossile Energieträger. Der Branche geht die Ausbreitung der Solaranlagen dennoch zu langsam.,https://www.tagesspiegel.de/images/15102504/alternates/BASE_16_9_W1400/1767585704000/schnellladepark-fur-elektromobile.jpeg,2026-01-05T04:01:44Z,,"Solaranlagen in Deutschland haben im vergangenen Jahr deutlich mehr Strom erzeugt. Ihr Anteil an der heimischen Stromerzeugung wuchs von 14 Prozent (2024) auf rund 18 Prozent, wie der Bundesverband S… [+1086 chars]",,de,'fossile Energie'
https://www.zeit.de/news/2026-01/05/trump-glaube-nicht-an-angriff-kiews-auf-putins-residenz,https://www.zeit.de/news/2026-01/05/trump-glaube-nicht-an-angriff-kiews-auf-putins-residenz,0,www.zeit.de,Ukraine-Krieg: Trump: Glaube nicht an Angriff Kiews auf Putins Residenz,Hier finden Sie Informationen zu dem Thema „Ukraine-Krieg“. Lesen Sie jetzt „Trump: Glaube nicht an Angriff Kiews auf Putins Residenz“.,https://img.zeit.de/news/2026-01/05/trump-glaube-nicht-an-angriff-kiews-auf-putins-residenz-image-group/wide__1300x731,2026-01-05T04:32:56Z,,"US-Präsident Donald Trump geht nicht von einem Angriff der Ukraine auf die Residenz des russischen Präsidenten Wladimir Putin aus. Er glaube nicht, dass dieser Angriff stattgefunden habe, sagte der R… [+996 chars]",,de,'Putin'
https://www.zeit.de/news/2026-01/05/winter-am-ber-fluege-laufen-meist-planmaessig,https://www.zeit.de/news/2026-01/05/winter-am-ber-fluege-laufen-meist-planmaessig,0,www.zeit.de,Flugverkehr: Winter am BER: Flüge laufen meist planmäßig,Hier finden Sie Informationen zu dem Thema „Flugverkehr“. Lesen Sie jetzt „Winter am BER: Flüge laufen meist planmäßig“.,https://img.zeit.de/news/2026-01/05/winter-am-ber-fluege-laufen-meist-planmaessig-image-group/wide__1300x731,2026-01-05T07:14:26Z,,"Fluggäste am Flughafen Berlin Brandenburg (BER) können trotz winterlicher Wetterlage größtenteils entspannt ihre Reisen antreten. Der Flughafen laufe in seinem normalen Winterbetrieb, teilte ein Spre… [+905 chars]",,de,'Winter'
https://www.welt.de/videos/video695b7271fe6040199bf92939/blackout-in-berlin-vier-decken-und-kerzen-mehr-ging-nicht.html,https://www.welt.de/videos/video695b7271fe6040199bf92939/blackout-in-berlin-vier-decken-und-kerzen-mehr-ging-nicht.html,0,www.welt.de,„Vier Decken und Kerzen. Mehr ging nicht“,"Seit dem Stromausfall herrscht im Berliner Südwesten der Ausnahmezustand. Anwohner kämpfen mit improvisierten Mitteln gegen die Kälte in ihren Wohnungen, berichtet Reporterin Alina Quast.",https://images.welt.de/695b7271fe6040199bf92939/10e90b67502a2b03435257d89b5d48f0-master/ci16x9-w1200/stromausfall-anwohnerin-jpg,2026-01-05T09:15:12Z,,Die WELT als ePaper: Die vollständige Ausgabe steht Ihnen bereits am Vorabend zur Verfügung so sind Sie immer hochaktuell informiert. Weitere Informationen https://epaper.welt.de,,de,'Kälte'
https://www.focus.de/kultur/stars/koennte-ich-nicht-simone-ballack-zeigt-ihr-extremes-dschungelcamp-training_2603f20c-4b02-4f0d-a325-62f9131e9d6e.html,https://www.focus.de/kultur/stars/koennte-ich-nicht-simone-ballack-zeigt-ihr-extremes-dschungelcamp-training_2603f20c-4b02-4f0d-a325-62f9131e9d6e.html,0,www.focus.de,"""Könnte ich nicht"": Simone Ballack zeigt ihr extremes Dschungelcamp-Training","Simone Ballack muss bald mit der tropischen Hitze im Dschungelcamp klarkommen. Zur Vorbereitung trainiert sie jedoch hart in eisiger Kälte, wie sie ihren Followern auf Instagram präsentiert.",https://quadro.burda-forward.de/ctf/a2919440-3b47-4666-a0e0-3f266d5b628b.deca18d3-abe5-4e51-83a0-aa1e835be201.jpg?im=RegionOfInterestCrop%3D%281200%2C630%29%2CregionOfInterest%3D%281766%2C483%29&hash=a8d1589a32208da4b1060d0cfcd6231c9974741319776560b7a35eb19a221b0b,2026-01-05T09:33:23Z,,"Am 23. Januar 2026 schickt RTL erneut zwölf mehr oder weniger bekannte Promis ins Dschungelcamp. Auch Simone Ballack (49) ist Teil der 19. Staffel von ""Ich bin ein Star Holt mich hier raus"". Vor der … [+1601 chars]",,de,'Kälte'
https://www.focus.de/kultur/stars/simone-ballack-zeigt-ihr-extremes-dschungelcamp-training-koennte-ich-nicht_2603f20c-4b02-4f0d-a325-62f9131e9d6e.html,https://www.focus.de/kultur/stars/simone-ballack-zeigt-ihr-extremes-dschungelcamp-training-koennte-ich-nicht_2603f20c-4b02-4f0d-a325-62f9131e9d6e.html,0,www.focus.de,"Simone Ballack zeigt ihr extremes Dschungelcamp-Training: ""Könnte ich nicht""","Simone Ballack muss bald mit der tropischen Hitze im Dschungelcamp klarkommen. Zur Vorbereitung trainiert sie jedoch hart in eisiger Kälte, wie sie ihren Followern auf Instagram präsentiert.",https://quadro.burda-forward.de/ctf/a2919440-3b47-4666-a0e0-3f266d5b628b.deca18d3-abe5-4e51-83a0-aa1e835be201.jpg?im=RegionOfInterestCrop%3D%281200%2C630%29%2CregionOfInterest%3D%281766%2C483%29&hash=a8d1589a32208da4b1060d0cfcd6231c9974741319776560b7a35eb19a221b0b,2026-01-05T09:33:23Z,,"Am 23. Januar 2026 schickt RTL erneut zwölf mehr oder weniger bekannte Promis ins Dschungelcamp. Auch Simone Ballack (49) ist Teil der 19. Staffel von ""Ich bin ein Star Holt mich hier raus"". Vor der … [+1601 chars]",,de,'Kälte'
https://www.tagesspiegel.de/berlin/stromausfall-netzbetreiber-donnerstag-wieder-strom-fur-alle-15103294.html,https://www.tagesspiegel.de/berlin/stromausfall-netzbetreiber-donnerstag-wieder-strom-fur-alle-15103294.html,0,www.tagesspiegel.de,Stromausfall: Netzbetreiber: Donnerstag wieder Strom für alle,Kälte und komplizierte Technik: Erst am Donnerstag soll im Südwesten Berlins der Strom wieder fließen. Wie Experten aus ganz Deutschland jetzt helfen.,https://www.tagesspiegel.de/images/15105055/alternates/BASE_16_9_W1400/1767623492000/stromausfall-in-berlin.jpeg,2026-01-05T09:53:50Z,,"Der Betreiber des Berliner Stromnetzes geht im Moment davon aus, dass nach dem großen Blackout erst am Donnerstagnachmittag wieder alle Haushalte versorgt werden. Dieser schon am Wochenende verkündet… [+1958 chars]",,de,'Kälte'
https://www.tagesspiegel.de/gesellschaft/panorama/chaotische-verhaltnisse-winterwetter-hat-europaische-lander-fest-im-griff-15103342.html,https://www.tagesspiegel.de/gesellschaft/panorama/chaotische-verhaltnisse-winterwetter-hat-europaische-lander-fest-im-griff-15103342.html,0,www.tagesspiegel.de,Chaotische Verhältnisse: Winterwetter hat europäische Länder fest im Griff,"Zugausfälle, stundenlange Verspätungen und Flughäfen im Ausnahmezustand: Schnee und Eis haben viele Länder Europas zu großen Einschränkungen geführt.",https://www.tagesspiegel.de/images/15104087/alternates/BASE_16_9_W1400/1767613707000/winterwetter-in-gro-britannien.jpeg,2026-01-05T10:01:01Z,,"Starker Schneefall und eisige Temperaturen haben in etlichen europäischen Ländern für chaotische Verhältnisse gesorgt. Am Montag, als viele Menschen aus den Weihnachtsferien in den Alltag starteten, … [+3610 chars]",,de,'Kälte'
https://futurezone.at/apps/app-kaelte-immer-griffbereit-haben-kaeltetelefon-kaelteapp-obdachlos-wien-melden/403118685,https://futurezone.at/apps/app-kaelte-immer-griffbereit-haben-kaeltetelefon-kaelteapp-obdachlos-wien-melden/403118685,0,futurezone.at,Extreme Kälte: Diese App solltet ihr jetzt immer griffbereit haben,Die KälteApp und das Kältetelefon können bei diesen Temperaturen zum Lebensretter werden.,https://image.futurezone.at/images/facebook/9187236/46-175463301.jpg,2026-01-05T10:08:48Z,,Die KälteApp und das Kältetelefon können bei diesen Temperaturen zum Lebensretter werden.,,de,'Kälte'
https://www.bild.de/regional/hamburg/rettung-dauert-vier-stunden-huendin-lucie-bricht-in-hamburg-ins-eis-ein-695b64a3c83d5f8e0659c922,https://www.bild.de/regional/hamburg/rettung-dauert-vier-stunden-huendin-lucie-bricht-in-hamburg-ins-eis-ein-695b64a3c83d5f8e0659c922,0,www.bild.de,Beim Gassigehen in See eingebrochen - Nach 4 Stunden! Feuerwehr rettet Hund aus Eiswasser,Dramatische Rettung am Öjendorfer See: Hündin Lucie bricht ins Eis ein und kämpft ums Überleben. Mit welcher aufwendigen Taktik das Tier gerettet wurde.,"https://images.bild.de/695b64a3c83d5f8e0659c922/3d86dadd83f82474dc7d9859701eff81,f0bfeccb?w=1280",2026-01-05T10:22:51Z,,"Hamburg Was als harmloser Spaziergang begann, wurde für Mischlingshündin Lucie zum Überlebenskampf im Eiswasser und zu einer aufwendigen Rettungsaktion für 20 Helfer.
Am Sonntagnachmittag gegen 15.3… [+1900 chars]",,de,'Kälte'
https://www.sueddeutsche.de/bayern/funtensee-berchtesgaden-nationalpark-frost-eis-temperaturen-minusgrade-li.3363266,https://www.sueddeutsche.de/bayern/funtensee-berchtesgaden-nationalpark-frost-eis-temperaturen-minusgrade-li.3363266,0,www.sueddeutsche.de,"Nationalpark Berchtesgaden: Kalt, kälter - Funtensee","Klirrende Kälte hat nicht nur Bayern im Griff. Doch es gibt einen Ort im Nationalpark Berchtesgaden, der immer die eisigsten Temperaturen liefert. Was den Funtensee so besonders macht.",https://www.sueddeutsche.de/2026/01/05/650e2153-04ea-4a47-a221-e654555db386.jpg?q=60&fm=webp&width=1200&rect=0%2C48%2C2560%2C1440,2026-01-05T10:42:19Z,,"Der Kälterekord
An Heiligabend 2001 maß eine private Wetterstation am Funtensee minus 45,9 Grad  der historische Tiefstwert in Deutschland. Die Station des Deutschen Wetterdienstes (DWD) auf der and… [+4896 chars]",,de,'Kälte'
https://www.dw.com/de/wie-koennen-aermere-entwicklungslaender-ohne-fossile-energie-kohle-oel-und-gas-wachsen-alternativen/a-75267197,https://www.dw.com/de/wie-koennen-aermere-entwicklungslaender-ohne-fossile-energie-kohle-oel-und-gas-wachsen-alternativen/a-75267197,0,www.dw.com,"Können Entwicklungsländer ohne Kohle, Öl und Gas wachsen?","Industrienationen wurden mit Kohle, Öl und Gas reich. Nun sollen ärmere Staaten anders wachsen. Doch ist ein fossilfreier Entwicklungspfad realistisch, bezahlbar und wirtschaftlich sinnvoll?",https://static.dw.com/image/70870074_6.jpg,2026-01-05T11:57:00Z,,"Mosambik steht an einem Wendepunkt. Vor der Nordküste locken Offshore-Gasprojekte im Wert von mehreren Milliarden US-Dollar, die dem Staat neue Einnahmen in erheblichem Umfang einbringen könnten. Gle… [+7831 chars]",,de,'Öl'
https://www.faz.net/aktuell/wirtschaft/trumps-venezuela-abenteuer-wirft-fragen-auf-110813978.html,https://www.faz.net/aktuell/wirtschaft/trumps-venezuela-abenteuer-wirft-fragen-auf-110813978.html,0,www.faz.net,US-Intervention in Venezuela: Trumps Abenteuer,"Öl allein kann die Intervention in Venezuela nicht erklären. Eher wird die Welt Zeuge einer Rückkehr zu Zeiten, in denen die Großmächte nach Gutdünken schalten und walten. Das sind keine schöne Aussichten.",https://media0.faz.net/image/w1200h627/db7c95c06775/w3452h1803x0y69o/202601/43601.0.1637357922/per-hubschrauber-der.webp,2026-01-05T20:29:53Z,,"Man muss konstatieren, dass die amerikanische Regierung bis heute keine schlüssige Begründung für die spektakuläre Intervention in Venezuela und die Entführung des Staatschefs geliefert hat. Das ist … [+1908 chars]",,de,'Öl'
https://www.bild.de/politik/ausland-und-internationales/us-experte-sicher-trumps-oel-plan-schwaecht-russland-und-china-695bce60b0086aa64be6f78e,https://www.bild.de/politik/ausland-und-internationales/us-experte-sicher-trumps-oel-plan-schwaecht-russland-und-china-695bce60b0086aa64be6f78e,0,www.bild.de,US-Experte sicher - Trumps Öl-Plan schwächt Russland und China,USA zielen auf Chinas und Russlands Einfluss in Südamerika. Expertenanalyse zur Festnahme von Maduro.,"https://images.bild.de/695bce60b0086aa64be6f78e/d20ef17fe6b65d838d5173dc71c833c5,b6d8bd6a?w=1280",2026-01-05T20:53:46Z,,"Berlin Richtet sich der Militärschlag der USA in Venezuela auch gegen China und Russland?
Nach der Festnahme des Diktators Nicolás Maduro durch amerikanische Truppen im Zuge eines Militäreinsatzes i… [+3365 chars]",,de,'Öl'
https://www.n-tv.de/wirtschaft/Wall-Street-startet-stark-in-die-Woche-id30206126.html,https://www.n-tv.de/wirtschaft/Wall-Street-startet-stark-in-die-Woche-id30206126.html,0,www.n-tv.de,Ölpreise ziehen an: Wall Street startet stark in die Woche,"Der Sturz Maduros in Venezuela sorgt an der Wall Street nicht für Panik. Die Ölpreise fallen zunächst, legen im Tagesverlauf aber deutlich zu. Insgesamt schauen die US-Anleger inzwischen gelassener auf die stürmische Geopolitik.",https://www.n-tv.de/img/30206125/1767651285/Img_16_9/1200/Trader-Jonathan-Mueller-works-on-the-floor-of-the-New-York-Stock-Exchange-Friday-Jan-2-2026.jpg,2026-01-05T21:28:38Z,,"Die Handelswoche beginnt in New York freundlich. (Foto: AP)
Der Sturz Maduros in Venezuela sorgt an der Wall Street nicht für Panik. Die Ölpreise fallen zunächst, legen im Tagesverlauf aber deutlich… [+4258 chars]",,de,'Öl'
https://www.faz.net/aktuell/politik/ausland/liveblog-angriff-auf-venezuela-berichte-ueber-schuesse-in-der-naehe-des-praesidentenpalastes-faz-200405141.html,https://www.faz.net/aktuell/politik/ausland/liveblog-angriff-auf-venezuela-berichte-ueber-schuesse-in-der-naehe-des-praesidentenpalastes-faz-200405141.html,0,www.faz.net,angriff auf Venezuela: Berichte über Schüsse in der Nähe des Präsidentenpalastes,Venezuela sucht nach Kollaborateuren des US-Angriffs +++ Öl-Aktien legen nach US-Intervention in Venezuela zu +++ Die Nachfolgerin Maduros legt einen Amtseid in der Nationalversammlung ab  +++ alle Entwicklungen im Liveblog,https://media0.faz.net/image/w1200h627/9cf2a608e251/w3000h1567x0y216o/202601/43601.0.1630719899/truppen-der-praesidentengarde.webp,2026-01-06T02:01:00Z,,"Der amerikanische UN-Botschafter Mike Waltz wiederholt in New York die Darstellung der Regierung in Washington. Maduro sei verantwortlich für Angriffe auf Amerikaner, die Destabilisierung der Westlic… [+1029 chars]",,de,'Öl'
https://www.welt.de/politik/ausland/article6958ef97441b06c4906d1ccf/venezuela-liveticker-lage-angeblich-unter-kontrolle-polizei-gibt-schuesse-vor-praesidentenpalast-ab.html,https://www.welt.de/politik/ausland/article6958ef97441b06c4906d1ccf/venezuela-liveticker-lage-angeblich-unter-kontrolle-polizei-gibt-schuesse-vor-praesidentenpalast-ab.html,0,www.welt.de,Lage angeblich unter Kontrolle – Polizei gibt Schüsse vor Präsidentenpalast ab,"Donald Trump kann sich vorstellen, US-Ölkonzernen in Venezuela unter die Arme zu greifen. Noch halten sich die Unternehmen zurück, doch ihre Aktien steigen bereits stark. In der venezuelanischen Hauptstadt Caracas fallen Schüsse. Mehr im Liveticker.",https://images.welt.de/6958ef97441b06c4906d1ccf/04cc1fa003fe4f07c3d8fffe81d6133f/ci16x9-w1200/dpa-com-20090101-260105-99-84142-jpg,2026-01-06T02:32:00Z,,"Donald Trump kann sich vorstellen, US-Ölkonzernen in Venezuela unter die Arme zu greifen. Noch halten sich die Unternehmen zurück, doch ihre Aktien steigen bereits stark. In der venezuelanischen Haup… [+11912 chars]",,de,'Öl'
https://www.zeit.de/news/2026-01/06/eisunfall-wenn-der-winter-lebensgefaehrlich-wird,https://www.zeit.de/news/2026-01/06/eisunfall-wenn-der-winter-lebensgefaehrlich-wird,0,www.zeit.de,Frostperiode: Eisunfall – wenn der Winter lebensgefährlich wird,Hier finden Sie Informationen zu dem Thema „Frostperiode“. Lesen Sie jetzt „Eisunfall – wenn der Winter lebensgefährlich wird“.,https://img.zeit.de/news/2026-01/06/eisunfall-wenn-der-winter-lebensgefaehrlich-wird-image-group/wide__1300x731,2026-01-06T04:02:05Z,,"Spiegelglatte Eisflächen laden derzeit vielerorts zum Schlittern und Schlittschuhfahren auf zugefrorenen Seen ein. Doch das kann lebensgefährlich sein, warnt Dominik Schneider von der Deutschen Leben… [+4119 chars]",,de,'Winter'
https://www.zeit.de/2025/51/im-land-der-vergessenen-aliyeh-ataei-iran-afghanistan-krieg,https://www.zeit.de/2025/51/im-land-der-vergessenen-aliyeh-ataei-iran-afghanistan-krieg,0,www.zeit.de,"""Im Land der Vergessenen"" von Aliyeh Ataei: Die erste Kugel","Die iranische Schriftstellerin Aliyeh Ataei wuchs an der Grenze zu Afghanistan auf. In ihren autofiktionalen Erzählungen schreibt sie über Krieg, Leid, Fassungslosigkeit.",https://img.zeit.de/2025/51/die-erste-kugel-bild-2/wide__1300x731,2026-01-06T08:38:19Z,,"Jeden Tag sehen wir Bilder und hören Nachrichten aus dem Krieg. Je weiter weg das Leid, desto stumpfer scheint, was durch die Köpfe des Tagesschau- und Social-Media-Publikums rauscht. Was Krieg, was … [+746 chars]",,de,'Krieg'
https://www.bild.de/sport/fussball/fc-bayern-testspiel-gegen-red-bull-salzburg-hier-im-live-ticker-ab-15-uhr-695cd489fb77630dac278f0e,https://www.bild.de/sport/fussball/fc-bayern-testspiel-gegen-red-bull-salzburg-hier-im-live-ticker-ab-15-uhr-695cd489fb77630dac278f0e,0,www.bild.de,Ab 15 Uhr - Bayern-Test gegen Salzburg hier im Live-Ticker,Die Bayern starten mit dem Testspiel bei Red Bull Salzburg in das Fußball-Jahr 2026.  Fünf Tage später geht es in der Bundesliga gegen den VfL Wolfsburg.,"https://images.bild.de/695cd489fb77630dac278f0e/a0ff98eef0e61e843810a347dad9bc1f-landscape,286682aa?w=1280",2026-01-06T10:09:52Z,,"+++Koalitionsbruch in Brandenburg Woidke feuert Wagenknecht-Partei: Keine Basis mehr!
+++Koalitionsbruch in Brandenburg Woidke feuert Wagenknecht-Partei: Keine Basis mehr!
+++Koalitionsbruch in Bra… [+668 chars]",,de,'Bayern'
https://www.bild.de/news/ausland/schnee-und-eis-legen-europa-lahm-flug-und-zugchaos-frost-und-schulschliessungen-695cc070b125e961a2f99acd,https://www.bild.de/news/ausland/schnee-und-eis-legen-europa-lahm-flug-und-zugchaos-frost-und-schulschliessungen-695cc070b125e961a2f99acd,0,www.bild.de,Zug- und Flugausfälle und Mega-Frost - Wintereinbruch legt halb Europa lahm,"Der heftige Wintereinbruch legt halb Europa lahm: Es kommt zu Flug- und Zugausfällen, Monster-Staus und Schulausfällen.","https://images.bild.de/695cc070b125e961a2f99acd/220551bcf9e751f841172f86ae9f69af,86c2ed52?w=1280",2026-01-06T10:12:30Z,,"Berlin Die Winter-Zange hat uns fest im Griff! Während Deutschland zu Beginn der Woche schon bei bis zu minus 24 Grad bibberte, kämpfen auch große Teile Europas mit den Auswirkungen von Super-Kälte, … [+7290 chars]",,de,'Winter'
https://www.zeit.de/news/2026-01/06/minister-sieht-bayern-fuer-stromausfall-gewappnet,https://www.zeit.de/news/2026-01/06/minister-sieht-bayern-fuer-stromausfall-gewappnet,0,www.zeit.de,Katastrophenschutz: Minister sieht Bayern für Stromausfall gewappnet,Hier finden Sie Informationen zu dem Thema „Katastrophenschutz“. Lesen Sie jetzt „Minister sieht Bayern für Stromausfall gewappnet“.,https://img.zeit.de/news/2026-01/06/minister-sieht-bayern-fuer-stromausfall-gewappnet-image-group/wide__1300x731,2026-01-06T10:34:39Z,,Im Freistaat liegen dem Innenministerium zufolge keine konkreten Hinweise auf einen Angriff auf die kritische Infrastruktur vor. Mit Blick auf den in Berlin mutmaßlich durch einen linksextremistische… [+1752 chars],,de,'Bayern'
https://www.bild.de/sport/fussball/fc-bayern-kennen-sie-den-noch-ex-bayern-profi-in-die-politik-695cdbd395fe8bf439d66e41,https://www.bild.de/sport/fussball/fc-bayern-kennen-sie-den-noch-ex-bayern-profi-in-die-politik-695cdbd395fe8bf439d66e41,0,www.bild.de,Kennen Sie den noch? - Ex-Bayern-Profi in die Politik!,"Beim FC Bayern spielte er gemeinsam mit Weltstars. Jetzt drängt Andreas Görlitz in die Politik, in Rott kandidiert er für den Gemeinderat.","https://images.bild.de/695cdbd395fe8bf439d66e41/69438c39fc92218a4ec6b998c3045b4d,afeeae5b?w=1280",2026-01-06T10:50:44Z,,"Beim FC Bayern spielte er gemeinsam mit Weltstars wie Oliver Kahn (56), Philipp Lahm (42) oder Bastian Schweinsteiger (41). Jetzt drängt Andreas Görlitz (43) in die Politik! 
In seinem Heimatort Rot… [+1806 chars]",,de,'Bayern'
https://www.bild.de/sport/fussball/fc-bayern-ueberraschendes-comeback-von-tv-legende-695ce1d295fe8bf439d66ed8,https://www.bild.de/sport/fussball/fc-bayern-ueberraschendes-comeback-von-tv-legende-695ce1d295fe8bf439d66ed8,0,www.bild.de,Überraschendes Comeback - Bayern holt TV-Legende zurück,Der FC Bayern hat vor seinem heutigen Testspiel bei RB Salzburg (15 Uhr) eine Besonderheit bei der Übertragung der Partie angekündigt.,"https://images.bild.de/695ce1d295fe8bf439d66ed8/02db1f4999a188af5153ef715ace0c78,68d2d7bf?w=1280",2026-01-06T11:05:54Z,,"Huiuiui, was für eine legendäre Überraschung!
Der FC Bayern hat vor seinem heutigen Testspiel bei RB Salzburg (15 Uhr) eine Besonderheit bei der Übertragung der Partie angekündigt.
Kommentaren-Lege… [+1820 chars]",,de,'Bayern'
https://www.zeit.de/news/2026-01/06/was-sind-frost-und-eistage,https://www.zeit.de/news/2026-01/06/was-sind-frost-und-eistage,0,www.zeit.de,Winter: Was sind Frost- und Eistage?,Hier finden Sie Informationen zu dem Thema „Winter“. Lesen Sie jetzt „Was sind Frost- und Eistage?“.,https://img.zeit.de/news/2026-01/06/was-sind-frost-und-eistage-image-group/wide__1300x731,2026-01-06T11:07:51Z,,Zu Beginn des Jahres lädt das Wetter noch einmal zu winterlichen Aktivitäten in ganz Hessen ein. Aber bei Frost und Schnee und Temperaturen rund um den Gefrierpunkt stellt sich auch die Frage: Ist di… [+943 chars],,de,'Winter'
https://www.zeit.de/zeit-magazin/2026/01/franz-muentefering-ratschlaege-leben,https://www.zeit.de/zeit-magazin/2026/01/franz-muentefering-ratschlaege-leben,0,www.zeit.de,"Franz Müntefering: ""Das Sterben ist Teil des Lebens, nicht des Todes""","Über das Altwerden, Putin und Bücher als Gesprächspartner: Der ehemalige SPD-Politiker Franz Müntefering verrät, was er gern früher im Leben gewusst hätte.",https://img.zeit.de/zeit-magazin/2026/01/das-sterben-ist-teil-des-lebens-nicht-des-todes-bild-1/wide__1300x731,2026-01-06T13:20:02Z,,"Hier verraten jede Woche Prominente, was sie erst spät begriffen haben. Franz Müntefering, 85, war jahrzehntelang eine der prägenden Figuren der deutschen Sozialdemokratie. Er war Vorsitzender der SP… [+329 chars]",,de,'Putin'
https://www.zeit.de/news/2026-01/06/winterdienst-im-dauereinsatz,https://www.zeit.de/news/2026-01/06/winterdienst-im-dauereinsatz,0,www.zeit.de,Winter in Norddeutschland: Winterdienst im Dauereinsatz,Hier finden Sie Informationen zu dem Thema „Winter in Norddeutschland“. Lesen Sie jetzt „Winterdienst im Dauereinsatz“.,https://img.zeit.de/news/2026-01/06/winterdienst-im-dauereinsatz-image-group/wide__1300x731,2026-01-06T13:41:58Z,,"Gut gewappnet für den Winter: Kommunen im Norden und Nordosten haben noch ausreichend Streugut, um auch in der nächsten Zeit für sichere Straßenverhältnisse zu sorgen. Dies ergab eine stichprobenarti… [+2762 chars]",,de,'Winter'
