index,url,valid,domain,title,description,image,published,archive,content,quote,language,keyword
https://www.zeit.de/news/2025-02/01/auch-haeftlinge-in-bayern-koennen-an-bundestagswahl-teilnehmen,https://www.zeit.de/news/2025-02/01/auch-haeftlinge-in-bayern-koennen-an-bundestagswahl-teilnehmen,0,www.zeit.de,Wahlen: Auch Häftlinge in Bayern können an Bundestagswahl teilnehmen,Hier finden Sie Informationen zu dem Thema „Wahlen“. Lesen Sie jetzt „Auch Häftlinge in Bayern können an Bundestagswahl teilnehmen“.,https://img.zeit.de/news/2025-02/01/auch-haeftlinge-in-bayern-koennen-an-bundestagswahl-teilnehmen-image-group/wide__1300x731,2025-02-01T03:30:36Z,,Zur Bundestagswahl am 23. Februar sind auch zahlreiche Häftlinge in Bayerns Gefängnissen zur Stimmabgabe aufgerufen. Rund 9.700 Menschen saßen Ende 2024 in Haftanstalten des Freistaats. Wie viele von… [+1554 chars],,de,'Bayern'
https://www.focus.de/finanzen/news/donald-trump-am-druecker-gerald-hoerhan-erklaert-worauf-die-welt-sich-einstellen-muss_id_260675096.html,https://www.focus.de/finanzen/news/donald-trump-am-druecker-gerald-hoerhan-erklaert-worauf-die-welt-sich-einstellen-muss_id_260675096.html,0,www.focus.de,Analyse vom Investmentpunk - „Niedriger Ölpreis hat Kommunismus zu Fall gebracht – jetzt könnte es Russland treffen“,"Donald Trump fördert fossile Energien und günstige Preise – Investor Gerald Hörhan, auch bekannt als Investment-Punk, analysiert die Folgen für die Weltwirtschaft.",https://p6.focus.de/img/fotos/id_259485808/gerald-hoerhan-16-9.jpg?im=Crop%3D%280%2C37%2C1195%2C597%29%3BResize%3D%281200%2C627%29&impolicy=perceptual&quality=mediumHigh&hash=507b618d01da056784e13d13566281e7378224861b899eaf82b7d309649176d3,2025-02-01T08:27:59Z,,Der neue US-Präsident hat in einer Woche mehr Aktionismus an den Tag gelegt als sein Vorgänger Joe Biden in seiner gesamten Amtszeit. Donald Trump unterzeichnete in den ersten sieben Tagen zahlreiche… [+6968 chars],,de,'fossile Energie'
https://www.welt.de/kultur/article249220716/Juri-Durkot-Meine-Mutter-ihr-Hoergeraet-und-der-Krieg.html,https://www.welt.de/kultur/article249220716/Juri-Durkot-Meine-Mutter-ihr-Hoergeraet-und-der-Krieg.html,0,www.welt.de,"Meine Mutter, ihr Hörgerät und der Krieg","Seit dem ersten Kriegsmorgen hält uns der preisgekrönte Übersetzer Juri Durkot aus Lemberg über die Lage in der Ukraine auf dem Laufenden. Heute erzählt er, warum seit dem russischen Überfall die HNO-Ärzte so viel zu tun haben.",https://img.welt.de/img/channels-extern/ipad_neu/kultur_ipad_neu/mobile101923246/6447930817-ci16x9-w1200/Leipziger-Buchmesse-DW-Kultur-Leipzig-jpg.jpg,2025-02-01T09:30:00Z,,"Seit dem ersten Kriegsmorgen hält uns der preisgekrönte Übersetzer Juri Durkot aus Lemberg über die Lage in der Ukraine auf dem Laufenden. Heute erzählt er, warum seit dem russischen Überfall die HNO… [+153550 chars]",,de,'Krieg'
https://www.diepresse.com/19317209/e-control-stromverbrauch-2024-gestiegen-gasverbrauch-geht-zurueck,https://www.diepresse.com/19317209/e-control-stromverbrauch-2024-gestiegen-gasverbrauch-geht-zurueck,0,www.diepresse.com,"E-Control: Stromverbrauch 2024 gestiegen, Gasverbrauch geht zurück","Die Gasspeicher leeren sich schneller als sonst zu dieser Jahreszeit, der Füllstand soll aber trotzdem für mehr als ein halbes Jahr reichen.",https://img.diepresse.com/public/incoming/n5w646-imago-images-0202625343/alternates/DPR_SOCIAL_NACHRICHTEN/imago%20images%200202625343,2025-02-01T10:35:45Z,,"Die Gasspeicher leeren sich schneller als sonst zu dieser Jahreszeit, der Füllstand soll aber trotzdem für mehr als ein halbes Jahr reichen.
Der Stromverbrauch in Österreich ist 2024 gestiegen, noch… [+3546 chars]",,de,'Gasspeicher'
https://www.faz.net/aktuell/politik/ukraine/friedenstruppen-fuer-die-ukraine-das-sind-die-vorschlaege-110267444.html,https://www.faz.net/aktuell/politik/ukraine/friedenstruppen-fuer-die-ukraine-das-sind-die-vorschlaege-110267444.html,0,www.faz.net,Putins Angriffskrieg: Die Debatte über Friedenstruppen in der Ukraine läuft,"Russland rückt im Donbass vor. Ein Sieg ist für beide Seiten fern, und so diskutieren Fachleute über eine Waffenruhe. Und über europäische Soldaten, die sie sichern könnten.",https://media0.faz.net/ppmedia/aktuell/3914036998/1.10267744/facebook_teaser/russische-soldaten-schwenken.jpg,2025-02-01T11:30:38Z,http://archive.md/20250201114401/https://www.faz.net/aktuell/politik/ukraine/friedenstruppen-fuer-die-ukraine-das-sind-die-vorschlaege-110267444.html,"Die russische Armee rückt in der Ukraine seit Monaten vor zwar langsam, aber so stetig, dass Fachleute im Augenblick keine Hoffnung auf ein baldiges Ende des Vormarsches haben. Insider aus jenen Stru… [+10485 chars]",,de,'Putin'
https://www.zeit.de/news/2025-02/01/special-olympics-sportler-bei-bayern-spiel-gewuerdigt,https://www.zeit.de/news/2025-02/01/special-olympics-sportler-bei-bayern-spiel-gewuerdigt,0,www.zeit.de,Weltwinterspiele in Turin: Special-Olympics-Sportler bei Bayern-Spiel gewürdigt,Hier finden Sie Informationen zu dem Thema „Weltwinterspiele in Turin“. Lesen Sie jetzt „Special-Olympics-Sportler bei Bayern-Spiel gewürdigt“.,https://img.zeit.de/news/2025-02/01/special-olympics-sportler-bei-bayern-spiel-gewuerdigt-image-group/wide__1300x731,2025-02-01T14:24:54Z,,Vor dem Spiel zwischen dem FC Bayern München und Holstein Kiel in der Fußball-Bundesliga wurden die Special-Olympics-Athleten in Richtung der Weltwinterspiele in Turin verabschiedet. 53 deutsche Athl… [+1474 chars],,de,'Bayern'
https://www.zeit.de/news/2025-02/01/bayern-warnung-vor-grossen-spielen-sinne-schaerfen,https://www.zeit.de/news/2025-02/01/bayern-warnung-vor-grossen-spielen-sinne-schaerfen,0,www.zeit.de,"Fußball-Bundesliga: Bayern-Warnung vor großen Spielen - ""Sinne schärfen""","Hier finden Sie Informationen zu dem Thema „Fußball-Bundesliga“. Lesen Sie jetzt „Bayern-Warnung vor großen Spielen - ""Sinne schärfen""“.",https://img.zeit.de/news/2025-02/01/bayern-warnung-vor-grossen-spielen-sinne-schaerfen-image-group/wide__1300x731,2025-02-01T18:16:00Z,,"Nach der verrückten Schlussphase beim 4:3 gegen Holstein Kiel blickt der FC Bayern nicht unbeschwert richtungsweisenden Aufgaben im Februar entgegen. «Natürlich müssen wir die Sinne schärfen», sagte … [+1820 chars]",,de,'Bayern'
https://www.zeit.de/news/2025-02/01/kiew-tote-und-verletzte-nach-bombeneinschlag-in-sudscha,https://www.zeit.de/news/2025-02/01/kiew-tote-und-verletzte-nach-bombeneinschlag-in-sudscha,0,www.zeit.de,Russisch-ukrainischer Krieg: Kiew: Tote und Verletzte nach Bombeneinschlag in Sudscha,Hier finden Sie Informationen zu dem Thema „Russisch-ukrainischer Krieg“. Lesen Sie jetzt „Kiew: Tote und Verletzte nach Bombeneinschlag in Sudscha“.,https://img.zeit.de/news/2025-02/01/kiew-tote-und-verletzte-nach-bombeneinschlag-in-sudscha-image-group/wide__1300x731,2025-02-01T21:15:02Z,,In der von Kiews Truppen kontrollierten Stadt Sudscha im russischen Gebiet Kursk sollen nach ukrainischen Angaben beim Einschlag einer Gleitbombe in einem Gebäude mindestens vier Menschen getötet wor… [+976 chars],,de,'Krieg'
https://www.zeit.de/news/2025-02/02/vesperkirchen-in-bayern-oeffnen-ihre-tueren,https://www.zeit.de/news/2025-02/02/vesperkirchen-in-bayern-oeffnen-ihre-tueren,0,www.zeit.de,"Soziales: ""Vesperkirchen"" in Bayern öffnen ihre Türen","Hier finden Sie Informationen zu dem Thema „Soziales“. Lesen Sie jetzt „""Vesperkirchen"" in Bayern öffnen ihre Türen“.",https://img.zeit.de/news/2025-02/02/vesperkirchen-in-bayern-oeffnen-ihre-tueren-image-group/wide__1300x731,2025-02-02T04:00:39Z,,"Viele «Vesperkirchen» in Bayern öffnen in diesen Tagen wieder ihre Türen. In der kalten Jahreszeit bieten Kirchen damit Menschen eine warme Mahlzeit, vor allem aber eine Möglichkeit zum Austausch und… [+2123 chars]",,de,'Bayern'
https://www.zeit.de/politik/ausland/2025-02/ukraine-russland-krieg-sudscha-angriff-anschuldigungen,https://www.zeit.de/politik/ausland/2025-02/ukraine-russland-krieg-sudscha-angriff-anschuldigungen,0,www.zeit.de,Krieg in der Ukraine: Russland und Ukraine geben einander die Schuld für Angriff in Sudscha,"Laut der Ukraine schlug eine russische Gleitbombe in einer Notunterkunft auf russischem Gebiet ein. Aus Moskau heißt es, die Ukraine habe die Unterkunft beschossen.",https://img.zeit.de/politik/ausland/2025-02/ukraine-russland-krieg-sudscha-angriff-anschuldigungen-bild/wide__1300x731,2025-02-02T06:21:35Z,http://archive.md/20250202064731/https://www.zeit.de/politik/ausland/2025-02/ukraine-russland-krieg-sudscha-angriff-anschuldigungen,"In der von ukrainischen Truppen kontrollierten Stadt Sudscha
 im russischen Gebiet Kursk sind nach Angaben des Generalstabs in Kyjiw mindestens vier Menschen gestorben. Demnach schlug eine russische… [+1990 chars]",,de,'Krieg'
https://t3n.de/news/gigawattstunden-sparen-wie-30-zeilen-code-den-energiehunger-von-datenzentren-zuegeln-koennten-1670102/,https://t3n.de/news/gigawattstunden-sparen-wie-30-zeilen-code-den-energiehunger-von-datenzentren-zuegeln-koennten-1670102/,0,t3n.de,Gigawattstunden sparen: Wie 30 Zeilen Code den Energiehunger von Datenzentren zügeln könnten,"Weil Training und Betrieb von KI-Systemen enorm viel Energie verbrauchen, wollen Tech-Konzerne verstärkt auf Atomkraftwerke setzen. Dabei könnten einige kleinere Anpassungen den Stromverbrauch der Rechenzentren deutlich drosseln.weiterlesen auf t3n.de",https://t3n.de/news/wp-content/uploads/2023/12/shutterstock_2030685899.jpg,2025-02-02T11:15:00Z,,"Im Herbst 2024 haben Forscher:innen mit Perseus ein Open-Source-Tool vorgestellt, das den Stromverbrauch beim Training von großen Sprachmodellen wie OpenAIs GPT um bis zu 30 Prozent senken können sol… [+2136 chars]",,de,'Energie sparen'
https://www.sueddeutsche.de/wirtschaft/klima-energie-subventionen-gas-kohle-g7-li.3193245,https://www.sueddeutsche.de/wirtschaft/klima-energie-subventionen-gas-kohle-g7-li.3193245,0,www.sueddeutsche.de,"Subventionen: Mehr Geld für Kohle, Gas und Öl statt weniger",Eigentlich wollten die Industrieländer der G7 bis Ende dieses Jahres auf fossile Subventionen verzichten. Nun zeigt eine Studie: Statt weniger wurde fast überall mehr Geld für sie ausgegeben.,https://www.sueddeutsche.de/2024/01/14/22785cb7-0eab-4a28-afe9-8c47f8466f6e.jpeg?q=60&fm=webp&width=1200&rect=0%2C66%2C1365%2C768,2025-02-02T15:38:10Z,http://archive.md/20250203102457/https://www.sueddeutsche.de/wirtschaft/klima-energie-subventionen-gas-kohle-g7-li.3193245,"2. Februar 2025, 16:38 UhrLesezeit: 2 Min.
Eigentlich wollten die Industrieländer der G7 bis Ende dieses Jahres auf fossile Subventionen verzichten. Nun zeigt eine Studie: Statt weniger wurde fast ü… [+502 chars]",,de,'Öl'
https://www.zeit.de/news/2025-02/02/alba-berlin-verliert-klassiker-bei-bayern-muenchen,https://www.zeit.de/news/2025-02/02/alba-berlin-verliert-klassiker-bei-bayern-muenchen,0,www.zeit.de,Basketball: Alba Berlin verliert Klassiker bei Bayern München,Hier finden Sie Informationen zu dem Thema „Basketball“. Lesen Sie jetzt „Alba Berlin verliert Klassiker bei Bayern München“.,https://img.zeit.de/news/2025-02/02/alba-berlin-verliert-klassiker-bei-bayern-muenchen-image-group/wide__1300x731,2025-02-02T17:52:45Z,,"Alba Berlin hat den Klassiker der Basketball-Bundesliga verloren. Die Berliner zogen vor 11.200 Zuschauern beim Dauerrivalen FC Bayern München trotz großen Kampfes nach Verlängerung mit 86:99 (38:41,… [+1326 chars]",,de,'Bayern'
https://www.n-tv.de/ratgeber/Kellerdecke-daemmen-Diese-sechs-Fehler-vermeiden-Sie-besser-article25519872.html,https://www.n-tv.de/ratgeber/Kellerdecke-daemmen-Diese-sechs-Fehler-vermeiden-Sie-besser-article25519872.html,0,www.n-tv.de,Einfach Energie sparen: Kellerdecke dämmen: Diese sechs Fehler vermeiden Sie besser,"Wer die Kellerdecke nachträglich isoliert, kann Heizkosten sparen. Einige Dämmarbeiten können handwerklich geschickte Laien selbst erledigen. Diese häufigen Fehler lässt man dabei lieber aus.",https://www.n-tv.de/img/incoming/crop25519389/1451329681-cImg_16_9-w1200/Manchmal-sollte-besser-ein-Profi-ran-wer-seinen-Keller-dammen-will-sollte-sich-vorab-auf-jeden-Fall-beraten-lassen.jpg,2025-02-02T18:51:50Z,,"Wer die Kellerdecke nachträglich isoliert, kann Heizkosten sparen. Einige Dämmarbeiten können handwerklich geschickte Laien selbst erledigen. Diese häufigen Fehler lässt man dabei lieber aus.
Eine F… [+4318 chars]",,de,'Energie sparen'
https://www.zeit.de/news/2025-02/02/laut-wuetend-schrill-pussy-riot-klagen-putin-an,https://www.zeit.de/news/2025-02/02/laut-wuetend-schrill-pussy-riot-klagen-putin-an,0,www.zeit.de,"Kunstkollektiv: Laut, wütend, schrill: Pussy Riot klagen Putin an","Hier finden Sie Informationen zu dem Thema „Kunstkollektiv“. Lesen Sie jetzt „Laut, wütend, schrill: Pussy Riot klagen Putin an“.",https://img.zeit.de/news/2025-02/02/laut-wuetend-schrill-pussy-riot-klagen-putin-an-image-group/wide__1300x731,2025-02-02T22:34:22Z,https://web.archive.org/web/20250204054429/https://www.zeit.de/news/2025-02/02/laut-wuetend-schrill-pussy-riot-klagen-putin-an,"Pussy Riot sind mit einer Neuauflage ihrer Show «Riot Days» auf Tour und legen in ihrer Anklage des russischen Präsidenten Wladimir Putin gewaltig nach. «Putin ist ein Mörder!», prangert das feminist… [+1726 chars]",,de,'Krieg'
https://www.zeit.de/news/2025-02/03/nebel-und-glaette-zum-wochenstart-in-bayern,https://www.zeit.de/news/2025-02/03/nebel-und-glaette-zum-wochenstart-in-bayern,0,www.zeit.de,Wetter: Nebel und Glätte zum Wochenstart in Bayern,Hier finden Sie Informationen zu dem Thema „Wetter“. Lesen Sie jetzt „Nebel und Glätte zum Wochenstart in Bayern“.,https://img.zeit.de/news/2025-02/03/nebel-und-glaette-zum-wochenstart-in-bayern-image-group/wide__1300x731,2025-02-03T09:39:11Z,,In weiten Teilen Bayerns bleibt es in den kommenden Tagen neblig und frostig. Der Deutsche Wetterdienst (DWD) warnt insbesondere nachts und in den Morgenstunden örtlich vor Glätte. Demnach müssen Aut… [+1304 chars],,de,'Bayern'
https://www.n-tv.de/panorama/Verbliebene-Potomac-Opfer-werden-tief-im-Wrack-vermutet-article25534782.html,https://www.n-tv.de/panorama/Verbliebene-Potomac-Opfer-werden-tief-im-Wrack-vermutet-article25534782.html,0,www.n-tv.de,55 Leichen geborgen: Verbliebene Potomac-Opfer werden tief im Wrack vermutet,"Nach dem Flugzeugzusammenstoß über dem Potomac in Washington D.C. erweist sich die Bergung der Opfer als extrem schwierig. 55 Leichen sind bereits identifiziert, doch einige Opfer sind noch im Wrack eingeschlossen. Die Einsatzkräfte kämpfen gegen Kälte und Tr…",https://www.n-tv.de/img/incoming/crop25534795/7511323254-cImg_16_9-w1200/bc95bcbdb6d4c84344100b0a551f9b19.jpg,2025-02-03T10:05:52Z,https://web.archive.org/web/20250206161613/https://www.n-tv.de/panorama/Verbliebene-Potomac-Opfer-werden-tief-im-Wrack-vermutet-article25534782.html,"Nach dem Flugzeugzusammenstoß über dem Potomac in Washington D.C. erweist sich die Bergung der Opfer als extrem schwierig. 55 Leichen sind bereits identifiziert, doch einige Opfer sind noch im Wrack … [+2714 chars]",,de,'Kälte'
https://www.welt.de/politik/ausland/article255320668/Slowakei-Warum-Putin-Freund-Fico-die-Nerven-verliert.html,https://www.welt.de/politik/ausland/article255320668/Slowakei-Warum-Putin-Freund-Fico-die-Nerven-verliert.html,0,www.welt.de,"„Umsturzpläne“, „verlogenes Theater“ – warum Putin-Freund Fico die Nerven verliert",In der Slowakei gehen Zehntausende gegen den pro-russischen Kurs des Premierministers auf die Straße. Fico wittert bereits einen „slowakischen Maidan“ und wirft der Opposition Umsturzphantasien vor. Die heftige Reaktion hängt auch mit einem folgenschweren Mom…,https://img.welt.de/img/politik/ausland/mobile255320666/4897936667-ci16x9-w1200/Protest-in-der-Slowakei.jpg,2025-02-03T11:36:05Z,,In der Slowakei gehen Zehntausende gegen den pro-russischen Kurs des Premierministers auf die Straße. Fico wittert bereits einen slowakischen Maidan und wirft der Opposition Umsturzphantasien vor. Di… [+7007 chars],,de,'Putin'
https://www.zeit.de/news/2025-02/03/bio-anbau-in-bayern-stagniert-nachfrage-waechst-kraeftig,https://www.zeit.de/news/2025-02/03/bio-anbau-in-bayern-stagniert-nachfrage-waechst-kraeftig,0,www.zeit.de,Bio-Landwirtschaft: Bio-Anbau in Bayern stagniert - Nachfrage wächst kräftig,Hier finden Sie Informationen zu dem Thema „Bio-Landwirtschaft“. Lesen Sie jetzt „Bio-Anbau in Bayern stagniert - Nachfrage wächst kräftig“.,https://img.zeit.de/news/2025-02/03/bio-anbau-in-bayern-stagniert-nachfrage-waechst-kraeftig-image-group/wide__1300x731,2025-02-03T12:22:05Z,,"Die Bio-Anbaufläche in Bayern hat im vergangenen Jahr nur leicht zugelegt. Gleichzeitig kauften wieder mehr Menschen Bio-Lebensmittel, sagte Andreas Hopf von der Vermarktungsgesellschaft für die Biob… [+1242 chars]",,de,'Bayern'
https://www.focus.de/wissen/natur/futter-und-schutz-so-koennen-sie-igeln-voegeln-und-eichhoernchen-im-winter-helfen_873c84cb-3852-45fa-8d23-c23f40e38029.html,https://www.focus.de/wissen/natur/futter-und-schutz-so-koennen-sie-igeln-voegeln-und-eichhoernchen-im-winter-helfen_873c84cb-3852-45fa-8d23-c23f40e38029.html,0,www.focus.de,"Futter und Schutz - So können Sie Igeln, Vögeln und Eichhörnchen im Winter helfen","Bei Frost und Schnee können Sie die Wildtiere in Ihrem Garten beim Überwintern unterstützen. Dabei kommt es nicht nur auf das geeignete Futter an, sondern auch auf den richtigen Umgang mit Tieren, die Winterschlaf halten.",https://quadro.burda-forward.de/ctf/49f51d69-234c-49f9-85c4-68497b0bfef4.9abd42ba-419e-48e2-a9c8-bd23ac7fae62.jpeg?im=Resize%3D%281200%2C630%29&hash=0dc6b258399975704832399d898d277565e00c2d5a438994cc936cdd2ecacd51,2025-02-03T13:07:00Z,https://web.archive.org/web/20250206191051/https://www.focus.de/wissen/natur/futter-und-schutz-so-koennen-sie-igeln-voegeln-und-eichhoernchen-im-winter-helfen_873c84cb-3852-45fa-8d23-c23f40e38029.html,"Viele Wildtiere tummeln sich auch im Winter in den Gärten. Dort finden Igel, Eichhörnchen und Vögel Zuflucht. Doch Frost und Schnee erschweren den Gartenbewohnern die Futtersuche. Wie Sie ihnen dabei… [+7530 chars]",,de,'Winter'
https://taz.de/Deutschlandbild-in-Syrien/!6066229/,https://taz.de/Deutschlandbild-in-Syrien/!6066229/,0,taz.de,"Deutschlandbild in Syrien: Autos, Wurst und humanitäre Hilfe",Nach dem Sturz von Assad schauen viele Sy­re­r:in­nen optimistisch in Richtung Bundesrepublik. Doch auch die Kälte der Deutschen spielt eine Rolle,https://taz.de/picture/7505129/1200/37591715-1.jpeg,2025-02-03T16:18:00Z,,Nach dem Sturz von Assad schauen viele Sy­re­r:in­nen optimistisch in Richtung Bundesrepublik. Doch auch die Kälte der Deutschen spielt eine Rolle mehr...,,de,'Kälte'
https://www.zeit.de/news/2025-02/03/fc-bayern-verleiht-adam-aznou-nach-spanien,https://www.zeit.de/news/2025-02/03/fc-bayern-verleiht-adam-aznou-nach-spanien,0,www.zeit.de,Fußball-Bundesliga: FC Bayern verleiht Adam Aznou nach Spanien,Hier finden Sie Informationen zu dem Thema „Fußball-Bundesliga“. Lesen Sie jetzt „FC Bayern verleiht Adam Aznou nach Spanien“.,https://img.zeit.de/news/2025-02/03/fc-bayern-verleiht-adam-aznou-nach-spanien-image-group/wide__1300x731,2025-02-03T20:36:00Z,,Adam Aznou verlässt den Fußball-Bundesligisten FC Bayern München und wird bis zum Ende der Saison an den spanischen Erstligisten Real Valladolid ausgeliehen. Das gab der Rekordmeister am Montag bekan… [+441 chars],,de,'Bayern'
https://www.zeit.de/politik/ausland/2025-02/donald-trump-ukraine-krieg-forderung-seltene-erden-us-hilfen,https://www.zeit.de/politik/ausland/2025-02/donald-trump-ukraine-krieg-forderung-seltene-erden-us-hilfen,0,www.zeit.de,Krieg in der Ukraine: Trump fordert von Ukraine seltene Erden im Austausch für Unterstützung,"Der US-Präsident verlangt für die Fortsetzung von US-Militärhilfe eine ""Sicherheit"" von der Ukraine. Bundeskanzler Scholz kritisiert die Forderung als egoistisch.",https://img.zeit.de/politik/ausland/2025-02/donald-trump-ukraine-krieg-forderung-seltene-erden-us-hilfen-bild/wide__1300x731,2025-02-04T02:37:37Z,http://archive.md/20250204090658/https://www.zeit.de/politik/ausland/2025-02/donald-trump-ukraine-krieg-forderung-seltene-erden-us-hilfen,"US-Präsident Donald Trump hat von der Ukraine wertvolle Rohstoffe im Austausch für weitere US-Hilfen gefordert. Trump sagte am Montag in Washington, seine Regierung wolle ein Abkommen mit der Regieru… [+1614 chars]",,de,'Krieg'
https://www.zeit.de/news/2025-02/04/trump-will-von-ukraine-krieg-wirtschaftlich-profitieren,https://www.zeit.de/news/2025-02/04/trump-will-von-ukraine-krieg-wirtschaftlich-profitieren,0,www.zeit.de,Lage im Überblick: Trump will von Ukraine-Krieg wirtschaftlich profitieren,Hier finden Sie Informationen zu dem Thema „Lage im Überblick“. Lesen Sie jetzt „Trump will von Ukraine-Krieg wirtschaftlich profitieren“.,https://img.zeit.de/news/2025-02/04/trump-will-von-ukraine-krieg-wirtschaftlich-profitieren-image-group/wide__1300x731,2025-02-04T03:25:58Z,,Mit Äußerungen über die Ausbeutung von Bodenschätzen in der Ukraine im Gegenzug für US-Militärhilfe hat Präsident Donald Trump scharfe Kritik der Bundesregierung auf sich gezogen. Kanzler Olaf Scholz… [+4713 chars],,de,'Krieg'
https://www.zeit.de/politik/ausland/2025-02/fossile-energien-us-senat-bestaetigung-chris-wright-energieminister,https://www.zeit.de/politik/ausland/2025-02/fossile-energien-us-senat-bestaetigung-chris-wright-energieminister,0,www.zeit.de,Trumps Kabinett: US-Senat bestätigt Chris Wright als Energieminister,Der US-Senat hat für den CEO eines Öldienstleisters als neuen Energieminister gestimmt. Chris Wright gilt als Gegner der Bemühungen im Kampf gegen den Klimawandel.,https://img.zeit.de/administratives/sharing/fallback-image/wide__1300x731,2025-02-04T05:38:46Z,http://archive.md/20250204091056/https://www.zeit.de/politik/ausland/2025-02/fossile-energien-us-senat-bestaetigung-chris-wright-energieminister,"Chris Wright, CEO des US-Öldienstleisters Liberty Energy, ist vom US-Senat als Energieminister der Vereinigten Staaten bestätigt worden. Der Senat stimmte der Nominierung von US-Präsident Donald Trum… [+738 chars]",,de,'fossile Energie'
https://www.welt.de/geschichte/article255285382/Halligflut-1825-Die-meisten-halbnackt-alle-durchnaesst-alle-vor-Angst-und-Kaelte-zitternd.html,https://www.welt.de/geschichte/article255285382/Halligflut-1825-Die-meisten-halbnackt-alle-durchnaesst-alle-vor-Angst-und-Kaelte-zitternd.html,0,www.welt.de,"„Die meisten halbnackt, alle durchnässt, alle vor Angst und Kälte zitternd“","Während und nach der napoleonischen Besatzung war der Küstenschutz an der Nordsee vernachlässigt worden. Daher weitete sich die Sturmflut vom 3./4. Februar 1825 zu einer Katastrophe aus, der Hunderte zum Opfer fielen. Die Konsequenzen wirken bis heute.",https://img.welt.de/img/geschichte/mobile255307324/5457933697-ci16x9-w1200/Image-679cf209103e042fb1b7f170.jpg,2025-02-04T06:26:39Z,,"Während und nach der napoleonischen Besatzung war der Küstenschutz an der Nordsee vernachlässigt worden. Daher weitete sich die Sturmflut vom 3./4. Februar 1825 zu einer Katastrophe aus, der Hunderte… [+6619 chars]",,de,'Kälte'
https://www.zeit.de/news/2025-02/04/sonne-in-den-alpen-trueb-in-nordbayern,https://www.zeit.de/news/2025-02/04/sonne-in-den-alpen-trueb-in-nordbayern,0,www.zeit.de,"Wetter in Bayern: Sonne in den Alpen, trüb in Nordbayern","Hier finden Sie Informationen zu dem Thema „Wetter in Bayern“. Lesen Sie jetzt „Sonne in den Alpen, trüb in Nordbayern“.",https://img.zeit.de/news/2025-02/04/sonne-in-den-alpen-trueb-in-nordbayern-image-group/wide__1300x731,2025-02-04T07:13:59Z,,"Während die Sonne auf die Alpen und das Vorland scheint, bleibt es im Norden Bayerns vorerst trüb und wolkig. An den Alpen kann es nach Informationen des Deutschen Wetterdienstes (DWD) am Dienstag bi… [+883 chars]",,de,'Bayern'
https://www.welt.de/sport/wintersport/article255326962/Georg-Hackl-Das-habe-ich-ehrlich-gesagt-etwas-unterschaetzt.html,https://www.welt.de/sport/wintersport/article255326962/Georg-Hackl-Das-habe-ich-ehrlich-gesagt-etwas-unterschaetzt.html,0,www.welt.de,„Das wäre natürlich eine Katastrophe für den Rodelsport“,"Georg Hackl ist ein Wintersport-Held hierzulande, eine Legende. Dass er vor knapp drei Jahren als Trainer zu den Österreichern wechselte, sorgte für viel Aufsehen. Und er arbeitet erfolgreich, sehr sogar, wie die letzte Saison zeigte. Ein Gespräch.",https://img.welt.de/img/sport/wintersport/mobile255333896/7747930267-ci16x9-w1200/AUT-Medientag-Rodel-Austria.jpg,2025-02-04T07:53:27Z,https://web.archive.org/web/20250207190130/https://www.welt.de/sport/wintersport/article255326962/Georg-Hackl-Das-habe-ich-ehrlich-gesagt-etwas-unterschaetzt.html,"Georg Hackl ist ein Wintersport-Held hierzulande, eine Legende. Dass er vor knapp drei Jahren als Trainer zu den Österreichern wechselte, sorgte für viel Aufsehen. Und er arbeitet erfolgreich, sehr s… [+8585 chars]",,de,'Kälte'
