index,url,valid,domain,title,description,image,published,archive,content,quote,language,keyword
https://www.nzz.ch/meinung/ukraine-krieg-die-bittere-arithmetik-eines-fatalen-rechenfehlers-ld.1728529,https://www.nzz.ch/meinung/ukraine-krieg-die-bittere-arithmetik-eines-fatalen-rechenfehlers-ld.1728529,0,www.nzz.ch,SERIE - Die bittere Arithmetik eines fatalen Rechenfehlers – warum der Krieg in der Ukraine nicht so bald enden wird,"Hätte man vor einem Jahr das heutige Kriegsszenario prophezeit, hätten viele dessen Möglichkeit verworfen. Doch die Ukraine hält stand, und Russland versagt. Putin spielt auf Zeit, Selenski schöpft Hoffnung. Derweil ist kein Ende der Kampfhandlungen in Sicht.","https://img.nzz.ch/2023/03/02/df5b1945-063a-4f8f-b3bc-f5d4e5aef326.jpeg?width=1200&height=675&fit=bound&quality=75&auto=webp&crop=3957,2226,x0,y412&wmark=nzz",2023-03-05T04:30:00Z,http://archive.md/20230305062921/https://www.nzz.ch/meinung/ukraine-krieg-die-bittere-arithmetik-eines-fatalen-rechenfehlers-ld.1728529,"Zerstörte Panzer am gefrorenen Fluss Siwerski Donez in der Nähe von Bohoroditschne, Januar 2023.
In dem Jahr, das seit dem Einmarsch Russlands in die Ukraine vergangen ist, hat sich der Krieg anders… [+7049 chars]",,de,'Krieg'
https://www.nzz.ch/wissenschaft/methan-aus-wasserstoff-und-co2-mittels-katalysator-ld.1725371,https://www.nzz.ch/wissenschaft/methan-aus-wasserstoff-und-co2-mittels-katalysator-ld.1725371,0,www.nzz.ch,Grünes Methan für Reservekraftwerke: Mineral-Kügelchen machen es möglich,"Synthetisches Methan ist fast identisch mit Erdgas – aber klimaneutral. Der Brennstoff, produziert aus Wasserstoff und CO2, kann in der existierenden Gasinfrastruktur eingesetzt werden. Der Empa gelang nun eine Verbesserung bei der Herstellung von Methan.","https://img.nzz.ch/2023/02/28/a8595f6c-c034-4670-8674-a529bffef037.jpeg?width=1200&height=674&fit=bound&quality=75&auto=webp&crop=1428,803,x0,y641&wmark=nzz",2023-03-05T04:30:00Z,http://archive.md/20230305130258/https://www.nzz.ch/wissenschaft/methan-aus-wasserstoff-und-co2-mittels-katalysator-ld.1725371,"Die Herstellung von synthetischem Methan wird nicht nur an der Empa erforscht, sondern auch im Paul-Scherrer-Institut (diese Aufnahme). 
Photovoltaik, Windenergie und auch Wasserkraft sie alle sind … [+6869 chars]",,de,'Gas'
https://www.n-tv.de/wirtschaft/Stadtwerken-geht-Liquiditaet-fuer-Gaseinkauf-aus-article23961953.html,https://www.n-tv.de/wirtschaft/Stadtwerken-geht-Liquiditaet-fuer-Gaseinkauf-aus-article23961953.html,0,www.n-tv.de,Ruf nach größerem Rettungsschirm: Stadtwerken geht Liquidität für Gaseinkauf aus,"Seit dem extremen Energiepreisanstieg infolge des Ukraine-Kriegs müssen Versorgungsunternehmen bei der Beschaffung auf dem Energiemarkt gewaltige Summen als Sicherheiten hinterlegen. Mit der jüngsten Preisentspannung ist dieser Aufwand nicht etwa gesunken, so…",https://bilder4.n-tv.de/img/incoming/crop23961963/3891322504-cImg_16_9-w1200/281846869.jpg,2023-03-05T06:29:46Z,,Seit dem extremen Energiepreisanstieg infolge des Ukraine-Kriegs müssen Versorgungsunternehmen bei der Beschaffung auf dem Energiemarkt gewaltige Summen als Sicherheiten hinterlegen. Mit der jüngsten… [+2320 chars],,de,'Gas'
https://www.n-tv.de/ratgeber/Diese-Heizungsalternativen-gibt-es-jetzt-article23956175.html,https://www.n-tv.de/ratgeber/Diese-Heizungsalternativen-gibt-es-jetzt-article23956175.html,0,www.n-tv.de,Öl- und Gasheizungen vor Aus: Diese Heizungsalternativen gibt es jetzt,"Derzeit sorgt der Wirtschaftsminister mit einem vorzeitigen Verbot neuer Gas- und Ölheizungen für Unruhe. Zwar ist der Gesetzentwurf noch keine ausgemachte Sache, dennoch kann es lohnen, sich schon mal über Alternativen und deren Förderung schlau zu machen.",https://bilder3.n-tv.de/img/incoming/crop23958422/172132778-cImg_16_9-w1200/imago0238226576h.jpg,2023-03-05T06:30:48Z,https://web.archive.org/web/20230305075426/https://www.n-tv.de/ratgeber/Diese-Heizungsalternativen-gibt-es-jetzt-article23956175.html,"Derzeit sorgt der Wirtschaftsminister mit einem vorzeitigen Verbot neuer Gas- und Ölheizungen für Unruhe. Zwar ist der Gesetzentwurf noch keine ausgemachte Sache, dennoch kann es lohnen, sich schon m… [+11936 chars]",,de,'Öl'
https://salzburg.orf.at/stories/3197291/,https://salzburg.orf.at/stories/3197291/,0,salzburg.orf.at,Immer mehr heizen zentral mit Holzöfen,"Wegen teurem Strom, Gas und Erdöl werden  Holzöfen immer beliebter. Viele wollen deren Wärme für das ganze Haus oder die ganze Wohnung nutzen. Zentralheizungssysteme, die Kachelöfen integrieren, seien besonders gefragt, sagen Ofensetzer.",https://ibs.orf.at/sbg?image=https%3A%2F%2Foekastatic.orf.at%2Fmims%2F2022%2F50%2F71%2Fcrops%2Fw%3D1200%2Ch%3D627%2Cq%3D75%2F1601924_master_587071_energie_heizen_4.jpg%3Fs%3D38f656396ce5c2c22a305a5d8482fb7384d25244,2023-03-05T07:24:55Z,,"Die gemütliche Strahlungswärme von Feuer, die bei vielen Öfen frei sichtbaren Flammen und eine Energie, die aus heimischen Wäldern zu gut 140 Euro pro Raummeter Scheitholz kommt: Darum kaufen immer m… [+647 chars]",,de,'Gas'
https://www.bild.de/bild-plus/politik/inland/politik-inland/strom-und-gas-deshalb-sind-die-bremsen-murks-83096504.bild.html,https://www.bild.de/bild-plus/politik/inland/politik-inland/strom-und-gas-deshalb-sind-die-bremsen-murks-83096504.bild.html,0,www.bild.de,*** BILDplus Inhalt *** Strom und Gas - Deshalb sind die Bremsen Murks,"Sie waren gut gemeint, aber sie kommen zu spät und sind oft wirkungslos: Über Strom- und Gaspreisbremse freuen sich vor allem die Energie­versorger.","https://images.bild.de/6403651b834b0a045728fbed/7ebc0127a280b6732211a2993eea7259,80b174bd?w=1280",2023-03-05T07:29:38Z,http://archive.md/20230305090711/https://www.bild.de/bild-plus/politik/inland/politik-inland/strom-und-gas-deshalb-sind-die-bremsen-murks-83096504.bild.html,"Gut gemeint, aber nicht gut gemacht: Deshalb sind die Strom- und Gaspreis-Bremsen Murks
Gut gemeint, aber nicht gut gemacht: Deshalb sind die Strom- und Gaspreis-Bremsen Murks
Gut gemeint, aber nic… [+688 chars]",,de,'Gas'
https://www.focus.de/politik/deutschland/kontrolle-der-dezemberhilfe-ueberpruefung-der-antraege-fuer-gas-und-strompreisbremse-millionen-honorar-fuer-pwc_id_187487106.html,https://www.focus.de/politik/deutschland/kontrolle-der-dezemberhilfe-ueberpruefung-der-antraege-fuer-gas-und-strompreisbremse-millionen-honorar-fuer-pwc_id_187487106.html,0,www.focus.de,Kontrolle der Dezemberhilfe - Überprüfung der Anträge für Gas- und Strompreisbremse - Millionen-Honorar für PwC,Die Wirtschaftsprüfungsgesellschaft PwC verdient an den Energiepreisbremsen Millionen. Für die Überprüfung der Strom- und Gaspreisbremsen-Anträge wird PwC laut Bundeswirtschaftsministerium in diesem Jahr ein Honorar „von bis zu 10 Millionen Euro“ vom Staat er…,https://p6.focus.de/img/finanzen/news/id_48092180/pricewaterhousecoopers-international-in-stuttgart..jpg?im=Crop%3D%280%2C149%2C2048%2C1024%29%3BResize%3D%281200%2C627%29&hash=ce590b989e74f4bcf3ca113765da302246999c7a51e0ef40637b50998453cfdd,2023-03-05T07:37:27Z,https://web.archive.org/web/20230305144157/https://www.focus.de/politik/deutschland/kontrolle-der-dezemberhilfe-ueberpruefung-der-antraege-fuer-gas-und-strompreisbremse-millionen-honorar-fuer-pwc_id_187487106.html,Die Wirtschaftsprüfungsgesellschaft PwC verdient an den Energiepreisbremsen Millionen. Für die Überprüfung der Strom- und Gaspreisbremsen-Anträge wird PwC laut Bundeswirtschaftsministerium in diesem … [+1220 chars],,de,'Gas'
https://www.tagesspiegel.de/internationales/sorge-vor-putin-eu-wird-moldau-offenbar-bei-aufbau-von-sicherheitssektor-helfen-9453953.html,https://www.tagesspiegel.de/internationales/sorge-vor-putin-eu-wird-moldau-offenbar-bei-aufbau-von-sicherheitssektor-helfen-9453953.html,0,www.tagesspiegel.de,Sorge vor Putin: EU wird Moldau offenbar bei Aufbau von Sicherheitssektor helfen,Seit Beginn des Ukraine-Kriegs fühlt sich auch Moldau nicht mehr sicher. Die EU will dem Land einem Bericht zufolge beim Aufbau eines Sicherheitssektors helfen.,https://www.tagesspiegel.de/images/topshot-moldova-russia-ukraine-politics-energy-protest/alternates/BASE_16_9_W1400/topshot-moldova-russia-ukraine-politics-energy-protest.jpeg,2023-03-05T07:44:01Z,http://archive.md/20230305114023/https://www.tagesspiegel.de/internationales/sorge-vor-putin-eu-wird-moldau-offenbar-bei-aufbau-von-sicherheitssektor-helfen-9453953.html,Die Europäische Union will der Republik Moldau einem Zeitungsbericht zufolge beim Aufbau eines effizienten Sicherheitssektors unterstützen. Dazu solle im Frühsommer im Rahmen einer neuen zivilen EU-M… [+1807 chars],,de,'Putin'
https://www.stern.de/gesellschaft/regional/sachsen/energieversorgung--gasspeicher-der-vng-noch-immer-gut-gefuellt-33253120.html,https://www.stern.de/gesellschaft/regional/sachsen/energieversorgung--gasspeicher-der-vng-noch-immer-gut-gefuellt-33253120.html,0,www.stern.de,Energieversorgung: Gasspeicher der VNG noch immer gut gefüllt,Die VNG-Gasspeicher in Bad Lauchstädt und Bernburg sind noch zu rund zwei Dritteln gefüllt. Das Unternehmen hält Gassparen trotzdem weiterhin für wichtig.,https://image.stern.de/33253122/t/fU/v1/w1440/r1.7778/-/05--urnnewsmldpacom2009010123030599835512v3w800h600l12t174r1742b1705jpeg---2d9ed6fdeb298feb.jpg,2023-03-05T07:49:19Z,,"Die VNG-Gasspeicher in Bad Lauchstädt und Bernburg sind noch zu rund zwei Dritteln gefüllt. Das Unternehmen hält Gassparen trotzdem weiterhin für wichtig.
Die Gasspeicher der VNG sind noch immer rel… [+985 chars]",,de,'Energie sparen'
https://www.stern.de/gesellschaft/regional/thueringen/energie--gasspeicher-in-thueringen-noch-relativ-gut-gefuellt-33253114.html,https://www.stern.de/gesellschaft/regional/thueringen/energie--gasspeicher-in-thueringen-noch-relativ-gut-gefuellt-33253114.html,0,www.stern.de,Energie: Gasspeicher in Thüringen noch relativ gut gefüllt,"Die Befürchtungen waren groß, dass es nach dem russischen Angriffskrieg auf die Ukraine zu Engpässen beim Gas kommt. Nun zeigt sich: Es ist mehr Gas im Speicher in Thüringen als sonst zu dieser Jahreszeit.",https://image.stern.de/33253116/t/zI/v1/w1440/r1.7778/-/05--urnnewsmldpacom2009010123030599835534v3w800h600l670t174r1788b1511jpeg---a2167a08c784b90f.jpg,2023-03-05T07:53:28Z,,"Die Befürchtungen waren groß, dass es nach dem russischen Angriffskrieg auf die Ukraine zu Engpässen beim Gas kommt. Nun zeigt sich: Es ist mehr Gas im Speicher in Thüringen als sonst zu dieser Jahre… [+1899 chars]",,de,'Gas'
https://taz.de/70-Todestag-von-Josef-Stalin/!5916323/,https://taz.de/70-Todestag-von-Josef-Stalin/!5916323/,0,taz.de,70. Todestag von Josef Stalin: Sein Geist in Putins Russland,Vor 70 Jahren starb der sowjetische Diktator Josef Stalin. Sein Erbe prägt Russland und viele seiner Mechanismen werden im System Putin gefördert.,https://taz.de/picture/6129457/948/32088649-1.jpeg,2023-03-05T08:02:00Z,,"Vor 70 Jahren starb der sowjetische Diktator Josef Stalin. Sein Erbe prägt Russland und viele seiner Mechanismen werden im System Putin gefördert.
Zur Erinnerung an den Sieg in Stalingrad vor 80 Jah… [+6299 chars]",,de,'Putin'
https://consent.google.com/ml?continue=https://news.google.com/rss/articles/CBMinAFodHRwczovL3d3dy50LW9ubGluZS5kZS9uYWNocmljaHRlbi9wYW5vcmFtYS93aXNzZW4vZ2VzY2hpY2h0ZS9pZF8xMDAxMzUzNTQvc28tdmllbC1zdGFsaW4tc3RlY2t0LWluLXdsYWRpbWlyLXB1dGluLWdlZnVlcmNodGV0ZXItZGlrdGF0b3ItYWxzLXZvcmJpbGQtLmh0bWzSAQA?oc%3D5&gl=FR&hl=en-US&pc=n&src=1,https://consent.google.com/ml?continue=https://news.google.com/rss/articles/CBMinAFodHRwczovL3d3dy50LW9ubGluZS5kZS9uYWNocmljaHRlbi9wYW5vcmFtYS93aXNzZW4vZ2VzY2hpY2h0ZS9pZF8xMDAxMzUzNTQvc28tdmllbC1zdGFsaW4tc3RlY2t0LWluLXdsYWRpbWlyLXB1dGluLWdlZnVlcmNodGV0ZXItZGlrdGF0b3ItYWxzLXZvcmJpbGQtLmh0bWzSAQA?oc%3D5&gl=FR&hl=en-US&pc=n&src=1,0,consent.google.com,So viel Stalin steckt in Wladimir Putin: Gefürchteter Diktator als Vorbild? - t-online,"<ol><li>So viel Stalin steckt in Wladimir Putin: Gefürchteter Diktator als Vorbild?  t-online
</li><li>Stalin ist tot, der Stalinismus nicht - Politik  fr.de
</li><li>Vom Revolutionär zum Verbrecher: Der lange Schatten des Josef Wissarionowitsch Stalin - n-…",,2023-03-05T08:07:00Z,,"We use cookies and data to<ul><li>Deliver and maintain Google services</li><li>Track outages and protect against spam, fraud, and abuse</li><li>Measure audience engagement and site statistics to unde… [+1131 chars]",,de,'Putin'
https://consent.google.com/ml?continue=https://news.google.com/rss/articles/CBMifGh0dHBzOi8vd3d3Lm4tdHYuZGUvbWVkaWF0aGVrL2JpbGRlcnNlcmllbi9wb2xpdGlrL0Rlci1sYW5nZS1TY2hhdHRlbi1kZXMtSm9zZWYtV2lzc2FyaW9ub3dpdHNjaC1TdGFsaW4tYXJ0aWNsZTIzOTYxMDk2Lmh0bWzSAQA?oc%3D5&gl=FR&hl=en-US&pc=n&src=1,https://consent.google.com/ml?continue=https://news.google.com/rss/articles/CBMifGh0dHBzOi8vd3d3Lm4tdHYuZGUvbWVkaWF0aGVrL2JpbGRlcnNlcmllbi9wb2xpdGlrL0Rlci1sYW5nZS1TY2hhdHRlbi1kZXMtSm9zZWYtV2lzc2FyaW9ub3dpdHNjaC1TdGFsaW4tYXJ0aWNsZTIzOTYxMDk2Lmh0bWzSAQA?oc%3D5&gl=FR&hl=en-US&pc=n&src=1,0,consent.google.com,Vom Revolutionär zum Verbrecher: Der lange Schatten des Josef Wissarionowitsch Stalin - n-tv.de - n-tv NACHRICHTEN,"<ol><li>Vom Revolutionär zum Verbrecher: Der lange Schatten des Josef Wissarionowitsch Stalin - n-tv.de  n-tv NACHRICHTEN
</li><li>So viel Stalin steckt in Wladimir Putin: Gefürchteter Diktator als Vorbild?  t-online
</li><li>Stalin ist tot, der Stalinismus…",,2023-03-05T08:08:57Z,,"We use cookies and data to<ul><li>Deliver and maintain Google services</li><li>Track outages and protect against spam, fraud, and abuse</li><li>Measure audience engagement and site statistics to unde… [+1131 chars]",,de,'Putin'
https://www.welt.de/politik/ausland/plus244102509/Imperialismus-Diktatoren-ernst-nehmen-auch-im-Fall-Chinas.html,https://www.welt.de/politik/ausland/plus244102509/Imperialismus-Diktatoren-ernst-nehmen-auch-im-Fall-Chinas.html,0,www.welt.de,Diktatoren ernst nehmen – auch im Fall Chinas,"Ähnlich wie Russlands Präsident Wladimir Putin in Sachen Ukraine macht auch Peking keinen Hehl daraus, sich den Inselstaat Taiwan mit militärischer Gewalt einverleiben zu wollen. Wenn der Westen gewisse Denkfehler nicht wiederholt, besteht noch die Chance zur…",https://img.welt.de/img/politik/ausland/mobile244102507/7811355677-ci16x9-w1200-fnov-fpotl-fpi157750653/DWO-Teaser-putin-xi-aw.jpg,2023-03-05T09:18:28Z,http://archive.md/20230305095708/https://www.welt.de/politik/ausland/plus244102509/Imperialismus-Diktatoren-ernst-nehmen-auch-im-Fall-Chinas.html,"Heute erscheint es als Fehler, dass man in Berlin, Paris und Brüssel lange nicht davon ausging, dass Wladimir Putin die Ukraine nach 2014 erneut angreifen würde, zu dramatisch seien die Folgen für Mo… [+512 chars]",,de,'Putin'
https://www.welt.de/politik/ausland/plus244102509/Imperialismus-Der-Westen-muss-die-Berechenbarkeit-von-Diktatoren-ausnutzen.html,https://www.welt.de/politik/ausland/plus244102509/Imperialismus-Der-Westen-muss-die-Berechenbarkeit-von-Diktatoren-ausnutzen.html,0,www.welt.de,Der Westen muss die Berechenbarkeit von Diktatoren ausnutzen,"Ähnlich wie Russlands Präsident Wladimir Putin in Sachen Ukraine macht auch Peking keinen Hehl daraus, sich den Inselstaat Taiwan mit militärischer Gewalt einverleiben zu wollen. Wenn der Westen gewisse Denkfehler nicht wiederholt, besteht noch die Chance zur…",https://img.welt.de/img/politik/ausland/mobile244102507/7811355677-ci16x9-w1200-fnov-fpotl-fpi157750653/DWO-Teaser-putin-xi-aw.jpg,2023-03-05T09:18:28Z,http://archive.md/20230305103554/https://www.welt.de/politik/ausland/plus244102509/Imperialismus-Der-Westen-muss-die-Berechenbarkeit-von-Diktatoren-ausnutzen.html,"Heute erscheint es als Fehler, dass man in Berlin, Paris und Brüssel lange nicht davon ausging, dass Wladimir Putin die Ukraine nach 2014 erneut angreifen würde, zu dramatisch seien die Folgen für Mo… [+512 chars]",,de,'Putin'
https://www.stern.de/gesellschaft/regional/bayern/theater---krieg-und-frieden--an-der-bayerischen-staatsoper-33253316.html,https://www.stern.de/gesellschaft/regional/bayern/theater---krieg-und-frieden--an-der-bayerischen-staatsoper-33253316.html,0,www.stern.de,"Theater: ""Krieg und Frieden"" an der Bayerischen Staatsoper","""Krieg und Frieden"" an der Bayerischen Staatsoper: Unter Regie von Dmitri Tcherniakov kommt am Sonntagabend in München ein schwieriges Werk zur Aufführung. Die Oper von Sergej Prokofjew beruht auf dem gleichnamigen Roman von Leo Tolstoi und spielt im Jahr 181…",https://image.stern.de/6681672/t/31/v5/w1440/r1.7778/-/video-fallback-image.jpg,2023-03-05T09:26:53Z,,"""Krieg und Frieden"" an der Bayerischen Staatsoper: Unter Regie von Dmitri Tcherniakov kommt am Sonntagabend in München ein schwieriges Werk zur Aufführung. Die Oper von Sergej Prokofjew beruht auf de… [+3922 chars]",,de,'Putin'
https://www.wiwo.de/finanzen/immobilien/verbot-fuer-oel-und-gasheizungen-das-gasheizungsverbot-wird-ein-rohrkrepierer/29013310.html,https://www.wiwo.de/finanzen/immobilien/verbot-fuer-oel-und-gasheizungen-das-gasheizungsverbot-wird-ein-rohrkrepierer/29013310.html,0,www.wiwo.de,Verbot für Öl- und Gasheizungen: „Das Gasheizungsverbot wird ein Rohrkrepierer“,SPD und Grüne forcieren den Austausch von Heizungen. Sanierungsexperte Thomas Rolf Hermes hält das für übereilt – und warnt vor überforderten privaten Hauseigentümern.,https://www.wiwo.de/images/100-pro-imago-life-2-152638372-highres/29016150/2-format11240.jpg,2023-03-05T09:28:19Z,http://archive.md/20230305181117/https://www.wiwo.de/finanzen/immobilien/verbot-fuer-oel-und-gasheizungen-das-gasheizungsverbot-wird-ein-rohrkrepierer/29013310.html,Theorie trifft auf Realität: Der Hamburger Sanierungsspezialist Thomas Rolf Hermes nimmt derzeit an den Anhörungen in Berlin zur Reform des Gebäudeenergiegesetzes (GEG) teil. Besonders heiß wird das … [+4687 chars],,de,'Gas'
https://www.focus.de/politik/ausland/ukraine-krieg-medwedew-droht-mit-beschuss-von-rheinmetall-panzerfabrik-in-ukraine_id_57275780.html,https://www.focus.de/politik/ausland/ukraine-krieg-medwedew-droht-mit-beschuss-von-rheinmetall-panzerfabrik-in-ukraine_id_57275780.html,0,www.focus.de,Ukraine-Krieg - Stimmen und Entwicklungen - Medwedew droht mit Beschuss von Rheinmetall-Panzerfabrik in Ukraine,"Russlands Außenminister Lawrow wird in Indien ausgelacht, als er über den Krieg spricht. Ein maßgeblicher Entwickler des Sputnik-Impfstoffs wird ermordet. Russlands Einnahmen aus dem Verkauf von Öl und Gas brechen ein - ein schwerer Schlag für Putins Kriegska…",https://p6.focus.de/img/politik/ausland/id_119347052/dmitri-medwedew-ist-vizechef-des-russischen-sicherheitsrates..jpg?im=Crop%3D%280%2C60%2C2048%2C1025%29%3BResize%3D%281200%2C627%29&hash=d21c6493135f9b4ee076c4d7d477bfe2138d39dc065572304c019761226404f5,2023-03-05T09:28:20Z,https://web.archive.org/web/20230305115959/https://www.focus.de/politik/ausland/ukraine-krieg-medwedew-droht-mit-beschuss-von-rheinmetall-panzerfabrik-in-ukraine_id_57275780.html,"<ul><li>
Kommentare</li><li>
E-Mail</li><li>
Teilen</li><li>
Mehr</li><li>
Twitter</li><li>
Drucken</li><li>
Feedback</li><li>
Fehler meldenSie haben einen Fehler gefunden?
Bitte markieren S… [+10316 chars]",,de,'Öl'
https://www.bild.de/bild-plus/politik/ausland/politik-ausland/russen-kommandeur-droht-putin-mit-rueckzug-dann-faellt-die-krim-83099876.bild.html,https://www.bild.de/bild-plus/politik/ausland/politik-ausland/russen-kommandeur-droht-putin-mit-rueckzug-dann-faellt-die-krim-83099876.bild.html,0,www.bild.de,„Dann bricht die Front zusammen“ - Russen-Kommandeur droht Putin mit Rückzug!,"Ein Militär-Führer droht dem Kreml offen, sich zurückzuziehen – und die ganze Russen-Front zusammenbrechen zu lassen!","https://images.bild.de/64043e3525d16d4e9991eade/b90cd04f0d1f08a919cb523518ecef4f,36dc3898?w=1280",2023-03-05T10:28:40Z,http://archive.md/20230305105023/https://www.bild.de/bild-plus/politik/ausland/politik-ausland/russen-kommandeur-droht-putin-mit-rueckzug-dann-faellt-die-krim-83099876.bild.html,"Der Machtkampf in Russland eskaliert!
Erstmals hat ein Militär-Führer gedroht, seine Truppen zurückzuziehen und die Front zum Einsturz zu bringen. Er macht klar: Wenn MEINE Kämpfer den Rückzug antre… [+214 chars]",,de,'Putin'
https://www.handelsblatt.com/politik/international/ukraine-krieg-russland-droht-mit-angriff-auf-geplantes-rheinmetall-werk-in-ukraine/29018240.html,https://www.handelsblatt.com/politik/international/ukraine-krieg-russland-droht-mit-angriff-auf-geplantes-rheinmetall-werk-in-ukraine/29018240.html,0,www.handelsblatt.com,Ukraine-Krieg: Russland droht mit Angriff auf geplantes Rheinmetall-Werk in Ukraine,"Der Rüstungskonzern bietet der Ukraine den Bau einer Fabrik für den Panther-Panzer an. Das dürfte zwar noch dauern, aber die Antwort aus Moskau ist eindeutig.",https://www.handelsblatt.com/images/panzer-panther-von-rheinmetall/29018278/2-format2003.jpg,2023-03-05T10:32:00Z,http://archive.md/20230306053755/https://www.handelsblatt.com/politik/international/ukraine-krieg-russland-droht-mit-angriff-auf-geplantes-rheinmetall-werk-in-ukraine/29018240.html,"Panzer Panther von RheinmetallBis zur Serienproduktion dieses Modells dürfte es noch dauern. 
(Foto: dpa)
Berlin Die Pläne von Rheinmetall für den Bau einer Panzerfabrik in der Ukraine werden in Ru… [+1207 chars]",,de,'Krieg'
https://www.nzz.ch/international/norwegen-klimajugend-protestiert-fuer-die-rechte-der-samen-ld.1728759,https://www.nzz.ch/international/norwegen-klimajugend-protestiert-fuer-die-rechte-der-samen-ld.1728759,0,www.nzz.ch,Eine zornige Jugend demonstriert in Norwegen für die Rechte der samischen Urbevölkerung – und protestiert gegen Windräder,"Verkehrte Welt in Norwegen? Seit Tagen machen heftige Proteste junger Leute gegen ein grosses Windkraftwerk Schlagzeilen. Denn die Installation schränkt die indigene samische Bevölkerung in ihren Rechten bei der Rentierhaltung ein, wie das Höchste Gericht fes…","https://img.nzz.ch/2023/03/03/51b560f4-64ba-4595-a93d-ca04cb568fd5.jpeg?width=1200&height=675&fit=bound&quality=75&auto=webp&crop=5472,3078,x0,y491&wmark=nzz",2023-03-05T11:39:37Z,,"Norwegische Polizeibeamte gehen in Oslo gegen die Protestierenden vor, die den Abriss einer Windfarm an der Westküste fordern.
Zuerst Verhaftungen, dann plötzlich eine Entschuldigung von höchster St… [+6952 chars]",,de,'Windräder'
https://www.freitag.de/autoren/jamal-tuschick/texastext-jamal-tuschick-michael-thumann-russischer-revolverstil,https://www.freitag.de/autoren/jamal-tuschick/texastext-jamal-tuschick-michael-thumann-russischer-revolverstil,0,www.freitag.de,#TexasText/Jamal Tuschick | Michael Thumann - Russischer Revolverstil,Michael Thumann „Revanche. Wie Putin das bedrohlichste Regime der Welt geschaffen hat“ - Der Autor skizziert „die verhängnisvolle Linie von den polnischen Teilungen des 18. Jahrhunderts über Rapallo bis zum Bau der Nord-Stream-Pipelines“ Sehen Sie ferner http…,https://www.freitag.de/++theme++freitag.theme/freitag/fallbacks/fallback-community-3-2.png,2023-03-05T11:46:20Z,,"Sehen Sie ferner https://jamaltuschick.de/index.php?article_id=4466
*
Seit mehreren Jahren wird die Bevölkerung in Russland überall auf Krieg eingestimmt. Galia Ackerman
*
Das derzeitige Russland… [+9280 chars]",,de,'Putin'
https://www.n-tv.de/panorama/Spaetwinter-bringt-Kaelte-und-Sturmboeen-article23962353.html,https://www.n-tv.de/panorama/Spaetwinter-bringt-Kaelte-und-Sturmboeen-article23962353.html,0,www.n-tv.de,Die Wetterwoche im Schnellcheck: Spätwinter bringt Kälte und Sturmböen,"Der März bleibt ungemütlich, der Frühling ist noch nicht in Sicht. Stattdessen kommen mit der feuchtkalten Polarluft auch Schneeregen und Glätte bis ins Flachland. Mitte der Woche erfasst dann ein Sturmtief weite Teile Deutschlands.",https://bilder4.n-tv.de/img/incoming/crop23962387/5531325534-cImg_16_9-w1200/275441080.jpg,2023-03-05T12:08:47Z,https://web.archive.org/web/20230306063633/https://www.n-tv.de/panorama/Spaetwinter-bringt-Kaelte-und-Sturmboeen-article23962353.html,"Der März bleibt ungemütlich, der Frühling ist noch nicht in Sicht. Stattdessen kommen mit der feuchtkalten Polarluft auch Schneeregen und Glätte bis ins Flachland. Mitte der Woche erfasst dann ein St… [+4584 chars]",,de,'Kälte'
https://www.n-tv.de/politik/15-42-Waffenlieferungen-an-Ukraine-praegen-Wahl-in-Estland--article23143824.html,https://www.n-tv.de/politik/15-42-Waffenlieferungen-an-Ukraine-praegen-Wahl-in-Estland--article23143824.html,0,www.n-tv.de,Ukraine-Krieg im Liveticker: +++ 15:42 Waffenlieferungen an Ukraine prägen Wahl in Estland +++,"Berlin, Washington, Br\u00fcssel - \u00fcberall. n-tv berichtet von allen wichtigen Schaupl\u00e4tzen der Innen- und Au\u00dfenpolitik.",https://bilder2.n-tv.de/img/incoming/crop23332537/9041326157-cImg_16_9-w1200/Liveticker1-grau-1-Kopie.jpg,2023-03-05T12:15:00Z,,In Estland läuft seit dem Morgen die Parlamentswahl. Geprägt wird die Abstimmung auch von einem Streit um die Militärhilfen für die Ukraine im Krieg gegen die russischen Invasionstruppen. Die amtiere… [+20336 chars],,de,'Krieg'
