index,url,valid,domain,title,description,image,published,archive,content,quote,language,keyword
https://www.welt.de/politik/ausland/article247793216/Bergkarabach-Kriegsteilnehmer-prahlten-damit-dass-sie-Koepfe-abschlagen-wuerden.html,https://www.welt.de/politik/ausland/article247793216/Bergkarabach-Kriegsteilnehmer-prahlten-damit-dass-sie-Koepfe-abschlagen-wuerden.html,0,www.welt.de,"„Kriegsteilnehmer prahlten damit, dass sie Köpfe abschlagen würden“","Mehr als 100.000 Armenier sind aus Bergkarabach geflohen, nachdem Aserbaidschan die selbst verwaltete Enklave durch eine Militäroffensive zur Kapitulation und Selbstauflösung gezwungen hat. Baku beteuert, die Armenier hätten nichts zu befürchten. Eine Lüge, w…",https://img.welt.de/img/politik/ausland/mobile247795564/2021354017-ci16x9-w1200/Konflikt-in-Berg-Karabach.jpg,2023-10-03T17:08:06Z,,Nach der Rückeroberung der Südkaukasusregion Bergkarabach durch Aserbaidschan hat nach armenischen Angaben der vorerst letzte Flüchtlingsbus das Konfliktgebiet verlassen. Damit seien nun 100.514 zwan… [+6149 chars],,de,'Krieg'
https://www.jungewelt.de/artikel/460323.baku-führt-krieg-niemand-wird-die-armenier-schützen.html,https://www.jungewelt.de/artikel/460323.baku-führt-krieg-niemand-wird-die-armenier-schützen.html,0,www.jungewelt.de,Baku führt Krieg: »Niemand wird die Armenier schützen«,Nach dem Überfall auf Bergkarabach fordert die armenische Diaspora in Deutschland mehr als Worte. Sie verlangt Sanktionen gegen den Aggressor Aserbaidschan. Ein Gespräch mit Ani Menua.,https://www.jungewelt.de/img/1100/186066.jpg,2023-10-03T17:37:35Z,,Nach dem Angriff auf das armenische Bergkarabach sind laut UN-Angaben mittlerweile mehr als 100.000 Menschen nach Armenien geflohen. In einem Aufruf zur Demonstration am vergangenen Freitag in Berlin… [+3961 chars],,de,'Krieg'
https://www.stern.de/wirtschaft/news/energie--wegfall-der-gasumlagen--lemke-fordert-entlastung-fuer-kunden-33881184.html,https://www.stern.de/wirtschaft/news/energie--wegfall-der-gasumlagen--lemke-fordert-entlastung-fuer-kunden-33881184.html,0,www.stern.de,Energie: Wegfall der Gasumlagen: Lemke fordert Entlastung für Kunden,"Seit dem 1. Oktober ist die Beschaffung von Gas für die Gaslieferanten günstiger. Ministerin Lemke wünscht sich, dass diese Entlastung auch beim Kunden ankommt.",https://image.stern.de/33881186/t/0g/v1/w1440/r1.7778/-/04--urnnewsmldpacom2009010123100499432098v3w800h600l640t437r1920b1311jpeg---d187629e5839bceb.jpg,2023-10-04T03:39:55Z,,"Seit dem 1. Oktober ist die Beschaffung von Gas für die Gaslieferanten günstiger. Ministerin Lemke wünscht sich, dass diese Entlastung auch beim Kunden ankommt.
Bundesverbraucherministerin Steffi Le… [+1827 chars]",,de,'Gas'
https://www.stern.de/gesellschaft/regional/bayern/energie--aiwanger-prueft-landes-foerderprogramm-fuer-holzheizungen-33881360.html,https://www.stern.de/gesellschaft/regional/bayern/energie--aiwanger-prueft-landes-foerderprogramm-fuer-holzheizungen-33881360.html,0,www.stern.de,Energie: Aiwanger prüft Landes-Förderprogramm für Holzheizungen,"Bayerns Wirtschaftsminister Hubert Aiwanger (Freie Wähler) will ein eigenes Landes-Förderprogramm für reine Holzheizungen prüfen, sollte das Heizungsgesetz des Bundes nicht noch einmal korrigiert werden. ""Holzenergie wird gezielt ausgebremst"", kritisierte der…",https://image.stern.de/33881362/t/IN/v1/w1440/r1.7778/-/04--urnnewsmldpacom2009010123100499432663v3w800h600l303t429r1581b1317jpeg---6781ed650a564de1.jpg,2023-10-04T04:44:00Z,,"Bayerns Wirtschaftsminister Hubert Aiwanger (Freie Wähler) will ein eigenes Landes-Förderprogramm für reine Holzheizungen prüfen, sollte das Heizungsgesetz des Bundes nicht noch einmal korrigiert wer… [+2184 chars]",,de,'Fossile Energie'
https://www.faz.net/aktuell/sport/fussball/champions-league/fc-bayern-muenchen-von-sven-ulreich-in-champions-league-begeistert-19218529.html,https://www.faz.net/aktuell/sport/fussball/champions-league/fc-bayern-muenchen-von-sven-ulreich-in-champions-league-begeistert-19218529.html,0,www.faz.net,Bayern-Begeisterung um Ulreich: „Wie er den rausholt – gigantisch“,In letzter Minute rettet der Münchner Ersatztorhüter dem FC Bayern mit einer spektakulären Tat noch den Sieg im Champions-League-Spiel gegen Kopenhagen. Wie lange aber darf Sven Ulreich noch zwischen den Pfosten stehen?,https://media0.faz.net/ppmedia/aktuell/2872256051/1.9218558/facebook_teaser/im-entscheidenden-moment-zur.jpg,2023-10-04T06:32:54Z,,In seiner ersten Bankett-Rede als Vorstandsvorsitzender ernannte Jan-Christian Dreesen Torwart Sven Ulreich nach Mitternacht im Teamhotel zum Bayern-Retter von Kopenhagen. Der 35 Jahre alte Torwart h… [+3333 chars],,de,'Bayern'
https://www.focus.de/sport/fussball/bundesliga1/in-der-form-seinen-lebens-zweifelt-leroy-sane-an-zukunft-beim-fc-bayern_id_218115516.html,https://www.focus.de/sport/fussball/bundesliga1/in-der-form-seinen-lebens-zweifelt-leroy-sane-an-zukunft-beim-fc-bayern_id_218115516.html,0,www.focus.de,Weggang im Sommer 2024 möglich - In der Form seinen Lebens zweifelt Leroy Sané an Zukunft beim FC Bayern,Nach drei Spielzeiten mit reichlich Höhen und Tiefen scheint Leroy Sané endlich den Weg zur Weltklasse gefunden zu haben beim FC Bayern.,https://p6.focus.de/img/fotos/id_218185062/leroy-sane.png?im=Crop%3D%280%2C46%2C1860%2C930%29%3BResize%3D%281200%2C627%29&impolicy=perceptual&quality=mediumHigh&hash=32d9660b96440b65c7505a8c4643a8a0df2728b721c24810eb6f91cf1bed0e82,2023-10-04T06:40:45Z,,"Leroy Sané spielt bei den Bayern gerade so gut wie lange nicht. Der Flügelstürmer brilliert regelmäßig mit Tempo, Toren und inzwischen auch mit einer enormen Arbeitsrate. Demnach wird der 27-Jährige … [+1546 chars]",,de,'Bayern'
https://www.bild.de/sport/fussball/champions-league/champions-league-kopenhagen-fans-machen-sich-ueber-uli-hoeness-lustig-85626102.bild.html,https://www.bild.de/sport/fussball/champions-league/champions-league-kopenhagen-fans-machen-sich-ueber-uli-hoeness-lustig-85626102.bild.html,0,www.bild.de,Haben Sie das gesehen? - Fans machen sich über Hoeneß lustig,Die Kopenhagen-Fans machten sich vor dem Spiel gegen den FC Bayern in der Champions League über Uli Hoeneß und Thomas Müller lustig.,"https://images.bild.de/651cfd6676f5fb74d0de3edb/082905950d3081a11be787719db4c72c,7ce09324?w=1280",2023-10-04T06:58:26Z,,"Das war definitiv mal eine kreative Choreografie ...
Der 
FC Bayern siegt am zweiten Spieltag der Gruppenphase der 
Champions League gerade so mit 2:1 beim FC Kopenhagen.
Die Fans der Dänen macht… [+2723 chars]",,de,'Bayern'
https://11freunde.de/artikel/ach-hoer-doch-auf/9259542,https://11freunde.de/artikel/ach-hoer-doch-auf/9259542,0,11freunde.de,„Ach hör doch auf“ - Die Netzreaktionen zum Champions-League-Abend,"Union Berlin verliert schon wieder in letzter Minute, Thomas Müller rettet die Bayern. Und das Netz denkt nur an Jude Bellingham.",https://11freunde.de/assets/images/_1200x630_crop_center-center_82_none/1_2023-10-04-065404_wwbb.jpg?mtime=1696402444,2023-10-04T07:00:00Z,,"Die gute alte Unschuldsvermutung
Jerome Boateng könnte tat­säch­lich zurück­kehren, Union ver­liert schon wieder, Götze ist das Sinn­bild: 11FREUNDE am Morgen der News­letter.",,de,'Bayern'
https://taz.de/Maskenaffaere-in-Bayern/!5964439/,https://taz.de/Maskenaffaere-in-Bayern/!5964439/,0,taz.de,Maskenaffäre in Bayern: Prozess gegen Tandler beginnt,"Mit Masken kassierte Andrea Tandler in der Pandemie Millionen. Nun stehen Sie und ihr Partner vor Gericht, weil sie Steuern hinterzogen haben sollen.",https://taz.de/picture/6564040/948/tandler-csu-masken-1.jpeg,2023-10-04T07:01:00Z,,"Mit Masken kassierte Andrea Tandler in der Pandemie Millionen. Nun stehen Sie und ihr Partner vor Gericht, weil sie Steuern hinterzogen haben sollen.
Fachfrau für Masken: Tandler 2022 als Zeugin bei… [+2490 chars]",,de,'Bayern'
https://www.welt.de/sport/fussball/video247800024/FC-Bayern-Herausragend-gut-Tuchels-Lob-fuer-Ulreich-und-seine-Superjoker.html,https://www.welt.de/sport/fussball/video247800024/FC-Bayern-Herausragend-gut-Tuchels-Lob-fuer-Ulreich-und-seine-Superjoker.html,0,www.welt.de,„Herausragend gut“ – Tuchels Lob für Ulreich und seine Superjoker,Der FC Bayern hat seine Serie in der Champions League beim FC Kopenhagen ausgebaut. Nach der Partie schwärmt Trainer Thomas Tuchel unter anderem von der letzten Parade seines Torhüters Sven Ulreich und adelt zudem seine Joker.,https://img.welt.de/img/sport/fussball/mobile247800030/2681359147-ci16x9-w1200/Champions-League-Group-A-FC-Copenhagen-v-Bayern-Munich.jpg,2023-10-04T07:11:29Z,,"Die WELT als ePaper: Die vollständige Ausgabe steht Ihnen bereits am Vorabend zur Verfügung so sind Sie immer hochaktuell informiert. Weitere Informationen: http://epaper.welt.de 
 Der Kurz-Link die… [+49 chars]",,de,'Bayern'
https://www.bild.de/sport/mehr-sport/basketball/basketball-ex-bayern-coach-schreibt-alba-in-europa-komplett-ab-85626646.bild.html,https://www.bild.de/sport/mehr-sport/basketball/basketball-ex-bayern-coach-schreibt-alba-in-europa-komplett-ab-85626646.bild.html,0,www.bild.de,Null Chance - Ex-Bayern-Coach schreibt Alba komplett ab!,Morgen startet die Euroleague mit dem deutschen Kracher-Duell: Bayern gegen Alba (20.30 Uhr). Die Münchener müssen die Sensations-Pleite in Oldenburg (67...,"https://images.bild.de/651d105d76f5fb74d0de3ef7/e80527f08fa754ea82e37d3496bc269e,46cdd4ee?w=1280",2023-10-04T07:15:28Z,,"Morgen startet die Euroleague mit dem deutschen Kracher-Duell: Bayern gegen Alba (20.30 Uhr). Die Münchener müssen die Sensations-Pleite in Oldenburg (67:77) vergessen machen, die Berliner kommen mit… [+1951 chars]",,de,'Bayern'
https://www.stern.de/news/csu-vor-landtagswahl-in-bayern-weiter-auf-schwachem-umfragewert-33881776.html,https://www.stern.de/news/csu-vor-landtagswahl-in-bayern-weiter-auf-schwachem-umfragewert-33881776.html,0,www.stern.de,CSU vor Landtagswahl in Bayern weiter auf schwachem Umfragewert,"Wenige Tage vor der Landtagswahl in Bayern sieht eine Umfrage die CSU weiter auf einem für die Partei schwachen Wert. In der am späten Dienstag veröffentlichten Erhebung des Instituts Insa für die ""Bild""-Zeitung kommen die Christsozialen von Ministerpräsident…",https://image.stern.de/33881778/t/av/v1/w1440/r1.7778/-/04--markus-soeder---a849e72965d32338.jpg,2023-10-04T07:35:55Z,,"Wenige Tage vor der Landtagswahl in Bayern sieht eine Umfrage die CSU weiter auf einem für die Partei schwachen Wert. In der am späten Dienstag veröffentlichten Erhebung des Instituts Insa für die ""B… [+820 chars]",,de,'Bayern'
https://www.welt.de/kultur/stuetzen-der-gesellschaft/plus247799694/Don-Alphonso-Tage-der-Angst-in-Bayern.html,https://www.welt.de/kultur/stuetzen-der-gesellschaft/plus247799694/Don-Alphonso-Tage-der-Angst-in-Bayern.html,0,www.welt.de,Tage der Angst in Bayern,"Lange sahen die bayerischen Grünen wie die zweite Kraft im Freistaat aus – kurz vor der Landtagswahl kommt die Partei ins Schleudern. Im Abstieg ist fast alles möglich, aber die Ursachen dafür haben die Grünen selbst geschaffen.",https://img.welt.de/img/kultur/stuetzen-der-gesellschaft/mobile247799868/1131354317-ci16x9-w1200-fnov-fpotl-fpi157750653/Kombo-Don-Alphonso-Bywahl.jpg,2023-10-04T07:39:19Z,,"Die grüne Bewegung war kompetent bei grünen Fakten. Das ist weg. Ihre Spitzenleute in Bayern kommen mir vor wie eine grüne Werbeagentur, sagte der Kabarettist und Ex-Biermösl-Blosn-Kopf Hans Well im … [+73 chars]",,de,'Bayern'
https://www.welt.de/politik/deutschland/video247799692/Landtagswahlen-in-Bayern-AfD-Chefin-Weidel-sagt-Kundgebung-wegen-Bedrohungslage-ab.html,https://www.welt.de/politik/deutschland/video247799692/Landtagswahlen-in-Bayern-AfD-Chefin-Weidel-sagt-Kundgebung-wegen-Bedrohungslage-ab.html,0,www.welt.de,AfD-Chefin Weidel sagt Kundgebung wegen Bedrohungslage ab,"AfD-Chefin Alice Weidel hat einen Auftritt bei einer Kundgebung ihrer Partei kurz vor den Landtagswahlen in Bayern aus Sicherheitsgründen abgesagt. Weidel war als Hauptrednerin zum Tag der Deutschen Einheit in Mödlareuth geladen - ein Ort, durch den früher di…",https://img.welt.de/img/videos/mobile247800272/7351353587-ci16x9-w1200/GERMANY-POLITICS-EU-PARTIES-FARRIGHT-AFD.jpg,2023-10-04T07:41:41Z,,"Die WELT als ePaper: Die vollständige Ausgabe steht Ihnen bereits am Vorabend zur Verfügung so sind Sie immer hochaktuell informiert. Weitere Informationen: http://epaper.welt.de 
 Der Kurz-Link die… [+49 chars]",,de,'Bayern'
https://www.stern.de/gesellschaft/regional/bayern/landtagswahl--faeser-wirft-soeder-wahlkampfgetoese-vor-33881796.html,https://www.stern.de/gesellschaft/regional/bayern/landtagswahl--faeser-wirft-soeder-wahlkampfgetoese-vor-33881796.html,0,www.stern.de,Landtagswahl: Faeser wirft Söder Wahlkampfgetöse vor,"In der Debatte um Sach- statt Geldleistungen für Asylbewerber hat die SPD-Spitzenkandidatin für die hessische Landtagswahl und Bundesinnenministerin Nancy Faeser Bayerns Ministerpräsident Markus Söder (CSU) Wahlkampfgetöse vorgeworfen. ""Herr Söder läuft damit…",https://image.stern.de/33881798/t/7h/v1/w1440/r1.7778/-/04--urnnewsmldpacom2009010123100499434094v3w800h600l640t412r1920b1238jpeg---f7b5ec522a967e68.jpg,2023-10-04T07:44:40Z,,In der Debatte um Sach- statt Geldleistungen für Asylbewerber hat die SPD-Spitzenkandidatin für die hessische Landtagswahl und Bundesinnenministerin Nancy Faeser Bayerns Ministerpräsident Markus Söde… [+2219 chars],,de,'Bayern'
https://www.bild.de/video/clip/sport-videos/tuchel-ueber-bayern-joker-ist-doch-klar-dass-er-mit-den-hufen-scharrt-85626770.bild.html,https://www.bild.de/video/clip/sport-videos/tuchel-ueber-bayern-joker-ist-doch-klar-dass-er-mit-den-hufen-scharrt-85626770.bild.html,0,www.bild.de,"Tuchel über Bayern-Joker - „Ist doch klar, dass er mit den Hufen scharrt“",Thomas Müller stand beim 2:1-Sieg gegen Kopenhagen in der Champions League wieder nicht in der Startelf.,"https://images.bild.de/651d126b79539613519b837c/602e706df30939acb62e8ed52b538062,19234de0?w=1280",2023-10-04T07:44:57Z,,"Mehr zum Video anzeigen
Thomas Müller stand beim 2:1-Sieg gegen Kopenhagen in der Champions League wieder nicht in der Startelf.
Quelle: AP 04.10.2023 - 09:44 Uhr",,de,'Bayern'
https://www.kicker.de/tuchel-adelt-die-joker-so-war-unser-spiel-das-gefaehrlichste-971842/video,https://www.kicker.de/tuchel-adelt-die-joker-so-war-unser-spiel-das-gefaehrlichste-971842/video,0,www.kicker.de,"Tuchel adelt die Joker: ""So war unser Spiel das gefährlichste""",Video: Nach dem hart erkämpften 2:1-Auswärtssieg in Kopenhagen sprach Bayern-Coach Thomas Tuchel nach dem Spiel über die Qualitäten von Thomas Müller und den anderen Jokern.,"https://derivates.kicker.de/image/upload/c_crop,x_0,y_355,w_2215,h_1246/w_1200,q_auto/v1/2023/10/04/024230fd-d92b-4a3f-bb1e-e1694b072aec.jpeg",2023-10-04T08:00:36Z,,"Werbung und Tracking: Um dir relevante Inhalte und personalisierte Werbung anzubieten, setzen wir Cookies und andere Technologien ein. Damit messen wir, wie und womit du unsere Angebote nutzt. Diese … [+2186 chars]",,de,'Bayern'
https://www.welt.de/sport/fussball/bundesliga/fc-bayern-muenchen/plus247795776/Leroy-Sane-Ist-seine-beste-Bayern-Saison-auch-seine-letzte.html,https://www.welt.de/sport/fussball/bundesliga/fc-bayern-muenchen/plus247795776/Leroy-Sane-Ist-seine-beste-Bayern-Saison-auch-seine-letzte.html,0,www.welt.de,Wie Tuchel Sanés Spiellust weckt,"Leroy Sané drohte beim FC Bayern zum teuren Missverständnis zu werden. Nun spielt er so gut wie seit Jahren nicht mehr. Eine Wandlung, die selbst Mitspieler verwundert und an der drei Personen entscheidenden Anteil haben. Allerdings könnte seine beste Saison …",https://img.welt.de/img/sport/mobile247796796/4591356277-ci16x9-w1200-fnov-fpotl-fpi157750653/RB-Leipzig-Bayern-Muenchen.jpg,2023-10-04T08:09:48Z,,"Die WELT als ePaper: Die vollständige Ausgabe steht Ihnen bereits am Vorabend zur Verfügung so sind Sie immer hochaktuell informiert. Weitere Informationen: http://epaper.welt.de 
 Der Kurz-Link die… [+49 chars]",,de,'Bayern'
https://www.zeit.de/politik/ausland/2023-10/europa-gipfel-in-granada-laender-ukraine-unterstuetzung,https://www.zeit.de/politik/ausland/2023-10/europa-gipfel-in-granada-laender-ukraine-unterstuetzung,0,www.zeit.de,Europa-Gipfel in Granada: Fast 50 Länder beraten über schwindende Unterstützung für die Ukraine,Ganz Europa steht geschlossen gegen den Krieg: Dieses Zeichen soll heute von dem Gipfel in Granada ausgehen. Doch andere Themen könnten sich in den Vordergrund schieben.,,2023-10-05T03:52:04Z,,"When browsing with ads:
We collect personal data and also transmit it to third-party providers
 that help us improve and finance our digital content. Some of the information stored on your device, … [+821 chars]",,de,'Krieg'
https://www.zeit.de/news/2023-10/05/deutschland-sagt-ukraine-weiteres-flugabwehrsystem-zu,https://www.zeit.de/news/2023-10/05/deutschland-sagt-ukraine-weiteres-flugabwehrsystem-zu,0,www.zeit.de,Krieg: Deutschland sagt Ukraine weiteres Flugabwehrsystem zu,,,2023-10-05T16:02:40Z,,"When browsing with ads:
We collect personal data and also transmit it to third-party providers
 that help us improve and finance our digital content. Some of the information stored on your device, … [+821 chars]",,de,'Krieg'
