index,url,valid,domain,title,description,image,published,archive,content,quote,language,keyword
https://www.dw.com/de/taurus-leak-deutschland-ist-hoffnungslos-naiv/a-68434070,https://www.dw.com/de/taurus-leak-deutschland-ist-hoffnungslos-naiv/a-68434070,0,www.dw.com,"Taurus-Leak: ""Deutschland ist hoffnungslos naiv""",Das von Russland abgehörte Gespräch deutscher Offiziere hat ein Ziel Putins schon erreicht: die Unterstützer der Ukraine auseinanderzubringen. Großbritannien reagiert scharf.,https://static.dw.com/image/68424389_6.jpg,2024-03-04T13:59:00Z,,"Die Kritik an Deutschland nach dem geleakten Gespräch hochrangiger Luftwaffen-Offiziere über die Verwendbarkeit von Taurus-Marschflugkörpern in der Ukraine ist vor allem in Großbritannien scharf: ""Wi… [+5104 chars]",,de,'Putin'
https://www.dw.com/de/taurus-leak-wie-russland-die-ukraine-unterst%C3%BCtzer-spaltet/a-68434070,https://www.dw.com/de/taurus-leak-wie-russland-die-ukraine-unterst%C3%BCtzer-spaltet/a-68434070,0,www.dw.com,Taurus-Leak: Wie Russland die Ukraine-Unterstützer spaltet,Das von Moskau abgehörte Gespräch deutscher Offiziere hat ein Ziel Putins schon erreicht: die Unterstützer der Ukraine auseinanderzubringen. London reagiert scharf.,https://static.dw.com/image/68424389_6.jpg,2024-03-04T13:59:00Z,,"Die Kritik an Deutschland nach dem geleakten Gespräch hochrangiger Luftwaffen-Offiziere über die Verwendbarkeit von Taurus-Marschflugkörpern in der Ukraine ist vor allem in Großbritannien scharf: ""Wi… [+5104 chars]",,de,'Putin'
https://www.golem.de/sonstiges/zustimmung/auswahl.html?from=https://www.golem.de/news/bgr-energiestudie-die-menschheit-verbraucht-so-viel-energie-wie-nie-zuvor-2403-182841.html&referer=https://t.co/ad8d7eea86,https://www.golem.de/sonstiges/zustimmung/auswahl.html?from=https://www.golem.de/news/bgr-energiestudie-die-menschheit-verbraucht-so-viel-energie-wie-nie-zuvor-2403-182841.html&referer=https://t.co/ad8d7eea86,0,www.golem.de,BGR-Energiestudie: Die Menschheit verbraucht so viel Energie wie nie zuvor,"Der Krieg in der Ukraine hatte im Jahr 2022 keinen Einfluss auf den Energieverbrauch. Der stieg an, auch durch den Einsatz fossiler Energieträger. (Energie, Studien)",,2024-03-04T15:31:01Z,,"Besuchen Sie Golem.de wie gewohnt mit Werbung und Tracking,
 indem Sie der Nutzung aller Cookies zustimmen.
 Details zum Tracking finden Sie im Privacy Center.
Skript wurde nicht geladen. Informat… [+607 chars]",,de,'fossile Energie'
https://www.zeit.de/news/2024-03/04/un-vergewaltigungen-durch-hamas-terroristen-wahrscheinlich,https://www.zeit.de/news/2024-03/04/un-vergewaltigungen-durch-hamas-terroristen-wahrscheinlich,0,www.zeit.de,Gaza-Krieg: UN: Vergewaltigungen durch Hamas-Terroristen wahrscheinlich,Hier finden Sie Informationen zu dem Thema „Gaza-Krieg“. Lesen Sie jetzt „UN: Vergewaltigungen durch Hamas-Terroristen wahrscheinlich“.,https://img.zeit.de/news/2024-03/04/un-vergewaltigungen-durch-hamas-terroristen-wahrscheinlich-image-group/wide__1300x731,2024-03-04T22:55:47Z,,"Ein Bericht der Vereinten Nationen sieht sexualisierte Gewalt bei dem Terroranschlag der islamistischen Hamas am 7. Oktober in Israel als wahrscheinlich an. Es gebe «berechtigten Grund zur Annahme», … [+5729 chars]",,de,'Krieg'
https://www.n-tv.de/politik/09-58-Ex-Militaer-plaudert-auf-Dating-App-ueber-US-Strategie-fuer-Ukraine-Festnahme--article23143824.html,https://www.n-tv.de/politik/09-58-Ex-Militaer-plaudert-auf-Dating-App-ueber-US-Strategie-fuer-Ukraine-Festnahme--article23143824.html,0,www.n-tv.de,Ukraine-Krieg im Liveticker: +++ 09:58 Ex-Militär plaudert auf Dating-App über US-Strategie für Ukraine: Festnahme +++,Lesen Sie alle aktuellen Entwicklungen und Nachrichten über den russischen Angriffskrieg auf die Ukraine im Liveticker von ntv.de.,https://bilder2.n-tv.de/img/incoming/crop23332537/9041326157-cImg_16_9-w1200/Liveticker1-grau-1-Kopie.jpg,2024-03-04T23:05:00Z,,"Ein ehemaliger Offizier der US-Armee ist festgenommen worden, weil er über eine Dating-App Geheiminformationen ausgeplaudert haben soll. Wie das Justizministerium am Montag (Ortszeit) mitteilt, arbei… [+15530 chars]",,de,'Krieg'
https://www.sueddeutsche.de/politik/israel-krieg-news-liveticker-un-bericht-vergewaltigung-hamas-1.6409778,https://www.sueddeutsche.de/politik/israel-krieg-news-liveticker-un-bericht-vergewaltigung-hamas-1.6409778,0,www.sueddeutsche.de,Krieg in Nahost: UN-Bericht hält Vergewaltigungen durch Hamas für wahrscheinlich,"Israel kritisiert, dass der Bericht nicht im UN-Sicherheitsrat erörtert worden ist. Israels UN-Botschafter zeigt in New York ein Video, das belegen soll, dass ein UNRWA-Mitarbeiter an den Entführungen am 7. Oktober beteiligt gewesen sein soll.",https://www.sueddeutsche.de/image/sz.1.6422246/1200x675?v=1709594538,2024-03-04T23:22:18Z,,"Viele von euch hassen uns, einige von euch aber haben uns sogar lieb: Ihr seid rechts, links, doof, klug, divers, tragt Irokese, Burka oder Minirock. Eine Klarstellung für dunkle Tage in Deutschland.",,de,'Krieg'
https://www.morgenpost.de/kultur/tv/article241817112/Linken-Aussage-zur-Ukraine-laesst-Hofreiter-laut-werden.html,https://www.morgenpost.de/kultur/tv/article241817112/Linken-Aussage-zur-Ukraine-laesst-Hofreiter-laut-werden.html,0,www.morgenpost.de,Linken-Aussage zur Ukraine lässt Hofreiter laut werden,Beenden Waffenlieferungen den Ukraine-Krieg? Darüber gibt es bei „Hart aber fair“ geteilte Meinungen – die für Gesprächsstoff sorgten.,https://img.sparknews.funkemedien.de/241539932/241539932_1707188828_v4_3_800.jpeg,2024-03-04T23:44:02Z,,"Berlin. Beenden Waffenlieferungen den Ukraine-Krieg? Darüber gibt es bei Hart aber fair geteilte Meinungen die für Gesprächsstoff sorgten.
Putins Angriffskrieg gegen die Ukraine geht in das dritte J… [+3525 chars]",,de,'Krieg'
https://www.sueddeutsche.de/medien/anton-hofreiter-hart-aber-fair-tv-kritik-krieg-in-der-ukraine-1.6422437,https://www.sueddeutsche.de/medien/anton-hofreiter-hart-aber-fair-tv-kritik-krieg-in-der-ukraine-1.6422437,0,www.sueddeutsche.de,"""Hart aber fair"": 75 Minuten deutsche Selbstbeschau","Bei ""Hart aber fair"" gehen die Gäste der Frage nach, was der Krieg in der Ukraine mit Deutschland macht. Nur: Was bringt es, eine europäische Krise in einer rein deutschen Runde zu erörtern?",https://www.sueddeutsche.de/image/sz.1.6422438/1200x675?v=1709600540,2024-03-05T01:02:31Z,,"Hauptsache auf Sendung: Moderator Louis Klamroth (Mitte) diskutiert mit seinen Gästen Fragen, denen es an Relevanz fehlt.
(Foto: WDR/Dirk Borm)
Bei ""Hart aber fair"" gehen die Gäste der Frage nach, … [+1166 chars]",,de,'Krieg'
https://www.zeit.de/news/2024-03/05/kiew-russisches-kriegsschiff-bei-drohnenattacke-versenkt,https://www.zeit.de/news/2024-03/05/kiew-russisches-kriegsschiff-bei-drohnenattacke-versenkt,0,www.zeit.de,Ukraine-Krieg: Kiew: Russisches Kriegsschiff bei Drohnenattacke versenkt,Hier finden Sie Informationen zu dem Thema „Ukraine-Krieg“. Lesen Sie jetzt „Kiew: Russisches Kriegsschiff bei Drohnenattacke versenkt“.,https://img.zeit.de/news/2024-03/05/kiew-russisches-kriegsschiff-bei-drohnenattacke-versenkt-image-group/wide__1300x731,2024-03-05T07:49:51Z,,"Ein russisches Kriegsschiff ist Angaben aus Kiew zufolge vor der Halbinsel Krim durch einen Angriff von ukrainischen Wasserdrohnen versenkt worden. Getroffen worden sei die Korvette «Sergej Kotow», d… [+2569 chars]",,de,'Krieg'
https://www.focus.de/politik/ausland/ukraine-krise/taurus-abhoer-skandal-strategie-genie-putin-schlachtet-deutschlands-grosse-blamage-voll-aus_id_259730038.html,https://www.focus.de/politik/ausland/ukraine-krise/taurus-abhoer-skandal-strategie-genie-putin-schlachtet-deutschlands-grosse-blamage-voll-aus_id_259730038.html,0,www.focus.de,Taurus-Abhör-Skandal - Strategie-Genie Putin schlachtet Deutschlands große Blamage voll aus,"Geschickt versucht der Kreml, den Mitschnitt des Taurus-Gesprächs für seine Zwecke zu nutzen. So unterstellen staatliche Medien und politische Akteure den Deutschen, einen Angriff auf die Krim-Brücke zu planen. Für Putin die perfekte Munition im Informationsk…",https://p6.focus.de/img/fotos/id_259730179/wladimir-putin-praesident-von-russland.jpg?im=Crop%3D%280%2C22%2C3463%2C1732%29%3BResize%3D%281200%2C627%29&impolicy=perceptual&quality=mediumHigh&hash=4ad8739c5db1f5cb8663742423c278d363b8196a7baccea637399dbbf7663097,2024-03-05T11:41:59Z,,"Geschickt versucht der Kreml, den Mitschnitt des Taurus-Gesprächs für seine Zwecke zu nutzen. So unterstellen staatliche Medien und politische Akteure den Deutschen, einen Angriff auf die Krim-Brücke… [+5511 chars]",,de,'Putin'
https://www.focus.de/politik/ausland/ukraine-krise/wendet-sich-das-blatt-mal-wieder-kims-lieferstopp-stellt-putin-vor-probleme-europa-laesst-ukraine-hoffen_id_259730378.html,https://www.focus.de/politik/ausland/ukraine-krise/wendet-sich-das-blatt-mal-wieder-kims-lieferstopp-stellt-putin-vor-probleme-europa-laesst-ukraine-hoffen_id_259730378.html,0,www.focus.de,Wendet sich das Blatt - mal wieder? - Kims Lieferstopp stellt Putin vor Probleme - Europa lässt Ukraine hoffen,"Die Artilleriekrise in der Ukraine nimmt eine unerwartete Wendung, während sich die Unterstützung Europas verstärkt und die Waffenzufuhr aus Nordkorea eventuell nachlässt.",https://p6.focus.de/img/politik/ausland/id_259689343/nordkorea-um-machthaber-kim-jong-un-l-lieferte-waffen-an-russland-die-einem-bericht-zufolge-etliche-bauteile-aus-westlichen-laendern-enthalten..jpg?im=Crop%3D%280%2C0%2C2048%2C1023%29%3BResize%3D%281200%2C627%29&impolicy=perceptual&quality=mediumHigh&hash=223049adb7fee084772435c23f1db3478abc5e7a1020f406c856b2abc75fa686,2024-03-05T11:57:24Z,,"Die Artilleriekrise in der Ukraine nimmt eine unerwartete Wendung, während sich die Unterstützung Europas verstärkt und die Waffenzufuhr aus Nordkorea eventuell nachlässt.Die Ukraine ist weiterhin Sc… [+2685 chars]",,de,'Putin'
https://www.bild.de/politik/ausland/politik-ausland/aufruestungsplan-wegen-putin-eu-bereitet-sich-auf-kriegswirtschaft-vor-87404500.bild.html,https://www.bild.de/politik/ausland/politik-ausland/aufruestungsplan-wegen-putin-eu-bereitet-sich-auf-kriegswirtschaft-vor-87404500.bild.html,0,www.bild.de,Aufrüstungsplan wegen Putin - EU bereitet sich auf Kriegswirtschaft vor,"Europa soll seine Rüstungsproduktion massiv ausbauen, unabhängiger von Waffenlieferungen und politischen Entscheidungen der USA werden","https://images.bild.de/65e6f38ceb289564c7d91a32/31ca3130e69621d65ee38f8e8151c89e,45732018?w=1280",2024-03-05T12:29:29Z,,"Paris und Berlin streiten über die richtige Strategie gegen Kriegstreiber Putin Brüssel handelt!
Während der Streit über die richtige Ukraine-Strategie die deutsch-französischen Beziehungen belastet… [+2497 chars]",,de,'Putin'
https://www.nzz.ch/international/taurus-abhoeraffaere-pistorius-spricht-von-schwerem-fehler-ld.1820742,https://www.nzz.ch/international/taurus-abhoeraffaere-pistorius-spricht-von-schwerem-fehler-ld.1820742,0,www.nzz.ch,Verteidigungsminister Boris Pistorius: «Ich werde niemanden meiner besten Offiziere für Herrn Putin opfern»,Der deutsche Verteidigungsminister gibt einen Zwischenbericht zur Taurus-Abhöraffäre. Danach hat offenbar ein ranghoher Offizier im Ausland gegen Regeln des Geheimschutzes verstossen. Personelle Konsequenzen soll es vorerst aber nicht geben.,"https://img.nzz.ch/2024/03/05/4b787026-fa84-4f17-b6b7-8700eb2e98e9.jpeg?width=1200&height=675&fit=bound&quality=75&auto=webp&crop=5500,3094,x0,y287&wmark=nzz",2024-03-05T12:33:11Z,,"Verteidigungsminister Boris Pistorius bei einer Pressekonferenz am Dienstag in Berlin.
Der Abhörskandal in der deutschen Bundeswehr geht auf den Fehler eines ranghohen Offiziers zurück, der aus Sing… [+4333 chars]",,de,'Putin'
https://www.welt.de/politik/deutschland/article250408262/Spionage-Affaere-Wie-Putin-Verteidigungsminister-Pistorius-die-Agenda-vorschreibt.html,https://www.welt.de/politik/deutschland/article250408262/Spionage-Affaere-Wie-Putin-Verteidigungsminister-Pistorius-die-Agenda-vorschreibt.html,0,www.welt.de,Wie Putin Pistorius die Agenda vorschreibt,"Der „Anwendungsfehler“ eines Generals führte zum Taurus-Leck, offenbart der Verteidigungsminister. Dennoch werde er keinen Offizier „Putins Spielen opfern“. Doch Russland bestimmt auch die Themen von Pistorius‘ Besuch bei den skandinavischen Bündnispartnern –…",https://img.welt.de/img/politik/deutschland/mobile250409442/4271350107-ci16x9-w1200/Pistorius-zum-Abhoerfall.jpg,2024-03-05T12:50:33Z,,"Einen besseren Zeitpunkt hätte es für die Antrittsbesuche von Verteidigungsminister Boris Pistorius (SPD) in Schweden, Norwegen und Finnland nicht geben können. Denn die Bündnispartner aus Skandinavi… [+5472 chars]",,de,'Putin'
https://www.stern.de/digital/technik/kiew-wirft-seine-besten-truppen-in-die-schlacht---noch-halten-sie-die-russische-flut-auf-34517524.html,https://www.stern.de/digital/technik/kiew-wirft-seine-besten-truppen-in-die-schlacht---noch-halten-sie-die-russische-flut-auf-34517524.html,0,www.stern.de,Krieg in der Ukraine: Kiew wirft seine besten Truppen in die Schlacht – noch halten sie den russischen Ansturm auf,"Putin geht ""all in"", die Russen drücken auf die ganze Front. An Schlüsselstellen konnten die Ukrainer den Gegner trotzdem stoppen und zurückwerfen. Die Frage bleibt: Wie viele Reserven hat das Oberkommando in Kiew noch?",https://image.stern.de/34517532/t/M2/v2/w1440/r1.7778/-/ukraine-war.jpg,2024-03-05T14:04:00Z,,"Nach dem Fall von Awdijiwka sind die Russen in die Offensive gegangen. Die Ukraine wiederum hat dort und auch bei Robotyne Gegenangriffe angesetzt, mit denen der Gegner aufgehalten und zurückgeworfen… [+6126 chars]",,de,'Krieg'
https://www.sueddeutsche.de/bayern/bayern-uniper-wasserkraftwerke-uebernahme-aiwanger-1.6424403,https://www.sueddeutsche.de/bayern/bayern-uniper-wasserkraftwerke-uebernahme-aiwanger-1.6424403,0,www.sueddeutsche.de,Energiepolitik: Bayern rechnet nicht mehr mit Übernahme von Uniper-Wasserkraftwerken,"Wirtschaftsminister Aiwanger erklärt die Pläne für hinfällig, da Uniper das Geschäft nicht aufgeben wolle. Das klang im vergangenen Jahr noch ganz anders.",https://www.sueddeutsche.de/image/sz.1.6424404/1200x675?v=1709650265,2024-03-05T14:51:10Z,,"Wirtschaftsminister Aiwanger erklärt die Pläne für hinfällig, da Uniper das Geschäft nicht aufgeben wolle. Das klang im vergangenen Jahr noch ganz anders.Der Freistaat Bayern rechnet nicht mehr mit d… [+1812 chars]",,de,'Bayern'
https://www.n-tv.de/politik/15-41-Frankreich-und-Moldau-schliessen-Kooperationsvertrag--article23143824.html,https://www.n-tv.de/politik/15-41-Frankreich-und-Moldau-schliessen-Kooperationsvertrag--article23143824.html,0,www.n-tv.de,Ukraine-Krieg im Liveticker: +++ 15:41 Frankreich und Moldau schließen Kooperationsvertrag +++,Lesen Sie alle aktuellen Entwicklungen und Nachrichten über den russischen Angriffskrieg auf die Ukraine im Liveticker von ntv.de.,https://bilder2.n-tv.de/img/incoming/crop23332537/9041326157-cImg_16_9-w1200/Liveticker1-grau-1-Kopie.jpg,2024-03-05T23:05:00Z,,"Frankreich und die Republik Moldau werden am Donnerstag einen Kooperationsvertrag für Verteidigung unterzeichnen. Damit sollen die Bemühungen gestärkt werden, die frühere Sowjet-Republik besser gegen… [+19761 chars]",,de,'Krieg'
https://www.n-tv.de/politik/17-04-Russen-beschiessen-Odessa-waehrend-Besuch-von-Selenskyj-und-Mitsotakis--article23143824.html,https://www.n-tv.de/politik/17-04-Russen-beschiessen-Odessa-waehrend-Besuch-von-Selenskyj-und-Mitsotakis--article23143824.html,0,www.n-tv.de,Ukraine-Krieg im Liveticker: +++ 17:04 Russen beschießen Odessa während Besuch von Selenskyj und Mitsotakis +++,Lesen Sie alle aktuellen Entwicklungen und Nachrichten über den russischen Angriffskrieg auf die Ukraine im Liveticker von ntv.de.,https://bilder2.n-tv.de/img/incoming/crop23332537/9041326157-cImg_16_9-w1200/Liveticker1-grau-1-Kopie.jpg,2024-03-05T23:05:00Z,,Während eines Treffens des ukrainischen Präsidenten Wolodymyr Selenskyj mit dem griechischen Ministerpräsidenten Kyriakos Mitsotakis in Odessa ist die südukrainische Hafenstadt von Russland mit Raket… [+22065 chars],,de,'Öl'
https://www.n-tv.de/politik/13-59-Internationale-Atombehoerde-warnt-Russland-vor-Hochfahren-von-Atomkraftwerk-Saporischschja--article23143824.html,https://www.n-tv.de/politik/13-59-Internationale-Atombehoerde-warnt-Russland-vor-Hochfahren-von-Atomkraftwerk-Saporischschja--article23143824.html,0,www.n-tv.de,Ukraine-Krieg im Liveticker: +++ 13:59 Internationale Atombehörde warnt Russland vor Hochfahren von Atomkraftwerk Saporischschja +++,Lesen Sie alle aktuellen Entwicklungen und Nachrichten über den russischen Angriffskrieg auf die Ukraine im Liveticker von ntv.de.,https://bilder2.n-tv.de/img/incoming/crop23332537/9041326157-cImg_16_9-w1200/Liveticker1-grau-1-Kopie.jpg,2024-03-05T23:05:00Z,,"Die Internationale Atomenergiebehörde (IAEA) warnt Moskau davor, das von russischen Truppen besetzte Atomkraftwerk Saporischschja im Südosten der Ukraine wieder in Betrieb zu nehmen. Ein solcher Schr… [+17205 chars]",,de,'Krieg'
https://www.n-tv.de/politik/13-35-Ukraine-17-russische-Kriegsverbrecher-verurteilt-und-in-Haft-gesteckt--article23143824.html,https://www.n-tv.de/politik/13-35-Ukraine-17-russische-Kriegsverbrecher-verurteilt-und-in-Haft-gesteckt--article23143824.html,0,www.n-tv.de,Ukraine-Krieg im Liveticker: +++ 13:35 Ukraine: 17 russische Kriegsverbrecher verurteilt und in Haft gesteckt +++,Lesen Sie alle aktuellen Entwicklungen und Nachrichten über den russischen Angriffskrieg auf die Ukraine im Liveticker von ntv.de.,https://bilder2.n-tv.de/img/incoming/crop23332537/9041326157-cImg_16_9-w1200/Liveticker1-grau-1-Kopie.jpg,2024-03-05T23:05:00Z,,"Die Ukraine macht nach Justizangaben Fortschritte bei der Ahndung russischer Kriegsverbrechen. Der ukrainische Generalstaatsanwalt Andrij Kostin sagt bei einem Besuch in Brüssel, sein Land habe 81 ru… [+16272 chars]",,de,'Krieg'
https://www.n-tv.de/politik/13-04-Ausweisung-deutscher-Journalisten-Munz-Unklar-wie-lange-wir-von-hier-berichten-koennen--article23143824.html,https://www.n-tv.de/politik/13-04-Ausweisung-deutscher-Journalisten-Munz-Unklar-wie-lange-wir-von-hier-berichten-koennen--article23143824.html,0,www.n-tv.de,"Ukraine-Krieg im Liveticker: +++ 13:04 Ausweisung deutscher Journalisten? Munz: Unklar, ""wie lange wir von hier berichten können"" +++",Lesen Sie alle aktuellen Entwicklungen und Nachrichten über den russischen Angriffskrieg auf die Ukraine im Liveticker von ntv.de.,https://bilder2.n-tv.de/img/incoming/crop23332537/9041326157-cImg_16_9-w1200/Liveticker1-grau-1-Kopie.jpg,2024-03-05T23:05:00Z,,Moskau droht deutschen Journalisten mit einer möglichen Ausweisung aus Russland. Grund sind angebliche Schikanen gegen russische Medienvertreter in Deutschland. ntv-Korrespondent Munz ist vor Ort und… [+15436 chars],,de,'Öl'
https://www.n-tv.de/politik/11-31-Ukraine-stellt-Hightech-Modell-vor-Neue-Sea-Baby-kann-ueber-eine-Tonne-Sprengstoff-laden--article23143824.html,https://www.n-tv.de/politik/11-31-Ukraine-stellt-Hightech-Modell-vor-Neue-Sea-Baby-kann-ueber-eine-Tonne-Sprengstoff-laden--article23143824.html,0,www.n-tv.de,"Ukraine-Krieg im Liveticker: +++ 11:31 Ukraine stellt Hightech-Modell vor: Neue ""Sea Baby"" kann über eine Tonne Sprengstoff laden +++",Lesen Sie alle aktuellen Entwicklungen und Nachrichten über den russischen Angriffskrieg auf die Ukraine im Liveticker von ntv.de.,https://bilder2.n-tv.de/img/incoming/crop23332537/9041326157-cImg_16_9-w1200/Liveticker1-grau-1-Kopie.jpg,2024-03-05T23:05:00Z,,Immer wieder nutzt die Ukraine Wasserdrohnen gegen russische Ziele. So sollen die nach eigenen Angaben selbst entwickelten Waffen etwa bei der Sprengung der Krim-Brücke und bei der Zerstörung mehrere… [+14269 chars],,de,'Öl'
https://www.n-tv.de/politik/16-07-Julia-Nawalnaja-ruft-zu-Wahl-Sabotage-in-Russland-auf--article23143824.html,https://www.n-tv.de/politik/16-07-Julia-Nawalnaja-ruft-zu-Wahl-Sabotage-in-Russland-auf--article23143824.html,0,www.n-tv.de,Ukraine-Krieg im Liveticker: +++ 16:07 Julia Nawalnaja ruft zu Wahl-Sabotage in Russland auf +++,Lesen Sie alle aktuellen Entwicklungen und Nachrichten über den russischen Angriffskrieg auf die Ukraine im Liveticker von ntv.de.,https://bilder2.n-tv.de/img/incoming/crop23332537/9041326157-cImg_16_9-w1200/Liveticker1-grau-1-Kopie.jpg,2024-03-05T23:05:00Z,,"""Wir sind real. Wir leben. Es gibt uns und wir sind gegen Putin"" - mit diesen Worten ruft die Oppositionelle Julia Nawalnaja dazu auf, die russischen Präsidentschaftswahlen zu sabotieren. Putin-Gegne… [+20121 chars]",,de,'Krieg'
https://www.n-tv.de/politik/08-37-Schwerer-russischer-Drohnenangriff-Ukraine-meldet-hohe-Abschussquote--article23143824.html,https://www.n-tv.de/politik/08-37-Schwerer-russischer-Drohnenangriff-Ukraine-meldet-hohe-Abschussquote--article23143824.html,0,www.n-tv.de,Ukraine-Krieg im Liveticker: +++ 08:37 Schwerer russischer Drohnenangriff - Ukraine meldet hohe Abschussquote +++,Lesen Sie alle aktuellen Entwicklungen und Nachrichten über den russischen Angriffskrieg auf die Ukraine im Liveticker von ntv.de.,https://bilder2.n-tv.de/img/incoming/crop23332537/9041326157-cImg_16_9-w1200/Liveticker1-grau-1-Kopie.jpg,2024-03-05T23:05:00Z,,Das ukrainische Militär hat nach eigenen Angaben in der Nacht zu Mittwoch 38 russische Drohnen abgefangen und zerstört. Insgesamt hätten die russischen Streitkräfte 42 Drohnen auf Ziele in der Ukrain… [+10048 chars],,de,'Öl'
https://www.n-tv.de/politik/09-34-Ukrainische-Drohne-schlaegt-in-der-russischen-Region-Kursk-ein-und-loest-Brand-aus--article23143824.html,https://www.n-tv.de/politik/09-34-Ukrainische-Drohne-schlaegt-in-der-russischen-Region-Kursk-ein-und-loest-Brand-aus--article23143824.html,0,www.n-tv.de,Ukraine-Krieg im Liveticker: +++ 09:34 Ukrainische Drohne schlägt in der russischen Region Kursk ein und löst Brand aus +++,Lesen Sie alle aktuellen Entwicklungen und Nachrichten über den russischen Angriffskrieg auf die Ukraine im Liveticker von ntv.de.,https://bilder2.n-tv.de/img/incoming/crop23332537/9041326157-cImg_16_9-w1200/Liveticker1-grau-1-Kopie.jpg,2024-03-05T23:05:00Z,,"In der westrussischen Region Kursk ist nach einem ukrainischen Drohnenangriff offiziellen Angaben zufolge ein Ölreservoir in einem Bergbaukombinat in Brand geraten. Verletzte gebe es nicht, die Feuer… [+11703 chars]",,de,'Öl'
https://www.n-tv.de/politik/14-43-Russland-Wollen-nicht-gegen-Deutschland-kaempfen--article23143824.html,https://www.n-tv.de/politik/14-43-Russland-Wollen-nicht-gegen-Deutschland-kaempfen--article23143824.html,0,www.n-tv.de,Ukraine-Krieg im Liveticker: +++ 14:43 Russland: Wollen nicht gegen Deutschland kämpfen +++,Lesen Sie alle aktuellen Entwicklungen und Nachrichten über den russischen Angriffskrieg auf die Ukraine im Liveticker von ntv.de.,https://bilder2.n-tv.de/img/incoming/crop23332537/9041326157-cImg_16_9-w1200/Liveticker1-grau-1-Kopie.jpg,2024-03-05T23:05:00Z,,Russland will nach Angaben seiner Führung nicht gegen Deutschland kämpfen. Das meldet die staatliche Nachrichtenagentur Tass unter Berufung auf das Präsidialamt in Moskau. Offenbar bezieht dieses sic… [+18590 chars],,de,'Putin'
https://www.focus.de/politik/ausland/ukraine-krise/analyse-zum-ukraine-krieg-der-verzweifelte-kampf-am-dnipro-birgt-zwei-bittere-erkenntnisse_id_259733657.html,https://www.focus.de/politik/ausland/ukraine-krise/analyse-zum-ukraine-krieg-der-verzweifelte-kampf-am-dnipro-birgt-zwei-bittere-erkenntnisse_id_259733657.html,0,www.focus.de,Analyse zum Ukraine-Krieg - Der verzweifelte Kampf am Dnipro birgt zwei bittere Erkenntnisse,"Auf dem Fluss Dnipro dringen ukrainische Soldaten mit Booten tief in russisch besetztes Gebiet vor. Das Unterfangen hat ein klares strategisches Ziel. Es offenbart aber auch, was passieren kann, wenn die Ukrainer an der Frontlinie scheitern.Von FOCUS-online-R…",https://p6.focus.de/img/fotos/id_259733778/ukrainische-soldaten-in-einem-boot-auf-dem-fluss-dnipro-bei-cherson.jpg?im=Crop%3D%280%2C188%2C3464%2C1732%29%3BResize%3D%281200%2C627%29&impolicy=perceptual&quality=mediumHigh&hash=380e4e14163ac3ba1d7cfaf113d6a947f000ef6e7167360adb8f9c4203dd7c4c,2024-03-06T10:40:21Z,,"Auf dem Fluss Dnipro dringen ukrainische Soldaten mit Booten tief in russisch besetztes Gebiet vor. Das Unterfangen hat ein klares strategisches Ziel. Es offenbart aber auch, was passieren kann, wenn… [+6072 chars]",,de,'Kälte'
https://www.spektrum.de/news/keine-globale-katastrophe-durch-supervulkane/2210187,https://www.spektrum.de/news/keine-globale-katastrophe-durch-supervulkane/2210187,0,www.spektrum.de,Aschewinter: Keine globale Katastrophen durch Supervulkane,Gigantische Vulkane verursachen durch ihre Aschewolken ebenso katastrophale vulkanische Winter - sollte man meinen. Doch der Kühleffekt eines Supervulkans bleibt wohl mäßig.,https://static.spektrum.de/fm/912/f1920x1080/img157.jpg,2024-03-06T11:30:00Z,,"Wenn Supervulkane wie die Yellowstone-Caldera in den USA oder Mount Toba in Indonesien explodieren, schießen sie enorme Mengen Asche und Schwefel bis hoch in die Stratosphäre. Seit Jahrzehnten rätsel… [+2166 chars]",,de,'Winter'
