index,url,valid,domain,title,description,image,published,archive,content,quote,language,keyword
https://www.focus.de/finanzen/news/donald-trump-am-druecker-gerald-hoerhan-erklaert-worauf-die-welt-sich-einstellen-muss_id_260675096.html,https://www.focus.de/finanzen/news/donald-trump-am-druecker-gerald-hoerhan-erklaert-worauf-die-welt-sich-einstellen-muss_id_260675096.html,0,www.focus.de,Analyse vom Investmentpunk - „Niedriger Ölpreis hat Kommunismus zu Fall gebracht – jetzt könnte es Russland treffen“,"Donald Trump fördert fossile Energien und günstige Preise – Investor Gerald Hörhan, auch bekannt als Investment-Punk, analysiert die Folgen für die Weltwirtschaft.",https://p6.focus.de/img/fotos/id_259485808/gerald-hoerhan-16-9.jpg?im=Crop%3D%280%2C37%2C1195%2C597%29%3BResize%3D%281200%2C627%29&impolicy=perceptual&quality=mediumHigh&hash=507b618d01da056784e13d13566281e7378224861b899eaf82b7d309649176d3,2025-02-01T08:27:59Z,,Der neue US-Präsident hat in einer Woche mehr Aktionismus an den Tag gelegt als sein Vorgänger Joe Biden in seiner gesamten Amtszeit. Donald Trump unterzeichnete in den ersten sieben Tagen zahlreiche… [+6968 chars],,de,'fossile Energie'
https://www.zeit.de/news/2025-02/01/kiew-tote-und-verletzte-nach-bombeneinschlag-in-sudscha,https://www.zeit.de/news/2025-02/01/kiew-tote-und-verletzte-nach-bombeneinschlag-in-sudscha,0,www.zeit.de,Russisch-ukrainischer Krieg: Kiew: Tote und Verletzte nach Bombeneinschlag in Sudscha,Hier finden Sie Informationen zu dem Thema „Russisch-ukrainischer Krieg“. Lesen Sie jetzt „Kiew: Tote und Verletzte nach Bombeneinschlag in Sudscha“.,https://img.zeit.de/news/2025-02/01/kiew-tote-und-verletzte-nach-bombeneinschlag-in-sudscha-image-group/wide__1300x731,2025-02-01T21:15:02Z,,In der von Kiews Truppen kontrollierten Stadt Sudscha im russischen Gebiet Kursk sollen nach ukrainischen Angaben beim Einschlag einer Gleitbombe in einem Gebäude mindestens vier Menschen getötet wor… [+976 chars],,de,'Krieg'
https://www.zeit.de/news/2025-02/02/vesperkirchen-in-bayern-oeffnen-ihre-tueren,https://www.zeit.de/news/2025-02/02/vesperkirchen-in-bayern-oeffnen-ihre-tueren,0,www.zeit.de,"Soziales: ""Vesperkirchen"" in Bayern öffnen ihre Türen","Hier finden Sie Informationen zu dem Thema „Soziales“. Lesen Sie jetzt „""Vesperkirchen"" in Bayern öffnen ihre Türen“.",https://img.zeit.de/news/2025-02/02/vesperkirchen-in-bayern-oeffnen-ihre-tueren-image-group/wide__1300x731,2025-02-02T04:00:39Z,,"Viele «Vesperkirchen» in Bayern öffnen in diesen Tagen wieder ihre Türen. In der kalten Jahreszeit bieten Kirchen damit Menschen eine warme Mahlzeit, vor allem aber eine Möglichkeit zum Austausch und… [+2123 chars]",,de,'Bayern'
https://www.sueddeutsche.de/wirtschaft/klima-energie-subventionen-gas-kohle-g7-li.3193245,https://www.sueddeutsche.de/wirtschaft/klima-energie-subventionen-gas-kohle-g7-li.3193245,0,www.sueddeutsche.de,"Subventionen: Mehr Geld für Kohle, Gas und Öl statt weniger",Eigentlich wollten die Industrieländer der G7 bis Ende dieses Jahres auf fossile Subventionen verzichten. Nun zeigt eine Studie: Statt weniger wurde fast überall mehr Geld für sie ausgegeben.,https://www.sueddeutsche.de/2024/01/14/22785cb7-0eab-4a28-afe9-8c47f8466f6e.jpeg?q=60&fm=webp&width=1200&rect=0%2C66%2C1365%2C768,2025-02-02T15:38:10Z,http://archive.md/20250203102457/https://www.sueddeutsche.de/wirtschaft/klima-energie-subventionen-gas-kohle-g7-li.3193245,"2. Februar 2025, 16:38 UhrLesezeit: 2 Min.
Eigentlich wollten die Industrieländer der G7 bis Ende dieses Jahres auf fossile Subventionen verzichten. Nun zeigt eine Studie: Statt weniger wurde fast ü… [+502 chars]",,de,'Öl'
