index,url,valid,domain,title,description,image,published,archive,content,quote,language,keyword
https://www.stern.de/wirtschaft/news/folgen-fuer-die-wirtschaft--iran-krieg-trifft-deutschland--sprit-und-gas-deutlich-teurer-37183546.html,https://www.stern.de/wirtschaft/news/folgen-fuer-die-wirtschaft--iran-krieg-trifft-deutschland--sprit-und-gas-deutlich-teurer-37183546.html,0,www.stern.de,Folgen für die Wirtschaft: Iran-Krieg trifft Deutschland: Sprit und Gas deutlich teurer,Der Irankonflikt hat Folgen für Verbraucher und Wirtschaft - von steigenden Kosten für Heizen und Tanken über sinkende Aktienkurse bis Sorgen um die Konjunktur. Viel hängt von der Dauer des Kriegs ab.,https://image.stern.de/37183790/t/9r/v1/w1440/r1.7778/-/02--qod5shm4n3v1axs2048jpeg---2c09ea15c4e45baf.jpg,2026-03-02T12:39:30Z,,"Kopiere den aktuellen Link
Zur Merkliste hinzufügen
Der Irankonflikt hat Folgen für Verbraucher und Wirtschaft - von steigenden Kosten für Heizen und Tanken über sinkende Aktienkurse bis Sorgen um … [+6329 chars]",,de,'Heizen'
https://www.tagesspiegel.de/wirtschaft/folgen-fur-die-wirtschaft-iran-krieg-trifft-deutschland-sprit-und-gas-deutlich-teurer-15307835.html,https://www.tagesspiegel.de/wirtschaft/folgen-fur-die-wirtschaft-iran-krieg-trifft-deutschland-sprit-und-gas-deutlich-teurer-15307835.html,0,www.tagesspiegel.de,Folgen für die Wirtschaft: Iran-Krieg trifft Deutschland: Sprit und Gas deutlich teurer,Der Irankonflikt hat Folgen für Verbraucher und Wirtschaft - von steigenden Kosten für Heizen und Tanken über sinkende Aktienkurse bis Sorgen um die Konjunktur. Viel hängt von der Dauer des Kriegs ab.,https://www.tagesspiegel.de/images/15307834/alternates/BASE_16_9_W1400/1772455261000/kraftstoffpreise-an-der-tankstelle.jpeg,2026-03-02T12:41:01Z,,"Rasant steigende Öl-, Sprit und Gaspreise, Aktien unter Druck, Sorgen um die Konjunktur: Der Iran-Krieg sorgt für große Unsicherheit und könnte die Wirtschaft in Deutschland treffen - sofern die Kämp… [+6161 chars]",,de,'Gas'
https://www.zeit.de/news/2026-03/02/was-der-iran-krieg-fuer-schiffe-und-haefen-bedeutet,https://www.zeit.de/news/2026-03/02/was-der-iran-krieg-fuer-schiffe-und-haefen-bedeutet,0,www.zeit.de,Krieg in Nahost: Was der Iran-Krieg für Schiffe und Häfen bedeutet,Hier finden Sie Informationen zu dem Thema „Krieg in Nahost“. Lesen Sie jetzt „Was der Iran-Krieg für Schiffe und Häfen bedeutet“.,https://img.zeit.de/news/2026-03/02/was-der-iran-krieg-fuer-schiffe-und-haefen-bedeutet-image-group/wide__1300x731,2026-03-02T14:37:04Z,,"Der Iran-Krieg hat weltweite Folgen. Auch norddeutsche Schifffahrts- und Logistikunternehmen sind von Auswirkungen betroffen. Der Vorsitzende der Industrie- und Handelskammern Nord, André Grobien, sa… [+4735 chars]",,de,'Krieg'
https://www.diepresse.com/20638651/wie-abhaengig-ist-die-welt-noch-von-oel-und-gas-aus-nahost-sechs-auf,https://www.diepresse.com/20638651/wie-abhaengig-ist-die-welt-noch-von-oel-und-gas-aus-nahost-sechs-auf,0,www.diepresse.com,Wie abhängig ist die Welt noch von Öl und Gas aus Nahost? Sechs Antworten auf die aktuell wichtigsten Fragen [premium],Der Preis für Öl und vor allem für Gas sprang am Montag infolge des Krieges in Nahost steil in die Höhe. Und Experten schließen eine weitaus schlimmere Entwicklung nicht aus. Doch wie abhängig ist die Welt von den Rohstoffen aus dieser Gegend wirklich?,https://img.diepresse.com/public/incoming/auvywy-uae-iran-us-israel-conflict/alternates/DPR_SOCIAL_NACHRICHTEN/UAE-IRAN-US-ISRAEL-CONFLICT,2026-03-02T14:44:04Z,,"Dass in Österreich 1974 die Energieferien eingeführt wurden, verdankt sich nicht etwa der Sorge des damaligen Unterrichtsministers Fred Sinowatz um die mangelnde Energie der Schüler. Die schulfreie W… [+8199 chars]",,de,'Gas'
https://www.focus.de/finanzen/eskalation-in-nahost-das-aendert-sich-bei-oel-und-gas_6ee2b09d-d7da-468c-b41a-0594d416208a.html,https://www.focus.de/finanzen/eskalation-in-nahost-das-aendert-sich-bei-oel-und-gas_6ee2b09d-d7da-468c-b41a-0594d416208a.html,0,www.focus.de,Eskalation in Nahost – das ändert sich bei Öl und Gas,Große Anteile von Öl- und Gas-Lieferungen kommen aus dem Nahen Osten. Sie sind von der Straße von Hormus abhängig. Die ist nun blockiert.,https://quadro.burda-forward.de/ctf/9229caf7-8e54-4fcb-b2cb-896c9738356f.a0e474e0-f1e6-4f43-96be-776b3941b165.jpg?im=RegionOfInterestCrop%3D%281200%2C630%29%2CregionOfInterest%3D%28827%2C596%29&hash=59251d14b3924e8dcba706e855b6b7a6eae3830c6bc2b3babdfefecb52ce891b,2026-03-02T15:27:00Z,,"20 Prozent der weltweiten Lieferungen für flüssiges Erdgas (Liquefied Natural Gas, LNG) laufen durch die Straße von Hormus. Fast alles davon kommt aus Katar. Europa bezieht zwar nur rund acht Prozent… [+4626 chars]",,de,'Gasspeicher'
https://vorarlberg.orf.at/stories/3344129/,https://vorarlberg.orf.at/stories/3344129/,0,vorarlberg.orf.at,illwerke vkw kündigen ab April neuen Tarif an,"Trotz der Ereignisse im Nahen Osten hält der Vorarlberger Energieversorger die Strom- und Gaspreise stabil – auch mit dem neuen Tarif ab 1. April. Die Preise würden sogar leicht sinken, heißt es von Seiten der illwerke vkw.",https://ibs.orf.at/vbg?image=https%3A%2F%2Foekastatic.orf.at%2Fmims%2F2023%2F13%2F14%2Fcrops%2Fw%3D1200%2Ch%3D627%2Cq%3D75%2F1729940_master_640214_strom_sujet_2_pba.jpg%3Fs%3Dab5f9b3520eb243d04be37550f156efc2e4898f3,2026-03-02T17:19:45Z,,"Der Krieg zwischen den USA und Israel gegen den Iran hat sich prompt auf die Öl- und Gaspreise ausgewirkt. Die Großhandelspreise seien in den vergangenen Tagen gestiegen, berichten die illwerke vkw. … [+2145 chars]",,de,'Gas'
https://www.nzz.ch/pro/der-krieg-in-nahost-schuert-das-gespenst-der-siebziger-jahre-kommt-es-zu-einer-neuen-erdoel-und-erdgaskrise-ld.1927375,https://www.nzz.ch/pro/der-krieg-in-nahost-schuert-das-gespenst-der-siebziger-jahre-kommt-es-zu-einer-neuen-erdoel-und-erdgaskrise-ld.1927375,0,www.nzz.ch,Der Krieg in Nahost schürt das Gespenst der siebziger Jahre: Kommt es zu einer neuen Erdöl- und Erdgaskrise?,"Der Iran-Krieg hat zu Produktionsstopps geführt und den Verkehr in der Strasse von Hormuz vorerst zum Erliegen gebracht. Erdöl ist um 10 Prozent, Erdgas in Europa gar um 40 Prozent teurer geworden.","https://img.nzz.ch/2026/03/02/5e1a0c78-c976-4c07-9193-b6920dd9f974.jpg?width=1200&height=675&fit=bounds&quality=75&auto=webp&crop=5900,3319,x0,y307&wmark=nzz",2026-03-03T04:30:00Z,,"Der Iran-Krieg hat zu Produktionsstopps geführt und den Verkehr in der Strasse von Hormuz vorerst zum Erliegen gebracht. Erdöl ist um 10Prozent, Erdgas in Europa gar um 40Prozent teurer geworden.
Zu… [+6958 chars]",,de,'Krieg'
https://www.zeit.de/politik/2026-03/friedrich-merz-donald-trump-nahost-zollpolitik-usa-nachrichtenpodcast,https://www.zeit.de/politik/2026-03/friedrich-merz-donald-trump-nahost-zollpolitik-usa-nachrichtenpodcast,0,www.zeit.de,Nahost- und Zollpolitik: Merz trifft Trump im Weißen Haus,Als erster Europäer ist der Kanzler nach dem Iranangriff zu Gast bei Trump. Der Krieg dürfte das wichtigste Thema sein. Und: Der Winter war ungewohnt mild und trocken.,https://img.zeit.de/politik/ausland/2026-03/friedrich-merz-donald-trump-nahost-zollpolitik-usa-nachrichtenpodcast-bild/wide__1300x731,2026-03-03T04:55:26Z,,Zum zweiten Mal trifft Bundeskanzler Friedrich Merz US-Präsident Donald Trump unter vier Augen in Washington. Hintergrund sind die aktuellen Entwicklungen im Nahen Osten nach den US-amerikanischen un… [+1910 chars],,de,'Gas'
https://www.zeit.de/wissen/2026-03/dwd-winter-bilanz-wetter-deutschland,https://www.zeit.de/wissen/2026-03/dwd-winter-bilanz-wetter-deutschland,0,www.zeit.de,"DWD-Winterbilanz: Warum der Winter nicht so hart war, wie Sie glauben",Endlich scheint der Frühling da zu sein. Wurde auch Zeit. Doch offiziell war der Winter zu warm und zu trocken. Hat sich anders angefühlt? Stimmt. Beides.,https://img.zeit.de/wissen/2026-03/dwd-winter-bilanz-wetter-deutschland-bild/wide__1300x731,2026-03-03T09:44:32Z,,"Als an den letzten Februartagen auch im bis dahin bitterkalten Berlin die Stühle vor die Cafés gerückt wurden und das Geräusch heißlaufender
 Heckenscheren durch die Randbezirke schallte, war klar: … [+720 chars]",,de,'Winter'
https://www.bild.de/leben-wissen/mein-recht-verbraucherportal/heizen-im-fruehling-diese-heiztipps-sparen-jetzt-kosten-69a686cb4ffe244904b65e1e,https://www.bild.de/leben-wissen/mein-recht-verbraucherportal/heizen-im-fruehling-diese-heiztipps-sparen-jetzt-kosten-69a686cb4ffe244904b65e1e,0,www.bild.de,Heizen im Frühling - Diese Heiztipps sparen jetzt Kosten,Cleveres Heizen und Lüften im Frühling senkt Energieverbrauch und Heizkosten.,"https://images.bild.de/69a686cb4ffe244904b65e1e/b5f3a2a9e15559371f900bb95a50b716,40345999?w=1280",2026-03-03T10:17:35Z,,"TTS-Player überspringenArtikel weiterlesenBerlin (ots) Der Winter ist so gut wie vorbei, der Frühling naht und mit ihm ein Wetterchaos der besonderen Art. Morgens frostig, mittags mild, abends wieder… [+2029 chars]",,de,'Energie sparen'
https://www.focus.de/finanzen/gas-und-oelpreis-explodieren-und-wir-sind-schutzlos_e78e78bf-7d72-485f-8ea1-20b17e5e85ed.html,https://www.focus.de/finanzen/gas-und-oelpreis-explodieren-und-wir-sind-schutzlos_e78e78bf-7d72-485f-8ea1-20b17e5e85ed.html,0,www.focus.de,Gas- und Ölpreis explodieren – und wir sind schutzlos,"Öl springt um 14 Prozent, Gas um mehr als 50 Prozent. Die Speicher sind nur zu einem Fünftel gefüllt. Der Krieg im Iran trifft Deutschland ins Mark. Wind und Sonne können uns nicht helfen.",https://quadro.burda-forward.de/ctf/809956ba-e601-4dab-8459-22aaaad0440f.43a2d44f-319e-4511-9857-4aca094f74a4.jpg?im=RegionOfInterestCrop%3D%281200%2C630%29%2CregionOfInterest%3D%281026%2C886%29&hash=a9ae7ff625dcd034b13866d5ebedc06bc156e419fd29f9cd62345c27b70449b4,2026-03-03T12:24:00Z,,"Drei Tage haben gereicht, um die Illusion von Deutschland als autark werdendes Energiewende-Land zu zerbröseln wie altes Mauerwerk. Seit dem vergangenen Wochenende zeigt der Weltmarkt, wer am längere… [+6500 chars]",,de,'Öl'
https://www.diepresse.com/20642114/gaspreise-in-europa-fast-verdoppelt-bringt-der-angriff-auf-den-iran-als,https://www.diepresse.com/20642114/gaspreise-in-europa-fast-verdoppelt-bringt-der-angriff-auf-den-iran-als,0,www.diepresse.com,Gaspreise in Europa fast verdoppelt: Was bedeutet das für Konsumenten? [premium],"Experten warnen, dass sich die europäische Energiekrise von 2022 durch die Eskalation im Iran wiederhole – „nur diesmal schlimmer“. Was ist da dran? „Die Presse“ beantwortet die fünf wichtigsten Fragen.",https://img.diepresse.com/public/incoming/dojibx-china-usalng/alternates/DPR_SOCIAL_MAGAZIN/CHINA-USALNG,2026-03-03T13:05:16Z,,"Die koordinierten Angriffe von Israel und den USA auf den Iran bringen Europa neuerlich an den Rand einer Energiekrise. Die wichtige Transportroute über die Straße von Hormus ist geschlossen, der zwe… [+5261 chars]",,de,'Gasspeicher'
https://www.zeit.de/news/2026-03/03/iran-krieg-verstaerkt-angst-in-juedischen-gemeinden,https://www.zeit.de/news/2026-03/03/iran-krieg-verstaerkt-angst-in-juedischen-gemeinden,0,www.zeit.de,Krieg im Nahen Osten: Iran-Krieg verstärkt Angst in jüdischen Gemeinden,Hier finden Sie Informationen zu dem Thema „Krieg im Nahen Osten“. Lesen Sie jetzt „Iran-Krieg verstärkt Angst in jüdischen Gemeinden“.,https://img.zeit.de/news/2026-03/03/iran-krieg-verstaerkt-angst-in-juedischen-gemeinden-image-group/wide__1300x731,2026-03-03T13:25:16Z,,Der Iran-Krieg hat das Unsicherheitsgefühl in jüdischen Gemeinden nach Ansicht des Beauftragten gegen Antisemitismus in Brandenburg noch einmal erhöht. Antisemitische Spannungen nähmen auch in Deutsc… [+1310 chars],,de,'Krieg'
https://www.tagesschau.de/wirtschaft/konjunktur/iran-krieg-energie-ausblick-100.html,https://www.tagesschau.de/wirtschaft/konjunktur/iran-krieg-energie-ausblick-100.html,0,www.tagesschau.de,Was der Iran-Krieg für die Konjunktur bedeutet,Nach der Sperrung der Straße von Hormus und der gestoppten LNG-Lieferungen aus Katar steigen die Preise für Öl und Gas. Wie realistisch sind Engpässe? Und was würde ein längerer Krieg für die Konjunktur bedeuten? Von T. Bücker.,https://images.tagesschau.de/image/61dea5bb-2138-4a6d-85d9-dcab408724a7/AAABnLKRttg/AAABmyZE0EA/16x9-big/hormus-114.jpg?width=1280,2026-03-03T15:12:03Z,,"Stand: 03.03.2026 16:12 Uhr
Nach der Sperrung der Straße von Hormus und der gestoppten LNG-Lieferungen aus Katar steigen die Preise für Öl und Gas. Wie realistisch sind Engpässe? Und was würde ein l… [+8353 chars]",,de,'Inflation'
https://www.dw.com/de/iranische-luftangriffe-sch%C3%BCren-energie%C3%A4ngste/a-76203467,https://www.dw.com/de/iranische-luftangriffe-sch%C3%BCren-energie%C3%A4ngste/a-76203467,0,www.dw.com,Iranische Luftangriffe schüren Energieängste,"Iranische Angriffe auf Raffinerien, Gasanlagen und Öltanker gefährden die globale Energieversorgung und bergen das Risiko schwerwiegender wirtschaftlicher Folgen weltweit. Sie zwingen die Verbraucher zum Sparen. Der Krieg im Nahen Osten stellt Investoren auf …",https://static.dw.com/image/76199392_6.jpg,2026-03-03T17:31:00Z,,"Der Krieg im Nahen Osten stellt Investoren auf der ganzen Welt vor die Aufgabe, die Auswirkungen eines langwierigen regionalen Konflikts auf die weltweite Energieversorgung und sein Potenzial, die In… [+8018 chars]",,de,'Öl'
https://www.zeit.de/wirtschaft/boerse/2026-03/iran-krieg-boerse-dax-gaspreis-oel,https://www.zeit.de/wirtschaft/boerse/2026-03/iran-krieg-boerse-dax-gaspreis-oel,0,www.zeit.de,Krieg im Iran: Dax sinkt wegen Iran-Krieg weiter,"Der Krieg im Iran und die infolgedessen steigenden Energiepreise sorgen am Markt für schlechte Stimmung. Der Dax verlor zum Handelsende 3,44 Prozent.",https://img.zeit.de/politik/deutschland/2026-03/dax-iran-krieg/wide__1300x731,2026-03-03T17:38:39Z,,"Der Iran-Krieg hat den Abwärtsdruck an den 
weltweiten Börsen verstärkt. So sank der deutsche Leitindex Dax ab und büßte zum Handelsende 
3,44 Prozent auf 23.790,65 Punkte 
ein. Mit dem deutlichen… [+787 chars]",,de,'Krieg'
https://www.stern.de/politik/deutschland/energiepreise--schwesig-fordert--schnelle-auffuellung--der-gasspeicher-37188032.html,https://www.stern.de/politik/deutschland/energiepreise--schwesig-fordert--schnelle-auffuellung--der-gasspeicher-37188032.html,0,www.stern.de,Steigende Energiepreise: SPD-Ministerpräsidentin Schwesig fordert „schnelle Auffüllung“ der Gasspeicher,Das Chaos im Nahen Osten lässt die Energiepreise in Deutschland kräftig anziehen. Nicht nur SPD-Ministerpräsidentin Schwesig nimmt die schwarz-rote Regierung in die Pflicht.,https://image.stern.de/37188034/t/D4/v4/w1440/r1.7778/-/energiepreise--schwesig-fordert--schnelle-auffuellung--der-gasspeicher.jpg,2026-03-03T23:01:00Z,,"Kopiere den aktuellen Link
Zur Merkliste hinzufügen
Das Chaos im Nahen Osten lässt die Energiepreise in Deutschland kräftig anziehen. Nicht nur SPD-Ministerpräsidentin Schwesig nimmt die schwarz-ro… [+4473 chars]",,de,'Gas'
https://salzburg.orf.at/stories/3344295/,https://salzburg.orf.at/stories/3344295/,0,salzburg.orf.at,Iran-Krieg: Gaspreise bei Salzburg AG steigen nicht,"Auch wenn die Erdgas-Preise auf dem Weltmarkt durch den Krieg im Iran derzeit stark steigen, habe das derzeit keine Auswirkungen auf Erdgaskunden der Salzburg AG. Das teilte der Landesenergieversorger jetzt mit.",https://ibs.orf.at/sbg?image=https%3A%2F%2Foekastatic.orf.at%2Fmims%2F2024%2F45%2F74%2Fcrops%2Fw%3D1200%2Ch%3D627%2Cq%3D75%2F2413295_master_922574_sujet_gas_220726_02_hum.jpg%3Fs%3De76d526834cc7b628241eeb928b8311843266db6,2026-03-04T06:36:44Z,,"Die Sorge auch vor den weltweiten wirtschaftlichen Folgen des Iran-Krieges sind groß. Nicht der Öl-, vielmehr der Gasversorgung gilt dabei das größte Augenmerk. Der Gaspreis ist bereits rasant gestie… [+970 chars]",,de,'Krieg'
https://www.diepresse.com/20645047/pressestimmen-golfstaaten-sind-fuer-iran-leichter-zu-treffen-als-die,https://www.diepresse.com/20645047/pressestimmen-golfstaaten-sind-fuer-iran-leichter-zu-treffen-als-die,0,www.diepresse.com,Pressestimmen: „Golfstaaten sind für Iran leichter zu treffen als die Festung Israel“,Zum Krieg der USA und Israels gegen den Iran sowie zu den Drohungen von US-Präsident Donald Trump gegen Nato-Partner Spanien schreiben Zeitungen am Mittwoch.,https://img.diepresse.com/public/incoming/f9adtk-imago849478741jpg/alternates/DPR_SOCIAL_NACHRICHTEN/imago849478741.jpg,2026-03-04T09:23:48Z,,"Zum Krieg der USA und Israels gegen den Iran sowie zu den Drohungen von US-Präsident Donald Trump gegen Nato-Partner Spanien schreiben Zeitungen am Mittwoch.
Polityka (Warschau):
(Israels Ministerp… [+15067 chars]",,de,'Nachhaltige Energie'
https://www.golem.de/sonstiges/zustimmung/auswahl.html?from=https://www.golem.de/news/flugabwehr-im-irankrieg-abnutzungskrieg-um-raketenbestaende-2603-206071.html&referer=https://t.co/d1195c363b,https://www.golem.de/sonstiges/zustimmung/auswahl.html?from=https://www.golem.de/news/flugabwehr-im-irankrieg-abnutzungskrieg-um-raketenbestaende-2603-206071.html&referer=https://t.co/d1195c363b,0,www.golem.de,Flugabwehr im Irankrieg: Abnutzungskrieg um Raketenbestände,"Der Iran-Krieg könnte eine unerwartete Wendung nehmen, angesichts der vielen verschossenen Flugabwehrraketen Israels und der USA. (Militär, Politik)",,2026-03-04T10:40:02Z,,"Besuchen Sie Golem.de wie gewohnt mit Werbung und Tracking,
 indem Sie der Nutzung aller Cookies zustimmen.
 Details zum Tracking finden Sie im Privacy Center.
Skript wurde nicht geladen. Informat… [+607 chars]",,de,'Krieg'
https://www.stern.de/politik/deutschland/katherina-reiche---ist-sie-in-der-krise-so-gut-wie-habeck---37189872.html,https://www.stern.de/politik/deutschland/katherina-reiche---ist-sie-in-der-krise-so-gut-wie-habeck---37189872.html,0,www.stern.de,Meinung: Krisenmanagerin Reiche: Ausgerechnet an Habeck muss sie sich jetzt messen lassen,"Energiepolitik in Zeiten des Krieges: Eben noch war Wirtschaftsministerin Reiche bemüht, den Geist des Vorgängers zu vertreiben. Jetzt muss sie es erstmal so gut machen wie er.",https://image.stern.de/37189870/t/02/v1/w1440/r1.7778/-/foto-katherina-reiche.jpg,2026-03-04T12:48:00Z,,"Kopiere den aktuellen Link
Zur Merkliste hinzufügen
Energiepolitik in Zeiten des Krieges: Eben noch war Wirtschaftsministerin Reiche bemüht, den Geist des Vorgängers zu vertreiben. Jetzt muss sie e… [+4795 chars]",,de,'Krieg'
https://www.morgenpost.de/berlin/article411367582/krieg-im-nahen-osten-berliner-wirtschaft-befuerchtet-negative-auswirkungen.html,https://www.morgenpost.de/berlin/article411367582/krieg-im-nahen-osten-berliner-wirtschaft-befuerchtet-negative-auswirkungen.html,0,www.morgenpost.de,Krieg im Nahen Osten: Das sind die Auswirkungen auf die Berliner Wirtschaft,"Benzin- und Heizölpreise gehen durch die Decke, die Straße von Hormus wird zum Nadelöhr. Die Wirtschaft fürchtet negative Folgen.",https://img.sparknews.funkemedien.de/411369150/411369150_1772640187_v16_9_1600.jpeg,2026-03-04T16:18:00Z,,Der Iran hatte den Schiffsverkehr durch die Straße von Hormus blockiert. Für den internationalen Handel ist diese Meerenge eine der wichtigsten Verkehrsrouten. Durch sie transportieren riesige Tanker… [+3078 chars],,de,'Gasspeicher'
https://www.faz.net/aktuell/sport/sportpolitik/krieg-im-nahen-osten-ioc-praesidentin-fehlt-die-substanz-110847530.html,https://www.faz.net/aktuell/sport/sportpolitik/krieg-im-nahen-osten-ioc-praesidentin-fehlt-die-substanz-110847530.html,0,www.faz.net,Krieg im Nahen Osten: Das IOC und die Flucht in die eigene Verzwergung,"Olympischer Friede? Kürzlich noch Grund für PR-Offensiven. Im Angesicht der amerikanisch-israelischen Angriffe vollzieht die IOC-Präsidentin eine Kehrtwende – und offenbart, wie sehr ihr die Substanz fehlt.",https://media0.faz.net/image/w1200h627/0f8faf323e11/w6033h3152x0y121o/202602/43601.0.1813230082/olympischer-friede-als-nettes.webp,2026-03-04T17:13:48Z,,"Nachdem vergangenen Samstag die ersten Bomben und Cruise Missiles in Teheran und anderen iranischen Städten einschlugen, war drei Tage lang nichts zu hören vom Internationalen Olympischen Komitee (IO… [+3129 chars]",,de,'Putin'
https://www.zeit.de/news/2026-03/04/pistorius-lehnt-deutsche-beteiligung-am-iran-krieg-ab,https://www.zeit.de/news/2026-03/04/pistorius-lehnt-deutsche-beteiligung-am-iran-krieg-ab,0,www.zeit.de,Krieg im Iran: Pistorius lehnt deutsche Beteiligung am Iran-Krieg ab,Hier finden Sie Informationen zu dem Thema „Krieg im Iran“. Lesen Sie jetzt „Pistorius lehnt deutsche Beteiligung am Iran-Krieg ab“.,https://img.zeit.de/news/2026-03/04/pistorius-lehnt-deutsche-beteiligung-am-iran-krieg-ab-image-group/wide__1300x731,2026-03-04T17:25:33Z,,Verteidigungsminister Boris Pistorius hat einen Einsatz der Bundeswehr im Iran-Krieg strikt abgelehnt. «Deutschland ist nicht Kriegspartei. Die deutsche Bundeswehr wird sich an diesem Krieg nicht bet… [+3437 chars],,de,'Krieg'
https://www.zeit.de/news/2026-03/04/aiwanger-fordert-stopp-der-co2-steuer-wegen-preisschub,https://www.zeit.de/news/2026-03/04/aiwanger-fordert-stopp-der-co2-steuer-wegen-preisschub,0,www.zeit.de,Hohe Gas- und Ölpreise: Aiwanger fordert Stopp der CO2-Steuer wegen Preisschub,Hier finden Sie Informationen zu dem Thema „Hohe Gas- und Ölpreise“. Lesen Sie jetzt „Aiwanger fordert Stopp der CO2-Steuer wegen Preisschub“.,https://img.zeit.de/news/2026-03/04/aiwanger-fordert-stopp-der-co2-steuer-wegen-preisschub-image-group/wide__1300x731,2026-03-04T18:07:06Z,,Bayerns Wirtschaftsminister Hubert Aiwanger (Freie Wähler) fordert angesichts gestiegener Preise für Öl und Gas den Stopp der CO2-Steuer. Der Bund und die Europäische Union müssten die heimische Wirt… [+1271 chars],,de,'Inflation'
https://www.zeit.de/news/2026-03/05/iom-chefin-warnt-vor-migrationskrise-durch-iran-krieg,https://www.zeit.de/news/2026-03/05/iom-chefin-warnt-vor-migrationskrise-durch-iran-krieg,0,www.zeit.de,Iran-Krieg: IOM-Chefin warnt vor Migrationskrise durch Iran-Krieg,Hier finden Sie Informationen zu dem Thema „Iran-Krieg“. Lesen Sie jetzt „IOM-Chefin warnt vor Migrationskrise durch Iran-Krieg“.,https://img.zeit.de/news/2026-03/05/iom-chefin-warnt-vor-migrationskrise-durch-iran-krieg-image-group/wide__1300x731,2026-03-05T01:00:04Z,,"Wegen des Iran-Kriegs warnt die Chefin der UN-Organisation für Migration (IOM) Europa vor einer Migrationskrise, die sich binnen Tagen entwickeln könnte. «Schauen Sie sich das Beispiel der Ukraine an… [+1562 chars]",,de,'Krieg'
https://www.zeit.de/news/2026-03/05/wie-wirkt-sich-der-iran-krieg-auf-den-ukraine-konflikt-aus,https://www.zeit.de/news/2026-03/05/wie-wirkt-sich-der-iran-krieg-auf-den-ukraine-konflikt-aus,0,www.zeit.de,Krieg in der Ukraine: Wie wirkt sich der Iran-Krieg auf den Ukraine-Konflikt aus?,Hier finden Sie Informationen zu dem Thema „Krieg in der Ukraine“. Lesen Sie jetzt „Wie wirkt sich der Iran-Krieg auf den Ukraine-Konflikt aus?“.,https://img.zeit.de/news/2026-03/05/wie-wirkt-sich-der-iran-krieg-auf-den-ukraine-konflikt-aus-image-group/wide__1300x731,2026-03-05T04:00:19Z,,"Der Krieg im Iran stellt das Kampfgeschehen in der Ukraine derzeit in den Schatten. Auch wenn Moskau und Kiew an dem Konflikt im Nahen Osten nicht direkt beteiligt sind, betreffen die Ereignisse dort… [+5033 chars]",,de,'Krieg'
https://www.basicthinking.de/blog/2026/03/05/deutsche-energiepolitik-zerschellt-im-iran/,https://www.basicthinking.de/blog/2026/03/05/deutsche-energiepolitik-zerschellt-im-iran/,0,www.basicthinking.de,Denkzettel für Deutschland: Energiepolitik zerschellt im Iran,"Der Beitrag Denkzettel für Deutschland: Energiepolitik zerschellt im Iran erschien zuerst beim Online-Magazin BASIC thinking. Über unseren Newsletter UPDATE startest du jeden Morgen bestens informiert in den Tag.
Der Iran-Krieg ist geografisch zwar weit von D…",https://www.basicthinking.de/blog/wp-content/uploads/2026/03/iran-spritpreise.jpg,2026-03-05T10:00:16Z,,"Der Iran-Krieg ist geografisch zwar weit von Deutschland entfernt, ökonomisch ist er aber längst hier angekommen. Grund ist die Sperrung der Straße von Hormus seitens des Iran, durch die jeweils rund… [+6758 chars]",,de,'Krieg'
https://www.n-tv.de/politik/Bas-Renten-steigen-am-1-Juli-um-4-24-Prozent-id30434667.html,https://www.n-tv.de/politik/Bas-Renten-steigen-am-1-Juli-um-4-24-Prozent-id30434667.html,0,www.n-tv.de,"Anstieg stärker als Inflation: Bas: Renten steigen am 1. Juli um 4,24 Prozent",Die mehr als 20 Millionen Rentner in Deutschland bekommen ab Juli deutlich mehr Geld. Laut Arbeitsministerin Bas steigen ihre Bezüge um über vier Prozent. Grundlage ist demnach die gute Lohnentwicklung.,https://www.n-tv.de/img/30434785/1772717583/Img_16_9/1200/Ein-Senior-und-eine-Seniorin-machen-in-der-morgendlichen-Sonne-einen-Spaziergang-durch-einen-Park-aufgenommen-in-Berlin-20-10-2025.jpg,2026-03-05T12:02:30Z,,"Für eine Standardrente bedeutet die Anhebung ein monatliches Plus von fast 78 Euro. (Foto: picture alliance / photothek.de)
Die mehr als 20 Millionen Rentner in Deutschland bekommen ab Juli deutlich… [+2142 chars]",,de,'Inflation'
