index,url,valid,domain,title,description,image,published,archive,content,quote,language,keyword
https://www.n-tv.de/politik/17-18-Schiffe-attackiert-Kiews-Geheimdienstsprecher-kuendigt-weitere-Angriffe-an--article23143824.html,https://www.n-tv.de/politik/17-18-Schiffe-attackiert-Kiews-Geheimdienstsprecher-kuendigt-weitere-Angriffe-an--article23143824.html,0,www.n-tv.de,Ukraine-Krieg im Liveticker: +++ 17:18 Schiffe attackiert: Kiews Geheimdienstsprecher kündigt weitere Angriffe an +++,Lesen Sie alle aktuellen Entwicklungen und Nachrichten über den russischen Angriffskrieg auf die Ukraine im Liveticker von ntv.de.,https://bilder2.n-tv.de/img/incoming/crop23332537/9041326157-cImg_16_9-w1200/Liveticker1-grau-1-Kopie.jpg,2023-08-03T22:01:00Z,,Nach dem Angriff einer ukrainischen Seedrohne auf ein russisches Landungsschiff im Schwarzmeerhafen von Noworossijsk kündigt ein Geheimdienstsprecher in Kiew weitere solche Attacken an. Der Treffer a… [+27855 chars],,de,'Krieg'
https://www.n-tv.de/politik/17-39-Litauen-will-wegen-Wagner-Soeldnern-in-Belarus-Grenzuebergaenge-schliessen--article23143824.html,https://www.n-tv.de/politik/17-39-Litauen-will-wegen-Wagner-Soeldnern-in-Belarus-Grenzuebergaenge-schliessen--article23143824.html,0,www.n-tv.de,Ukraine-Krieg im Liveticker: +++ 17:39 Litauen will wegen Wagner-Söldnern in Belarus Grenzübergänge schließen +++,Lesen Sie alle aktuellen Entwicklungen und Nachrichten über den russischen Angriffskrieg auf die Ukraine im Liveticker von ntv.de.,https://bilder2.n-tv.de/img/incoming/crop23332537/9041326157-cImg_16_9-w1200/Liveticker1-grau-1-Kopie.jpg,2023-08-03T22:01:00Z,,"Wegen der russischen Wagner-Söldner in Belarus will der Baltenstaat Litauen zwei von sechs Grenzübergängen zum Nachbarland schließen. ""Wir bereiten eine entsprechende Entscheidung vor"", sagte der lit… [+28583 chars]",,de,'Krieg'
https://www.n-tv.de/politik/05-02-Bundeswehr-registriert-deutlich-mehr-Antraege-auf-Kriegsdienstverweigerung--article23143824.html,https://www.n-tv.de/politik/05-02-Bundeswehr-registriert-deutlich-mehr-Antraege-auf-Kriegsdienstverweigerung--article23143824.html,0,www.n-tv.de,Ukraine-Krieg im Liveticker: +++ 05:02 Bundeswehr registriert deutlich mehr Anträge auf Kriegsdienstverweigerung +++,Lesen Sie alle aktuellen Entwicklungen und Nachrichten über den russischen Angriffskrieg auf die Ukraine im Liveticker von ntv.de.,https://bilder2.n-tv.de/img/incoming/crop23332537/9041326157-cImg_16_9-w1200/Liveticker1-grau-1-Kopie.jpg,2023-08-03T22:01:00Z,,"Seit Beginn des russischen Angriffskriegs in der Ukraine gibt es deutlich mehr Anträge auf Kriegsdienstverweigerung bei der Bundeswehr. Die Zahlen haben sich verfünffacht, wie aus einer der Antwort d… [+6096 chars]",,de,'Krieg'
https://www.n-tv.de/politik/10-49-USA-Russland-verzweifelt-Schoigu-bemueht-sich-in-Nordkorea-um-Munition--article23143824.html,https://www.n-tv.de/politik/10-49-USA-Russland-verzweifelt-Schoigu-bemueht-sich-in-Nordkorea-um-Munition--article23143824.html,0,www.n-tv.de,Ukraine-Krieg im Liveticker: +++ 10:49 USA: Russland verzweifelt - Schoigu bemüht sich in Nordkorea um Munition +++,Lesen Sie alle aktuellen Entwicklungen und Nachrichten über den russischen Angriffskrieg auf die Ukraine im Liveticker von ntv.de.,https://bilder2.n-tv.de/img/incoming/crop23332537/9041326157-cImg_16_9-w1200/Liveticker1-grau-1-Kopie.jpg,2023-08-03T22:01:00Z,,"Russland versucht, mehr Munition aus Nordkorea für den Krieg in der Ukraine zu kaufen, da Moskau zunehmend von ausländischen Lieferungen abhängig wird, berichtet AP unter Berufung auf den Sprecher de… [+15360 chars]",,de,'Krieg'
http://www.kalenderblatt.de/index.php?what=thmanu&lang=de&manu_id=972&sdt=20230804&maca=de-podcast_kalenderblatt-1086-xml-mrss,http://www.kalenderblatt.de/index.php?what=thmanu&lang=de&manu_id=972&sdt=20230804&maca=de-podcast_kalenderblatt-1086-xml-mrss,0,www.kalenderblatt.de,4.8.1914: England tritt in den Ersten Weltkrieg ein,"Nachdem am Vortag Deutschland Frankreich den Krieg erklärt und unmittelbar mit den Angriffen begonnen hatte, trat Großbritannien am 4. August 1914 in den Krieg gegen Deutschland ein.",,2023-08-04T00:00:00Z,,"Am Abend des 4. August 1914 versammeln sich Henry Asquith, der britische Premier, sein AuÃenminister Sir Edward Grey und die anderen Mitglieder des Kabinetts im Sitzungssaal der Downing Street. Sie … [+3999 chars]",,de,'Krieg'
https://www.basicthinking.de/blog/2023/08/04/lebenshaltungskosten-salzburg/,https://www.basicthinking.de/blog/2023/08/04/lebenshaltungskosten-salzburg/,0,www.basicthinking.de,Wohnen und Leben: So hoch sind die Lebenshaltungskosten in Salzburg,Die Inflation macht vielen Mensch zu schaffen. Die Energiekrise scheint sich zwar zu entspannen und die Inflationsrate sinkt allmählich. Doch vor allem die Lebensmittelpreise steigen derzeit rasant – von den Mieten ganz zu schweigen. Aber wie hoch sind die Le…,https://www.basicthinking.de/blog/wp-content/uploads/2023/07/lebenshaltungskosten-salzburg.jpg,2023-08-04T04:07:13Z,,Die Inflation macht vielen Mensch zu schaffen. Die Energiekrise scheint sich zwar zu entspannen und die Inflationsrate sinkt allmählich. Doch vor allem die Lebensmittelpreise steigen derzeit rasant v… [+3363 chars],,de,'Energiepreise'
https://www.stern.de/gesellschaft/regional/nordrhein-westfalen/quartalszahlen--konjunkturschwaeche--lanxess-schliesst-betriebe-33708994.html,https://www.stern.de/gesellschaft/regional/nordrhein-westfalen/quartalszahlen--konjunkturschwaeche--lanxess-schliesst-betriebe-33708994.html,0,www.stern.de,Quartalszahlen: Konjunkturschwäche: Lanxess schließt Betriebe,"Schwache weltweite Nachfrage, hohe Energiepreise in Deutschland - die Chemiebranche hat hierzulande schon bessere Zeiten gesehen. Es muss gespart werden, Fabriken sollen schließen.",https://image.stern.de/33708996/t/0Q/v2/w1440/r1.7778/-/04--urnnewsmldpacom2009010123080499696701v2w800h600l1290t996r4025b2775jpeg---140bed4fbbc30e76.jpg,2023-08-04T07:38:23Z,https://web.archive.org/web/20230804080655/https://www.stern.de/gesellschaft/regional/nordrhein-westfalen/quartalszahlen--konjunkturschwaeche--lanxess-schliesst-betriebe-33708994.html,"Schwache weltweite Nachfrage, hohe Energiepreise in Deutschland - die Chemiebranche hat hierzulande schon bessere Zeiten gesehen. Es muss gespart werden, Fabriken sollen schließen.
Der Spezialchemie… [+2829 chars]",,de,'Energiepreise'
https://www.faz.net/aktuell/politik/ausland/russland-nach-dem-aufstand-wieso-putin-nicht-auf-prigoschin-verzichtet-19078920.html,https://www.faz.net/aktuell/politik/ausland/russland-nach-dem-aufstand-wieso-putin-nicht-auf-prigoschin-verzichtet-19078920.html,0,www.faz.net,Russland nach dem Aufstand: Der für Putin unverzichtbare Putschist,"Vor mehr als einem Monat probte Jewgenij Prigoschin in Russland den Aufstand, nun hält er Hof, als sei nichts geschehen. Das Gewaltmonopol des Kremls fragmentiert weiter.",https://media1.faz.net/ppmedia/aktuell/1616200241/1.9063219/facebook_teaser/prigoschin-mit-einem-vertreter.jpg,2023-08-04T10:56:10Z,https://web.archive.org/web/20230804110837/https://www.faz.net/aktuell/politik/ausland/russland-nach-dem-aufstand-wieso-putin-nicht-auf-prigoschin-verzichtet-19078920.html,"Jewgenij Prigoschin ist in die russische Politik zurückgekehrt. Am Rande des zweiten Russland-Afrika-Gipfels in der vergangenen Woche tauchte er zwar nicht auf der offiziellen, von Staatsfernsehkamer… [+2734 chars]",,de,'Putin'
https://www.faz.net/aktuell/politik/inland/bundesregierung-hofft-auf-chinesische-teilnahme-19080950.html,https://www.faz.net/aktuell/politik/inland/bundesregierung-hofft-auf-chinesische-teilnahme-19080950.html,0,www.faz.net,Hoffen auf Teilnahme Chinas am Treffen in Saudi-Arabien,"Die Unterstützer der Ukraine in ihrem Krieg gegen Russland wollen möglichst viele und einflussreiche Länder des Südens dazu bringen, Kiew zu unterstützen. Wer ist am Wochenende dabei?",https://media1.faz.net/ppmedia/aktuell/politik/1649429552/1.9080949/facebook_teaser/teilnehmer-der-ukraine.jpg,2023-08-04T11:57:03Z,https://web.archive.org/web/20230804120534/https://www.faz.net/aktuell/politik/inland/bundesregierung-hofft-auf-chinesische-teilnahme-19080950.html,"In der Bundesregierung gibt es vorsichtige Zuversicht, dass auch Vertreter Chinas an dem Treffen von mehr als 30 Staaten im saudischen Dschidda an diesem Wochenende dabei sein werden. Es geht um die … [+2407 chars]",,de,'Krieg'
https://taz.de/Geplante-Nordsee-Bohrungen/!5949073/,https://taz.de/Geplante-Nordsee-Bohrungen/!5949073/,0,taz.de,Geplante Nordsee-Bohrungen: Rishi Sunaks fossiler Wahnsinn,Öl und Gas sind saubere Energiequellen? Fossile Kraftstoffe gehören zur Klimaneutralität? Der britische Premier hat außergewöhnliche Ideen.,https://taz.de/picture/6432276/948/33334279-1.jpeg,2023-08-04T13:38:00Z,https://web.archive.org/web/20230804150701/https://taz.de/Geplante-Nordsee-Bohrungen/!5949073/,"Öl und Gas sind saubere Energiequellen? Fossile Kraftstoffe gehören zur Klimaneutralität? Der britische Premier hat außergewöhnliche Ideen.
Greenpeace Aktion gegen die geplanten Öl- und Gasbohrungen… [+2066 chars]",,de,'fossile Energie'
https://www.tagesschau.de/faktenfinder/russland-sanktionen-146.html,https://www.tagesschau.de/faktenfinder/russland-sanktionen-146.html,0,www.tagesschau.de,Krieg gegen die Ukraine: Wie erfolgreich sind die Russland-Sanktionen?,Elf Sanktionspakete hat die EU mittlerweile gegen Russland erlassen - getragen von vielen westlichen Partnern. Dennoch entwickelt sich Russlands Wirtschaft besser als erwartet. Sind die Sanktionsmaßnahmen wirkungslos? Von Pascal Siggelkow.,https://images.tagesschau.de/image/9122b5de-160b-46e4-bef6-270b3e3abaa2/AAABicAJgCA/AAABibBxqrQ/16x9-1280/moskau-einkaufszentrum-100.jpg,2023-08-04T13:40:53Z,https://web.archive.org/web/20230804135223/https://www.tagesschau.de/faktenfinder/russland-sanktionen-146.html,"Stand: 04.08.2023 15:40 Uhr
Elf Sanktionspakete hat die EU mittlerweile gegen Russland erlassen - getragen von vielen westlichen Partnern. Dennoch entwickelt sich Russlands Wirtschaft besser als erw… [+9111 chars]",,de,'Krieg'
https://www.zeit.de/news/2023-08/04/telegraph-bayern-fordert-kane-entscheidung,https://www.zeit.de/news/2023-08/04/telegraph-bayern-fordert-kane-entscheidung,0,www.zeit.de,Fußball: «Telegraph»: Bayern fordert Kane-Entscheidung,,,2023-08-04T14:29:02Z,https://web.archive.org/web/20230805023630/https://www.zeit.de/news/2023-08/04/telegraph-bayern-fordert-kane-entscheidung,"When browsing with ads:
We collect personal data and also transmit it to third-party providers
 that help us improve and finance our digital content. Some of the information stored on your device, … [+821 chars]",,de,'Bayern'
https://www.zeit.de/politik/ausland/2023-08/russischer-oppositioneller-nawalny-zu-19-jahren-haft-verurteilt,https://www.zeit.de/politik/ausland/2023-08/russischer-oppositioneller-nawalny-zu-19-jahren-haft-verurteilt,0,www.zeit.de,Inhaftierter Oppositionspolitiker: Russischer Oppositioneller Nawalny zu 19 Jahren Haft verurteilt,Ein Moskauer Gericht hat den prominenten Putin-Kritiker Alexej Nawalny zu einer weiteren Haftstrafe verurteilt. Kritiker hielten den Prozess für inszeniert.,,2023-08-04T14:29:10Z,https://web.archive.org/web/20230804153250/https://www.zeit.de/politik/ausland/2023-08/russischer-oppositioneller-nawalny-zu-19-jahren-haft-verurteilt,"When browsing with ads:
We collect personal data and also transmit it to third-party providers
 that help us improve and finance our digital content. Some of the information stored on your device, … [+821 chars]",,de,'Putin'
https://www.stern.de/news/reduzierte-mehrwertsteuer-in-gastronomie-kostet-staat-3-4-milliarden-euro-im-jahr-33710522.html,https://www.stern.de/news/reduzierte-mehrwertsteuer-in-gastronomie-kostet-staat-3-4-milliarden-euro-im-jahr-33710522.html,0,www.stern.de,"Reduzierte Mehrwertsteuer in Gastronomie kostet Staat 3,4 Milliarden Euro im Jahr","Durch die seit der Corona-Pandemie reduzierte Mehrwertsteuer in der Gastronomie verliert der Staat pro Jahr rund 3,4 Milliarden Euro an Einnahmen. Dies teilte das Bundesfinanzministerium am Freitag in Berlin mit. Aus der Gastronomie-Branche kommen seit Wochen…",https://image.stern.de/33710524/t/UC/v1/w1440/r1.7778/-/04--restaurant---d3be57a3d95b2b6d.jpg,2023-08-04T14:53:41Z,https://web.archive.org/web/20230806052918/https://www.stern.de/news/reduzierte-mehrwertsteuer-in-gastronomie-kostet-staat-3-4-milliarden-euro-im-jahr-33710522.html,"Durch die seit der Corona-Pandemie reduzierte Mehrwertsteuer in der Gastronomie verliert der Staat pro Jahr rund 3,4 Milliarden Euro an Einnahmen. Dies teilte das Bundesfinanzministerium am Freitag i… [+1039 chars]",,de,'Gas'
https://www.faz.net/aktuell/politik/alexej-nawalnyj-zu-haftstrafe-verurteilt-19081701.html,https://www.faz.net/aktuell/politik/alexej-nawalnyj-zu-haftstrafe-verurteilt-19081701.html,0,www.faz.net,"Nawalnyj vor Gericht: Ein Urteil, das auf Millionen zielt","Alexej Nawalnyj gibt sich vor Gericht ungebrochen. Seine Anhänger ruft er auf, sich nicht einschüchtern zu lassen, wie es Putin mit der politischen Verfolgung seiner Gegner bezwecke.",https://media1.faz.net/ppmedia/aktuell/politik/2815694794/1.9082149/facebook_teaser/bei-der-urteilsverkuendung.jpg,2023-08-04T15:43:55Z,,"Präsident Wladimir Putins wichtigster innenpolitischer Gegner wusste schon vor dem jüngsten Urteil, was ihn erwartet. Es werde eine lange Haftstrafe, schrieb Alexej Nawalnyj am Donnerstag in einem üb… [+5021 chars]",,de,'Putin'
https://www.zeit.de/politik/ausland/2023-08/russland-alexej-nawalny-widerstand-wladimir-putin-urteil,https://www.zeit.de/politik/ausland/2023-08/russland-alexej-nawalny-widerstand-wladimir-putin-urteil,0,www.zeit.de,Russland: Alexej Nawalny ruft nach Verurteilung zu Widerstand gegen Putin auf,"Der russische Oppositionelle Nawalny hat seine Landsleute aufgerufen, sich nicht einschüchtern zu lassen. Mit seiner Verurteilung wolle die Regierung Angst verbreiten.",,2023-08-04T18:17:37Z,,"When browsing with ads:
We collect personal data and also transmit it to third-party providers
 that help us improve and finance our digital content. Some of the information stored on your device, … [+821 chars]",,de,'Putin'
https://www.zeit.de/news/2023-08/05/medien-mehrere-explosionen-nahe-der-krim-bruecke,https://www.zeit.de/news/2023-08/05/medien-mehrere-explosionen-nahe-der-krim-bruecke,0,www.zeit.de,Krieg gegen die Ukraine: Medien: Mehrere Explosionen nahe der Krim-Brücke,,,2023-08-04T23:30:26Z,https://web.archive.org/web/20230805122202/https://www.zeit.de/news/2023-08/05/medien-mehrere-explosionen-nahe-der-krim-bruecke,"When browsing with ads:
We collect personal data and also transmit it to third-party providers
 that help us improve and finance our digital content. Some of the information stored on your device, … [+821 chars]",,de,'Krieg'
https://www.nzz.ch/international/cdu-politiker-arnold-vaatz-merkel-mitverantwortlich-fuer-ukraine-krieg-ld.1750103,https://www.nzz.ch/international/cdu-politiker-arnold-vaatz-merkel-mitverantwortlich-fuer-ukraine-krieg-ld.1750103,0,www.nzz.ch,INTERVIEW - CDU-Politiker Arnold Vaatz: «Merkel ist in hohem Masse mitverantwortlich für den Krieg in der Ukraine»,"Er war Bürgerrechtler in der DDR und Vizechef der Unionsfraktion: Arnold Vaatz beschreibt Ex-Kanzlerin Merkel als «Katastrophe für Deutschland», an der er selbst mitgewirkt habe. Ein Gespräch über das Erbe Merkels, die deutsche Energiepolitik und die AfD.","https://img.nzz.ch/2022/04/14/4bb69751-0ceb-4e0f-aa71-7d48e6b93cff.jpeg?width=1200&height=674&fit=bound&quality=75&auto=webp&crop=4477,2515,x0,y566&wmark=nzz",2023-08-05T03:31:00Z,https://web.archive.org/web/20230805121734/https://www.nzz.ch/international/cdu-politiker-arnold-vaatz-merkel-mitverantwortlich-fuer-ukraine-krieg-ld.1750103,"Schwierige Konstellation: Russlands Präsident Putin mit der damaligen deutschen Kanzlerin Merkel bei einem Besuch in Berlin im Jahr 2016. 
Herr Vaatz, was macht Ihnen in der derzeitigen politischen … [+12524 chars]",,de,'Fossile Energie'
https://www.stern.de/gesellschaft/regional/bayern/agrar--regen-bremst-getreideernte-aus--qualitaet-leidet-33711688.html,https://www.stern.de/gesellschaft/regional/bayern/agrar--regen-bremst-getreideernte-aus--qualitaet-leidet-33711688.html,0,www.stern.de,Agrar: Regen bremst Getreideernte aus: Qualität leidet,"Erst Trockenheit und Hitze, dann gefühlt Dauerregen in vielen Regionen: Die Getreideernte in Bayern ist auch in diesem Jahr wieder eine Herausforderung. Anderen Gewächsen auf den Feldern dagegen tut der Regen gut.",https://image.stern.de/33711690/t/Bp/v1/w1440/r1.7778/-/05--urnnewsmldpacom2009010123080599714194v3w800h600l691t186r1924b1564jpeg---f7e165c5745a0f93.jpg,2023-08-05T07:09:35Z,https://web.archive.org/web/20230805073340/https://www.stern.de/gesellschaft/regional/bayern/agrar--regen-bremst-getreideernte-aus--qualitaet-leidet-33711688.html,"Erst Trockenheit und Hitze, dann gefühlt Dauerregen in vielen Regionen: Die Getreideernte in Bayern ist auch in diesem Jahr wieder eine Herausforderung. Anderen Gewächsen auf den Feldern dagegen tut … [+2546 chars]",,de,'Bayern'
https://www.zeit.de/sport/2023-08/fussball-wm-neuseeland-dunedin-bedingungen,https://www.zeit.de/sport/2023-08/fussball-wm-neuseeland-dunedin-bedingungen,0,www.zeit.de,Fußball-WM der Frauen: Am Südpol der WM,"Das größte Frauensportevent wird vor Traumkulissen ausgetragen. Im Winter – mit Rücksicht auf den Kalender der Männer. Eindrücke aus Dunedin, dem südlichsten Ort der WM",,2023-08-05T10:33:33Z,,"When browsing with ads:
We collect personal data and also transmit it to third-party providers
 that help us improve and finance our digital content. Some of the information stored on your device, … [+821 chars]",,de,'Winter'
https://www.wiwo.de/politik/europa/mehr-wettbewerb-fuer-europa-was-die-eu-braucht-mehr-zutrauen-in-menschen-und-marktwirtschaft/29293588.html,https://www.wiwo.de/politik/europa/mehr-wettbewerb-fuer-europa-was-die-eu-braucht-mehr-zutrauen-in-menschen-und-marktwirtschaft/29293588.html,0,www.wiwo.de,Mehr Wettbewerb für Europa: Was die EU braucht? Mehr Zutrauen in Menschen und Marktwirtschaft,"Sanierungszwang für Gebäude statt steuerliche Anreize, Wasserstoff nur grün aus Wind und Sonne, „All Electric“ vor Technologieoffenheit: Die EU steckt die Wirtschaft in eine Zwangsjacke. Ein Gastbeitrag.",https://www.wiwo.de/images/20-09-2019-bruessel-belgien-logo-des-europaeischen-parlaments-in-bruessel-am-gebaeude-altiero-spinelli-20-09-20/29300338/2-format11240.jpg,2023-08-05T10:38:55Z,https://web.archive.org/web/20230805172123/https://www.wiwo.de/politik/europa/mehr-wettbewerb-fuer-europa-was-die-eu-braucht-mehr-zutrauen-in-menschen-und-marktwirtschaft/29293588.html,"Zunächst ein Werbeblock, der sein muss: Die Europäische Union (EU) ist eine Erfolgsgeschichte. Offene Grenzen, gemeinsame Währung und technische Normen: Für Industrie und Mittelstand ist die EU das T… [+5576 chars]",,de,'Fossile Energie'
https://www.zeit.de/news/2023-08/05/mehrere-aquaplaning-unfaelle-in-bayern,https://www.zeit.de/news/2023-08/05/mehrere-aquaplaning-unfaelle-in-bayern,0,www.zeit.de,Wetter: Mehrere Aquaplaning-Unfälle in Bayern,,,2023-08-05T11:16:43Z,https://web.archive.org/web/20230806014707/https://www.zeit.de/news/2023-08/05/mehrere-aquaplaning-unfaelle-in-bayern,"When browsing with ads:
We collect personal data and also transmit it to third-party providers
 that help us improve and finance our digital content. Some of the information stored on your device, … [+821 chars]",,de,'Bayern'
https://consent.google.com/ml?continue=https://news.google.com/rss/articles/CBMiN2h0dHBzOi8vd3d3LnJldXRlcnMuY29tL3ZpZGVvL3dhdGNoL2lkT1YyNTI5MDUwODIwMjNSUDHSAQA?oc%3D5&gl=FR&hl=en-US&cm=2&pc=n&src=1,https://consent.google.com/ml?continue=https://news.google.com/rss/articles/CBMiN2h0dHBzOi8vd3d3LnJldXRlcnMuY29tL3ZpZGVvL3dhdGNoL2lkT1YyNTI5MDUwODIwMjNSUDHSAQA?oc%3D5&gl=FR&hl=en-US&cm=2&pc=n&src=1,0,consent.google.com,Ein Hauch von Winter in Reutlingen - Reuters,Ein Hauch von Winter in Reutlingen  Reuters,,2023-08-05T14:43:07Z,,"We use cookies and data to<ul><li>Deliver and maintain Google services</li><li>Track outages and protect against spam, fraud, and abuse</li><li>Measure audience engagement and site statistics to unde… [+1131 chars]",,de,'Winter'
https://www.tagesschau.de/ausland/europa/oesterreich-russland-gas-wien-100.html,https://www.tagesschau.de/ausland/europa/oesterreich-russland-gas-wien-100.html,0,www.tagesschau.de,Österreich bleibt bis 2040 abhängig von russischem Gas,"Österreich zählt laut einem britischen Magazin zu ""Putins nützlichen Idioten"". Grund dafür ist vor allem importiertes Gas aus Russland - und die Verträge gelten noch viele Jahre. Von Wolfgang Vichtl.",https://images.tagesschau.de/image/c32633ce-d6ae-4a67-bca9-90f93c31022e/AAABh1C1u64/AAABibBxqrQ/16x9-1280/omv-105.jpg,2023-08-05T14:57:32Z,https://web.archive.org/web/20230805182326/https://www.tagesschau.de/ausland/europa/oesterreich-russland-gas-wien-100.html,"Stand: 05.08.2023 16:57 Uhr
Österreich zählt laut einem britischen Magazin zu ""Putins nützlichen Idioten"". Grund dafür ist vor allem importiertes Gas aus Russland - und die Verträge gelten noch viel… [+3740 chars]",,de,'Putin'
https://www.welt.de/wirtschaft/article246760538/Markus-Soeder-Deutschland-faellt-immer-weiter-zurueck.html,https://www.welt.de/wirtschaft/article246760538/Markus-Soeder-Deutschland-faellt-immer-weiter-zurueck.html,0,www.welt.de,„Die Wirtschaft im Ausland wächst und Deutschland fällt immer weiter zurück“,"Die Union fordert von der Ampel-Koalition ein „Sofortprogramm“ für die Wirtschaft. Der „Cocktail“ aus hohen Steuern, Abgaben und Energiepreisen müsse weggeschüttet werden. Grünen-Chefin Ricarda Lang verspricht, das Thema schnell in Angriff zu nehmen.",https://img.welt.de/img/wirtschaft/mobile246760548/0261359347-ci16x9-w1200/Pressekonferenz-der-CSU-nach-Vorstandssitzu-ng-am-24-07-2023.jpg,2023-08-06T01:01:57Z,,Angesichts der Konjunkturflaute in Deutschland fordert die Union von der Bundesregierung schnelle Gegenmaßnahmen. Die Wirtschaft im Ausland wächst und Deutschland fällt immer weiter zurück. Die Probl… [+2332 chars],,de,'Energiepreise'
https://www.zeit.de/news/2023-08/06/krieg-gegen-die-ukraine-so-ist-die-lage,https://www.zeit.de/news/2023-08/06/krieg-gegen-die-ukraine-so-ist-die-lage,0,www.zeit.de,Russische Invasion: Krieg gegen die Ukraine: So ist die Lage,,,2023-08-06T03:26:26Z,https://web.archive.org/web/20230806043424/https://www.zeit.de/news/2023-08/06/krieg-gegen-die-ukraine-so-ist-die-lage,"When browsing with ads:
We collect personal data and also transmit it to third-party providers
 that help us improve and finance our digital content. Some of the information stored on your device, … [+821 chars]",,de,'Krieg'
https://www.n-tv.de/politik/Wo-bleibt-das-versprochene-Klimageld-article24295659.html,https://www.n-tv.de/politik/Wo-bleibt-das-versprochene-Klimageld-article24295659.html,0,www.n-tv.de,Entlastung für Bürger wackelt: Wo bleibt das versprochene Klimageld?,Das Klimageld ist eines der Schaufensterprojekte im Koalitionsvertrag: Die Ampel will so Verbraucher von steigenden Energiepreisen entlasten. Inzwischen scheint das Projekt in weite Ferne gerückt. Dabei hat Finanzminister Lindner gerade erst das Erreichen ein…,https://bilder2.n-tv.de/img/incoming/crop24298961/2091321548-cImg_16_9-w1200/401949343.jpg,2023-08-06T06:19:15Z,,Das Klimageld ist eines der Schaufensterprojekte im Koalitionsvertrag: Die Ampel will so Verbraucher von steigenden Energiepreisen entlasten. Inzwischen scheint das Projekt in weite Ferne gerückt. Da… [+9999 chars],,de,'Energiepreise'
https://www.faz.net/aktuell/feuilleton/debatten/kolumne-bild-der-woche-von-katja-petrowskaja-19079517.html,https://www.faz.net/aktuell/feuilleton/debatten/kolumne-bild-der-woche-von-katja-petrowskaja-19079517.html,0,www.faz.net,Katja Petrowskaja über einen chassidischen Flamenco-Tänzer in Kiew: Genius Loci,"Ein katholischer Flamenco-Choreograph aus Granada konvertiert zum Judentum und kommt im Krieg nach Kiew, um Meisterklassen zu geben. Das ist mein Bild der Woche.",https://media1.faz.net/ppmedia/aktuell/3839136350/1.9079527/facebook_teaser/der-chassidische-flamenco.jpg,2023-08-06T08:42:51Z,https://web.archive.org/web/20230806084939/https://www.faz.net/aktuell/feuilleton/debatten/kolumne-bild-der-woche-von-katja-petrowskaja-19079517.html,"Ein Chassid, Isaac de Hudea, der in Granada eigentlich als ein Katholik, als Perez Garcia aufgewachsen ist, gibt eine Flamenco-Meisterklasse in Kiew im Kriegssommer 2023. Ein Tag, an dem es wieder Lu… [+4300 chars]",,de,'Krieg'
"https://www.computerwoche.de/a/5-gegen-arm,3615028?utm_source=Nach-Artikeltyp_1,30,119,124,125&utm_medium=RSS&utm_campaign=RSS-Feeds","https://www.computerwoche.de/a/5-gegen-arm,3615028?utm_source=Nach-Artikeltyp_1,30,119,124,125&utm_medium=RSS&utm_campaign=RSS-Feeds",0,www.computerwoche.de,RISC-V-Joint-Venture: 5 gegen ARM,"Fünf führende Halbleiterproduzenten tun sich zusammen, um ihre Abhängigkeit von ARM zu reduzieren.",https://images.computerwoche.de/bdb/3385362/640x360.png,2023-08-07T07:49:00Z,,"Der quelloffene Standard RISC-V steht im Mittelpunkt eines neuen, noch nicht benannten Halbleiter-Joint-Ventures. Foto: Robert Bosch GmbH
Ein bislang noch namenloses Joint Venture haben fünf führend… [+2514 chars]",,de,'Abhängigkeit'
