index,url,valid,domain,title,description,image,published,archive,content,quote,language,keyword
https://www.zeit.de/news/2024-01/07/transfer-zeitplan-des-fc-bayern-nichts-konkretes-zu-dier,https://www.zeit.de/news/2024-01/07/transfer-zeitplan-des-fc-bayern-nichts-konkretes-zu-dier,0,www.zeit.de,Bundesliga: Transfer-Zeitplan des FC Bayern: Nichts Konkretes zu Dier,Hier finden Sie Informationen zu dem Thema „Bundesliga“. Lesen Sie jetzt „Transfer-Zeitplan des FC Bayern: Nichts Konkretes zu Dier“.,https://img.zeit.de/news/2024-01/07/transfer-zeitplan-des-fc-bayern-nichts-konkretes-zu-dier-image-group/wide__1300x731,2024-01-07T06:18:06Z,,"Auch nach dem einzigen Probelauf vor der Fortsetzung der Bundesliga-Saison war das Warten auf erfolgreiche Transferaktivitäten das spannendste Thema beim FC Bayern München. 
Mehr Schlagzeilen
Und T… [+3147 chars]",,de,'Bayern'
https://www.stern.de/gesellschaft/regional/bayern/fussball--der-transfer-plan-des-fc-bayern--nichts-konkretes-zu-dier-34343210.html,https://www.stern.de/gesellschaft/regional/bayern/fussball--der-transfer-plan-des-fc-bayern--nichts-konkretes-zu-dier-34343210.html,0,www.stern.de,Fußball: Der Transfer-Plan des FC Bayern: Nichts Konkretes zu Dier,Nach dem 1:1 des deutschen Fußball-Meisters beim Probelauf in Basel geht's natürlich auch wieder um Winter-Transfers. Noch geben sich der Verein und auch der Trainer entspannt.,https://image.stern.de/34343212/t/xV/v2/w1440/r1.7778/-/07--urnnewsmldpacom2009010124010699513072v2w800h600l1038t458r3493b2099jpeg---2b16a77d70fff9f3.jpg,2024-01-07T07:55:24Z,,"Nach dem 1:1 des deutschen Fußball-Meisters beim Probelauf in Basel geht's natürlich auch wieder um Winter-Transfers. Noch geben sich der Verein und auch der Trainer entspannt.
Auch nach dem einzige… [+2618 chars]",,de,'Winter'
https://www.bild.de/politik/inland/politik-inland/stauseen-waren-voll-haben-behoerden-das-hochwasser-noch-schlimmer-gemacht-86635480.bild.html,https://www.bild.de/politik/inland/politik-inland/stauseen-waren-voll-haben-behoerden-das-hochwasser-noch-schlimmer-gemacht-86635480.bild.html,0,www.bild.de,Verhängnisvolle Entscheidung - Haben Behörden die Flut noch schlimmer gemacht?,Aus Angst vor trockenen Sommern sind viele Talsperren in diesem Winter rappelvoll! Das ging jetzt nach kräftig hinten los!,"https://images.bild.de/6596b3b4591ea86d40d3cd3a/39d8d0ce7d6f43bb01d40498948f8c4d,f02d0f11?w=1280",2024-01-07T08:14:48Z,,"Aus Angst vor trockenen Sommern sind viele Talsperren in diesem Winter rappelvoll. Das rächt sich jetzt! 
Aus vielen Bundesländern kommen die gleichen Meldungen: Talsperren sind übergelaufen oder mü… [+3308 chars]",,de,'Winter'
https://www.kicker.de/die-winter-neuzugaenge-der-bundesligisten-im-ueberblick-986926/artikel,https://www.kicker.de/die-winter-neuzugaenge-der-bundesligisten-im-ueberblick-986926/artikel,0,www.kicker.de,Die Winter-Neuzugänge der Bundesligisten im Überblick,"In der Winterpause haben die 18 Bundesligisten die Möglichkeit, ihre Kader nachzurüsten. Die bisherigen Winter-Neuzugänge im Überblick ...","https://derivates.kicker.de/image/upload/c_crop,x_0,y_324,w_3922,h_2206/w_1200,q_auto/v1/2023/12/27/88f7b5f8-1678-4236-8ed1-6dfdead8881d.jpeg",2024-01-07T08:15:41Z,,"Werbung und Tracking: Um dir relevante Inhalte und personalisierte Werbung anzubieten, setzen wir Cookies und andere Technologien ein. Damit messen wir, wie und womit du unsere Angebote nutzt. Diese … [+1979 chars]",,de,'Winter'
https://www.diepresse.com/17964042/letzter-countdown-fuer-starstuermer-mbappe,https://www.diepresse.com/17964042/letzter-countdown-fuer-starstuermer-mbappe,0,www.diepresse.com,Letzter Countdown für Starstürmer Mbappé [premium],Wochen der Wahrheit für Kylian Mbappé: Im Winter-Transferfenster entscheidet sich die Zukunft des Superstars. Wer aber macht das Rennen um den besten Fußballer seiner Generation?,https://img.diepresse.com/public/incoming/gqivfk-TOPSHOT-FBL-FRA-CHAMPIONS-TROPHY-PSG-TRAINING/alternates/DPR_SOCIAL_MAGAZIN_PAID/TOPSHOT-FBL-FRA-CHAMPIONS-TROPHY-PSG-TRAINING,2024-01-07T08:27:53Z,,"Wochen der Wahrheit für Kylian Mbappé: Im Winter-Transferfenster entscheidet sich die Zukunft des Superstars. Wer aber macht das Rennen um den besten Fußballer seiner Generation? 
Seit 1. Jänner dar… [+679 chars]",,de,'Winter'
https://www.bild.de/sport/fussball/1-fc-nuernberg/fcn-mathenia-gegen-klaus-jetzt-ist-es-ein-echtes-torwart-duell-86645304.bild.html,https://www.bild.de/sport/fussball/1-fc-nuernberg/fcn-mathenia-gegen-klaus-jetzt-ist-es-ein-echtes-torwart-duell-86645304.bild.html,0,www.bild.de,Mathenia gegen Klaus - Jetzt ist es ein echtes Torwart-Duell!,In den vergangenen Jahren war der Kampf um die Kiste beim 1. FC Nürnberg nur ein Schein-Duell. In diesem Winter ist das anders!,"https://images.bild.de/6597e8ca66efd9053591e213/43e4042ef7e9bbec66cc0b19e61da821,7344d117?w=1280",2024-01-07T09:00:54Z,,"In den vergangenen Jahren war der Kampf um die Kiste beim 
1. FC Nürnberg nur ein Schein-Duell. In diesem Winter ist das anders!
Langzeit-Nummer-eins Christian Mathenia (31) hatte eine schwache Hin… [+1608 chars]",,de,'Winter'
https://www.faz.net/aktuell/sport/fussball/bundesliga/fc-bayern-muenchen-tuchel-und-freund-sprechen-ueber-transfers-im-winter-19431009.html,https://www.faz.net/aktuell/sport/fussball/bundesliga/fc-bayern-muenchen-tuchel-und-freund-sprechen-ueber-transfers-im-winter-19431009.html,0,www.faz.net,Tuchel und Freund: Der FC Bayern und das Problem mit den Wintertransfers,Für Trainer Tuchel ist der Zeitplan bereits überschritten: Der deutsche Fußball-Rekordmeister wartet weiter auf Verstärkung in der Defensive. Das liegt auch an den konkreten Vorstellungen der Münchner.,https://media1.faz.net/ppmedia/aktuell/sport/1372911618/1.9431063/facebook_teaser/auf-der-suche-nach-personal.jpg,2024-01-07T09:19:18Z,,Auch nach dem einzigen Probelauf vor der Fortsetzung der Bundesliga-Saison war das Warten auf erfolgreiche Transferaktivitäten das spannendste Thema beim FC Bayern München. Und Trainer Thomas Tuchel … [+2673 chars],,de,'Winter'
https://www.kicker.de/ich-bestehe-darauf-xavi-wuenscht-sich-dringend-einen-ersatz-fuer-gavi-988497/video,https://www.kicker.de/ich-bestehe-darauf-xavi-wuenscht-sich-dringend-einen-ersatz-fuer-gavi-988497/video,0,www.kicker.de,"""Ich bestehe darauf"" - Xavi wünscht sich dringend einen Ersatz für Gavi","Video: Barcelonas Trainer Xavi machte deutlich, dass er die Lücke, die Mittelfeldspieler Gavi nach seinem Kreuzbandriss hinterlassen hat, vor Ende der Winter-Transferperiode schließen will.","https://derivates.kicker.de/image/upload/w_1920,h_1080,c_fill,g_auto:subject/w_1200,q_auto/v1/2024/01/07/3ac824e4-ad1d-4738-8e30-08ffec04a5f8.jpeg",2024-01-07T09:55:08Z,,"Werbung und Tracking: Um dir relevante Inhalte und personalisierte Werbung anzubieten, setzen wir Cookies und andere Technologien ein. Damit messen wir, wie und womit du unsere Angebote nutzt. Diese … [+1979 chars]",,de,'Winter'
https://www.tagesspiegel.de/politik/cdu-politiker-frei-zur-migrationspolitik-bundesregierung-darf-den-menschen-nicht-langer-etwas-vormachen-11009743.html,https://www.tagesspiegel.de/politik/cdu-politiker-frei-zur-migrationspolitik-bundesregierung-darf-den-menschen-nicht-langer-etwas-vormachen-11009743.html,0,www.tagesspiegel.de,CDU-Politiker Frei zur Migrationspolitik: „Bundesregierung darf den Menschen nicht länger etwas vormachen“,"Am Montag will das Bundesamt für Migration und Flüchtlinge die jüngsten Asylbewerberzahlen veröffentlichen. Auch wenn die Zahlen im Winter zurückgehen, bedeutet das nicht zwangsläufig eine Trendumkehr.",https://www.tagesspiegel.de/images/cdu-politiker-frei1/alternates/BASE_16_9_W1400/cdu-politiker-frei.jpeg,2024-01-07T09:58:29Z,,Viele Flüchtlinge aus der Ukraine wollen inzwischen in Deutschland bleiben. Hinzu kommen die weiter hohen Zahlen von Asylbewerbern. Angesichts dieser Entwicklung warnt der Parlamentarische Geschäftsf… [+4914 chars],,de,'Winter'
https://www.zeit.de/news/2024-01/07/baerbock-terror-und-humanitaere-not-in-nahost-beenden,https://www.zeit.de/news/2024-01/07/baerbock-terror-und-humanitaere-not-in-nahost-beenden,0,www.zeit.de,Gaza-Krieg: Baerbock: Terror und humanitäre Not in Nahost beenden,Hier finden Sie Informationen zu dem Thema „Gaza-Krieg“. Lesen Sie jetzt „Baerbock: Terror und humanitäre Not in Nahost beenden“.,https://img.zeit.de/news/2024-01/07/baerbock-terror-und-humanitaere-not-in-nahost-beenden-image-group/wide__1300x731,2024-01-07T16:35:22Z,,Drei Monate nach Beginn des Gaza-Kriegs hat Außenministerin Annalena Baerbock eindringlich zum Ende der Gewalt aufgerufen. «Der Terror muss ein Ende haben. Die humanitäre Not der Menschen muss ein En… [+4399 chars],,de,'Krieg'
https://www.zeit.de/news/2024-01/07/rostock-seawolves-verlieren-gegen-fc-bayern,https://www.zeit.de/news/2024-01/07/rostock-seawolves-verlieren-gegen-fc-bayern,0,www.zeit.de,Basketball: Rostock Seawolves verlieren gegen FC Bayern,Hier finden Sie Informationen zu dem Thema „Basketball“. Lesen Sie jetzt „Rostock Seawolves verlieren gegen FC Bayern“.,https://img.zeit.de/news/2024-01/07/rostock-seawolves-verlieren-gegen-fc-bayern-image-group/wide__1300x731,2024-01-07T16:40:02Z,,Die Rostock Seawolves haben eine Überraschung im ersten Spiel des Jahres verpasst. Vor der Rekordkulisse von 4832 Zuschauern in der Stadthalle unterlag die Mannschaft von Cheftrainer Christian Held d… [+1949 chars],,de,'Bayern'
https://taz.de/Neue-Mobilisierungsregeln-in-der-Ukraine/!5982092/,https://taz.de/Neue-Mobilisierungsregeln-in-der-Ukraine/!5982092/,0,taz.de,"Neue Mobilisierungsregeln in der Ukraine: Kein Krieg, zumindest für Reiche","Bisher hängen Militärberufungen in der Ukraine nicht vom Einkommen ab. Doch die Regierungspartei denkt darüber nach, das zu ändern.",https://taz.de/picture/6749424/948/34310114-1.jpeg,2024-01-07T18:09:00Z,,"Bisher hängen Militärberufungen in der Ukraine nicht vom Einkommen ab. Doch die Regierungspartei denkt darüber nach, das zu ändern.
Einkommen spielte bisher keine Rolle, aber das könnte sich ändern … [+5044 chars]",,de,'Abhängigkeit'
https://www.zeit.de/news/2024-01/08/usa-sehen-erhebliche-spannungen-in-nahost,https://www.zeit.de/news/2024-01/08/usa-sehen-erhebliche-spannungen-in-nahost,0,www.zeit.de,Gaza-Krieg: USA sehen «erhebliche Spannungen» in Nahost,"Hier finden Sie Informationen zu dem Thema „Gaza-Krieg“. Lesen Sie jetzt „USA sehen ""erhebliche Spannungen"" in Nahost“.",https://img.zeit.de/news/2024-01/08/usa-sehen-erhebliche-spannungen-in-nahost-image-group/wide__1300x731,2024-01-08T03:51:28Z,,"Die USA sehen den Nahen Osten in einem «Moment erheblicher Spannungen» und haben Israel gemahnt, mehr für den Schutz von Zivilisten in Gaza zu tun. Die Weltgesundheitsorganisation (WHO) schafft es se… [+7388 chars]",,de,'Krieg'
https://www.zeit.de/news/2024-01/08/dlrg-warnt-vor-lebensgefahr-auf-dem-eis,https://www.zeit.de/news/2024-01/08/dlrg-warnt-vor-lebensgefahr-auf-dem-eis,0,www.zeit.de,Winter: DLRG warnt vor Lebensgefahr auf dem Eis,Hier finden Sie Informationen zu dem Thema „Winter“. Lesen Sie jetzt „DLRG warnt vor Lebensgefahr auf dem Eis“.,https://img.zeit.de/news/2024-01/08/dlrg-warnt-vor-lebensgefahr-auf-dem-eis-image-group/wide__1300x731,2024-01-08T09:40:15Z,,Angesichts von frostigen Temperaturen warnt die Deutsche Lebens-Rettungs-Gesellschaft (DLRG) vor dem Betreten von Eisflächen - auch in den Hochwassergebieten. «Auf Seen und Teichen ist das Eis zumeis… [+1711 chars],,de,'Winter'
https://www.zeit.de/news/2024-01/08/drei-lottospieler-aus-bayern-gewinnen-millionen,https://www.zeit.de/news/2024-01/08/drei-lottospieler-aus-bayern-gewinnen-millionen,0,www.zeit.de,Glücksspiele: Drei Lottospieler aus Bayern gewinnen Millionen,Hier finden Sie Informationen zu dem Thema „Glücksspiele“. Lesen Sie jetzt „Drei Lottospieler aus Bayern gewinnen Millionen“.,https://img.zeit.de/news/2024-01/08/drei-lottospieler-aus-bayern-gewinnen-millionen-image-group/wide__1300x731,2024-01-08T14:30:18Z,,"Gleich drei Lottospielerinnen oder -spieler aus Bayern haben bei der vergangenen Eurojackpot-Ziehung Millionengewinne erzielt. Sie gewannen jeweils 2.388.351,90 Euro, wie Lotto Bayern am Montag in Mü… [+1350 chars]",,de,'Bayern'
https://www.zeit.de/news/2024-01/08/soeder-bayern-wird-beckenbauer-nicht-vergessen,https://www.zeit.de/news/2024-01/08/soeder-bayern-wird-beckenbauer-nicht-vergessen,0,www.zeit.de,Fußball: Söder: Bayern wird Beckenbauer nicht vergessen,Hier finden Sie Informationen zu dem Thema „Fußball“. Lesen Sie jetzt „Söder: Bayern wird Beckenbauer nicht vergessen“.,https://img.zeit.de/news/2024-01/08/soeder-bayern-wird-beckenbauer-nicht-vergessen-image-group/wide__1300x731,2024-01-08T17:47:27Z,,Ministerpräsident Markus Söder (CSU) hat den gestorbenen Franz Beckenbauer als Botschafter Bayerns in der Welt gewürdigt. «Auch als Weltstar hat er seine Herkunft nie vergessen und ist immer bescheid… [+820 chars],,de,'Bayern'
https://www.tagesschau.de/inland/innenpolitik/oelbohrungen-arktis-usa-100.html,https://www.tagesschau.de/inland/innenpolitik/oelbohrungen-arktis-usa-100.html,0,www.tagesschau.de,Warum US-Präsident Biden über den Öl-Boom kaum spricht,"2023 haben US-Ölfirmen so viel ""schwarzes Gold"" aus dem Boden der Vereinigten Staaten geholt wie noch nie. Der Boom hat geholfen, die Benzinkosten wieder zu senken. US-Präsident Biden steckt dennoch in der Zwickmühle. Von J. Kastein.",https://images.tagesschau.de/image/c60cb68a-36fd-444d-9b2f-a33fe28f52c7/AAABid437HA/AAABibBxqrQ/16x9-1280/joe-biden-284.jpg,2024-01-09T03:48:17Z,,"Stand: 09.01.2024 04:48 Uhr
2023 haben US-Ölfirmen so viel ""schwarzes Gold"" aus dem Boden der Vereinigten Staaten geholt wie noch nie. Der Boom hat geholfen, die Benzinkosten wieder zu senken. US-Pr… [+3755 chars]",,de,'fossile Energie'
https://www.mobiflip.de/shortnews/hyundai-setzt-auf-wasserstoff-fuer-die-zukunft/,https://www.mobiflip.de/shortnews/hyundai-setzt-auf-wasserstoff-fuer-die-zukunft/,0,www.mobiflip.de,Hyundai setzt auf Wasserstoff für die Zukunft,"Hyundai hat im Rahmen der CES 2024 betont, dass man sich bis 2035 noch mehr auf Wasserstoff als Lösung für eine nachhaltigere Zukunft fokussieren möchte. Es wird ein „komplettes Wasserstoff-Energie-Ökosystem“ […]",https://www.mobiflip.de/wp-content/uploads/2023/07/hyundai-ioniq-5-n-detail.jpg,2024-01-09T05:40:57Z,,"Hyundai hat im Rahmen der CES 2024 betont, dass man sich bis 2035 noch mehr auf Wasserstoff als Lösung für eine nachhaltigere Zukunft fokussieren möchte. Es wird ein komplettes Wasserstoff-Energie-Ök… [+3087 chars]",,de,'nachhaltige Energie'
https://www.welt.de/geschichte/article249010762/Crazy-Horse-Ein-guter-Tag-zum-Sterben-rief-er-im-Sturm-auf-die-US-Kavallerie.html,https://www.welt.de/geschichte/article249010762/Crazy-Horse-Ein-guter-Tag-zum-Sterben-rief-er-im-Sturm-auf-die-US-Kavallerie.html,0,www.welt.de,"„Ein guter Tag zum Sterben!“, rief Crazy Horse im Sturm auf die US-Kavallerie","Am 8. Januar 1877 schlug Crazy Horse seine letzte Schlacht gegen die US-Kavallerie. Seit Jahrzehnten wird in South Dakota an einem gewaltigen Denkmal für den Krieger der Oglala-Lakota-Indianer gearbeitet. Sollte es je fertig werden, wäre es die zweitgrößte St…",https://img.welt.de/img/geschichte/mobile249031562/6111358947-ci16x9-w1200/Steinernes-Monument-von-Crazy-Horse-wird-50.jpg,2024-01-09T10:15:36Z,,"Der amerikanische Patriotismus ist sehr ausgeprägt, und davon zeugen etliche monumentale Denkmäler und Skulpturen. In der US-Hauptstadt Washington D.C. steht etwa das tempelartige Lincoln Memorial, 5… [+7338 chars]",,de,'Krieg'
https://www.zeit.de/news/2024-01/09/das-ist-ein-witz-missbrauchsgutachter-sieht-defizite,https://www.zeit.de/news/2024-01/09/das-ist-ein-witz-missbrauchsgutachter-sieht-defizite,0,www.zeit.de,Bayern: «Das ist ein Witz!»: Missbrauchsgutachter sieht Defizite,"Hier finden Sie Informationen zu dem Thema „Bayern“. Lesen Sie jetzt „""Das ist ein Witz!"": Missbrauchsgutachter sieht Defizite“.",https://img.zeit.de/news/2024-01/09/das-ist-ein-witz-missbrauchsgutachter-sieht-defizite-image-group/wide__1300x731,2024-01-09T11:04:23Z,,Zwei Jahre nach Veröffentlichung der vielbeachteten Studie über sexuelle Gewalt im katholischen Erzbistum München und Freising sieht Gutachter Ulrich Wastl noch große Defizite im Umgang mit Betroffen… [+2068 chars],,de,'Bayern'
https://www.zeit.de/news/2024-01/09/trauerflor-beim-training-fc-bayern-gedenkt-beckenbauer,https://www.zeit.de/news/2024-01/09/trauerflor-beim-training-fc-bayern-gedenkt-beckenbauer,0,www.zeit.de,Fußball: Trauerflor beim Training: FC Bayern gedenkt Beckenbauer,Hier finden Sie Informationen zu dem Thema „Fußball“. Lesen Sie jetzt „Trauerflor beim Training: FC Bayern gedenkt Beckenbauer“.,https://img.zeit.de/administratives/sharing/fallback-image/wide__1300x731,2024-01-09T14:53:57Z,,Trainer Thomas Tuchel und die Profis des FC Bayern haben am Dienstag beim Training der toten Vereinsikone Franz Beckenbauer gedacht. Der Coach des deutschen Fußball-Rekordmeisters und seine Spieler p… [+694 chars],,de,'Bayern'
https://www.zeit.de/news/2024-01/09/bayern-prueft-trauerakt-fuer-beckenbauer,https://www.zeit.de/news/2024-01/09/bayern-prueft-trauerakt-fuer-beckenbauer,0,www.zeit.de,Fußball: Bayern prüft Trauerakt für Beckenbauer,Hier finden Sie Informationen zu dem Thema „Fußball“. Lesen Sie jetzt „Bayern prüft Trauerakt für Beckenbauer“.,https://img.zeit.de/administratives/sharing/fallback-image/wide__1300x731,2024-01-09T16:38:17Z,,"Nach dem Tod von Fußball-Legende Franz Beckenbauer prüft die bayerische Staatsregierung die Durchführung eines großen Traueraktes. Er könne sich vorstellen, das Leben von Beckenbauer auch von staatli… [+870 chars]",,de,'Bayern'
https://www.zeit.de/news/2024-01/10/bayern-sportdirektor-freund-kuendigt-zeitnahe-transfers-an,https://www.zeit.de/news/2024-01/10/bayern-sportdirektor-freund-kuendigt-zeitnahe-transfers-an,0,www.zeit.de,Fußball: Bayern-Sportdirektor Freund kündigt zeitnahe Transfers an,Hier finden Sie Informationen zu dem Thema „Fußball“. Lesen Sie jetzt „Bayern-Sportdirektor Freund kündigt zeitnahe Transfers an“.,https://img.zeit.de/news/2024-01/10/bayern-sportdirektor-freund-kuendigt-zeitnahe-transfers-an-image-group/wide__1300x731,2024-01-10T07:02:32Z,,"Die Fans des FC Bayern dürfen zeitnah neue Spieler im Kader des deutschen Fußball-Meisters erwarten. Der Club sei «gerade dabei, den ein oder anderen Deal zu fixieren», sagte Sportdirektor Christoph … [+1863 chars]",,de,'Bayern'
https://www.stern.de/gesellschaft/regional/rheinland-pfalz-saarland/wetter--weiterhin-eisige-kaelte-in-rheinland-pfalz-und-dem-saarland-34352884.html,https://www.stern.de/gesellschaft/regional/rheinland-pfalz-saarland/wetter--weiterhin-eisige-kaelte-in-rheinland-pfalz-und-dem-saarland-34352884.html,0,www.stern.de,Wetter: Weiterhin eisige Kälte in Rheinland-Pfalz und dem Saarland,"In Rheinland-Pfalz und dem Saarland bleibt es in den kommenden Tagen weiterhin kalt. Wie der Deutsche Wetterdienst (DWD) mitteilte, kommt es am Mittwoch oft zu Dauerfrost bei Höchstwerten zwischen minus vier Grad und ein Grad. Dazu ist es am Vormittag zunächs…",https://image.stern.de/6681672/t/31/v5/w1440/r1.7778/-/video-fallback-image.jpg,2024-01-10T08:06:15Z,,"In Rheinland-Pfalz und dem Saarland bleibt es in den kommenden Tagen weiterhin kalt. Wie der Deutsche Wetterdienst (DWD) mitteilte, kommt es am Mittwoch oft zu Dauerfrost bei Höchstwerten zwischen mi… [+983 chars]",,de,'Kälte'
https://www.stern.de/panorama/wetter/wetter-und-kaelte--karten-zeigen--wo-es-in-deutschland-am-kaeltesten-ist-34352794.html,https://www.stern.de/panorama/wetter/wetter-und-kaelte--karten-zeigen--wo-es-in-deutschland-am-kaeltesten-ist-34352794.html,0,www.stern.de,"Kälteeinbruch: Diese Karten zeigen, wo es am kältesten ist – und wo es sich besonders frostig anfühlt","Winter-Wetter und Kälte haben Deutschland im Griff. Auf den Straßen liegen Schnee und Eis, das Thermometer zeigt regelmäßig Temperaturen im Minus-Bereich an. Karten zeigen, wo es am kältesten ist – und wo es sich am frostigsten anfühlt.",https://image.stern.de/34352802/t/Zy/v4/w1440/r1.7778/-/kaelte-teaser-wetter-de.jpg,2024-01-10T08:29:00Z,,"Winter-Wetter und Kälte haben Deutschland im Griff. Auf den Straßen liegen Schnee und Eis, das Thermometer zeigt regelmäßig Temperaturen im Minus-Bereich an. Karten zeigen, wo es am kältesten ist und… [+1913 chars]",,de,'Winter'
https://www.diepresse.com/17978186/in-usa-811000-haushalte-und-betriebe-durch-wintersturm-ohne-strom,https://www.diepresse.com/17978186/in-usa-811000-haushalte-und-betriebe-durch-wintersturm-ohne-strom,0,www.diepresse.com,In USA 811.000 Haushalte und Betriebe durch Wintersturm ohne Strom,Vor allem der Osten des Landes ist betroffen.,https://img.diepresse.com/public/incoming/4zaotz-US-IOWA-PREPARES-FOR-STATES-CAUCUSES/alternates/DPR_SOCIAL_NACHRICHTEN/US-IOWA-PREPARES-FOR-STATE%27S-CAUCUSES,2024-01-10T08:52:59Z,,"Vor allem der Osten des Landes ist betroffen.
Im Osten der USA sind durch einen Wintersturm rund 811.000 Haushalte und Unternehmen von der Stromversorgung abgeschnitten. Am stärksten betroffen sind … [+716 chars]",,de,'Kälte'
https://ooe.orf.at/stories/3239988/,https://ooe.orf.at/stories/3239988/,0,ooe.orf.at,Mehr Anrufe bei Kältetelefon,"Die große Kälte setzt dieser Tage vor allem Obdachlosen zu. Ein Hilfsangebot ist das Kältetelefon. Im Auftrag des Magistrats Linz nimmt der Sozialverein B37 immer mehr Anrufe von Menschen entgegen, die trotz Kälte im Freien leben müssen.",https://ibs.orf.at/ooe?image=https%3A%2F%2Foekastatic.orf.at%2Fmims%2F2019%2F48%2F23%2Fcrops%2Fw%3D1200%2Ch%3D627%2Cq%3D75%2F383713_master_124823_klirrende_kaelte_in_hamburg_.jpg%3Fs%3Dde326e4f25e33251aa93047cc1a27a5c8ba48a58,2024-01-10T09:23:32Z,,Rund 50 Menschen leben etwa in Linz auf der Straße. Auch vergangene Nacht haben bei Dauerfrost in der Landeshauptstadt viele Menschen im Freien übernachtet. Die Gefahr der Unterkühlung steigt durch d… [+516 chars],,de,'Kälte'
https://www.stern.de/panorama/faktencheck--schnaps-und-kaltduscher--kaeltemythen-auf-dem-pruefstand-34353092.html,https://www.stern.de/panorama/faktencheck--schnaps-und-kaltduscher--kaeltemythen-auf-dem-pruefstand-34353092.html,0,www.stern.de,Faktencheck: Schnaps und Kaltduscher: Kältemythen auf dem Prüfstand,Sind Kaltduscher seltener krank? Bekommt man mit nassen Haaren eine Erkältung? Zur kalten Jahreszeit kursieren die verschiedensten Mythen. Was ist wahr und welche Gerüchte halten sich hartnäckig?,https://image.stern.de/34353094/t/Ax/v1/w1440/r1.7778/-/10--urnnewsmldpacom2009010124011099552910v3w800h600l791t0r1873b1065jpeg---6a8b0f27f1ff19fa.jpg,2024-01-10T09:30:42Z,,"Sind Kaltduscher seltener krank? Bekommt man mit nassen Haaren eine Erkältung? Zur kalten Jahreszeit kursieren die verschiedensten Mythen. Was ist wahr und welche Gerüchte halten sich hartnäckig?
Di… [+4396 chars]",,de,'Kälte'
https://www.zeit.de/news/2024-01/10/minusgrade-bisher-kaelteste-nacht-in-diesem-winter,https://www.zeit.de/news/2024-01/10/minusgrade-bisher-kaelteste-nacht-in-diesem-winter,0,www.zeit.de,Wetter: Minusgrade: Bisher kälteste Nacht in diesem Winter,Hier finden Sie Informationen zu dem Thema „Wetter“. Lesen Sie jetzt „Minusgrade: Bisher kälteste Nacht in diesem Winter“.,https://img.zeit.de/news/2024-01/10/minusgrade-bisher-kaelteste-nacht-in-diesem-winter-image-group/wide__1300x731,2024-01-10T10:16:55Z,,"Die Nacht von Dienstag auf Mittwoch ist die bisher kälteste in Hessen in diesem Winter gewesen. Rekordtiefstwerte gab es nach Angaben des Deutschen Wetterdiensts (DWD) in Offenbach nicht, landesweit … [+407 chars]",,de,'Winter'
https://www.focus.de/earth/experten/gastbeitrag-von-gabriel-baunach-handabdruck-hebel-statt-fussabdruck-frust_id_255863698.html,https://www.focus.de/earth/experten/gastbeitrag-von-gabriel-baunach-handabdruck-hebel-statt-fussabdruck-frust_id_255863698.html,0,www.focus.de,Gastbeitrag von Gabriel Baunach - Die große Lüge vom „CO2-Fußabdruck“ - und worauf wir stattdessen schauen sollten,"Die Temperatur- und Treibhausgas-Rekorde des letzten Jahres machen klar: Wenn wir einen lebenswerten Planeten erhalten wollen, hilft jetzt nicht mehr kleckern, sondern nur noch klotzen. Klima-Kommunikator Gabriel Baunach erklärt, wieso es sich beim CO2-Fußabd…",https://p6.focus.de/img/fotos/id_259564461/gettyimages-140183003.jpg?im=Crop%3D%280%2C159%2C3467%2C1735%29%3BResize%3D%281200%2C627%29&impolicy=perceptual&quality=mediumHigh&hash=f22239bae5a32b6c7791405657792e0426fc2a788d58b84504f843afeead2a8b,2024-01-10T13:15:33Z,,"Die Temperatur- und Treibhausgas-Rekorde des letzten Jahres machen klar: Wenn wir einen lebenswerten Planeten erhalten wollen, hilft jetzt nicht mehr kleckern, sondern nur noch klotzen. Klima-Kommuni… [+8822 chars]",,de,'Gas'
https://www.zeit.de/news/2024-01/10/soeder-und-bayern-spitze-gedenken-beckenbauer,https://www.zeit.de/news/2024-01/10/soeder-und-bayern-spitze-gedenken-beckenbauer,0,www.zeit.de,Fußball: Söder und Bayern-Spitze gedenken Beckenbauer,Hier finden Sie Informationen zu dem Thema „Fußball“. Lesen Sie jetzt „Söder und Bayern-Spitze gedenken Beckenbauer“.,https://img.zeit.de/news/2024-01/10/soeder-und-bayern-spitze-gedenken-beckenbauer-image-group/wide__1300x731,2024-01-10T14:16:28Z,,"Schweren Schrittes nahm Uli Hoeneß die drei Stufen in der Hofkapelle und blickte tief bewegt auf das große Schwarz-Weiß-Foto von Franz Beckenbauer. Gemeinsam mit Karl-Heinz Rummenigge, Markus Söder u… [+4570 chars]",,de,'Bayern'
