index,url,valid,domain,title,description,image,published,archive,content,quote,language,keyword
https://www.zeit.de/news/2024-06/07/bayern-basketballer-vor-alba-gewarnt-alles-kann-passieren,https://www.zeit.de/news/2024-06/07/bayern-basketballer-vor-alba-gewarnt-alles-kann-passieren,0,www.zeit.de,BBL-Finale: Bayern-Basketballer vor Alba gewarnt: «Alles kann passieren»,"Hier finden Sie Informationen zu dem Thema „BBL-Finale“. Lesen Sie jetzt „Bayern-Basketballer vor Alba gewarnt: ""Alles kann passieren""“.",https://img.zeit.de/news/2024-06/07/bayern-basketballer-vor-alba-gewarnt-alles-kann-passieren-image-group/wide__1300x731,2024-06-07T09:48:02Z,,Die Basketballer des FC Bayern sind Favorit im Playoff-Finale - Gegner Alba Berlin muss mit nur einem Tag Regeneration in die Endspielserie starten und hat zudem Verletzungssorgen. Dennoch zeigen sic… [+2350 chars],,de,'Bayern'
https://www.faz.net/aktuell/wirtschaft/mehr-wirtschaft/warum-die-schweiz-mehr-strom-produzieren-will-19772274.html,https://www.faz.net/aktuell/wirtschaft/mehr-wirtschaft/warum-die-schweiz-mehr-strom-produzieren-will-19772274.html,0,www.faz.net,Wie die Schweiz die Stromproduktion erhöhen will,Im Winter kann die Schweiz ihren Strombedarf nicht durch die eigene Produktion decken. Erneuerbare Energien sollen die Unabhängigkeit von Stromimporten sichern. Über das Stromgesetz entscheiden nun die Bürger.,https://media1.faz.net/ppmedia/aktuell/wirtschaft/2441037058/1.9772321/facebook_teaser/rotorblaetter-werden-an-eine.jpg,2024-06-07T12:17:35Z,,"Das Gesetz sieht zudem den Ausbau von Wasserkraftwerken vor, damit im Winter genügend Strom gespeichert werden kann. Regierung, Parlament und Kantone haben sich im Einvernehmen mit den Umweltorganisa… [+3718 chars]",,de,'Abhängigkeit'
https://www.stern.de/digital/technik/ueberraschende-stromfresser-im-haushalt--finden-und-ausschalten-34772370.html,https://www.stern.de/digital/technik/ueberraschende-stromfresser-im-haushalt--finden-und-ausschalten-34772370.html,0,www.stern.de,Kosten senken: Überraschende Stromfresser im Haushalt – so geht es energiesparender,"Wer zuhause Energie sparen möchte, sollte zuerst einmal die typischen Stromfresser ausfindig machen und ausschalten. Manche Kandidaten hat nicht jeder sofort auf dem Schirm.",https://image.stern.de/34777746/t/Fc/v6/w1440/r1.7778/-/stromfresser.jpg,2024-06-07T14:03:00Z,,"Wer zuhause Energie sparen möchte, sollte zuerst einmal die typischen Stromfresser ausfindig machen und ausschalten. Manche Kandidaten hat nicht jeder sofort auf dem Schirm.
Es gibt mindestens zwei … [+6238 chars]",,de,'Energie sparen'
https://www.faz.net/aktuell/politik/inland/putin-waescht-die-afd-rein-faz-glosse-fraktur-19772811.html,https://www.faz.net/aktuell/politik/inland/putin-waescht-die-afd-rein-faz-glosse-fraktur-19772811.html,0,www.faz.net,Fraktur: Persilschein von Putin,"Der russische Präsident hat die AfD vor der Europawahl so rein gewaschen, dass sie geradezu aprilscherzfrisch riecht. Treue wird vom Kreml eben belohnt.",https://media1.faz.net/ppmedia/aktuell/politik/inland/3951046652/1.9772803/facebook_teaser/nicht-nur-sauber-sondern-rein.jpg,2024-06-07T14:51:26Z,,"Dass Russlands treueste Freunde in Deutschland wir sind auf das Gegendarstellungsbegehren von Sahra Wagenknecht gespannt etwas Unterstützung brauchen konnten, ist natürlich auch dem russischen Geheim… [+3500 chars]",,de,'Putin'
https://www.faz.net/aktuell/wirtschaft/klima-nachhaltigkeit/zuschuss-zur-waermepumpe-was-sie-zur-heizungsfoerderung-wissen-muessen-19772560.html,https://www.faz.net/aktuell/wirtschaft/klima-nachhaltigkeit/zuschuss-zur-waermepumpe-was-sie-zur-heizungsfoerderung-wissen-muessen-19772560.html,0,www.faz.net,21.000 Euro Zuschuss zur Wärmepumpe,"34.000 Anträge auf Heizungsförderung hat die KfW bislang bewilligt. Auch wer den Strom zum Heizen selbst erzeugen will, profitiert von staatlichen Zuschüssen.",https://media0.faz.net/ppmedia/aktuell/wirtschaft/2012755722/1.9772668/facebook_teaser/klimafreundlich-wer-sich-eine.jpg,2024-06-07T15:17:35Z,,"Wie genau funktioniert die Heizungsförderung?
Grundsätzlich fördert die KfW 30 Prozent der Anschaffungskosten in Höhe von 30.000 Euro. Für selbstnutzende Eigentümer kommen weitere Boni hinzu: Einen … [+6868 chars]",,de,'Öl'
https://www.faz.net/aktuell/politik/ukraine/china-und-indien-fehlen-auf-putins-wirtschaftsforum-19773120.html,https://www.faz.net/aktuell/politik/ukraine/china-und-indien-fehlen-auf-putins-wirtschaftsforum-19773120.html,0,www.faz.net,Putin auf Wirtschaftsforum: „Wir brauchen keine Atomwaffen für den Endsieg“,"Russlands Herrscher gibt sich zuversichtlich, die Ukraine und den Westen auch konventionell niederzuringen. Die Präsidenten Boliviens und Simbabwes sitzen dabei an seiner Seite.",https://media0.faz.net/ppmedia/aktuell/3224506255/1.9773118/facebook_teaser_fplus/russlands-praesident-wladmir.jpg,2024-06-07T16:42:22Z,,"Es war eine Kreml-Idealbesetzung, die sich am Freitagnachmittag auf dem Podium zur Hauptveranstaltung des Sankt Petersburger Internationalen Wirtschaftsforums versammelte. Das lag weniger am Gastgebe… [+273 chars]",,de,'Putin'
https://www.stern.de/gesellschaft/regional/niedersachsen-bremen/bremen--neue-windraeder-sollen-bremer-stahlwerk-mit-strom-versorgen-34779884.html,https://www.stern.de/gesellschaft/regional/niedersachsen-bremen/bremen--neue-windraeder-sollen-bremer-stahlwerk-mit-strom-versorgen-34779884.html,0,www.stern.de,Bremen: Neue Windräder sollen Bremer Stahlwerk mit Strom versorgen,"Der Stahlhersteller ArcelorMittal plant den Bau von bis zu zehn neuen Windrädern auf dem Gelände des Stahlwerks in Bremen. Dazu arbeitet ArcelorMittal mit dem Bremer Windparkentwickler und -betreiber WPD zusammen, wie aus einer Mitteilung von Freitag hervorge…",https://image.stern.de/34779886/t/ns/v1/w1440/r1.7778/-/07--urnnewsmldpacom2009010124060799314435v2w800h600l1936t1292r5816b3876jpeg---0f23f5ea3deec435.jpg,2024-06-07T17:00:53Z,,Der Stahlhersteller ArcelorMittal plant den Bau von bis zu zehn neuen Windrädern auf dem Gelände des Stahlwerks in Bremen. Dazu arbeitet ArcelorMittal mit dem Bremer Windparkentwickler und -betreiber… [+801 chars],,de,'Windräder'
https://www.tagesschau.de/ausland/kabinett-israel-100.html,https://www.tagesschau.de/ausland/kabinett-israel-100.html,0,www.tagesschau.de,Was die zerstrittene israelische Regierung zusammenhält,Tut sich etwas in der israelischen Regierung? Heute will sich Netanyahu-Rivale Gantz zu seiner Zukunft im Kriegskabinett äußern. Beobachter rechnen mit einem Rücktritt. Julio Segador über eine Regierung mit wenig Gemeinsamkeiten.,https://images.tagesschau.de/image/5cbfbe8d-8928-42d9-ab37-c6376e2ec890/AAABj_V-pLY/AAABjwnlFvA/16x9-1280/israel-regierung-138.jpg,2024-06-08T01:49:10Z,,"Stand: 08.06.2024 03:49 Uhr
Tut sich etwas in der israelischen Regierung? Heute will sich Netanyahu-Rivale Gantz zu seiner Zukunft im Kriegskabinett äußern. Beobachter rechnen mit einem Rücktritt. … [+3411 chars]",,de,'Öl'
https://www.nzz.ch/schweiz/freundschaft-durch-sport-auch-schweizer-soldaten-messen-sich-an-den-militaerweltspielen-mit-russen-ld.1834049,https://www.nzz.ch/schweiz/freundschaft-durch-sport-auch-schweizer-soldaten-messen-sich-an-den-militaerweltspielen-mit-russen-ld.1834049,0,www.nzz.ch,«Freundschaft durch Sport»: Auch Schweizer Soldaten messen sich an den Militärweltspielen mit Russen,Trotz dem Krieg in der Ukraine nehmen Athleten der Schweizer Armee an internationalen Wettkämpfen mit Angehörigen von Putins Streitkräften teil. Was bedeutet das für die Winter-Militärweltspiele hierzulande?,"https://img.nzz.ch/2024/06/07/d6633241-c117-48ad-8b26-c60e310797f1.jpeg?crop=1600,900,x0,y99&quality=75&auto=webp?width=1200&height=675&fit=bound&quality=75&auto=webp&wmark=nzz",2024-06-08T03:30:00Z,,"Eine andere Zeit: die Schweizer Delegation an den Militärweltspielen in Wuhan 2019.
An Weihnachten 1914 verlassen deutsche und britische Soldaten in Flandern ihre Schützengräben und spielen gemeinsa… [+5193 chars]",,de,'Winter'
https://www.zeit.de/politik/ausland/2024-06/selenskyi-macron-ukraine-frankreich-waffen,https://www.zeit.de/politik/ausland/2024-06/selenskyi-macron-ukraine-frankreich-waffen,0,www.zeit.de,"Emmanuel Macron: ""Man hat den Eindruck, dass er Lust auf einen Krieg hat""","Kampfjets für die Ukraine, vielleicht sogar Soldaten: Frankreichs Präsident verschärft den Kurs gegenüber Russland. Dafür wird er nicht nur von Marine Le Pen attackiert.",https://img.zeit.de/politik/ausland/2024-06/emmanuel-macron-ukraine-krieg-wahlkampf-bild/wide__1300x731,2024-06-08T04:38:03Z,,"Am Ende einer Woche, in der er den britischen König, den ukrainischen Präsidenten und Bundeskanzler Olaf Scholz
 in Frankreich begrüßt hat, wird Emmanuel Macron an diesem Samstag Joe Biden in Paris … [+1055 chars]",,de,'Krieg'
https://www.zeit.de/news/2024-06/08/us-aussenminister-blinken-reist-erneut-nach-nahost,https://www.zeit.de/news/2024-06/08/us-aussenminister-blinken-reist-erneut-nach-nahost,0,www.zeit.de,Gaza-Krieg: US-Außenminister Blinken reist erneut nach Nahost,Hier finden Sie Informationen zu dem Thema „Gaza-Krieg“. Lesen Sie jetzt „US-Außenminister Blinken reist erneut nach Nahost“.,https://img.zeit.de/news/2024-06/08/us-aussenminister-blinken-reist-erneut-nach-nahost-image-group/wide__1300x731,2024-06-08T05:24:25Z,,Die USA unternehmen einen weiteren diplomatischen Vorstoß für ein Abkommen über eine Waffenruhe im Gaza-Krieg. Außenminister Antony Blinken werde zwischen Montag und Mittwoch kommender Woche nach Ägy… [+5645 chars],,de,'Krieg'
https://www.zeit.de/politik/ausland/2024-06/benny-gantz-ruecktritt-israel-regierung-benjamin-netanjahu,https://www.zeit.de/politik/ausland/2024-06/benny-gantz-ruecktritt-israel-regierung-benjamin-netanjahu,0,www.zeit.de,Gaza-Krieg: Benny Gantz gibt nach Rücktrittsandrohung Erklärung ab,"Netanjahu müsse einen Nachkriegsplan für den Gazastreifen vorlegen, forderte Gantz – und setzte eine Frist bis heute. Auch andere Politiker drohen mit Rücktritt.",https://img.zeit.de/administratives/sharing/fallback-image/wide__1300x731,2024-06-08T07:02:18Z,,"Der Minister im israelischen Kriegskabinett und politische Rivale von Ministerpräsident Benjamin Netanjahu, Benny Gantz, steht womöglich vor einem Rücktritt. Er hält am Abend eine Pressekonferenz ab.… [+1595 chars]",,de,'Krieg'
https://www.zeit.de/news/2024-06/08/hochwasserlage-in-bayern-entspannung-trotz-neuer-regenfaelle,https://www.zeit.de/news/2024-06/08/hochwasserlage-in-bayern-entspannung-trotz-neuer-regenfaelle,0,www.zeit.de,Unwetter: Hochwasserlage in Bayern: Entspannung trotz neuer Regenfälle,Hier finden Sie Informationen zu dem Thema „Hochwasser“. Lesen Sie jetzt „Sinkende Pegelstände: Höchste Meldestufe bald unterschritten“.,https://img.zeit.de/news/2024-06/08/hochwasserlage-in-bayern-entspannung-trotz-neuer-regenfaelle-image-group/wide__1300x731,2024-06-08T09:46:11Z,,"Nach den Fluten hat sich die Hochwasserlage in weiten Teilen Bayerns weiter entspannt. Der Deutsche Wetterdienst (DWD) hat zwar in Teilen des Freistaates Unwetter und Regen angekündigt, die Lage soll… [+2432 chars]",,de,'Bayern'
https://www.zeit.de/news/2024-06/08/armee-vier-geiseln-aus-dem-gazastreifen-befreit,https://www.zeit.de/news/2024-06/08/armee-vier-geiseln-aus-dem-gazastreifen-befreit,0,www.zeit.de,Krieg in Nahost: Armee: Vier Geiseln aus dem Gazastreifen befreit,Hier finden Sie Informationen zu dem Thema „Krieg in Nahost“. Lesen Sie jetzt „Armee: Vier Geiseln aus dem Gazastreifen befreit“.,https://img.zeit.de/news/2024-06/08/armee-vier-geiseln-aus-dem-gazastreifen-befreit-image-group/wide__1300x731,2024-06-08T10:46:07Z,,Israelische Soldaten haben am Samstag der Armee zufolge vier Geiseln aus dem Gazastreifen gerettet. Die aus Israel Entführten seien bei zwei Einsätzen im Flüchtlingsviertel Nuseirat befreit worden. S… [+103 chars],,de,'Krieg'
https://www.zeit.de/politik/2024-06/ukraine-waffen-nato,https://www.zeit.de/politik/2024-06/ukraine-waffen-nato,0,www.zeit.de,Krieg in der Ukraine: NATO-Waffen gegen Russland – wie sie den Krieg verändern,Seit Kurzem darf die Ukraine mit westlichen Waffen auch Ziele in Russland beschießen – in einem sehr beschränkten Gebiet hinter der Grenze. Was das militärisch verändert.,https://img.zeit.de/politik/2024-06/thumbnail-ukraine-film/wide__1300x731,2024-06-08T13:10:27Z,,"Schließen
Hier können Sie interessante Artikel speichern, um sie später zu lesen und wiederzufinden.
Sie haben bereits ein Konto?
 Hier anmelden.",,de,'Krieg'
https://www.telepolis.de/features/EU-Kommission-Warum-Ursula-von-der-Leyens-Kandidatur-auf-wackeligen-Beinen-steht-9753880.html,https://www.telepolis.de/features/EU-Kommission-Warum-Ursula-von-der-Leyens-Kandidatur-auf-wackeligen-Beinen-steht-9753880.html,0,www.telepolis.de,EU-Kommission: Warum Ursula von der Leyens Kandidatur auf wackeligen Beinen steht,Die Christdemokratin strebt eine zweite Amtszeit an. Das stellt sie vor enorme Herausforderungen. Hauptgrund: Ihre erste Amtszeit. Ein Gastbeitrag.,https://heise.cloudimg.io/bound/1200x1200/q85.png-lossy-85.webp-lossy-85.foil1/_www-heise-de_/imgs/18/4/6/0/8/9/7/9/shutterstock_2300496511-4f77290e0e856c72.jpeg,2024-06-08T14:00:00Z,,"Selenskyj, von der Leyen. Bild: Review News, Shutterstock.com
Die Christdemokratin strebt eine zweite Amtszeit an. Das stellt sie vor enorme Herausforderungen. Hauptgrund: Ihre erste Amtszeit. Ein G… [+6568 chars]",,de,'Krieg'
https://www.mobiflip.de/shortnews/waermepumpe-ohne-aerger-markt-fuer-schallschutzwaende-gedeiht/,https://www.mobiflip.de/shortnews/waermepumpe-ohne-aerger-markt-fuer-schallschutzwaende-gedeiht/,0,www.mobiflip.de,Wärmepumpe ohne Ärger: Markt für Schallschutzwände gedeiht,"Immer mehr Hausbesitzer nutzen Wärmepumpen zum Heizen, da der Gesetzgeber die Nutzung erneuerbarer Energien fördert. Wärmepumpen sind jedoch nicht geräuschlos, was zunehmend zu Beschwerden von Nachbarn führt. Der Anteil von […]",https://www.mobiflip.de/wp-content/uploads/2024/06/00_devaux_laermschutzwand_waermepumpe_aus.jpg,2024-06-08T14:16:35Z,,"Immer mehr Hausbesitzer nutzen Wärmepumpen zum Heizen, da der Gesetzgeber die Nutzung erneuerbarer Energien fördert. Wärmepumpen sind jedoch nicht geräuschlos, was zunehmend zu Beschwerden von Nachba… [+1254 chars]",,de,'Heizen'
https://www.stern.de/politik/ausland/israel--armee-befreit-vier-geiseln-aus-der-gewalt-der-hamas-34781500.html,https://www.stern.de/politik/ausland/israel--armee-befreit-vier-geiseln-aus-der-gewalt-der-hamas-34781500.html,0,www.stern.de,"Gaza-Krieg: Noa, Almog, Andrey, Schlomi: Das sind die vier befreiten Hamas-Geiseln","Noa Argamani, Almog Meir Jan, Andrey Kozlov und Schlomi Ziv: Die israelische Armee hat vier Geiseln aus der Gewalt der Hamas befreit, die beim Überfall am 7. Oktober entführt wurden. Auch Bundeskanzler Scholz zeigte sich erleichtert.",https://image.stern.de/34781510/t/TQ/v4/w1440/r1.7778/-/israel-geiseln.jpg,2024-06-08T14:20:00Z,,"Noa Argamani, Almog Meir Jan, Andrey Kozlov und Schlomi Ziv: Die israelische Armee hat vier Geiseln aus der Gewalt der Hamas befreit, die beim Überfall am 7. Oktober entführt wurden. Auch Bundeskanzl… [+5079 chars]",,de,'Krieg'
https://www.focus.de/finanzen/news/der-einkauf-bleibt-weiter-teuer-welche-lebensmittelpreise-weiter-steigen_id_260018098.html,https://www.focus.de/finanzen/news/der-einkauf-bleibt-weiter-teuer-welche-lebensmittelpreise-weiter-steigen_id_260018098.html,0,www.focus.de,"Olivenöl, Kartoffeln, Schokolade - Bis zu 50 Prozent teurer! Bei welchen Lebensmitteln die Preise weiter stark steigen","Die Inflation ist so weit zurückgegangen, dass die EZB erstmals seit 2019 die Zinsen senkte. Diesen Rückgang spürt man an der Supermarktkasse nicht unbedingt – weil die Preise mancher Lebensmittel unbeirrt weiter klettern.",https://p6.focus.de/img/fotos/id_260018154/supermarkt-kasse.jpg?im=Crop%3D%280%2C199%2C3621%2C1810%29%3BResize%3D%281200%2C627%29&impolicy=perceptual&quality=mediumHigh&hash=cb5749c7f096a0b72ada92fa9dbf5675feab17867a236717ecd211b28f009ea9,2024-06-08T14:29:08Z,,"Die Inflation ist so weit zurückgegangen, dass die EZB erstmals seit 2019 die Zinsen senkte. Diesen Rückgang spürt man an der Supermarktkasse nicht unbedingt weil die Preise mancher Lebensmittel unbe… [+4611 chars]",,de,'Inflation'
https://www.stern.de/politik/ausland/krieg-in-nahost--israelische-armee-befreit-vier-geiseln-aus-gazastreifen-34781264.html,https://www.stern.de/politik/ausland/krieg-in-nahost--israelische-armee-befreit-vier-geiseln-aus-gazastreifen-34781264.html,0,www.stern.de,Krieg in Nahost: Israelische Armee befreit vier Geiseln aus Gazastreifen,Israelische Spezialkräfte befreien Geiseln aus dem Flüchtlingsviertel Nuseirat. Palästinensischen Angaben zufolge kommen bei Armeeeinsätzen in der Gegend sehr viele Menschen ums Leben.,https://image.stern.de/34781562/t/LN/v1/w1440/r1.7778/-/08--urnnewsmldpacom2009010124060899322455v2w800h600l635t286r1934b1154jpeg---ffe1d4a5f8da2163.jpg,2024-06-08T14:49:20Z,,"Israelische Spezialkräfte befreien Geiseln aus dem Flüchtlingsviertel Nuseirat. Palästinensischen Angaben zufolge kommen bei Armeeeinsätzen in der Gegend sehr viele Menschen ums Leben.
Israelische S… [+5678 chars]",,de,'Krieg'
https://www.sueddeutsche.de/politik/israel-krieg-news-gaza-geiseln-gantz-1.7482114,https://www.sueddeutsche.de/politik/israel-krieg-news-gaza-geiseln-gantz-1.7482114,0,www.sueddeutsche.de,Krieg in Nahost: Armee befreit vier Geiseln - offenbar viele Tote bei Einsatz,"Das israelische Militär meldet, drei Männer und eine Frau gerettet zu haben, die am 7. Oktober auf dem „Supernova“-Festival entführt worden waren. Bei Einsätzen im Gazastreifen kommen viele Menschen ums Leben.",https://www.sueddeutsche.de/2024/06/08/4f5e268d-bd15-477b-bf30-4008127030d5.jpeg?q=60&fm=webp&width=1200&rect=undefined%2Cundefined%2Cundefined%2Cundefined,2024-06-08T15:40:53Z,,Viele Angaben stammen von israelischen oder palästinensischen Behörden und lassen sich teilweise nicht unabhängig überprüfen. Für unseren Liveblog verwenden wir neben eigenen Recherchen Material der … [+57 chars],,de,'Krieg'
https://www.stern.de/news/biden-bei-besuch-in-frankreich---die-usa-stehen-fest-an-der-seite-der-ukraine--34781330.html,https://www.stern.de/news/biden-bei-besuch-in-frankreich---die-usa-stehen-fest-an-der-seite-der-ukraine--34781330.html,0,www.stern.de,"Biden bei Besuch in Frankreich: ""Die USA stehen fest an der Seite der Ukraine""","Bei seinem Staatsbesuch in Frankreich hat US-Präsident Joe Biden der Ukraine erneut die anhaltende Unterstützung der USA zugesichert. Der russische Präsident Wladimir Putin werde in der Ukraine nicht Halt machen, sagte Biden am Samstag nach einem Gespräch mit…",https://image.stern.de/34781672/t/0i/v1/w1440/r1.7778/-/08--biden-l-und-macron-am-pariser-triumphbogen---db9e387455b685e6.jpg,2024-06-08T15:55:15Z,,Bei seinem Staatsbesuch in Frankreich hat US-Präsident Joe Biden der Ukraine erneut die anhaltende Unterstützung der USA zugesichert. Der russische Präsident Wladimir Putin werde in der Ukraine nicht… [+2384 chars],,de,'Putin'
https://www.faz.net/aktuell/politik/ukraine-liveticker-biden-putin-wird-nicht-in-der-ukraine-halt-machen-faz-19030454.html,https://www.faz.net/aktuell/politik/ukraine-liveticker-biden-putin-wird-nicht-in-der-ukraine-halt-machen-faz-19030454.html,0,www.faz.net,Ukraine-Liveticker: Biden: „Putin wird nicht in der Ukraine halt machen“,Scholz: Arbeiten unermüdlich für gerechten Frieden +++ Russland: Mehr als 20 Tote nach Angriff der Ukraine +++ Hohe Sicherheitsstufe für Wiederaufbaukonferenz in Berlin geplant +++ alle Entwicklungen im Liveblog,https://media0.faz.net/ppmedia/aktuell/politik/2319459429/1.9774998/facebook_teaser/us-praesident-joe-biden.jpg,2024-06-08T16:18:19Z,,Zur zweitägigen Ukraine-Wiederaufbaukonferenz am Dienstag und Mittwoch in Berlin ist eine hohe Sicherheitsstufe in der Stadt geplant. Mit großen Verkehrsbehinderungen müssen die Berliner rechnen. Erw… [+1084 chars],,de,'Putin'
https://www.stern.de/politik/ausland/krieg-in-nahost--viele-tote-bei-befreiung-von-geiseln-aus-gazastreifen-34781264.html,https://www.stern.de/politik/ausland/krieg-in-nahost--viele-tote-bei-befreiung-von-geiseln-aus-gazastreifen-34781264.html,0,www.stern.de,Krieg in Nahost: Viele Tote bei Befreiung von Geiseln aus Gazastreifen,Israelische Spezialkräfte befreien Geiseln aus dem Flüchtlingsviertel Nuseirat im Gazastreifen. Nach palästinensischen Angaben kommen bei den Armeeeinsätzen Dutzende Menschen ums Leben.,https://image.stern.de/34781722/t/cN/v1/w1440/r1.7778/-/08--urnnewsmldpacom2009010124060899323203v3w800h600l70t41r1154b672jpeg---c5edeeb07019c1d7.jpg,2024-06-08T16:24:37Z,,"Israelische Spezialkräfte befreien Geiseln aus dem Flüchtlingsviertel Nuseirat im Gazastreifen. Nach palästinensischen Angaben kommen bei den Armeeeinsätzen Dutzende Menschen ums Leben.
Israelische … [+6283 chars]",,de,'Krieg'
https://www.zuckerzimtundliebe.de/2024/06/einfache-blaubeer-cheesecake-blaetterteig-windraeder/,https://www.zuckerzimtundliebe.de/2024/06/einfache-blaubeer-cheesecake-blaetterteig-windraeder/,0,www.zuckerzimtundliebe.de,Einfache Blaubeer Cheesecake Blätterteig Windräder,"Liebe solche kleinen feinen einfachen Rezepte für zwischendurch wie diese Blaubeer Cheesecake Blätterteig Windräder. Nicht die Sorte Windrad, die…
The post Einfache Blaubeer Cheesecake Blätterteig Windräder first appeared on Zucker, Zimt und Liebe.",,2024-06-08T16:55:25Z,,"Liebe solche kleinen feinen einfachen Rezepte für zwischendurch wie diese Blaubeer Cheesecake Blätterteig Windräder. Nicht die Sorte Windrad, die sich im Sommerwind so hübsch dreht und dabei flattern… [+6759 chars]",,de,'Windräder'
https://www.bild.de/politik/inland/ronzheimer-podcast-wahlen-hacker-spionage-putins-krieg-gegen-uns-6663f779e8fd2e28704d6b0f,https://www.bild.de/politik/inland/ronzheimer-podcast-wahlen-hacker-spionage-putins-krieg-gegen-uns-6663f779e8fd2e28704d6b0f,0,www.bild.de,"Neue „Ronzheimer.“-Folge - Wahlen, Hacker, Spionage: Putins Krieg gegen uns",Seit Jahren nimmt Kreml-Tyrann Wladimir Putin Einfluss auf unsere Freiheit und Demokratie. Neue Folge des Podcasts Ronzheimer mit CDU-Politiker Kiesewetter,"https://images.bild.de/6663f779e8fd2e28704d6b0f/acdb6996579e8868560cd81a2296ef5a,1171f4b5?w=1280",2024-06-08T18:53:53Z,,"Seit Jahren nimmt Kreml-Tyrann Wladimir Putin (71) Einfluss auf unsere Freiheit und Demokratie, in Europa, aber auch in Deutschland.
 Seit Beginn der Invasion der Ukraine, aber auch während des Euro… [+5015 chars]",,de,'Krieg'
https://www.faz.net/aktuell/politik/ausland/israel-krieg-im-liveticker-netanjahu-bittet-gantz-regierung-nicht-zu-verlassen-faz-19589481.html,https://www.faz.net/aktuell/politik/ausland/israel-krieg-im-liveticker-netanjahu-bittet-gantz-regierung-nicht-zu-verlassen-faz-19589481.html,0,www.faz.net,Israel-Krieg im Liveticker: Netanjahu bittet Gantz Regierung nicht zu verlassen,Scholz: Geiselbefreiung ein „Zeichen der Hoffnung“ +++ Befreite Geiseln zur medizinischen Versorgung im Krankenhaus +++ Israelische Armee greift militärische Ziele im Gebiet Nuseirat an +++ alle Entwicklungen im Liveblog,https://media1.faz.net/ppmedia/aktuell/politik/3669019394/1.9775091/facebook_teaser/der-israelische.jpg,2024-06-08T18:58:13Z,,"Die Berichte über die Absage fielen mit der Mitteilung der israelischen Armee zusammen, dass sie vier israelische Geisel aus der Gewalt der Hamas befreit hat. Gantz hatte Mitte Mai mit seinem Rücktri… [+426 chars]",,de,'Krieg'
https://www.zeit.de/politik/ausland/2024-06/israel-netanjahu-gantz-gaza-krieg,https://www.zeit.de/politik/ausland/2024-06/israel-netanjahu-gantz-gaza-krieg,0,www.zeit.de,Gaza-Krieg: Netanjahu ruft Gantz zu Verbleib in israelischem Kriegskabinett auf,"Benjamin Netanjahu will, dass Benny Gantz im Kriegskabinett bleibt. Der hatte angekündigt, aus diesem auszutreten, sollte kein Plan für den Gazastreifen vorliegen.",https://img.zeit.de/politik/ausland/2024-06/israel-netanjahu-gantz-gaza-krieg-bild/wide__1300x731,2024-06-08T19:09:56Z,,"Der israelische Ministerpräsident Benjamin Netanjahu hat Benny Gantz aufgefordert, nicht als Mitglied des Kriegskabinetts zurückzutreten. ""Ich fordere Benny Gantz auf: Verlassen Sie nicht die Notstan… [+2036 chars]",,de,'Krieg'
https://www.zeit.de/politik/ausland/2024-06/isreal-gaza-krieg-geiseln-hamas,https://www.zeit.de/politik/ausland/2024-06/isreal-gaza-krieg-geiseln-hamas,0,www.zeit.de,"Gaza-Krieg: ""Ich bin so glücklich, hier zu sein""",Acht Monate nach ihrer Entführung hat Israels Armee vier Geiseln aus Gaza befreit. Ein Moment der Hoffnung für das traumatisierte Land.,https://img.zeit.de/politik/ausland/2024-06/geiseln-noa-argamani-gaza-befreiung-israel-bild/wide__1300x731,2024-06-08T19:19:40Z,,"Inhalt
Auf einer Seite lesen
 Inhalt
<ol><li>Seite 1""Ich bin so glücklich, hier zu sein""
</li><li>Seite 2""Jede Möglichkeit nutzen, um die Geiseln nach Hause zu holen.""</li></ol>
Am Samstag kurz … [+4563 chars]",,de,'Krieg'
