index,url,valid,domain,title,description,image,published,archive,content,quote,language,keyword
https://www.zeit.de/news/2023-08/15/trotz-gefuellter-gasspeicher-land-will-weiter-energie-sparen,https://www.zeit.de/news/2023-08/15/trotz-gefuellter-gasspeicher-land-will-weiter-energie-sparen,0,www.zeit.de,Energie: Trotz gefüllter Gasspeicher: Land will weiter Energie sparen,,,2023-08-15T03:46:47Z,https://web.archive.org/web/20230817012457/https://www.zeit.de/news/2023-08/15/trotz-gefuellter-gasspeicher-land-will-weiter-energie-sparen,"When browsing with ads:
We collect personal data and also transmit it to third-party providers
 that help us improve and finance our digital content. Some of the information stored on your device, … [+821 chars]",,de,'Gas'
https://www.zeit.de/news/2023-08/15/london-kadyrow-will-putin-loyalitaet-beweisen,https://www.zeit.de/news/2023-08/15/london-kadyrow-will-putin-loyalitaet-beweisen,0,www.zeit.de,Tschetschenen-Anführer: London: Kadyrow will Putin-Loyalität beweisen,,,2023-08-15T07:08:52Z,,"When browsing with ads:
We collect personal data and also transmit it to third-party providers
 that help us improve and finance our digital content. Some of the information stored on your device, … [+821 chars]",,de,'Putin'
https://www.diepresse.com/14400293/gasspeicher-sind-schon-zu-90-prozent-gefuellt,https://www.diepresse.com/14400293/gasspeicher-sind-schon-zu-90-prozent-gefuellt,0,www.diepresse.com,Gasspeicher sind schon zu 90 Prozent gefüllt,Die Versorgung Österreichs über den Winter ist dem Klimaministerium zufolge bereits gesichert.,https://img.diepresse.com/public/incoming/h102uj-Energie/alternates/DPR_SOCIAL_NACHRICHTEN/Energie,2023-08-15T07:44:56Z,,"Die Versorgung Österreichs über den Winter ist dem Klimaministerium zufolge bereits gesichert. 
Bereits Mitte August sind die österreichischen Gasspeicher zu 90 Prozent gefüllt. Dies entspricht mehr… [+862 chars]",,de,'Gasspeicher'
https://www.faz.net/aktuell/politik/ukraine-liveticker-london-kadyrow-inszeniert-sich-als-putin-loyalist-19030454.html,https://www.faz.net/aktuell/politik/ukraine-liveticker-london-kadyrow-inszeniert-sich-als-putin-loyalist-19030454.html,0,www.faz.net,Ukraine-Liveblog: London: Kadyrow inszeniert sich als Putin-Loyalist,Lindner hält Taurus-Lieferung noch während Gegenoffensive für möglich +++ Russischer Kampfjet während Training in Krasnodar abgestürzt +++ Zwei russische Kampfflugzeuge nahe schottischer Shetland-Inseln abgefangen +++ alle Entwicklungen im Liveblog,https://media0.faz.net/ppmedia/aktuell/politik/3881670717/1.9104014/facebook_teaser/ramsan-kadyrow-m-oberhaupt-der.jpg,2023-08-15T08:00:45Z,https://web.archive.org/web/20230816134749/https://www.faz.net/aktuell/politik/ukraine-liveticker-london-kadyrow-inszeniert-sich-als-putin-loyalist-19030454.html,"Bundesfinanzminister Cristian Lindner (FDP) hält es einem Medienbericht zufolge für möglich, dass Deutschland der Ukraine die gewünschten Taurus-Marschflugkörper noch rechtzeitig für die laufende Geg… [+715 chars]",,de,'Putin'
https://www.welt.de/regionales/hamburg/article246911478/Energie-Eine-Mangellage-ist-noch-nicht-auszuschliessen.html,https://www.welt.de/regionales/hamburg/article246911478/Energie-Eine-Mangellage-ist-noch-nicht-auszuschliessen.html,0,www.welt.de,„Eine Mangellage ist noch nicht auszuschließen“,Trotz gefüllter Gasspeicher soll Hamburg auch in diesem Herbst und Winter weiter Energie sparen. Dafür hat sich die Umweltbehörde ausgesprochen. Es geht dabei etwa um die Beleuchtung von Denkmälern und niedrigere Temperaturen in städtischen Gebäuden.,https://img.welt.de/img/regionales/hamburg/mobile246912312/0711350597-ci16x9-w1200/298331735.jpg,2023-08-15T08:25:56Z,,Mit Blick auf die kommende kalte Jahreszeit hat sich die Hamburger Umweltbehörde für eine Fortsetzung von Energiesparmaßnahmen ausgesprochen. Die Gasmangellage ist für den kommenden Winter derzeit no… [+2657 chars],,de,'Winter'
https://www.n-tv.de/wirtschaft/Stromkosten-Aiwanger-springt-Norddeutschland-bei-article24326618.html,https://www.n-tv.de/wirtschaft/Stromkosten-Aiwanger-springt-Norddeutschland-bei-article24326618.html,0,www.n-tv.de,Deutliche Kritik an Markus Söder: Stromkosten: Aiwanger springt Norddeutschland bei,"Der Norden produziert viel billige Windkraft, Einwohner zahlen dort aber mehr für Strom als im Süden, wo der Ausbau hinterherhinkt. Eine Neuregelung der Netzentgelte soll das ändern - das stößt bei Bayerns Landeschef Söder auf Kritik. Sein Wirtschaftsminister…",https://bilder2.n-tv.de/img/incoming/crop24326661/8901327218-cImg_16_9-w1200/261973324.jpg,2023-08-15T09:22:23Z,,"Der Norden produziert viel billige Windkraft, Einwohner zahlen dort aber mehr für Strom als im Süden, wo der Ausbau hinterherhinkt. Eine Neuregelung der Netzentgelte soll das ändern - das stößt bei B… [+2502 chars]",,de,'Windräder'
https://www.basicthinking.de/blog/2023/08/15/windrad-holz-schweden/,https://www.basicthinking.de/blog/2023/08/15/windrad-holz-schweden/,0,www.basicthinking.de,Nachhaltiges Windrad aus Holz versorgt bald 500 schwedische Haushalte,Das schwedische Start-up Modvion baut in Kooperation mit dem dänischen Windradbauer Vestas derzeit ein 105 Meter hohes Windrad aus Holz. Die nachhaltige Konstruktion soll bis zu 500 Haushalte mit Strom versorgen. Der Ausbau von Windrädern schreitet sowohl in …,https://www.basicthinking.de/blog/wp-content/uploads/2023/08/windrad-holz.jpg,2023-08-15T11:00:18Z,https://web.archive.org/web/20230815110224/https://www.basicthinking.de/blog/2023/08/15/windrad-holz-schweden/,Das schwedische Start-up Modvion baut in Kooperation mit dem dänischen Windradbauer Vestas derzeit ein 105 Meter hohes Windrad aus Holz. Die nachhaltige Konstruktion soll bis zu 500 Haushalte mit Str… [+2330 chars],,de,'Windräder'
https://www.faz.net/aktuell/politik/ausland/ukraine-mehrere-tote-durch-luftangriffe-im-westen-des-landes-19104937.html,https://www.faz.net/aktuell/politik/ausland/ukraine-mehrere-tote-durch-luftangriffe-im-westen-des-landes-19104937.html,0,www.faz.net,Mindestens vier Tote bei Luftangriffen auf die Ukraine: „Es herrscht Zerstörung“,In der Nacht wurden bei russischen Raketenangriffen mindestens vier Menschen getötet. In Lemberg schlug eine Rakete in einen Kindergarten ein. Putin gibt dem Westen die Schuld an vielen Konflikten in der Welt.,https://media0.faz.net/ppmedia/aktuell/3748216514/1.9104936/facebook_teaser/aufraeumarbeiten-am-15-august.jpg,2023-08-15T14:05:05Z,https://web.archive.org/web/20230816202408/https://www.faz.net/aktuell/politik/ausland/ukraine-mehrere-tote-durch-luftangriffe-im-westen-des-landes-19104937.html,"Bei Luftangriffen auf die Ukraine sind in der Nacht zu Dienstag mindestens vier Menschen getötet worden, mindestens 16 wurden verletzt. Über mehrere Stunden hinweg galt im ganzen Land Luftalarm. Im w… [+1871 chars]",,de,'Putin'
https://www.faz.net/aktuell/politik/ukraine-liveticker-russland-und-nordkorea-wollen-zusammenarbeit-ausbauen-faz-19030454.html,https://www.faz.net/aktuell/politik/ukraine-liveticker-russland-und-nordkorea-wollen-zusammenarbeit-ausbauen-faz-19030454.html,0,www.faz.net,Ukraine-Liveblog: Russland und Nordkorea wollen Zusammenarbeit ausbauen,London: Kadyrow inszeniert sich als Putin-Loyalist Lindner hält Taurus-Lieferung noch während Gegenoffensive für möglich +++ Russischer Kampfjet während Training in Krasnodar abgestürzt +++ alle Entwicklungen im Liveblog,https://media1.faz.net/ppmedia/aktuell/politik/1781315936/1.9105707/facebook_teaser/kim-jong-un-bei-einem-besuch.jpg,2023-08-15T16:23:04Z,https://web.archive.org/web/20230815202716/https://www.faz.net/aktuell/politik/ukraine-liveticker-russland-und-nordkorea-wollen-zusammenarbeit-ausbauen-faz-19030454.html,"Ukraine-Liveblog: Russland und Nordkorea wollen Zusammenarbeit ausbauen
Ukraine-Liveblog
Russland und Nordkorea wollen Zusammenarbeit ausbauen
Von London: Kadyrow inszeniert sich als Putin-Loyalis… [+236 chars]",,de,'Putin'
https://www.faz.net/aktuell/politik/ausland/polen-will-staerkste-armee-europas-haben-bedrohung-auch-von-belarus-19105334.html,https://www.faz.net/aktuell/politik/ausland/polen-will-staerkste-armee-europas-haben-bedrohung-auch-von-belarus-19105334.html,0,www.faz.net,Polen rüstet auf: Warschau will bald die stärkste Armee Europas haben,Polens Streitkräfte zeigen zum „Tag der Armee“ ihr neuestes Gerät. Russlands Krieg gegen die Ukraine treibt die Aufrüstung voran. Auch von Belarus fühlt sich Warschau bedroht.,https://media1.faz.net/ppmedia/aktuell/1005219296/1.9105633/facebook_teaser_fplus/polens-praesident-andrzej-duda.jpg,2023-08-15T16:59:52Z,https://web.archive.org/web/20230816134242/https://www.faz.net/aktuell/politik/ausland/polen-will-staerkste-armee-europas-haben-bedrohung-auch-von-belarus-19105334.html,"Am Montagabend war es so weit: Die neuesten Panzer der polnischen Armee, amerikanische Abrams, verließen ihre Kaserne am östlichen Stadtrand von Warschau. Auf Sattelschleppern wurden sie vorsichtig d… [+1099 chars]",,de,'Krieg'
https://www.faz.net/aktuell/politik/ukraine-liveticker-angriffe-auf-getreidehaefen-in-donaumuendung-faz-19030454.html,https://www.faz.net/aktuell/politik/ukraine-liveticker-angriffe-auf-getreidehaefen-in-donaumuendung-faz-19030454.html,0,www.faz.net,Ukraine-Liveblog: Angriffe auf Getreidehäfen in Donaumündung,Russland und Nordkorea wollen Zusammenarbeit ausbauen +++ London: Kadyrow inszeniert sich als Putin-Loyalist +++ Lindner hält Taurus-Lieferung noch während Gegenoffensive für möglich +++ alle Entwicklungen im Liveblog,https://media0.faz.net/ppmedia/aktuell/2610233649/1.9040284/facebook_teaser/im-ukrainischen-donauhafen.jpg,2023-08-15T17:23:43Z,https://web.archive.org/web/20230816041911/https://www.faz.net/aktuell/politik/ukraine-liveticker-angriffe-auf-getreidehaefen-in-donaumuendung-faz-19030454.html,"Ukraine-Liveblog: Angriffe auf Getreidehäfen in Donaumündung
Ukraine-Liveblog
Angriffe auf Getreidehäfen in Donaumündung
Von Russland und Nordkorea wollen Zusammenarbeit ausbauen +++ London: Kadyr… [+211 chars]",,de,'Putin'
https://www.handelsblatt.com/politik/konjunktur/nachrichten/liveblog-zum-ukraine-krieg-kiew-meldet-rueckeroberung-im-sueden-schiff-deutscher-reederei-faehrt-von-odessa-nach-istanbul/27982126.html,https://www.handelsblatt.com/politik/konjunktur/nachrichten/liveblog-zum-ukraine-krieg-kiew-meldet-rueckeroberung-im-sueden-schiff-deutscher-reederei-faehrt-von-odessa-nach-istanbul/27982126.html,0,www.handelsblatt.com,+++ Ukraine-Krieg +++: Kiew meldet Rückeroberung im Süden – Schiff deutscher Reederei fährt von Odessa nach Istanbul,Russland: Drei ukrainische Drohnen über Kaluga-Region zerstört +++ Lettland verstärkt Grenzschutz nach versuchten Übertritten aus Belarus +++ Der Newsblog,https://www.handelsblatt.com/images/donauhafen-von-izmail/29334034/2-format2003.jpg,2023-08-16T04:16:37Z,,"<li>Herr Hans Schönenberg15.08.2023, 12:19 Uhr
Herr Peter: ein Hinweis Ihrerseits hinsichtlich der Akteure hinter NuoViso wäre hilfreich gewesen; das sind Verschwörungstheoretiker, die dankbar Theme… [+5905 chars]",,de,'Krieg'
https://www.handelsblatt.com/politik/konjunktur/nachrichten/liveblog-zum-ukraine-krieg-ukraine-russische-drohnen-bedrohen-hafenstaedte-an-der-donau-kiew-meldet-rueckeroberung-im-sueden/27982126.html,https://www.handelsblatt.com/politik/konjunktur/nachrichten/liveblog-zum-ukraine-krieg-ukraine-russische-drohnen-bedrohen-hafenstaedte-an-der-donau-kiew-meldet-rueckeroberung-im-sueden/27982126.html,0,www.handelsblatt.com,+++ Ukraine-Krieg +++: Ukraine: Russische Drohnen bedrohen Hafenstädte an der Donau – Kiew meldet Rückeroberung im Süden,Russland: Drei ukrainische Drohnen über Kaluga-Region zerstört +++ Lettland verstärkt Grenzschutz nach versuchten Übertritten aus Belarus +++ Der Newsblog,https://www.handelsblatt.com/images/donauhafen-von-izmail/29334034/2-format2003.jpg,2023-08-16T04:16:37Z,,"<li>Herr Hans Schönenberg15.08.2023, 12:19 Uhr
Herr Peter: ein Hinweis Ihrerseits hinsichtlich der Akteure hinter NuoViso wäre hilfreich gewesen; das sind Verschwörungstheoretiker, die dankbar Theme… [+5905 chars]",,de,'Putin'
https://www.faz.net/aktuell/feuilleton/debatten/russland-tiktok-stars-und-kreative-menschen-werden-gedemuetigt-19105139.html,https://www.faz.net/aktuell/feuilleton/debatten/russland-tiktok-stars-und-kreative-menschen-werden-gedemuetigt-19105139.html,0,www.faz.net,Rachejustiz in Russland: Kahlgeschoren wird der Tiktok-Star zum armen Tier,An den Pranger gestellt: Russland stärkt den Staat durch archaische Formen der Demütigung und Ächtung. Die Methoden stammen aus Tschetschenien. Sie werden vor allem auf junge Leute aus kreativen Berufen angewandt. Ein Gastbeitrag.,https://media0.faz.net/ppmedia/aktuell/1554641643/1.9105138/facebook_teaser_fplus/der-blogger-nekoglai-nikolai.jpg,2023-08-16T04:22:45Z,,"In Russland versuchen immer mehr Akteure, das Gewaltmonopol des Staates aufzuteilen. Jewgenij Prigoschins Vorschlaghammer wurde zum Symbol außergerichtlicher Justiz. Präsident Putin hat das befördert… [+680 chars]",,de,'Putin'
https://www.handelsblatt.com/politik/international/ukraine-krieg-lage-am-morgen-ukraine-verlegt-reserven-nach-kupjansk/28144208.html,https://www.handelsblatt.com/politik/international/ukraine-krieg-lage-am-morgen-ukraine-verlegt-reserven-nach-kupjansk/28144208.html,0,www.handelsblatt.com,Ukraine-Krieg – Lage am Morgen: Selenski besucht Front bei Bachmut,Erst im vergangenen Jahr haben ukrainische Truppen die Stadt Kupjansk aus russischer Besatzung befreit. Nun wächst der Druck auf die Armee des Ukraine ausgerechnet dort erneut.,https://www.handelsblatt.com/images/ukrainische-soldaten/29334076/2-format2003.jpg,2023-08-16T04:49:11Z,https://web.archive.org/web/20230816053928/https://www.handelsblatt.com/politik/international/ukraine-krieg-lage-am-morgen-ukraine-verlegt-reserven-nach-kupjansk/28144208.html,"<li>Herr Andreas Felsch11.08.2023, 12:29 Uhr
Herr Peter,Ihre Wortmeldungen (Argumentation mag ich es nicht nennen) hier sind so dünn, dass es sich kaum lohnt, damit auseinander zu setzen.Das Muster … [+10079 chars]",,de,'Krieg'
https://www.focus.de/politik/ausland/ukraine-krise/erschreckender-blick-in-putins-armee-abgefangener-anruf-von-russischem-soldaten-das-machen-die-heilige-scheisse_id_201906111.html,https://www.focus.de/politik/ausland/ukraine-krise/erschreckender-blick-in-putins-armee-abgefangener-anruf-von-russischem-soldaten-das-machen-die-heilige-scheisse_id_201906111.html,0,www.focus.de,Erschreckender Blick in Putins Armee - Abgefangener Anruf von russischem Soldaten: „Das machen die? Heilige Scheiße“,Der ukrainische Geheimdienst teilt regelmäßig abgefangene Anrufe russischer Soldaten von der Front. Sie zeichnen jedes Mal aufs Neue ein erschreckend Bild der Situation der Armee. So auch im Fall des Soldaten Yura.,https://p6.focus.de/img/regional/koeln/id_201906095/ein-ukrainischer-soldat-feuert-ende-mai-einen-moerser-auf-russische-stellungen-in-der-naehe-von-bachmut-ab..jpg?im=Crop%3D%280%2C289%2C3463%2C1731%29%3BResize%3D%281200%2C627%29&impolicy=perceptual&quality=mediumHigh&hash=e5cf278adabd1e88510a6211ee195a1299234939c9effa89fa02d6d397b2e84c,2023-08-16T05:08:58Z,,"Putin will die Stellungen an der Front bis zum Tod halten. Das war schon vor einigen Monaten die Einschätzung der britischen Regierung. Wer fliehen oder sich unerlaubt zurückziehen will, wird erschos… [+4446 chars]",,de,'Putin'
https://www.zeit.de/news/2023-08/16/london-russland-baut-eigene-angriffsdrohnen,https://www.zeit.de/news/2023-08/16/london-russland-baut-eigene-angriffsdrohnen,0,www.zeit.de,Krieg gegen die Ukraine: London: Russland baut eigene Angriffsdrohnen,,,2023-08-16T06:40:00Z,https://web.archive.org/web/20230818014316/https://www.zeit.de/news/2023-08/16/london-russland-baut-eigene-angriffsdrohnen,"When browsing with ads:
We collect personal data and also transmit it to third-party providers
 that help us improve and finance our digital content. Some of the information stored on your device, … [+821 chars]",,de,'Krieg'
https://www.n-tv.de/politik/20-16-Geistlicher-berichtet-So-setzt-Moskau-die-orthodoxe-Kirche-unter-Druck--article23143824.html,https://www.n-tv.de/politik/20-16-Geistlicher-berichtet-So-setzt-Moskau-die-orthodoxe-Kirche-unter-Druck--article23143824.html,0,www.n-tv.de,Ukraine-Krieg im Liveticker: +++ 20:16 Geistlicher berichtet: So setzt Moskau die orthodoxe Kirche unter Druck +++,Lesen Sie alle aktuellen Entwicklungen und Nachrichten über den russischen Angriffskrieg auf die Ukraine im Liveticker von ntv.de.,https://bilder2.n-tv.de/img/incoming/crop23332537/9041326157-cImg_16_9-w1200/Liveticker1-grau-1-Kopie.jpg,2023-08-16T07:19:02Z,https://web.archive.org/web/20230816185027/https://www.n-tv.de/politik/20-16-Geistlicher-berichtet-So-setzt-Moskau-die-orthodoxe-Kirche-unter-Druck--article23143824.html,"Kyrill I. ist ehemaliger KGB-Agent, Moskaus Patriarch und Vertrauter von Putin. Er wies seine Priester im vergangenen Jahr an, für den ""Sieg"" über die Ukraine zu beten. Wer dem nicht nachkam, erlebt … [+19967 chars]",,de,'Putin'
https://www.n-tv.de/politik/22-19-Selenskyj-Ukraine-steigert-Drohnenproduktion-erheblich--article23143824.html,https://www.n-tv.de/politik/22-19-Selenskyj-Ukraine-steigert-Drohnenproduktion-erheblich--article23143824.html,0,www.n-tv.de,"Ukraine-Krieg im Liveticker: +++ 22:19 Selenskyj: Ukraine steigert Drohnenproduktion ""erheblich"" +++",Lesen Sie alle aktuellen Entwicklungen und Nachrichten über den russischen Angriffskrieg auf die Ukraine im Liveticker von ntv.de.,https://bilder2.n-tv.de/img/incoming/crop23332537/9041326157-cImg_16_9-w1200/Liveticker1-grau-1-Kopie.jpg,2023-08-16T07:19:02Z,,"Der ukrainische Präsident Wolodymyr Selenskyj betont die Bedeutung von Drohnen für die Verteidigung seines Landes gegen den russischen Angriffskrieg. ""Drohnen sind die 'Augen' und der Schutz an der F… [+22391 chars]",,de,'Krieg'
https://www.n-tv.de/politik/21-31-USA-kritisieren-Angriffe-auf-ukrainische-Donau-Haefen--article23143824.html,https://www.n-tv.de/politik/21-31-USA-kritisieren-Angriffe-auf-ukrainische-Donau-Haefen--article23143824.html,0,www.n-tv.de,Ukraine-Krieg im Liveticker: +++ 21:31 USA kritisieren Angriffe auf ukrainische Donau-Häfen +++,Lesen Sie alle aktuellen Entwicklungen und Nachrichten über den russischen Angriffskrieg auf die Ukraine im Liveticker von ntv.de.,https://bilder2.n-tv.de/img/incoming/crop23332537/9041326157-cImg_16_9-w1200/Liveticker1-grau-1-Kopie.jpg,2023-08-16T07:19:02Z,,"Die USA verurteilen die russischen Angriffe auf für den Getreideexport wichtige ukrainische Häfen an der Donaumündung. Kremlchef Wladimir Putin sei die weltweite Ernährungssicherheit egal, sagt ein S… [+21029 chars]",,de,'Putin'
https://www.n-tv.de/politik/20-54-Ex-Oberbefehlshaber-von-Russlands-Invasionstruppen-ist-tot--article23143824.html,https://www.n-tv.de/politik/20-54-Ex-Oberbefehlshaber-von-Russlands-Invasionstruppen-ist-tot--article23143824.html,0,www.n-tv.de,Ukraine-Krieg im Liveticker: +++ 20:54 Ex-Oberbefehlshaber von Russlands Invasionstruppen ist tot +++,Lesen Sie alle aktuellen Entwicklungen und Nachrichten über den russischen Angriffskrieg auf die Ukraine im Liveticker von ntv.de.,https://bilder2.n-tv.de/img/incoming/crop23332537/9041326157-cImg_16_9-w1200/Liveticker1-grau-1-Kopie.jpg,2023-08-16T07:19:02Z,,"Der russische Generaloberst Gennadi Walerjewitsch Schidko ist ""nach langer Krankheit"" im Alter von 57 Jahren gestorben. Das meldet der Gouverneur der Region Chabarowsk, Michail Degtarew, auf Telegram… [+20454 chars]",,de,'Putin'
https://consent.google.com/ml?continue=https://news.google.com/rss/articles/CBMikQFodHRwczovL3d3dy5iaWxkLmRlL3BvbGl0aWsvYXVzbGFuZC9wb2xpdGlrLWF1c2xhbmQvcHJvcGFnYW5kYS1zaG93LWJlaS1tb3NrYXUtcnVzc2xhbmQtc3RlbGx0LWVyYmV1dGV0ZS1uYXRvLXBhbnplci16dXItc2NoYXUtODUwNTY2MjIuYmlsZC5odG1s0gEA?oc%3D5&gl=FR&hl=en-US&cm=2&pc=n&src=1,https://consent.google.com/ml?continue=https://news.google.com/rss/articles/CBMikQFodHRwczovL3d3dy5iaWxkLmRlL3BvbGl0aWsvYXVzbGFuZC9wb2xpdGlrLWF1c2xhbmQvcHJvcGFnYW5kYS1zaG93LWJlaS1tb3NrYXUtcnVzc2xhbmQtc3RlbGx0LWVyYmV1dGV0ZS1uYXRvLXBhbnplci16dXItc2NoYXUtODUwNTY2MjIuYmlsZC5odG1s0gEA?oc%3D5&gl=FR&hl=en-US&cm=2&pc=n&src=1,0,consent.google.com,Propaganda-Show bei Moskau: Russland stellt erbeutete „Nato“-Panzer zur Schau - BILD,"<ol><li>Propaganda-Show bei Moskau: Russland stellt erbeutete „Nato“-Panzer zur Schau  BILD
</li><li>Ukraine-Krieg: Russland zeigt auf Konferenz erbeutete West-Panzer  FAZ - Frankfurter Allgemeine Zeitung
</li><li>Putin: Der Westen tut alles, um den Konflik…",,2023-08-16T08:26:47Z,,"We use cookies and data to<ul><li>Deliver and maintain Google services</li><li>Track outages and protect against spam, fraud, and abuse</li><li>Measure audience engagement and site statistics to unde… [+1131 chars]",,de,'Putin'
https://www.bild.de/politik/ausland/politik-ausland/propaganda-show-bei-moskau-russland-stellt-erbeutete-nato-panzer-zur-schau-85056622.bild.html,https://www.bild.de/politik/ausland/politik-ausland/propaganda-show-bei-moskau-russland-stellt-erbeutete-nato-panzer-zur-schau-85056622.bild.html,0,www.bild.de,Propaganda-Show bei Moskau - Russland stellt erbeutete „Nato“-Panzer zur Schau,"Putin will den Russen und der Welt weismachen, dass russische Waffen denen der Nato überlegen seien. Mit einer Ausstellung im „Park Patriot“ bei Moskau.","https://images.bild.de/64db83d8ede7416279762024/c32713e7883a5d62015c1496ba06ac6a,574506e2?w=1280",2023-08-16T08:26:55Z,https://web.archive.org/web/20230816202355/https://www.bild.de/politik/ausland/politik-ausland/propaganda-show-bei-moskau-russland-stellt-erbeutete-nato-panzer-zur-schau-85056622.bild.html,"Putin will den Russen und der ganzen Welt weismachen, dass russische Waffen denen der Nato überlegen seien.
Die genauso einfach wie faktisch falsche Botschaft versucht das russische Verteidigungsmin… [+3493 chars]",,de,'Putin'
https://www.n-tv.de/politik/Kiesewetter-wirft-Kretschmer-Doppelmoral-vor-article24329031.html,https://www.n-tv.de/politik/Kiesewetter-wirft-Kretschmer-Doppelmoral-vor-article24329031.html,0,www.n-tv.de,Streit unter CDU-Politikern: Kiesewetter wirft Kretschmer Doppelmoral vor,"Der deutschen Marschflugkörper Taurus könnte für die Ukraine im Krieg eine wichtige Waffe werden. Sachsens Ministerpräsident Kretschmer stemmt sich vehement gegen eine Lieferung aus Deutschland. Das erzürnt einen CDU-Parteikollegen dermaßen, dass er zur Schim…",https://bilder4.n-tv.de/img/incoming/crop24329103/3211328670-cImg_16_9-w1200/imago0260186728h.jpg,2023-08-16T08:38:53Z,,Der deutschen Marschflugkörper Taurus könnte für die Ukraine im Krieg eine wichtige Waffe werden. Sachsens Ministerpräsident Kretschmer stemmt sich vehement gegen eine Lieferung aus Deutschland. Das … [+2349 chars],,de,'Krieg'
https://www.zeit.de/news/2023-08/16/deutsches-containerschiff-verlaesst-hafen-odessa,https://www.zeit.de/news/2023-08/16/deutsches-containerschiff-verlaesst-hafen-odessa,0,www.zeit.de,Krieg: Deutsches Containerschiff verlässt Hafen Odessa,,,2023-08-16T10:02:22Z,https://web.archive.org/web/20230818112140/https://www.zeit.de/news/2023-08/16/deutsches-containerschiff-verlaesst-hafen-odessa,"When browsing with ads:
We collect personal data and also transmit it to third-party providers
 that help us improve and finance our digital content. Some of the information stored on your device, … [+821 chars]",,de,'Krieg'
https://www.faz.net/aktuell/politik/ausland/russland-praesentiert-stolz-auf-konferenz-erbeutete-west-panzer-19107438.html,https://www.faz.net/aktuell/politik/ausland/russland-praesentiert-stolz-auf-konferenz-erbeutete-west-panzer-19107438.html,0,www.faz.net,Russlands Krieg: Gäste und Panzer als Trophäen,"Russlands Verteidigungsminister Schojgu lädt zu einer Konferenz in den „Park Patriot“ nahe Moskau. Er bietet „unseren Partnern“ an, sie über Schwächen westlicher Waffen zu unterrichten.",https://media1.faz.net/ppmedia/aktuell/politik/2671366382/1.9108259/facebook_teaser_fplus/besucher-fotografieren-einen.jpg,2023-08-16T18:12:29Z,https://web.archive.org/web/20230817083923/https://www.faz.net/aktuell/politik/ausland/russland-praesentiert-stolz-auf-konferenz-erbeutete-west-panzer-19107438.html,Bald eineinhalb Jahre nach dem Überfall auf die Ukraine vom 24. Februar 2022 will Russlands Militär Erfolge vorweisen. Die jährliche Moskauer Konferenz zur internationalen Sicherheit bot Verteidigung… [+1004 chars],,de,'Krieg'
https://www.telepolis.de/features/Deutschlands-Gasreserven-und-die-globale-LNG-Krise-Was-der-Winter-bringen-koennte-9247620.html,https://www.telepolis.de/features/Deutschlands-Gasreserven-und-die-globale-LNG-Krise-Was-der-Winter-bringen-koennte-9247620.html,0,www.telepolis.de,Deutschlands Gasreserven und die globale LNG-Krise: Was der Winter bringen könnte,"Deutschland kam ohne Engpässe durch den Winter. Zwar sind die Gasspeicher jetzt gut gefüllt, doch der Markt lässt aufhorchen. Warum Gassparen wieder angesagt sein könnte.",https://heise.cloudimg.io/bound/1200x1200/q85.png-lossy-85.webp-lossy-85.foil1/_www-heise-de_/imgs/18/4/2/8/7/4/1/2/2x-lng-tanker_ho-a6a12fc419b1da77.jpeg,2023-08-17T05:00:00Z,,"Deutschland kam ohne Engpässe durch den Winter. Zwar sind die Gasspeicher jetzt gut gefüllt, doch der Markt lässt aufhorchen. Warum Gassparen wieder angesagt sein könnte.
Bei den derzeitigen Außente… [+5634 chars]",,de,'Gasspeicher'
