index,url,valid,domain,title,description,image,published,archive,content,quote,language,keyword
https://www.zeit.de/news/2025-03/01/muenchen-tatort-charlie-probt-den-krieg-in-deutschland,https://www.zeit.de/news/2025-03/01/muenchen-tatort-charlie-probt-den-krieg-in-deutschland,0,www.zeit.de,"Tv-Ausblick: München-""Tatort"": ""Charlie"" probt den Krieg in Deutschland","Hier finden Sie Informationen zu dem Thema „Tv-Ausblick“. Lesen Sie jetzt „München-""Tatort"": ""Charlie"" probt den Krieg in Deutschland“.",https://img.zeit.de/news/2025-03/01/muenchen-tatort-charlie-probt-den-krieg-in-deutschland-image-group/wide__1300x731,2025-03-01T06:00:36Z,,Spätestens seit der Rede von US-Vizepräsident JD Vance bei der Münchner Sicherheitskonferenz ist verteidigungspolitisch womöglich ein neues Zeitalter angebrochen für die Bundesrepublik - und der Münc… [+3162 chars],,de,'Krieg'
https://www.zeit.de/news/2025-03/01/baerbock-wir-muessen-jetzt-schnell-handeln,https://www.zeit.de/news/2025-03/01/baerbock-wir-muessen-jetzt-schnell-handeln,0,www.zeit.de,Ukraine-Krieg: Trump-Eklat setzt deutsche Politik unter Druck,Hier finden Sie Informationen zu dem Thema „Ukraine-Krieg“. Lesen Sie jetzt „Trump-Eklat setzt deutsche Politik unter Druck“.,https://img.zeit.de/news/2025-03/01/baerbock-wir-muessen-jetzt-schnell-handeln-image-group/wide__1300x731,2025-03-01T16:07:36Z,,Die Eskalation zwischen den USA und der Ukraine setzt die deutsche Politik in der Übergangszeit nach der Bundestagswahl unter erhöhten Druck. Außenministerin Annalena Baerbock (Grüne) forderte in Ber… [+4284 chars],,de,'Krieg'
https://www.zeit.de/news/2025-03/01/skisprung-quartett-um-freitag-gewinnt-wm-bronze-im-team,https://www.zeit.de/news/2025-03/01/skisprung-quartett-um-freitag-gewinnt-wm-bronze-im-team,0,www.zeit.de,Wintersport: Springerinnen holen WM-Bronze - Verletzte Görlich jubelt mit,Hier finden Sie Informationen zu dem Thema „Wintersport“. Lesen Sie jetzt „Springerinnen holen WM-Bronze - Verletzte Görlich jubelt mit“.,https://img.zeit.de/news/2025-03/01/skisprung-quartett-um-freitag-gewinnt-wm-bronze-im-team-image-group/wide__1300x731,2025-03-01T18:15:25Z,,"Jubelnd herzten die deutschen Skispringerinnen ihre verletzte Teamkollegin Luisa Görlich. Die 26-Jährige hatte sich mit Krücken extra zum Schanzenauslauf geschleppt und feierte mit Juliane Seyfarth, … [+2506 chars]",,de,'Winter'
https://www.zeit.de/news/2025-03/01/orban-fordert-direkte-gespraeche-mit-russland,https://www.zeit.de/news/2025-03/01/orban-fordert-direkte-gespraeche-mit-russland,0,www.zeit.de,Ukraine-Krieg: Orban droht mit Blockade von EU-Hilfen für die Ukraine,Hier finden Sie Informationen zu dem Thema „Ukraine-Krieg“. Lesen Sie jetzt „Orban droht mit Blockade von EU-Hilfen für die Ukraine“.,https://img.zeit.de/news/2025-03/01/orban-fordert-direkte-gespraeche-mit-russland-image-group/wide__1300x731,2025-03-01T18:30:04Z,,Kurz vor einem Sondergipfel der EU hat Ungarns Ministerpräsident Viktor Orban eine Blockade möglicher neuer Unterstützungsbemühungen für die Ukraine angekündigt. In einem Brief an EU-Ratspräsident An… [+2510 chars],,de,'Krieg'
https://www.faz.net/aktuell/sport/fussball/bundesliga/joshua-kimmich-beim-fc-bayern-muenchen-es-steht-generell-keiner-ueber-dem-verein-110330290.html,https://www.faz.net/aktuell/sport/fussball/bundesliga/joshua-kimmich-beim-fc-bayern-muenchen-es-steht-generell-keiner-ueber-dem-verein-110330290.html,0,www.faz.net,Die Causa Kimmich: „Es steht generell keiner über dem Verein“,Sportvorstand Max Eberl macht eine Ansage im Vertragspoker mit dem Nationalspieler. Die entscheidende Frage aber lautet: Wer braucht den anderen mehr – der FC Bayern Joshua Kimmich oder Joshua Kimmich den FC Bayern?,https://media1.faz.net/ppmedia/aktuell/sport/1623356162/1.10330289/facebook_teaser_fplus/gibt-den-weg-vor-aber-wie.jpg,2025-03-02T12:11:48Z,,"Es konnte im Nachhinein als eine glückliche Fügung betrachtet werden, dass Joshua Kimmich wegen einer Sehnenreizung nicht nach Stuttgart gereist war. So musste er sich nicht den Fragen der Journalist… [+272 chars]",,de,'Bayern'
https://www.zeit.de/news/2025-03/02/republikaner-johnson-vorwurf-von-trumps-kreml-naehe-absurd,https://www.zeit.de/news/2025-03/02/republikaner-johnson-vorwurf-von-trumps-kreml-naehe-absurd,0,www.zeit.de,"Ukraine-Krieg: Republikaner Johnson: Vorwurf von Trumps Kreml-Nähe ""absurd""","Hier finden Sie Informationen zu dem Thema „Ukraine-Krieg“. Lesen Sie jetzt „Republikaner Johnson: Vorwurf von Trumps Kreml-Nähe ""absurd""“.",https://img.zeit.de/news/2025-03/02/republikaner-johnson-vorwurf-von-trumps-kreml-naehe-absurd-image-group/wide__1300x731,2025-03-02T16:27:57Z,,"Der republikanische Vorsitzende des Repräsentantenhauses, Mike Johnson, weist Vorwürfe einer zu russlandfreundlichen Haltung von US-Präsident Donald Trump und seiner Regierung zurück. «Es ist ziemlic… [+1928 chars]",,de,'Krieg'
https://www.morgenpost.de/wirtschaft/article408447396/gas-gasverbrauch-gaspreise-energie-energiepreise-heizung-heizen-gasheizung-verivox-preisvergleich.html,https://www.morgenpost.de/wirtschaft/article408447396/gas-gasverbrauch-gaspreise-energie-energiepreise-heizung-heizen-gasheizung-verivox-preisvergleich.html,0,www.morgenpost.de,"Gas ist billiger, doch viele Deutsche heizen sparsamer","Eine Statistik zeigt, wie viel Gas die Deutschen 2024 verbraucht haben. Wie hoch das Minus war und wo am meisten eingespart wurde.",https://img.sparknews.funkemedien.de/408448627/408448627_1740999704_v16_9_1600.jpeg,2025-03-03T11:01:44Z,,"Berlin. Eine Statistik zeigt, wie viel Gas die Deutschen 2024 verbraucht haben. Wie hoch das Minus war und wo am meisten eingespart wurde.
Trotz wieder gesunkener Gaspreise blieben in Deutschland vi… [+2806 chars]",,de,'Heizen'
https://www.focus.de/auto/neuheiten/cla-eq-in-der-wintererprobung-so-faehrt-sich-die-neue-mercedes-a-klasse_id_260754331.html,https://www.focus.de/auto/neuheiten/cla-eq-in-der-wintererprobung-so-faehrt-sich-die-neue-mercedes-a-klasse_id_260754331.html,0,www.focus.de,CLA EQ im Härtetest - So fährt sich die neue Mercedes A-Klasse,Die Erprobung des vollelektrischen Mercedes CLA EQ geht kurz vor dem Marktstart in die finale Phase. Wir haben den Prototypen in kalten Winterlandschaften auf den Dynamik-Zahn gefühlt.Von FOCUS-online-Autor Wolfgang Gomoll,https://p6.focus.de/img/fotos/id_259982069/mercedes-cla-orange.jpg?im=Crop%3D%28750%2C751%2C2712%2C1357%29%3BResize%3D%281200%2C627%29&impolicy=perceptual&quality=mediumHigh&hash=572e4201cded47b46625b238213d57a43bca2e7ee2d22ea436ca33066f8bfc8f,2025-03-03T15:13:24Z,,"<ul><li>
Kommentare</li><li>
E-Mail</li><li>
Teilen</li><li>
Mehr</li><li>
Twitter</li><li>
Drucken</li><li>
Feedback</li><li>
Fehler meldenSie haben einen Fehler gefunden?
Bitte markieren S… [+7027 chars]",,de,'Winter'
https://www.welt.de/regionales/hamburg/article255596498/Unglueck-5000-Liter-Wasser-Oel-Mischung-im-Hamburger-Hafen-ausgelaufen.html,https://www.welt.de/regionales/hamburg/article255596498/Unglueck-5000-Liter-Wasser-Oel-Mischung-im-Hamburger-Hafen-ausgelaufen.html,0,www.welt.de,5000 Liter Wasser-Öl-Mischung im Hamburger Hafen ausgelaufen,"Im Osten des Hamburger Hafens laufen Tausende Liter einer Wasser-Öl-Mischung aus. Sperren stoppen das Gemisch. Betroffen ist weniger das Wasser, sagt die Umweltbehörde.",https://img.welt.de/img/regionales/hamburg/mobile255596496/6627939677-ci16x9-w1200/Oel-im-Hamburger-Hafen-ausgelaufen.jpg,2025-03-03T15:26:13Z,,"Im Osten des Hamburger Hafens laufen Tausende Liter einer Wasser-Öl-Mischung aus. Sperren stoppen das Gemisch. Betroffen ist weniger das Wasser, sagt die Umweltbehörde.Das im Osten des Hamburger Hafe… [+1295 chars]",,de,'Öl'
https://www.stern.de/politik/ausland/ukraine-krieg--trump-nach-aeusserung-selenskyjs--usa-verlieren-geduld-35516048.html,https://www.stern.de/politik/ausland/ukraine-krieg--trump-nach-aeusserung-selenskyjs--usa-verlieren-geduld-35516048.html,0,www.stern.de,Ukraine-Krieg: Trump nach Äußerung Selenskyjs: USA verlieren Geduld,Seit dem öffentlichen ausgetragenen Streit mit Wolodymyr Selenskyj im Weißen Haus brodelt es bei Trump weiter. Eine Aussage des ukrainischen Präsidenten in London erzürnt ihn nun besonders.,https://image.stern.de/35516050/t/ui/v1/w1440/r1.7778/-/03--xeehrvosq7v8axs2048jpeg---e5f19c7135330d1d.jpg,2025-03-03T19:09:03Z,,"Kopiere den aktuellen Link
Zur Merkliste hinzufügen
Seit dem öffentlichen ausgetragenen Streit mit Wolodymyr Selenskyj im Weißen Haus brodelt es bei Trump weiter. Eine Aussage des ukrainischen Präs… [+1453 chars]",,de,'Krieg'
https://www.tagesspiegel.de/internationales/ukraine-krieg-trump-nach-ausserung-selenskyjs-usa-verlieren-geduld-13309354.html,https://www.tagesspiegel.de/internationales/ukraine-krieg-trump-nach-ausserung-selenskyjs-usa-verlieren-geduld-13309354.html,0,www.tagesspiegel.de,Ukraine-Krieg: Trump nach Äußerung Selenskyjs: USA verlieren Geduld,Seit dem öffentlichen ausgetragenen Streit mit Wolodymyr Selenskyj im Weißen Haus brodelt es bei Trump weiter. Eine Aussage des ukrainischen Präsidenten in London erzürnt ihn nun besonders.,https://www.tagesspiegel.de/images/13309351/alternates/BASE_16_9_W1400/1741029009000/ukrainischer-prasident-selenskyj-in-den-usa.jpeg,2025-03-03T19:10:09Z,,"Im Streit mit dem ukrainischen Präsidenten Wolodymyr Selenskyj hat US-Präsident Donald Trump nachgelegt und damit gedroht, dass die USA ihre Geduld verlieren könnten. Er reagierte auf Aussagen Selens… [+1963 chars]",,de,'Krieg'
https://www.welt.de/politik/ausland/article255588600/Ukraine-Krieg-Trump-droht-Selenskyj-und-weicht-Fragen-zu-moeglichem-Ende-der-Waffenlieferungen-aus-Liveticker.html,https://www.welt.de/politik/ausland/article255588600/Ukraine-Krieg-Trump-droht-Selenskyj-und-weicht-Fragen-zu-moeglichem-Ende-der-Waffenlieferungen-aus-Liveticker.html,0,www.welt.de,Trump droht Selenskyj – und weicht Fragen zu möglichem Ende der Waffenlieferungen aus,"Eine Einigung zwischen den USA und Russland über ein Ende des Kriegs in der Ukraine sei noch weit entfernt, sagt Wolodymyr Selenskyj. Die Aussage verärgert Donald Trump – und auch über Europa spottet der US-Präsident. Selenskyj antwortet mit einem X-Beitrag. …",https://img.welt.de/img/politik/ausland/mobile255598682/6917933637-ci16x9-w1200/US-President-Trump-makes-an-investment-announcement.jpg,2025-03-03T21:37:00Z,http://archive.md/20250303214410/https://www.welt.de/politik/ausland/article255588600/Ukraine-Krieg-Trump-droht-Selenskyj-und-weicht-Fragen-zu-moeglichem-Ende-der-Waffenlieferungen-aus-Liveticker.html,Seit mehr als drei Jahren führt Russland einen Angriffskrieg gegen die Ukraine. Frankreichs Präsident Emmanuel Macron und Großbritanniens Premierminister Keir Starmer schlagen eine einmonatige Waffen… [+14727 chars],,de,'Krieg'
https://www.n-tv.de/politik/23-14-Trump-legt-baldiges-Ende-von-Praesidentschaft-Selenskyjs-nahe--article25603565.html,https://www.n-tv.de/politik/23-14-Trump-legt-baldiges-Ende-von-Praesidentschaft-Selenskyjs-nahe--article25603565.html,0,www.n-tv.de,Ukraine-Krieg im Liveticker: +++ 23:14 Trump legt baldiges Ende von Präsidentschaft Selenskyjs nahe +++,Lesen Sie alle aktuellen Entwicklungen und Nachrichten über den russischen Angriffskrieg auf die Ukraine im Liveticker von ntv.de.,https://www.n-tv.de/img/incoming/crop25117070/4231326595-cImg_16_9-w1200/Ukraine-Liveticker.jpg,2025-03-03T22:50:00Z,,"US-Präsident Donald Trump legt ein baldiges Ende der Ägide des ukrainischen Präsidenten Wolodymyr Selenskyj nahe. Ein Deal zur Beendigung der Feindseligkeiten in der Ukraine ""könnte sehr schnell gesc… [+34071 chars]",,de,'Krieg'
https://www.stern.de/politik/ausland/donald-trump---amerika-wird-sich-das-nicht-laenger-gefallen-lassen--35515990.html,https://www.stern.de/politik/ausland/donald-trump---amerika-wird-sich-das-nicht-laenger-gefallen-lassen--35515990.html,0,www.stern.de,"Krieg in der Ukraine: Trump droht Selenskyj: ""Amerika wird sich das nicht länger gefallen lassen""",US-Präsident Donald Trump hat am Montag seine Attacken gegen Wolodymyr Selenskyj mit unverminderter Härte fortgesetzt. Eine kleine Tür für Gespräche lässt er aber offen.,https://image.stern.de/35516208/t/cY/v2/w1440/r1.7778/-/donald-trump-und-wolodymyr-selenskyj-streiten-im-oval-office.jpg,2025-03-04T00:24:00Z,,"Kopiere den aktuellen Link
Zur Merkliste hinzufügen
US-Präsident Donald Trump hat am Montag seine Attacken gegen Wolodymyr Selenskyj mit unverminderter Härte fortgesetzt. Eine kleine Tür für Gesprä… [+3457 chars]",,de,'Krieg'
https://www.faz.net/aktuell/politik/ukraine/ukraine-liveticker-oelpipeline-brennt-nach-drohnenangriff-110172806.html,https://www.faz.net/aktuell/politik/ukraine/ukraine-liveticker-oelpipeline-brennt-nach-drohnenangriff-110172806.html,0,www.faz.net,Ukraine-Liveblog: Trump stoppt laut Medienberichten sämtliche Militärhilfe für die Ukraine,Russland: Europäische Länder wollen Fortsetzung des Kriegs +++ Kiews Botschafter in Deutschland: Wir alle brauchen Trump +++ US-Finanzminister: Abkommen mit Ukraine vorerst vom Tisch +++ alle Entwicklungen im Liveblog,https://media1.faz.net/ppmedia/aktuell/3226377016/1.10333799/facebook_teaser/ukrainische-drohnen-vor-dem.jpg,2025-03-04T00:37:30Z,http://archive.md/20250304062753/https://www.faz.net/aktuell/politik/ukraine/ukraine-liveticker-oelpipeline-brennt-nach-drohnenangriff-110172806.html,Seit langem stellt Moskau den Angriffskrieg gegen die Ukraine als Verteidigungsringen gegen einen kollektiven Westen dar. Mit der Annäherung zwischen Präsident Wladimir Putin an seinen amerikanischen… [+1090 chars],,de,'Krieg'
https://www.stern.de/politik/ausland/ukraine-krieg--medien--usa-stellen-ukraine-militaerhilfen-vorerst-ein-35516250.html,https://www.stern.de/politik/ausland/ukraine-krieg--medien--usa-stellen-ukraine-militaerhilfen-vorerst-ein-35516250.html,0,www.stern.de,Ukraine-Krieg: Medien: USA stellen Ukraine-Militärhilfen vorerst ein,"Lange stand die Drohung im Raum, die USA könnten unter Donald Trump ihre Hilfe für den Verteidigungskampf der Ukraine gegen Russland einstellen. Nun macht der US-Präsident anscheinend Ernst.",https://image.stern.de/35516252/t/Ss/v1/w1440/r1.7778/-/04--wkymaqqanrv8axs2048jpeg---32b9e2bfda1d8438.jpg,2025-03-04T00:45:29Z,,"Kopiere den aktuellen Link
Zur Merkliste hinzufügen
Lange stand die Drohung im Raum, die USA könnten unter Donald Trump ihre Hilfe für den Verteidigungskampf der Ukraine gegen Russland einstellen. … [+1534 chars]",,de,'Krieg'
https://www.tagesspiegel.de/internationales/ukraine-krieg-trump-regierung-stellt-militarhilfe-fur-ukraine-vorerst-ein-13309546.html,https://www.tagesspiegel.de/internationales/ukraine-krieg-trump-regierung-stellt-militarhilfe-fur-ukraine-vorerst-ein-13309546.html,0,www.tagesspiegel.de,Ukraine-Krieg: Trump-Regierung stellt Militärhilfe für Ukraine vorerst ein,Trump-Regierung stellt Militärhilfe für Ukraine vorerst ein,https://www.tagesspiegel.de/images/13309555/alternates/BASE_16_9_W1400/1741051726000/us-prasident-donald-trump.jpeg,2025-03-04T00:46:35Z,,"Die Regierung von Präsident Donald Trump stellt die US-Militärhilfe für die von Russland angegriffene Ukraine vorerst ein. Trump habe unmissverständlich klargemacht, dass sein Fokus auf Frieden liege… [+215 chars]",,de,'Krieg'
https://www.tagesspiegel.de/internationales/ukraine-krieg-medien-usa-stellen-ukraine-militarhilfen-vorerst-ein-13309546.html,https://www.tagesspiegel.de/internationales/ukraine-krieg-medien-usa-stellen-ukraine-militarhilfen-vorerst-ein-13309546.html,0,www.tagesspiegel.de,Ukraine-Krieg: Medien: USA stellen Ukraine-Militärhilfen vorerst ein,"Lange stand die Drohung im Raum, die USA könnten unter Donald Trump ihre Hilfe für den Verteidigungskampf der Ukraine gegen Russland einstellen. Nun macht der US-Präsident anscheinend Ernst.",https://www.tagesspiegel.de/images/13309543/alternates/BASE_16_9_W1400/1741049195000/medien-usa-stellen-ukraine-militarhilfen-vorubergehend-ein.jpeg,2025-03-04T00:46:35Z,,Die Regierung von US-Präsident Donald Trump stellt nach dem Eklat während des Besuchs des ukrainischen Präsidenten Wolodymyr Selenskyj laut Medienberichten ihre Militärhilfe für die Ukraine vorerst e… [+2047 chars],,de,'Krieg'
https://www.zeit.de/news/2025-03/04/medien-usa-stellen-ukraine-militaerhilfen-vorerst-ein,https://www.zeit.de/news/2025-03/04/medien-usa-stellen-ukraine-militaerhilfen-vorerst-ein,0,www.zeit.de,Ukraine-Krieg: Trump-Regierung stellt Militärhilfe für Ukraine vorerst ein,Hier finden Sie Informationen zu dem Thema „Ukraine-Krieg“. Lesen Sie jetzt „Trump-Regierung stellt Militärhilfe für Ukraine vorerst ein“.,https://img.zeit.de/news/2025-03/04/medien-usa-stellen-ukraine-militaerhilfen-vorerst-ein-image-group/wide__1300x731,2025-03-04T01:27:35Z,,"Die Regierung von Präsident Donald Trump stellt die US-Militärhilfe für die von Russland angegriffene Ukraine vorerst ein. Trump habe klargemacht, dass sein Fokus auf Frieden liege, hieß es aus dem W… [+3614 chars]",,de,'Krieg'
https://www.stern.de/politik/ausland/ukraine-krieg--trump-regierung-stellt-militaerhilfe-fuer-ukraine-vorerst-ein-35516250.html,https://www.stern.de/politik/ausland/ukraine-krieg--trump-regierung-stellt-militaerhilfe-fuer-ukraine-vorerst-ein-35516250.html,0,www.stern.de,Ukraine-Krieg: Trump-Regierung stellt Militärhilfe für Ukraine vorerst ein,"Die Regierung von Präsident Donald Trump stellt die US-Militärhilfe für die von Russland angegriffene Ukraine vorerst ein. Trump habe ""unmissverständlich klargemacht, dass sein Fokus auf Frieden"" liege, teilte das Weiße Haus der Deutschen Presse-Agentur in Wa…",https://image.stern.de/35516286/t/Ui/v1/w1440/r1.7778/-/04--4evjmghqbqv5axs2048jpeg---fa25db2a9db33254.jpg,2025-03-04T01:27:35Z,,"Kopiere den aktuellen Link
Zur Merkliste hinzufügen
Lange stand die Drohung im Raum, dass die USA unter Trump ihre Hilfen für die Ukraine einstellen könnten. Nun macht der US-Präsident Ernst. Für d… [+3830 chars]",,de,'Krieg'
https://www.n-tv.de/politik/16-02-Politologe-Geht-um-Signal-Richtung-Moskau-und-Washington--article23143824.html,https://www.n-tv.de/politik/16-02-Politologe-Geht-um-Signal-Richtung-Moskau-und-Washington--article23143824.html,0,www.n-tv.de,Ukraine-Krieg im Liveticker: +++ 15:29 Partisanengruppe Atesh: Russen verweigern Angriffsbefehle in Cherson +++,Lesen Sie alle aktuellen Entwicklungen und Nachrichten über den russischen Angriffskrieg auf die Ukraine im Liveticker von ntv.de.,https://www.n-tv.de/img/incoming/crop25117070/4231326595-cImg_16_9-w1200/Ukraine-Liveticker.jpg,2025-03-04T01:30:00Z,,"Die Ukraine steckt in der Klemme - einen Weg heraus zu finden wird schwierig, sagt Politikwissenschaftler Fröhlich. Der von Macron und Starmer vorgeschlagene Waffenstillstand könne ein solcher Weg se… [+24171 chars]",,de,'Krieg'
https://www.n-tv.de/politik/06-28-Rostow-meldet-Brand-an-Olpipeline-nach-Drohnenangriffen--article23143824.html,https://www.n-tv.de/politik/06-28-Rostow-meldet-Brand-an-Olpipeline-nach-Drohnenangriffen--article23143824.html,0,www.n-tv.de,Ukraine-Krieg im Liveticker: +++ 06:28 Rostow meldet Brand an Ölpipeline nach Drohnenangriffen +++,Lesen Sie alle aktuellen Entwicklungen und Nachrichten über den russischen Angriffskrieg auf die Ukraine im Liveticker von ntv.de.,https://www.n-tv.de/img/incoming/crop25117070/4231326595-cImg_16_9-w1200/Ukraine-Liveticker.jpg,2025-03-04T01:30:00Z,,"Der stellvertretende Gouverneur der südrussischen Region Rostow meldet mehrere ukrainische Drohnenangriffe auf verschiedene Industriestandorte in dem Grenzgebiet zur Ukraine. ""Infolge eines massiven … [+4292 chars]",,de,'Öl'
https://www.n-tv.de/politik/17-01-Selenskyj-bedauert-erstmals-eskaliertes-Treffen-mit-Trump-und-Vance--article23143824.html,https://www.n-tv.de/politik/17-01-Selenskyj-bedauert-erstmals-eskaliertes-Treffen-mit-Trump-und-Vance--article23143824.html,0,www.n-tv.de,Ukraine-Krieg im Liveticker: +++ 16:32 Sorge unbegründet? USA wollen Kiew weiterhin bei Aufklärung unterstützen +++,Lesen Sie alle aktuellen Entwicklungen und Nachrichten über den russischen Angriffskrieg auf die Ukraine im Liveticker von ntv.de.,https://www.n-tv.de/img/incoming/crop25117070/4231326595-cImg_16_9-w1200/Ukraine-Liveticker.jpg,2025-03-04T01:30:00Z,,"Der ukrainische Präsident Selenskyj erklärt in einem längeren Statement in sozialen Medien erstmals, dass er bedauert, wie das Treffen mit US-Präsident Trump und seinem Vize Vance abgelaufen ist. ""Es… [+25497 chars]",,de,'Krieg'
https://www.n-tv.de/politik/07-51-Joschka-Fischer-fordert-Wehrpflicht-fuer-Maenner-und-Frauen--article23143824.html,https://www.n-tv.de/politik/07-51-Joschka-Fischer-fordert-Wehrpflicht-fuer-Maenner-und-Frauen--article23143824.html,0,www.n-tv.de,Ukraine-Krieg im Liveticker: +++ 07:51 Joschka Fischer fordert Wehrpflicht für Männer und Frauen +++,Lesen Sie alle aktuellen Entwicklungen und Nachrichten über den russischen Angriffskrieg auf die Ukraine im Liveticker von ntv.de.,https://www.n-tv.de/img/incoming/crop25117070/4231326595-cImg_16_9-w1200/Ukraine-Liveticker.jpg,2025-03-04T01:30:00Z,,Angesichts der russischen Aggression in der Ukraine und der Krise der transatlantischen Beziehungen spricht sich der frühere Bundesaußenminister Joschka Fischer für eine Wehrpflicht in Deutschland - … [+7712 chars],,de,'Krieg'
https://www.n-tv.de/politik/17-43-Geheimdienstmitarbeiter-US-Munition-in-der-Ukraine-ist-in-drei-Monaten-aufgebraucht--article23143824.html,https://www.n-tv.de/politik/17-43-Geheimdienstmitarbeiter-US-Munition-in-der-Ukraine-ist-in-drei-Monaten-aufgebraucht--article23143824.html,0,www.n-tv.de,Ukraine-Krieg im Liveticker: +++ 17:43 Geheimdienstmitarbeiter: US-Munition in der Ukraine ist in drei Monaten aufgebraucht +++,Lesen Sie alle aktuellen Entwicklungen und Nachrichten über den russischen Angriffskrieg auf die Ukraine im Liveticker von ntv.de.,https://www.n-tv.de/img/incoming/crop25117070/4231326595-cImg_16_9-w1200/Ukraine-Liveticker.jpg,2025-03-04T01:30:00Z,,"Nachdem die US-Regierung am Montag einen Stopp der Waffenlieferungen an die Ukraine erklärt hat, warnt ein hochrangiger ukrainischer Geheimdienstmitarbeiter in der ""Financial Times"", die Ukraine werd… [+28245 chars]",,de,'Krieg'
https://www.n-tv.de/politik/10-25-Fritz-sieht-Bruch-mit-Ukraine-Das-ist-reine-Erpressung-und-Einladung-an-Russland--article23143824.html,https://www.n-tv.de/politik/10-25-Fritz-sieht-Bruch-mit-Ukraine-Das-ist-reine-Erpressung-und-Einladung-an-Russland--article23143824.html,0,www.n-tv.de,"Ukraine-Krieg im Liveticker: +++ 10:25 Fritz sieht Bruch mit Ukraine: ""Das ist reine Erpressung - und Einladung an Russland"" +++",Lesen Sie alle aktuellen Entwicklungen und Nachrichten über den russischen Angriffskrieg auf die Ukraine im Liveticker von ntv.de.,https://www.n-tv.de/img/incoming/crop25117070/4231326595-cImg_16_9-w1200/Ukraine-Liveticker.jpg,2025-03-04T01:30:00Z,,"ntv-Korrespondent Gordian Fritz findet klare Worte für die jüngste Anordnung Donald Trumps: Der umgehende Stopp aller Hilfslieferungen an die Ukraine ist nicht nur ein beispielloser Bruch, sondern au… [+11642 chars]",,de,'Krieg'
https://www.zeit.de/news/2025-03/04/hitzfeld-bayern-haben-gegen-bayer-mehr-zu-verlieren,https://www.zeit.de/news/2025-03/04/hitzfeld-bayern-haben-gegen-bayer-mehr-zu-verlieren,0,www.zeit.de,Champions League: Hitzfeld: Bayern haben gegen Bayer mehr zu verlieren,Hier finden Sie Informationen zu dem Thema „Champions League“. Lesen Sie jetzt „Hitzfeld: Bayern haben gegen Bayer mehr zu verlieren“.,https://img.zeit.de/news/2025-03/04/hitzfeld-bayern-haben-gegen-bayer-mehr-zu-verlieren-image-group/wide__1300x731,2025-03-04T05:46:35Z,,Der FC Bayern München steht im Champions-League-Achtelfinale gegen Bayer Leverkusen aus Sicht von Ex-Trainer Ottmar Hitzfeld mehr unter Druck. Der 76-Jährige sieht das deutsche Duell zwar als völlig … [+1268 chars],,de,'Bayern'
https://www.morgenpost.de/politik/article408458082/wer-weniger-heizt-spart-und-staerkt-die-demokratie.html,https://www.morgenpost.de/politik/article408458082/wer-weniger-heizt-spart-und-staerkt-die-demokratie.html,0,www.morgenpost.de,"Wer weniger heizt, spart – und stärkt die Demokratie","Obwohl Gas wieder billiger geworden ist, sparen die Deutschen beim Heizen. Offenbar haben sich die Menschen an ein paar Grad weniger in der Wohnung gewöhnt. Warum das nicht nur gut fürs Klima ist.",https://img.sparknews.funkemedien.de/408462917/408462917_1741071487_v16_9_1600.jpeg,2025-03-04T06:58:07Z,,"Berlin. Obwohl Gas billiger ist, sparen die Deutschen beim Heizen. Ob Geld, Klima, Menschenrechte es gibt viele Gründe, warum das richtig ist.
Deutsche verbrauchten 2024 weniger Gas das ist eine gut… [+2131 chars]",,de,'Gas'
https://www.zeit.de/news/2025-03/04/ehrung-von-beckenbauer-xxl-trikot-in-allianz-arena,https://www.zeit.de/news/2025-03/04/ehrung-von-beckenbauer-xxl-trikot-in-allianz-arena,0,www.zeit.de,FC Bayern München: Ehrung von Beckenbauer: XXL-Trikot in Allianz Arena,Hier finden Sie Informationen zu dem Thema „FC Bayern München“. Lesen Sie jetzt „Ehrung von Beckenbauer: XXL-Trikot in Allianz Arena“.,https://img.zeit.de/news/2025-03/04/ehrung-von-beckenbauer-xxl-trikot-in-allianz-arena-image-group/wide__1300x731,2025-03-04T11:02:37Z,,Im Gedenken an Franz Beckenbauer hängt der FC Bayern München ein riesiges Trikot mit dem Namen des Fußball-«Kaisers» und dessen legendärer Rückennummer fünf unter das Dach der Allianz Arena. Wie der … [+1112 chars],,de,'Bayern'
